,id,profile_url,sequence,sitzung,speaker,speaker_cleaned,speaker_fp,speaker_key,speaker_party,text,top,top_id,type,wahlperiode
599,521482,https://www.abgeordnetenwatch.de/profile/heidrun-bluhm/archive/215374,599,12,Heidrun Bluhm (DIE LINKE),Heidrun Bluhm,heidrun-bluhm,1861.0,linke,"Die Bundesregierung hat uns mit dem Koalitionsvertrag einen wohnungspolitischen Dreiklang aus Stärkung der Investitionskraft, Wiederbelebung des sozialen Wohnungsbaus und einer ausgewogenen mietrechtlichen und sozialpolitischen Flankierung versprochen. Was Frau Ministerin Hendricks hier heute vorgetragen hat, bestätigt das. Das klingt alles schon einmal viel besser als das, was wir von Vorgängerregierungen gehört haben oder was diese gar umzusetzen vermochten. Deshalb wünschen wir uns sehr, dass aus diesem Dreiklang eine harmonische Melodie mit langem Nachhall werden wird.

Allerdings zeichnen sich schon heute einige Dissonanzen ab:

Stichwort „Investitionskraft“: Frau Ministerin, weder im Koalitionsvertrag noch in Ihrer Rede heute haben die Altschulden der ostdeutschen Wohnungsunternehmen eine Rolle gespielt. Wir brauchen, so denke ich, die Streichung der Altschulden ostdeutscher Wohnungsunternehmen.","TOP 1 Umwelt, Naturschutz, Bau und Reaktorsicherheit",13787,speech,18
600,521483,,600,12,,,,,,Beifall bei der LINKEN,"TOP 1 Umwelt, Naturschutz, Bau und Reaktorsicherheit",13787,poi,18
601,521484,https://www.abgeordnetenwatch.de/profile/heidrun-bluhm/archive/215374,601,12,Heidrun Bluhm (DIE LINKE),Heidrun Bluhm,heidrun-bluhm,1861.0,linke,"Die SPD hat mit uns gemeinsam noch in der letzten Legislaturperiode entsprechende Anträge gestellt und auch eingereicht. Von alldem steht aber nun nichts im Koalitionsvertrag, und auch Sie, Frau Ministerin, haben dazu nichts gesagt. Wir werden weiterhin fordern, die Altschulden zu streichen und damit die Investitionskraft der Wohnungsunternehmen zum Beispiel für energetische Sanierung oder auch den altersgerechten Umbau der Wohnungen zu stärken.","TOP 1 Umwelt, Naturschutz, Bau und Reaktorsicherheit",13787,speech,18
602,521485,,602,12,,,,,,Beifall bei der LINKEN,"TOP 1 Umwelt, Naturschutz, Bau und Reaktorsicherheit",13787,poi,18
603,521486,https://www.abgeordnetenwatch.de/profile/heidrun-bluhm/archive/215374,603,12,Heidrun Bluhm (DIE LINKE),Heidrun Bluhm,heidrun-bluhm,1861.0,linke,"Demnächst, liebe Kolleginnen und Kollegen, ist die Haushaltsdebatte. Die Regierung will die Mittel für die Städtebauförderung von 455 Millionen Euro auf 700 Millionen Euro aufstocken;","TOP 1 Umwelt, Naturschutz, Bau und Reaktorsicherheit",13787,speech,18
604,521487,,604,12,,,,,,Beifall des Abg. Sören Bartol [SPD],"TOP 1 Umwelt, Naturschutz, Bau und Reaktorsicherheit",13787,poi,18
605,521488,https://www.abgeordnetenwatch.de/profile/heidrun-bluhm/archive/215374,605,12,Heidrun Bluhm (DIE LINKE),Heidrun Bluhm,heidrun-bluhm,1861.0,linke,"das hat Frau Hendricks hier eben noch einmal bestätigt, ebenso auf der Bauministerkonferenz in dieser Woche. Das begrüßen wir sehr, weil auch wir diese Forderung unterstützen. Herr Pronold hat das allerdings auf meine Anfrage im Ausschuss in dieser Woche schon wieder relativiert. Er sagte nämlich: Über vier Jahre wollen wir zusätzlich 620 Millionen Euro zur Verfügung stellen. - Wenn ich die Differenz zwischen 455 Millionen Euro und 700 Millionen Euro ausrechne, komme ich auf jährlich 245 Millionen Euro mehr, und mal vier Jahre macht das dann 980 Millionen Euro. 620 Millionen Euro wären also schon einmal 360 Millionen Euro weniger, als Sie brauchen würden, um Ihr Versprechen von 700 Millionen Euro pro Jahr einzuhalten. Ich zitiere, was mein Kollege Bartsch in der gestrigen Debatte zu Finanzen und Haushalt sagte: Mathematische Gesetze lassen sich nicht wegbeschließen. - Auch beim Summieren sind die Zahlen für die Regierung die gleichen wie für die Opposition. Aber in 2014 muss das ja auch nicht mehr unbedingt umgesetzt werden; denn wenn wir erst im Juni den Haushalt beschließen, ist das Jahr halb um. Ehe das Geld dann ausgereicht ist, hat man die Hälfte wahrscheinlich schon wieder eingespart.

Stichwort „sozialer Wohnungsbau“: Sie wollen diesen wiederbeleben, aber die Mittel von 518 Millionen Euro pro Jahr, die zur Verfügung stehen, werden nicht aufgestockt. Wenn wir genauer hinsehen, stellen wir fest, dass Herr Schäuble in der Verwaltungsvereinbarung bis 2018 nicht einmal darauf bestanden hat, dass durch die Länder kofinanziert werden muss. Außerdem hat er auch noch die Zweckbindung für den sozialen Wohnungsbau aufgegeben. Ich weiß nicht, wie Sie mit den Ländern vereinbaren wollen, dass das Geld dann zukünftig ausschließlich für den sozialen Wohnungsbau ausgegeben werden soll. Da sind Sie auf das Wohlwollen der Bauminister angewiesen; aber die haben ihre Haushalte längst beschlossen. Und: Selbst das würde nicht reichen, um die fehlenden 4 Millionen Sozialwohnungen in Deutschland zu schaffen oder ausreichend viele Wohnungen aus dem Bestand in die Zweckbindung zurückzuführen. Der Wegfall der Zweckbindung ist also, glaube ich, kontraproduktiv. Da müssen Sie nacharbeiten.","TOP 1 Umwelt, Naturschutz, Bau und Reaktorsicherheit",13787,speech,18
606,521489,,606,12,,,,,,Beifall bei der LINKEN,"TOP 1 Umwelt, Naturschutz, Bau und Reaktorsicherheit",13787,poi,18
607,521490,https://www.abgeordnetenwatch.de/profile/heidrun-bluhm/archive/215374,607,12,Heidrun Bluhm (DIE LINKE),Heidrun Bluhm,heidrun-bluhm,1861.0,linke,"Stichwort „Klimaschutz im Gebäudebereich“: Das CO2-Gebäudesanierungsprogramm und die energetische Stadtsanierung sollen fortgeführt werden. Richtig! Aber auf welchem Niveau und mit welchen Mitteln? Der Koalitionsvertrag spricht von Zusammenfassung von Wohnungsbau und energetischer Gebäudesanierung zu einem Aktionsprogramm. Aber wie? Aus den 518 Millionen Euro Kompensationsmitteln für den sozialen Wohnungsbau? Aus Mitteln der Städtebauförderung und wenn ja, in welcher Höhe? Aus dem EKF, der allerdings jetzt bei Herrn Gabriel verwaltet werden soll? Dazu würde ich in Zukunft gern noch etwas mehr von Ihnen hören, Frau Ministerin.

Meine Damen und Herren, die bevorstehende Haushaltsdebatte wird der erste Test für die Ernsthaftigkeit dieser Ankündigungen sein. Es wird sich zeigen, wer den Taktstock führt und ob der versprochene Dreiklang als kräftiges Fortissimo daherkommt oder doch nur ein seichtes Piano bleibt.

Danke schön.","TOP 1 Umwelt, Naturschutz, Bau und Reaktorsicherheit",13787,speech,18
608,521491,,608,12,,,,,,Beifall bei der LINKEN sowie bei Abgeordneten des BÜNDNISSES 90/DIE GRÜNEN,"TOP 1 Umwelt, Naturschutz, Bau und Reaktorsicherheit",13787,poi,18
609,521492,https://www.abgeordnetenwatch.de/profile/norbert-lammert,609,12,Präsident Dr. Norbert Lammert,Dr. Norbert Lammert,norbert-lammert,1754.0,,Nun hat Marie-Luise Dött das Wort für die CDU/CSU-Fraktion.,"TOP 1 Umwelt, Naturschutz, Bau und Reaktorsicherheit",13787,chair,18
610,521493,,610,12,,,,,,Beifall bei der CDU/CSU,"TOP 1 Umwelt, Naturschutz, Bau und Reaktorsicherheit",13787,poi,18
611,521494,https://www.abgeordnetenwatch.de/profile/marie-luise-dott/archive/214672,611,12,Marie-Luise Dött (CDU/CSU),Marie-Luise Dött,marie-luise-dott,1845.0,cducsu,"Sehr geehrter Herr Präsident! Sehr geehrte Damen und Herren! Die Entscheidung, die Umweltpolitik und die Bau- und Wohnungspolitik in einem Bundesministerium zusammenzuführen, hat viel Aufmerksamkeit erzeugt. Ich sehe in dieser Zusammenführung beider Politikfelder eine spannende Herausforderung. Bereits heute gibt es ja sehr viele inhaltliche Verzahnungen. Im Konfliktfall mussten sie aber bisher zwischen zwei Bundesministerien geklärt werden. Nun muss Frau Bundesministerin selbst für die Ausgewogenheit der Entscheidung für beide Politikbereiche einstehen. Wir werden sie dabei unterstützen.

Meine Damen und Herren, ich will hier die Gelegenheit nutzen, einige Schwerpunkte unserer Arbeit zu benennen.

Wir werden auch in der neuen Legislaturperiode die Umwelt- und Klimapolitik dynamisch weiterentwickeln; Frau Ministerin Hendricks hat das schon ausführlich beschrieben.

Wettbewerb, Produktverantwortung und anspruchsvolle Recyclingquoten sind auch zukünftig der Maßstab für die Kreislaufwirtschaft. Dabei bleibt das bewährte effiziente System einer fairen Beteiligung von Kommunen und privaten Entsorgern auch künftig erhalten.

Der Schutz der Bürger vor Lärm wird verbessert. Der Schienenlärm soll bis 2020 halbiert werden. Die Belastungen durch Fluglärm werden wir reduzieren und vor allen Dingen die Öffentlichkeit stärker beteiligen.

Wir werden, wie schon genannt, das Nationale Naturerbe um mindestens 30 000 Hektar erweitern.

Bei Infrastrukturmaßnahmen werden die Belange des Natur- und Hochwasserschutzes stärker berücksichtigt.

Es bleibt beim beschlossenen Ausstieg aus der Kernenergie. Wir sorgen für die Sicherheit der Kraftwerke bis zum letzten Betriebstag und setzen uns für verbindliche, ambitionierte Sicherheitsziele sowie Zusammenarbeit und Transparenz in Europa ein. Das ist nicht nur eine Frage, die Deutschland betrifft, sondern das muss für ganz Europa gelten.

Wir werden die Suche nach einem geeigneten Endlager für radioaktive Abfälle auf der Grundlage des Standortsuchgesetzes voranbringen. Ich bin froh, dass wir dies mit diesem Gesetz geschafft haben. Ich schließe mich natürlich dem Appell der anderen Redner an die Umweltverbände zur Mitarbeit an. Das ist ganz wichtig. Wir dürfen auch nicht vergessen, die Voraussetzungen für die Rückholung der Abfälle aus der Schachtanlasse Asse zu schaffen.

Meine Damen und Herren, die Umweltpolitik bleibt auch künftig ein Motor für Wachstum und Beschäftigung in Deutschland. Neben all diesen Themen bleibt der Schutz des Klimas im Zentrum deutscher und europäischer Politik.","TOP 1 Umwelt, Naturschutz, Bau und Reaktorsicherheit",13787,speech,18
612,521495,,612,12,,,,,,Beifall bei der CDU/CSU und der SPD,"TOP 1 Umwelt, Naturschutz, Bau und Reaktorsicherheit",13787,poi,18
613,521496,https://www.abgeordnetenwatch.de/profile/marie-luise-dott/archive/214672,613,12,Marie-Luise Dött (CDU/CSU),Marie-Luise Dött,marie-luise-dott,1845.0,cducsu,"Das von der Europäischen Kommission vorgelegte Weißbuch zur Weiterentwicklung der europäischen Energie- und Klimapolitik kann nur der Beginn einer umfassenden Diskussion sein. 40 Prozent Minderung der Treibhausgasemissionen bis 2030 sind ein gutes Signal - ich sage das ganz bewusst - für den Start der Verhandlungen. Es muss zudem bei der Zieltrias - dazu habe ich schon im Ausschuss Ausführungen gemacht - von Klimaziel, Ausbauziel für die erneuerbaren Energien und Steigerung der Energieeffizienz bleiben.","TOP 1 Umwelt, Naturschutz, Bau und Reaktorsicherheit",13787,speech,18
614,521497,,614,12,,,,,,Beifall bei der CDU/CSU,"TOP 1 Umwelt, Naturschutz, Bau und Reaktorsicherheit",13787,poi,18
615,521498,https://www.abgeordnetenwatch.de/profile/marie-luise-dott/archive/214672,615,12,Marie-Luise Dött (CDU/CSU),Marie-Luise Dött,marie-luise-dott,1845.0,cducsu,"Das sind drei gleichberechtigte und gleichwichtige Säulen einer modernen, zukünftigen Standortpolitik.

Meine Damen und Herren, bau- und wohnungspolitisch steht die Koalition vor wichtigen Aufgaben. Der demografische Wandel, die wirtschaftsstrukturellen Veränderungen und die ambitionierten klimapolitischen Ziele wirken sich stark auf die Stadtentwicklung sowie den gesamten Gebäudesektor aus. Wir brauchen passende Antworten auf die regionalen Unterschiede auf dem Wohnungsmarkt. Wir müssen die erforderlichen Stadtanpassungsprozesse in Schrumpfungsregionen effizient gestalten. Wir wollen die Stadtentwicklung auch auf die Herausforderungen des Klimawandels ausrichten. Und wir wollen, dass Wohnen trotz der erforderlichen Investition in die Energieeffizienz bezahlbar bleibt.","TOP 1 Umwelt, Naturschutz, Bau und Reaktorsicherheit",13787,speech,18
616,521499,,616,12,,,,,,Beifall bei der CDU/CSU sowie bei Abgeordneten der SPD,"TOP 1 Umwelt, Naturschutz, Bau und Reaktorsicherheit",13787,poi,18
617,521500,https://www.abgeordnetenwatch.de/profile/marie-luise-dott/archive/214672,617,12,Marie-Luise Dött (CDU/CSU),Marie-Luise Dött,marie-luise-dott,1845.0,cducsu,"Im Koalitionsvertrag haben wir Vorhaben verabredet, die dazu beitragen sollen, diese Aufgaben zu bewältigen. CDU und CSU haben die SPD von ihrem regionalisierten Konzept der Mietpreisbremse überzeugen können. Das ist sachgerecht. Ergänzt werden muss die Mietpreisbremse jedoch durch eine Stärkung des Wohnungsbaus. Das wäre die nachhaltige Lösung des Problems. Wenn man „nachhaltig“ steigern könnte, dann würde ich sagen: Es ist die nachhaltigste Lösung des Problems.","TOP 1 Umwelt, Naturschutz, Bau und Reaktorsicherheit",13787,speech,18
618,521501,,618,12,,,,,,Beifall bei der CDU/CSU sowie bei Abgeordneten der SPD,"TOP 1 Umwelt, Naturschutz, Bau und Reaktorsicherheit",13787,poi,18
619,521502,https://www.abgeordnetenwatch.de/profile/marie-luise-dott/archive/214672,619,12,Marie-Luise Dött (CDU/CSU),Marie-Luise Dött,marie-luise-dott,1845.0,cducsu,"Länder und Kommunen stehen hier in besonderer Verantwortung. Die beabsichtigte Anhebung der Städtebauförderung auf 700 Millionen Euro wollen wir ausdrücklich. Das ist ein starkes Signal an die Städte und Gemeinden in Deutschland. Wir unterstützen sie bei den erforderlichen Investitionen in die Stadtentwicklung. Sie werden beim Stadtumbau, beim städtebaulichen Denkmalschutz und bei den spezifischen Herausforderungen der kleinen Städte und Gemeinden im ländlichen Raum nicht alleingelassen.","TOP 1 Umwelt, Naturschutz, Bau und Reaktorsicherheit",13787,speech,18
620,521503,,620,12,,,,,,Beifall bei der CDU/CSU und der SPD,"TOP 1 Umwelt, Naturschutz, Bau und Reaktorsicherheit",13787,poi,18
621,521504,https://www.abgeordnetenwatch.de/profile/marie-luise-dott/archive/214672,621,12,Marie-Luise Dött (CDU/CSU),Marie-Luise Dött,marie-luise-dott,1845.0,cducsu,"Die sinnvolle Verknüpfung mit gesellschaftspolitischen Herausforderungen wird in den Programmen „Aktive Stadt- und Ortsteilzentren“ sowie „Soziale Stadt“ deutlich. Das Programm „Soziale Stadt“ werden wir als Leitprogramm der sozialen Integration weiterführen - so die Vereinbarung des Koalitionsvertrages. Dazu muss es aber endlich gelingen, die jeweiligen Kompetenzen aus den verschiedenen Bundesministerien sinnvoll zu bündeln.","TOP 1 Umwelt, Naturschutz, Bau und Reaktorsicherheit",13787,speech,18
622,521505,https://www.abgeordnetenwatch.de/profile/soren-bartol/archive/216875,622,12,Sören Bartol [SPD],Sören Bartol,soren-bartol,1603.0,spd,Sehr richtig!,"TOP 1 Umwelt, Naturschutz, Bau und Reaktorsicherheit",13787,poi,18
623,521506,https://www.abgeordnetenwatch.de/profile/marie-luise-dott/archive/214672,623,12,Marie-Luise Dött (CDU/CSU),Marie-Luise Dött,marie-luise-dott,1845.0,cducsu,"Die Politik denkt hier seit Jahren weiter, als es die Ressortstrukturen freiwillig wollen, Herr Bartol.","TOP 1 Umwelt, Naturschutz, Bau und Reaktorsicherheit",13787,speech,18
624,521507,https://www.abgeordnetenwatch.de/profile/soren-bartol/archive/216875,624,12,Sören Bartol [SPD],Sören Bartol,soren-bartol,1603.0,spd,Ich bin begeistert!,"TOP 1 Umwelt, Naturschutz, Bau und Reaktorsicherheit",13787,poi,18
625,521508,https://www.abgeordnetenwatch.de/profile/marie-luise-dott/archive/214672,625,12,Marie-Luise Dött (CDU/CSU),Marie-Luise Dött,marie-luise-dott,1845.0,cducsu,"Ein besonders großer Beitrag zur Erreichung der Klimaschutzziele wird vom Gebäudesektor erwartet. Das Umwelt- und Bauministerium muss in der geänderten Zuständigkeit nun verstärkt darauf hinarbeiten, dass die Energiewende für Mieter und Hauseigentümer bezahlbar bleibt. Die Energiewende verliert sonst ihre gesellschaftliche Akzeptanz. Wir haben im Koalitionsvertrag das geltende Wirtschaftlichkeitsprinzip im Ordnungsrecht und den Verzicht auf Zwangssanierungen bestätigt. Das ist richtig und vertrauensbildend.","TOP 1 Umwelt, Naturschutz, Bau und Reaktorsicherheit",13787,speech,18
626,521509,,626,12,,,,,,Beifall bei der CDU/CSU,"TOP 1 Umwelt, Naturschutz, Bau und Reaktorsicherheit",13787,poi,18
627,521510,https://www.abgeordnetenwatch.de/profile/marie-luise-dott/archive/214672,627,12,Marie-Luise Dött (CDU/CSU),Marie-Luise Dött,marie-luise-dott,1845.0,cducsu,Viele Eigentümer von Einfamilienhäusern oder kleineren Mietshäusern sind in dieser Frage genauso schutzbedürftig wie Mieter; und darauf werden wir achten.,"TOP 1 Umwelt, Naturschutz, Bau und Reaktorsicherheit",13787,speech,18
628,521511,,628,12,,,,,,Beifall bei der CDU/CSU,"TOP 1 Umwelt, Naturschutz, Bau und Reaktorsicherheit",13787,poi,18
629,521512,https://www.abgeordnetenwatch.de/profile/marie-luise-dott/archive/214672,629,12,Marie-Luise Dött (CDU/CSU),Marie-Luise Dött,marie-luise-dott,1845.0,cducsu,"Meine Damen und Herren, das umwelt- und baupolitische Programm der Großen Koalition ist ambitioniert, wachstumsorientiert und sozial gerecht. Jetzt geht es kraftvoll an die Umsetzung.","TOP 1 Umwelt, Naturschutz, Bau und Reaktorsicherheit",13787,speech,18
630,521513,,630,12,,,,,,Beifall bei der CDU/CSU und der SPD,"TOP 1 Umwelt, Naturschutz, Bau und Reaktorsicherheit",13787,poi,18
631,521514,https://www.abgeordnetenwatch.de/profile/norbert-lammert,631,12,Präsident Dr. Norbert Lammert,Dr. Norbert Lammert,norbert-lammert,1754.0,,Ich erteile dem Kollegen Christian Kühn für die Fraktion Bündnis 90/Die Grünen das Wort.,"TOP 1 Umwelt, Naturschutz, Bau und Reaktorsicherheit",13787,chair,18
632,521515,,632,12,Christian Kühn (Tübingen) (BÜNDNIS 90/DIE GRÜNEN),Christian Kühn,christian-kuhn,,gruene,"Sehr geehrter Herr Präsident! Sehr geehrte Frau Ministerin! Meine sehr geehrten Damen und Herren auf der Tribüne! Liebe Kolleginnen und Kollegen! Ich freue mich heute, nicht nur, weil ich meine erste Rede hier im Parlament halte, sondern auch, weil es uns Grünen in der letzten Legislaturperiode gelungen ist, zwei Konzepte zu entwickeln und auf den Weg zu bringen, die in den Koalitionsvertrag Eingang gefunden haben, nämlich die Mietpreisbremse und das Bestellprinzip bei den Maklerkosten.","TOP 1 Umwelt, Naturschutz, Bau und Reaktorsicherheit",13787,speech,18
633,521516,,633,12,,,,,,Beifall beim BÜNDNIS 90/DIE GRÜNEN,"TOP 1 Umwelt, Naturschutz, Bau und Reaktorsicherheit",13787,poi,18
634,521517,,634,12,,,,,,Lachen des Abg. Sören Bartol [SPD],"TOP 1 Umwelt, Naturschutz, Bau und Reaktorsicherheit",13787,poi,18
635,521518,,635,12,Christian Kühn (Tübingen) (BÜNDNIS 90/DIE GRÜNEN),Christian Kühn,christian-kuhn,,gruene,"2010 haben es sowohl SPD als auch CDU/CSU noch abgelehnt. Dass es in dieser Legislaturperiode umgesetzt wird, ist ein grüner Erfolg. Darauf können wir Grüne stolz sein.","TOP 1 Umwelt, Naturschutz, Bau und Reaktorsicherheit",13787,speech,18
636,521519,,636,12,,,,,,Beifall beim BÜNDNIS 90/DIE GRÜNEN,"TOP 1 Umwelt, Naturschutz, Bau und Reaktorsicherheit",13787,poi,18
637,521520,,637,12,,,,,,Lachen bei Abgeordneten der SPD,"TOP 1 Umwelt, Naturschutz, Bau und Reaktorsicherheit",13787,poi,18
638,521521,,638,12,Christian Kühn (Tübingen) (BÜNDNIS 90/DIE GRÜNEN),Christian Kühn,christian-kuhn,,gruene,"Frau Ministerin, Sie können von uns Grünen in dieser Legislaturperiode eine konstruktive Oppositionsarbeit in der Wohnungs- und Baupolitik erwarten. Wir wollen gemeinsam dafür Sorge tragen, dass das Thema Bauen und Wohnen in diesem Parlament einen größeren Stellenwert bekommt. Ihre ersten Aussagen dazu haben wir sehr wohlwollend zur Kenntnis genommen. Aber Ihren warmen Worten - da will ich Frau Bluhm von der Linken recht geben - müssen haushalterische Taten folgen.

Alle wohnungspolitischen, alle baupolitischen, alle mietrechtlichen Instrumente und auch alle Fördermittel müssen auf zwei große Herausforderungen ausgerichtet werden: zur Energiewende auch bei den Gebäuden beizutragen und den demografischen Wandel zu meistern. Wir finden es richtig, dass Sie die Mietpreisbremse schnell umsetzen wollen. Angesichts der vielen Podiumsveranstaltungen, auf denen man im Augenblick ist, warne ich Sie davor, gegenüber denjenigen einzuknicken, die gerade gegen die Mietpreisbremse arbeiten. Bleiben Sie hier in der Großen Koalition standfest, zum Wohle der Mieterinnen und Mieter in Deutschland.","TOP 1 Umwelt, Naturschutz, Bau und Reaktorsicherheit",13787,speech,18
639,521522,,639,12,,,,,,Beifall beim BÜNDNIS 90/DIE GRÜNEN sowie bei Abgeordneten der SPD,"TOP 1 Umwelt, Naturschutz, Bau und Reaktorsicherheit",13787,poi,18
640,521523,,640,12,Christian Kühn (Tübingen) (BÜNDNIS 90/DIE GRÜNEN),Christian Kühn,christian-kuhn,,gruene,Leider haben Sie ein Konzept von uns nicht übernommen.,"TOP 1 Umwelt, Naturschutz, Bau und Reaktorsicherheit",13787,speech,18
641,521524,https://www.abgeordnetenwatch.de/profile/steffi-lemke/archive/215081,641,12,Steffi Lemke [BÜNDNIS 90/DIE GRÜNEN],Steffi Lemke,steffi-lemke,1443.0,gruene,Nicht nur eins!,"TOP 1 Umwelt, Naturschutz, Bau und Reaktorsicherheit",13787,poi,18
642,521525,,642,12,Christian Kühn (Tübingen) (BÜNDNIS 90/DIE GRÜNEN),Christian Kühn,christian-kuhn,,gruene,"Sie begehen mit der Absenkung der Modernisierungsumlage - das muss man wirklich sagen - einen Konstruktionsfehler,","TOP 1 Umwelt, Naturschutz, Bau und Reaktorsicherheit",13787,speech,18
643,521526,https://www.abgeordnetenwatch.de/profile/soren-bartol/archive/216875,643,12,Sören Bartol [SPD],Sören Bartol,soren-bartol,1603.0,spd,Mist!,"TOP 1 Umwelt, Naturschutz, Bau und Reaktorsicherheit",13787,poi,18
644,521527,,644,12,Christian Kühn (Tübingen) (BÜNDNIS 90/DIE GRÜNEN),Christian Kühn,christian-kuhn,,gruene,"indem Sie eine zeitliche Befristung einführen wollen. Das wird am Ende zu nichts anderem führen als zu einem Konjunkturprogramm für Anwaltskanzleien. Nichts gegen Anwaltskanzleien - auch Anwälte brauchen Jobs -, aber eines ist ganz klar: Eine Absenkung der Modernisierungsumlage in dieser Form ist nicht sinnvoll. Vielleicht schwenken Sie doch noch auf unser Konzept um, nämlich auf eine inhaltliche Begrenzung der Modernisierungsumlage nur auf die Fälle, wo auf die beiden genannten großen Herausforderungen reagiert wird, also auf den demografischen Wandel in Form des Abbaus von Barrieren und auf die Energiewende in Form energetischer Gebäudesanierung.","TOP 1 Umwelt, Naturschutz, Bau und Reaktorsicherheit",13787,speech,18
645,521528,,645,12,,,,,,Beifall beim BÜNDNIS 90/DIE GRÜNEN,"TOP 1 Umwelt, Naturschutz, Bau und Reaktorsicherheit",13787,poi,18
646,521529,,646,12,Christian Kühn (Tübingen) (BÜNDNIS 90/DIE GRÜNEN),Christian Kühn,christian-kuhn,,gruene,"Im Zusammenhang mit der energetischen Gebäudesanierung haben wir sehr wohlwollend zur Kenntnis genommen, dass Sie die Sanierungsquote auf 2,5 Prozent erhöhen wollen. Doch wenn man in den Koalitionsvertrag schaut, sieht man, dass dort steht: Sie wollen das KfW-Gebäudesanierungsprogramm „verstetigen“ und das Programm zur energetischen Stadtsanierung „fortschreiben“. - Wenn man aber die Sanierungsquote steigern will, kann man die Programme nicht auf dem gleichen Niveau fortführen. Die jetzige Quote liegt bei unter 1 Prozent. Wenn man darüber hinauskommen will, muss man mehr Mittel einsetzen. Hier gibt es in Ihrem Koalitionsvertrag eine riesige Leerstelle; das zeigen auch Ihre Aussagen. Ich finde es schade, dass Sie nicht bereit sind, gerade in diesem Bereich Mittel einzusetzen. Ich glaube, das zeugt von großer Zukunftsvergessenheit der Großen Koalition bei der energetischen Gebäudesanierung.","TOP 1 Umwelt, Naturschutz, Bau und Reaktorsicherheit",13787,speech,18
647,521530,,647,12,,,,,,Beifall beim BÜNDNIS 90/DIE GRÜNEN,"TOP 1 Umwelt, Naturschutz, Bau und Reaktorsicherheit",13787,poi,18
648,521531,,648,12,Christian Kühn (Tübingen) (BÜNDNIS 90/DIE GRÜNEN),Christian Kühn,christian-kuhn,,gruene,"Ein paar Worte an die Sozialdemokratie. Die Heizkosten steigen dreimal schneller als die Löhne. Gerade deshalb müssten Sie erkennen: Die energetische Sanierung ist nicht nur eine Frage des Klimaschutzes, sondern auch eine Frage der sozialen Gerechtigkeit. Ich hoffe, dass Sie hier nachlegen und die Regierung ein bisschen vor sich hertreiben werden.","TOP 1 Umwelt, Naturschutz, Bau und Reaktorsicherheit",13787,speech,18
649,521532,,649,12,,,,,,Beifall beim BÜNDNIS 90/DIE GRÜNEN,"TOP 1 Umwelt, Naturschutz, Bau und Reaktorsicherheit",13787,poi,18
650,521533,,650,12,Christian Kühn (Tübingen) (BÜNDNIS 90/DIE GRÜNEN),Christian Kühn,christian-kuhn,,gruene,"Ich komme zum Schluss. Die eigentliche Herausforderung, vor der die Große Koalition und auch Sie als Ministerin stehen, ist das, was Sie hier beschworen haben, nämlich die Verzahnung von Umwelt- und Baupolitik. Ich sage ganz klar: Die klassische Antwort der Sozialdemokratie „Mehr Beton hilft mehr“ wird an dieser Stelle nicht helfen.","TOP 1 Umwelt, Naturschutz, Bau und Reaktorsicherheit",13787,speech,18
651,521534,,651,12,,,,,,Beifall beim BÜNDNIS 90/DIE GRÜNEN,"TOP 1 Umwelt, Naturschutz, Bau und Reaktorsicherheit",13787,poi,18
652,521535,https://www.abgeordnetenwatch.de/profile/dr-matthias-miersch/archive/216678,652,12,Dr. Matthias Miersch [SPD],Dr. Matthias Miersch,matthias-miersch,1730.0,spd,Dann haben Sie aber die Sozialdemokratie falsch verstanden!,"TOP 1 Umwelt, Naturschutz, Bau und Reaktorsicherheit",13787,poi,18
