,id,profile_url,sequence,sitzung,speaker,speaker_cleaned,speaker_fp,speaker_key,speaker_party,text,top,top_id,type,wahlperiode
308,521191,https://www.abgeordnetenwatch.de/profile/tabea-rosner/archive/215245,308,12,Tabea Rößner (BÜNDNIS 90/DIE GRÜNEN),Tabea Rößner,tabea-roßner,1399.0,gruene,So sieht es 2014 in vielen Regionen Deutschlands aus. Die Menschen in diesen Regionen hätten lieber heute als morgen schnelle Internetverbindungen.,TOP 1 Verkehr und digitale Infrastruktur,13786,speech,18
309,521192,,309,12,,,,,,Beifall beim BÜNDNIS 90/DIE GRÜNEN,TOP 1 Verkehr und digitale Infrastruktur,13786,poi,18
310,521193,https://www.abgeordnetenwatch.de/profile/tabea-rosner/archive/215245,310,12,Tabea Rößner (BÜNDNIS 90/DIE GRÜNEN),Tabea Rößner,tabea-roßner,1399.0,gruene,"Wir stehen vor zwei gewaltigen Herausforderungen:

Erstens: Wie stopfen wir die Löcher im Breitbandnetz möglichst schnell?

Zweitens: Wie bauen wir mittel- und langfristig das Glasfasernetz aus? Das brauchen wir nämlich wirklich, wenn wir ein Hightechland sein wollen. Denn ohne gibt es kein Cloud-Computing, kein Smart Grid und auch keine intelligente Logistik. Gewaltige Aufgaben, die Sie da zu bewältigen haben! Bis ein Runder Tisch „Netzallianz“ Ergebnisse liefert, dauert es. Dabei warten wir jetzt ja schon seit Jahren darauf, dass sich die Lage insbesondere in den ländlichen Regionen deutlich verbessert.

Die Grundversorgung hätten wir schnell und ohne zusätzliche Haushaltsmittel haben können, nämlich mit dem Universaldienst.",TOP 1 Verkehr und digitale Infrastruktur,13786,speech,18
311,521194,https://www.abgeordnetenwatch.de/profile/martin-dormann/archive/216748,311,12,Martin Dörmann [SPD],Martin Dörmann,martin-dormann,1844.0,spd,So geht es aber wirklich nicht!,TOP 1 Verkehr und digitale Infrastruktur,13786,poi,18
312,521195,https://www.abgeordnetenwatch.de/profile/tabea-rosner/archive/215245,312,12,Tabea Rößner (BÜNDNIS 90/DIE GRÜNEN),Tabea Rößner,tabea-roßner,1399.0,gruene,"Danach würde jeder Haushalt einen einigermaßen schnellen Internetanschluss kriegen, so wie jeder von der Post beliefert werden muss oder einen Telefonanschluss bekommt - und da ist es völlig egal, ob auf der Alm, auf der Hallig oder im Westerwald.",TOP 1 Verkehr und digitale Infrastruktur,13786,speech,18
313,521196,,313,12,,,,,,Beifall beim BÜNDNIS 90/DIE GRÜNEN,TOP 1 Verkehr und digitale Infrastruktur,13786,poi,18
314,521197,https://www.abgeordnetenwatch.de/profile/tabea-rosner/archive/215245,314,12,Tabea Rößner (BÜNDNIS 90/DIE GRÜNEN),Tabea Rößner,tabea-roßner,1399.0,gruene,"Das ist ein Konzept, das bis zur Wahl übrigens auch von der SPD gefordert wurde. Nach den Koalitionsverhandlungen wollten Sie aber leider nichts mehr davon wissen. Hier, werte Kollegen von der SPD, haben Sie sich über den Tisch ziehen lassen.",TOP 1 Verkehr und digitale Infrastruktur,13786,speech,18
315,521198,https://www.abgeordnetenwatch.de/profile/soren-bartol/archive/216875,315,12,Sören Bartol [SPD],Sören Bartol,soren-bartol,1603.0,spd,"Ja, ja! Ist klar!",TOP 1 Verkehr und digitale Infrastruktur,13786,poi,18
316,521199,https://www.abgeordnetenwatch.de/profile/tabea-rosner/archive/215245,316,12,Tabea Rößner (BÜNDNIS 90/DIE GRÜNEN),Tabea Rößner,tabea-roßner,1399.0,gruene,Bis 2018 ist es noch lange hin. Bis dahin gibt es ja bereits eine neue Bundesregierung.,TOP 1 Verkehr und digitale Infrastruktur,13786,speech,18
317,521200,https://www.abgeordnetenwatch.de/profile/valerie-wilms,317,12,Dr. Valerie Wilms [BÜNDNIS 90/DIE GRÜNEN],Dr. Valerie Wilms,valerie-wilms,1276.0,gruene,"Ja, genau!",TOP 1 Verkehr und digitale Infrastruktur,13786,poi,18
318,521201,https://www.abgeordnetenwatch.de/profile/tabea-rosner/archive/215245,318,12,Tabea Rößner (BÜNDNIS 90/DIE GRÜNEN),Tabea Rößner,tabea-roßner,1399.0,gruene,"Wahrscheinlich müssen Sie sich für das Nichteinlösen dieser Versprechungen dann gar nicht mehr rechtfertigen. Das Ziel ist also nicht nur auf den ersten Blick mutig, es ist auch auf den zweiten vor allen Dingen bequem.

Eines halte ich Ihnen aber zugute: Die neue Regierung hat immerhin verstanden, wie wichtig der Breitbandausbau ist. Das ist nicht nur eine Frage von Teilhabe, wie Minister Dobrindt betont, sondern auch eine Zukunftsinvestition. Flächendeckendes Breitband birgt für Deutschland auch enorme Wirtschaftskraft. Ein Anstieg der Breitbandversorgung um 10 Prozent kann laut EU-Kommission zu einem jährlichen BIP-Wachstum von 1 bis 1,5 Prozent führen. Breitbandverbindungen bewirken Innovationen in Unternehmen, sie fördern Beschäftigung und bieten das Potenzial, bis 2020 2 Millionen zusätzliche Arbeitsplätze zu schaffen. Ohne Ausbau läuft die Energiewende nur mit angezogener Handbremse. Wir könnten bis zu vier Kohlekraftwerke einsparen, hätten wir externe klimaneutrale Rechenzentren. Dafür brauchen die Unternehmen aber eben Breitbandverbindungen.",TOP 1 Verkehr und digitale Infrastruktur,13786,speech,18
319,521202,,319,12,,,,,,Beifall beim BÜNDNIS 90/DIE GRÜNEN,TOP 1 Verkehr und digitale Infrastruktur,13786,poi,18
320,521203,https://www.abgeordnetenwatch.de/profile/tabea-rosner/archive/215245,320,12,Tabea Rößner (BÜNDNIS 90/DIE GRÜNEN),Tabea Rößner,tabea-roßner,1399.0,gruene,"Die vorgeschlagenen Maßnahmen sind leider wenig vielversprechend. Es gibt weder Geld noch ein Konzept und auch kein Anreizprogramm. Die ursprünglich geplante 1 Milliarde Euro für den Ausbau ist in den Koalitionsverhandlungen gestrichen worden. Was bleibt, sind bloße Ankündigungen. Aber die alleine machen noch keinen Breitband-Frühling.

Die Einberufung eines Runden Tisches und Ihr Auftritt im Ausschuss hinterlassen einen engagierten Eindruck. Aber letztendlich kostet der Ausbau viel Geld, das die Regierung eben nicht bereitstellen will und von dem unklar ist, woher es kommen soll. Von Gesprächsrunden wird es nicht vom Himmel fallen. Irgendeiner wird die Zeche zahlen müssen. Die Frage bleibt nur: Wer?

Herr Dobrindt, als Sie im Dezember letzten Jahres bei Ihrer Vereidigung hier vorne standen, konnte ich beobachten: Hier ist ein Mann, der es gar nicht erwarten kann, Minister zu werden.",TOP 1 Verkehr und digitale Infrastruktur,13786,speech,18
321,521204,,321,12,,,,,,Heiterkeit beim BÜNDNIS 90/DIE GRÜNEN sowie bei Abgeordneten der SPD,TOP 1 Verkehr und digitale Infrastruktur,13786,poi,18
322,521205,https://www.abgeordnetenwatch.de/profile/martin-dormann/archive/216748,322,12,Martin Dörmann [SPD],Martin Dörmann,martin-dormann,1844.0,spd,Zwölf Jahre!,TOP 1 Verkehr und digitale Infrastruktur,13786,poi,18
323,521206,https://www.abgeordnetenwatch.de/profile/tabea-rosner/archive/215245,323,12,Tabea Rößner (BÜNDNIS 90/DIE GRÜNEN),Tabea Rößner,tabea-roßner,1399.0,gruene,"Ich wünsche Ihnen, dass Ihnen zwischen Peißenberg und Runden Tischen die Puste nicht ausgeht.

Vielen Dank.",TOP 1 Verkehr und digitale Infrastruktur,13786,speech,18
324,521207,,324,12,,,,,,Beifall beim BÜNDNIS 90/DIE GRÜNEN,TOP 1 Verkehr und digitale Infrastruktur,13786,poi,18
325,521208,https://www.abgeordnetenwatch.de/profile/petra-pau/archive/215458,325,12,Vizepräsidentin Petra Pau,Petra Pau,petra-pau,1713.0,,Das Wort hat der Kollege Gero Storjohann für die CDU/CSU-Fraktion.,TOP 1 Verkehr und digitale Infrastruktur,13786,chair,18
326,521209,,326,12,,,,,,Beifall bei der CDU/CSU,TOP 1 Verkehr und digitale Infrastruktur,13786,poi,18
327,521210,https://www.abgeordnetenwatch.de/profile/gero-storjohann/archive/214474,327,12,Gero Storjohann (CDU/CSU),Gero Storjohann,gero-storjohann,1649.0,cducsu,"Sehr verehrte Frau Präsidentin! Liebe Kolleginnen und Kollegen! Image macht man am Anfang. Deswegen bin ich dem neuen Verkehrsminister sehr dankbar, dass er hier seine Prioritäten auf den Tisch gelegt hat. Wir hatten vorher ein Ministerium, das auch mit Wohnungsbau zu tun hatte. Wir Mitglieder des Ausschusses hatten immer den Eindruck, dass der Wohnungsbau ein Anhängsel war und es in erster Linie um Verkehrspolitik ging. Alexander Dobrindt hat jetzt deutlich gemacht, dass digitale Infrastruktur sehr wichtig ist, dass er hier sehr viel Arbeitskraft einbringen wird und dass Verkehrspolitik und digitale Infrastruktur in diesem Ministerium gleichwertig behandelt werden sollen. Das ist die Botschaft. Wir als Ausschuss sollten uns dieser Aufgabe intensiv annehmen.

Ich möchte etwas zu der Kritik von Frau Rößner sagen. Ich glaube, Sie waren von 2002 bis 2005 mit in der Regierung. Da hatten Sie die Möglichkeit, in die Zukunft zu schauen und zu erkennen, ob ein Breitbandnetz zur Daseinsvorsorge gehört.",TOP 1 Verkehr und digitale Infrastruktur,13786,speech,18
328,521211,https://www.abgeordnetenwatch.de/profile/tabea-rosner/archive/215245,328,12,Tabea Rößner [BÜNDNIS 90/DIE GRÜNEN],Tabea Rößner,tabea-roßner,1399.0,gruene,Das ist schon ganz schön lange her!,TOP 1 Verkehr und digitale Infrastruktur,13786,poi,18
329,521212,https://www.abgeordnetenwatch.de/profile/gero-storjohann/archive/214474,329,12,Gero Storjohann (CDU/CSU),Gero Storjohann,gero-storjohann,1649.0,cducsu,"Sie haben das nicht in das Telekommunikationsgesetz geschrieben. - Es ist lange her, und wir brauchen lange Wege, um etwas umzusetzen. Wir haben es in der letzten Koalition auch nicht gemacht,",TOP 1 Verkehr und digitale Infrastruktur,13786,speech,18
330,521213,https://www.abgeordnetenwatch.de/profile/tabea-rosner/archive/215245,330,12,Tabea Rößner [BÜNDNIS 90/DIE GRÜNEN],Tabea Rößner,tabea-roßner,1399.0,gruene,Vorletzte auch nicht!,TOP 1 Verkehr und digitale Infrastruktur,13786,poi,18
331,521214,https://www.abgeordnetenwatch.de/profile/gero-storjohann/archive/214474,331,12,Gero Storjohann (CDU/CSU),Gero Storjohann,gero-storjohann,1649.0,cducsu,"auch vor dem Hintergrund, dass die finanziellen Mittel nicht da sind.

Ich möchte Ihnen ein Beispiel aus meinem Wahlkreis nennen.",TOP 1 Verkehr und digitale Infrastruktur,13786,speech,18
332,521215,https://www.abgeordnetenwatch.de/profile/petra-pau/archive/215458,332,12,Vizepräsidentin Petra Pau,Petra Pau,petra-pau,1713.0,,"Kollege Storjohann, gestatten Sie eine Bemerkung oder Frage des Kollegen von Notz?",TOP 1 Verkehr und digitale Infrastruktur,13786,chair,18
333,521216,https://www.abgeordnetenwatch.de/profile/gero-storjohann/archive/214474,333,12,Gero Storjohann (CDU/CSU),Gero Storjohann,gero-storjohann,1649.0,cducsu,"Ja, gerne.",TOP 1 Verkehr und digitale Infrastruktur,13786,speech,18
334,521217,https://www.abgeordnetenwatch.de/profile/dr-konstantin-von-notz-0,334,12,Dr. Konstantin von Notz (BÜNDNIS 90/DIE GRÜNEN),Dr. Konstantin von Notz,konstantin-notz,1576.0,gruene,"Lieber Herr Kollege, vielen Dank. - Herr Storjohann, wir kommen aus dem schönen Schleswig-Holstein. Auch da ist es mit dem Breitbandausbau ähnlich traurig bestellt wie in vielen Kreisen in Bayern. Sie haben auf Rot-Grün verwiesen. Ich sage: Das waren noch gute Zeiten. Es ist aber schon eine Weile her. Sie regieren nun schon seit acht Jahren.",TOP 1 Verkehr und digitale Infrastruktur,13786,speech,18
335,521218,https://www.abgeordnetenwatch.de/profile/tabea-rosner/archive/215245,335,12,Tabea Rößner [BÜNDNIS 90/DIE GRÜNEN],Tabea Rößner,tabea-roßner,1399.0,gruene,Fast neun!,TOP 1 Verkehr und digitale Infrastruktur,13786,poi,18
336,521219,https://www.abgeordnetenwatch.de/profile/dr-konstantin-von-notz-0,336,12,Dr. Konstantin von Notz (BÜNDNIS 90/DIE GRÜNEN),Dr. Konstantin von Notz,konstantin-notz,1576.0,gruene,"Seit acht Jahren regiert die CDU/CSU, und in dem Bereich ist nichts passiert. Jetzt kündigen Sie großartig wieder Dinge an - Breitbandausbau -, stellen dafür aber keinen Euro zur Verfügung. Was soll der Verweis auf rot-grüne Zeiten, wenn Sie heute nicht bereit sind, Geld dafür auszugeben? Wie können Sie den Vorwurf entkräften, dass dies alles Ankündigungspolitik und reiner Budenzauber ist und Sie am Ende doch wieder nicht liefern werden, wie in den letzten acht Jahren?",TOP 1 Verkehr und digitale Infrastruktur,13786,speech,18
337,521220,,337,12,,,,,,Beifall beim BÜNDNIS 90/DIE GRÜNEN,TOP 1 Verkehr und digitale Infrastruktur,13786,poi,18
338,521221,https://www.abgeordnetenwatch.de/profile/gero-storjohann/archive/214474,338,12,Gero Storjohann (CDU/CSU),Gero Storjohann,gero-storjohann,1649.0,cducsu,"Ich bin Ihnen dankbar für diesen Hinweis, Herr von Notz. Ich sehe darin überhaupt kein Problem. Ich glaube, es wäre falsch, mit Geld den Infrastrukturausbau befördern zu wollen. Das möchte ich Ihnen auch gerne begründen.",TOP 1 Verkehr und digitale Infrastruktur,13786,speech,18
339,521222,https://www.abgeordnetenwatch.de/profile/oliver-krischer/archive/215110,339,12,Oliver Krischer [BÜNDNIS 90/DIE GRÜNEN],Oliver Krischer,oliver-krischer,1450.0,gruene,Wie denn sonst?,TOP 1 Verkehr und digitale Infrastruktur,13786,poi,18
340,521223,https://www.abgeordnetenwatch.de/profile/dr-konstantin-von-notz-0,340,12,Dr. Konstantin von Notz [BÜNDNIS 90/DIE GRÜNEN],Dr. Konstantin von Notz,konstantin-notz,1576.0,gruene,"Ohne Moos nix los, Herr Storjohann!",TOP 1 Verkehr und digitale Infrastruktur,13786,poi,18
341,521224,https://www.abgeordnetenwatch.de/profile/gero-storjohann/archive/214474,341,12,Gero Storjohann (CDU/CSU),Gero Storjohann,gero-storjohann,1649.0,cducsu,"- Lassen Sie es sich jetzt bitte erklären. Ich war gerade bei meiner Erklärung.

In meinem Wahlkreis haben wir drei Anbieter - neben Telekom und Vodafone -, die den Breitbandausbau intensiv vorantreiben. In Norderstedt gibt es seit über zehn Jahren ein schnelles Internet, mit das schnellste in Deutschland.

Der Kreis hat einen Zweckverband gegründet, um kleinen Kommunen mit 200 bis 400 Einwohnern Fiber-to-the-Home zu ermöglichen. Die ersten Dörfer sind angeschlossen, weitere kommen. Wir haben einen privaten Investor - die Deutsche Glasfaser, ein niederländisches Unternehmen -, der das jetzt auch macht. Das heißt, unser Kreis Segeberg wird in den nächsten drei Jahren versorgt sein. In Ihrer Region machen es die Stadtwerke. In Neumünster machen es die Stadtwerke. Die Dinge nehmen also zurzeit einen guten Lauf. Wenn jetzt plötzlich 1 Milliarde Euro als Fördermittel bereitgestellt würden, würde jede Kommune überlegen: Warten wir noch ein bisschen, ob wir das Fördergeld bekommen können! Wie sind die Ausschreibungsbedingungen? - Wir haben in den letzten drei Jahren erlebt, dass Fördermittel meistens nicht in ausreichendem Maße zur Verfügung stehen und letztlich das ganze Vorhaben gefährden. Ich bin sehr zuversichtlich, dass wir mit dem Konzept, das wir im Kreise Segeberg, aber auch bei Ihnen haben, einen großen Schritt vorankommen. Deswegen meine ich, dass wir auf dem richtigen Weg sind.",TOP 1 Verkehr und digitale Infrastruktur,13786,speech,18
342,521225,,342,12,,,,,,Beifall bei der CDU/CSU,TOP 1 Verkehr und digitale Infrastruktur,13786,poi,18
343,521226,https://www.abgeordnetenwatch.de/profile/gero-storjohann/archive/214474,343,12,Gero Storjohann (CDU/CSU),Gero Storjohann,gero-storjohann,1649.0,cducsu,"Meine Damen und Herren, grundsätzlich begrüße ich - um auf das andere Thema, das Thema Verkehr, zu sprechen zu kommen -, dass wir im Bundesverkehrswegeplan die Planung netzorientiert vornehmen. Wir werden also Lücken in unserem Verkehrsnetz schließen. Es geht auch darum, mit Mobilität unserem Land die Zukunft zu erhalten. Dabei handelt es sich einmal um die digitale Mobilität und zum Zweiten um die Infrastruktur. Wir müssen in unserem Bundesverkehrswegeplan über das nationale Prioritätenkonzept definieren, welche Vorhaben bedeutsam sind. Das wird eine spannende Diskussion, auch bei uns in den Ausschüssen. Es gibt unterschiedliche Interessen, die wir bündeln müssen. In diese Projekte werden zukünftig 80 Prozent der Mittel für den Neu- und Ausbau fließen. Welche Projekte werden das sein? Das sind die Seehafenhinterlandanbindungen, der Ausbau hochbelasteter Knoten, die Schließung wichtiger, überregional bedeutsamer Netzlücken sowie die Einbindung von Achsen, die schon in transeuropäischen, völkerrechtlichen Verträgen festgelegt sind.

Als Beispiel für die Notwendigkeit des Ausbaus von Seehafenhinterlandanbindungen kann ich nur den Hamburger Hafen nennen, der eine wichtige Bedeutung für ganz Deutschland hat. Der Hamburger Hafen ist vom Funktionieren des Nord-Ostsee-Kanals abhängig. Vom Funktionieren des Nord-Ostsee-Kanals sind natürlich auch Warenströme nach Bayern und Baden-Württemberg betroffen. Es geht also um ein Gesamtkonzept. Ich bin froh, dass wir die Finanzierung der Maßnahmen bei den Brunsbütteler Schleusen sichergestellt haben. Weitere Maßnahmen sind erforderlich;",TOP 1 Verkehr und digitale Infrastruktur,13786,speech,18
344,521227,https://www.abgeordnetenwatch.de/profile/dr-konstantin-von-notz-0,344,12,Dr. Konstantin von Notz [BÜNDNIS 90/DIE GRÜNEN],Dr. Konstantin von Notz,konstantin-notz,1576.0,gruene,Machen Sie das mal!,TOP 1 Verkehr und digitale Infrastruktur,13786,poi,18
345,521228,https://www.abgeordnetenwatch.de/profile/gero-storjohann/archive/214474,345,12,Gero Storjohann (CDU/CSU),Gero Storjohann,gero-storjohann,1649.0,cducsu,"ich setze mich dafür ein, dass wir das jetzt machen. Ich freue mich, Herr von Notz, dass Sie uns da unterstützen.",TOP 1 Verkehr und digitale Infrastruktur,13786,speech,18
346,521229,https://www.abgeordnetenwatch.de/profile/dr-konstantin-von-notz-0,346,12,Dr. Konstantin von Notz [BÜNDNIS 90/DIE GRÜNEN],Dr. Konstantin von Notz,konstantin-notz,1576.0,gruene,"Ja, volle Kanne!",TOP 1 Verkehr und digitale Infrastruktur,13786,poi,18
347,521230,https://www.abgeordnetenwatch.de/profile/gero-storjohann/archive/214474,347,12,Gero Storjohann (CDU/CSU),Gero Storjohann,gero-storjohann,1649.0,cducsu,- Wunderbar!,TOP 1 Verkehr und digitale Infrastruktur,13786,speech,18
348,521231,https://www.abgeordnetenwatch.de/profile/valerie-wilms,348,12,Dr. Valerie Wilms [BÜNDNIS 90/DIE GRÜNEN],Dr. Valerie Wilms,valerie-wilms,1276.0,gruene,"Nicht nur Spatenstiche, sondern auch bauen!",TOP 1 Verkehr und digitale Infrastruktur,13786,poi,18
349,521232,https://www.abgeordnetenwatch.de/profile/dr-konstantin-von-notz-0,349,12,Dr. Konstantin von Notz [BÜNDNIS 90/DIE GRÜNEN],Dr. Konstantin von Notz,konstantin-notz,1576.0,gruene,Virtuelle Spatenstiche!,TOP 1 Verkehr und digitale Infrastruktur,13786,poi,18
350,521233,https://www.abgeordnetenwatch.de/profile/gero-storjohann/archive/214474,350,12,Gero Storjohann (CDU/CSU),Gero Storjohann,gero-storjohann,1649.0,cducsu,"- Sie sind ja nur verärgert, dass Sie damals nicht dabei waren. Ich weiß, Sie wären gerne dabei gewesen.",TOP 1 Verkehr und digitale Infrastruktur,13786,speech,18
351,521234,,351,12,,,,,,Beifall bei der CDU/CSU,TOP 1 Verkehr und digitale Infrastruktur,13786,poi,18
352,521235,https://www.abgeordnetenwatch.de/profile/gero-storjohann/archive/214474,352,12,Gero Storjohann (CDU/CSU),Gero Storjohann,gero-storjohann,1649.0,cducsu,"Der Ausbau der Verkehrsinfrastruktur bringt unser Land voran und ist auch Grundlage für unseren Wohlstand. Ich halte es für wichtig, dass wir uns im Koalitionsvertrag für ÖPP-Projekte starkmachen. Das ist eine Finanzierungsform, die es uns über die bisherige Haushaltsfinanzierung hinaus und über größere Zeiträume hinweg ermöglicht, Projekte auf den Weg zu bringen. Dafür gibt es gute Beispiele.",TOP 1 Verkehr und digitale Infrastruktur,13786,speech,18
353,521236,https://www.abgeordnetenwatch.de/profile/stephan-kuhn/archive/215191,353,12,Stephan Kühn [Dresden] [BÜNDNIS 90/DIE GRÜNEN],Stephan Kühn,stephan-kuhn,1760.0,gruene,Ach ja?,TOP 1 Verkehr und digitale Infrastruktur,13786,poi,18
354,521237,https://www.abgeordnetenwatch.de/profile/gero-storjohann/archive/214474,354,12,Gero Storjohann (CDU/CSU),Gero Storjohann,gero-storjohann,1649.0,cducsu,"Ich bin hoffnungsvoll, dass wir darüber neue Projekte anschieben können, zum Beispiel den Weiterbau der Küstenautobahn A 20, den Sie von den Grünen nicht wollen. Wir sehen durchaus Möglichkeiten, hier ein gutes Konzept auf den Weg zu bringen.",TOP 1 Verkehr und digitale Infrastruktur,13786,speech,18
355,521238,https://www.abgeordnetenwatch.de/profile/valerie-wilms,355,12,Dr. Valerie Wilms [BÜNDNIS 90/DIE GRÜNEN],Dr. Valerie Wilms,valerie-wilms,1276.0,gruene,Träumereien!,TOP 1 Verkehr und digitale Infrastruktur,13786,poi,18
356,521239,https://www.abgeordnetenwatch.de/profile/gero-storjohann/archive/214474,356,12,Gero Storjohann (CDU/CSU),Gero Storjohann,gero-storjohann,1649.0,cducsu,"Was mich natürlich besonders interessiert, ist der Klimaschutz, insbesondere die Förderung des Fahrrads als umweltfreundliches Verkehrsmittel.",TOP 1 Verkehr und digitale Infrastruktur,13786,speech,18
357,521240,,357,12,,,,,,Beifall bei Abgeordneten des BÜNDNISSES 90/DIE GRÜNEN,TOP 1 Verkehr und digitale Infrastruktur,13786,poi,18
358,521241,https://www.abgeordnetenwatch.de/profile/gero-storjohann/archive/214474,358,12,Gero Storjohann (CDU/CSU),Gero Storjohann,gero-storjohann,1649.0,cducsu,"Wir haben den Nationalen Radverkehrsplan auf den Weg gebracht; er steht explizit im Koalitionsvertrag. Jetzt zu behaupten, das Fahrrad sei im Koalitionsvertrag nicht enthalten, finde ich nicht in Ordnung.",TOP 1 Verkehr und digitale Infrastruktur,13786,speech,18
359,521242,https://www.abgeordnetenwatch.de/profile/michael-grosse-bromer-2/archive/217189,359,12,Michael Grosse-Brömer [CDU/CSU],Michael Grosse-Brömer,michael-grosse-bromer,1544.0,cducsu,Das lässt sich Gero nicht sagen!,TOP 1 Verkehr und digitale Infrastruktur,13786,poi,18
360,521243,https://www.abgeordnetenwatch.de/profile/gero-storjohann/archive/214474,360,12,Gero Storjohann (CDU/CSU),Gero Storjohann,gero-storjohann,1649.0,cducsu,"Im Bereich des Fahrradverkehrs werden wir viele Dinge auf den Weg bringen. Im Koalitionsvertrag steht explizit, dass wir die gesetzliche Grundlage dafür schaffen werden, an Bundeswasserstraßen mehr Fahrradwege zu bauen.",TOP 1 Verkehr und digitale Infrastruktur,13786,speech,18
361,521244,https://www.abgeordnetenwatch.de/profile/stephan-kuhn/archive/215191,361,12,Stephan Kühn [Dresden] [BÜNDNIS 90/DIE GRÜNEN],Stephan Kühn,stephan-kuhn,1760.0,gruene,Dann stellen Sie auch das Geld in den Haushalt ein!,TOP 1 Verkehr und digitale Infrastruktur,13786,poi,18
362,521245,https://www.abgeordnetenwatch.de/profile/gero-storjohann/archive/214474,362,12,Gero Storjohann (CDU/CSU),Gero Storjohann,gero-storjohann,1649.0,cducsu,"- Sie haben unter Rot-Grün einmal 10 Millionen Euro zur Verfügung gestellt und es nicht geschafft, dieses Geld auszugeben. Deswegen ist der Haushaltsansatz inzwischen auf 3 Millionen Euro gefallen. Wir haben nur 300 000 bis 600 000 Euro ausgeben können.",TOP 1 Verkehr und digitale Infrastruktur,13786,speech,18
363,521246,https://www.abgeordnetenwatch.de/profile/stephan-kuhn/archive/215191,363,12,Stephan Kühn [Dresden] [BÜNDNIS 90/DIE GRÜNEN],Stephan Kühn,stephan-kuhn,1760.0,gruene,Sie haben die Mittel gekürzt!,TOP 1 Verkehr und digitale Infrastruktur,13786,poi,18
364,521247,https://www.abgeordnetenwatch.de/profile/gero-storjohann/archive/214474,364,12,Gero Storjohann (CDU/CSU),Gero Storjohann,gero-storjohann,1649.0,cducsu,"Wir wollen da was machen. Das ist touristisch hochinteressant und fördert auch die Akzeptanz des Fahrrads im Alltag.

Die jährlichen Verkaufszahlen bei Fahrrädern steigen. Die Zukunft des Pedelecs ist positiv einzuschätzen. Nicht alle Fahrräder werden zukünftig Pedelecs sein; aber die Pedelecs fördern den Fahrradverkehr gerade in den Regionen, in denen es nicht flach ist. Aber da der Wind dort, wo es flach ist, immer aus der falschen Richtung weht, sind Pedelecs eigentlich für ganz Deutschland interessant.",TOP 1 Verkehr und digitale Infrastruktur,13786,speech,18
365,521248,https://www.abgeordnetenwatch.de/profile/michael-grosse-bromer-2/archive/217189,365,12,Michael Grosse-Brömer [CDU/CSU],Michael Grosse-Brömer,michael-grosse-bromer,1544.0,cducsu,Das ist nur in Schleswig-Holstein so!,TOP 1 Verkehr und digitale Infrastruktur,13786,poi,18
366,521249,https://www.abgeordnetenwatch.de/profile/gero-storjohann/archive/214474,366,12,Gero Storjohann (CDU/CSU),Gero Storjohann,gero-storjohann,1649.0,cducsu,"- In Schleswig-Holstein kommt der Wind immer von vorne. Ihr glaubt gar nicht, wie viele kleine Hügel wir haben, bei denen es auch anstrengend sein kann.",TOP 1 Verkehr und digitale Infrastruktur,13786,speech,18
367,521250,,367,12,,,,,,Heiterkeit und Beifall bei Abgeordneten der CDU/CSU und der SPD,TOP 1 Verkehr und digitale Infrastruktur,13786,poi,18
368,521251,https://www.abgeordnetenwatch.de/profile/michael-grosse-bromer-2/archive/217189,368,12,Michael Grosse-Brömer [CDU/CSU],Michael Grosse-Brömer,michael-grosse-bromer,1544.0,cducsu,Ihr seid nicht so gut trainiert! Das ist alles!,TOP 1 Verkehr und digitale Infrastruktur,13786,poi,18
369,521252,https://www.abgeordnetenwatch.de/profile/gero-storjohann/archive/214474,369,12,Gero Storjohann (CDU/CSU),Gero Storjohann,gero-storjohann,1649.0,cducsu,"Meine Damen und Herren, ein weiteres Thema ist die Verkehrssicherheit. Darauf werden wir ebenfalls einen Schwerpunkt setzen. Wenn auch die Zahl der Verkehrstoten kontinuierlich zurückgegangen ist, bleibt es Aufgabe der Bundesregierung, hier weitere Fortschritte zu erzielen. Wir haben die Alkoholgrenze für Fahranfänger auf 0 Promille gesetzt.",TOP 1 Verkehr und digitale Infrastruktur,13786,speech,18
370,521253,https://www.abgeordnetenwatch.de/profile/stephan-kuhn/archive/215191,370,12,Stephan Kühn [Dresden] [BÜNDNIS 90/DIE GRÜNEN],Stephan Kühn,stephan-kuhn,1760.0,gruene,Das müssen Sie für alle machen!,TOP 1 Verkehr und digitale Infrastruktur,13786,poi,18
