,id,profile_url,sequence,sitzung,speaker,speaker_cleaned,speaker_fp,speaker_key,speaker_party,text,top,top_id,type,wahlperiode
370,691310,,370,44,,,,,,Abg. Oliver Krischer [BÜNDNIS 90/DIE GRÜNEN] meldet sich,"TOP V Erneuerbare-Energien-Gesetz, Ausgleichsregelung",13984,poi,18
371,691311,https://www.abgeordnetenwatch.de/profile/norbert-lammert,371,44,Präsident Dr. Norbert Lammert,Dr. Norbert Lammert,norbert-lammert,1754.0,,Wir kommen jetzt zu den Abstimmungen.,"TOP V Erneuerbare-Energien-Gesetz, Ausgleichsregelung",13984,chair,18
372,691312,,372,44,,,,,,Widerspruch beim BÜNDNIS 90/DIE GRÜNEN,"TOP V Erneuerbare-Energien-Gesetz, Ausgleichsregelung",13984,poi,18
373,691313,https://www.abgeordnetenwatch.de/profile/kai-gehring/archive/215144,373,44,Kai Gehring [BÜNDNIS 90/DIE GRÜNEN],Kai Gehring,kai-gehring,1821.0,gruene,Darauf muss man reagieren können! Laut Geschäftsordnung ist eine Reaktion möglich!,"TOP V Erneuerbare-Energien-Gesetz, Ausgleichsregelung",13984,poi,18
374,691314,https://www.abgeordnetenwatch.de/profile/norbert-lammert,374,44,Präsident Dr. Norbert Lammert,Dr. Norbert Lammert,norbert-lammert,1754.0,,"- Das war kein Debattenbeitrag, sondern eine Erklärung nach der Geschäftsordnung.","TOP V Erneuerbare-Energien-Gesetz, Ausgleichsregelung",13984,chair,18
375,691315,https://www.abgeordnetenwatch.de/profile/kai-gehring/archive/215144,375,44,Kai Gehring [BÜNDNIS 90/DIE GRÜNEN],Kai Gehring,kai-gehring,1821.0,gruene,Das darf nicht wahr sein!,"TOP V Erneuerbare-Energien-Gesetz, Ausgleichsregelung",13984,poi,18
376,691316,https://www.abgeordnetenwatch.de/profile/norbert-lammert,376,44,Präsident Dr. Norbert Lammert,Dr. Norbert Lammert,norbert-lammert,1754.0,,"Wenn jemand bei mir eine Erklärung nach der Geschäftsordnung anmeldet, schaue ich mir an, ob es dafür eine hinreichende Grundlage in der Geschäftsordnung gibt. Bisher hat bei mir niemand einen solchen","TOP V Erneuerbare-Energien-Gesetz, Ausgleichsregelung",13984,chair,18
377,691317,https://www.abgeordnetenwatch.de/profile/oliver-krischer/archive/215110,377,44,Oliver Krischer [BÜNDNIS 90/DIE GRÜNEN],Oliver Krischer,oliver-krischer,1450.0,gruene,Ich möchte eine Erklärung zur Geschäftsordnung abgeben!,"TOP V Erneuerbare-Energien-Gesetz, Ausgleichsregelung",13984,poi,18
378,691318,https://www.abgeordnetenwatch.de/profile/norbert-lammert,378,44,Präsident Dr. Norbert Lammert,Dr. Norbert Lammert,norbert-lammert,1754.0,,Erklärungswunsch angemeldet.,"TOP V Erneuerbare-Energien-Gesetz, Ausgleichsregelung",13984,chair,18
379,691319,https://www.abgeordnetenwatch.de/profile/oliver-krischer/archive/215110,379,44,Oliver Krischer [BÜNDNIS 90/DIE GRÜNEN],Oliver Krischer,oliver-krischer,1450.0,gruene,Ich melde mich doch hier!,"TOP V Erneuerbare-Energien-Gesetz, Ausgleichsregelung",13984,poi,18
380,691320,https://www.abgeordnetenwatch.de/profile/norbert-lammert,380,44,Präsident Dr. Norbert Lammert,Dr. Norbert Lammert,norbert-lammert,1754.0,,"Wir kommen jetzt zu den Abstimmungen. Ich mache darauf aufmerksam, dass inzwischen eine sechste namentliche Abstimmung beantragt ist, und zwar zur Schlussabstimmung. Ich bitte, sich auf die anstehenden Abstimmungen einzustellen. Ich weise vor allen Dingen darauf hin, dass es heute Nachmittag noch weitere namentliche Abstimmungen zum Entwurf des Haushaltsgesetzes gibt, damit keine Missverständnisse hinsichtlich der Gesamtzahl der namentlichen Abstimmungen entstehen.

Ich komme zum Tagesordnungspunkt V a. Hierbei geht es um die Abstimmung über den von der Bundesregierung eingebrachten Entwurf eines Gesetzes zur grundlegenden Reform des Erneuerbare-Energien-Gesetzes und zur Änderung weiterer Bestimmungen des Energiewirtschaftsrechts. Der Ausschuss für Wirtschaft und Energie empfiehlt unter Buchstabe a seiner Beschlussempfehlung auf der Drucksache 18/1891, den Gesetzentwurf der Bundesregierung auf den Drucksachen 18/1304 und 18/1573 in der Ausschussfassung anzunehmen. Hierzu gibt es vier Änderungsanträge der Fraktion Die Linke sowie einen Änderungsantrag der Fraktion Bündnis 90/Die Grünen, über die wir zuerst abstimmen.

Wir kommen zunächst zu zwei Änderungsanträgen der Fraktion Die Linke, zu denen jeweils namentliche Abstimmung verlangt wurde.

Ich rufe den Änderungsantrag der Fraktion Die Linke auf der Drucksache 18/1892 (neu) auf. Hierzu bitte ich die Schriftführerinnen und Schriftführer, die vorgesehenen Plätze einzunehmen und mir zu signalisieren, wenn alle Abstimmungsurnen besetzt sind. - Ich eröffne die Abstimmung.

Hat noch ein Mitglied des Hauses zur ersten namentlichen Abstimmung seine Stimmkarte nicht abgegeben? - Das scheint nicht der Fall zu sein. Dann schließe ich die erste dieser Abstimmungen und bitte, mit der Auszählung zu beginnen.1

Wir kommen zum Änderungsantrag der Fraktion Die Linke auf der Drucksache 18/1894 (neu). Auch hier darf ich bitten, nach Auswechseln der Urnen die entsprechenden Abstimmungsplätze von den Schriftführern neu zu besetzen und mir einen Hinweis zu geben. - Sind alle Plätze besetzt? - Dann eröffne ich die zweite namentliche Abstimmung.

Ist noch jemand im Saal, der seine Stimmkarte zur zweiten namentlichen Abstimmung nicht abgegeben hat? - Ich schließe die zweite namentliche Abstimmung und bitte auch hier, mit der Auszählung zu beginnen.2

Wir haben jetzt eine Reihe weiterer Abstimmungen durchzuführen, die nicht namentlich sind. Deswegen darf ich Sie bitten, einen Augenblick Platz zu nehmen.

Wir setzten die Abstimmungen über Änderungsanträge fort.

Wir kommen zum Änderungsantrag der Fraktion Die Linke auf der Drucksache 18/1893 (neu). Wer stimmt für diesen Änderungsantrag? - Wer stimmt dagegen? - Wer enthält sich? - Damit ist dieser Änderungsantrag mit den Stimmen der Koalition abgelehnt.

Wir kommen zur Abstimmung über den Änderungsantrag der Fraktion Die Linke auf der Drucksache 18/1895 (neu). Wer will diesem Änderungsantrag zustimmen? - Wer stimmt dagegen? - Wer enthält sich? - Auch dieser Änderungsantrag ist mit den Stimmen der Koalitionsfraktionen abgelehnt.

Abstimmung über den Änderungsantrag der Fraktion Bündnis 90/Die Grünen auf der Drucksache 18/1896. Wer stimmt für diesen Änderungsantrag? - Wer stimmt dagegen? - Wer enthält sich? - Damit ist dieser Änderungsantrag mit den Stimmen der Koalition bei Enthaltung der Fraktion Die Linke abgelehnt.

Bis zum Vorliegen der Ergebnisse der namentlichen Abstimmungen über die beiden Änderungsanträge, die wir vorhin durchgeführt haben, werde ich die Sitzung gleich für einen Augenblick unterbrechen. Auf eines weise ich aber jetzt schon einmal hin: Es gibt zahlreiche persönliche Erklärungen sowohl zu einzelnen Bestimmungen des Gesetzesvorhabens wie auch zum gesamten Gesetzespaket. Es hat nicht jeder einzelne Abgeordnete eine persönliche Erklärung abgegeben, aber es gibt eine beachtliche Anzahl von persönlichen Erklärungen, die selbstverständlich alle, soweit wir sie hier erhalten haben, wie üblich dem Protokoll beigefügt werden.3

Die Unterbrechung der Sitzung wird vermutlich nur wenige Minuten dauern. Im Anschluss daran werden wir die Abstimmungen, auch namentliche, fortsetzen. In solchen Fällen empfiehlt es sich immer, sich nicht allzu weit entfernt von den Abstimmungsurnen aufzuhalten und nicht zu glauben, die Abstimmung sei im Sprint in jedem Falle noch zu bewerkstelligen.

Die Sitzung ist unterbrochen.","TOP V Erneuerbare-Energien-Gesetz, Ausgleichsregelung",13984,chair,18
381,691321,,381,44,,,,,,Unterbrechung von 10.47 bis 10.51 Uhr,"TOP V Erneuerbare-Energien-Gesetz, Ausgleichsregelung",13984,poi,18
