,id,profile_url,sequence,sitzung,speaker,speaker_cleaned,speaker_fp,speaker_key,speaker_party,text,top,top_id,type,wahlperiode
0,690940,https://www.abgeordnetenwatch.de/profile/norbert-lammert,0,44,Präsident Dr. Norbert Lammert,Dr. Norbert Lammert,norbert-lammert,1754.0,,"Nehmen Sie bitte Platz. Die Sitzung ist eröffnet.

Guten Morgen, liebe Kolleginnen und Kollegen! Ich begrüße Sie herzlich zum letzten Tag unserer Haushaltsdebatte.

Bevor wir in unsere Tagesordnung eintreten, müssen wir zwei Geschäftsordnungsanträge behandeln. Die Fraktionen Die Linke und Bündnis 90/Die Grünen haben jeweils beantragt, die zweite und dritte Beratung des von der Bundesregierung eingebrachten Gesetzentwurfs zur grundlegenden Reform des Erneuerbare-Energien-Gesetzes von der heutigen Tagesordnung abzusetzen. Zu diesem Geschäftsordnungsantrag erteile ich jetzt der Kollegin Petra Sitte das Wort.",TOP  GO-Debatte,13983,chair,18
1,690941,,1,44,,,,,,Beifall bei der LINKEN,TOP  GO-Debatte,13983,poi,18
2,690942,https://www.abgeordnetenwatch.de/profile/dr-petra-sitte-0,2,44,Dr. Petra Sitte (DIE LINKE),Dr. Petra Sitte,petra-sitte,1579.0,linke,"Schönen guten Morgen! Herr Präsident! Meine Damen und Herren! Vorgestern hat die Süddeutsche Zeitung getitelt „Stromschnellen“ und Folgendes geschrieben:

Der SPD-Chef, keine Frage, hat sich die denkbar größte Problemzone in seinem Ressort ausgesucht, und das sogar ganz freiwillig. Die EEG-Reform sollte eine Art Kabinettstück werden.

Früher lagen die Kabinettstücke in den sogenannten Wunderkammern der Fürsten. Herr Gabriel ist ganz sicher kein Fürst. Das wird jeder erkennen.",TOP  GO-Debatte,13983,speech,18
3,690943,,3,44,,,,,,Heiterkeit bei der SPD und der CDU/CSU,TOP  GO-Debatte,13983,poi,18
4,690944,,4,44,,,,,,Zurufe von der SPD,TOP  GO-Debatte,13983,poi,18
5,690945,https://www.abgeordnetenwatch.de/profile/dr-petra-sitte-0,5,44,Dr. Petra Sitte (DIE LINKE),Dr. Petra Sitte,petra-sitte,1579.0,linke,"- Energiefürst. Darüber sollten wir noch einmal reden, nachdem das Gesetz beschlossen wurde.

Es haben sich in den letzten Tagen sehr viele gewundert. Warum? Im Januar wurden die Eckpunkte zu diesem Gesetzentwurf festgelegt. Anfang Mai gab es die erste Lesung. Parallel dazu liefen die Verhandlungen mit EU-Kommissionen. Sie selbst haben zeitgleich zahlreiche Veranstaltungen durchgeführt, auf denen man über die Verhandlungserfolge in Brüssel berichtet hat. Nun, Anfang der Woche, große Panik: Es gab unglaublich viele Vorbehalte aus Brüssel. Es war zunächst unübersichtlich. Vor allem gab es ganz offensichtlich grundsätzliche Probleme, die das Gesamtprojekt gefährden konnten.

Daraus ergeben sich zunächst einmal zwei mögliche Folgerungen: Entweder ist dem Minister in den letzten Monaten entgangen, dass doch nicht so erfolgreich verhandelt wurde, wie man angenommen hatte, oder man hat ein bisschen gepokert und die schlechten Nachrichten für zuletzt aufgehoben, weil man geglaubt hat, dass es sich noch in letzter Minute klärt.",TOP  GO-Debatte,13983,speech,18
6,690946,,6,44,,,,,,Beifall bei der LINKEN und dem BÜNDNIS 90/DIE GRÜNEN,TOP  GO-Debatte,13983,poi,18
7,690947,https://www.abgeordnetenwatch.de/profile/dr-petra-sitte-0,7,44,Dr. Petra Sitte (DIE LINKE),Dr. Petra Sitte,petra-sitte,1579.0,linke,"Nun soll es der Bundestag richten und über die „Stromschnellen“ - wie es die Süddeutsche Zeitung -geschrieben hat - reiten. Am Dienstagmittag kamen 204 Seiten Synopse und 5 Seiten Änderungsanträge zum Gesetz. Das ist alles kein Problem, sagt der Minister, denn 5 Seiten kann man mit einigermaßen Intellekt schnell durchlesen. Um es aber zu bewerten, bleibt es einem nicht erspart, auch die 204 Seiten durchzusehen.",TOP  GO-Debatte,13983,speech,18
8,690948,,8,44,,,,,,Beifall bei der LINKEN und dem BÜNDNIS 90/DIE GRÜNEN,TOP  GO-Debatte,13983,poi,18
9,690949,https://www.abgeordnetenwatch.de/profile/britta-haselmann-0,9,44,Britta Haßelmann [BÜNDNIS 90/DIE GRÜNEN],Britta Haßelmann,britta-haßelmann,1807.0,gruene,"Es sei denn, man ist in der SPD-Fraktion!",TOP  GO-Debatte,13983,poi,18
10,690950,https://www.abgeordnetenwatch.de/profile/dr-petra-sitte-0,10,44,Dr. Petra Sitte (DIE LINKE),Dr. Petra Sitte,petra-sitte,1579.0,linke,"Einige Stunden später jagte dann der Wirtschaftsausschuss durch die hochkomplexe Materie. Mitberatende Ausschüsse tagten teilweise gar nicht oder beschlossen, von Voten abzusehen. Das heißt, sie haben ihren vom Parlament bekommenen Auftrag nicht erfüllt.",TOP  GO-Debatte,13983,speech,18
11,690951,,11,44,,,,,,Beifall bei der LINKEN und dem BÜNDNIS 90/DIE GRÜNEN,TOP  GO-Debatte,13983,poi,18
12,690952,https://www.abgeordnetenwatch.de/profile/dr-petra-sitte-0,12,44,Dr. Petra Sitte (DIE LINKE),Dr. Petra Sitte,petra-sitte,1579.0,linke,"Dabei wissen alle - das war auch das Hauptargument gegenüber der Opposition -: Das Gesetz ist extrem wichtig für betroffene energieintensive Unternehmen, für kleine und mittelständische Unternehmen, für Handwerksbetriebe, Gewerbetreibende, für private Verbraucher, aber auch für Energiegenossenschaften und andere mehr. Es geht also um nichts Geringeres als gerechte Strompreisgestaltung. Welche Perspektive man auch immer einnehmen mag: Aus unserer Sicht ist die Erfolgsgeschichte des EEG in Gefahr. Deshalb müssen wir hier seriös verhandeln. Genau das war aber nicht möglich.

Das Ministerium selbst brauchte Monate. Dem Bundesrat werden 14 Tage eingeräumt, weil Sie panische Angst davor haben, dass er den Vermittlungsausschuss anruft. Der federführende Wirtschaftsausschuss jagt sozusagen an einem Abend zur Beschlussempfehlung. Das, meine Damen und Herren, ist eine unglaubliche Missachtung des Parlaments, der Ausschüsse und unserer Aufgaben.",TOP  GO-Debatte,13983,speech,18
13,690953,,13,44,,,,,,Beifall bei der LINKEN und dem BÜNDNIS 90/DIE GRÜNEN,TOP  GO-Debatte,13983,poi,18
14,690954,https://www.abgeordnetenwatch.de/profile/dr-petra-sitte-0,14,44,Dr. Petra Sitte (DIE LINKE),Dr. Petra Sitte,petra-sitte,1579.0,linke,"Erst recht werden hier die Aufgaben der Opposition missachtet: Kontrolle, Kritik und das Einbringen eigener Vorstellungen; das sind originäre Aufgaben der Opposition. Um diese sachgerecht erfüllen zu können, müssen wir eben auch unsere Minderheitenrechte wahrnehmen können. Das heißt, zum einen brauchen wir natürlich eine Beratungsverlängerung, zum anderen eine erneute Anhörung; denn es sind neue Gesichtspunkte aufgetaucht, und immer dann, wenn neue Gesichtspunkte auftauchen, besteht das Recht der Minderheit in diesem Parlament auf eine Anhörung.",TOP  GO-Debatte,13983,speech,18
15,690955,,15,44,,,,,,Beifall bei der LINKEN und dem BÜNDNIS 90/DIE GRÜNEN,TOP  GO-Debatte,13983,poi,18
16,690956,https://www.abgeordnetenwatch.de/profile/dr-petra-sitte-0,16,44,Dr. Petra Sitte (DIE LINKE),Dr. Petra Sitte,petra-sitte,1579.0,linke,"Ich will nur zwei neue Punkte benennen - es waren ja mehr -, die medial bereits als neu erkannt wurden: Da ist die Erweiterung der EEG-Förderung auf Anlagen in anderen EU-Ländern oder eben auch die Streichung der Vergütung für erneuerbare Energie bei anhaltenden Negativpreisen an der Strombörse. Das heißt, zum Teil hat sich die Geschäftsgrundlage dieses Gesetzes verändert. Ihre Ablehnung einer Anhörung bedeutet nun aber auch, dass Betroffene ihre Position nicht darstellen können und uns als Parlament Expertise verloren geht, und das kann doch wohl nicht sein.",TOP  GO-Debatte,13983,speech,18
17,690957,,17,44,,,,,,Beifall bei der LINKEN und dem BÜNDNIS 90/DIE GRÜNEN,TOP  GO-Debatte,13983,poi,18
18,690958,https://www.abgeordnetenwatch.de/profile/dr-petra-sitte-0,18,44,Dr. Petra Sitte (DIE LINKE),Dr. Petra Sitte,petra-sitte,1579.0,linke,"Noch vor Wochen, meine Damen und Herren, haben wir hier über die GO - für die Zuhörerinnen und Zuhörer: die Geschäftsordnung - des Bundestages beraten. Da ging es vor allem um die Wahrung der Minderheitsrechte. Da haben Sie uns hoch und heilig versprochen, dass Sie sie wahren werden. Jetzt kommt die erste Nagelprobe, und es passiert genau das, was die Linke damals vorausgesagt hat: Sie werden Ihre pralle Mehrheit nutzen, um sich gegen unsere Einwände durchzusetzen. Das führt am Ende dazu, dass die Opposition ausgeschlossen wird. Vor diesem Hintergrund haben wir uns nicht an der Abstimmungsfarce im Wirtschaftsausschuss beteiligt.",TOP  GO-Debatte,13983,speech,18
19,690959,https://www.abgeordnetenwatch.de/profile/hubertus-heil/archive/216675,19,44,Hubertus Heil [Peine] [SPD],Hubertus Heil,hubertus-heil,1801.0,spd,An den Beratungen!,TOP  GO-Debatte,13983,poi,18
20,690960,https://www.abgeordnetenwatch.de/profile/dr-petra-sitte-0,20,44,Dr. Petra Sitte (DIE LINKE),Dr. Petra Sitte,petra-sitte,1579.0,linke,Wir beantragen hier die Absetzung dieses Punktes von der Tagesordnung.,TOP  GO-Debatte,13983,speech,18
21,690961,https://www.abgeordnetenwatch.de/profile/norbert-lammert,21,44,Präsident Dr. Norbert Lammert,Dr. Norbert Lammert,norbert-lammert,1754.0,,Frau Kollegin.,TOP  GO-Debatte,13983,chair,18
22,690962,https://www.abgeordnetenwatch.de/profile/dr-petra-sitte-0,22,44,Dr. Petra Sitte (DIE LINKE),Dr. Petra Sitte,petra-sitte,1579.0,linke,"Immer wieder gern, Herr Präsident. Ein Satz noch. - Ich appelliere an Sie: Geben Sie sich, geben Sie den Betroffenen und natürlich der Opposition in diesem Haus die Chance, dieses Gesetz seriös, sachgerecht und fair zu verhandeln.

Danke schön.",TOP  GO-Debatte,13983,speech,18
23,690963,,23,44,,,,,,Beifall bei der LINKEN und dem BÜNDNIS 90/DIE GRÜNEN,TOP  GO-Debatte,13983,poi,18
24,690964,https://www.abgeordnetenwatch.de/profile/norbert-lammert,24,44,Präsident Dr. Norbert Lammert,Dr. Norbert Lammert,norbert-lammert,1754.0,,"Zu den Regeln unserer Geschäftsordnung gehört auch, dass Anträge zur Geschäftsordnung nicht länger als fünf Minuten begründet werden dürfen. Da hat es jetzt wieder einen Minderheitszuschlag gegeben, Frau Sitte.",TOP  GO-Debatte,13983,chair,18
25,690965,,25,44,,,,,,"Beifall bei Abgeordneten der CDU/CSU, der SPD und der LINKEN",TOP  GO-Debatte,13983,poi,18
26,690966,https://www.abgeordnetenwatch.de/profile/norbert-lammert,26,44,Präsident Dr. Norbert Lammert,Dr. Norbert Lammert,norbert-lammert,1754.0,,Die nächste Wortmeldung ist von der Kollegin Christine Lambrecht für die SPD-Fraktion.,TOP  GO-Debatte,13983,chair,18
27,690967,,27,44,,,,,,Beifall bei der SPD sowie bei Abgeordneten der CDU/CSU,TOP  GO-Debatte,13983,poi,18
28,690968,https://www.abgeordnetenwatch.de/profile/christine-lambrecht-0,28,44,Christine Lambrecht (SPD),Christine Lambrecht,christine-lambrecht,1749.0,spd,"Herr Präsident! Liebe Kolleginnen und Kollegen! Um die Spannung aus der Debatte gleich herauszunehmen, erkläre ich, dass wir von den Koalitionsfraktionen diesem Geschäftsordnungsantrag nicht zustimmen werden.",TOP  GO-Debatte,13983,speech,18
29,690969,https://www.abgeordnetenwatch.de/profile/dr-anton-hofreiter-0,29,44,Dr. Anton Hofreiter [BÜNDNIS 90/DIE GRÜNEN],Dr. Anton Hofreiter,anton-hofreiter,1793.0,gruene,Sie könnten sich ja zumindest komplett die Argumente anhören!,TOP  GO-Debatte,13983,poi,18
30,690970,https://www.abgeordnetenwatch.de/profile/christine-lambrecht-0,30,44,Christine Lambrecht (SPD),Christine Lambrecht,christine-lambrecht,1749.0,spd,"Ich will aber auch begründen, warum. Ich muss zugeben: Ich habe ein gewisses Maß an Verständnis für die Kritik an diesem Verfahren,",TOP  GO-Debatte,13983,speech,18
31,690971,https://www.abgeordnetenwatch.de/profile/volker-kauder/archive/214888,31,44,Volker Kauder [CDU/CSU],Volker Kauder,volker-kauder,1775.0,cducsu,Ich nicht!,TOP  GO-Debatte,13983,poi,18
32,690972,,32,44,,,,,,Zurufe von der LINKEN und dem BÜNDNIS 90/DIE GRÜNEN,TOP  GO-Debatte,13983,poi,18
33,690973,https://www.abgeordnetenwatch.de/profile/christine-lambrecht-0,33,44,Christine Lambrecht (SPD),Christine Lambrecht,christine-lambrecht,1749.0,spd,"und ich glaube, es geht uns allen so.",TOP  GO-Debatte,13983,speech,18
34,690974,,34,44,,,,,,Beifall des Abg. Arnold Vaatz [CDU/CSU],TOP  GO-Debatte,13983,poi,18
35,690975,https://www.abgeordnetenwatch.de/profile/christine-lambrecht-0,35,44,Christine Lambrecht (SPD),Christine Lambrecht,christine-lambrecht,1749.0,spd,"Das ist sicherlich kein Verfahren, das für zukünftige Projekte beispielgebend ist. Aber dieses Verfahren ist auch nicht einmalig,",TOP  GO-Debatte,13983,speech,18
36,690976,https://www.abgeordnetenwatch.de/profile/katrin-goring-eckardt/archive/215231,36,44,Katrin Göring-Eckardt [BÜNDNIS 90/DIE GRÜNEN],Katrin Göring-Eckardt,katrin-goring-eckardt,1604.0,gruene,Wird es dadurch besser?,TOP  GO-Debatte,13983,poi,18
37,690977,https://www.abgeordnetenwatch.de/profile/christine-lambrecht-0,37,44,Christine Lambrecht (SPD),Christine Lambrecht,christine-lambrecht,1749.0,spd,"so wie es teilweise in Erklärungen der letzten Tagen zu lesen und zu hören war.

Lassen Sie mich deswegen aus einer Pressemitteilung zitieren: Die Art und Weise, wie die Regierungsfraktionen ihren Entwurf zum Erneuerbare-Energien-Gesetz durch die Ausschussberatung peitschten, widerspricht eklatant den Regeln eines geordneten parlamentarischen Beratungsverfahrens. Heute steht noch nicht fest, welcher Gesetzestext am Freitag beschlossen werden soll.

(Beifall bei der LINKEN und dem BÜNDNIS 90/DIE GRÜNEN

Meine Damen und Herren, diese Pressemitteilung stammt weder von Herrn Hofreiter oder der Fraktion der Grünen noch von Herrn Gysi oder der Fraktion der Linken. Nein, sie stammt von den Kollegen Grill, CDU, und Christian Ruck, CSU; beide heute nicht mehr im Bundestag.",TOP  GO-Debatte,13983,speech,18
38,690978,https://www.abgeordnetenwatch.de/profile/claudia-roth-0,38,44,Claudia Roth [Augsburg] [BÜNDNIS 90/DIE GRÜNEN],Claudia Roth,claudia-roth,1686.0,gruene,Das ist doch kein Argument!,TOP  GO-Debatte,13983,poi,18
39,690979,https://www.abgeordnetenwatch.de/profile/christine-lambrecht-0,39,44,Christine Lambrecht (SPD),Christine Lambrecht,christine-lambrecht,1749.0,spd,So haben sie sich auf die damalige erste Fassung des EEG im Jahr 2000 bezogen. Deswegen kann ich nur sagen: Das ist kein einmaliger Vorgang.,TOP  GO-Debatte,13983,speech,18
40,690980,,40,44,,,,,,Beifall bei Abgeordneten der SPD,TOP  GO-Debatte,13983,poi,18
41,690981,,41,44,,,,,,Widerspruch bei der LINKEN und dem BÜNDNIS 90/DIE GRÜNEN,TOP  GO-Debatte,13983,poi,18
42,690982,https://www.abgeordnetenwatch.de/profile/christine-lambrecht-0,42,44,Christine Lambrecht (SPD),Christine Lambrecht,christine-lambrecht,1749.0,spd,Das habe ich gestern auch Kolleginnen und Kollegen der Grünen entgegengehalten. Darauf kam dann die Antwort: Das macht das Verfahren nicht besser. Da haben Sie recht!,TOP  GO-Debatte,13983,speech,18
43,690983,,43,44,,,,,,Beifall bei Abgeordneten des BÜNDNISSES 90/DIE GRÜNEN,TOP  GO-Debatte,13983,poi,18
44,690984,https://www.abgeordnetenwatch.de/profile/christine-lambrecht-0,44,44,Christine Lambrecht (SPD),Christine Lambrecht,christine-lambrecht,1749.0,spd,Aber das macht Ihre gespielte Empörung nicht glaubwürdig; das gehört ebenfalls zur Wahrheit.,TOP  GO-Debatte,13983,speech,18
45,690985,,45,44,,,,,,Beifall bei der SPD und der CDU/CSU,TOP  GO-Debatte,13983,poi,18
46,690986,,46,44,,,,,,Zuruf der Abg. Claudia Roth [Augsburg] [BÜNDNIS 90/DIE GRÜNEN],TOP  GO-Debatte,13983,poi,18
47,690987,https://www.abgeordnetenwatch.de/profile/christine-lambrecht-0,47,44,Christine Lambrecht (SPD),Christine Lambrecht,christine-lambrecht,1749.0,spd,"Ich glaube, wir sollten bei diesem Thema mal runterkommen und mit den wechselseitigen Erklärungen aufhören. Ich bin seit 1998 im Bundestag. Ich habe im Rechtsausschuss schon mit 200 bis 300 Seiten langen Tischvorlagen arbeiten müssen.",TOP  GO-Debatte,13983,speech,18
48,690988,https://www.abgeordnetenwatch.de/profile/katrin-goring-eckardt/archive/215231,48,44,Katrin Göring-Eckardt [BÜNDNIS 90/DIE GRÜNEN],Katrin Göring-Eckardt,katrin-goring-eckardt,1604.0,gruene,Das war aber toll!,TOP  GO-Debatte,13983,poi,18
49,690989,https://www.abgeordnetenwatch.de/profile/christine-lambrecht-0,49,44,Christine Lambrecht (SPD),Christine Lambrecht,christine-lambrecht,1749.0,spd,"Das ist nicht beispielgebend, aber das zeigt: Es ist auch nicht einmalig.",TOP  GO-Debatte,13983,speech,18
50,690990,,50,44,,,,,,Zurufe vom BÜNDNIS 90/DIE GRÜNEN,TOP  GO-Debatte,13983,poi,18
51,690991,https://www.abgeordnetenwatch.de/profile/christine-lambrecht-0,51,44,Christine Lambrecht (SPD),Christine Lambrecht,christine-lambrecht,1749.0,spd,"Lassen Sie uns über die Kritikpunkte sprechen. Es war immer zu lesen, man müsse innerhalb eines Tages 200 Seiten lesen.",TOP  GO-Debatte,13983,speech,18
52,690992,,52,44,,,,,,Zuruf der Abg. Dr. Gesine Lötzsch [DIE LINKE],TOP  GO-Debatte,13983,poi,18
53,690993,https://www.abgeordnetenwatch.de/profile/christine-lambrecht-0,53,44,Christine Lambrecht (SPD),Christine Lambrecht,christine-lambrecht,1749.0,spd,"Ich glaube, es ist mittlerweile ausgeräumt, dass es nicht darum geht, 200 Seiten zu lesen. Vielmehr geht es um den Vergleich eines Entwurfs, der schon vorlag und über den schon wochenlang diskutiert wurde, und den in diesem Zusammenhang vorgenommenen Änderungen. Wenn man das alles eindampft, dann stellt man fest: Es sind die berühmten fünf oder zehn Seiten, die zu lesen und zu verstehen waren.",TOP  GO-Debatte,13983,speech,18
54,690994,https://www.abgeordnetenwatch.de/profile/volker-kauder/archive/214888,54,44,Volker Kauder [CDU/CSU],Volker Kauder,volker-kauder,1775.0,cducsu,Das überfordert die Grünen nicht!,TOP  GO-Debatte,13983,poi,18
55,690995,,55,44,,,,,,Zurufe vom BÜNDNIS 90/DIE GRÜNEN,TOP  GO-Debatte,13983,poi,18
56,690996,https://www.abgeordnetenwatch.de/profile/christine-lambrecht-0,56,44,Christine Lambrecht (SPD),Christine Lambrecht,christine-lambrecht,1749.0,spd,"Ich finde, zehn Seiten an einem Tag zu lesen und durchzuarbeiten, ist viel Arbeit, ja. Aber das überfordert einen Bundestagsabgeordneten eigentlich nicht oder sollte ihn zumindest nicht überfordern.",TOP  GO-Debatte,13983,speech,18
57,690997,,57,44,,,,,,Beifall bei der SPD und der CDU/CSU,TOP  GO-Debatte,13983,poi,18
58,690998,,58,44,,,,,,Widerspruch beim BÜNDNIS 90/DIE GRÜNEN,TOP  GO-Debatte,13983,poi,18
59,690999,https://www.abgeordnetenwatch.de/profile/christine-lambrecht-0,59,44,Christine Lambrecht (SPD),Christine Lambrecht,christine-lambrecht,1749.0,spd,"Deswegen muss ich sagen: Diese Empörung ist gespielt.

Das Argument der Anhörung, Frau Sitte: Sie als Parlamentarische Geschäftsführerin kennen die Spielregeln. Selbstverständlich wäre eine Anhörung notwendig gewesen, wenn jetzt in der Novelle, jetzt in der geänderten Fassung tatsächlich neue Gesichtspunkte enthalten gewesen wären. Das ist aber nicht der Fall.

Der Punkt, den Sie angesprochen und auch beantragt haben, nämlich die Frage der Ausweitung der Förderung auf Anlagen in EU-Nachbarländern, ist nicht Gegenstand dieser Novelle. Darüber werden wir reden müssen, ja, insbesondere vor dem Hintergrund des dann - ich glaube, am 1. Juli - ergehenden Urteils, aber das ist nicht Gegenstand der Novelle. Deswegen bedurfte es auch keiner Anhörung.",TOP  GO-Debatte,13983,speech,18
60,691000,,60,44,,,,,,Beifall bei der SPD sowie bei Abgeordneten der CDU/CSU,TOP  GO-Debatte,13983,poi,18
61,691001,https://www.abgeordnetenwatch.de/profile/christine-lambrecht-0,61,44,Christine Lambrecht (SPD),Christine Lambrecht,christine-lambrecht,1749.0,spd,"Die anderen Punkte, die Sie angesprochen haben, waren Gegenstand von zwei Anhörungen. Dort wurde ausgiebig diskutiert. Deswegen war dieses Minderheitenrecht auch verbraucht. Das ist übliches Vorgehen. Deswegen sollte man das auch nicht skandalisieren.",TOP  GO-Debatte,13983,speech,18
62,691002,,62,44,,,,,,Beifall bei der SPD sowie bei Abgeordneten der CDU/CSU,TOP  GO-Debatte,13983,poi,18
63,691003,https://www.abgeordnetenwatch.de/profile/christine-lambrecht-0,63,44,Christine Lambrecht (SPD),Christine Lambrecht,christine-lambrecht,1749.0,spd,"Ich kann uns alle nur aufrufen: Hören wir endlich auf, eine Verfahrensdiskussion zu führen, dafür ist dieses Thema nämlich viel zu wichtig.",TOP  GO-Debatte,13983,speech,18
64,691004,,64,44,Zurufe vom BÜNDNIS 90/DIE GRÜNEN,vom BÜNDNIS 90/DIE GRÜNEN,vom-bundnis-90-die-grunen,,gruene,Oh! Oh!,TOP  GO-Debatte,13983,poi,18
65,691005,https://www.abgeordnetenwatch.de/profile/christine-lambrecht-0,65,44,Christine Lambrecht (SPD),Christine Lambrecht,christine-lambrecht,1749.0,spd,Lassen Sie uns doch endlich in die Fachdiskussion einsteigen.,TOP  GO-Debatte,13983,speech,18
66,691006,,66,44,,,,,,Zuruf der Abg. Kerstin Andreae [BÜNDNIS 90/DIE GRÜNEN],TOP  GO-Debatte,13983,poi,18
67,691007,https://www.abgeordnetenwatch.de/profile/christine-lambrecht-0,67,44,Christine Lambrecht (SPD),Christine Lambrecht,christine-lambrecht,1749.0,spd,"Ich würde mich freuen, wenn die so empörten Grünen endlich einmal eine Sachdiskussion führen würden;",TOP  GO-Debatte,13983,speech,18
68,691008,,68,44,,,,,,Beifall bei der SPD und der CDU/CSU,TOP  GO-Debatte,13983,poi,18
69,691009,https://www.abgeordnetenwatch.de/profile/christine-lambrecht-0,69,44,Christine Lambrecht (SPD),Christine Lambrecht,christine-lambrecht,1749.0,spd,"denn in der Sache sind wir gar nicht so weit auseinander. Lassen Sie uns endlich in die Diskussion einsteigen. Darum geht es heute.

Vielen Dank.",TOP  GO-Debatte,13983,speech,18
70,691010,,70,44,,,,,,Beifall bei der SPD und der CDU/CSU,TOP  GO-Debatte,13983,poi,18
71,691011,https://www.abgeordnetenwatch.de/profile/volker-kauder/archive/214888,71,44,Volker Kauder [CDU/CSU],Volker Kauder,volker-kauder,1775.0,cducsu,Sehr schön! Wunderbar!,TOP  GO-Debatte,13983,poi,18
72,691012,https://www.abgeordnetenwatch.de/profile/norbert-lammert,72,44,Präsident Dr. Norbert Lammert,Dr. Norbert Lammert,norbert-lammert,1754.0,,Für die Fraktion Bündnis 90/Die Grünen hat nun die Kollegin Haßelmann das Wort.,TOP  GO-Debatte,13983,chair,18
73,691013,https://www.abgeordnetenwatch.de/profile/volker-kauder/archive/214888,73,44,Volker Kauder [CDU/CSU],Volker Kauder,volker-kauder,1775.0,cducsu,Es kommt jetzt Frau Haßelmann!,TOP  GO-Debatte,13983,poi,18
74,691014,https://www.abgeordnetenwatch.de/profile/britta-haselmann-0,74,44,Britta Haßelmann (BÜNDNIS 90/DIE GRÜNEN),Britta Haßelmann,britta-haßelmann,1807.0,gruene,Sehr geehrter Herr Präsident! Meine Damen und Herren Zuschauerinnen und Zuschauer!,TOP  GO-Debatte,13983,speech,18
75,691015,https://www.abgeordnetenwatch.de/profile/volker-kauder/archive/214888,75,44,Volker Kauder [CDU/CSU],Volker Kauder,volker-kauder,1775.0,cducsu,Wir sind keine Zuschauer! Wir sind nicht auf dem Fußballplatz!,TOP  GO-Debatte,13983,poi,18
76,691016,https://www.abgeordnetenwatch.de/profile/britta-haselmann-0,76,44,Britta Haßelmann (BÜNDNIS 90/DIE GRÜNEN),Britta Haßelmann,britta-haßelmann,1807.0,gruene,"Sehr geehrte Kolleginnen und Kollegen! Liebe Christine Lambrecht, Sie haben doch Jura studiert.",TOP  GO-Debatte,13983,speech,18
77,691017,https://www.abgeordnetenwatch.de/profile/christine-lambrecht-0,77,44,Christine Lambrecht [SPD],Christine Lambrecht,christine-lambrecht,1749.0,spd,Ja!,TOP  GO-Debatte,13983,poi,18
78,691018,https://www.abgeordnetenwatch.de/profile/thomas-oppermann/archive/216688,78,44,Thomas Oppermann [SPD],Thomas Oppermann,thomas-oppermann,1719.0,spd,"Ja, deshalb!",TOP  GO-Debatte,13983,poi,18
79,691019,https://www.abgeordnetenwatch.de/profile/britta-haselmann-0,79,44,Britta Haßelmann (BÜNDNIS 90/DIE GRÜNEN),Britta Haßelmann,britta-haßelmann,1807.0,gruene,"Es gibt keine Gleichheit im Unrecht, das lernt man im ersten Semester.",TOP  GO-Debatte,13983,speech,18
80,691020,,80,44,,,,,,Beifall beim BÜNDNIS 90/DIE GRÜNEN und bei der LINKEN,TOP  GO-Debatte,13983,poi,18
81,691021,https://www.abgeordnetenwatch.de/profile/britta-haselmann-0,81,44,Britta Haßelmann (BÜNDNIS 90/DIE GRÜNEN),Britta Haßelmann,britta-haßelmann,1807.0,gruene,"Wir sollten uns als Parlament hier und heute alle an die eigene Nase fassen, Sie ganz besonders;",TOP  GO-Debatte,13983,speech,18
82,691022,https://www.abgeordnetenwatch.de/profile/christine-lambrecht-0,82,44,Christine Lambrecht [SPD],Christine Lambrecht,christine-lambrecht,1749.0,spd,"Ja, alle! Bitte mit der Heuchelei aufhören!",TOP  GO-Debatte,13983,poi,18
83,691023,https://www.abgeordnetenwatch.de/profile/britta-haselmann-0,83,44,Britta Haßelmann (BÜNDNIS 90/DIE GRÜNEN),Britta Haßelmann,britta-haßelmann,1807.0,gruene,denn es hat in der Debatte über diese EEG-Reform grobe Verfahrensfehler gegeben.,TOP  GO-Debatte,13983,speech,18
84,691024,,84,44,Wolfgang Tiefensee [SPD],Wolfgang Tiefensee,wolfgang-tiefensee,,spd,Welche?,TOP  GO-Debatte,13983,poi,18
85,691025,https://www.abgeordnetenwatch.de/profile/britta-haselmann-0,85,44,Britta Haßelmann (BÜNDNIS 90/DIE GRÜNEN),Britta Haßelmann,britta-haßelmann,1807.0,gruene,"Eines möchte ich ganz deutlich sagen: Sie, meine Damen und Herren von der SPD, haben gestern diese selbstgefällige Äußerung Ihres Bundeswirtschaftsministers Gabriel beklatscht - ich zitiere -:

Ich finde, ehrlich gesagt, das Lesen von fünf Seiten, auf denen präzise steht, worum es bei den Änderungen geht, ist keine … Überforderung … Daraus machen Sie einen Riesenpopanz.

Dazu kann ich Ihnen nur sagen: Sie schaffen sich ab als Parlamentarierinnen und Parlamentarier!",TOP  GO-Debatte,13983,speech,18
86,691026,,86,44,,,,,,Beifall beim BÜNDNIS 90/DIE GRÜNEN und bei der LINKEN,TOP  GO-Debatte,13983,poi,18
87,691027,https://www.abgeordnetenwatch.de/profile/britta-haselmann-0,87,44,Britta Haßelmann (BÜNDNIS 90/DIE GRÜNEN),Britta Haßelmann,britta-haßelmann,1807.0,gruene,"Unsere Pflicht ist es, einen Gesetzentwurf zu lesen, kritisch zu hinterfragen und sorgfältig zu prüfen. Sie hingegen haben gestern dieses blöde Argument des Bundeswirtschaftsministers bejubelt, beklatscht haben Sie es.",TOP  GO-Debatte,13983,speech,18
