,id,profile_url,sequence,sitzung,speaker,speaker_cleaned,speaker_fp,speaker_key,speaker_party,text,top,top_id,type,wahlperiode
493,691433,https://www.abgeordnetenwatch.de/profile/sven-christian-kindler/archive/215049,493,44,Sven-Christian Kindler [BÜNDNIS 90/DIE GRÜNEN],Sven-Christian Kindler,sven-christian-kindler,1328.0,gruene,Wo denn?,TOP II.18 Verkehr und digitale Infrastruktur,13985,poi,18
494,691434,https://www.abgeordnetenwatch.de/profile/alexander-dobrindt-0,494,44,"Alexander Dobrindt, Bundesminister für Verkehr und digitale Infrastruktur",Alexander Dobrindt,alexander-dobrindt,1847.0,,"Nach sehr vielen Jahren verkehrspolitischer Diskussionen und des Einsatzes aller Beteiligten ist es uns gelungen, eine Überjährigkeit und Mehrjährigkeit der Mittel zu erreichen. Zu diesem Zweck haben wir den Einsatz der Mittel bei langlaufenden Projekten stärker an die baulichen Fortschritte gekoppelt. Das ist ein großer Erfolg der Verkehrspolitiker in diesem Haus. Deswegen sage ich an dieser Stelle auch Danke schön für Ihren Einsatz.",TOP II.18 Verkehr und digitale Infrastruktur,13985,speech,18
495,691435,,495,44,,,,,,Beifall bei der CDU/CSU und der SPD,TOP II.18 Verkehr und digitale Infrastruktur,13985,poi,18
496,691436,https://www.abgeordnetenwatch.de/profile/alexander-dobrindt-0,496,44,"Alexander Dobrindt, Bundesminister für Verkehr und digitale Infrastruktur",Alexander Dobrindt,alexander-dobrindt,1847.0,,"Der zweite große Punkt des Investitionshochlaufs der nächsten Jahre ist die Ausweitung der Nutzerfinanzierung. Ich habe einen klaren Fahrplan vorgelegt: zum 1. Juli nächsten Jahres die Verbreiterung der Lkw-Maut auf weitere 1 000 Kilometer vierstreifige Bundesstraßen, die Vertiefung der Lkw-Maut ab 1. Oktober 2015 auf Fahrzeuge von 7,5 bis 12 Tonnen, die Pkw-Maut ab dem 1. Januar 2016 und die Lkw-Maut auf allen Bundesstraßen in Deutschland ab Mitte 2018.

All diesen Maßnahmen muss eines gemeinsam sein: Diese Mittel kommen aus dem Bereich der Straße und müssen deswegen auch wieder in die Straßen investiert werden. Bei allen Mitteln, die aufgewandt werden, muss es eine klare Zweckbindung geben. Die Mittel, die aus dem Bereich eines bestimmten Transportweges kommen, müssen in diesen auch wieder investiert werden.",TOP II.18 Verkehr und digitale Infrastruktur,13985,speech,18
497,691437,,497,44,,,,,,Beifall bei der CDU/CSU sowie bei Abgeordneten der SPD,TOP II.18 Verkehr und digitale Infrastruktur,13985,poi,18
498,691438,https://www.abgeordnetenwatch.de/profile/alexander-dobrindt-0,498,44,"Alexander Dobrindt, Bundesminister für Verkehr und digitale Infrastruktur",Alexander Dobrindt,alexander-dobrindt,1847.0,,"Der dritte Punkt des Investitionshochlaufs ist die Ausweitung der ÖPP-Projekte. Ich weiß, dass wir - das ist übrigens nicht neu - seit vielen Jahren immer wieder darüber diskutieren: Kann man sie optimieren, kann man sie verbessern? Führen wir in jedem Einzelfall den Nachweis der Wirtschaftlichkeit? Ja, wir führen ihn,",TOP II.18 Verkehr und digitale Infrastruktur,13985,speech,18
499,691439,https://www.abgeordnetenwatch.de/profile/sven-christian-kindler/archive/215049,499,44,Sven-Christian Kindler [BÜNDNIS 90/DIE GRÜNEN],Sven-Christian Kindler,sven-christian-kindler,1328.0,gruene,Das stimmt aber nicht! Das sieht der Rechnungshof ganz anders!,TOP II.18 Verkehr und digitale Infrastruktur,13985,poi,18
500,691440,https://www.abgeordnetenwatch.de/profile/alexander-dobrindt-0,500,44,"Alexander Dobrindt, Bundesminister für Verkehr und digitale Infrastruktur",Alexander Dobrindt,alexander-dobrindt,1847.0,,"und wir haben in dieser Koalition eine klare Vereinbarung hinsichtlich der ÖPP-Projekte getroffen: Wenn sie schneller, effizienter und wirtschaftlicher sind, dann wollen wir dieses Instrument nutzen.

Ich bitte hier um Verständnis. Ich nehme die Hinweise des Bundesrechnungshofes sehr ernst, und wir gehen jedem einzelnen Hinweis auch an dieser Stelle ganz selbstverständlich nach.",TOP II.18 Verkehr und digitale Infrastruktur,13985,speech,18
501,691441,https://www.abgeordnetenwatch.de/profile/sven-christian-kindler/archive/215049,501,44,Sven-Christian Kindler [BÜNDNIS 90/DIE GRÜNEN],Sven-Christian Kindler,sven-christian-kindler,1328.0,gruene,Folgen gibt es aber nie! Sie machen weiter wie bisher!,TOP II.18 Verkehr und digitale Infrastruktur,13985,poi,18
502,691442,https://www.abgeordnetenwatch.de/profile/alexander-dobrindt-0,502,44,"Alexander Dobrindt, Bundesminister für Verkehr und digitale Infrastruktur",Alexander Dobrindt,alexander-dobrindt,1847.0,,"Deswegen sage ich: Ja, wir überprüfen jedes ÖPP-Projekt darauf, ob es wirtschaftlich ist und ob es wirtschaftlicher realisierbar ist als eine andere Beschaffungsva-riante. Die Prüfmechanismen müssen aber eben auch umfänglich sein. Sie müssen nicht nur den jeweiligen Bau während der Erstellung, sondern auch den ganzen Lebenszyklus und den volkswirtschaftlichen Nutzen mit einschließen. Die Alternative zu ÖPP-Projekten heißt Stau, und Stau ist die schlechteste wirtschaftliche und volkswirtschaftliche Variante.",TOP II.18 Verkehr und digitale Infrastruktur,13985,speech,18
503,691443,,503,44,,,,,,Beifall bei der CDU/CSU,TOP II.18 Verkehr und digitale Infrastruktur,13985,poi,18
504,691444,https://www.abgeordnetenwatch.de/profile/sven-christian-kindler/archive/215049,504,44,Sven-Christian Kindler [BÜNDNIS 90/DIE GRÜNEN],Sven-Christian Kindler,sven-christian-kindler,1328.0,gruene,"Lesen Sie einmal das Buch dazu, dass Ihnen Frau Hagedorn geschenkt hat!",TOP II.18 Verkehr und digitale Infrastruktur,13985,poi,18
505,691445,https://www.abgeordnetenwatch.de/profile/alexander-dobrindt-0,505,44,"Alexander Dobrindt, Bundesminister für Verkehr und digitale Infrastruktur",Alexander Dobrindt,alexander-dobrindt,1847.0,,"Deswegen bereiten wir auch eine dritte Staffel von ÖPP-Projekten vor. Ich sichere aber zu: Wir werden uns in der Tat jeden Einzelfall sehr genau anschauen, ihn analysieren und auf seine Wirtschaftlichkeit hin prüfen, weil wir uns hier konform mit den Vereinbarungen verhalten wollen.

Vierter Punkt des Investitionshochlaufs ist eine klare Prioritätensetzung. Das heißt, Investitionen, die wir vorhaben, richten sich nach der verkehrlichen Gesamtwirkung und dem volkswirtschaftlichen Nutzen. Es geht um Engpässe, es geht um Knotenpunkte, und es geht darum, ein bestehendes Netz leistungsfähiger zu machen.

Das tun wir zum Beispiel mit dem Seehafen-Hinterland-Anbindungsprogramm in seiner dann zweiten Version. Wir werden damit dort helfen, wo wir Engpässe feststellen, wo also ein hohes Verkehrsaufkommen auftritt und dadurch das ganze Netz gestört wird, zum Beispiel an Europas größtem Rangierbahnhof Maschen. Was man dort bei einer Besichtigung sieht, ist schon eindrucksvoll. Aber dieser Rangierbahnhof ist auch ein Knotenpunkt, eine Engstelle mit Auswirkungen auf das ganze umliegende Netz, die wir gerne dadurch auflösen wollen, dass wir mit dem Seehafen-Hinterland-Anbindungsprogramm in den Ausbau dieser Knotenpunkte investieren.

Ein zweites, prioritätensetzendes Element haben Sie erwähnt: den Nord-Ostsee-Kanal mit seiner ganzen Bedeutung. Von diesem Kanal kann man nur dann überzeugt sein, wenn man die Leistungsfähigkeit dieses weltweit einzigartigen Projektes sieht. Deswegen bin ich dankbar, dass wir im Haushaltsausschuss die Mehrkosten für die fünfte Schleusenkammer gemeinschaftlich freigegeben haben.

Ich sage Ihnen, Herr Kindler: Ihre Kritik an dieser Stelle kann ich nicht verstehen. Wir sind uns einig, dass dies ein herausragendes Projekt im Rahmen unserer Verkehrssysteme ist. Alle Fraktionen haben der Übernahme der Mehrkosten im Haushaltsausschuss gemeinschaftlich zugestimmt, und zwar auch deswegen, weil wir die Kritik des Rechnungshofes an dieser Stelle für nicht schlüssig gehalten haben. Deswegen ist es falsch, zu sagen, hier wäre etwas auf den Weg gebracht worden, was in der Kritik stand.

Wir haben sehr deutlich gemacht: Es gibt mit Blick auf den Ausbau des NOK kein Wenn und Aber. Wir wollen den Ausbau erreichen. Deswegen werden wir diese Mehrkosten übernehmen und investieren. Dies gilt genauso, liebe Frau Hagedorn, für die Oststrecke. Die Gelder dafür sind in den Ermächtigungen freigegeben. Wir werden umgehend in den Bau der Oststrecke einsteigen.

Für bestimmte Teile brauchen wir allerdings Baurecht. Wir haben nicht auf allen Teilen der Oststrecke Baurecht. Da, wo wir dieses Recht haben, können wir schon in diesem Jahr beginnen. An den anderen Teilen müssen wir erst Baurecht schaffen. Wir können trotz Geldes ohne Baurecht nicht bauen. Das wäre ein Schwarzbau. Kein Parlament würde wollen, dass der Bundesminister mit schwarz gebauten Strecken in Zusammenhang gebracht wird.",TOP II.18 Verkehr und digitale Infrastruktur,13985,speech,18
506,691446,,506,44,Vizepräsident Peter Hintze,Peter Hintze,peter-hintze,,,"Apropos „wollen“: Herr Bundesminister, es gibt den Wunsch nach einer Zwischenfrage des Kollegen Kindler. Wollen Sie sie zulassen?",TOP II.18 Verkehr und digitale Infrastruktur,13985,chair,18
507,691447,https://www.abgeordnetenwatch.de/profile/alexander-dobrindt-0,507,44,"Alexander Dobrindt, Bundesminister für Verkehr und digitale Infrastruktur",Alexander Dobrindt,alexander-dobrindt,1847.0,,"Herr Kindler hat mich vorhin in seiner Rede viel öfter erwähnt, als ich das normalerweise von meinen eigenen Kollegen gewohnt bin.",TOP II.18 Verkehr und digitale Infrastruktur,13985,speech,18
508,691448,,508,44,,,,,,Heiterkeit bei Abgeordneten der CDU/CSU und der SPD,TOP II.18 Verkehr und digitale Infrastruktur,13985,poi,18
509,691449,https://www.abgeordnetenwatch.de/profile/alexander-dobrindt-0,509,44,"Alexander Dobrindt, Bundesminister für Verkehr und digitale Infrastruktur",Alexander Dobrindt,alexander-dobrindt,1847.0,,Deswegen darf er jetzt noch einmal sprechen.,TOP II.18 Verkehr und digitale Infrastruktur,13985,speech,18
510,691450,https://www.abgeordnetenwatch.de/profile/sven-christian-kindler/archive/215049,510,44,Sven-Christian Kindler (BÜNDNIS 90/DIE GRÜNEN),Sven-Christian Kindler,sven-christian-kindler,1328.0,gruene,"Vielen Dank, Herr Minister Dobrindt. - Es stimmt: Alle Fraktionen im Haushaltsausschuss haben dieses Projekt gemeinsam vorangetrieben. Auch in der Ver-gangenheit haben wir unter Ihrem Vorgänger, Herrn Ramsauer, dafür gesorgt, dass dieses Projekt auf den Weg gebracht wird. Das ist uns wichtig, und das haben wir gemeinsam gemacht.

Es ist auch richtig, dass nachher die Kritik des Rechnungshofes - meiner Ansicht nach zu Recht - entkräftet wurde. Auch das war wichtig. Wir haben allerdings in der entscheidenden Sitzung erst zwei Stunden vor der Befassung erfahren, dass der Rechnungshof hieran Kritik geübt und die Wirtschaftlichkeit dieses Projekts - es stehen 485 Millionen Euro im Raum - angezweifelt hat. Ein Vertreter des Bundesfinanzministeriums selber hat ausgeführt, dass man an diesem Tag die Gelder nicht hätte freigeben dürfen. Wir standen aber unter Zeitdruck.

Wir als Haushälter wurden darüber nicht informiert. Wir haben mehrere Gespräche mit Ihnen und Ihrem Staatssekretär Ferlemann geführt. Sie haben davon nach Ihrer eigenen Aussage nichts gewusst, Ihr Staatssekretär wusste seit einem Monat von dieser Kritik. Diesen Vorwurf habe ich erhoben, und darauf zielte meine Kritik: Wir wurden hier nicht informiert, und ich fühle mich hinters Licht geführt.

Der Kritikpunkt im Haushaltsausschuss, nicht nur meiner Fraktion und der Linksfraktion, sondern auch von anderen Kollegen, war, dass Ihr Staatssekretär Ferlemann in der Sitzung Anfang April nicht gesagt hat, dass er schon seit einem Monat von der Kritik des Rechnungshofes wusste, sondern das verschwiegen hat. Erst in der nächsten Sitzung kam heraus, dass ihm dies schon seit einem Monat bekannt war.

Deswegen haben wir die Tonaufnahmen der Sitzung nicht gelöscht, sondern archiviert, um so diese Vorfälle und den Verdacht, dass Staatssekretär Ferlemann hier die Unwahrheit gesagt hat - dieser Verdacht steht im Raum und besteht für mich auch weiterhin -, aufzuklären. Ihr Staatssekretär muss zustimmen, wenn wir diesen Vorfall lückenlos aufklären wollen. Ich finde, dieser Vorfall muss auch im Sinne des Haushaltsausschusses lückenlos aufgeklärt werden.

Ich frage Sie, ob Sie es richtig finden, dass Ihr Staatssekretär sich dieser Aufklärung verweigert, was Ihre persönliche Meinung dazu ist und ob Sie nicht mit Ihrem Staatssekretär reden können, um das zu ändern.",TOP II.18 Verkehr und digitale Infrastruktur,13985,speech,18
511,691451,https://www.abgeordnetenwatch.de/profile/alexander-dobrindt-0,511,44,"Alexander Dobrindt, Bundesminister für Verkehr und digitale Infrastruktur",Alexander Dobrindt,alexander-dobrindt,1847.0,,"Herr Kindler, als Erstes halte ich fest, dass Sie mir recht geben. Die Kritik des Rechnungshofes, die Sie vorhin noch einmal deutlich beschrieben haben, konnte ausgeräumt werden. Wir lagen richtig damit, die Mehrkosten für die fünfte Schleusenkammer in Brunsbüttel zu übernehmen. Die Wirtschaftlichkeit ist gegeben. Es wird ein gutes Projekt auf den Weg gebracht. Dieses Missverständnis können wir hier ausräumen.

Das Zweite haben wir bereits im Haushaltsausschuss ausgiebig besprochen. Wir waren mit der Kritik des Rechnungshofes noch nicht im kontradiktorischen Verfahren, was der übliche Weg der Zuleitung zum Minister ist. Deswegen hat mein Haus vollkommen korrekt gehandelt. Mein Staatssekretär hat mich vollkommen korrekt informiert, und deswegen sind die Vorwürfe, die Sie gegen ihn erheben, aus meiner Sicht vollkommen unerheblich und im Haushaltsausschuss ausgeräumt worden.",TOP II.18 Verkehr und digitale Infrastruktur,13985,speech,18
512,691452,,512,44,,,,,,Beifall bei der CDU/CSU,TOP II.18 Verkehr und digitale Infrastruktur,13985,poi,18
513,691453,https://www.abgeordnetenwatch.de/profile/sven-christian-kindler/archive/215049,513,44,Sven-Christian Kindler [BÜNDNIS 90/DIE GRÜNEN],Sven-Christian Kindler,sven-christian-kindler,1328.0,gruene,Das stimmt doch nicht!,TOP II.18 Verkehr und digitale Infrastruktur,13985,poi,18
514,691454,https://www.abgeordnetenwatch.de/profile/alexander-dobrindt-0,514,44,"Alexander Dobrindt, Bundesminister für Verkehr und digitale Infrastruktur",Alexander Dobrindt,alexander-dobrindt,1847.0,,- Sie dürfen sich setzen. Ich bin fertig mit meiner Antwort.,TOP II.18 Verkehr und digitale Infrastruktur,13985,speech,18
515,691455,,515,44,,,,,,Beifall bei Abgeordneten der CDU/CSU,TOP II.18 Verkehr und digitale Infrastruktur,13985,poi,18
516,691456,https://www.abgeordnetenwatch.de/profile/alexander-dobrindt-0,516,44,"Alexander Dobrindt, Bundesminister für Verkehr und digitale Infrastruktur",Alexander Dobrindt,alexander-dobrindt,1847.0,,"Fünfter Punkt unseres Investitionshochlaufs: Sub-stanz-erhalt geht vor Neu- und Ausbau. Das ist nicht nur ein Spruch, sondern es findet sich in dem ganzen Haushalt wieder. Deswegen ist eines der elementarsten Teile unserer Infrastruktur jetzt zu einem eigenen Programm zusammengeschnürt worden. Das Sonderprogramm Brückenmodernisierung, wie wir es genannt haben, nimmt die sensibelsten Bereiche der Infrastruktur, nämlich die Brücken, in den Fokus. Wir haben dieses Programm mit über 1 Milliarde Euro bis 2017 ausgestattet. Davon kommen in der Tat 400 Millionen Euro aus dem 5-Milliarden-Euro-Programm und 600 Millionen Euro aus bestehenden Mitteln. Damit können wir über 1 Milliarde Euro direkt in diesen sensiblen Bereich der Infrastruktur investieren.

Wenn man offen und transparent an das Thema herangeht, wie es mit diesem Programm der Fall ist, dann sollten wir uns klar vor Augen führen - ich glaube, das ist jedem bekannt -, dass wir jahrelang auch unseren Brücken sehr viel zugemutet haben. Denn wir haben deutlich mehr Lasten auf die Brücken verlagert, als die ursprünglichen Berechnungen für gewisse Zeiträume vorausgesagt haben. Deswegen sind die Sanierungen in diesem Bereich dringend notwendig.

Ich habe eines der Beispiele, das uns alle immer wieder beschäftigt, sehr genau vor Augen, nämlich die Rheinbrücke bei Leverkusen auf der A 1, die gerade wieder für Lastwagen über 3,5 Tonnen gesperrt werden musste, weil erneut Sanierungsbedarf festgestellt wurde. Das hat nichts mit Schlamperei oder sonst etwas zu tun. Es ist einfach eine Zeit gekommen, in der die Brücken an die Grenzen ihrer Leistungsfähigkeit geraten. Wir - das kann ich an dieser Stelle sagen - werden gerade in dem zentralen Bereich A 1, Rheinbrücke Leverkusen alle Möglichkeiten ausnutzen, um schnell, umgehend und sicher einen Ersatzbau zu realisieren. Da hat diese Region die ganze Solidarität dieses Hauses. Wir werden möglichst schnell eine neue Brücke auf den Weg bringen, meine Damen und Herren.",TOP II.18 Verkehr und digitale Infrastruktur,13985,speech,18
517,691457,,517,44,,,,,,Beifall bei der CDU/CSU und der SPD,TOP II.18 Verkehr und digitale Infrastruktur,13985,poi,18
518,691458,,518,44,Vizepräsident Peter Hintze,Peter Hintze,peter-hintze,,,Bitte denken Sie ein bisschen an Ihre Redezeit.,TOP II.18 Verkehr und digitale Infrastruktur,13985,chair,18
519,691459,https://www.abgeordnetenwatch.de/profile/alexander-dobrindt-0,519,44,"Alexander Dobrindt, Bundesminister für Verkehr und digitale Infrastruktur",Alexander Dobrindt,alexander-dobrindt,1847.0,,"Danke. - Wir haben im Hinblick auf die digitale In-frastruktur ein Programm aufgelegt, dessen Umsetzung in der Tat gewisse Zeit in Anspruch nimmt, weil es mit zwei wesentlichen Elementen arbeitet. Das eine ist die digitale Netzallianz, die dafür sorgt, dass die investi-tionswilligen Unternehmen zusammenkommen und die Rahmenbedingungen geschaffen werden, damit mehr Investitionen in die digitale Infrastruktur erfolgen.

Wir haben des Weiteren zugesagt, dass die Einnahmen aus der Digitalen Dividende, die im nächsten Jahr durch die Versteigerung der 700-Megahertz-Frequenzen realisiert werden können, direkt für den Ausbau und die Förderung der Breitbandtechnologie gerade auf dem Land eingesetzt werden. Das ist ein festes Programm, das auch umgesetzt wird.

Die Digitalität und die Mobilität sind zwei Elemente einer zukunftsfähigen Gesellschaft, die zusammengehören. Die Mobilität der Zukunft schreibt das nächste Kapitel der sozialen Marktwirtschaft. Deswegen werden wir den Zusammenhang zwischen Mobilität, Modernität und Digitalität in unserem Haus weiterhin abbilden, gerade auch in unseren Haushalten.

Danke schön.",TOP II.18 Verkehr und digitale Infrastruktur,13985,speech,18
520,691460,,520,44,,,,,,Beifall bei der CDU/CSU und der SPD,TOP II.18 Verkehr und digitale Infrastruktur,13985,poi,18
521,691461,,521,44,Vizepräsident Peter Hintze,Peter Hintze,peter-hintze,,,"Als nächstem Redner erteile ich das Wort dem Abgeordneten Herbert Behrens, Fraktion Die Linke.",TOP II.18 Verkehr und digitale Infrastruktur,13985,chair,18
522,691462,,522,44,,,,,,Beifall bei der LINKEN,TOP II.18 Verkehr und digitale Infrastruktur,13985,poi,18
523,691463,https://www.abgeordnetenwatch.de/profile/herbert-behrens/archive/215393,523,44,Herbert Behrens (DIE LINKE),Herbert Behrens,herbert-behrens,1344.0,linke,"Herr Präsident! Liebe Kolleginnen und Kollegen! Herr Minister Dobrindt, Sie haben einen neuen Begriff hinzugefügt. Früher waren es nur Mobilität und Modernität, die Sie vertreten wollten. Nun kommt die Digitalität hinzu. Dann sollte man zumindest erwarten, dass diese Grundpfeiler, die das neue Ministerium prägen sollen, ihren Niederschlag auch im Haushalt finden, der uns hier vorliegt. Das tun sie aber nicht.",TOP II.18 Verkehr und digitale Infrastruktur,13985,speech,18
524,691464,,524,44,,,,,,Beifall bei der LINKEN sowie bei Abgeordneten des BÜNDNISSES 90/DIE GRÜNEN,TOP II.18 Verkehr und digitale Infrastruktur,13985,poi,18
525,691465,https://www.abgeordnetenwatch.de/profile/herbert-behrens/archive/215393,525,44,Herbert Behrens (DIE LINKE),Herbert Behrens,herbert-behrens,1344.0,linke,"Außer einem neuen Schild an der Tür des Ministeriums und Stühlerücken auf den unteren Etagen des Ministeriums ist seit der Bundestagswahl 2013 eher wenig passiert. Zukunftstaugliche verkehrspolitische Ansätze? Fehlanzeige! Viele Straßen, Schienen, Brücken und auch manche Wasserwege sind in einem erbärmlichen Zustand. Das vorhandene Verkehrsnetz muss dringend saniert werden. Das sagen alle Verkehrsexperten, unabhängig davon, ob sie der Koalition zugeneigt sind oder der Opposition.

Sie aber, Herr Minister, setzen auf ein Weiter-so, und die wegweisenden Empfehlungen werden nicht genutzt. Statt den Sanierungsstau abzuarbeiten, sind Sie gerade dabei, die öffentliche Straßeninfrastruktur zu privatisieren. Der Ausbau der A 7 nördlich von Hamburg soll an Hochtief gehen. In Niedersachsen verlangen Sie, Herr Minister, dass die A 7 zwischen Salzgitter und Göttingen von privaten Investoren ausgebaut wird. Die Landesregierung protestiert. Es geht auch um Arbeitsplätze von vielen Straßenwärtern und Angestellten. Nach der Zuschlagerteilung droht den Autobahnmeistereien die Auflösung. Die Immobilien werden wahrscheinlich den künftigen Investoren angeboten. Der privatisierte Bau bedeute, sagt die niedersächsische Landesregierung, Mehrkosten in Höhe von 25 Millionen Euro. Ich zitiere: „Minister Ramsauers Entscheidung, das Bauprojekt A 7 mit privaten Geldern auszuführen, grenzt für mich an Untreue.“ Das sagte die Kollegin Lühmann vor ein paar Monaten. Ich stimme diesem voll zu.

Dann gab es einen weiteren Versuch des SPD-Fraktionsvorsitzenden Oppermann und des Ministers Gabriel. Sie wollten „mit guten Argumenten Verkehrsminister Dobrindt davon überzeugen, dass es am Ende wirtschaftlicher ist, den Betrieb der Autobahn in Händen der staatlichen Bediensteten zu belassen“, heißt es in einem Zeitungsbericht. Keine vier Wochen später ordnet Ihr Ministerium an, privat zu vergeben. Auch die vermeintlich guten Argumente des Koalitionspartners haben offensichtlich nichts genutzt. Diese Koalition der Privatisierer muss jetzt gestoppt werden.",TOP II.18 Verkehr und digitale Infrastruktur,13985,speech,18
526,691466,,526,44,,,,,,Beifall bei der LINKEN,TOP II.18 Verkehr und digitale Infrastruktur,13985,poi,18
527,691467,https://www.abgeordnetenwatch.de/profile/herbert-behrens/archive/215393,527,44,Herbert Behrens (DIE LINKE),Herbert Behrens,herbert-behrens,1344.0,linke,"Seit 2007 führt das Ministerium bereits sechs Projekte im Wege von ÖPP durch. Sieben weitere sind in Vorbereitung. Auch hier ist kein Paradigmenwechsel zu erkennen. Es geht um Investitionen im Umfang von 11,2 Milliarden Euro. Nun hat der Bundesrechnungshof fünf von sechs Autobahnprojekten geprüft; wir haben bereits von der Ausschussvorsitzenden im Rechnungsprüfungsausschuss, der Kollegin Hagedorn, davon gehört. Das Ergebnis ist vernichtend. Das Verkehrsministerium hat Kostenvorteile von bis zu 40 Prozent berechnet oder - besser - schöngerechnet. Die Gesamtbeurteilung ist eine deutliche Klatsche für die Privatisierer und eine Unterstützung für die Steuerzahler.

Meine Fraktion legt Ihnen einen Antrag vor, der die richtigen Konsequenzen aus dem Bericht des Bundesrechnungshofs zieht. Wir fordern, in Kapitel 1209 die Mittel für sechs ÖPP-Projekte zu sperren. Für sieben ÖPP-Projekte, darunter auch die A 7 in Niedersachsen, wollen wir Mittel im Volumen von 4 Milliarden Euro streichen. Frau Lühmann, Sie haben völlig recht: Die Entscheidung, das Bauprojekt A 7 von privaten Geldgebern finanzieren zu lassen, grenzt an Untreue. Es gibt hier im Plenum eine Mehrheit, die dem Privatisierungswahn der Vergangenheit und den Privatisierungsfantasien der Zukunft ein Ende bereiten kann. Es kommt nur darauf an, dass auch alle zu ihren Überzeugungen stehen.",TOP II.18 Verkehr und digitale Infrastruktur,13985,speech,18
528,691468,,528,44,,,,,,Beifall bei der LINKEN,TOP II.18 Verkehr und digitale Infrastruktur,13985,poi,18
529,691469,https://www.abgeordnetenwatch.de/profile/herbert-behrens/archive/215393,529,44,Herbert Behrens (DIE LINKE),Herbert Behrens,herbert-behrens,1344.0,linke,"Liebe Kolleginnen und Kollegen, eine mögliche Mehrheit gäbe es auch, um ein anderes fragwürdiges Projekt des Verkehrsministers zu verhindern. Vor der Sommerpause, also bis nächste Woche Freitag, soll der Plan für eine Pkw-Maut das Licht der Welt erblicken. Sie soll inländische Fahrzeughalter nichts kosten und trotzdem viel bringen. Sie soll nur Ausländer treffen, aber trotzdem europarechtsfreundlich sein. Nicht nur die Linke befürchtet, dass die Ausländermaut der Einstieg in die Pkw-Maut für alle sein wird. Das ist verkehrspolitisch und ökologisch unsinnig und muss verhindert werden.",TOP II.18 Verkehr und digitale Infrastruktur,13985,speech,18
530,691470,,530,44,,,,,,Beifall bei der LINKEN sowie bei Abgeordneten des BÜNDNISSES 90/DIE GRÜNEN,TOP II.18 Verkehr und digitale Infrastruktur,13985,poi,18
