,id,profile_url,sequence,sitzung,speaker,speaker_cleaned,speaker_fp,speaker_key,speaker_party,text,top,top_id,type,wahlperiode
785,691725,https://www.abgeordnetenwatch.de/profile/dr-gesine-lotzsch-0,785,44,Dr. Gesine Lötzsch (DIE LINKE),Dr. Gesine Lötzsch,gesine-lotzsch,1588.0,linke,"Herr Schäuble, Sie scheinen immer noch der Meinung zu sein, dass der Versuch, die Kriterien dieses Paktes einzuhalten, dazu beigetragen habe, dass es den Krisenländern heute wirtschaftlich besser gehe. Ich finde, das ist schon eine erstaunliche Ansicht und es hat mit der Realität wenig zu tun. Ich würde gerne wissen, wie griechische oder spanische Jugendliche auf eine solche Äußerung reagieren. Am 11. Juli 2014 sollte ein EU-Gipfel zur Bekämpfung der Jugendarbeitslosigkeit stattfinden. Dieser Gipfel wurde abgesagt. Warum? Weil Sie Ihr Versprechen eben nicht halten können. Sie hatten jedem Jugendlichen unter 25 Jahren garantiert, innerhalb von vier Monaten einen Arbeits- oder Ausbildungsplatz zu bekommen. Diese Garantie können Sie natürlich nicht umsetzen, wenn alle Staaten um die Wette sparen und nicht in neue Arbeitsplätze investieren. Das ist nicht gut für die Jugend in Europa, und das ist nicht gut für unsere gemeinsame Zukunft.",TOP VII Haushaltsgesetz 2014,13987,speech,18
786,691726,,786,44,,,,,,Beifall bei der LINKEN,TOP VII Haushaltsgesetz 2014,13987,poi,18
787,691727,https://www.abgeordnetenwatch.de/profile/dr-gesine-lotzsch-0,787,44,Dr. Gesine Lötzsch (DIE LINKE),Dr. Gesine Lötzsch,gesine-lotzsch,1588.0,linke,"Was die Bundesregierung Haushaltskonsolidierung nennt, ist nicht allein Ergebnis eigener Anstrengungen. Ein Teil der Haushaltssanierung ist Ihnen wie eine reife Frucht in den Schoß gefallen. Da mussten Sie gar nichts machen. Allein die Senkung der Zinsen durch die Europäische Zentralbank wird die Bundesschuld deutlich mindern. Das ist natürlich einerseits eine schöne Sache für den Finanzminister;",TOP VII Haushaltsgesetz 2014,13987,speech,18
788,691728,https://www.abgeordnetenwatch.de/profile/volker-kauder/archive/214888,788,44,Volker Kauder [CDU/CSU],Volker Kauder,volker-kauder,1775.0,cducsu,Genau!,TOP VII Haushaltsgesetz 2014,13987,poi,18
789,691729,https://www.abgeordnetenwatch.de/profile/dr-gesine-lotzsch-0,789,44,Dr. Gesine Lötzsch (DIE LINKE),Dr. Gesine Lötzsch,gesine-lotzsch,1588.0,linke,"aber andererseits, Kollege Kauder, ist es für die Bürgerinnen und Bürger im Hinblick auf ihre Alterssicherung eine Hiobsbotschaft. Haben Sie die Menschen nicht immer aufgefordert, sich nicht allein auf die staatliche Rente zu verlassen,",TOP VII Haushaltsgesetz 2014,13987,speech,18
790,691730,https://www.abgeordnetenwatch.de/profile/volker-kauder/archive/214888,790,44,Volker Kauder [CDU/CSU],Volker Kauder,volker-kauder,1775.0,cducsu,Genau!,TOP VII Haushaltsgesetz 2014,13987,poi,18
791,691731,https://www.abgeordnetenwatch.de/profile/dr-gesine-lotzsch-0,791,44,Dr. Gesine Lötzsch (DIE LINKE),Dr. Gesine Lötzsch,gesine-lotzsch,1588.0,linke,sondern zusätzlich privat vorzusorgen? Jetzt werden diese Menschen doppelt bestraft:,TOP VII Haushaltsgesetz 2014,13987,speech,18
792,691732,https://www.abgeordnetenwatch.de/profile/volker-kauder/archive/214888,792,44,Volker Kauder [CDU/CSU],Volker Kauder,volker-kauder,1775.0,cducsu,Quatsch!,TOP VII Haushaltsgesetz 2014,13987,poi,18
793,691733,https://www.abgeordnetenwatch.de/profile/dr-gesine-lotzsch-0,793,44,Dr. Gesine Lötzsch (DIE LINKE),Dr. Gesine Lötzsch,gesine-lotzsch,1588.0,linke,"Das Rentenniveau sinkt und die Zinsen auch, und damit ist bei vielen Altersarmut vorprogrammiert.",TOP VII Haushaltsgesetz 2014,13987,speech,18
794,691734,,794,44,Matthias W. Birkwald [DIE LINKE],Matthias W. Birkwald,matthias-birkwald,,linke,"So ist das, Herr Kauder!",TOP VII Haushaltsgesetz 2014,13987,poi,18
795,691735,https://www.abgeordnetenwatch.de/profile/volker-kauder/archive/214888,795,44,Volker Kauder [CDU/CSU],Volker Kauder,volker-kauder,1775.0,cducsu,Quatsch!,TOP VII Haushaltsgesetz 2014,13987,poi,18
796,691736,https://www.abgeordnetenwatch.de/profile/dr-gesine-lotzsch-0,796,44,Dr. Gesine Lötzsch (DIE LINKE),Dr. Gesine Lötzsch,gesine-lotzsch,1588.0,linke,"Daran wird auch Ihr Rentenpaket nichts ändern.

Herr Kauder, ehe Sie hier ein weiteres Mal „Quatsch“ rufen, möchte ich Sie daran erinnern, dass Ihre eigene Ministerin, Kollegin Ursula von der Leyen, schon vor Jahren auf die drohende Altersarmut hingewiesen hat. Wenn Sie meine Rede nicht überzeugt, dann sollten Sie sich wenigstens an dem orientieren, was Ihre eigenen Leute sagen.",TOP VII Haushaltsgesetz 2014,13987,speech,18
797,691737,,797,44,,,,,,Beifall bei der LINKEN sowie des Abg. Sven-Christian Kindler [BÜNDNIS 90/DIE GRÜNEN],TOP VII Haushaltsgesetz 2014,13987,poi,18
798,691738,https://www.abgeordnetenwatch.de/profile/dr-gesine-lotzsch-0,798,44,Dr. Gesine Lötzsch (DIE LINKE),Dr. Gesine Lötzsch,gesine-lotzsch,1588.0,linke,"Zu Beginn der Haushaltsberatungen wurde in der Koalition laut darüber nachgedacht, den Abbau der kalten Progression anzupacken. Die kalte Progression ist nichts anderes - das muss man einmal deutlich sagen - als eine Steuererhöhung für die Mittelschicht. Der Finanzminister kann sich also weiter mit den Lohnerhöhungen, die die Beschäftigten hart erkämpft haben, die Kassen füllen. Wir als Linke wollen die kalte Progression endlich abschaffen, dafür aber den Spitzensteuersatz anheben. Das würde mehr Gerechtigkeit in unser Steuersystem bringen, meine lieben Kolleginnen und Kollegen.",TOP VII Haushaltsgesetz 2014,13987,speech,18
799,691739,,799,44,,,,,,Beifall bei der LINKEN,TOP VII Haushaltsgesetz 2014,13987,poi,18
800,691740,https://www.abgeordnetenwatch.de/profile/norbert-barthle/archive/214859,800,44,Norbert Barthle [CDU/CSU],Norbert Barthle,norbert-barthle,1877.0,cducsu,"Wenn Sie den Spitzensteuersatz anheben, dann steigt auch die Progression, Kollegin! Dann wird der Tarif steiler!",TOP VII Haushaltsgesetz 2014,13987,poi,18
801,691741,https://www.abgeordnetenwatch.de/profile/dr-gesine-lotzsch-0,801,44,Dr. Gesine Lötzsch (DIE LINKE),Dr. Gesine Lötzsch,gesine-lotzsch,1588.0,linke,"- Den Tarif müssen wir in Ordnung bringen; das wissen wir alle doch.

Wie das Design - die schwarze Null - das Bewusstsein trübt, können wir auch an weiteren Haushaltstricks der Koalition beobachten. Im Vorfeld der Bereinigungssitzung wurde - wahrscheinlich aus dem Finanzministerium - gezielt lanciert, dass im Haushalt 2014 fast 4 Milliarden Euro fehlen. Das wurde auch von vielen Medien dankbar aufgenommen. Aber das war natürlich ein quasi inszeniertes Haushaltsloch.",TOP VII Haushaltsgesetz 2014,13987,speech,18
802,691742,https://www.abgeordnetenwatch.de/profile/volker-kauder/archive/214888,802,44,Volker Kauder [CDU/CSU],Volker Kauder,volker-kauder,1775.0,cducsu,Was?,TOP VII Haushaltsgesetz 2014,13987,poi,18
803,691743,https://www.abgeordnetenwatch.de/profile/dr-gesine-lotzsch-0,803,44,Dr. Gesine Lötzsch (DIE LINKE),Dr. Gesine Lötzsch,gesine-lotzsch,1588.0,linke,Teuer wird der Trick bei den Krankenkassen für die Versicherten. Die Krankenkassen bekommen nicht den versprochenen Zuschuss vom Bund.,TOP VII Haushaltsgesetz 2014,13987,speech,18
804,691744,https://www.abgeordnetenwatch.de/profile/volker-kauder/archive/214888,804,44,Volker Kauder [CDU/CSU],Volker Kauder,volker-kauder,1775.0,cducsu,"Norbert, das stimmt doch gar nicht, was sie sagt!",TOP VII Haushaltsgesetz 2014,13987,poi,18
805,691745,https://www.abgeordnetenwatch.de/profile/dr-gesine-lotzsch-0,805,44,Dr. Gesine Lötzsch (DIE LINKE),Dr. Gesine Lötzsch,gesine-lotzsch,1588.0,linke,"Die Kassen haben jetzt schon gesagt: Es wird Zusatzbeiträge hageln. - Mit Entlastung der Versicherten hat das also gar nichts zu tun, wie der Kollege Minister Gröhe meinte uns hier weismachen zu können. Das war eine falsche Aussage. Viele haben schon die Ankündigungen ihrer Kasse gehört. Das ist sozial ungerecht, meine Damen und Herren.",TOP VII Haushaltsgesetz 2014,13987,speech,18
806,691746,,806,44,,,,,,Beifall bei der LINKEN,TOP VII Haushaltsgesetz 2014,13987,poi,18
807,691747,https://www.abgeordnetenwatch.de/profile/norbert-barthle/archive/214859,807,44,Norbert Barthle [CDU/CSU],Norbert Barthle,norbert-barthle,1877.0,cducsu,Aber hat mit der Grundlage nichts zu tun!,TOP VII Haushaltsgesetz 2014,13987,poi,18
808,691748,https://www.abgeordnetenwatch.de/profile/dr-gesine-lotzsch-0,808,44,Dr. Gesine Lötzsch (DIE LINKE),Dr. Gesine Lötzsch,gesine-lotzsch,1588.0,linke,Wir als Linke brauchen keine Haushaltstricks für eine schwarze Null und mehr soziale Gerechtigkeit. Unsere Anträge fordern höhere Steuern für Vermögende und Besserverdienende sowie Ausgabenkürzungen für Rüstungsprojekte und Auslandseinsätze der Bundeswehr. Mit den Mehreinnahmen wollen wir Armut bekämpfen und Investitionen in die Zukunft möglich machen. Leider haben Sie unsere schlüssigen Vorschläge bisher abgelehnt.,TOP VII Haushaltsgesetz 2014,13987,speech,18
809,691749,https://www.abgeordnetenwatch.de/profile/volker-kauder/archive/214888,809,44,Volker Kauder [CDU/CSU],Volker Kauder,volker-kauder,1775.0,cducsu,Dabei bleibt es auch!,TOP VII Haushaltsgesetz 2014,13987,poi,18
810,691750,https://www.abgeordnetenwatch.de/profile/dr-gesine-lotzsch-0,810,44,Dr. Gesine Lötzsch (DIE LINKE),Dr. Gesine Lötzsch,gesine-lotzsch,1588.0,linke,"Aber ich bin sehr optimistisch, Kollege Kauder, dass Sie genauso wie beim Mindestlohn unseren Vorschlägen nicht nur folgen werden, sondern auch folgen müssen. Bloß: Warten Sie diesmal nicht so lange damit, meine Damen und Herren!",TOP VII Haushaltsgesetz 2014,13987,speech,18
811,691751,,811,44,Beifall bei der LINKEN Matthias W. Birkwald [DIE LINKE],Beifall bei der LINKEN Matthias W. Birkwald,beifall-bei-der-linken-matthias-birkwald,,linke,Gute Idee!,TOP VII Haushaltsgesetz 2014,13987,poi,18
812,691752,https://www.abgeordnetenwatch.de/profile/volker-kauder/archive/214888,812,44,Volker Kauder [CDU/CSU],Volker Kauder,volker-kauder,1775.0,cducsu,Eigentlich war das ein schönes Schlusswort!,TOP VII Haushaltsgesetz 2014,13987,poi,18
813,691753,https://www.abgeordnetenwatch.de/profile/dr-gesine-lotzsch-0,813,44,Dr. Gesine Lötzsch (DIE LINKE),Dr. Gesine Lötzsch,gesine-lotzsch,1588.0,linke,"- Das war noch nicht der Schlusssatz.

Meine Damen und Herren, im Laufe der Haushaltsdebatte wurde schon vielen gedankt - und das zu Recht -, natürlich in erster Linie den Kolleginnen und Kollegen im Haushaltsausschuss und in den anderen Ausschüssen, die sich an der Arbeit beteiligt haben, fleißig, engagiert, wenn natürlich auch mit unterschiedlichen Auffassungen, den Mitarbeiterinnen und Mitarbeitern in den Fraktionen und in den Ministerien, dem Bundesrechnungshof, auch den Ministern selbst, Minister Schäuble. Nicht unerwähnt sollen aber auch die Menschen bleiben, die uns mit Essen versorgt und den Ausschusssaal aufgeräumt haben.",TOP VII Haushaltsgesetz 2014,13987,speech,18
814,691754,,814,44,,,,,,Beifall im ganzen Hause,TOP VII Haushaltsgesetz 2014,13987,poi,18
815,691755,https://www.abgeordnetenwatch.de/profile/dr-gesine-lotzsch-0,815,44,Dr. Gesine Lötzsch (DIE LINKE),Dr. Gesine Lötzsch,gesine-lotzsch,1588.0,linke,"- Richtig!

Ganz besonders möchte ich mich als Vorsitzende des Haushaltsausschusses bei den Mitarbeiterinnen und Mitarbeitern des Haushaltsausschusssekretariats - es sind nur die Herren gekommen; die Damen gucken aber vielleicht am Fernseher zu - für ihre unermüdliche Arbeit bedanken. Wir haben 22 Einzelpläne, ein Haushaltsgesetz, ein Haushaltsbegleitgesetz, über 670 Änderungsanträge - das waren ungefähr 80 000 Kopien - in sieben Ausschusssitzungen, einschließlich Anhörung, mit insgesamt fast 39 Stunden Tagungszeit beraten. Darin sind die zahlreichen Berichterstattergespräche noch nicht enthalten. Alle diese Sitzungen mussten natürlich vorbereitet werden. Das war ein wirklicher Kraftakt. Dafür herzlichen Dank an alle, die beteiligt waren, und aus meiner Sicht vor allen Dingen noch einmal an die Mitarbeiterinnen und Mitarbeiter des Sekretariats!

Vielen Dank.",TOP VII Haushaltsgesetz 2014,13987,speech,18
816,691756,,816,44,,,,,,"Beifall bei der LINKEN, der SPD und dem BÜNDNIS 90/DIE GRÜNEN sowie bei Abgeordneten der CDU/CSU",TOP VII Haushaltsgesetz 2014,13987,poi,18
817,691757,https://www.abgeordnetenwatch.de/profile/johannes-singhammer,817,44,Vizepräsident Johannes Singhammer,Johannes Singhammer,johannes-singhammer,1582.0,,"Nächste Rednerin ist die Kollegin Antje Tillmann, CDU/CSU, der ich hiermit das Wort erteile.",TOP VII Haushaltsgesetz 2014,13987,chair,18
818,691758,,818,44,,,,,,Beifall bei der CDU/CSU,TOP VII Haushaltsgesetz 2014,13987,poi,18
819,691759,https://www.abgeordnetenwatch.de/profile/antje-tillmann-0,819,44,Antje Tillmann (CDU/CSU),Antje Tillmann,antje-tillmann,1639.0,cducsu,"Herr Präsident! Liebe Kolleginnen und Kollegen! Sehr geehrte Damen und Herren! Der Bund hält die ab 2016 geltenden Regelungen der Schuldenbremse seit 2012 ein. Bundesfinanzminister Schäuble hat das Ziel ausgegeben, innerhalb der nächsten zehn Jahre die Staatsverschuldung unter die Maastricht-Grenze von 60 Prozent des BIP zurückzuführen.

Heute verabschieden wir einen Haushalt mit einer strukturellen Null für das Jahr 2014. Für 2015 planen wir keine neuen Schulden mehr. - Mit diesen oder ähnlichen Sätzen haben viele Reden in dieser Woche begonnen. Viele Kolleginnen und Kollegen haben das in den Vordergrund gestellt, und das ist auch richtig so, weil das ein sehr wichtiger Teil dieser Haushaltsdebatte ist.

Liebe Frau Kollegin Lötzsch, Sie sprachen über Sozialpolitik. Künftigen Generationen gegenüber ist es -sozial, ihnen nicht mehr Schulden zu hinterlassen als unbedingt nötig. Sozialleistungen der kommenden Generationen können nur sichergestellt werden, wenn wir uns disziplinieren. Deshalb, Herr Kollege Schäuble, lieber Norbert Barthle, lieber Johannes Kahrs: Ihr seid noch besser, als es die Verfassung verlangt. Herzlichen Glückwunsch dazu! Gute Arbeit! Mit diesem guten Gefühl können wir die Beratungen über den Haushalt 2015 beginnen.",TOP VII Haushaltsgesetz 2014,13987,speech,18
820,691760,,820,44,,,,,,Beifall bei der CDU/CSU sowie bei Abgeordneten der SPD,TOP VII Haushaltsgesetz 2014,13987,poi,18
821,691761,https://www.abgeordnetenwatch.de/profile/antje-tillmann-0,821,44,Antje Tillmann (CDU/CSU),Antje Tillmann,antje-tillmann,1639.0,cducsu,"Diesen strukturell ausgeglichenen Haushalt haben wir erreicht, obwohl wir uns nicht nur auf unsere Bundesaufgaben konzentriert, sondern auch sichergestellt haben, dass die anderen staatlichen Ebenen, die Kommunen und die Länder, ebenfalls ihren Verpflichtungen bezüglich der Schuldenbremse nachkommen können. Ich nenne nur wenige Stichworte. Zur Entlastung der Kommunen: bei der Grundsicherung im Alter eine jährliche Entlastung ab 2015 von mehr als 5 Milliarden Euro, für den Ausbau der Kinderbetreuung bis 2014 über 5,4 Milliarden Euro, zusätzlich 1 Milliarde Euro in dieser Legis-laturperiode. In Bezug auf das Bundesteilhabegesetz wird der Bund Kosten von rund 5 Milliarden Euro stemmen und ab 2015 noch einmal 1 Milliarde Euro zur Verfügung stellen. - Für die Länder sieht die Rechnung ähnlich aus: zusätzliche Mittel von 5 Milliarden Euro für Bildung - ein deutliches Signal gegen Altersarmut ist nämlich, die Bildung zu verbessern -, Komplettübernahme des BAföG ab 2015 mit 1,17 Milliarden Euro und Entflechtungsmittel von jährlich 2,6 Milliarden Euro, die bis 2019 zusätzlich an die Länder fließen.

An alle, die noch größere Anstrengungen vom Bund fordern: Diese Summe von 16 Milliarden Euro hätten wir in die Konsolidierung des Bundeshaushalts stecken können. Wir haben aber, gemeinschaftlich mit den anderen Ebenen, das Gesamtziel im Auge gehabt. Dass wir diese Entlastung erreichen konnten, ist den Konsolidierungsbestrebungen unserer Haushaltspolitiker zuzurechnen. Auch dafür ein herzliches Dankeschön.",TOP VII Haushaltsgesetz 2014,13987,speech,18
822,691762,,822,44,,,,,,Beifall bei der CDU/CSU sowie bei Abgeordneten der SPD,TOP VII Haushaltsgesetz 2014,13987,poi,18
823,691763,https://www.abgeordnetenwatch.de/profile/antje-tillmann-0,823,44,Antje Tillmann (CDU/CSU),Antje Tillmann,antje-tillmann,1639.0,cducsu,"Vor dem Hintergrund dieser Zahlen muss ich deutlich sagen, dass ich die Forderungen einiger Länder der letzten Wochen mutig finde, in der nun anstehenden Bund-Länder-Kommission zum Länderfinanzausgleich immer weitere Lasten für den Bund zu fordern. Die Schulden der Länder sollen idealerweise vom Bund bezahlt werden. Die Defizite der Unikliniken der Länder sollen durch Bundesmittel ausgeglichen werden. Es muss zusätzliche Anstrengungen bei Bildung und Kinderbetreuung geben. - Die Zahl der Länder, die meinen, dass alle ihre Probleme vom Bund gelöst werden können, ist nach wie vor zu groß. Wir werden in der Bund-Länder-Kommission darüber sprechen müssen, wer welche Verantwortung hat, wer für welche Kosten zuständig ist und vor allem, wer welche eigenen Anstrengungen unternimmt, um 2016 bzw. 2020 die Gesamtverschuldung im Land entsprechend der Verfassung zu gestalten.

Frau Kollegin Lötzsch, Sie haben recht, wir werden das Thema „kalte Progression“ in diesem Jahr nicht angehen. Da uns das Ziel eines konsolidierten Haushalts so wichtig ist, müssen wir uns zusätzliche Spielräume erarbeiten. Hier sind wir auf dem Weg; vielleicht werden wir es bald schaffen. Es gibt aber ansonsten viele Themen in der Steuerpolitik, die wir angehen können. Ich kann Sie nur auffordern, mitzumachen. Am ungerechtesten in Ihrem Sinne ist doch, dass einige in Europa gar keine Steuern zahlen.",TOP VII Haushaltsgesetz 2014,13987,speech,18
824,691764,,824,44,,,,,,Beifall bei der CDU/CSU sowie bei Abgeordneten der SPD,TOP VII Haushaltsgesetz 2014,13987,poi,18
825,691765,https://www.abgeordnetenwatch.de/profile/antje-tillmann-0,825,44,Antje Tillmann (CDU/CSU),Antje Tillmann,antje-tillmann,1639.0,cducsu,"Wir werden das mit dem Projekt BEPS unter Führung des deutschen Finanzministers Schäuble angehen. Wir haben in der Vergangenheit immer wieder deutsche Steuerschlupflöcher gestopft. Mit dem Kroatien-Gesetz werden wir jetzt wieder gegen Steuervermeidung vorgehen. Aber das müssen wir europäisch umsetzen; denn Steuerrecht ist nun einmal international. Auf europäischer Ebene sind wir auf einem guten Weg. Wir werden sicherstellen, dass sich digitale Unternehmen durch ihre Standortwahl nicht mehr die niedrigsten Steuern aussuchen können. Wir werden sicherstellen, dass Patent-boxen nicht dazu missbraucht werden, über Briefkastenfirmen Steuergewinne ins Ausland zu verlagern. Wir werden dafür kämpfen, dass bei den Verrechnungspreisen Transparenz hergestellt wird, sodass keiner der deutschen Steuerpflicht entgehen kann. Wir werden auch die Dokumentationspflichten im Auge behalten und sicherstellen, dass kein Euro, der in Deutschland erwirtschaftet wird, unversteuert eingesteckt werden kann.",TOP VII Haushaltsgesetz 2014,13987,speech,18
826,691766,https://www.abgeordnetenwatch.de/profile/richard-pitterle/archive/215659,826,44,Richard Pitterle [DIE LINKE],Richard Pitterle,richard-pitterle,1409.0,linke,Das wollen wir mal sehen!,TOP VII Haushaltsgesetz 2014,13987,poi,18
827,691767,https://www.abgeordnetenwatch.de/profile/antje-tillmann-0,827,44,Antje Tillmann (CDU/CSU),Antje Tillmann,antje-tillmann,1639.0,cducsu,"- Das werden Sie sehen. Wenn Sie bei den BEPS-Anhörungen gewesen wären, hätten Sie das gehört. Wir sind auf einem guten Weg und werden diesen fortsetzen.

Wir werden auch im Auge behalten, dass wir die Unternehmen nicht übermäßig belasten. Denn noch mehr als durch die Steuerlast sind sie durch Aufzeichnungspflichten, durch Bürokratie belastet. Bei all diesen Maßnahmen zur gerechten Besteuerung gilt es sicherzustellen, dass die Unternehmen keinen zusätzlichen bürokratischen Aufwand haben. Wir werden auch sicherstellen, dass Firmengeheimnisse der Transparenz nicht zum -Opfer fallen, dass Unternehmen sich darauf verlassen können, dass ihre Daten wirklich nur zu Steuerzwecken genutzt werden.

Ein weiterer Bereich, dem wir uns widmen können, bevor wir uns dem Thema „kalte Progression“ zuwenden, ist die Vereinfachung des Steuerverfahrens, das bei Bürgerinnen und Bürgern zu erheblicher Verärgerung führt. Heute titeln viele Zeitungen, dass Hunderte von Steuererklärungen von getrennt veranlagten Ehegatten nicht bearbeitet werden können, weil es an den tech-nischen Voraussetzungen fehlt. Genau da können wir -ansetzen. Wir können im Rahmen des Vorhabens KONSENS das Besteuerungsverfahren vereinfachen. Wir können sicherstellen, liebe Damen und Herren auf der Tribüne, dass Sie bei der nächsten Steuererklärung nicht jeden einzelnen Beleg einreichen müssen. Wir arbeiten an einem Verfahren, bei dem Steuererklärungen nur dann noch händisch und einzeln geprüft werden, wenn sich die Erforderlichkeit aus der Risikoprüfung ergibt. Auch hier können wir Bürgerinnen und Bürger entlasten, und das werden wir auf diesem Wege machen, bis im Haushalt Spielraum für weitere Maßnahmen vorhanden ist.",TOP VII Haushaltsgesetz 2014,13987,speech,18
828,691768,,828,44,,,,,,Beifall bei der CDU/CSU sowie bei Abgeordneten der SPD,TOP VII Haushaltsgesetz 2014,13987,poi,18
829,691769,https://www.abgeordnetenwatch.de/profile/antje-tillmann-0,829,44,Antje Tillmann (CDU/CSU),Antje Tillmann,antje-tillmann,1639.0,cducsu,"Die Unternehmen machen eine ganze Reihe zusätzlicher Vorschläge, die wir uns ebenfalls intensiv anschauen werden. Es gibt das Problem, dass für verbindliche Auskünfte Gebühren zu zahlen sind. Wir wissen, dass § 7 g EStG, der ursprünglich einmal als Investi-tionsanreiz für mittelständische Unternehmen geschaffen wurde, nicht im erwünschten Umfang Wirkung entfaltet. Wir wissen, dass Unternehmen die LIFO-Methode, eine Berechnungsmethode, anwenden, die jetzt in einem BFH-Urteil infrage gestellt wird. Wir -wissen, dass wir Investitionsanreize im Bereich Wagniskapital setzen müssen. Wir wollen deshalb den Investi-tionszuschuss künftig steuerfrei stellen und Investitionsanreize für aufstrebende Unternehmen schaffen.

Es gibt also abseits von Flat Tax und Steuersenkungen, die den Haushalt belasten, viele Dinge, die wir in den nächsten Monaten tun können und werden, um Unternehmen und Bürgerinnen und Bürger von lästigen Pflichten, die mit dem Zahlen von Steuern verbunden sind, etwa bei der Abgabe der Steuererklärung, zu entlasten. Da können wir ansetzen; da können Sie dabei sein. Danach schaffen wir es vielleicht noch, gemeinsam die kalte Progression anzugehen. All die Maßnahmen, die vorher ergriffen werden können, haben bisher nicht Ihre Unterstützung gefunden. Ich würde mich freuen, wenn sich das ändern würde.

Danke.",TOP VII Haushaltsgesetz 2014,13987,speech,18
830,691770,,830,44,,,,,,Beifall bei der CDU/CSU und der SPD,TOP VII Haushaltsgesetz 2014,13987,poi,18
831,691771,https://www.abgeordnetenwatch.de/profile/johannes-singhammer,831,44,Vizepräsident Johannes Singhammer,Johannes Singhammer,johannes-singhammer,1582.0,,Der Kollege Sven-Christian Kindler ist der nächste Redner für Bündnis 90/Die Grünen.,TOP VII Haushaltsgesetz 2014,13987,chair,18
832,691772,https://www.abgeordnetenwatch.de/profile/sven-christian-kindler/archive/215049,832,44,Sven-Christian Kindler (BÜNDNIS 90/DIE GRÜNEN),Sven-Christian Kindler,sven-christian-kindler,1328.0,gruene,"Sehr geehrter Herr Präsident! Liebe Kolleginnen und Kollegen! Wenn ich die Haushaltsdebatten der letzten Wochen und Monate, aber auch der letzten Tage Revue passieren lasse, dann erkenne ich, dass sich eine rote Linie durch Ihren Haushalt zieht: die Arbeitsverweigerung der Großen Koalition.",TOP VII Haushaltsgesetz 2014,13987,speech,18
833,691773,,833,44,,,,,,Beifall beim BÜNDNIS 90/DIE GRÜNEN sowie des Abg. Dr. Dietmar Bartsch [DIE LINKE],TOP VII Haushaltsgesetz 2014,13987,poi,18
834,691774,,834,44,,,,,,Lachen bei Abgeordneten der CDU/CSU und der SPD,TOP VII Haushaltsgesetz 2014,13987,poi,18
835,691775,https://www.abgeordnetenwatch.de/profile/johannes-kahrs/archive/216630,835,44,Johannes Kahrs [SPD],Johannes Kahrs,johannes-kahrs,1782.0,spd,Rot ist eine gute Farbe!,TOP VII Haushaltsgesetz 2014,13987,poi,18
836,691776,https://www.abgeordnetenwatch.de/profile/michael-grosse-bromer-2/archive/217189,836,44,Michael Grosse-Brömer [CDU/CSU],Michael Grosse-Brömer,michael-grosse-bromer,1544.0,cducsu,Fangen Sie noch mal an!,TOP VII Haushaltsgesetz 2014,13987,poi,18
837,691777,https://www.abgeordnetenwatch.de/profile/sven-christian-kindler/archive/215049,837,44,Sven-Christian Kindler (BÜNDNIS 90/DIE GRÜNEN),Sven-Christian Kindler,sven-christian-kindler,1328.0,gruene,"Schon bei der Haushaltsaufstellung, Herr Schäuble, hat sich gezeigt: Da ist keine Vorsorge für die Zukunft, da ist keine Veränderung, da ist kein Mut, irgendetwas zu machen, keine Reform. Sie gehen nicht an die Einnahmen, nicht an die Ausgaben, nicht an die Subventionen heran.",TOP VII Haushaltsgesetz 2014,13987,speech,18
838,691778,https://www.abgeordnetenwatch.de/profile/michael-grosse-bromer-2/archive/217189,838,44,Michael Grosse-Brömer [CDU/CSU],Michael Grosse-Brömer,michael-grosse-bromer,1544.0,cducsu,Wo waren Sie denn in den letzten Sitzungswochen?,TOP VII Haushaltsgesetz 2014,13987,poi,18
839,691779,https://www.abgeordnetenwatch.de/profile/sven-christian-kindler/archive/215049,839,44,Sven-Christian Kindler (BÜNDNIS 90/DIE GRÜNEN),Sven-Christian Kindler,sven-christian-kindler,1328.0,gruene,"Das ist nur müdes Verwalten. Sie haben eine so große Mehrheit, aber so wenig Mut zu Veränderungen. Das wird uns noch alle teuer zu stehen kommen.",TOP VII Haushaltsgesetz 2014,13987,speech,18
840,691780,,840,44,,,,,,Beifall beim BÜNDNIS 90/DIE GRÜNEN sowie bei Abgeordneten der LINKEN,TOP VII Haushaltsgesetz 2014,13987,poi,18
