,id,profile_url,sequence,sitzung,speaker,speaker_cleaned,speaker_fp,speaker_key,speaker_party,text,top,top_id,type,wahlperiode
164,524472,https://www.abgeordnetenwatch.de/profile/volker-beck,164,56,Volker Beck (Köln) (BÜNDNIS 90/DIE GRÜNEN),Volker Beck,volker-beck,1874,gruene,"Ich möchte Sie ganz konkret zu dem Fall von Erhan A. befragen, der sich gegenwärtig in Bayern in Abschiebehaft befindet. Er hat in der Presse öffentlich geäußert, dass er David G. aus Kempten beneidet habe, der im ISIS-Kampf gestorben ist. Die bayerischen Stellen haben erklärt, dass eine Abschiebung von Erhan A. dennoch beabsichtigt ist.

Die CSU ist sich sogar nicht zu schade, heute ein Pic zu verbreiten, auf dem steht:

„Jemand, der in aller Öffentlichkeit die Gräueltaten der Terrormiliz Islamischer Staat gutheißt, das Köpfen von Journalisten rechtfertigt und nicht davor zurückschreckt, seine eigene Familie zu töten, wenn sie sich nicht an die islamischen Gesetze hält, hat bei uns nichts zu suchen.“

Damit wird die harte Linie der CSU, so jemanden des Landes zu verweisen, ausdrücklich beworben. Das verstößt meines Erachtens gegen den Wortlaut und den Sinn der UN-Resolution zu Foreign Fighters. Danach sind wir gehalten, solche Personen in unserem Land festzuhalten und sie gegebenenfalls mit Mitteln der Strafverfolgung festzusetzen oder polizeilich zu überwachen. - Mir fehlt jedes Verständnis für die Diskussionslage in der CSU.

Völkerrechtlich ist die Bundesregierung gegenüber den Vereinten Nationen verantwortlich. Soweit ich weiß, wurde diese Resolution von Deutschland ausdrücklich unterstützt. Wie beurteilen Sie vor dem Hintergrund dieser UN-Resolution die bevorstehende Abschiebung von Herrn Erhan A. in die Türkei, wodurch eine Weiterreise ins Kampfgebiet ermöglicht wird?",TOP 2 Fragestunde,14051,speech,18
165,524473,https://www.abgeordnetenwatch.de/profile/petra-pau/archive/215458,165,56,Vizepräsidentin Petra Pau,Petra Pau,petra-pau,1713,,"Bitte, Herr Staatssekretär.",TOP 2 Fragestunde,14051,chair,18
166,524474,https://www.abgeordnetenwatch.de/profile/ole-schroder,166,56,"Dr. Ole Schröder, Parl. Staatssekretär beim Bundesminister des Innern",Dr. Ole Schröder,ole-schroder,1662,,"Generell ist zu sagen, dass wir solche Personen, bei denen eine konkrete Reiseabsicht, aber auch eine konkrete Terrorabsicht besteht, nicht ausreisen lassen, weil wir nicht wollen, dass von deutschem Boden Terror und Krieg ausgehen. Davon zu unterscheiden sind aber solche Personen, die keine Terrorabsicht haben, aber entsprechend agitieren, insbesondere Hassprediger, die gerade junge Menschen dazu bringen könnten, nach Syrien zu ziehen. Diese Personen wollen wir nicht im Land haben, weil wir insbesondere die dafür anfälligen Jugendlichen schützen wollen. Wir wollen nicht, dass solche Hassprediger zum Beispiel in Moscheen in Deutschland andere zu Terror anstiften; sie gehören selbstverständlich ausgewiesen.",TOP 2 Fragestunde,14051,speech,18
167,524475,https://www.abgeordnetenwatch.de/profile/petra-pau/archive/215458,167,56,Vizepräsidentin Petra Pau,Petra Pau,petra-pau,1713,,Sie haben das Wort zu einer zweiten Nachfrage.,TOP 2 Fragestunde,14051,chair,18
168,524476,https://www.abgeordnetenwatch.de/profile/volker-beck,168,56,Volker Beck (Köln) (BÜNDNIS 90/DIE GRÜNEN),Volker Beck,volker-beck,1874,gruene,"Ich sehe das mit den Hasspredigern anders. Ich finde: Wenn sie über YouTube ihre Botschaften aus dem Kampfgebiet senden, hat das eine wesentlich verheerendere Wirkung. Wenn sie wirklich Hass predigen, ist das Strafrecht wegen Volksverhetzung in Anspruch zu nehmen.

Ich komme konkret zum Fall des Erhan A. Er sagt eindeutig, er beneide seinen Kumpel, der schon unten war. Er unterstützt ausdrücklich alle Gewalttaten, die der IS gegenwärtig begeht. Er hat lediglich noch nicht den Satz gesagt: Ich will da jetzt auch hin. - Aber wer eins und eins zusammenzählen kann, weiß, dass dieser Typ das denkt. Würden Sie mir zustimmen, dass es angesichts der UN-Resolution zu Foreign Fighters unzulässig wäre, Erhan A. gegenwärtig in die Türkei auszuweisen? Was haben Ihre diesbezüglichen Gespräche mit der Bayerischen Staatsregierung bislang ergeben? - Der Beschluss der IMK vom 5. Juni 2009 sieht ein hohes Maß an Kommunikation der Sicherheitsbehörden bei solchen Maßnahmen vor. Ich hoffe, das ist nicht nur Papier, sondern es gibt dieses Maß der Kommunikation.",TOP 2 Fragestunde,14051,speech,18
169,524477,https://www.abgeordnetenwatch.de/profile/ole-schroder,169,56,"Dr. Ole Schröder, Parl. Staatssekretär beim Bundesminister des Innern",Dr. Ole Schröder,ole-schroder,1662,,Wir müssen im konkreten Einzelfall unterscheiden:,TOP 2 Fragestunde,14051,speech,18
170,524478,https://www.abgeordnetenwatch.de/profile/volker-beck,170,56,Volker Beck [Köln] [BÜNDNIS 90/DIE GRÜNEN],Volker Beck,volker-beck,1874,gruene,Den kennen Sie doch!,TOP 2 Fragestunde,14051,poi,18
171,524479,https://www.abgeordnetenwatch.de/profile/ole-schroder,171,56,"Dr. Ole Schröder, Parl. Staatssekretär beim Bundesminister des Innern",Dr. Ole Schröder,ole-schroder,1662,,Ist das ein ausländischer Kämpfer? Will er im Ausland Terrortaten begehen?,TOP 2 Fragestunde,14051,speech,18
172,524480,https://www.abgeordnetenwatch.de/profile/volker-beck,172,56,Volker Beck [Köln] [BÜNDNIS 90/DIE GRÜNEN],Volker Beck,volker-beck,1874,gruene,Ja!,TOP 2 Fragestunde,14051,poi,18
173,524481,https://www.abgeordnetenwatch.de/profile/ole-schroder,173,56,"Dr. Ole Schröder, Parl. Staatssekretär beim Bundesminister des Innern",Dr. Ole Schröder,ole-schroder,1662,,"Dann verhindern wir die Ausreise. Wenn es eine Person ist, die andere dazu bringen möchte, ins Ausland zu gehen, die agitiert, die hier in Deutschland in Moscheen tätig ist und insbesondere Jugendliche dazu bringen will, nach Syrien zu gehen, um sich dort ISIS anzuschließen, dann greifen ausländerrechtliche Instrumentarien, dann ist es angezeigt, diese Person auszuweisen. - Das müssen wir unterscheiden; das bringen Sie gerade durch-einander.",TOP 2 Fragestunde,14051,speech,18
174,524482,https://www.abgeordnetenwatch.de/profile/volker-beck,174,56,Volker Beck [Köln] [BÜNDNIS 90/DIE GRÜNEN],Volker Beck,volker-beck,1874,gruene,Das bringe ich nicht durcheinander! Das ist doch eindeutig ein Fall der Gruppe A!,TOP 2 Fragestunde,14051,poi,18
175,524483,https://www.abgeordnetenwatch.de/profile/petra-pau/archive/215458,175,56,Vizepräsidentin Petra Pau,Petra Pau,petra-pau,1713,,Zu einer Nachfrage hat die Kollegin Heike Hänsel das Wort.,TOP 2 Fragestunde,14051,chair,18
176,524484,https://www.abgeordnetenwatch.de/profile/heike-hansel/archive/215687,176,56,Heike Hänsel (DIE LINKE),Heike Hänsel,heike-hansel,1594,linke,"Danke, Frau Präsidentin. - Ich habe eine Frage zu den aktuellen Auseinandersetzungen in Hamburg und Celle. Salafistische Gruppen hatten über Facebook und Twitter dazu aufgerufen, kurdische Kulturvereine zu überfallen. Danach kam es zu schweren Ausschreitungen. Wie gedenkt die Bundesregierung, darauf zu reagieren?",TOP 2 Fragestunde,14051,speech,18
177,524485,https://www.abgeordnetenwatch.de/profile/ole-schroder,177,56,"Dr. Ole Schröder, Parl. Staatssekretär beim Bundesminister des Innern",Dr. Ole Schröder,ole-schroder,1662,,"Das ist eine sehr dynamische Lage. Auch in anderen Städten gab es solche Vorfälle. Jetzt kommt es darauf an, konkret mit den Sicherheitsbehörden vor Ort und auch mit den unterschiedlichen Akteuren zu sprechen, damit mögliche Demonstrationen gewaltfrei ablaufen.",TOP 2 Fragestunde,14051,speech,18
178,524486,https://www.abgeordnetenwatch.de/profile/petra-pau/archive/215458,178,56,Vizepräsidentin Petra Pau,Petra Pau,petra-pau,1713,,Die Kollegin Haßelmann stellt die nächste Frage.,TOP 2 Fragestunde,14051,chair,18
179,524487,https://www.abgeordnetenwatch.de/profile/britta-haselmann-0,179,56,Britta Haßelmann (BÜNDNIS 90/DIE GRÜNEN),Britta Haßelmann,britta-haßelmann,1807,gruene,"Vielen Dank, Frau Präsidentin. - Herr Staatssekretär Schröder, ich möchte Sie auffordern, auf die konkrete Frage meines Kollegen Beck zu antworten. Er hat keine allgemeine Frage zu der grundsätzlichen Politik des Innenministeriums gestellt. Es ging ihm konkret um den Widerspruch zwischen den Aussagen des bayerischen Innenministeriums und der Ausreiseverfügung bezüglich einer ganz konkreten Person und der Rechtslage und der Anwendung der Rechtsvorschriften entsprechend den öffentlichen Einlassungen, insbesondere zur Linie des Innenministeriums von de Maizière. Herr Beck hat Sie ganz präzise und konkret gefragt. Sie haben aber, trotz zweimaliger Nachfrage, nicht darauf geantwortet. Ich fordere Sie deshalb auf, konkret etwas zu dem Fall -Erhan A. aus Bayern zu sagen.",TOP 2 Fragestunde,14051,speech,18
180,524488,https://www.abgeordnetenwatch.de/profile/ole-schroder,180,56,"Dr. Ole Schröder, Parl. Staatssekretär beim Bundesminister des Innern",Dr. Ole Schröder,ole-schroder,1662,,"Ich habe ganz konkret geantwortet und erläutert, welche Absprachen mit den Ländern in Bezug auf die Vorgehensweise getroffen wurden. Ich gehe davon aus, dass auch dieser konkrete Fall gemäß den IMK-Beschlüssen abgewickelt wurde. Aber natürlich kenne ich nicht die konkrete Akte.",TOP 2 Fragestunde,14051,speech,18
181,524489,https://www.abgeordnetenwatch.de/profile/volker-beck,181,56,Volker Beck [Köln] [BÜNDNIS 90/DIE GRÜNEN],Volker Beck,volker-beck,1874,gruene,Wozu schreiben wir Ihnen die Fragen am Freitag vorher auf?,TOP 2 Fragestunde,14051,poi,18
182,524490,https://www.abgeordnetenwatch.de/profile/petra-pau/archive/215458,182,56,Vizepräsidentin Petra Pau,Petra Pau,petra-pau,1713,,"Wir sind immer noch im Geschäftsbereich des Bundesministeriums des Innern. Ich rufe die Frage 9 der Kollegin Luise Amtsberg auf:

Was soll nach Kenntnis der Bundesregierung der Aufgabenbereich (unter Angabe der Budgethöhe) der geplanten Frontex-Operation „Triton“ sein, und mit welcher Begründung setzt sich die Bundesregierung beim anstehenden EU-Innenministerrat am 9. Oktober 2014 nicht für eine europäische Unterstützung der italienischen Marineoperation „Mare Nostrum“ auch außerhalb italienischen Hoheitsgewässers ein, die im vergangenen Jahr auf hoher See 100 000 Menschen gerettet hat (Schreiben des Bundesministers des Innern, Dr. Thomas de Maizière, vom 1. September 2014 an die EU-Kommissarin Cecilia Malmström)?

Bitte, Herr Staatssekretär.",TOP 2 Fragestunde,14051,chair,18
183,524491,https://www.abgeordnetenwatch.de/profile/ole-schroder,183,56,"Dr. Ole Schröder, Parl. Staatssekretär beim Bundesminister des Innern",Dr. Ole Schröder,ole-schroder,1662,,"Ich beantworte Ihre Frage wie folgt: Der Einsatzplan der gegenwärtig geplanten Frontex-koordinierten Operation „Triton“ ist der Bundesregierung noch nicht bekannt.

Nach bisherigem Kenntnisstand soll der Einsatz zur Implementierung koordinierter operativer Aktivitäten der EU-Mitgliedstaaten an den Seeaußengrenzen im zentralen Mittelmeer beitragen. Im Ergebnis sollen die grenzpolizeilichen Maßnahmen der zuständigen italienischen Behörden durch Personal und technische Ausrüstungsgegenstände anderer EU-Mitgliedstaaten unterstützt werden.

Ziel ist die grenzpolizeiliche Kontrolle von Migra-tionsströmen in Richtung Europa und die Bekämpfung von grenzüberschreitender Kriminalität. Darüber hinaus sollen Seenotrettungsmaßnahmen der zuständigen italienischen Behörden im Einsatzgebiet unterstützt werden. Diese Einsatzziele sollen insbesondere durch Mittel der Grenzüberwachung und gezielten Informationsgewinnung im Rahmen von Befragungen erreicht werden.

Die Höhe der dadurch entstehenden Einsatzkosten ist der Bundesregierung nicht bekannt. Da es sich bei der Operation „Triton“ um eine außerplanmäßige Maßnahme handelt, war sie nicht Gegenstand der Jahresplanung 2014. Der zulässige Kostenrahmen ergibt sich jedoch in erster Linie aus dem Frontex-Haushalt, also den verfügbaren Mitteln, und dem Jahresarbeitsprogramm der Agentur, also den durch den Verwaltungsrat entschiedenen Aktivitäten der Agentur.

Zum zweiten Teil Ihrer Frage. Die Kooperation der EU-Mitgliedstaaten erfolgt entsprechend den Mechanismen im Rahmen der gemeinsamen polizeilichen Grenzüberwachung. Hierzu verfügen die zuständigen Mitgliedstaaten über gemeinsame Ausbildungs- und Einsatzstandards, Rechtsgrundlagen, Einsatzkonzepte und Einsatzmittel. Diese Kooperation hat sich auch im Mittelmeer in den Frontex-koordinierten Operationen „Hermes“ und „Aeneas“ bewährt.

Die Operation „Mare Nostrum“ ist eine militärische Operation. Frontex hat hier weder das Mandat noch die Mittel, Einsatzmaßnahmen nach dem Vorbild „Mare Nostrum“ zu koordinieren. Um die vorhandenen Einsatzkapazitäten und notwendigen Ressourcen der Mitgliedstaaten kurzfristig nutzen zu können, sind Frontex-koordinierte Grenzüberwachungseinsätze unabdingbar. Die Erfahrungen der letzten Jahre haben gezeigt, dass hierdurch Tausende Menschen gerettet und gleichzeitig kriminelle Schleusungsorganisationen bekämpft werden. Diese notwendige Verknüpfung des Rettungseinsatzes mit der polizeilichen Bekämpfung von Schleusungskriminalität kann in einer militärisch geführten Operation nicht gewährleistet werden.",TOP 2 Fragestunde,14051,speech,18
184,524492,https://www.abgeordnetenwatch.de/profile/petra-pau/archive/215458,184,56,Vizepräsidentin Petra Pau,Petra Pau,petra-pau,1713,,Sie haben das Wort zur ersten Nachfrage.,TOP 2 Fragestunde,14051,chair,18
185,524493,https://www.abgeordnetenwatch.de/profile/luise-amtsberg-2/archive/217187,185,56,Luise Amtsberg (BÜNDNIS 90/DIE GRÜNEN),Luise Amtsberg,luise-amtsberg,1549,gruene,"Vielen Dank. - Wir wissen noch nicht viel über die Bedarfsanforderungen seitens Frontex für diese Mission. Das leuchtet mir ein. Da warten wir natürlich noch auf weitere Informationen. Aber wir wissen schon, wie man sich das ungefähr vorstellen kann. So sagt die italienische EU-Ratspräsidentschaft beispielsweise, dass das Abnehmen von Fingerabdrücken auf hoher See, im Zweifel auch mit Gewalt, legitimiert werden soll und eine engere Zusammenarbeit - das wurde von unserem Bundesinnenminister unterstützt - mit den Transit- und Herkunftsländern stattfinden soll, unter anderem auch mit Ländern am Horn von Afrika. Mich würde interessieren, weil das Fragen sind, die die Menschenrechte berühren, ob die Bundesregierung eine engere Kooperation mit den Transit- und Herkunftsstaaten tatsächlich unterstützt und wie diese aussehen soll. Wenn die Bundesregierung diese Forderung nicht teilt, möchte ich wissen, wie sie gedenkt, diese Ausrichtung zu verhindern.",TOP 2 Fragestunde,14051,speech,18
186,524494,https://www.abgeordnetenwatch.de/profile/ole-schroder,186,56,"Dr. Ole Schröder, Parl. Staatssekretär beim Bundesminister des Innern",Dr. Ole Schröder,ole-schroder,1662,,"Morgen wird auf dem Innenministerrat über das Papier der italienischen EU-Ratspräsidentschaft gesprochen. Dieses Papier, das Sie eben angesprochen haben, sieht eine Stabilisierung der Herkunftsstaaten vor, insbesondere von Libyen und seinen Nachbarstaaten. Es geht darum, mit den Transitländern enger zusammenzuarbeiten, um den Schleusern das Handwerk zu legen, aber auch, um humanitäre Aufnahmekapazitäten zu schaffen. Dann geht es natürlich um den Schutz der Außengrenzen. Triton kann keine Fortsetzung von „Mare Nostrum“ sein, weil „Mare Nostrum“ eine militärische Operation ist und die EU keine militärischen Operationen zum Grenzschutz durchführt. Bei Triton geht es um einen durch Frontex gestützten Einsatz. Dieser soll natürlich auch dafür sorgen, dass Schiffbrüchige, also Menschen in Seenot, gerettet werden. Außerdem geht es der italienischen Ratspräsidentschaft vor allen Dingen darum, dass das gemeinsame europäische Asylsystem durchgesetzt wird, das heißt, dass unsere humanitären Standards eingehalten werden.",TOP 2 Fragestunde,14051,speech,18
187,524495,https://www.abgeordnetenwatch.de/profile/petra-pau/archive/215458,187,56,Vizepräsidentin Petra Pau,Petra Pau,petra-pau,1713,,Sie haben das Wort zu einer zweiten Nachfrage.,TOP 2 Fragestunde,14051,chair,18
188,524496,https://www.abgeordnetenwatch.de/profile/luise-amtsberg-2/archive/217187,188,56,Luise Amtsberg (BÜNDNIS 90/DIE GRÜNEN),Luise Amtsberg,luise-amtsberg,1549,gruene,"Vielleicht muss man das einfach einmal grundlegend klären. Die Frage tauchte ja auch vorhin schon in der Regierungsbefragung auf. Sind die Maßnahmen, die zur Bekämpfung von Schleuserkriminalität ergriffen werden, ausschließlich überwachungstechnischer Natur? Wenn man es den Schleusern durch eine härtere Abgrenzung also sozusagen unmöglich machen will, Menschen nach Europa zu bringen, ist man dann auch bereit, darüber nachzudenken, ob es andere Möglichkeiten gibt, um den Schutzsuchenden, um die es ja geht, Wege nach Europa zu eröffnen? Denkt die Bundesregierung darüber nach?",TOP 2 Fragestunde,14051,speech,18
189,524497,https://www.abgeordnetenwatch.de/profile/ole-schroder,189,56,"Dr. Ole Schröder, Parl. Staatssekretär beim Bundesminister des Innern",Dr. Ole Schröder,ole-schroder,1662,,"Das machen wir aktiv. Denken Sie an unser Programm zur Aufnahme von 20 000 besonders Schutzbedürftigen. Diese Menschen haben wir aktiv nach Deutschland geholt. Wir haben die Kommission aufgefordert, ein entsprechendes Pledging-Verfahren durchzuführen, also die anderen Mitgliedstaaten aufzufordern, ebenfalls weitere Kapazitäten zu schaffen. Aber natürlich ist es auch notwendig, Schleuserkriminalität zu bekämpfen. Das erfolgt nicht durch Abschottung. Das geht nach der Genfer Flüchtlingskonvention überhaupt gar nicht. Wir sind gehalten - das entspricht auch unseren humanitären Standards -, jeden Flüchtling, der, egal auf welchem Weg, ob auf dem Landweg oder auf dem Seeweg, kommt, aufzunehmen, ihn nicht nur an Bord zu nehmen, sondern ihn auch nach Europa zu holen. Aber natürlich ist es auch notwendig, die Flüchtlinge zu befragen, wie sie denn nach Europa gekommen sind, was sie dafür bezahlt haben, welche Route sie gewählt haben. Die dadurch entstehenden Lagebilder sind wichtig, um Schleuserkriminalität zu bekämpfen.",TOP 2 Fragestunde,14051,speech,18
190,524498,https://www.abgeordnetenwatch.de/profile/petra-pau/archive/215458,190,56,Vizepräsidentin Petra Pau,Petra Pau,petra-pau,1713,,"Wir kommen damit zur Frage 10 der Kollegin Luise Amtsberg:

Welche sind nach Kenntnis der Bundesregierung die unterschiedlichen Maßnahmen, die von der Europäischen Kommission und den Mitgliedstaaten im Vorfeld des EU-Innenministertreffens am 9. Oktober 2014 vorgeschlagen wurden, um künftig ein faires und solidarisches System zur Aufnahme von Schutzsuchenden in die EU zu gewährleisten, und wie beurteilt die Bundesregierung die von der EU-Ratspräsidentschaft als Ausgleichsmaßnahme vorgeschlagene Intensivierung der Familienzusammenführung und des Selbsteintrittsrechts im Rahmen der Dublin-III-Verordnung?",TOP 2 Fragestunde,14051,chair,18
191,524499,https://www.abgeordnetenwatch.de/profile/ole-schroder,191,56,"Dr. Ole Schröder, Parl. Staatssekretär beim Bundesminister des Innern",Dr. Ole Schröder,ole-schroder,1662,,"Ich beantworte Ihre Frage wie folgt: Nach Kenntnis der Bundesregierung stellt die italienische EU-Ratspräsidentschaft zurzeit Maßnahmen zusammen, um die andauernden Flüchtlingsströme über das Mittelmeer nach Europa besser bewältigen zu können. Die hierzu erforderlichen Maßnahmen gehen über die Fragestellung eines fairen und solidarischen Systems zur Aufnahme von Schutzsuchenden in der Europäischen Union hinaus.

Die Maßnahmen enthalten die sieben Punkte, die Bundesminister Thomas de Maizière in seiner Haushaltsrede vor dem Deutschen Bundestag genannt hat: verstärkte Zusammenarbeit der Europäischen Union mit Transit- und Herkunftsstaaten, verstärkte Bekämpfung von Schleuserbanden, bessere Überwachung der Außengrenzen und Migrationsströme der Europäischen Union, konsequente Anwendung der Dublin- und Eurodac-Verordnungen, Einrichtung eines beschleunigten Prüfverfahrens für Asylanträge in den Fällen, in denen das -Bestehen eines Rechts auf Asyl wahrscheinlich ist, temporäre Verteilung anerkannter Flüchtlinge in andere Mitgliedstaaten zur Unterstützung besonders belasteter Mitgliedstaaten auf freiwilliger Basis und in Anrechnung der Lasten, die die Mitgliedstaaten bereits schultern, und zuletzt Umsetzung einer koordinierten gemeinsamen Rückführungspolitik.

Die 2013 neugefasste Dublin-III-Verordnung sieht erweiterte Regelungen der Familienzusammenführung sowie des Selbsteintrittsrechts gerade auch aus humanitären Gründen vor. Das Bundesamt für Migration und Flüchtlinge wendet diese Regelungen bereits an.",TOP 2 Fragestunde,14051,speech,18
192,524500,https://www.abgeordnetenwatch.de/profile/petra-pau/archive/215458,192,56,Vizepräsidentin Petra Pau,Petra Pau,petra-pau,1713,,Sie haben das Wort zur Nachfrage.,TOP 2 Fragestunde,14051,chair,18
193,524501,https://www.abgeordnetenwatch.de/profile/luise-amtsberg-2/archive/217187,193,56,Luise Amtsberg (BÜNDNIS 90/DIE GRÜNEN),Luise Amtsberg,luise-amtsberg,1549,gruene,"Vielen Dank für die Beantwortung meiner Frage. - Den Medien konnte man ja entnehmen, dass sich Bundesminister de Maizière eigentlich kritisch zu der Dublin-Verordnung und zum Dublin-Mechanismus geäußert hat. Jetzt sagen Sie, dass an der Dublin-III-Verordnung festgehalten werden soll, also an dem Mechanismus. Meine Frage: Ist es da zu einer neuen Ausrichtung innerhalb des Bundesinnenministeriums gekommen, oder denkt man tatsächlich über eine Neuausrichtung oder einen anderen Verteilmechanismus innerhalb der Europäischen Union bei der Flüchtlingsaufnahme nach?",TOP 2 Fragestunde,14051,speech,18
194,524502,https://www.abgeordnetenwatch.de/profile/ole-schroder,194,56,"Dr. Ole Schröder, Parl. Staatssekretär beim Bundesminister des Innern",Dr. Ole Schröder,ole-schroder,1662,,"Wir haben den Vorschlag gemacht, über eine zusätzliche freiwillige Verteilung nachzudenken. Die Herausforderung besteht darin, dass Sie immer festlegen müssen, wer für das konkrete Asylverfahren zuständig ist. Das müssen Sie nach der neuen Dublin-III-Verordnung umsetzen. Wenn Sie jetzt einen Verteilungsmechanismus einführen, der, wie Sie es vorschlagen, verpflichtend ist, dann haben Sie die gleiche Problematik der Durchsetzung. Das heißt, Sie lösen damit am Ende kein Problem.

Deshalb sagen wir, dass wir für die Mitgliedstaaten, die momentan nicht die humanitären Standards erfüllen und an die wir zurzeit nicht nach dem Dublin-Verfahren überführen, zum Beispiel Griechenland, Anreize schaffen wollen. Wenn diese Länder die Standards erfüllen, die wir im Bereich des Flüchtlingsschutzes erwarten, dann sind wir im Gegenzug auch bereit, freiwillig zu helfen. Da fordern wir natürlich vor allem die Mitgliedstaaten auf, die bisher noch nicht solche großen Herausforderungen im Bereich des Flüchtlingsschutzes zu schultern haben.",TOP 2 Fragestunde,14051,speech,18
195,524503,https://www.abgeordnetenwatch.de/profile/petra-pau/archive/215458,195,56,Vizepräsidentin Petra Pau,Petra Pau,petra-pau,1713,,Sie haben die Möglichkeit zu einer zweiten Nachfrage. Bitte.,TOP 2 Fragestunde,14051,chair,18
196,524504,https://www.abgeordnetenwatch.de/profile/luise-amtsberg-2/archive/217187,196,56,Luise Amtsberg (BÜNDNIS 90/DIE GRÜNEN),Luise Amtsberg,luise-amtsberg,1549,gruene,"Erst einmal: Ich habe noch gar keinen Vorschlag für einen Verteilungsmechanismus gemacht, sondern nur gesagt, dass es Alternativen gibt. Über diese kann man ja vielleicht einmal diskutieren; denn der Bundesminister hat sehr starke Kritik an Italien geäußert, weil es die Dublin-Verordnung sozusagen nicht in Gänze erfüllt.

Darüber hinaus ist es sozusagen eine Neuausrichtung, wenn man - ich beziehe mich erneut auf eine Aussage des Bundesinnenministers - über gewisse Obergrenzen und ein Anreizsystem, von dem Sie gerade gesprochen haben, nachdenkt. Deshalb lautete meine Frage vorhin - ich frage jetzt explizit noch einmal nach -: Gibt es Überlegungen, ein neues Modell einzuführen? Anreizsysteme für Staaten, zum Beispiel Griechenland, zu schaffen, die Standards wieder anzuheben, begrüßen wir ausdrücklich. Das würden wir immer unterstützen, weil nur das der Weg zu einem gemeinsamen Asylsystem ist. Aber meine Frage bezog sich tatsächlich auf die von Bundesminister de Maizière getroffenen Aussagen dazu.",TOP 2 Fragestunde,14051,speech,18
197,524505,https://www.abgeordnetenwatch.de/profile/ole-schroder,197,56,"Dr. Ole Schröder, Parl. Staatssekretär beim Bundesminister des Innern",Dr. Ole Schröder,ole-schroder,1662,,"Zunächst einmal: Der Bundesinnenminister hat nie von einer Obergrenze gesprochen. Das ist schlichtweg falsch. Es bringt auch nichts, ihn immer wieder falsch zu zitieren. Wir werden unserer humanitären Verpflichtung im Rahmen des gemeinsamen europäischen Asylsystems gerecht. Das Problem ist, dass sich einige Mitgliedstaaten zurzeit an dieses gemeinsame europäische Asylsystem nicht halten. Die Einhaltung muss aber durchgesetzt werden. Dabei geht es auch um humanitäre Standards. Das ist Aufgabe der Kommission. Nun überlegen wir, wie wir zusätzliche Anreize schaffen, damit Mitgliedstaaten wie beispielsweise Griechenland ebenfalls die Dublin-Standards erfüllen. Sie erwarten dann, dass sie zusätzlich zu den finanziellen Hilfen durch Frontex von allen Mitgliedstaaten freiwillig unterstützt werden. Das ist im Übrigen keine neue Position. Das ist schon in gemeinsamen Papieren der EVP-Minister und EVP-Abgeordneten, die sich mit Innenpolitik beschäftigen, so ausgeführt worden.",TOP 2 Fragestunde,14051,speech,18
