,id,profile_url,sequence,sitzung,speaker,speaker_cleaned,speaker_fp,speaker_key,speaker_party,text,top,top_id,type,wahlperiode
0,524308,https://www.abgeordnetenwatch.de/profile/norbert-lammert,0,56,Präsident Dr. Norbert Lammert,Dr. Norbert Lammert,norbert-lammert,1754,,"Die Sitzung ist eröffnet. Nehmen Sie bitte Platz.

Ich begrüße Sie alle herzlich, liebe Kolleginnen und Kollegen, zu unserer 56. Sitzung und darf Ihnen zunächst eine amtliche Mitteilung vortragen.

Interfraktionell ist vereinbart worden, die Unterrichtung der Bundesregierung zur Stellungnahme des Bundesrates und zur Gegenäußerung der Bundesregierung auf Drucksache 18/2709 zu dem bereits überwiesenen Entwurf eines Zwölften Gesetzes zur Änderung des Bundes-Immissionsschutzgesetzes an den federführenden Ausschuss für Umwelt, Naturschutz, Bau und Reaktorsicherheit sowie zur Mitberatung an den Ausschuss für Recht und Verbraucherschutz, den Haushaltsausschuss, den Ausschuss für Wirtschaft und Energie sowie den Ausschuss für Verkehr und digitale Infrastruktur zu überweisen.

Ebenso soll die Stellungnahme des Bundesrates auf Drucksache 18/2657 zu dem bereits überwiesenen Entwurf eines Zweiten Gesetzes zur Änderung des Bundesfernstraßenmautgesetzes an den federführenden Ausschuss für Verkehr und digitale Infrastruktur und zur Mitberatung an den Haushaltsausschuss sowie den Ausschuss für Umwelt, Naturschutz, Bau und Reaktorsicherheit überwiesen werden.

Darf ich Ihr Einvernehmen zu diesen Überweisungsvorschlägen feststellen? - Das sieht doch sehr danach aus. Dann haben wir das somit beschlossen.

Ich rufe den Tagesordnungspunkt 1 auf:

Befragung der Bundesregierung

Die Bundesregierung hat als Thema der heutigen Kabinettssitzung mitgeteilt: Maßnahmen im Bauplanungsrecht zur Erleichterung der Unterbringung von Flüchtlingen - Stellungnahme der Bundesregierung zum Gesetzentwurf des Bundesrates.

Das Wort für einen einleitenden fünfminütigen Bericht hat die Bundesministerin für Umwelt, Naturschutz, Bau und Reaktorsicherheit, Frau Dr. Barbara Hendricks.

Ich wäre ganz dankbar, soweit es bereits Wortmeldungen für Nachfragen gibt, wenn mir die Geschäftsführer einen Hinweis geben könnten. Dann kann man diese schon sortieren. - Frau Ministerin.",TOP 1 Befragung der Bundesregierung,14050,chair,18
1,524309,https://www.abgeordnetenwatch.de/profile/barbara-hendricks-0,1,56,"Dr. Barbara Hendricks, Bundesministerin für Umwelt, Naturschutz, Bau und Reaktorsicherheit",Dr. Barbara Hendricks,barbara-hendricks,1796,,"Herr Präsident! Meine lieben Kolleginnen und Kollegen! Flüchtlinge, die zu uns kommen, werden aus ethnischen, religiösen oder politischen Gründen verfolgt und häufig mit dem Tod bedroht. Es ist unser aller Aufgabe, dort zu helfen, wo wir helfen können, und zwar jede und jeder an der Stelle, wo wir es vermögen. Ich kann und will dabei mithelfen, dass die Flüchtlinge schnell ein Dach über den Kopf bekommen. Ich möchte, dass wir sie so aufnehmen, dass sie in Würde bei uns leben können.

Unser Bauplanungsrecht hält zwar schon auch jetzt eine Vielzahl von Instrumenten bereit, die den Bau von Flüchtlingsunterkünften auch kurzfristig ermöglichen. In der jetzigen Situation können und wollen wir die Länder und Kommunen dabei unterstützen, noch schneller Hilfe leisten zu können.

Ich habe heute dem Kabinett vorgeschlagen, der Bundesratsinitiative vom 19. September 2014 zu folgen. Einige Änderungen im Gesetzentwurf des Bundesrates sollen allerdings aus meiner Sicht helfen, dem Anliegen in rechtlicher Hinsicht noch besser gerecht zu werden. Wir schlagen Ihnen also in der Stellungnahme zum Gesetzentwurf des Bundesrates einige Änderungen vor; der Bundestag wird sich selbstverständlich damit befassen.

Dazu gehört, dass wir als Bundesregierung anstreben, dass die vorgesehenen Regelungen bundesweit gelten. Der Bundesrat war von landesgesetzlichen Anordnungen ausgegangen. Mir liegt daran, dass das Baugesetzbuch vom Bund einheitlich weitergeführt wird. Wir wollen mit den Änderungen des Baugesetzbuches für Klarstellungen und auch für befristete Erleichterungen sorgen. Die Erleichterungen sollen, wie gesagt, befristet sein; die Klarstellungen sollen natürlich auf Dauer helfen.

Insgesamt sollen Kommunen von bestimmten Festsetzungen des Bebauungsplanes abweichen können, um die Flüchtlingsunterbringung unkomplizierter zu ermöglichen. Wir wollen es zum Beispiel ermöglichen, Flüchtlingsunterkünfte im Innenbereich auch dann zuzulassen, wenn sie sich - anders als sonst im Bauplanungsrecht verlangt - nicht in die nähere Umgebung einfügen. Das betrifft beispielsweise Büro- oder Geschäftsgebäude, die dann als Unterkünfte dienen können. Außerdem wollen wir gestatten, dass Flüchtlinge auf Flächen untergebracht werden, die unmittelbar an einen bebauten Ortsteil anschließen. Und wir wollen den Kommunen die Möglichkeit geben, Flüchtlingsunterkünfte eingeschränkt und befristet in Gewerbegebieten einzurichten.

Natürlich soll bei alldem darauf geachtet werden, dass die Unterkünfte menschenwürdig sind. Bei weitem nicht jedes Gewerbegebiet eignet sich dazu, Menschen dort wohnen zu lassen. Die Prüfung muss in den Kommunen sachgerecht vorgenommen werden.

Es ist ausdrücklich vorgesehen, dass die Flüchtlingsunterbringung bei der Aufstellung von Bebauungsplänen zu berücksichtigen ist, und es wird klargestellt, dass die Unterbringung von Flüchtlingen zu den Belangen des Allgemeinwohls gehört. Das macht die Unterbringung vor Ort tatsächlich leichter und sorgt dafür, dass die Klagemöglichkeiten, die die Anwohner sonst hätten, eingeschränkt werden.

Liebe Kolleginnen und Kollegen, das Gesetzgebungsverfahren kann noch in diesem Jahr abgeschlossen werden. Damit wäre nicht nur den Ländern und Kommunen geholfen, sondern auch den Flüchtlingen. Es muss unser Hauptaugenmerk darauf liegen, dass wir jedenfalls vor dem Winter feste Unterkünfte für die Flüchtlinge haben und nicht hier oder da mit Zelten arbeiten müssen.

Ich bin mir absolut der Tatsache bewusst, dass es die Länder und Kommunen vor große Herausforderungen stellt, quasi über Nacht Flüchtlingsunterkünfte zur Verfügung stellen zu müssen und die menschenwürdige und angemessene Versorgung der Flüchtlinge sicherzustellen. Ich will bei dieser Gelegenheit allen Verantwortlichen in den Ländern und den Kommunen meinen herzlichen Dank dafür aussprechen.

Herzlichen Dank für die Aufmerksamkeit.",TOP 1 Befragung der Bundesregierung,14050,speech,18
2,524310,,2,56,,,,,,Beifall bei der SPD und der CDU/CSU sowie bei Abgeordneten der LINKEN und des BÜNDNISSES 90/DIE GRÜNEN,TOP 1 Befragung der Bundesregierung,14050,poi,18
3,524311,https://www.abgeordnetenwatch.de/profile/norbert-lammert,3,56,Präsident Dr. Norbert Lammert,Dr. Norbert Lammert,norbert-lammert,1754,,"Vielen Dank, Frau Ministerin. - Wir rufen jetzt zunächst Nachfragen zu diesem Bericht auf. Als Erster erteile ich der Kollegin Kerstin Kassner das Wort.",TOP 1 Befragung der Bundesregierung,14050,chair,18
4,524312,https://www.abgeordnetenwatch.de/profile/kerstin-kassner/archive/215371,4,56,Kerstin Kassner (DIE LINKE),Kerstin Kassner,kerstin-kassner,1464,linke,"Sehr geehrte Frau Ministerin, wir wissen: In der Bundesrepublik stehen circa 2 Millionen Wohnungen leer. Vor diesem Hintergrund frage ich Sie: Teilt die Bundesregierung meine Auffassung, dass es angesichts dieser Möglichkeiten viel besser wäre, Flüchtlingsfamilien und traumatisierte Flüchtlinge dezentral unterzubringen, anstatt sie in Gewerbegebieten oder sogar auf dem freien Feld unterzubringen, wo vieles, was an Infrastruktur dringend notwendig wäre, nur schwer zu organisieren ist?",TOP 1 Befragung der Bundesregierung,14050,speech,18
5,524313,https://www.abgeordnetenwatch.de/profile/barbara-hendricks-0,5,56,"Dr. Barbara Hendricks, Bundesministerin für Umwelt, Naturschutz, Bau und Reaktorsicherheit",Dr. Barbara Hendricks,barbara-hendricks,1796,,"Frau Kollegin, ich teile Ihre Auffassung durchaus. Wir haben aber in der Bundesrepublik Deutschland einen sehr unterschiedlich aufgestellten Wohnungsmarkt. Ich bin in der Tat dafür, dass in den Kommunen, in denen es leerstehende Wohnungen gibt, alle Möglichkeiten genutzt werden, um insbesondere Flüchtlingsfamilien dezentral, also in Wohnungen unterzubringen. Bei einzelnen Flüchtlingen ist es wiederum anders; bei ihnen bieten sich Gemeinschaftsunterkünfte möglicherweise sogar als erste Wahl an. Das muss aber vor Ort entschieden werden.

Wir haben Ballungsräume und Ballungsrandzonen, in denen es keinen Leerstand gibt. Den entsprechenden Kommunen werden aber gleichzeitig auch Flüchtlinge zur Aufnahme zugewiesen, sodass es nicht überall gelingen kann, Flüchtlinge in Wohnungen unterzubringen. Das ist in manchen Gegenden verhältnismäßig leicht möglich, in manchen Gegenden hingegen praktisch unmöglich.

Im Übrigen ist es aber nicht vorgesehen, Flüchtlinge - wie Sie es gesagt haben - „auf dem freien Feld unterzubringen“, sondern allenfalls am Rande einer Bebauung. Sie müssen sich das so vorstellen: An einem Ortsrand gibt es auf der einen Straßenseite Bebauung, auf der anderen Straßenseite beginnt der Geltungsbereich des § 35 Baugesetzbuch; dort ist zwar eigentlich freies Feld, aber die Infrastruktur ist vorhanden. Unterkünfte können nur in unmittelbarer Nähe einer Bebauung errichtet werden; denn man muss für jede Unterkunft eine Infrastruktur im Sinne von Versorgung mit Strom und Wasser und Entsorgung von Abwasser usw. haben.

Niemand käme auf die Idee, Unterkünfte auf einem freien Feld zu errichten, weil die entsprechende Infrastruktur nicht vorhanden ist. Die Nutzung von Gewerbegebieten ist natürlich nur dann möglich, wenn diese zum Beispiel nicht mit besonderen Emissionen belastet sind. Das muss vor Ort geprüft werden.",TOP 1 Befragung der Bundesregierung,14050,speech,18
6,524314,https://www.abgeordnetenwatch.de/profile/norbert-lammert,6,56,Präsident Dr. Norbert Lammert,Dr. Norbert Lammert,norbert-lammert,1754,,"Ich bitte noch einmal, gelegentlich auf die Uhr zu gucken. - Nächste Fragestellerin ist die Kollegin Luise Amtsberg.",TOP 1 Befragung der Bundesregierung,14050,chair,18
7,524315,https://www.abgeordnetenwatch.de/profile/luise-amtsberg-2/archive/217187,7,56,Luise Amtsberg (BÜNDNIS 90/DIE GRÜNEN),Luise Amtsberg,luise-amtsberg,1549,gruene,"Vielen Dank. - Frau Ministerin, Sie haben eben auf die regionalen Unterschiede hingewiesen. Es ist augenscheinlich, dass es einen Unterschied macht, ob man die Menschen auf dem Land oder in der Stadt unterbringt.

Letzte Woche hat sich der grüne Ministerpräsident des Landes Baden-Württemberg an die Kanzlerin mit dem Vorschlag gewandt, einen nationalen Asylgipfel einzurichten und dort Fragen, die eng mit diesem Thema verknüpft sind - beispielsweise die Aufstockung des Personals beim Bundesamt für Migration und Flüchtlinge, die aufgrund der regionalen Unterschiede notwendige Koordinierung, aber auch die Abschaffung des Asylbewerberleistungsgesetzes -, zu diskutieren. Vor diesem Hintergrund frage ich Sie, ob die Bundesregierung gesprächsbereit und bereit ist, auf diese einzelnen Punkte zur besseren Koordinierung einzugehen?",TOP 1 Befragung der Bundesregierung,14050,speech,18
8,524316,https://www.abgeordnetenwatch.de/profile/barbara-hendricks-0,8,56,"Dr. Barbara Hendricks, Bundesministerin für Umwelt, Naturschutz, Bau und Reaktorsicherheit",Dr. Barbara Hendricks,barbara-hendricks,1796,,"Was die einzelnen Punkte anbelangt, so ist die Bundesregierung nicht untätig geblieben, zum Beispiel wird das Personal des Bundesamts aufgestockt. Die Mittel dafür sind bereits im Haushaltsentwurf enthalten. Ob es tatsächlich sinnvoll ist, einen sogenannten Asylgipfel einzurichten - das sehe ich mit gewisser Skepsis. Nach meiner Kenntnis hat gerade die grüne Fraktion früher die „Gipfelitis“ immer kritisiert.",TOP 1 Befragung der Bundesregierung,14050,speech,18
9,524317,https://www.abgeordnetenwatch.de/profile/norbert-lammert,9,56,Präsident Dr. Norbert Lammert,Dr. Norbert Lammert,norbert-lammert,1754,,Nächster Fragesteller: Christian Kühn.,TOP 1 Befragung der Bundesregierung,14050,chair,18
10,524318,,10,56,Christian Kühn (Tübingen) (BÜNDNIS 90/DIE GRÜNEN),Christian Kühn,christian-kuhn,,gruene,"Danke, Herr Präsident. - Meine Nachfrage bezieht sich auf die Fragestellung, wie man es gewährleisten kann, Menschen ein Dach über dem Kopf zu geben, und zwar nicht nur in Gewerbegebieten, sondern auch in den Städten und Kommunen, also dort, wo es Wohnungen gibt.

Die BImA zum Beispiel verfügt über eine ganze Reihe von Liegenschaften. Inwieweit plant die Bundesregierung weitere Liegenschaften - nicht nur Konversionsliegenschaften, wie die Kaserne in Heidelberg - bereitzustellen, um Flüchtlinge jetzt in dieser konkreten Notsituation unterzubringen?",TOP 1 Befragung der Bundesregierung,14050,speech,18
11,524319,https://www.abgeordnetenwatch.de/profile/barbara-hendricks-0,11,56,"Dr. Barbara Hendricks, Bundesministerin für Umwelt, Naturschutz, Bau und Reaktorsicherheit",Dr. Barbara Hendricks,barbara-hendricks,1796,,"Herr Kollege, die BImA bietet seit längerem für die Unterbringung von Asylbewerbern und Flüchtlingen den betroffenen Kommunen und Landratsämtern grundsätzlich sämtliche freie Gebäude und Grundstücke an. Grundlage hierfür ist eine seit 2012 fortlaufende Untersuchung ihres Immobilienbestandes darauf, ob und inwieweit Liegenschaften den kommunalen oder Landesbehörden für die Notunterbringung des in Rede stehenden Personenkreises zur Verfügung gestellt werden können.

Standen dabei zunächst vor allem die ehemals von der Bundeswehr genutzten Liegenschaften und die von den Gaststreitkräften freigegebenen Areale im Fokus der Prüfung, hat die BImA im Hinblick auf die veränderte Situation in den vergangenen Wochen und Monaten ihr Angebotsportfolio - in Anführungszeichen - „offensiv“ erweitert und bietet nunmehr grundsätzlich alle verfügbaren Immobilien, auch Freiflächen, als Asyl- und Flüchtlingsunterkünfte an. Freiflächen können selbstverständlich nur für die Aufstellung von Wohncontainern genutzt werden und nicht für Zelte.",TOP 1 Befragung der Bundesregierung,14050,speech,18
12,524320,https://www.abgeordnetenwatch.de/profile/norbert-lammert,12,56,Präsident Dr. Norbert Lammert,Dr. Norbert Lammert,norbert-lammert,1754,,Frau Haßelmann.,TOP 1 Befragung der Bundesregierung,14050,chair,18
13,524321,https://www.abgeordnetenwatch.de/profile/britta-haselmann-0,13,56,Britta Haßelmann (BÜNDNIS 90/DIE GRÜNEN),Britta Haßelmann,britta-haßelmann,1807,gruene,"Vielen Dank, Herr Präsident. - Frau Ministerin, Sie haben eingangs die dramatische Situation der Flüchtlinge in Deutschland geschildert, insbesondere die Situation der Kommunen vor Ort, die Sie zu Ihrer Maßnahme veranlasst. Meine Frage ist: Warum weigert sich die Bundesregierung bis heute, über den Vorschlag unserer Fraktion und Fraktionsvorsitzenden und auch des Ministerpräsidenten von Baden-Württemberg nachzudenken, eine nationale Flüchtlingskonferenz unter Beteiligung von Bund, Ländern und Gemeinden durchzuführen, um endlich die Hilfe zu koordinieren?",TOP 1 Befragung der Bundesregierung,14050,speech,18
14,524322,https://www.abgeordnetenwatch.de/profile/barbara-hendricks-0,14,56,"Dr. Barbara Hendricks, Bundesministerin für Umwelt, Naturschutz, Bau und Reaktorsicherheit",Dr. Barbara Hendricks,barbara-hendricks,1796,,"Ich komme zurück auf meine Beantwortung der Frage Ihrer Kollegin. Auch die grüne Fraktion hat bis vor kurzer Zeit immer die sogenannte Gipfelitis kritisiert. Wir sind in ständigen Gesprächen, sowohl mit den Ländern als auch mit den kommunalen Spitzenverbänden. Die Arbeiten gehen zügig voran.",TOP 1 Befragung der Bundesregierung,14050,speech,18
15,524323,https://www.abgeordnetenwatch.de/profile/norbert-lammert,15,56,Präsident Dr. Norbert Lammert,Dr. Norbert Lammert,norbert-lammert,1754,,Kollege Wunderlich.,TOP 1 Befragung der Bundesregierung,14050,chair,18
16,524324,https://www.abgeordnetenwatch.de/profile/jorn-wunderlich/archive/215545,16,56,Jörn Wunderlich (DIE LINKE),Jörn Wunderlich,jorn-wunderlich,1617,linke,"Frau Ministerin Hendricks, vielen Dank. Sie haben sich gerade dafür ausgesprochen, dass man nach allen Möglichkeiten suchen soll, gerade Familien, die traumatisiert nach Deutschland kommen - wir wissen alle, was die Flüchtlingsfamilien und insbesondere die Kinder erlebt haben -, dezentral unterzubringen.

Ich habe am Montag die ausdrückliche Erklärung der Verwaltung meiner Heimatstadt erhalten - sie soll möglicherweise auch Flüchtlinge zugewiesen bekommen -, dass sie sich für eine dezentrale Unterbringung im kommunalen Wohnraum starkmacht. Jetzt ist meine Frage: Ist denn geklärt bzw. gibt es dahin gehende Überlegungen, wie bei einer dezentralen Unterbringung mit den Kosten für den erhöhten Personalbedarf - dabei geht es sowohl um die psychosoziale Betreuung als auch um den Sicherheitsdienst, um die Flüchtlinge vor den, so sage ich es einmal, national Verwirrten zu schützen - umgegangen werden soll? Soll für das Ganze seitens des Landes irgendein Ausgleich erfolgen, oder gar seitens des Bundes?",TOP 1 Befragung der Bundesregierung,14050,speech,18
17,524325,https://www.abgeordnetenwatch.de/profile/barbara-hendricks-0,17,56,"Dr. Barbara Hendricks, Bundesministerin für Umwelt, Naturschutz, Bau und Reaktorsicherheit",Dr. Barbara Hendricks,barbara-hendricks,1796,,"Herr Kollege, die Unterbringung von Flüchtlingen liegt nach unserer Rechtsordnung in der Verantwortung der Länder. Die Länder können das selbstverständlich nur in Zusammenarbeit mit den Kommunen, und so geschieht dies auch.",TOP 1 Befragung der Bundesregierung,14050,speech,18
18,524326,https://www.abgeordnetenwatch.de/profile/norbert-lammert,18,56,Präsident Dr. Norbert Lammert,Dr. Norbert Lammert,norbert-lammert,1754,,Kollegin Amtsberg.,TOP 1 Befragung der Bundesregierung,14050,chair,18
19,524327,https://www.abgeordnetenwatch.de/profile/luise-amtsberg-2/archive/217187,19,56,Luise Amtsberg (BÜNDNIS 90/DIE GRÜNEN),Luise Amtsberg,luise-amtsberg,1549,gruene,"Frau Ministerin, mich hat die Antwort nicht zufriedengestellt. Wir haben natürlich als grüne Fraktion Gipfel kritisiert, die keinen Sinn machen.",TOP 1 Befragung der Bundesregierung,14050,speech,18
20,524328,,20,56,,,,,,Lachen bei der CDU/CSU,TOP 1 Befragung der Bundesregierung,14050,poi,18
21,524329,https://www.abgeordnetenwatch.de/profile/luise-amtsberg-2/archive/217187,21,56,Luise Amtsberg (BÜNDNIS 90/DIE GRÜNEN),Luise Amtsberg,luise-amtsberg,1549,gruene,"Mit unserer Forderung stehen wir aber nicht alleine, sondern es gibt prominente Unterstützer, zum Beispiel den Deutschen Städtetag. Die Unterstützer sagen allesamt: Es stimmt, dass die Kommunen momentan große Schwierigkeiten haben, und sie brauchen eine Koordinierung. Wir müssen flexible Lösungen finden.

Deshalb noch einmal die Frage: Gibt es wenigstens, was die finanzielle Entlastung angeht, irgendwelche Planungen seitens der Bundesregierung, sich an der Finanzierung der Unterbringung der Flüchtlinge zu beteiligen? Das ist das, was die Kommunen tatsächlich fordern.",TOP 1 Befragung der Bundesregierung,14050,speech,18
22,524330,https://www.abgeordnetenwatch.de/profile/barbara-hendricks-0,22,56,"Dr. Barbara Hendricks, Bundesministerin für Umwelt, Naturschutz, Bau und Reaktorsicherheit",Dr. Barbara Hendricks,barbara-hendricks,1796,,"Ich weiß, dass die Kommunen das fordern. Überlegungen dazu sind in der Bundesregierung nicht abgeschlossen. Im Übrigen wird sich die Innenministerkonferenz zeitnah, nämlich nächste Woche, am 17. Oktober 2014, mit der Thematik befassen.",TOP 1 Befragung der Bundesregierung,14050,speech,18
23,524331,https://www.abgeordnetenwatch.de/profile/norbert-lammert,23,56,Präsident Dr. Norbert Lammert,Dr. Norbert Lammert,norbert-lammert,1754,,Kollege Kühn.,TOP 1 Befragung der Bundesregierung,14050,chair,18
24,524332,,24,56,Christian Kühn (Tübingen) (BÜNDNIS 90/DIE GRÜNEN),Christian Kühn,christian-kuhn,,gruene,"Auch ich kann Sie noch nicht rauslassen. Noch eine Frage zur BImA: Plant die Bundesregierung, Wohnungen, Grundstücke, Liegenschaften zu dem Zweck, den Asylsuchenden, den Flüchtlingen ein Dach über dem Kopf zu geben, verbilligt an die Kommunen abzugeben? Gilt weiterhin das Höchstpreisgebot auch vor dem Hintergrund dieser Notsituation, in der die Kommunen händeringend nach Liegenschaften suchen? Gibt es eine verbilligte Abgabe, zum Beispiel für Kommunen, die sich in einer Haushaltsnotsituation befinden? Ist vielleicht geplant, die Grundstücke zu einer verbilligten Pacht abzugeben?",TOP 1 Befragung der Bundesregierung,14050,speech,18
25,524333,https://www.abgeordnetenwatch.de/profile/barbara-hendricks-0,25,56,"Dr. Barbara Hendricks, Bundesministerin für Umwelt, Naturschutz, Bau und Reaktorsicherheit",Dr. Barbara Hendricks,barbara-hendricks,1796,,"Herr Kollege, in dieser Notsituation geht es nicht darum, dass die BImA Immobilien veräußert, sondern die BImA stellt den Kommunen Mietobjekte zur Verfügung. Wir müssen davon ausgehen, dass Kommunen auf Dauer zum Beispiel mit Kasernen nicht wirklich etwas anfangen können. In manchen Ballungsgebieten kann man sie sicherlich gut in Wohnraum umwandeln; dies ist aber längst nicht überall dort der Fall, wo Kasernen von der Bundeswehr oder von Gaststreitkräften freigemacht wurden. Deshalb geht es hier nicht um Veräußerungen, sondern allenfalls um Vermietung. Die BImA prüft das regelmäßig mit gutem Ergebnis.",TOP 1 Befragung der Bundesregierung,14050,speech,18
26,524334,https://www.abgeordnetenwatch.de/profile/norbert-lammert,26,56,Präsident Dr. Norbert Lammert,Dr. Norbert Lammert,norbert-lammert,1754,,Gibt es weitere Wortmeldungen zu diesem Themenkomplex? - Bitte schön.,TOP 1 Befragung der Bundesregierung,14050,chair,18
27,524335,https://www.abgeordnetenwatch.de/profile/harald-petzold/archive/215422,27,56,Harald Petzold (Havelland) (DIE LINKE),Harald Petzold,harald-petzold,1413,linke,"Herr Präsident, ich würde gerne eine Nachfrage zu der letzten Antwort stellen. Mich würde interessieren, wie die Instandsetzungsarbeiten, die die Kommunen vornehmen, vergütet, abgegolten oder gegengerechnet werden. Das wäre ja sonst sozusagen ein Geschäft zugunsten des Bundes, wenn er die Liegenschaften lediglich vermietet.",TOP 1 Befragung der Bundesregierung,14050,speech,18
28,524336,https://www.abgeordnetenwatch.de/profile/barbara-hendricks-0,28,56,"Dr. Barbara Hendricks, Bundesministerin für Umwelt, Naturschutz, Bau und Reaktorsicherheit",Dr. Barbara Hendricks,barbara-hendricks,1796,,"Herr Kollege, ich glaube, dass es am besten ist, wenn die Kommunen und die BImA sich im Einzelfall verständigen, auf welche Art und Weise die Kommunen eine BImA-Liegenschaft übernehmen wollen. Der Regelfall wird die Anmietung sein. Weiter gehende Fragestellungen zur Ausgestaltung der Verträge wird der Kollege Meister sicherlich schriftlich beantworten. Herzlichen Dank.",TOP 1 Befragung der Bundesregierung,14050,speech,18
29,524337,,29,56,,,,,,"Heiterkeit bei der SPD, der CDU/CSU und der LINKEN",TOP 1 Befragung der Bundesregierung,14050,poi,18
30,524338,https://www.abgeordnetenwatch.de/profile/norbert-lammert,30,56,Präsident Dr. Norbert Lammert,Dr. Norbert Lammert,norbert-lammert,1754,,"Die Begeisterung ist wechselseitig. - Ich darf fragen, ob es zu anderen Themen der heutigen Kabinettssitzung Fragen gibt. - Frau Haßelmann.",TOP 1 Befragung der Bundesregierung,14050,chair,18
31,524339,https://www.abgeordnetenwatch.de/profile/britta-haselmann-0,31,56,Britta Haßelmann (BÜNDNIS 90/DIE GRÜNEN),Britta Haßelmann,britta-haßelmann,1807,gruene,"Nicht zur Kabinettssitzung, Entschuldigung, sondern zu einem anderen Thema.",TOP 1 Befragung der Bundesregierung,14050,speech,18
32,524340,https://www.abgeordnetenwatch.de/profile/norbert-lammert,32,56,Präsident Dr. Norbert Lammert,Dr. Norbert Lammert,norbert-lammert,1754,,"Nein, das machen wir der Reihe nach. - Also, gibt es Fragen zu anderen Themen der heutigen Kabinettssitzung? - Herr Kekeritz, bitte schön.",TOP 1 Befragung der Bundesregierung,14050,chair,18
33,524341,https://www.abgeordnetenwatch.de/profile/uwe-kekeritz/archive/215289,33,56,Uwe Kekeritz (BÜNDNIS 90/DIE GRÜNEN),Uwe Kekeritz,uwe-kekeritz,1467,gruene,"Danke schön. - Ich hoffe, dass die Frage jetzt richtig ist.",TOP 1 Befragung der Bundesregierung,14050,speech,18
34,524342,https://www.abgeordnetenwatch.de/profile/norbert-lammert,34,56,Präsident Dr. Norbert Lammert,Dr. Norbert Lammert,norbert-lammert,1754,,Sonst sage ich Ihnen das schon.,TOP 1 Befragung der Bundesregierung,14050,chair,18
35,524343,https://www.abgeordnetenwatch.de/profile/uwe-kekeritz/archive/215289,35,56,Uwe Kekeritz (BÜNDNIS 90/DIE GRÜNEN),Uwe Kekeritz,uwe-kekeritz,1467,gruene,"Ja. - Wir kennen ja die Situation in der Ostukraine. Minister Müller hat angekündigt, einen Konvoi in die Ostukraine zu schicken. Ich möchte wissen, ob das heute im Kabinett Thema war. Ich möchte wissen, ob dies zwischen den einzelnen Ministerien, insbesondere zwischen AA und BMZ, abgesprochen war. Ich möchte gerne auch wissen, ob klar ist, wer das logistisch managt. Wenn man 100 Lkw in die Ostukraine schickt, dann müssen ja sehr viele finanzielle Mittel dort hineinfließen. Ist das abgesprochen worden, und woher kommt das Geld?",TOP 1 Befragung der Bundesregierung,14050,speech,18
36,524344,https://www.abgeordnetenwatch.de/profile/norbert-lammert,36,56,Präsident Dr. Norbert Lammert,Dr. Norbert Lammert,norbert-lammert,1754,,Frau Ministerin.,TOP 1 Befragung der Bundesregierung,14050,chair,18
37,524345,https://www.abgeordnetenwatch.de/profile/barbara-hendricks-0,37,56,"Dr. Barbara Hendricks, Bundesministerin für Umwelt, Naturschutz, Bau und Reaktorsicherheit",Dr. Barbara Hendricks,barbara-hendricks,1796,,Ich?,TOP 1 Befragung der Bundesregierung,14050,speech,18
