,id,profile_url,sequence,sitzung,speaker,speaker_cleaned,speaker_fp,speaker_key,speaker_party,text,top,top_id,type,wahlperiode
466,524774,https://www.abgeordnetenwatch.de/profile/christine-buchholz-0,466,56,Christine Buchholz (DIE LINKE),Christine Buchholz,christine-buchholz,1336,linke,"Es ist nicht so, dass es in allererster Linie handwerkliche Probleme gibt; nein, das Problem hat System:

Erstens. In allen Projektgruppen, die diesen Beschaffungsprozess prägen, saßen von Anfang an Vertreter der Rüstungsindustrie. Sie werden mit daran beteiligt, die sogenannten Fähigkeitslücken zu definieren. So war beispielsweise EADS Hauptauftragnehmer für die Erstellung der Systemkonzeptstudie zum Euro Hawk.

Zweitens. Ministerium und Rüstungsindustrie teilen das Interesse, die Bundeswehr global in Einsatz zu bringen, und dies bei größtmöglicher Eigenständigkeit gegenüber amerikanischen Partnern und russischen Rivalen.

Drittens. Über Personen kann man das Ganze auch plastisch machen. Ich verweise auf den ehemaligen Minister für wirtschaftliche Zusammenarbeit und Entwicklung Dirk Niebel, der nun Rüstungslobbyist bei Rheinmetall wird, oder auf Tom Enders, den jetzigen Vorstandsvorsitzenden der Airbus Group, der in der Vergangenheit als Beamter im Verteidigungsministerium gewirkt hat und bis 2011 Mitglied der CSU war. Es wundert nicht, dass die Regelung der Regierung zu Karenzzeiten ein zahnloser Tiger ist.",TOP ZP 1 Aktuelle Stunde zum Rüstungsbericht und Beschaffungswesen der Bundeswehr,14052,speech,18
467,524775,,467,56,,,,,,Beifall bei der LINKEN,TOP ZP 1 Aktuelle Stunde zum Rüstungsbericht und Beschaffungswesen der Bundeswehr,14052,poi,18
468,524776,https://www.abgeordnetenwatch.de/profile/christine-buchholz-0,468,56,Christine Buchholz (DIE LINKE),Christine Buchholz,christine-buchholz,1336,linke,"Wie geht die Rüstungsindustrie mit dem Bericht um? Sie jammert ja immer viel; dabei ist die Realität, dass deren Jahresumsatz 2013 knapp 30 Milliarden Euro betrug. Seit 2005 wächst die Rüstungsindustrie jährlich im Schnitt um 4,3 Prozent. Sie ist gierig. Sie verlangt mehr. Adamowitsch, der Hauptgeschäftsführer des Bundesverbandes der Deutschen Sicherheits- und Verteidigungs-industrie, fordert jetzt, dass die Deckelung von Gewinnmargen aufgebrochen wird. Meine Damen und Herren, das kann doch nicht wahr sein!",TOP ZP 1 Aktuelle Stunde zum Rüstungsbericht und Beschaffungswesen der Bundeswehr,14052,speech,18
469,524777,,469,56,,,,,,Beifall bei der LINKEN,TOP ZP 1 Aktuelle Stunde zum Rüstungsbericht und Beschaffungswesen der Bundeswehr,14052,poi,18
470,524778,https://www.abgeordnetenwatch.de/profile/christine-buchholz-0,470,56,Christine Buchholz (DIE LINKE),Christine Buchholz,christine-buchholz,1336,linke,"Frau von der Leyen produziert weiter Kosten für den Steuerzahler. Denn anstatt die ausufernden Kosten einzudämmen, kündigt das BMVg jetzt im Begleitschreiben zum KPMG-Bericht an, dass noch in diesem Jahr mehrere wichtige Rüstungsbeschaffungsentscheidungen auf den Weg gebracht werden sollen.

In diesem Zusammenhang kurz ein Wort zum Euro Hawk: Ich halte es für eine absolute Schnapsidee, den Euro Hawk, der bereits eine halbe Milliarde Euro verschlungen hat, aus der Mottenkiste zu holen.",TOP ZP 1 Aktuelle Stunde zum Rüstungsbericht und Beschaffungswesen der Bundeswehr,14052,speech,18
471,524779,https://www.abgeordnetenwatch.de/profile/florian-hahn/archive/214928,471,56,Florian Hahn [CDU/CSU],Florian Hahn,florian-hahn,1498,cducsu,Was wollen Sie stattdessen machen?,TOP ZP 1 Aktuelle Stunde zum Rüstungsbericht und Beschaffungswesen der Bundeswehr,14052,poi,18
472,524780,https://www.abgeordnetenwatch.de/profile/christine-buchholz-0,472,56,Christine Buchholz (DIE LINKE),Christine Buchholz,christine-buchholz,1336,linke,Die Kostenexplosion ist vorprogrammiert. Von daher: Ersparen Sie dem Steuerzahler dieses weitere Milliardengrab.,TOP ZP 1 Aktuelle Stunde zum Rüstungsbericht und Beschaffungswesen der Bundeswehr,14052,speech,18
473,524781,,473,56,,,,,,Beifall bei der LINKEN,TOP ZP 1 Aktuelle Stunde zum Rüstungsbericht und Beschaffungswesen der Bundeswehr,14052,poi,18
474,524782,https://www.abgeordnetenwatch.de/profile/christine-buchholz-0,474,56,Christine Buchholz (DIE LINKE),Christine Buchholz,christine-buchholz,1336,linke,"Die Regierung, Frau von der Leyen, die CDU nutzen die jetzige Debatte,",TOP ZP 1 Aktuelle Stunde zum Rüstungsbericht und Beschaffungswesen der Bundeswehr,14052,speech,18
475,524783,https://www.abgeordnetenwatch.de/profile/florian-hahn/archive/214928,475,56,Florian Hahn [CDU/CSU],Florian Hahn,florian-hahn,1498,cducsu,"Die CSU auch, Frau Buchholz!",TOP ZP 1 Aktuelle Stunde zum Rüstungsbericht und Beschaffungswesen der Bundeswehr,14052,poi,18
476,524784,https://www.abgeordnetenwatch.de/profile/christine-buchholz-0,476,56,Christine Buchholz (DIE LINKE),Christine Buchholz,christine-buchholz,1336,linke,"um eine weitere Diskussion voranzutreiben, nämlich die über die perspektivische Erhöhung des Rüstungsetats. Sie fordern mehr Geld für Rüstung in der Zukunft. Wir sagen Nein. Nutzen Sie jetzt nicht die Diskussion über die aufgetretenen Mängel, um an dieser Stelle Druck zu machen. Eine Erhöhung des Rüstungsetats werden wir, die Linke, nie mitmachen.",TOP ZP 1 Aktuelle Stunde zum Rüstungsbericht und Beschaffungswesen der Bundeswehr,14052,speech,18
477,524785,,477,56,,,,,,Beifall bei der LINKEN,TOP ZP 1 Aktuelle Stunde zum Rüstungsbericht und Beschaffungswesen der Bundeswehr,14052,poi,18
478,524786,https://www.abgeordnetenwatch.de/profile/henning-otte/archive/214538,478,56,Henning Otte [CDU/CSU],Henning Otte,henning-otte,1715,cducsu,"Wer soll denn die Hilfsgüter in den Nordirak bringen, Frau Buchholz?",TOP ZP 1 Aktuelle Stunde zum Rüstungsbericht und Beschaffungswesen der Bundeswehr,14052,poi,18
479,524787,https://www.abgeordnetenwatch.de/profile/christine-buchholz-0,479,56,Christine Buchholz (DIE LINKE),Christine Buchholz,christine-buchholz,1336,linke,"Internationale Verantwortung bedeutet die Abkehr von immer mehr militärischen Einsätzen. Internationale Verantwortung heißt Abrüstung. Sie setzt auf zivile Krisenlösungen. Internationale Verantwortung heißt auch, endlich den Filz zwischen Rüstungsindustrie und Politik aufzulösen.",TOP ZP 1 Aktuelle Stunde zum Rüstungsbericht und Beschaffungswesen der Bundeswehr,14052,speech,18
480,524788,,480,56,,,,,,Beifall bei der LINKEN,TOP ZP 1 Aktuelle Stunde zum Rüstungsbericht und Beschaffungswesen der Bundeswehr,14052,poi,18
481,524789,,481,56,Vizepräsident Peter Hintze,Peter Hintze,peter-hintze,,,"Als nächstem Redner erteile ich das Wort dem Abgeordneten Thomas Hitschler, SPD-Fraktion.",TOP ZP 1 Aktuelle Stunde zum Rüstungsbericht und Beschaffungswesen der Bundeswehr,14052,chair,18
482,524790,,482,56,,,,,,Beifall bei der SPD,TOP ZP 1 Aktuelle Stunde zum Rüstungsbericht und Beschaffungswesen der Bundeswehr,14052,poi,18
483,524791,https://www.abgeordnetenwatch.de/profile/thomas-hitschler/archive/216937,483,56,Thomas Hitschler (SPD),Thomas Hitschler,thomas-hitschler,1624,spd,"Sehr geehrter Herr Präsident! Liebe Kolleginnen und Kollegen! Ich bin dem Verteidigungsministerium ausgesprochen dankbar für diesen Bericht, auch wenn ich mich gefreut hätte, ihn vor der Presse zu Gesicht zu bekommen; aber da bin ich vielleicht etwas zu altmodisch.

Dass es beim Material der Bundeswehr Probleme gibt, ist nicht neu, das Ausmaß der Herausforderung allerdings schon. Das haben die alarmierenden Nachrichten der letzten Wochen unterstrichen. Eine kritische und gleichzeitig schonungslose Analyse ist absolut notwendig, um diese Herausforderung zu meistern. Eine solche Analyse liegt jetzt vor und offenbart in manchen Bereichen, dass in den letzten Jahren Fehlentscheidungen getroffen wurden.

Ich will diese Aktuelle Stunde nutzen, um auf einen Punkt hinzuweisen, der in diesem Papier zu wenig Beachtung findet. Baustellen gibt es nämlich nicht nur bei den Großprojekten; auch ein Blick auf die persönliche Ausstattung der Soldatinnen und Soldaten lohnt sich.

Ich habe diesen Sommer genutzt, um viele Bundeswehrstandorte in unserer Republik zu besuchen. Besonders erschreckt haben mich Berichte, die ich in der letzten Woche erhalten habe. Bei einem Einsatzverband im Südwesten wurde mir ein Problem deutlich vor Augen geführt. Mir wurde berichtet, dass die materielle Einsatzbereitschaft der Grundausstattung bei Teilen der Truppe bei nur 20 Prozent liegt. Handfeuerwaffen und Nachtsichtgeräte sind nur zum Teil verfügbar.

Liebe Kolleginnen und Kollegen, aus dem Bericht, den die Soldaten mir vorgelegt haben, wurde deutlich, dass auch für die Ausbildung eine entsprechende Ausrüstung dringend nötig ist. Nur wenn die Soldatinnen und Soldaten bestens ausgebildet sind, auch bei Tag und Nacht mit der Ausrüstung üben können, können sie den hohen Grad an Einsatzbereitschaft zeigen, den wir alle von ihnen fordern. Das ist nämlich unser Auftrag, Kolleginnen und Kollegen, den wir den Soldatinnen und Soldaten geben.

Gerade bei den Fallschirmjägern haben sich große Probleme gezeigt, also bei denen, die als Erste in den Einsatz geschickt werden und als Erste im Gefecht stehen. Die Situation ist, so meine ich, schlicht unzumutbar und auf dem schnellsten Wege zu ändern. Nur so können wir die Sicherheit unserer Soldatinnen und Soldaten gewährleisten und auch unserer Verantwortung als Auftraggeber nachkommen.

Ich hoffe, hier handelt es sich nur um ein Verteilungsproblem und nicht um ein grundsätzliches Beschaffungsproblem. Die Kosten sind im Vergleich relativ gering. Deshalb bitte ich das Verteidigungsministerium, sich dieses Punktes unverzüglich anzunehmen.

Um ähnliche Probleme auch bei anderen Standorten auszumachen, brauchen wir zusätzliche Sachstandsberichte, Sachstandsberichte über die einzelnen Verbände. Der Ausrüstungsstand sollte überall bei 100 Prozent liegen. Das muss das ausgemachte Ziel sein, Kolleginnen und Kollegen.",TOP ZP 1 Aktuelle Stunde zum Rüstungsbericht und Beschaffungswesen der Bundeswehr,14052,speech,18
484,524792,,484,56,,,,,,Beifall bei der SPD,TOP ZP 1 Aktuelle Stunde zum Rüstungsbericht und Beschaffungswesen der Bundeswehr,14052,poi,18
485,524793,https://www.abgeordnetenwatch.de/profile/thomas-hitschler/archive/216937,485,56,Thomas Hitschler (SPD),Thomas Hitschler,thomas-hitschler,1624,spd,"Kritik zu äußern ist relativ einfach und bequem - das haben wir heute schon mindestens zweimal gesehen -; Kritik anzunehmen, Lösungen zu erarbeiten und umzusetzen ist eine andere Frage.",TOP ZP 1 Aktuelle Stunde zum Rüstungsbericht und Beschaffungswesen der Bundeswehr,14052,speech,18
486,524794,,486,56,,,,,,Zuruf des Abg. Wolfgang Gehrcke [DIE LINKE],TOP ZP 1 Aktuelle Stunde zum Rüstungsbericht und Beschaffungswesen der Bundeswehr,14052,poi,18
487,524795,https://www.abgeordnetenwatch.de/profile/thomas-hitschler/archive/216937,487,56,Thomas Hitschler (SPD),Thomas Hitschler,thomas-hitschler,1624,spd,"Die wichtigste Leistung dieses Berichts ist es, die schlimmsten Mängel schonungslos offenzulegen. Damit muss aber auch die Geheimhaltungs- und Verschleierungskultur der letzten Jahre ein Ende haben. Ein solcher Kulturwechsel wäre wirklich der größte Erfolg dieses Berichts und für das Parlament unabdingbar.

Neben der Analyse finden sich auch konkrete und, wie ich finde, meist vernünftige Handlungsempfehlungen in diesem Papier, die für uns auch die Ursachen aufzeigen, und das heißt nicht automatisch: mehr Geld! Wer reflexartig ausschließlich mehr Geld als Lösung fordert, der hat den Bericht entweder nicht gelesen oder nicht verstanden. Die massive Geldverschwendung bei den Rüstungsprojekten ist doch gerade Teil des Problems, und damit muss jetzt Schluss sein, Kolleginnen und Kollegen.",TOP ZP 1 Aktuelle Stunde zum Rüstungsbericht und Beschaffungswesen der Bundeswehr,14052,speech,18
488,524796,,488,56,,,,,,Beifall bei der SPD,TOP ZP 1 Aktuelle Stunde zum Rüstungsbericht und Beschaffungswesen der Bundeswehr,14052,poi,18
489,524797,https://www.abgeordnetenwatch.de/profile/thomas-hitschler/archive/216937,489,56,Thomas Hitschler (SPD),Thomas Hitschler,thomas-hitschler,1624,spd,"Dafür brauchen wir vor allem eines - das wurde in der Debatte wirklich deutlich -: Wir brauchen ein besseres Management. „Besseres Management“ heißt für mich: mehr Fachpersonal. Das Kaputtsparen bei den zivilen und militärischen Beschäftigten rechnet sich nicht; auch das zeigt der Bericht deutlich. Nur so können wir wieder auf Augenhöhe mit der Industrie verhandeln. Eigene Fachexpertise ist da dringend notwendig.

Die Bundeswehr braucht, so meine ich, ein besseres Personalmanagement mit nachhaltigen Personalentwicklungsplänen und gezielten Förderprogrammen für den gesamten Personalkörper; denn der Arbeitgeber Bundeswehr wird nur dann attraktiv, wenn wir den nachfolgenden Generationen eine Perspektive aufzeigen. Wenn wir das jetzt nicht anpacken, fällt uns der Fachkräftemangel in den nächsten Jahren deutlich und noch stärker auf die Füße, und die Probleme werden noch größer.

Auf den Prüfstand gehört ebenso das Konzept „Breite vor Tiefe“. Es hat sich weder bewährt, noch ist es zeitgemäß. Der Debattenanstoß um Schlüsselqualifikationen der Rüstungsindustrie ist daher wichtig. Dafür bin ich Ihnen auch sehr dankbar.

Wir werden also schauen müssen: Was können wir besonders gut, auch und gerade mit Blick auf unsere Verbündeten? Die Entwicklung wird daher zwangsläufig in Richtung einer europäischen Armee gehen müssen. Es ist schlicht ineffektiv und veraltet, im nationalen Klein-Klein jede Fähigkeit ein bisschen beherrschen zu wollen; noch schlimmer wäre es, eine Fähigkeit gar nicht zu beherrschen. Wir müssen stattdessen Kernprofile schärfen, in denen die Bundeswehr Topleistungen bringt, und diese dann auch mit den Topleistungen unserer Freunde und Partner kombinieren. So geht eine moderne, schlagkräftige und effektive Verteidigungspolitik für Europa, liebe Kolleginnen und Kollegen.

Dieser Bericht ist ein mutiger und wichtiger erster Schritt. Den Ankündigungen müssen jetzt aber auch Taten folgen. Die Handlungsempfehlungen müssen analysiert werden, sie müssen in konkrete Vorhaben gegossen werden, und sie müssen umgesetzt werden. Wir werden diesen Prozess mit allen Kräften unterstützen. Und wir laden auch die Opposition ein: Auch Vorschläge von ihr sind hier gefragt, nicht nur unsachliche Kritik.

Vielen Dank.",TOP ZP 1 Aktuelle Stunde zum Rüstungsbericht und Beschaffungswesen der Bundeswehr,14052,speech,18
490,524798,,490,56,,,,,,Beifall bei der SPD sowie bei Abgeordneten der CDU/CSU,TOP ZP 1 Aktuelle Stunde zum Rüstungsbericht und Beschaffungswesen der Bundeswehr,14052,poi,18
491,524799,,491,56,Vizepräsident Peter Hintze,Peter Hintze,peter-hintze,,,"Als nächster Rednerin erteile ich das Wort der Abgeordneten Agnieszka Brugger, Bündnis 90/Die Grünen.",TOP ZP 1 Aktuelle Stunde zum Rüstungsbericht und Beschaffungswesen der Bundeswehr,14052,chair,18
492,524800,https://www.abgeordnetenwatch.de/profile/agnieszka-brugger-0,492,56,Agnieszka Brugger (BÜNDNIS 90/DIE GRÜNEN),Agnieszka Brugger,agnieszka-brugger,1335,gruene,"Herr Präsident! Meine Damen und Herren! Liebe Frau Ministerin von der Leyen, nicht nur weil Sie heute Geburtstag haben, zu dem ich Ihnen natürlich auch ganz herzlich gratulieren möchte,",TOP ZP 1 Aktuelle Stunde zum Rüstungsbericht und Beschaffungswesen der Bundeswehr,14052,speech,18
493,524801,https://www.abgeordnetenwatch.de/profile/florian-hahn/archive/214928,493,56,Florian Hahn [CDU/CSU],Florian Hahn,florian-hahn,1498,cducsu,Hast du schon!,TOP ZP 1 Aktuelle Stunde zum Rüstungsbericht und Beschaffungswesen der Bundeswehr,14052,poi,18
494,524802,https://www.abgeordnetenwatch.de/profile/agnieszka-brugger-0,494,56,Agnieszka Brugger (BÜNDNIS 90/DIE GRÜNEN),Agnieszka Brugger,agnieszka-brugger,1335,gruene,"möchte ich einen Schritt zurücktreten von der üblichen Oppositions-Regierungs-Logik; denn normalerweise sind ja Rüstungsdesaster, plump gesprochen, ein gefundenes Fressen für die Opposition. Nein, ich wünsche mir wirklich, dass es Ihnen gelingt, das umzusetzen, woran all Ihre männlichen Vorgänger gescheitert sind, nämlich beim Thema Rüstungsprojekte bei der Bundeswehr einmal ganz grundsätzlich aufzuräumen.",TOP ZP 1 Aktuelle Stunde zum Rüstungsbericht und Beschaffungswesen der Bundeswehr,14052,speech,18
495,524803,,495,56,,,,,,Beifall beim BÜNDNIS 90/DIE GRÜNEN sowie bei Abgeordneten der SPD,TOP ZP 1 Aktuelle Stunde zum Rüstungsbericht und Beschaffungswesen der Bundeswehr,14052,poi,18
496,524804,https://www.abgeordnetenwatch.de/profile/florian-hahn/archive/214928,496,56,Florian Hahn [CDU/CSU],Florian Hahn,florian-hahn,1498,cducsu,Männerfeindlich! Das finde ich diskriminierend!,TOP ZP 1 Aktuelle Stunde zum Rüstungsbericht und Beschaffungswesen der Bundeswehr,14052,poi,18
497,524805,https://www.abgeordnetenwatch.de/profile/henning-otte/archive/214538,497,56,Henning Otte [CDU/CSU],Henning Otte,henning-otte,1715,cducsu,Da muss der Präsident einschreiten!,TOP ZP 1 Aktuelle Stunde zum Rüstungsbericht und Beschaffungswesen der Bundeswehr,14052,poi,18
498,524806,https://www.abgeordnetenwatch.de/profile/agnieszka-brugger-0,498,56,Agnieszka Brugger (BÜNDNIS 90/DIE GRÜNEN),Agnieszka Brugger,agnieszka-brugger,1335,gruene,"Es gibt gravierende Mängel, es gibt große Probleme, einerseits beim alten Material, andererseits aber auch bei den Projekten, die neu zulaufen. Sie müssen für die Lösung all dieser Probleme ein schlüssiges Gesamtkonzept bringen. Sie müssen kurzfristige, aber auch langfristige und strukturelle Lösungen jetzt endlich auf den Tisch legen.

Viele Empfehlungen, wie das gehen könnte, wie man durch Drehen an der einen oder anderen Schraube etwas verbessern könnte, stehen in dem Gutachten, das heute schon erwähnt wurde und über das wir schon viel diskutiert haben. Es hat 1,4 Millionen Euro gekostet, ist über 1 000 Seiten dick und stellt dem Rüstungswesen bei der Bundeswehr, aber auch den Reformen, die Ihr Vorgänger de Maizière an dieser Stelle durchgeführt hat, ein verheerendes Zeugnis aus. Es ist deutlich: Es gibt viele Probleme, es gibt Chaos bei der Projektsteuerung, schlechte Verträge, unübersichtliche Zuständigkeiten und widerstreitende Interessen.

Frau von der Leyen, in Ihrem Haus weiß offensichtlich die eine Hand nicht, was die andere tut. Beenden Sie dieses Missmanagement und diese ineffizienten Strukturen! Sorgen Sie für mehr Transparenz und für eine offene und ehrliche Kommunikation in dieser Frage!",TOP ZP 1 Aktuelle Stunde zum Rüstungsbericht und Beschaffungswesen der Bundeswehr,14052,speech,18
499,524807,,499,56,,,,,,Beifall beim BÜNDNIS 90/DIE GRÜNEN,TOP ZP 1 Aktuelle Stunde zum Rüstungsbericht und Beschaffungswesen der Bundeswehr,14052,poi,18
500,524808,https://www.abgeordnetenwatch.de/profile/agnieszka-brugger-0,500,56,Agnieszka Brugger (BÜNDNIS 90/DIE GRÜNEN),Agnieszka Brugger,agnieszka-brugger,1335,gruene,"Denn es muss Schluss sein mit einer Kultur, bei der Probleme immer wieder übersehen, vertuscht oder kleingeredet werden.

Sie haben aber jetzt schon - und das macht mich sehr skeptisch, dass Sie Ihre Ankündigungen wirklich umsetzen - so gut wie ausgeschlossen, dass Sie sich ganz grundsätzlich an die Organisationsstruktur wagen. Da muss ich sagen: So ernst nehmen Sie also Ihr eigenes teures Gutachten! Ich würde sagen, Sie sollten es annehmen und umsetzen, was Ihnen da ins Hausaufgabenheft geschrieben worden ist.",TOP ZP 1 Aktuelle Stunde zum Rüstungsbericht und Beschaffungswesen der Bundeswehr,14052,speech,18
501,524809,,501,56,,,,,,Beifall beim BÜNDNIS 90/DIE GRÜNEN,TOP ZP 1 Aktuelle Stunde zum Rüstungsbericht und Beschaffungswesen der Bundeswehr,14052,poi,18
502,524810,https://www.abgeordnetenwatch.de/profile/agnieszka-brugger-0,502,56,Agnieszka Brugger (BÜNDNIS 90/DIE GRÜNEN),Agnieszka Brugger,agnieszka-brugger,1335,gruene,"Es gibt schon jetzt einige Zweifel daran, dass Sie wirklich das anpacken wollen, was Sie uns hier an dieser Stelle vollmundig versprochen haben.

Ich möchte ein anderes Beispiel nennen: Das Dokument sagt zu der Frage, wie es mit der Aufklärungsdrohne Euro Hawk, dem riesigen Flopprojekt aus dem letzten Sommer, weitergehen soll, sehr klar: Dieser Punkt ist noch nicht entscheidungsreif. - Da habe ich persönlich schon sehr gestaunt, als ich Sie am Sonntag, also einen Tag bevor das Gutachten übergeben wurde, im Fernsehen gesehen habe und Sie wörtlich gesagt haben - ich zitiere -:

… für die Serienreife, also wenn wir dann in den Normalbetrieb gehen, werden wir ein anderes Flugzeug nehmen, eine andere Drohne, die heißt Triton, die ist aus den USA.

Und das, obwohl es die gleichen Probleme wie beim Euro Hawk geben wird! Wenn das die neue Beschaffungspolitik à la Frau von der Leyen sein soll, dann sage ich nicht nur „Gute Nacht!“, sondern sage Ihnen auch voraus: Da stolpern Sie sehenden Auges genau in die Falle, in die Ihr Vorgänger de Maizière getappt ist.",TOP ZP 1 Aktuelle Stunde zum Rüstungsbericht und Beschaffungswesen der Bundeswehr,14052,speech,18
503,524811,,503,56,,,,,,Beifall beim BÜNDNIS 90/DIE GRÜNEN,TOP ZP 1 Aktuelle Stunde zum Rüstungsbericht und Beschaffungswesen der Bundeswehr,14052,poi,18
504,524812,https://www.abgeordnetenwatch.de/profile/agnieszka-brugger-0,504,56,Agnieszka Brugger (BÜNDNIS 90/DIE GRÜNEN),Agnieszka Brugger,agnieszka-brugger,1335,gruene,"Frau von der Leyen, Sie haben hier vorhin gesagt, es solle nicht nur um Problembeschreibungen gehen, jetzt gehe es um Lösungsvorschläge. Aber dazu muss ich ehrlich sagen: Ich habe bisher nicht viel gehört. Es wird zwei Task Forces geben, einen Lenkungsausschuss; es soll eine neue Kultur geben. Ich glaube, da müssen Sie noch einmal viel grundsätzlicher ran und auch sagen, was Sie aus dem Gutachten an der Stelle umsetzen wollen.

Sie haben jetzt auch das Thema Rüstungsindustrie angesprochen. Sie haben die Schlüsselfähigkeiten, die die wehrtechnische Industrie in Deutschland haben sollte, benannt. Es ist sicherlich eine Grundursache für die Probleme, die wir im Beschaffungsbereich haben - die sind ja auch schon genannt worden -, dass viel zu oft indus-triepolitische Interessen Vorrang hatten vor außen- und sicherheitspolitischen Begründungen, Vorrang hatten vor den Notwendigkeiten für die Bundeswehr und auch den finanziellen Rahmenbedingungen. Aber nach dem, was der Kollege Otte und der Kollege Arnold gerade hier gesagt haben, habe ich auch an der Stelle große Skepsis, dass Sie Ihren Vorschlag so werden umsetzen können.",TOP ZP 1 Aktuelle Stunde zum Rüstungsbericht und Beschaffungswesen der Bundeswehr,14052,speech,18
505,524813,,505,56,,,,,,Beifall beim BÜNDNIS 90/DIE GRÜNEN,TOP ZP 1 Aktuelle Stunde zum Rüstungsbericht und Beschaffungswesen der Bundeswehr,14052,poi,18
506,524814,https://www.abgeordnetenwatch.de/profile/agnieszka-brugger-0,506,56,Agnieszka Brugger (BÜNDNIS 90/DIE GRÜNEN),Agnieszka Brugger,agnieszka-brugger,1335,gruene,"Liebe Kolleginnen und Kollegen aus dem Verteidigungsausschuss, nach fünf Jahren in diesem Ausschuss muss ich sagen: Mir reicht es an dieser Stelle.",TOP ZP 1 Aktuelle Stunde zum Rüstungsbericht und Beschaffungswesen der Bundeswehr,14052,speech,18
507,524815,https://www.abgeordnetenwatch.de/profile/ingo-gadechens/archive/214476,507,56,Ingo Gädechens [CDU/CSU],Ingo Gädechens,ingo-gadechens,1823,cducsu,"Ja, dann -wechseln!",TOP ZP 1 Aktuelle Stunde zum Rüstungsbericht und Beschaffungswesen der Bundeswehr,14052,poi,18
508,524816,https://www.abgeordnetenwatch.de/profile/agnieszka-brugger-0,508,56,Agnieszka Brugger (BÜNDNIS 90/DIE GRÜNEN),Agnieszka Brugger,agnieszka-brugger,1335,gruene,"Ich finde, das Vertrauen ist an vielen Stellen grundsätzlich beschädigt worden. Ich habe es, ehrlich gesagt, satt - ich habe auch viele Kollegen und Kolleginnen, egal ob aus der Opposition oder aus der Regierung, so verstanden -, dass wir als Abgeordnete von Skandalen oder bestimmten Missständen nur erfahren, wenn wir mühsam und gezielt nachfragen, wenn die Presse es aufgedeckt hat, wenn wir einen Hinweis aus der Truppe bekommen oder wenn der Bundesrechnungshof von explodierenden Kosten bei bestimmten Waffensystemen schreibt.

Ich finde, wir als Ausschuss - da haben Sie völlig recht, Herr Arnold - sind nicht verantwortlich für diese Probleme. Wir können sicherlich auch nicht die Arbeit des Ministeriums machen. Wir haben gesagt - das ist richtig -, wir wollen kontinuierlich über Materiallager und Beschaffung unterrichtet werden, und wir wollen Transparenz herstellen. Aber ich finde, wir sollten die Kontrolle an dieser Stelle noch verschärfen. Wir sollten Transparenz noch härter einfordern. Deshalb bitte ich Sie, liebe Kolleginnen und Kollegen - da appelliere ich auch an Ihr Selbstverständnis als Parlamentarierinnen und Parlamentarier -: Lassen Sie uns einen gemeinsamen Unterausschuss zur Frage der Rüstungsprojekte auf den Weg bringen.",TOP ZP 1 Aktuelle Stunde zum Rüstungsbericht und Beschaffungswesen der Bundeswehr,14052,speech,18
509,524817,,509,56,,,,,,Beifall beim BÜNDNIS 90/DIE GRÜNEN,TOP ZP 1 Aktuelle Stunde zum Rüstungsbericht und Beschaffungswesen der Bundeswehr,14052,poi,18
