,id,profile_url,sequence,sitzung,speaker,speaker_cleaned,speaker_fp,speaker_key,speaker_party,text,top,top_id,type,wahlperiode
328,524636,https://www.abgeordnetenwatch.de/profile/stefan-muller/archive/214967,328,56,"Stefan Müller, Parl. Staatssekretär bei der Bundesministerin für Bildung und Forschung",Stefan Müller,stefan-muller,1723,,"Herr Kollege Gehring, ich darf Ihnen wie folgt antworten: Die vom Bundesministerium für Bildung und Forschung in Auftrag gegebene Studie zu den BMBF-Projektpauschalen enthält - entgegen Ihrer Fragestel-lung - keine Befunde, inwieweit Verhandlungspositionen des Bundes in Bund-Länder-Verhandlungen gerechtfertigt sind.

Ich will daran erinnern: Grundlage der DFG-Programmpauschale ist die Verwaltungsvereinbarung zwischen Bund und Ländern über den Hochschulpakt 2020, der zufolge „über die weitere Ausgestaltung mit dem Ziel der Verstetigung der Förderung und der Beteiligung der Länder an der Finanzierung“ zu entscheiden ist. Diese Vereinbarung läuft am 31. Dezember aus. Wir befinden uns dazu derzeit in Gesprächen mit den Ländern.

Der Bund setzt sich jedenfalls mit Nachdruck dafür ein, dass Bund und Länder die Programmpauschale gemeinsam weiterführen. DFG-Projekte werden von Bund und Ländern ebenso gemeinsam finanziert. Daher halten jedenfalls wir es nur für konsequent, dass im Sinne einer gemeinsamen Kooperationskultur auch die indirekten Kosten gemeinsam zu tragen sind. Dies wird im Übrigen auch vom Bundesrechnungshof und vom Rechnungsprüfungsausschuss des Deutschen Bundestages entsprechend gefordert.",TOP 2 Fragestunde,14051,speech,18
329,524637,,329,56,Vizepräsident Peter Hintze,Peter Hintze,peter-hintze,,,"Eine Zusatzfrage, Herr Kollege? - Bitte schön.",TOP 2 Fragestunde,14051,chair,18
330,524638,https://www.abgeordnetenwatch.de/profile/kai-gehring/archive/215144,330,56,Kai Gehring (BÜNDNIS 90/DIE GRÜNEN),Kai Gehring,kai-gehring,1821,gruene,"Vielen Dank. - Nach unserer Bewertung widerlegt das Prognos-Gutachten die zentralen Kritikpunkte des Bundesrechnungshofs. Ich möchte Sie darauf aufmerksam machen, dass die Hochschulen in unserem Land sehr beunruhigt und in großer Sorge darüber sind, dass Sie als BMBF die Weiterfinanzierung der Programmpauschale zur Förderung der universitären Forschung weiterhin infrage stellen. Können Sie Medienberichte bestätigen oder dementieren, wonach das BMBF die Vereinbarung zur dritten Phase des Bund-Länder-Hochschulpakts nur dann abschließt, also den Hochschulpakt nur dann fortsetzt, wenn sich die Länder an der Finanzierung der Programmpauschale beteiligen?",TOP 2 Fragestunde,14051,speech,18
331,524639,https://www.abgeordnetenwatch.de/profile/stefan-muller/archive/214967,331,56,"Stefan Müller, Parl. Staatssekretär bei der Bundesministerin für Bildung und Forschung",Stefan Müller,stefan-muller,1723,,"Herr Kollege Gehring, ich will mich bei Ihnen ausdrücklich dafür bedanken, dass Sie es mir ermöglichen, den Deutschen Bundestag als Forum zu nutzen, um eindeutig klarzumachen: Der Bund, das Bundesministerium für Bildung und Forschung und die Bundesregierung, steht zur Programmpauschale, und es ist nicht beabsichtigt, die Programmpauschale in irgendeiner Art und Weise einzustellen.

Wir sind - das habe ich gesagt - derzeit mit den Bundesländern im Gespräch über eine Fortsetzung, eine dritte Phase des Hochschulpaktes. Der Hochschulpakt hat zwei Säulen: Die eine Säule betrifft die finanzielle Unterstützung der Länder bei der Schaffung von Studienplätzen. Die zweite Säule betrifft die Programmpauschale. Wir haben vor - das ist beabsichtigt -, bei der GWK am 30. Oktober dazu entsprechende Beschlüsse zu fassen. Es gibt - insofern sind Medienberichte korrekt - bei diesen Verhandlungen des Bundes mit den Ländern in der Tat derzeit noch Gesprächsbedarf, was die Frage einer gemeinsamen Finanzierung der Programmpauschale anbelangt. Diese Gespräche laufen noch. Aber ich sage noch einmal ausdrücklich: Der Bund wird seiner Verantwortung hier weiter gerecht werden.",TOP 2 Fragestunde,14051,speech,18
332,524640,,332,56,Vizepräsident Peter Hintze,Peter Hintze,peter-hintze,,,"Noch eine Zusatzfrage, Herr Kollege? - Bitte schön.",TOP 2 Fragestunde,14051,chair,18
333,524641,https://www.abgeordnetenwatch.de/profile/kai-gehring/archive/215144,333,56,Kai Gehring (BÜNDNIS 90/DIE GRÜNEN),Kai Gehring,kai-gehring,1821,gruene,"Herr Staatssekretär, mir ist durchaus bewusst, dass der Hochschulpakt auf zwei Säulen fußt. Was ich den Medien entnehme, ist, dass der Bund offensichtlich ein neues Junktim setzt, nach dem Motto: Wir finanzieren Studienplätze künftig nur noch mit, wenn die Länder künftig bei der Programmpauschale einen deutlichen Beitrag leisten. - Das würde wiederum zulasten der Grundfinanzierung der Hochschulen in den Ländern gehen.

Ich möchte Sie darauf aufmerksam machen, dass es im Zusammenhang mit dem 6-plus-3-Milliarden-Euro-Paket für Bildung und Forschung eine Verabredung gibt, die lautet:

Zusätzliche Programme mit einem Kofinanzierungsbedarf können von den Ländern nur umgesetzt werden, wenn andere Ausgaben gekürzt werden.

Deshalb möchte ich Sie einfach bitten, mir zu sagen, ob die Bundesregierung die von ihr geschlossene Vereinbarung kennt und weiter zu ihr steht oder ob sie den Ländern konkrete Vorschläge gemacht hat, wo sie bei der -Finanzierung ihrer Wissenschaftshäuser und der Grundfinanzierung der Hochschulen kürzen sollen.",TOP 2 Fragestunde,14051,speech,18
334,524642,https://www.abgeordnetenwatch.de/profile/stefan-muller/archive/214967,334,56,"Stefan Müller, Parl. Staatssekretär bei der Bundesministerin für Bildung und Forschung",Stefan Müller,stefan-muller,1723,,"Zunächst einmal, Herr Kollege Gehring, finde ich es sehr interessant, dass Sie Verabredungen innerhalb der Koalition interpretieren. Ich darf Sie aber auch darauf hinweisen, dass mit der Bezeichnung „Programme“ in dieser Vereinbarung jedenfalls nicht die Programmpauschale gemeint war, sondern es beispielsweise um zusätzliche Förderprogramme geht.

Nun sind Sie wie ich schon einige Jahre hier im Deutschen Bundestag, und Sie wissen auch, wie politische Verhandlungen aussehen. Eine Gesamtvereinbarung kann es erst dann geben, wenn alle einzelnen Fragen in der Sache vereinbart sind. Ich habe Ihnen schon gesagt, dass wir bei der ersten Säule die Verhandlungen weitgehend abgeschlossen, jedenfalls für die GWK am 30. Oktober vorbereitet haben, dass es aber bei der zweiten Säule noch einige Fragen gibt, die geklärt werden müssen, und es dazu noch keine Vereinbarungen gibt. Ich sage es noch einmal: Eine Gesamtvereinbarung kann es erst dann geben, wenn alles miteinander vereinbart ist. Das ist derzeit noch nicht der Fall.",TOP 2 Fragestunde,14051,speech,18
335,524643,,335,56,Vizepräsident Peter Hintze,Peter Hintze,peter-hintze,,,"Wir kommen zum Geschäftsbereich des Bundesministeriums für wirtschaftliche Zusammenarbeit und Entwicklung.

Die Frage 54 des Abgeordneten Niema Movassat wird schriftlich beantwortet.

Wir kommen zum Geschäftsbereich der Bundeskanzlerin und des Bundeskanzleramtes. Zur Beantwortung steht Staatssekretär Klaus-Dieter Fritsche bereit.

Ich rufe die Frage 55 der Abgeordneten Britta Haßelmann auf:

In welchem Umfang und in welchem Zeitraum hat der Bundesnachrichtendienst Kommunikationsdaten deutscher Staatsbürger an die National Security Agency, NSA, weitergegeben?

Herr Staatssekretär, bitte.

Klaus-Dieter Fritsche, Staatssekretär im Bundeskanzleramt:

Herr Präsident! Sehr verehrte Frau Abgeordnete, ich verstehe die Frage so, dass Sie mit Kommunikations-daten deutscher Staatsangehöriger solche Daten meinen, die durch eine G-10-Beschränkungsmaßnahme erhoben wurden. Es kann sich dabei sowohl um Inhalts- als auch um Verkehrsdaten handeln. Während unter Inhaltsdaten insbesondere Gesprächsinhalte zu verstehen sind, bezeichnen die Verkehrsdaten, auch als Metadaten bezeichnet, sämtliche Umstände einer Kommunikation, also zum Beispiel auch eine Telefonnummer.

Wenn Daten aus einer G-10-Beschränkungsmaßnahme an andere Nachrichtendienste, etwa der USA, übermittelt werden, dann richtet sich diese Übermittlung unter anderem nach den strengen Vorschriften des § 7 a G 10. Ich zitiere:

Der Bundesnachrichtendienst darf durch Beschränkungen nach § 5 Abs. 1 Satz 3 Nr. 2, 3 und 7 erhobene personenbezogene Daten an die mit nachrichtendienstlichen Aufgaben betrauten ausländischen öffentlichen Stellen übermitteln, soweit 1. die Übermittlung zur Wahrung außen- und sicherheitspolitischer Belange der Bundesrepublik Deutschland oder erheblicher Sicherheitsinteressen des ausländischen Staates erforderlich ist, 2. überwiegende schutzwürdige Interessen des Betroffenen nicht entgegenstehen, insbesondere in dem ausländischen Staat ein angemessenes Datenschutzniveau gewährleistet ist sowie davon auszugehen ist, dass die -Verwendung der Daten durch den Empfänger im Einklang mit grundlegenden rechtsstaatlichen Prinzipien erfolgt, und 3. das Prinzip der Gegenseitigkeit gewahrt ist. Die Übermittlung bedarf der Zustimmung des Bundeskanzleramts.

Nach § 7 a des Artikel-10-Gesetzes hat der BND im Jahr 2012 zwei Übermittlungen an die USA durchgeführt. Diese betrafen den Fall eines im Ausland entführten deutschen und US-amerikanischen Staatsbürgers. Die beiden Übermittlungen betrafen Erkenntnisse zu konkreten Umständen der Situation des Entführungsopfers. Ihre Weitergabe an die USA diente dazu, die Situation weiter aufzuklären und auf diese Weise Leib und Leben des Entführungsopfers zu schützen. Die Übermittlungen waren notwendig, um die Umstände der Entführung weiter aufzuhellen. Ziel der Übermittlungen war, die Geisel möglichst unversehrt zu retten.",TOP 2 Fragestunde,14051,chair,18
336,524644,,336,56,Vizepräsident Peter Hintze,Peter Hintze,peter-hintze,,,"Frau Haßelmann, haben Sie eine Zusatzfrage?",TOP 2 Fragestunde,14051,chair,18
337,524645,https://www.abgeordnetenwatch.de/profile/britta-haselmann-0,337,56,Britta Haßelmann (BÜNDNIS 90/DIE GRÜNEN),Britta Haßelmann,britta-haßelmann,1807,gruene,"Vielen Dank, Herr Präsident. - Auch Ihnen, Herr Fritsche, vielen Dank für die Beantwortung. Sie haben am Anfang der Beantwortung meiner Frage eine Grundannahme getroffen. Da sich meine Frage auf sämtliche abgezapften Rohdaten bezieht, möchte ich nachfragen: Muss Ihre Antwort dann nicht noch ergänzt werden?

Lassen Sie mich einen zweiten Aspekt ansprechen. Sie hatten meinem Kollegen Hans-Christian Ströbele mit Datum vom 11. Juli auf eine entsprechende Frage geantwortet - ich zitiere -:

Der Bundesnachrichtendienst hat im angefragten Zeitraum weder selbst noch mit Hilfe des Betreibers DE-CIX … Rohdaten aus im Raum Frankfurt erfassten Telekommunikationsverkehren automatisiert an die NSA weitergeleitet. Der in der zweiten Teilfrage suggerierte Zusammenhang besteht nicht.

Das Letzte bezog sich auf einen anderen Sachverhalt.

Nach den Presseberichten der Süddeutschen Zeitung, des SWR und des NDR ist jetzt bekannt geworden, dass unter dem Stichwort „Eikonal“ ein Austausch von Daten regelmäßig und über Jahre stattgefunden hat. Wie decken sich Ihre Aussage in der Beantwortung meiner Frage und die Aussage in der Beantwortung der Frage von Hans-Christian Ströbele vom 11. Juli 2014 mit den Vorwürfen und Behauptungen, die in der Presseberichterstattung über die Operation „Eikonal“ bekannt gegeben wurden?",TOP 2 Fragestunde,14051,speech,18
338,524646,,338,56,Vizepräsident Peter Hintze,Peter Hintze,peter-hintze,,,"Herr Staatssekretär.

Klaus-Dieter Fritsche, Staatssekretär im Bundeskanzleramt:

Zunächst einmal, Frau Abgeordnete, bedauere ich es ausdrücklich, dass Unterlagen, die bis zu Streng Geheim eingestuft waren und dem Untersuchungsausschuss vonseiten der Bundesregierung zur Verfügung gestellt worden sind, in kürzester Zeit in die Presse gekommen sind und sie offensichtlich Hintergrund der Berichterstattung in der Süddeutschen Zeitung waren.

Um auf die grundsätzliche Frage zurückzukommen, die Sie einleitend gestellt haben: Es gibt nur zwei Möglichkeiten für den BND, Kommunikationsdaten von Deutschen oder über Deutsche weiterzugeben. Das ist die von mir eingangs geschilderte G-10-Möglichkeit, also die Möglichkeit nach den Regularien des Artikel- 10-Gesetzes. Die zweite Möglichkeit ist, dass Daten von anderen Diensten, also auch Telekommunikationsdaten von anderen Diensten bzw. von menschlichen Quellen, die der BND führt, übermittelt werden. Diese Daten werden ebenfalls auf einer rechtlichen Grundlage - dem Bundesnachrichtendienstgesetz in Verbindung mit dem Bundesverfassungsschutzgesetz - auch an öffentliche ausländische Stellen, also auch an andere Dienste übermittelt. Nur diese beiden Möglichkeiten gibt es für eine Datenübermittlung von Kommunikationsdaten Deutscher.",TOP 2 Fragestunde,14051,chair,18
339,524647,,339,56,Vizepräsident Peter Hintze,Peter Hintze,peter-hintze,,,"Noch eine Zusatzfrage, Frau Haßelmann? - Bitte.",TOP 2 Fragestunde,14051,chair,18
340,524648,https://www.abgeordnetenwatch.de/profile/britta-haselmann-0,340,56,Britta Haßelmann (BÜNDNIS 90/DIE GRÜNEN),Britta Haßelmann,britta-haßelmann,1807,gruene,"Vielen Dank. - Herr Fritsche, kann ich Ihren Aussagen entnehmen, dass Sie definitiv davon ausgehen, dass Kommunikationsdaten ausschließlich in den zwei Fällen, die Sie hier skizziert haben, zwischen BND und NSA weitergegeben worden sind und dass sämtliche Sachverhalte, die, durch welche Indiskretion auch immer, Gegenstand öffentlicher Berichterstattung waren, somit nicht zutreffend sind? Schließen Sie aus, dass es eine Weitergabe von Daten gegeben hat, dass es Vereinbarungen gegeben hat zwischen dem BND und der NSA über die Frage des Austausches und der Weitergabe von Telekommunikationsdaten?

Klaus-Dieter Fritsche, Staatssekretär im Bundeskanzleramt:

Frau Abgeordnete, ich beantworte die Frage wie folgt: Ich schließe aus, dass es solche Abkommen zwischen der NSA und dem BND gegeben hat, die sich über die beiden Möglichkeiten, die ich eingangs geschildert habe, hinweg zu einem Datenaustausch einlassen. Es gibt die sogenannte Routineaufklärung - die keine G-10-Aufklärung ist - des Bundesnachrichtendienstes. Sie betrifft Ausländer im Ausland. Hier hat der Bundesnachrichtendienst entsprechende Schutzmaßnahmen, nämlich Filtersysteme, eingebaut. Nach diesen Filtersystemen werden, sollte ein deutscher Staatsangehöriger in diese Ausland-Ausland-Aufklärung geraten, Daten herausgefiltert. Damit können auch Daten, die hier weitergegeben werden, keine Daten von deutschen Staatsangehörigen enthalten.",TOP 2 Fragestunde,14051,speech,18
341,524649,,341,56,Vizepräsident Peter Hintze,Peter Hintze,peter-hintze,,,"Danke schön. Ich schließe damit die Fragestunde.

Ich rufe den Zusatzpunkt 1 auf:

Aktuelle Stunde

auf Verlangen der Fraktionen DIE LINKE und BÜNDNIS 90/DIE GRÜNEN

Reaktion der Bundesregierung auf den Rüstungsbericht und die schwierige Situation des Beschaffungswesens der Bundeswehr

Bevor wir in die Rednerfolge eintreten, gratuliere ich im Namen des Präsidiums und hoffentlich des ganzen Hauses unserer Bundesverteidigungsministerin zu ihrem heutigen Geburtstag. - Frau von der Leyen, herzlichen Glückwunsch!",TOP 2 Fragestunde,14051,chair,18
342,524650,,342,56,,,,,,Beifall,TOP 2 Fragestunde,14051,poi,18
343,524651,,343,56,Vizepräsident Peter Hintze,Peter Hintze,peter-hintze,,,"Es ist ein Zeichen hohen Verantwortungsbewusstseins, dass sie diesen Geburtstag mit uns verbringt, und ein Zeichen der Freude an der Politik, dass sie auch an ihrem Geburtstag an dieser wichtigen Debatte als Rednerin für die Bundesregierung teilnimmt.

Ich eröffne die Aussprache und rufe als ersten Redner den Kollegen Wolfgang Gehrcke, Fraktion Die Linke, auf. - Bitte schön.",TOP 2 Fragestunde,14051,chair,18
344,524652,,344,56,,,,,,Beifall bei der LINKEN,TOP 2 Fragestunde,14051,poi,18
345,524653,https://www.abgeordnetenwatch.de/profile/wolfgang-gehrcke,345,56,Wolfgang Gehrcke (DIE LINKE),Wolfgang Gehrcke,wolfgang-gehrcke,1293,linke,"Schönen Dank, Herr Präsident. - Verehrte Kolleginnen und Kollegen! Ich befürchte, dass ich mich mit meinem Beitrag nicht in die Schar der Gratulanten zum Geburtstag einreihen kann, sondern es etwas kantiger wird.",TOP ZP 1 Aktuelle Stunde zum Rüstungsbericht und Beschaffungswesen der Bundeswehr,14052,speech,18
346,524654,https://www.abgeordnetenwatch.de/profile/thomas-hitschler/archive/216937,346,56,Thomas Hitschler [SPD],Thomas Hitschler,thomas-hitschler,1624,spd,Überraschung!,TOP ZP 1 Aktuelle Stunde zum Rüstungsbericht und Beschaffungswesen der Bundeswehr,14052,poi,18
347,524655,https://www.abgeordnetenwatch.de/profile/rainer-arnold,347,56,Rainer Arnold [SPD],Rainer Arnold,rainer-arnold,1884,spd,Schade!,TOP ZP 1 Aktuelle Stunde zum Rüstungsbericht und Beschaffungswesen der Bundeswehr,14052,poi,18
348,524656,https://www.abgeordnetenwatch.de/profile/wolfgang-gehrcke,348,56,Wolfgang Gehrcke (DIE LINKE),Wolfgang Gehrcke,wolfgang-gehrcke,1293,linke,"- Genau so.

Ich möchte zu Anfang ein Problem ansprechen, das nur mittelbar mit der Frage zu tun hat, über die wir hier debattieren. Vielleicht gibt es da eine Möglichkeit zur Verständigung; in Fragen der Rüstung und der Aufrüstung gibt es von mir keine Brücke.

Ich habe die neuesten Informationen aus Kobane: IS ist auf dem Rückzug. Wenn das stimmen sollte, sollte das uns alle glücklich machen. Ich möchte gern, dass wir zumindest gemeinsam Druck auf die Türkei entwickeln und der Türkei klipp und klar sagen: Die Grenzen müssen für Flüchtlinge auf- und für den IS zugemacht werden.",TOP ZP 1 Aktuelle Stunde zum Rüstungsbericht und Beschaffungswesen der Bundeswehr,14052,speech,18
349,524657,,349,56,,,,,,Beifall bei der LINKEN und dem BÜNDNIS 90/DIE GRÜNEN,TOP ZP 1 Aktuelle Stunde zum Rüstungsbericht und Beschaffungswesen der Bundeswehr,14052,poi,18
350,524658,https://www.abgeordnetenwatch.de/profile/wolfgang-gehrcke,350,56,Wolfgang Gehrcke (DIE LINKE),Wolfgang Gehrcke,wolfgang-gehrcke,1293,linke,"Auf dieses Minimum werden wir uns doch hier im Haus verständigen können.

Jetzt möchte ich zu dem Bericht argumentieren. Ich habe ihn voller Spannung gelesen. Es ist eigentlich ein Krimi, der hier aufgeführt worden ist. Ich würde titeln: Kriminaltango, initiiert von der Ministerin von der Leyen. - Vom Stern wurde sie als „Kriegsministerin“ bezeichnet. Das hat der Stern gemacht, nicht ich; ich wiederhole das hier nur.",TOP ZP 1 Aktuelle Stunde zum Rüstungsbericht und Beschaffungswesen der Bundeswehr,14052,speech,18
351,524659,https://www.abgeordnetenwatch.de/profile/henning-otte/archive/214538,351,56,Henning Otte [CDU/CSU],Henning Otte,henning-otte,1715,cducsu,Haben Sie eine Anzeige geschaltet?,TOP ZP 1 Aktuelle Stunde zum Rüstungsbericht und Beschaffungswesen der Bundeswehr,14052,poi,18
352,524660,https://www.abgeordnetenwatch.de/profile/wolfgang-gehrcke,352,56,Wolfgang Gehrcke (DIE LINKE),Wolfgang Gehrcke,wolfgang-gehrcke,1293,linke,"Ich möchte gern, dass man über zwei verschiedene Grundrichtungen nachdenkt. Die Grundrichtung der Linken ist: Wir wollen Sicherheit durch Abrüstung. Die Grundrichtung der Verteidigungsministerin und der Regierung ist: Sicherheit durch Aufrüstung. - Das wird scheitern, und das geht nicht zusammen. Sicherheit ist durch Abrüstung zu erreichen.",TOP ZP 1 Aktuelle Stunde zum Rüstungsbericht und Beschaffungswesen der Bundeswehr,14052,speech,18
353,524661,,353,56,,,,,,Beifall bei der LINKEN,TOP ZP 1 Aktuelle Stunde zum Rüstungsbericht und Beschaffungswesen der Bundeswehr,14052,poi,18
354,524662,https://www.abgeordnetenwatch.de/profile/wolfgang-gehrcke,354,56,Wolfgang Gehrcke (DIE LINKE),Wolfgang Gehrcke,wolfgang-gehrcke,1293,linke,"Es geht nicht nur um Sicherheit. Ich möchte auch über andere Fragen reden, die immer verdrängt werden. Wenn man den Bericht liest - es geht um neun große Rüstungsprojekte -, weiß man sofort: Es geht um Geld, um viel Geld. Wir reden über Sicherheit, und andere reden über Profite. Mit Rüstung werden ungeheure Profite gemacht. Darüber muss man sprechen. Ich möchte einmal im Sinne von Transparenz aufgelistet haben, welche Rüstungsunternehmen an welchem Projekt wie viel verdient haben. Während hier über Sicherheit gesprochen wird, geht es um Geld und Profit. Das Streben nach Profit sollte aber nicht unsere Politik aussteuern. Das gehört zu dem Krimi.",TOP ZP 1 Aktuelle Stunde zum Rüstungsbericht und Beschaffungswesen der Bundeswehr,14052,speech,18
355,524663,,355,56,,,,,,Beifall bei der LINKEN,TOP ZP 1 Aktuelle Stunde zum Rüstungsbericht und Beschaffungswesen der Bundeswehr,14052,poi,18
356,524664,https://www.abgeordnetenwatch.de/profile/wolfgang-gehrcke,356,56,Wolfgang Gehrcke (DIE LINKE),Wolfgang Gehrcke,wolfgang-gehrcke,1293,linke,"Wir müssen auch über mafiöse Strukturen in diesem ganzen Bereich reden. In meinem Jargon würde ich diese Kooperation von Rüstung, von Rüstungsinteressen und Ministerium eher als militärisch-industriellen Komplex bezeichnen. Wer schreibt eigentlich die Vorschläge, was beschafft werden soll und von wem es geliefert werden soll? Jetzt hört und liest man, dass Verträge sogar von denen geschrieben werden, die auf der anderen Seite das Geld dadurch bekommen, und dass das Ministerium selbst so oberflächlich auf die Dinge eingeht, dass die Bezeichnung Filz zwischen Politik und Militär durchaus angebracht ist. Ich möchte über diesen Filz reden.",TOP ZP 1 Aktuelle Stunde zum Rüstungsbericht und Beschaffungswesen der Bundeswehr,14052,speech,18
357,524665,,357,56,,,,,,Beifall bei der LINKEN,TOP ZP 1 Aktuelle Stunde zum Rüstungsbericht und Beschaffungswesen der Bundeswehr,14052,poi,18
358,524666,https://www.abgeordnetenwatch.de/profile/wolfgang-gehrcke,358,56,Wolfgang Gehrcke (DIE LINKE),Wolfgang Gehrcke,wolfgang-gehrcke,1293,linke,"Ich möchte ein weiteres Problem ansprechen - Frau Ministerin, hier spreche ich Sie auch ganz direkt an -: Wäre es nicht möglich, etwas mehr Respekt vor dem Parlament - nicht vor einzelnen Abgeordneten - an den Tag zu legen? Müssen Sie mit jeder Planung, so absurd sie auch im Einzelnen ist, sofort versuchen, Öffentlichkeitsarbeit zu betreiben?",TOP ZP 1 Aktuelle Stunde zum Rüstungsbericht und Beschaffungswesen der Bundeswehr,14052,speech,18
359,524667,https://www.abgeordnetenwatch.de/profile/henning-otte/archive/214538,359,56,Henning Otte [CDU/CSU],Henning Otte,henning-otte,1715,cducsu,Transparenz!,TOP ZP 1 Aktuelle Stunde zum Rüstungsbericht und Beschaffungswesen der Bundeswehr,14052,poi,18
360,524668,https://www.abgeordnetenwatch.de/profile/wolfgang-gehrcke,360,56,Wolfgang Gehrcke (DIE LINKE),Wolfgang Gehrcke,wolfgang-gehrcke,1293,linke,"An der russischen Westgrenze Drohnen aus Deutschland und Soldaten aus Deutschland stationieren zu wollen, ist so absurd und so gefährlich wie nur irgendwas.",TOP ZP 1 Aktuelle Stunde zum Rüstungsbericht und Beschaffungswesen der Bundeswehr,14052,speech,18
361,524669,,361,56,,,,,,Beifall bei der LINKEN,TOP ZP 1 Aktuelle Stunde zum Rüstungsbericht und Beschaffungswesen der Bundeswehr,14052,poi,18
362,524670,https://www.abgeordnetenwatch.de/profile/wolfgang-gehrcke,362,56,Wolfgang Gehrcke (DIE LINKE),Wolfgang Gehrcke,wolfgang-gehrcke,1293,linke,Die OSZE will das gar nicht; das wissen Sie. Die OSZE hat nicht angefragt. Sie drängen sich hier auf.,TOP ZP 1 Aktuelle Stunde zum Rüstungsbericht und Beschaffungswesen der Bundeswehr,14052,speech,18
363,524671,https://www.abgeordnetenwatch.de/profile/henning-otte/archive/214538,363,56,Henning Otte [CDU/CSU],Henning Otte,henning-otte,1715,cducsu,Das stimmt doch nicht!,TOP ZP 1 Aktuelle Stunde zum Rüstungsbericht und Beschaffungswesen der Bundeswehr,14052,poi,18
364,524672,https://www.abgeordnetenwatch.de/profile/wolfgang-gehrcke,364,56,Wolfgang Gehrcke (DIE LINKE),Wolfgang Gehrcke,wolfgang-gehrcke,1293,linke,"Kann man das klären und hier sagen, dass wir als Deutscher Bundestag das nicht wollen, es sollen keine Soldaten dort stationiert werden, wo deutsche Soldaten einmal waren? Das war die Politik und auch die Formulierung von Herrn Kohl: keine deutschen Soldaten, wo deutsche Soldaten einmal waren.

Muss der Bundestag aus den Medien erfahren, dass Sie Ausbildungszentren im Nordirak einrichten wollen? Ich finde, diese Art des Umgangs mit dem Parlament macht viel kaputt und die deutsche Politik noch unseriöser, als sie sowieso schon ist.",TOP ZP 1 Aktuelle Stunde zum Rüstungsbericht und Beschaffungswesen der Bundeswehr,14052,speech,18
365,524673,,365,56,,,,,,Beifall bei Abgeordneten der LINKEN,TOP ZP 1 Aktuelle Stunde zum Rüstungsbericht und Beschaffungswesen der Bundeswehr,14052,poi,18
366,524674,https://www.abgeordnetenwatch.de/profile/wolfgang-gehrcke,366,56,Wolfgang Gehrcke (DIE LINKE),Wolfgang Gehrcke,wolfgang-gehrcke,1293,linke,"Ich möchte nicht, dass mit dem Parlament in dieser Art und Weise umgegangen wird. Ich fordere Respekt für das Parlament. Ich finde, dass das Parlament die Entscheidung hat. Das sollte man auch in allen Fragen deutlich machen und nicht vorab die Presse so hochschaukeln, dass es sich bereits wie Fakten liest.

Keine deutschen Soldaten an die Westgrenze Russlands, das ist das Mindeste, was Sie aus der Geschichte lernen sollten.

Danke sehr.",TOP ZP 1 Aktuelle Stunde zum Rüstungsbericht und Beschaffungswesen der Bundeswehr,14052,speech,18
367,524675,,367,56,,,,,,Beifall bei der LINKEN,TOP ZP 1 Aktuelle Stunde zum Rüstungsbericht und Beschaffungswesen der Bundeswehr,14052,poi,18
368,524676,,368,56,Vizepräsident Peter Hintze,Peter Hintze,peter-hintze,,,Für die Bundesregierung erteile ich das Wort Frau Bundesministerin Dr. Ursula von der Leyen.,TOP ZP 1 Aktuelle Stunde zum Rüstungsbericht und Beschaffungswesen der Bundeswehr,14052,chair,18
