,id,profile_url,sequence,sitzung,speaker,speaker_cleaned,speaker_fp,speaker_key,speaker_party,text,top,top_id,type,wahlperiode
337,537531,https://www.abgeordnetenwatch.de/profile/gunter-krings/archive/214657,337,62,"Dr. Günter Krings, Parl. Staatssekretär beim Bundesminister des Innern",Dr. Günter Krings,gunter-krings,1766.0,,"Herr Abgeordneter Tressel, das Thema Flug-gastdatenspeicherung beschäftigt uns in diesem Hause schon länger. Ich will vorwegschicken: Dieses Thema bzw. die EU-Richtlinie, die in Arbeit ist, ist durch den Beschluss des Europäischen Rates vom August dieses Jahres und auch durch die VN-Resolution vom 24. September 2014 im Kontext mit den Terrorkämpfern und ihren Reise-bewegungen natürlich drängender geworden.

Die Europäische Kommission hat 2011 einen Vorschlag für eine Richtlinie für ein EU-PNR-System vorgelegt. Der Entwurf der Kommission sieht vor, dass die bei der Buchung von Flügen über EU-Außengrenzen erfassten Passagierdaten - also Sitzplatz, Reisebüro, Gepäcknummer usw. - an die jeweilige PNR-Zentralstelle der Mitglied-staaten übermittelt werden. Es sollen aber nur die Daten angefordert werden, die bei den Fluggesell-schaften ohnehin gesammelt werden. Das heißt, die Richtlinie begründet keine Pflicht für die Flug-gesellschaften, zusätzliche PNR-Daten zu erfas-sen. Von dem Richtlinienvorschlag der EU-Kommission sind natürlich auch nicht die Daten, wie es in der Frage etwas plakativ heißt, von rund 80 Millionen Deutschen oder 500 Millionen Euro-päern erfasst, sondern nur die Daten derjenigen Bürger, die Linienflüge über EU-Außengrenzen an-treten wollen.

Die von den Behörden der Mitgliedstaaten er-fassten PNR-Daten sollen ausschließlich zur Be-kämpfung von terroristischen Straftaten und schwerer Kriminalität verarbeitet werden. Es bleibt darüber hinaus den einzelnen Mitgliedstaaten überlassen, zu entscheiden, ob und welche Daten einer Analyse unterzogen werden. Die Mitglied-staaten sind somit nicht zu einer routinemäßigen Datenanalyse verpflichtet.

Nach Ansicht der Bundesregierung ist wegen der Gefahr von Anschlägen durch aus Syrien und aus dem Irak zurückkehrende Dschihadisten dringliches Handeln geboten. Ein Element, um dieser Bedrohung der inneren Sicherheit zu be-gegnen, ist das Aufspüren verdächtiger Reisebe-wegungen. Hierzu könnten PNR-Daten wichtige Dienste leisten, indem sie unter anderem die Feststellung von Reisebewegungen von terroris-musverdächtigen Personen und Rückschlüsse auf den Aufenthalt solcher Personen in Terrorcamps oder in Kampfgebieten ermöglichen.

Der Europäische Rat hat am 30. August 2014 vor dem Hintergrund der Bedrohung durch die so-genannten -Foreign Fighters den Rat und das Eu-ropäische Parlament ersucht, die Arbeiten an der EU-PNR-Richtlinie vor Ende dieses Jahres abzu-schließen. Es ist daher davon auszugehen, dass die Arbeiten an der Richtlinie zur Einrichtung eines EU-PNR-Systems zeitnah abgeschlossen werden. Deutschland wird sich hierbei weiterhin für Ver-besserungen insbesondere im Bereich des Daten-schutzes einsetzen.",TOP 2 Fragestunde,14095,speech,18
338,537532,https://www.abgeordnetenwatch.de/profile/johannes-singhammer,338,62,Vizepräsident Johannes Singhammer,Johannes Singhammer,johannes-singhammer,1582.0,,"Herr Kollege Tressel, ich vermute, Sie haben dazu eine Nachfrage. Dann erteile ich Ihnen dazu auch das Wort.",TOP 2 Fragestunde,14095,chair,18
339,537533,https://www.abgeordnetenwatch.de/profile/markus-tressel/archive/187563,339,62,Markus Tressel (BÜNDNIS 90/DIE GRÜNEN),Markus Tressel,markus-tressel,1343.0,gruene,"Vielen Dank, Herr Präsident. - Herr Staatssek-retär, Sie haben gerade gesagt, dass das zeitnah geschehen soll. Wann rechnen Sie mit einer Um-setzung der Fluggastdatenrichtlinie?

Eine zweite Nachfrage. Um den 29. Oktober herum hat das Justizministerium verlauten lassen, man wolle Datenschutzschranken in die Fluggast-datenrichtlinie hineinverhandelt sehen. Ist das die Auffassung der gesamten Bundesregierung, und wie können solche Schranken Ihrer Auffassung nach aussehen?",TOP 2 Fragestunde,14095,speech,18
340,537534,https://www.abgeordnetenwatch.de/profile/gunter-krings/archive/214657,340,62,"Dr. Günter Krings, Parl. Staatssekretär beim Bundesminister des Innern",Dr. Günter Krings,gunter-krings,1766.0,,"Vielen Dank. - Ich habe mir abgewöhnt, bei solch sensiblen europäischen Richtlinien exakte Zeitpläne anzunehmen. „Zeitnah“ heißt natürlich: Wir sollten, wenn der Vorschlag in diesem Jahr vorliegt, im nächsten Jahr zu Ergebnissen kom-men. Dann gibt es natürlich noch die Umset-zungsfristen. Einen genauen Zeitplan können Sie von mir heute leider nicht bekommen. Jedenfalls ist es angesichts der aktuellen Bedrohungslage eine dringliche Angelegenheit.

Ich kenne die Verlautbarung der Kollegen aus dem Justizministerium und auch den exakten Hin-tergrund nicht, aber ich habe Ihnen in meiner Ant-wort schon gesagt, dass auch wir - da sind wir, glaube ich, die beiden Häuser und die gesamte Bundesregierung, nicht weit voneinander entfernt - auf hohe Datenschutzstandards drängen. Wir haben uns bereits in der Vergangenheit für relativ kurze Speicherfristen eingesetzt. Man kann auch überlegen, ob man stärkere Vorgaben braucht, wenn es um die Weitergabe von Daten an Dritt-staaten und ähnliche Dinge geht. Verfahrensrege-lungen kann man verschärfen. Es ist eine ganze Fülle von datenschutzfreundlichen Regelungen denkbar und richtig.",TOP 2 Fragestunde,14095,speech,18
341,537535,https://www.abgeordnetenwatch.de/profile/johannes-singhammer,341,62,Vizepräsident Johannes Singhammer,Johannes Singhammer,johannes-singhammer,1582.0,,"Herr Kollege Tressel, haben Sie dazu noch eine Nachfrage? - Das ist nicht der Fall.

Dann kommen wir zur Frage 22, die ebenso vom Kollegen Tressel gestellt worden ist:

Hält die Bundesregierung die Fluggastdatenspeicherung vor dem Hintergrund des Urteils des Europäischen Gerichtshofes vom April dieses Jahres zur Vorratsdatenspeicherungsrichtlinie für mit der EU-Grundrechtecharta vereinbar, und, wenn ja, aus welchen Erwägungen?",TOP 2 Fragestunde,14095,chair,18
342,537536,https://www.abgeordnetenwatch.de/profile/gunter-krings/archive/214657,342,62,"Dr. Günter Krings, Parl. Staatssekretär beim Bundesminister des Innern",Dr. Günter Krings,gunter-krings,1766.0,,"Diese Frage bewegt sich im gleichen themati-schen Kontext und nimmt auf das Urteil des Euro-päischen Gerichtshofes zum Thema Vorratsda-tenspeicherung Bezug. - Das Urteil des EuGH vom 8. April 2014 betrifft natürlich in erster Linie die Richtlinie 2006/24/EG zur Speicherung von Telekommunikationsverkehrsdaten. Darin hatte der Europäische Gerichtshof unter anderem be-mängelt, dass die Richtlinie keine ausreichenden Garantien für den Schutz der Grundrechte vorsah. Aus der -Entscheidung folgt nicht, dass ein EU-System zur Speicherung von PNR-Daten gegen die Charta der Grundrechte der Europäischen Union verstoßen würde.

Der Innenkommissar Avramopoulos hat erst kürzlich, in seiner Anhörung vor dem Europäi-schen Parlament am 30. September, angekündigt, den Entwurf für eine EU-PNR-Richtlinie auch im Lichte des Urteils des EuGH zur Richtlinie zur Vorratsdatenspeicherung zu überprüfen. Unab-hängig davon wird sich die Bundesregierung im Rahmen der weiteren Beratungen zwischen dem -Europäischen Rat und dem Europäischen Parla-ment über den Entwurf der EU-PNR-Richtlinie, wie ich das eben schon gesagt habe, für die Aufnah-me weiterer Datenschutzgarantien einsetzen.",TOP 2 Fragestunde,14095,speech,18
343,537537,https://www.abgeordnetenwatch.de/profile/johannes-singhammer,343,62,Vizepräsident Johannes Singhammer,Johannes Singhammer,johannes-singhammer,1582.0,,"Der Herr Kollege Tressel hat dazu keine Nach-frage.

Dann können wir den Geschäftsbereich des In-nenministeriums abschließen. Ich darf an dieser Stelle dem Herrn Staatssekretär für die Beantwor-tung herzlich danken.

Wir kommen zum Geschäftsbereich des Bun-desministeriums der Justiz und für Verbraucher-schutz. Die Frage 23 des Kollegen Hunko wird schriftlich beantwortet.

Wir kommen zum Geschäftsbereich des Bun-desministeriums der Finanzen. Die Fragen 24 und 25 der Kollegin Karawanskij werden schriftlich be-antwortet.

Wir kommen nun zum Geschäftsbereich des Bundesministeriums für Arbeit und Soziales. Für die Beantwortung steht die Parlamentarische Staatssekretärin Lösekrug-Möller zur Verfügung.

Ich rufe die Frage 26 der Kollegin Corinna Rüf-fer auf:

Wie bewertet die Bundesregierung den Vorschlag, die Kos-ten der Unterkunft in einem ersten Schritt ab 2018 in Höhe von 5 Milliarden Euro und ab 2020 komplett aus Bundesmitteln zu finanzieren, und welcher inhaltliche und zeitliche Zusammenhang besteht aus Sicht der Bundesregierung zwischen einer solchen finanziellen Entlastung der Kommunen und der Weiterentwick-lung der Eingliederungshilfe im Sinne der UN-Behindertenrechtskonvention?

Gabriele Lösekrug-Möller, Parl. Staatssekretä-rin bei der Bundesministerin für Arbeit und Sozia-les:

Verehrte Kollegin Rüffer, ich darf Ihnen auf Ihre Frage antworten: Nach dem Koalitionsvertrag sol-len die Kommunen im Rahmen der Verabschie-dung eines Bundesteilhabegesetzes im Umfang von 5 Milliarden Euro jährlich von den Kosten der Eingliederungshilfe entlastet werden. Die Bundes-regierung prüft auch den Vorschlag, eine Entlas-tung der Kommunen über eine höhere Bundesbe-teiligung an den Kosten der Unterkunft zu errei-chen. Die Bundesregierung steht gleichzeitig zu ihrer Zusage, in dieser Legislaturperiode den Ent-wurf eines Bundesteilhabegesetzes zu erarbeiten, um das Teilhaberecht im Sinne der UN-Behindertenrechtskonvention weiterzuentwickeln.",TOP 2 Fragestunde,14095,chair,18
344,537538,https://www.abgeordnetenwatch.de/profile/johannes-singhammer,344,62,Vizepräsident Johannes Singhammer,Johannes Singhammer,johannes-singhammer,1582.0,,"Frau Kollegin, haben Sie dazu eine Nachfrage?",TOP 2 Fragestunde,14095,chair,18
345,537539,https://www.abgeordnetenwatch.de/profile/corinna-ruffer-0,345,62,Corinna Rüffer (BÜNDNIS 90/DIE GRÜNEN),Corinna Rüffer,corinna-ruffer,1690.0,gruene,"Ja. - Angesichts der Bedeutung dieses Ge-setzgebungsvorhabens - unheimlich viele Men-schen schauen darauf: betroffene behinderte Menschen, die sie vertretenden Verbände - ist es offensichtlich, dass ein Teil der Dynamik, die im Gesetzgebungsprozess von Anfang an wahrzu-nehmen war, damit zusammenhing, dass es eine enge Verbindung zwischen der Reform der Ein-gliederungshilfe, der Vorlage eines Bundesteilha-begesetzes auf der einen Seite und der Entlastung der Kommunen auf der anderen Seite gab. Der Vorschlag auf der Grundlage des Schäuble-Scholz-Papiers, der jetzt im Raum steht, geht in eine andere Richtung und sieht eine Entkoppelung dieses Zusammenhanges vor; so viel zum Hinter-grund.

Frau Nahles war heute Morgen im Ausschuss und hat klar gesagt, dass das BMAS dem Vor-schlag, ab 2020 100 Prozent der KdU zu über-nehmen, kritisch gegenübersteht. Daraus resul-tiert jetzt meine Frage: Welche alternativen Vor-schläge werden gegenwärtig einer tieferen Prü-fung unterzogen, um die Weiterentwicklung der Eingliederungshilfe im Sinne der UN-Behindertenrechtskonvention mit der finanziellen Entlastung der Kommunen zu verknüpfen? Welche Rolle spielt dabei gegebenenfalls die stärkere Be-teiligung der Sozialversicherung?",TOP 2 Fragestunde,14095,speech,18
346,537540,https://www.abgeordnetenwatch.de/profile/johannes-singhammer,346,62,Vizepräsident Johannes Singhammer,Johannes Singhammer,johannes-singhammer,1582.0,,"Frau Staatssekretärin, Sie haben das Wort.

Gabriele Lösekrug-Möller, Parl. Staatssekretä-rin bei der Bundesministerin für Arbeit und Sozia-les:

Ich kann Ihnen darauf gerne antworten. Auch ich war heute im Ausschuss zugegen und habe die Ministerin gehört. Für mich stand sehr im Vor-dergrund, dass sie gar keinen Zweifel daran ge-lassen hat, dass ein Bundesteilhabegesetz in die-ser Legislatur nicht nur vorbereitet, sondern auch verabschiedet wird. Jetzt gibt es einen neuen Vor-schlag über einen Finanzierungspfad. Ich würde mich wiederholen und merke nur an: Dieser Vor-schlag wird geprüft. Der Koalitionsvertrag enthält außer der von mir zitierten Regelung keinen ande-ren Finanzierungsweg.

Sie können versichert sein, dass wir in der fachlichen Vorbereitung des Gesetzes sehr stark voranschreiten. Sie wissen auch um den breiten Beteiligungsprozess, in den wir eingestiegen sind. Das ist der gegenwärtige Stand der Arbeit zu die-sem aus der Sicht des Ministeriums wichtigen Gesetzesvorhaben.",TOP 2 Fragestunde,14095,chair,18
347,537541,https://www.abgeordnetenwatch.de/profile/johannes-singhammer,347,62,Vizepräsident Johannes Singhammer,Johannes Singhammer,johannes-singhammer,1582.0,,"Frau Kollegin Rüffer, haben Sie noch eine zwei-te Nachfrage? - Dann bitte ich Sie, diese zu stel-len.",TOP 2 Fragestunde,14095,chair,18
348,537542,https://www.abgeordnetenwatch.de/profile/corinna-ruffer-0,348,62,Corinna Rüffer (BÜNDNIS 90/DIE GRÜNEN),Corinna Rüffer,corinna-ruffer,1690.0,gruene,"Genau. - Sie lautet wie folgt: Zieht die Bundes-regierung in Betracht, im Zuge des angekündigten Bundesteilhabegesetzes ein Teilhabegeld zu schaffen? Wenn ja: Soll dieses Teilhabegeld in erster Linie der finanziellen Beteiligung des Bun-des an den Ausgaben der Träger der Eingliede-rungshilfe oder der Schaffung eines Nachteils-ausgleichs für Menschen mit Behinderung dienen?

Gabriele Lösekrug-Möller, Parl. Staatssekretä-rin bei der Bundesministerin für Arbeit und Sozia-les:

Frau Kollegin Rüffer, vielen Dank für diese Fra-ge. - Sie werden wissen, wir haben im Koalitions-vertrag zu diesem Thema aus gutem Grund einen Prüfauftrag vereinbart. Wir sind in diese Prüfung eingestiegen. Sie ist noch nicht abgeschlossen. Wir haben noch kein Ergebnis. Deshalb kann ich Ihnen gar nicht sagen, worauf genau das hinaus-laufen wird. Wir befassen uns sehr ernsthaft mit dem Thema, aber es liegt noch kein Ergebnis vor.",TOP 2 Fragestunde,14095,speech,18
349,537543,https://www.abgeordnetenwatch.de/profile/corinna-ruffer-0,349,62,Corinna Rüffer [BÜNDNIS 90/DIE GRÜ-NEN],Corinna Rüffer,corinna-ruffer,1690.0,gruene,Sie ziehen es in Betracht!,TOP 2 Fragestunde,14095,poi,18
350,537544,https://www.abgeordnetenwatch.de/profile/johannes-singhammer,350,62,Vizepräsident Johannes Singhammer,Johannes Singhammer,johannes-singhammer,1582.0,,"Vielen Dank, Frau Staatssekretärin. - Wir kommen damit zum Ende der Fragestunde. Die vereinbarte Redezeit ist vorüber, und Sie haben auch noch Ihre beiden Zusatzfragen stellen kön-nen. Ich danke der Frau Staats-sekretärin Lö-sekrug-Möller für das Bundeministerium für Arbeit und Soziales und beende damit die Fragestunde.

Ich rufe jetzt den Tagesordnungspunkt 3 auf:

Vereinbarte Debatte

anlässlich des 3. Jahrestages der Aufde-ckung der NSU-Verbrechen am 4. Novem-ber 2011

Nach einer interfraktionellen Vereinbarung sind für diese Aussprache 60 Minuten vorgesehen. - Ich höre keinen Widerspruch. Dann ist das so be-schlossen.

Ich eröffne die Aussprache und erteile das Wort für die Bundesregierung Herrn Bundesminister Dr. Thomas de Maizière.",TOP 2 Fragestunde,14095,chair,18
351,537545,,351,62,,,,,,Beifall bei der CDU/CSU sowie bei Ab-geordneten der SPD,TOP 2 Fragestunde,14095,poi,18
352,537546,https://www.abgeordnetenwatch.de/profile/johannes-singhammer,352,62,Vizepräsident Johannes Singhammer,Johannes Singhammer,johannes-singhammer,1582.0,,"Dr. Thomas de Maizière, Bundesminis-ter des Innern:

Herr Präsident! Meine Damen und Herren! Gut zwei Jahre ist es her, da hielt Semiya Simsek, die Tochter eines der ersten Mordopfer des NSU, bei der zentralen Gedenkveranstaltung im Konzert-haus eine sehr bewegende Rede. Viele von uns waren dabei, und viele werden sich ihr Leben lang daran erinnern. Ein Satz von ihr ist mir ganz be-sonders in Erinnerung geblieben. Sie sagte:

Elf Jahre durften wir nicht einmal reinen Ge-wissens Opfer sein.

Dieser Satz fasst wie unter einem Brennglas das Versagen des deutschen Staates, vielleicht aber auch unserer Gesellschaft insgesamt, im Umgang mit dem NSU zusammen. Lange, viel zu lange hatten die Sicherheitsbehörden in die fal-sche Richtung ermittelt, die Lage falsch einge-schätzt. Sie haben damit den Opfern und ihren Familien - sicher unbeabsichtigt - im Ergebnis zusätz-liches Leid zugefügt. Es waren aber nicht lediglich einzelne Fehler, Ermittlungspannen, die dafür gesorgt haben, dass der NSU so lange un-entdeckt bleiben konnte. Nein, es waren auch die Strukturen und die Haltungen von Sicherheitsbe-hörden, von Verantwortlichen, die dazu führten, dass die Ermittlungen so lange auf das Umfeld der Opfer begrenzt blieben.

Unser Staat - das ist mehrfach gesagt worden, auch bei dieser Veranstaltung, auch durch die Verantwortlichen der Sicherheitsbehörden selbst - hat mit diesem Versagen Schuld auf sich geladen. Diese Schuld und das, was wir den Opfern und ih-ren Familien damit angetan haben, können wir nicht ungeschehen machen. Es war, es ist und es bleibt deshalb unsere erste Pflicht, weiter aufzu-klären, wie es zu diesem fürchterlichen Versagen kommen konnte, aufzuklären, welche Strukturen und Haltungen dieses Versagen begünstigt haben. Zugleich kommt es darauf an, das für die Zukunft abzustellen.",TOP 2 Fragestunde,14095,chair,18
353,537547,,353,62,,,,,,Beifall bei der CDU/CSU und der SPD sowie bei Abgeordneten der LINKEN und des BÜNDNISSES 90/DIE GRÜNEN,TOP 2 Fragestunde,14095,poi,18
354,537548,https://www.abgeordnetenwatch.de/profile/johannes-singhammer,354,62,Vizepräsident Johannes Singhammer,Johannes Singhammer,johannes-singhammer,1582.0,,"Vieles ist getan worden, um Licht in das Dunkel zu bringen, um besser zu werden, vor allem auch durch die Parlamente. Seit drei Jahren wurden und werden die Versäumnisse von insgesamt sechs parlamentarischen Untersuchungsausschüssen aufgearbeitet. Über die Arbeit des Untersu-chungsausschusses dieses Parlaments haben wir viel geredet: 47 kluge, weitreichende und ein-stimmige Empfehlungen, die die Koalition komplett umsetzen möchte. Auf Länderseite haben die Un-tersuchungsausschüsse in Thüringen und Sach-sen ihre Arbeit beendet. Die Untersuchungsaus-schüsse in Hessen und Nordrhein-Westfalen nehmen ihre Arbeit auf. Heute hat Baden-Württemberg beschlossen, auch einen Untersu-chungsausschuss einzusetzen.

Das Verfahren vor dem OLG München - am Anfang auch kritisch begleitet; es hieß: zu lang, zu aufwendig; gefragt wurde: „Wie ist es mit der Presseberichterstattung?“; wir erinnern uns daran - mit fünf Angeklagten, 90 Nebenklägern und 600 Zeugen zeigt in seinem bisherigen Verlauf ein-drucksvoll, mit welcher großen Ernsthaftigkeit und Sorgfalt Gericht und Bundesanwaltschaft an der Aufklärung dieser konkreten Taten arbeiten. Das ist langsam, aber, glaube ich, gerade wegen der Gründlichkeit auch im Interesse der Opfer.

Im Hintergrund ermitteln Bundesanwaltschaft und Bundeskriminalamt unermüdlich und akribisch weiter gegen potenzielle weitere Täter. Sie gehen zahllosen Spuren nach, sehen sich Asservate im-mer und immer wieder im Lichte aktueller Er-kenntnisse an. Bund und Länder arbeiten gemein-sam unaufgeklärte Mordfälle auf, die lange zu-rückliegen, in der Hoffnung, sie doch noch aufzu-klären, indem man jetzt einen anderen Blick auf denkbare Ursachen, auch auf rechtsextremisti-sche Tathintergründe richtet.

Unmittelbar nach der Entdeckung der NSU-Terrorzelle sind die Behörden des Bundes im Ver-bund mit den Ländern aktiv geworden. Die Umset-zung der Empfehlungen des Untersuchungsaus-schusses des Deutschen Bundestages läuft auf Hochtouren. Das gilt für die Justiz- und Polizeibe-hörden, aber auch für die Nachrichtendienste. Bei der Bekämpfung des Rechtsextremismus und des Rechtsterrorismus hat sich in den vergangenen drei Jahren im Bund und in den Ländern sehr viel verändert: angefangen von der innerbehördlichen Organisation über die Zusammenarbeit der Behör-den bis zur Aus- und Fortbildung in vielen Berei-chen. Stellvertretend für viele Einzelmaßnahmen steht das Gemeinsame Abwehrzentrum gegen Rechtsextremismus/Rechtsterrorismus in Köln. Nach rund zwei Jahren hat es sich zu einer unver-zichtbaren Kommunikations- und Kooperations-plattform für die Länder und den Bund entwickelt. Das bedeutet: Heute wissen wir besser, wer die sogenannten gefährdungsrelevanten Personen im Bereich rechts sind, auf wen wir also besonders achten müssen.

Auch bei Empfehlungen, die nur von Bund und Ländern gemeinsam umgesetzt werden können, sind wir auf einem guten Weg. Viele Änderungen bei der Zusammenarbeit im Verfassungsschutz-verbund sind durch die Innenministerkonferenz be-reits beschlossen worden. Auch das Definitions-system „Politisch motivierte Kriminalität“ - das war ja, Herr Präsident, eben noch Gegenstand der Fragestunde - wird zurzeit zusammen mit den Ländern grundlegend auf Verbesserungsbedarf geprüft.

Das Gesetz über die Arbeit des Bundesamtes für Verfassungsschutz ist mit den Ländern weit-gehend erörtert, und wir legen es in Kürze, das heißt in wenigen Wochen, vor, sodass es dann im Deutschen Bundestag beraten werden kann. Da geht es insbesondere um die Beschreibung und Führung von V Leuten und die Informationsweiter-gabe - all das Dinge, die wir zu kritisieren hatten.

Auch bei der Aus- und Fortbildung unserer Mit-arbeiter besteht ein großer Handlungsbedarf. Da-rauf weisen auch die Mitglieder des Untersu-chungsausschusses immer wieder hin. Wir müs-sen kontinuierlich um Mitarbeiter werben, die ei-gene Migrationserfahrungen haben. Wir müssen das Versagen bei den Ermittlungen gegen den NSU auch im Hinblick auf unsere Schulungsmaß-nahmen aufarbeiten, gerade mit Blick auf junge Mitarbeiterinnen und Mitarbeiter. Sie müssen sich mit der Frage beschäftigen: Wie konnte das ge-schehen?

Wir brauchen einen anderen Umgang mit Feh-lern. Auch das ist ein Prozess, bei dem wir sicher noch nicht da angekommen sind, wo wir hinwol-len. Aber wir haben im Bund und in den Ländern begonnen, Fehler aufzuarbeiten.

Wir müssen unsere eigenen Mitarbeiter nach-haltig dazu ertüchtigen und ermutigen, Fehler und Zweifel an der Richtigkeit des bisher eingeschla-genen Weges auch anzusprechen. Nur so können wir aus den Fehlern und dem Versagen im Um-gang mit dem NSU lernen.

Semiya Simsek sprach vor zwei Jahren von ih-rer Trauer um den ermordeten Vater und davon - das hat mich genauso bewegt -, dass Deutsch-land immer noch ihre Heimat sei und bleiben wer-de, auch wenn sie, die sie sich noch nie in ihrem Leben Gedanken über Integration gemacht habe, erkennen musste, dass es hier in unserem Land Menschen gibt, die zu Mördern werden, nur weil jemand aus einem anderen Land stamme.

Gerade vor diesem Hintergrund - damit will ich schließen - ist es für mich unerträglich, dass vor gerade einmal zwei Wochen randalierende Rechtsextremisten gemeinsam mit anderen ge-waltbereiten Chaoten in Köln rechtsradikale Paro-len gebrüllt haben und die Menschen in der Kölner Innenstadt in Angst und Schrecken versetzt ha-ben, Polizisten verletzt haben, und all das mit Al-kohol und mit Ansage. Das können und werden wir nicht dulden.",TOP 2 Fragestunde,14095,chair,18
355,537549,,355,62,,,,,,"Beifall bei der CDU/CSU, der SPD und dem BÜNDNIS 90/DIE GRÜNEN sowie bei Abgeordneten der LINKEN",TOP 2 Fragestunde,14095,poi,18
356,537550,https://www.abgeordnetenwatch.de/profile/johannes-singhammer,356,62,Vizepräsident Johannes Singhammer,Johannes Singhammer,johannes-singhammer,1582.0,,"Wir können es erst recht nicht dulden, dass sich diese Rechtsextremisten unter dem Deckmantel des Kampfes gegen Islamisten in unseren Städten zusammenrotten. Hier muss unser Staat hart rea-gieren, um Grenzen aufzuzeigen. Wir sind und bleiben eine wehrhafte Demokratie, und wenn un-sere Polizei, wenn unser Staat und wenn unser Zusammenleben derart angegriffen werden, so müssen wir alle Kräfte bündeln, um gemeinsam unser friedliches Zusammenleben zu verteidigen. Das kann auch mal ein Verbot einer Demonstrati-on sein, vor allen Dingen, wenn sich absehen lässt, dass sie wahrscheinlich nicht friedlich ver-läuft. Ich möchte die Behörden in Hannover aus-drücklich ermuntern, diesen Weg so zu prüfen, dass ein solches Verbot möglichst auch vor Ge-richt Bestand hat.",TOP 2 Fragestunde,14095,chair,18
357,537551,,357,62,,,,,,Beifall bei der CDU/CSU und der SPD,TOP 2 Fragestunde,14095,poi,18
358,537552,https://www.abgeordnetenwatch.de/profile/johannes-singhammer,358,62,Vizepräsident Johannes Singhammer,Johannes Singhammer,johannes-singhammer,1582.0,,"Aber ein Verbot einer Demonstration allein löst das Problem natürlich auch nicht. Wir brauchen eine gesellschaftliche Isolierung von Gewalt als Mittel innenpolitischer Meinungsbildung. Toleranz und Vielfalt, Freiheit und Menschenwürde bleiben prägend für unser Land. Toleranz endet dort, wo Vielfalt, Freiheit und Menschenwürde gewaltsam angegriffen werden. Dies gemeinsam anzugehen, auch das sind wir den Opfern des NSU schuldig.",TOP 2 Fragestunde,14095,chair,18
359,537553,,359,62,,,,,,Beifall bei der CDU/CSU und der SPD sowie bei Abgeordneten des BÜNDNIS-SES 90/DIE GRÜNEN,TOP 2 Fragestunde,14095,poi,18
360,537554,https://www.abgeordnetenwatch.de/profile/johannes-singhammer,360,62,Vizepräsident Johannes Singhammer,Johannes Singhammer,johannes-singhammer,1582.0,,Für die Linke spricht jetzt die Kollegin Petra Pau.,TOP 2 Fragestunde,14095,chair,18
361,537555,,361,62,,,,,,Beifall bei der LINKEN,TOP 2 Fragestunde,14095,poi,18
