,id,profile_url,sequence,sitzung,speaker,speaker_cleaned,speaker_fp,speaker_key,speaker_party,text,top,top_id,type,wahlperiode
281,537475,https://www.abgeordnetenwatch.de/profile/michael-roth/archive/216871,281,62,"Michael Roth, Staatsminister im Auswärtigen Amt",Michael Roth,michael-roth,1687.0,,"Vielen Dank. - Herr Abgeordneter Ströbele, die Bundesregierung ist sich selbstverständlich der historischen Verantwortung aus den Jahren der deutschen Kolonialherrschaft in Kamerun sehr bewusst. Sie haben die -geschichtliche Erfor-schung der von Ihnen angeführten Vorgänge an-gemahnt. Nach Auffassung der Bundesregierung ist das in erster Linie Aufgabe der Wissenschaft.

Eine Forderung der Vertreter der Douala aus Kamerun zur Rehabilitierung von Rudolf Douala Manga Bell wurde gegenüber der Bundesregie-rung bislang nicht erhoben.

Im Jahr 2006 hat die Bundesregierung aus Mit-teln des Auswärtigen Amts im Rahmen des Kul-turerhalts ein Projekt in Douala finanziell unter-stützt, mit dem unter anderem an das Schicksal von Manga Bell und die Verantwortung der deut-schen Kolonialverwaltung erinnert wird. Die Deut-sche Botschaft hat dabei sehr eng mit den Nach-fahren des Königs von Douala zusammengearbei-tet. Es wird auch entsprechende Feierlichkeiten zum 100. Todestag von Manga Bell geben. Diese Feierlichkeiten werden von der Bundesregierung finanziell unterstützt. Auch unsere Botschaft in Jaunde hat ihre Bereitschaft bekundet, an diesen Feierlichkeiten zu Ehren des Verstorbenen teilzu-nehmen.",TOP 2 Fragestunde,14095,speech,18
282,537476,,282,62,Vizepräsident Peter Hintze,Peter Hintze,peter-hintze,,,"Zusatzfrage, Herr Abgeordneter Ströbele? - Bit-te schön.",TOP 2 Fragestunde,14095,chair,18
283,537477,https://www.abgeordnetenwatch.de/profile/hans-christian-strobele,283,62,Hans-Christian Ströbele (BÜNDNIS 90/DIE GRÜNEN),Hans-Christian Ströbele,hans-christian-strobele,1578.0,gruene,"Herr Staatsminister, es ist ja fast genau 100 Jahre her, dass Manga Bell verurteilt und hinge-richtet worden ist, nachdem er von einem deut-schen Kolonialgericht wegen parlamentarischer und anderer friedlicher und ziviler Aktivitäten für sein Volk in Deutschland zum Tode verurteilt wor-den ist. Nicht nur Manga Bell selber, sondern über 150 Menschen sind seinerzeit in der deutschen Kolonie hingerichtet worden. Es geht hier nicht nur um die historische Forschung - da gebe ich Ihnen ja recht; das ist im Wesentlichen Aufgabe der Wissenschaft -, sondern meine Frage geht auch dahin, ob die Bundesregierung bereit ist, ein Re-habilitationsverfahren einzuleiten oder eine solche Erklärung hier im Deutschen Bundestag und ge-genüber dem Volk der Douala abzugeben, ganz unabhängig davon, ob dazu ein förmlicher Antrag vorliegt.",TOP 2 Fragestunde,14095,speech,18
284,537478,https://www.abgeordnetenwatch.de/profile/michael-roth/archive/216871,284,62,"Michael Roth, Staatsminister im Auswärtigen Amt",Michael Roth,michael-roth,1687.0,,"Aber es ist schon entscheidend, ob es ein sol-ches Begehren und einen solchen Wunsch gibt. Er ist bislang nicht an uns herangetragen worden. Wir stehen mit den Nachkommen des Ermordeten und mit vielen anderen in engem Kontakt. Wir werden auch an den Feierlichkeiten mitwirken und sie finanziell unterstützen. Wie andere Regierun-gen vor uns stehen auch wir selbstverständlich zu diesem ganz schwierigen Kapitel der deutschen Kolonialherrschaft in Afrika. Wir wissen um unse-re historische Verantwortung.",TOP 2 Fragestunde,14095,speech,18
285,537479,,285,62,Vizepräsident Peter Hintze,Peter Hintze,peter-hintze,,,"Noch eine Zusatzfrage, Herr Abgeordneter Ströbele? - Bitte schön.",TOP 2 Fragestunde,14095,chair,18
286,537480,https://www.abgeordnetenwatch.de/profile/hans-christian-strobele,286,62,Hans-Christian Ströbele (BÜNDNIS 90/DIE GRÜNEN),Hans-Christian Ströbele,hans-christian-strobele,1578.0,gruene,"Herr Staatsminister, wollen Sie sich oder will sich der Minister nicht vielleicht ein Beispiel an der früheren Entwicklungshilfeministerin Frau Wieczorek-Zeul nehmen, die in die ehemalige Ko-lonie Deutschlands, nach Namibia, gereist ist und dort eine sehr bewegende und sehr zutreffende Erklärung zu dem Völkermord, den die deutschen Kolonialtruppen dort zu verantworten hatten, ab-gegeben hat? Ich glaube, das hat den Beziehun-gen zu Afrika, aber insbesondere natürlich zu dem betroffenen Land damals gutgetan. Das würde auch in diesem Falle erheblich helfen.",TOP 2 Fragestunde,14095,speech,18
287,537481,https://www.abgeordnetenwatch.de/profile/michael-roth/archive/216871,287,62,"Michael Roth, Staatsminister im Auswärtigen Amt",Michael Roth,michael-roth,1687.0,,"Herr Abgeordneter Ströbele, Ihre positive Wür-digung der auch im Namen der Bundesregierung vorgetragenen Bitte um Entschuldigung und Ver-gebung durch die damalige Bundesentwicklungs-hilfeministerin teile ich ausdrücklich; das sehe ich genauso wie Sie. Ich werde gerne einmal mit dem Bundesminister des Auswärtigen darüber spre-chen, wie wir mit unserer historischen Verantwor-tung in Kamerun umgehen.

Kamerun war immer ein Schwerpunkt unserer entwicklungspolitischen Zusammenarbeit. Seit der Unabhängigkeit sind im Rahmen der Entwick-lungszusammenarbeit über 900 Millionen Euro in konkrete Projekte in Kamerun geflossen. Dass Geld die historische Verantwortung, die wir haben, nicht in irgendeiner Weise zu relativieren vermag, ist mir natürlich klar. Aber wir stehen zu dieser Verantwortung. Wir stehen insbesondere zu Ka-merun. Das ist ja auch kein abgeschlossener Pro-zess.",TOP 2 Fragestunde,14095,speech,18
288,537482,https://www.abgeordnetenwatch.de/profile/johannes-singhammer,288,62,Vizepräsident Johannes Singhammer,Johannes Singhammer,johannes-singhammer,1582.0,,"Dazu gibt es keine weiteren Nachfragen.

Dann kommen wir zur Frage 10 der Ab-geordneten Heike Hänsel:

Teilt die Bundesregierung die Position des EU-Botschafters in Mexiko, Andrew Standley, dass für das Verschwinden der 43 Studierenden in Iguala nicht der Staat verantwortlich ist und deshalb auch keine Konsequenzen bezüglich der Beziehungen mit der EU gezogen werden - speziell das Freihandelsabkom-men betreffend (http://mexico.cnn.com/videos/2014/10/23/mexico-ante-el-reto-del-caso-ayotzinapa)?",TOP 2 Fragestunde,14095,chair,18
289,537483,https://www.abgeordnetenwatch.de/profile/michael-roth/archive/216871,289,62,"Michael Roth, Staatsminister im Auswärtigen Amt",Michael Roth,michael-roth,1687.0,,"Vielen Dank, Herr Präsident. - Frau Abgeordne-te Hänsel, der EU-Botschafter in Mexiko, Andrew -Standley, hat in einem Fernsehinterview für CNN am 23. Oktober dieses Jahres Folgendes klarge-stellt: Er sieht aufgrund der Vorfälle in Iguala kei-ne Notwendigkeit von Konsequenzen für die Be-ziehungen zwischen der EU und Mexiko und für das mit Mexiko auf Bundesebene - das möchte ich ausdrücklich unterstreichen - -abgeschlossene Freihandelsabkommen, da die mexikanische Bundesregierung nicht Urheber der Menschenrechtsverletzungen im Gliedstaat Guer-rero sei.

Er hat dabei die mutmaßliche Verstrickung lo-kaler Behörden nicht erwähnt, aber auch nicht in Zweifel gezogen. Er verwies in diesem Zusam-menhang auf die Resolution des Europäischen Parlaments vom gleichen Tage, die nach seiner Meinung einen ausgewogenen Ton zwischen der Verurteilung der Taten und gleichzeitiger Zusage der Unterstützung der mexikanischen Regierung seitens der EU bei der Bekämpfung der organi-sierten Kriminalität trifft.

Der Resolutionstext des Europäischen Parla-ments, den wir ebenso unterstützen und auch würdigen, verweist im Übrigen, Frau Abgeordnete Hänsel, klar auf die mutmaßliche Verwicklung lo-kaler Behörden in diese schlimmen Vorfälle. Ich erspare es Ihnen jetzt, die entsprechende Formu-lierung auf Englisch vorzutragen.",TOP 2 Fragestunde,14095,speech,18
290,537484,https://www.abgeordnetenwatch.de/profile/johannes-singhammer,290,62,Vizepräsident Johannes Singhammer,Johannes Singhammer,johannes-singhammer,1582.0,,"Frau Kollegin Hänsel, haben Sie eine Nachfrage dazu? - Dann haben Sie das Wort.",TOP 2 Fragestunde,14095,chair,18
291,537485,https://www.abgeordnetenwatch.de/profile/heike-hansel/archive/215687,291,62,Heike Hänsel (DIE LINKE),Heike Hänsel,heike-hansel,1594.0,linke,"Danke schön. - Dazu muss man sagen, viele Delegationen von uns reisen regelmäßig nach Mexiko. Wir sind dort seit Jahren mit einer fast 100-prozentigen Straflosigkeit auf allen Ebenen konfrontiert. Wenn Sie jetzt nach Mexiko fahren, stellen Sie eine 98-prozentige Straflosigkeit fest. Auch vor fünf Jahren bestand schon eine 98-prozentige Straflosigkeit. Das gilt unabhängig da-von, welche Regierung an der Macht ist.

Daher können Sie doch nicht davon sprechen, es gebe keine Verantwortung des Staates, wenn schlimme Verbrechen, egal auf welcher Ebene sie passieren, in großem Umfang nicht geahndet werden.

Der derzeit amtierende Präsident Nieto war sei-nerzeit als Gouverneur des Bundesstaates Mexiko für einen brutalen Polizeieinsatz verantwortlich, den er befehligt hat. Über 200 Menschen wurden dabei verhaftet und übel misshandelt. Ein 14-Jähriger wurde getötet. 40 Frauen wurden mas-senvergewaltigt durch die Polizei. Das alles hatte keine Konsequenzen.

Wie können Sie behaupten, dass es keine Ver-antwortung der Bundesebene für solche Verbre-chen gibt? Die 43 Studierenden sind nur die Spitze des Eisbergs. In einem anderen Bundesstaat sind 21 Jugendliche in einem Kaufhaus öffentlich hin-gerichtet worden.

Das heißt, es gibt natürlich eine Verantwortung des Bundesstaates. Diese können Sie hier auch nicht wegleugnen.",TOP 2 Fragestunde,14095,speech,18
292,537486,https://www.abgeordnetenwatch.de/profile/johannes-singhammer,292,62,Vizepräsident Johannes Singhammer,Johannes Singhammer,johannes-singhammer,1582.0,,Herr Staatsminister.,TOP 2 Fragestunde,14095,chair,18
293,537487,https://www.abgeordnetenwatch.de/profile/michael-roth/archive/216871,293,62,"Michael Roth, Staatsminister im Auswärtigen Amt",Michael Roth,michael-roth,1687.0,,"Nicht nur Delegationen des Deutschen Bundes-tages, sondern auch Delegationen der Bundesre-gierung reisen nach Mexiko. Erst kürzlich hat meine Kollegin Böhmer aus dem Auswärtigen Amt Mexiko besucht, und zwar vom 19. bis zum 24. Oktober. Ich kann Ihnen versichern, dass Frau Staatsministerin Böhmer die Vorfälle, die von Ihnen kritisiert werden, gegenüber hoch- und höchstrangigen Stellen der mexikanischen Regie-rung angesprochen hat.

Darüber hinaus hat sie sich zusammengesetzt mit Menschenrechtsverteidigern Mexikos. In Vor-bereitung dieser Reise hat es eine Fülle von Ge-sprächen mit Vertretern hiesiger Menschen-rechtsorganisationen zu diesem Thema gegeben.

Das Auswärtige Amt hat bereits am 8. Oktober zu diesen Vorfällen Gespräche mit der Nichtregie-rungsorganisation Menschenrechtskoordination Mexiko und mit Amnesty International geführt. Ich darf hinzufügen, dass auch unser Menschen-rechtsbeauftragter, Herr Strässer, ein Gespräch mit der NGO Menschenrechtskoordination Mexiko geführt hat. Darüber hinaus hat sich unsere Bot-schaft auch gegenüber der EU-Delegation in Me-xiko für eine entsprechende EU-Erklärung einge-setzt. Diese lokale Erklärung wurde am 12. Oktober veröffentlicht. Ferner habe ich deut-lich gemacht, dass die Bundesregierung die Re-solution des Europäischen Parlaments teilt, das sich sehr kritisch geäußert hat.

Nun möchte ich auf Ihre Forderung zurück-kommen - ich insinuiere das jetzt einfach einmal so -, die Modernisierung des Freihandelsabkom-mens mit Mexiko auszusetzen bzw. das in Ver-handlung befindliche Sicherheitsabkommen aus-zusetzen. Da es gerade um den Kampf gegen die organisierte Kriminalität geht, wäre es aus meiner Sicht geradezu hanebüchen, wenn wir jetzt vor dem Hintergrund dieser schrecklichen Verbrechen im Bundesstaat Guerrero unsere Verhandlungen aussetzen würden. Wir brauchen mehr Sicherheit. Wir müssen die Zusammenarbeit im Bereich der Bekämpfung der organisierten Kriminalität auswei-ten. Daher bin ich dafür, dass wir diese Verhand-lungen entschieden fortsetzen.",TOP 2 Fragestunde,14095,speech,18
294,537488,https://www.abgeordnetenwatch.de/profile/johannes-singhammer,294,62,Vizepräsident Johannes Singhammer,Johannes Singhammer,johannes-singhammer,1582.0,,"Frau Kollegin Hänsel, haben Sie noch eine zweite Nachfrage?",TOP 2 Fragestunde,14095,chair,18
295,537489,https://www.abgeordnetenwatch.de/profile/heike-hansel/archive/215687,295,62,Heike Hänsel (DIE LINKE),Heike Hänsel,heike-hansel,1594.0,linke,Ja.,TOP 2 Fragestunde,14095,speech,18
296,537490,https://www.abgeordnetenwatch.de/profile/johannes-singhammer,296,62,Vizepräsident Johannes Singhammer,Johannes Singhammer,johannes-singhammer,1582.0,,Bitte schön.,TOP 2 Fragestunde,14095,chair,18
297,537491,https://www.abgeordnetenwatch.de/profile/heike-hansel/archive/215687,297,62,Heike Hänsel (DIE LINKE),Heike Hänsel,heike-hansel,1594.0,linke,"Danke schön. - Herr Staatsminister, wenn Sie so umfassend mit Menschenrechtsgruppen wie Amnesty International und anderen sprechen, dann ist es eigentlich noch schlimmer, dass Sie nicht agieren, weil all diese Gruppen Ihnen wie auch uns allen bei allen Besuchen erzählen, dass der Staat Teil des Problems ist und dass diese Verbrechen nicht vonseiten der organisierten Kri-minalität begangen werden, sondern von Teilen des Sicherheitsapparates, der Polizei auf lokaler Ebene und auf Bundesebene und von Teilen des Militärs.

Genau deswegen fordern wir - damit komme ich zu meiner Frage -, dass man in dieser Situati-on einer massiven Unterwanderung seitens der Polizei- und Sicherheitskräfte, die Teil der organi-sierten Kriminalität und Täter dieser staatlichen Repressionen sind, kein Sicherheitsabkommen abschließt, bei dem es unter anderem darum geht, den Datenaustausch weiter zu forcieren und die Aufstandsbekämpfung weiter zu trainieren. Das heißt, man trainiert im Grunde Sicherheitskräfte, die kriminell vorgehen und für Menschenrechts-verletzungen verantwortlich sind. Das können Sie nicht verantworten.",TOP 2 Fragestunde,14095,speech,18
298,537492,https://www.abgeordnetenwatch.de/profile/michael-roth/archive/216871,298,62,"Michael Roth, Staatsminister im Auswärtigen Amt",Michael Roth,michael-roth,1687.0,,"Frau Abgeordnete Hänsel, ich teile Ihre Inter-pretation eines Sicherheitsabkommens ausdrück-lich nicht. Es geht gerade darum, Bürgerinnen und Bürger zu schützen und die individuelle Sicherheit zu erhöhen. Ich will auch vor dem Hintergrund der jüngsten Entwicklung hinzufügen, dass nach ak-tuellem Stand auf der mexikanischen Seite die Generalstaatsanwaltschaft, die auch mit der Strafverfolgung der Täter des Verbrechens von Guerrero beauftragt wurde, gerade über 20 ver-dächtigte Polizeibeamte festgenommen hat. Inso-fern will ich das jetzt nicht weiter bewerten.

Es tut sich etwas, aber Sie können sich darauf verlassen, dass wir in enger Abstimmung sind. Wir verlassen uns eben nicht nur auf die Gesprä-che mit der mexikanischen Regierung, sondern - ganz im Gegenteil - wir suchen den engen Aus-tausch und das direkte Gespräch mit den NGOs, mit Amnesty und anderen Organisationen, die ich Ihnen eben genannt habe. Das fließt auch in unse-re jeweilige Beurteilung mit ein. Die Beurteilung sieht aber anders aus als die Ihrige.",TOP 2 Fragestunde,14095,speech,18
299,537493,https://www.abgeordnetenwatch.de/profile/johannes-singhammer,299,62,Vizepräsident Johannes Singhammer,Johannes Singhammer,johannes-singhammer,1582.0,,Der Kollege Ströbele hat noch eine weitere Nachfrage. Darum erteile ich ihm das Wort.,TOP 2 Fragestunde,14095,chair,18
300,537494,https://www.abgeordnetenwatch.de/profile/hans-christian-strobele,300,62,Hans-Christian Ströbele (BÜNDNIS 90/DIE GRÜNEN),Hans-Christian Ströbele,hans-christian-strobele,1578.0,gruene,"Danke, Herr Präsident. - Herr Staatsminister, ich glaube, Sie haben etwas an der Frage vorbei geantwortet. Ich finde es gut, dass Sie dort mit Oppositionellen, aber auch mit NGOs und gerade auch mit Menschenrechts-organisationen reden. Das ist dringend erforderlich. Aber dann müssen Sie doch auch die Schreie aus den Massende-monstrationen zur Kenntnis genommen haben, die man aus Mexiko-Stadt bis nach Berlin hört. In Berlin findet derzeit - ich weiß nicht, ob Sie das wissen - eine 43-stündige Mahnwache im Geden-ken an die Toten und an die Zustände in Mexiko statt. Sie müssen doch zur Kenntnis nehmen, dass die Beschuldigungen sich nicht darauf be-schränken, dass lokale Behörden eine direkte Verantwortung für die mutmaßliche Ermordung - wir wissen noch nicht genau, was passiert ist - haben, sondern dass man die gesamte Administ-ration bis in die Regierung hinein der Komplizen-schaft verdächtigt und beschuldigt. Das müssen Sie doch zur Kenntnis nehmen, statt einfach zu sagen: Wir liefern denen jetzt Waffen und machen Sicherheitsabkommen und alles Mögliche, weil wir der Regierung vertrauen.

Uns interessiert: Welchen Wert legen Sie auf die Argumente der Menschenrechtsorganisationen und der Demonstranten, die solche Feststellungen oder Mutmaßungen äußern? Sagen Sie: „Da ist überhaupt nichts dran; die Regierung ist in jeder Hinsicht vertrauenswürdig und duldet diese schrecklichen Geschichten nicht, sondern sie macht wirklich etwas dagegen“? Die Beauftragung eines Generalstaatsanwalts ist wenig wert, solan-ge man nicht weiß, ob er nicht selber mit den ört-lichen Behörden in Verbindung steht. Deshalb ist meine Frage: Wie ernst nehmen Sie die anderen Darstellungen? Überprüfen Sie sie, und welche Meinung haben Sie dazu?",TOP 2 Fragestunde,14095,speech,18
301,537495,https://www.abgeordnetenwatch.de/profile/johannes-singhammer,301,62,Vizepräsident Johannes Singhammer,Johannes Singhammer,johannes-singhammer,1582.0,,Herr Staatsminister.,TOP 2 Fragestunde,14095,chair,18
302,537496,https://www.abgeordnetenwatch.de/profile/michael-roth/archive/216871,302,62,"Michael Roth, Staatsminister im Auswärtigen Amt",Michael Roth,michael-roth,1687.0,,"Herr Abgeordneter Ströbele, wir nehmen alle Vorwürfe sehr ernst. Deshalb befinden wir uns auch mit allen Verantwortlichen im engen Aus-tausch. Damit hier kein falscher Eindruck ent-steht: Ich bin stolz darauf, für ein Auswärtiges Amt arbeiten zu dürfen, das sich nicht nur als Mi-nisterium für internationale Beziehungen versteht, sondern vor allem als Menschenrechtsministeri-um. Das ist ein wesentliches Element unserer po-litischen Bemühungen auf der internationalen Ebene. Ich darf Ihnen versichern, dass sich alle Kolleginnen und Kollegen, die in meinem Haus in Verantwortung stehen, der Stärkung der Men-schenrechte und ihrer Universalität verpflichtet fühlen. Dabei ist uns völlig egal, um welches Land es geht. Wir setzen uns überall für die Einhaltung der Menschenrechte ein. Ich freue mich, dass Sie dabei an unserer Seite stehen, Herr Abgeordneter Ströbele.",TOP 2 Fragestunde,14095,speech,18
303,537497,https://www.abgeordnetenwatch.de/profile/markus-kurth/archive/215170,303,62,Markus Kurth [BÜNDNIS 90/DIE GRÜ-NEN],Markus Kurth,markus-kurth,1590.0,gruene,Die Frage ist damit aber nicht be-antwortet!,TOP 2 Fragestunde,14095,poi,18
304,537498,https://www.abgeordnetenwatch.de/profile/michael-roth/archive/216871,304,62,"Michael Roth, Staatsminister im Auswärtigen Amt",Michael Roth,michael-roth,1687.0,,"- Ich beantworte die Fragen so, wie ich meine, sie beantworten zu müssen.",TOP 2 Fragestunde,14095,speech,18
305,537499,https://www.abgeordnetenwatch.de/profile/johannes-singhammer,305,62,Vizepräsident Johannes Singhammer,Johannes Singhammer,johannes-singhammer,1582.0,,Für eine weitere Nachfrage hat der Kollege Lenkert das Wort.,TOP 2 Fragestunde,14095,chair,18
306,537500,https://www.abgeordnetenwatch.de/profile/ralph-lenkert/archive/215580,306,62,Ralph Lenkert (DIE LINKE),Ralph Lenkert,ralph-lenkert,1442.0,linke,"Sehr geehrter Herr Staatsminister, es gibt zu-mindest berechtigte Zweifel an der Zuverlässigkeit von Behörden in einigen mexikanischen Bundes-staaten. Wir haben im Gegensatz zu Ihnen auch Zweifel an der Rechtmäßigkeit einiger Verhal-tensweisen der Zentralregierung in Mexiko. Vor dem Hintergrund, dass Schusswaffen, die von Heckler & Koch nach Mexiko geliefert wurden, in völlig andere Kanäle gelangt sind, möchte ich Sie fragen, ob Sie zukünftig planen, keine Waffenliefe-rungen nach Mexiko mehr zuzulassen.",TOP 2 Fragestunde,14095,speech,18
307,537501,https://www.abgeordnetenwatch.de/profile/michael-roth/archive/216871,307,62,"Michael Roth, Staatsminister im Auswärtigen Amt",Michael Roth,michael-roth,1687.0,,"Wie Sie wissen, gibt es eine sehr restriktive Regelung betreffend den Export von Waffen in Länder außerhalb der Europäischen Union und der NATO. Wir werden weiterhin - hier ist das Bun-desministerium für Wirtschaft und Energie feder-führend - auf die restriktiven Maßstäbe bei der Umsetzung achten. Darauf können Sie sich ver-lassen.",TOP 2 Fragestunde,14095,speech,18
308,537502,https://www.abgeordnetenwatch.de/profile/johannes-singhammer,308,62,Vizepräsident Johannes Singhammer,Johannes Singhammer,johannes-singhammer,1582.0,,"Damit kommen wir zu Frage 11 der Kollegin Heike Hänsel:

Inwieweit hat die Bundesregierung Kenntnis darüber, ob die extrem rechte Partei Swoboda vor allem deshalb trotz Schei-terns an der Fünfprozenthürde über Direktmandate im ukraini-schen Parlament vertreten sein wird, weil die Partei des ukraini-schen Präsidenten, Block Petro Poroschenko, in den Wahlkrei-sen, in denen Swoboda bei den vergangenen Wahlen Direkt-mandate geholt hat, als Dank für die Unterstützung bei der Auf-lösung des Parlaments und damit der Ausrichtung von vorge-zogenen Wahlen auf eigene Kandidaten verzichtet bzw. nur schwache Kandidaten aufgestellt hat und somit dieser extrem rechten Partei einen Verbleib in der Werchowna Rada gesichert hat, und teilt die Bundesregierung die Auffassung, dass diese Art der Organisation des Wahl-ergebnisses derjenigen stark äh-nelt, die die Partei der Regionen unter dem Präsidenten Wiktor Janukowitsch bei den Parlamentswahlen 2012 angewandt hat (http://library.fes.de/pdf-files/id-moe/10998.pdf)?

Das Wort hat wiederum der Herr Staatsminis-ter.",TOP 2 Fragestunde,14095,chair,18
309,537503,https://www.abgeordnetenwatch.de/profile/michael-roth/archive/216871,309,62,"Michael Roth, Staatsminister im Auswärtigen Amt",Michael Roth,michael-roth,1687.0,,"Vielen Dank. - Frau Abgeordnete Hänsel, in Ih-rer Frage beziehen Sie sich auf die jüngsten Wah-len zum ukrainischen Parlament, zu der soge-nannten Rada. Bei den Wahlen am 26. Oktober haben - das darf ich persönlich hinzufügen - er-freulicherweise extremistische, radikale Parteien - anders als noch im Jahr 2012 - einen ausgespro-chen geringen Zulauf erhalten. Die Partei Rechter Sektor scheiterte sehr deutlich an der Fünfpro-zenthürde und konnte nur ein einziges Direktman-dat erzielen. Die rechtsnationalistische Swoboda scheiterte ebenfalls an der Fünfprozenthürde. Die rechtspopulistische Radikale Partei blieb mit etwa 7,5 Prozent hinter den Erwartungen zurück. Vor diesem Hintergrund gehen wir davon aus - das ist die Bewertung der Wahlergebnisse -, dass na-tionalistische, extremistische und radikale Kräfte keinen Einfluss auf die Politik der Ukraine haben werden. Auch dieser Hinweis sei mir gestattet: Solche schlechten Wahlergebnisse von Rechts-extremisten und Populisten würde ich mir auch in manchem Mitgliedsland der Europäischen Union wünschen.

Der Bundesregierung sind Presseberichte be-kannt, nach denen sich der Block Petro Poro-schenko und die Partei Swoboda bei der Aufstel-lung von Direktkandidaten abgesprochen haben sollen. Bei dieser Absprache ging es vor allem da-rum, die Erfolgschancen der jeweiligen Kandida-ten beider Parteien zu erhöhen. Absprachen dieser Art verstoßen nach Kenntnis der Bundesregierung nicht gegen ukrainisches Recht. Sie werden sich daran erinnern, dass noch im Jahr 2012 der Partei der Regionen klar rechtswidrige Handlungen vor-geworfen worden sind wie Wählerbestechung, Missbrauch administrativer Ressourcen und direk-te Wahlfälschung. Nun liegen die vorläufigen Schlussfolgerungen der OSZE-Wahlbe-obachtungsmission vor. Die OSZE hat bei den jüngsten Wahlen am 26. Oktober derartige Prakti-ken nicht beobachtet bzw. nur in einigen wenigen Einzelfällen. Dabei geht es um Wählerbestechung.",TOP 2 Fragestunde,14095,speech,18
310,537504,https://www.abgeordnetenwatch.de/profile/johannes-singhammer,310,62,Vizepräsident Johannes Singhammer,Johannes Singhammer,johannes-singhammer,1582.0,,"Frau Kollegin Hänsel, haben Sie dazu eine Nachfrage? - Bitte schön.",TOP 2 Fragestunde,14095,chair,18
