,id,profile_url,sequence,sitzung,speaker,speaker_cleaned,speaker_fp,speaker_key,speaker_party,text,top,top_id,type,wahlperiode
0,537194,,0,62,Vizepräsident Peter Hintze,Peter Hintze,peter-hintze,,,"Die Sitzung ist eröffnet.

Interfraktionell ist vereinbart worden, den Ent-wurf eines Zweiten Gesetzes zur Änderung des Bundesdatenschutzgesetzes zur Stärkung der Unabhängigkeit der Datenschutzaufsicht im Bund auf Drucksache 18/2848 dem Haushaltsaus-schuss zur Mitberatung zu überweisen.

Darüber hinaus sollen die Unterrichtungen der Bundesregierung zu Stellungnahmen des Bundes-rates und Gegenäußerungen der Bundesregierung auf den Drucksachen 18/3000 und 18/3004 zu den bereits überwiesenen Gesetzentwürfen zur Ände-rung des Freizügigkeitsgesetzes bzw. zur Ände-rung des Asylbewerberleistungsgesetzes auf den Drucksachen 18/2581 und 18/2592 an die ent-sprechenden federführenden und mitberatenden Ausschüsse überwiesen werden. Sind Sie damit einverstanden? - Ich höre keinen Widerspruch. Dann ist das so beschlossen.

Ich rufe den Tagesordnungspunkt 1 auf:

Befragung der Bundesregierung

Die Bundesregierung hat als Thema der heuti-gen Kabinettssitzung mitgeteilt: Entwurf eines Dritten Gesetzes zur Änderung des Bundes-fernstraßenmautgesetzes - Ausweitung der Lkw-Maut.

Das Wort für den einleitenden fünfminütigen Be-richt hat der Bundesminister für Verkehr und digi-tale Infrastruktur, Herr Alexander Dobrindt. - Bitte schön, Herr Minister.",TOP 1 Befragung der Bundesregierung,14094,chair,18
1,537195,https://www.abgeordnetenwatch.de/profile/alexander-dobrindt-0,1,62,"Alexander Dobrindt, Bundesminister für Ver-kehr und digitale Infrastruktur",Alexander Dobrindt,alexander-dobrindt,1847.0,,"Herzlichen Dank. - Herr Präsident! Liebe Kolle-ginnen und Kollegen! Wir haben nicht nur in Deutschland, sondern an vielen Stellen in Europa Diskussionen darüber, wie wir die Wettbewerbsfä-higkeit, das Wachstum unserer Wirtschaft und Arbeitsplätze in Zukunft verstetigen können. Eine der Grundlagen dafür ist immer Zustand, Qualität und Ausbau der Infrastruktur.

Deswegen hat sich die Bundesregierung zu Fragen der Infrastrukturfinanzierung in der Ver-gangenheit immer dahin gehend geäußert, dass wir einen Investitionshochlauf organisieren wer-den, der die Chance bietet, mehr Geld in Infra-struktur zu investieren. Ein wesentlicher Bestand-teil dieses Hochlaufs ist das 5-Milliarden-Euro-Paket, das in dieser Wahlperiode einen Hochlauf der Investitionen um 500 Millionen Euro mehr in diesem Jahr, 1 Milliarde Euro mehr im nächsten Jahr usw. vorsieht, bis dann im Jahre 2017 in der Gesamtsumme der Investitionen ein Spitzenwert von 12 Milliarden Euro erreicht werden kann.

Wir begleiten diesen Investitionshochlauf unter anderem mit der stärkeren Nutzerfinanzierung. Ein Teil dieser Nutzerfinanzierung ist die Lkw-Maut. Sie wissen, dass gerade der Güterverkehr in den nächsten Jahren weiter massiv ansteigen wird: auf der Straße, auf der Schiene und auf den Was-serwegen. Wir werden in den nächsten 15 Jahren auf der Straße einen Zuwachs von 40 Prozent beim Güterverkehr zu verzeichnen haben. Das zeigt auch schon die Herausforderungen: erstens für die Belastung der Straßen und zweitens für Unterhalt, Reparatur und auch Neubau von Stra-ßen.

Wir haben im Rahmen der Beratungen des Entwurfs eines Dritten Gesetzes zur Änderung des Bundesfernstraßenmautgesetzes heute be-schlossen, dass wir im nächsten Jahr die Verbrei-terung und Vertiefung der Lkw-Maut vornehmen werden. Verbreiterung und Vertiefung heißt, dass zum 1. Juli die vierspurigen Bundesstraßen in das Mautsystem und zum 1. Oktober 2015 die Lkw-Klasse von 7,5 bis 12 Tonnen in das Mautsystem einbezogen werden.

Zusammen werden diese beiden Maßnahmen in einem ganzen Jahr Mehreinnahmen in Höhe von 380 Millionen Euro erbringen. Im Startjahr, dem Rumpfjahr 2015, werden es in der Summe circa 115 Millionen Euro sein. Das ist klar, weil wir erst Mitte bis Ende des Jahres, also zum 1. Juli bzw. zum 1. Oktober, starten können. Langfristig stärkt das unsere Möglichkeiten zu mehr Investitionen in unsere Straßeninfrastruktur. Perspektivisch pla-nen wir, die Lkw-Maut im Jahr 2018 auf alle Bun-desstraßen auszudehnen. Das Finanzvolumen wird durch ein entsprechendes Wegekostengut-achten ermittelt werden. Dieses Gutachten wird perspektivisch bereits vorbereitet.

Wenn wir das Ziel, die Einbeziehung von Lkws mit 7,5 Tonnen bis 12 Tonnen und von vierspuri-gen Bundesstraßen, erreicht haben, werden wir einen wesentlichen Teil der Investitionslücke schließen können, die gemäß dem Wegekosten-gutachten aufgrund von Mindereinnahmen bei der bisherigen Lkw-Maut entstanden ist. Diese gehen auf einen Zinseffekt zurück: Zinsvorteile aufgrund der geringen Zinsen, die zurzeit herrschen, müs-sen nämlich an die Nutzer der Straße weitergege-ben werden. Straße ist letztlich gebundenes Kapi-tal und wird zumindest nach der bisherigen Lesart auch mit Zinsen versehen. Ich habe in der Ver-gangenheit darauf hingewiesen, dass ich mir im Sinne einer langfristigen und verlässlichen Finan-zierungsstruktur wünschen würde, dass der Zins-effekt bei der Berechnung der Mautgebühren nicht so durchschlägt. Wir sind deswegen in Brüssel initiativ geworden. Wir wollen gemeinsam mit den Kollegen der Kommission dafür sorgen, dass bei zukünftigen Wegekostengutachten, die ja die Grundlage für Mautgebühren sind, der Zinseffekt geringer ausfällt und dadurch mehr Verlässlichkeit bei den Einnahmen und damit für die Finanzierung der Infrastruktur sichergestellt werden kann.

In der jetzigen Wahlperiode helfen uns die ge-rade dargestellten Maßnahmen, die entstandene Lücke zu schließen. Wir werden sie auch über-kompensieren. Das heißt, am Schluss wird von den Einnahmen, die wir über Verbreiterung und Vertiefung erreichen, auch zusätzliches Geld für Investitionen in die Infrastruktur übrig bleiben. Das sind also Maßnahmen, die auf dem Weg zur stär-keren Nutzerfinanzierung einen weiteren Meilen-stein darstellen und umgehend, das heißt schon im nächsten Jahr, haushaltswirksam werden kön-nen.

Ich freue mich, dass dies allgemein sehr positiv aufgenommen wird. Es ebnet uns den Weg zur Hereinnahme aller Bundesstraßen in die Lkw-Maut 2018 und damit zu einer noch stärkeren Nutzerfi-nanzierung.

Danke schön.",TOP 1 Befragung der Bundesregierung,14094,speech,18
2,537196,,2,62,Vizepräsident Peter Hintze,Peter Hintze,peter-hintze,,,"Wir haben eine ganze Reihe von Fragen. Ich lese die Fragesteller vor, damit sich jeder geistig darauf einstellen kann: Frau Dr. Wilms, Bündnis 90/Die Grünen, Herr Gastel, Bündnis 90/Die Grü-nen, Herr Behrens, Fraktion Die Linke, Herr Bil-ger, CDU/CSU-Fraktion, Frau Haßelmann, Bünd-nis 90/Die Grünen, Herr Kühn, Bündnis 90/Die Grünen, Herr Krischer, Bündnis 90/Die Grünen, und Frau Leidig, Fraktion Die Linke.

Ich gebe jetzt Frau Dr. Wilms, Bündnis 90/Die Grünen, das Wort.",TOP 1 Befragung der Bundesregierung,14094,chair,18
3,537197,https://www.abgeordnetenwatch.de/profile/valerie-wilms,3,62,Dr. Valerie Wilms (BÜNDNIS 90/DIE GRÜNEN),Dr. Valerie Wilms,valerie-wilms,1276.0,gruene,"Vielen Dank, Herr Präsident. - Herr Minister Dobrindt, Sie haben eben gesagt, Sie wollen im Rahmen der Verbreiterung und Vertiefung der Lkw-Maut auf 7,5 Tonnen heruntergehen. Hier klafft aber noch eine Lücke zu Ihrem Referenten-entwurf, der letzte Woche auf der Pressekonfe-renz zum Thema „Pkw-Maut“ bekannt geworden ist; da hat man dies vernehmen können. Es gibt jetzt die schöne Lücke zwischen 3,5 Tonnen und 7,5 Tonnen. Aus welchem Grund nehmen Sie ei-gentlich diese Fahrzeuge - mit Ausnahme der Wohnmobile - aus? Was steckt dahinter? Ich kann das irgendwie nicht nachvollziehen. Auch solche Fahrzeuge nutzen doch die Straßen und nutzen sie in irgendeiner Weise ab.",TOP 1 Befragung der Bundesregierung,14094,speech,18
4,537198,,4,62,Zurufe vom BÜNDNIS 90/DIE GRÜNEN,vom BÜNDNIS 90/DIE GRÜNEN,vom-bundnis-90-die-grunen,,gruene,Herr Minister!,TOP 1 Befragung der Bundesregierung,14094,poi,18
5,537199,,5,62,Vizepräsident Peter Hintze,Peter Hintze,peter-hintze,,,Herr Minister.,TOP 1 Befragung der Bundesregierung,14094,chair,18
6,537200,https://www.abgeordnetenwatch.de/profile/alexander-dobrindt-0,6,62,"Alexander Dobrindt, Bundesminister für Ver-kehr und digitale Infrastruktur",Alexander Dobrindt,alexander-dobrindt,1847.0,,"Verzeihung. Ich hatte nicht damit gerechnet, dass Frau Wilms schon fertig ist. - Liebe Frau Wilms, wenn Sie sich den Gesetzentwurf, wie wir ihn heute im Kabinett beschlossen haben, an-schauen, dann werden Sie feststellen, dass da ein Prüfauftrag formuliert worden ist, nämlich zu prü-fen, wie und ob - wahrscheinlich eher: wie - man die Klasse von Fahrzeugen zwischen 3,5 und 7,5 Tonnen in ein Mautsystem miteinbeziehen kann. Das war auch ausdrücklicher Wunsch von betei-ligten Ressorts.

Ich teile nicht hundertprozentig Ihre Einschät-zung, dass es eine Lücke gibt. Wir haben viel-mehr zwei Systeme, die nebeneinander existieren: zum einen das System der Güterverkehre, das von den Lkws abgebildet wird, zum anderen das System der Personenverkehre, das von den Pkws abgebildet wird. Sie existieren nebeneinander und unterliegen daher sehr unterschiedlichen Rege-lungen. Sie wissen: In der Eurovignetten-Richtlinie, also dem europäischen Regelwerk, sind Regelungen für Fahrzeuge ab 3,5 Tonnen auf-wärts formuliert - nicht darunter.

Es gibt aktuell keine Überlegungen im Haus, was die Bemautung der 3,5- bis 7,5-Tonner be-trifft; aber im Gesetzentwurf ist ein diesbezügli-cher Prüfauftrag deutlich formuliert. Der Prüfauf-trag wird auch umgesetzt werden. Von daher kann man davon ausgehen, dass wir uns in naher Zu-kunft mit dieser Frage beschäftigen müssen. Das wird allerdings nicht mehr in diesem Jahr sein. Ergebnisse einer Prüfung kann ich - da bitte ich um Verständnis - beim besten Willen nicht vor-wegnehmen.",TOP 1 Befragung der Bundesregierung,14094,speech,18
7,537201,,7,62,Vizepräsident Peter Hintze,Peter Hintze,peter-hintze,,,"Nächste Frage: Herr Abgeordneter Gastel, Bündnis 90/Die Grünen.",TOP 1 Befragung der Bundesregierung,14094,chair,18
8,537202,https://www.abgeordnetenwatch.de/profile/matthias-gastel/archive/215312,8,62,Matthias Gastel (BÜNDNIS 90/DIE GRÜNEN),Matthias Gastel,matthias-gastel,1552.0,gruene,"Vielen Dank. - Herr Minister, ich habe eine Frage, die sich auf einen datenschutzrechtlichen Vergleich zwischen der bestehenden Lkw-Maut und Ihrer geplanten Pkw-Maut bezieht. Sie planen ja, die Daten bei der Pkw-Maut einen Monat län-ger, als das jeweils abgelaufene Jahr dauert, zu speichern. Was ist da der Hintergrund? Planen Sie ein ähnliches Vorgehen, eine entsprechende Änderung auch im Bereich der Lkw-Maut, wo die Daten ja bisher sofort wieder gelöscht werden?",TOP 1 Befragung der Bundesregierung,14094,speech,18
9,537203,,9,62,Vizepräsident Peter Hintze,Peter Hintze,peter-hintze,,,Herr Minister.,TOP 1 Befragung der Bundesregierung,14094,chair,18
10,537204,https://www.abgeordnetenwatch.de/profile/alexander-dobrindt-0,10,62,"Alexander Dobrindt, Bundesminister für Ver-kehr und digitale Infrastruktur",Alexander Dobrindt,alexander-dobrindt,1847.0,,"Lieber Kollege Gastel, wir haben die Regelun-gen zum Datenschutz, die wir aus dem Bereich der Lkw-Maut kennen - es sind die schärfsten Da-tenschutzregelungen, die bisher in einem Gesetz zu finden sind -, gerade was die ausschließliche Verwendung dieser Daten für das Mautsystem und den Ausschluss der Verwendung der Daten für andere Zwecke - sprich: auch durch andere Behörden - anbelangt, in unseren Gesetzentwurf zur Infrastrukturabgabe, der sogenannten Pkw-Maut, übernommen. Das heißt - ich habe auch dies schon öffentlich formuliert -, dass wir aus-drücklich widersprechen, dass die Daten einer an-deren Nutzung zugeführt werden.",TOP 1 Befragung der Bundesregierung,14094,speech,18
11,537205,https://www.abgeordnetenwatch.de/profile/valerie-wilms,11,62,Dr. Valerie Wilms [BÜNDNIS 90/DIE GRÜNEN],Dr. Valerie Wilms,valerie-wilms,1276.0,gruene,Aber 13 Monate!,TOP 1 Befragung der Bundesregierung,14094,poi,18
12,537206,https://www.abgeordnetenwatch.de/profile/alexander-dobrindt-0,12,62,"Alexander Dobrindt, Bundesminister für Ver-kehr und digitale Infrastruktur",Alexander Dobrindt,alexander-dobrindt,1847.0,,"Dass dies passiert, ist sogar explizit ausge-schlossen.

Die Kontrolldaten, die wir erheben, werden grundsätzlich unverzüglich gelöscht. Das ist im Gesetz so vorgesehen. Bei der erstmaligen Kon-trolle innerhalb des Gültigkeitszeitraumes einer Jahresvignette werden das Kennzeichen und der Tag der Kontrolle festgehalten, wobei die Aufbe-wahrungszeit je nach Zeitpunkt der Kontrolle in-nerhalb des Zeitraums der Gültigkeit einer Jah-resvignette 1 Monat bis maximal 13 Monate be-tragen kann.  Es geht dabei darum, dass wir uns für Härtefälle eine -Erstattung auf Antrag vorstellen können, wenn nachgewiesen wird, dass ein Kraftfahrzeug im gesamten Entrichtungszeit-raum nicht genutzt worden ist. Um jedoch unge-rechtfertigten Erstattungen vorzubeugen, ist vor-gesehen, dass einmalig innerhalb der Gültigkeit der Jahresvignette das Kennzeichen und der Tag der Kontrolle des Kfz mit einer Jahresvignette ge-speichert werden können.

Es geht dabei um die einmalige Feststellung der Nutzung des Netzes innerhalb des Gültig-keitszeitraums einer Jahresvignette. Die Feststel-lung findet ausschließlich über das Kennzeichen und den Tag der Nutzung statt. Eine Verwendung dieser Daten ist ausschließlich für den Zweck der Erstattung vorgesehen. Eine Übermittlung oder Beschlagnahme dieser Daten für andere Zwecke ist nicht zulässig.",TOP 1 Befragung der Bundesregierung,14094,speech,18
13,537207,https://www.abgeordnetenwatch.de/profile/herbert-behrens/archive/215393,13,62,Herbert Behrens [DIE LINKE],Herbert Behrens,herbert-behrens,1344.0,linke,Für zwei Fragen fünf Antwortzeiträume ver-braucht!,TOP 1 Befragung der Bundesregierung,14094,poi,18
14,537208,https://www.abgeordnetenwatch.de/profile/alexander-dobrindt-0,14,62,"Alexander Dobrindt, Bundesminister für Ver-kehr und digitale Infrastruktur",Alexander Dobrindt,alexander-dobrindt,1847.0,,"Von daher sehen Sie, worum es an dieser Stelle geht, nämlich darum, einmalig festzuhalten, ob ein Befahren des Netzes stattgefunden hat. Grund da-für ist, Erstattungen oder Erstattungsanfragen möglich zu machen bzw. unberechtigte Anfragen entsprechend zu beantworten.",TOP 1 Befragung der Bundesregierung,14094,speech,18
15,537209,,15,62,Vizepräsident Peter Hintze,Peter Hintze,peter-hintze,,,"Schönen Dank. - Ich bin von der Fraktion Die Linke darauf hingewiesen worden, dass die Abge-ordneten und die Regierungsmitglieder bitte die Redezeitampel beachten. Die Frage war allerdings so komplex, dass eine ausführliche Antwort aus meiner Sicht für das Haus wichtig war.",TOP 1 Befragung der Bundesregierung,14094,chair,18
16,537210,,16,62,Zuruf von der CDU/CSU,von der CDU/CSU,von-der-cdu-csu,,cducsu,Sehr richtig!,TOP 1 Befragung der Bundesregierung,14094,poi,18
17,537211,,17,62,Vizepräsident Peter Hintze,Peter Hintze,peter-hintze,,,Herr Kollege Behrens von der Fraktion Die Lin-ke stellt die nächste Frage.,TOP 1 Befragung der Bundesregierung,14094,chair,18
18,537212,https://www.abgeordnetenwatch.de/profile/herbert-behrens/archive/215393,18,62,Herbert Behrens (DIE LINKE),Herbert Behrens,herbert-behrens,1344.0,linke,"Herr Minister, ich würde mich über eine kurze, aber hoffentlich inhaltsreiche Antwort freuen. - Sie stellen jetzt einen von Ihnen vorgelegten Gesetz-entwurf vor, in dem es um die Frage der Auswei-tung der Maut für Lkw geht. Dieses Thema ist nicht neu. Wir haben bereits im letzten Jahr dar-über gesprochen, dass es eigentlich notwendig ist, weitere Straßen mit einer Lkw-Maut zu bele-gen. Zum damaligen Zeitpunkt war das angeblich aus technischen Gründen nicht möglich. Das Ar-gument ist jetzt aufgehoben.

Aber auch in der zweiten Runde sind es nicht mehr als 1 000 Kilometer Bundesstraßen, die zu-sätzlich in die Bemautung einbezogen werden können. Das ist eindeutig zu wenig, weil dahinter nicht nur steht, dass wir mehr Geld für das Ver-kehrssystem brauchen, sondern wir auch eine verkehrspolitische Maßnahme damit verbinden wollen, nämlich eine Lenkungswirkung erzielen wollen. Darum sind die Anforderungen an eine Maut einfach andere als die bloße Überlegung, ob wir damit genug Geld hereinbekommen oder nicht.

Die Zeitspanne der Verbändeanhörung - nun zu meiner Frage - war sehr kurz bemessen. Der Bundesverband Güterkraftverkehr Logistik und Entsorgung hat das angemahnt. Warum ist die Frist für die Verbändeanhörung so kurz gewesen? Wie viele Stellungnahmen gab es? Welche dieser Stellungnahmen haben Sie in Ihrem neuen Entwurf eingebaut?",TOP 1 Befragung der Bundesregierung,14094,speech,18
19,537213,,19,62,Vizepräsident Peter Hintze,Peter Hintze,peter-hintze,,,"Das waren jetzt schon drei Fragen und damit eigentlich zwei mehr, als die Geschäftsordnung vorsieht. Deswegen braucht der Minister auch die Zeit, sie zu beantworten. - Bitte, Herr Minister.",TOP 1 Befragung der Bundesregierung,14094,chair,18
20,537214,https://www.abgeordnetenwatch.de/profile/alexander-dobrindt-0,20,62,"Alexander Dobrindt, Bundesminister für Ver-kehr und digitale Infrastruktur",Alexander Dobrindt,alexander-dobrindt,1847.0,,"Wenn ich Sie richtig verstanden habe, Herr Behrens, bemängeln Sie zwar, dass die Entschei-dung zur Bemautung der vierspurigen Bundes-straßen zu spät getroffen worden sei, aber Sie begrüßen, dass sie kommt.",TOP 1 Befragung der Bundesregierung,14094,speech,18
21,537215,https://www.abgeordnetenwatch.de/profile/herbert-behrens/archive/215393,21,62,Herbert Behrens [DIE LINKE],Herbert Behrens,herbert-behrens,1344.0,linke,Jeder Schritt ist nötig!,TOP 1 Befragung der Bundesregierung,14094,poi,18
22,537216,https://www.abgeordnetenwatch.de/profile/alexander-dobrindt-0,22,62,"Alexander Dobrindt, Bundesminister für Ver-kehr und digitale Infrastruktur",Alexander Dobrindt,alexander-dobrindt,1847.0,,- Bitte? Der Schritt ist gut?,TOP 1 Befragung der Bundesregierung,14094,speech,18
23,537217,https://www.abgeordnetenwatch.de/profile/herbert-behrens/archive/215393,23,62,Herbert Behrens [DIE LINKE],Herbert Behrens,herbert-behrens,1344.0,linke,Jeder Schritt ist nötig!,TOP 1 Befragung der Bundesregierung,14094,poi,18
24,537218,https://www.abgeordnetenwatch.de/profile/alexander-dobrindt-0,24,62,"Alexander Dobrindt, Bundesminister für Ver-kehr und digitale Infrastruktur",Alexander Dobrindt,alexander-dobrindt,1847.0,,"Die von Ihnen angesprochenen 1 000 Kilometer sind tatsächlich 1 100 Kilometer. Das heißt, dass alle vierspurigen Bundesstraßen, die an Autobah-nen angebunden sind, in das Mautsystem aufge-nommen werden. Das ist dann letztlich ein flä-chendeckendes Netz von Autobahnen und vier-spurigen Bundesstraßen.

In der Tat gab es in vergangenen Zeiten offen-sichtlich technische Fragen, die aber auf dem Weg bis hierhin geklärt werden konnten, sodass dies jetzt möglich ist.

Des Weiteren wissen Sie, dass wir einen Be-treibervertrag haben. Dieser Betreibervertrag ist eindeutig und lässt zu, dass wir ihn um diese bei-den Maßnahmen -erweitern. Eine Bemautung von allen Bundesstraßen braucht deutlich längere Vor-bereitungen, weil sie erstens technisch kompliziert ist - sie muss aufgebaut werden - und zweitens auch inhaltlich kompliziert ist. Eine Vergabe an ein bestehendes System halte ich nicht für möglich; vielmehr müssen wir, bevor wir alle Bundesstra-ßen bemauten, dafür sorgen, dass auch die Fra-ge, wer dies durchführt, vorbereitet und geregelt wird. Hier unterliegen wir auch den europarechtli-chen Rahmenbedingungen.

Wir haben innerhalb der Frist in der Tat Stel-lungnahmen erhalten. Ich kann Ihnen nicht sagen, wie viele Stellungnahmen eingegangen sind, aber ich reiche das gerne nach, wenn dies für Sie von besonderem Interesse ist.

Ich stelle fest, dass die allgemeine Zustimmung zu unserer Entscheidung für diese Entscheidung groß ist, vor allem, weil jeder weiß, dass die Ein-nahmen, die wir durch die Maßnahmen erzielen, direkt wieder in die In-frastruktur investiert wer-den. Alle Beteiligten, auch beteiligte Verbände, profitieren davon, dass wir eine stabile Infrastruk-tur haben.",TOP 1 Befragung der Bundesregierung,14094,speech,18
25,537219,,25,62,Vizepräsident Peter Hintze,Peter Hintze,peter-hintze,,,Die nächste Frage stellt der Abgeordnete Herr Kollege Bilger von der CDU/CSU-Fraktion.,TOP 1 Befragung der Bundesregierung,14094,chair,18
26,537220,https://www.abgeordnetenwatch.de/profile/steffen-bilger/archive/214852,26,62,Steffen Bilger (CDU/CSU),Steffen Bilger,steffen-bilger,1671.0,cducsu,"Vielen Dank, Herr Präsident. - Herr Minister, Sie haben dargestellt, wie Sie sich den Weg hin zu einer Erhöhung der Einnahmen für die Infra-struktur vorstellen. Wie hoch schätzen Sie denn den nötigen Bedarf, wenn wir den Rückstau beim Erhalt aufholen, aber auch die fehlenden Mittel für den nötigen Ausbau aufbringen wollen? Wie ist si-chergestellt, dass die durch die Ausweitung der Lkw-Maut und die durch die Einführung der Pkw-Maut eingenommenen Mittel dann auch tatsäch-lich für die Infrastruktur zur Verfügung stehen?",TOP 1 Befragung der Bundesregierung,14094,speech,18
27,537221,https://www.abgeordnetenwatch.de/profile/alexander-dobrindt-0,27,62,"Alexander Dobrindt, Bundesminister für Ver-kehr und digitale Infrastruktur",Alexander Dobrindt,alexander-dobrindt,1847.0,,"Sehr geehrter Kollege Bilger, wir wissen, dass es in der Vergangenheit eine ganze Reihe von Kommissionen gegeben hat, die versucht haben, den nötigen Mittelbedarf zu spezifizieren. Die Daehre/Bodewig-Kommission als letzte Kommis-sion, die darüber getagt hat, hat einen jährlichen Mehrbedarf von 7,5 Milliarden Euro beziffert, der allerdings Bund, Länder und Kommunen erfasst, sodass wohl von einem ungefähren Mehrbedarf beim Bund von 3,5 bis 4 Milliarden Euro auszuge-hen ist.

Wir haben einen Investitionshochlauf vorge-zeichnet. Innerhalb des Zeitraums, den die Daeh-re/Bodewig-Kommission vorsieht, nämlich über das Jahr 2018 hinaus, soll der entsprechende Fi-nanzierungsbedarf gedeckt werden. Durch die Schritte hin zu einer Verbreiterung und Vertiefung der Lkw-Maut, insbesondere ab 2018 die Auswei-tung auf alle Bundesstraßen, durch die Einführung der Pkw-Maut, sprich: der Infrastrukturabgabe, durch ÖPP-Modelle, das heißt durch neue öffent-lich-private Partnerschaften, durch eine Versteti-gung der Investitionsmittel aus dem Haushalt und durch eine klare Priorisierung und das Bekenntnis „Erhalt vor Neubau“, was wir durch unser Brü-ckenmodernisierungsprogramm deutlich unterstri-chen haben, werden wir die notwendigen Investiti-onen für die Zukunft, wie sie auch von der Daeh-re/Bodewig-Kommission vorgeschlagen worden sind, sicherstellen.",TOP 1 Befragung der Bundesregierung,14094,speech,18
28,537222,,28,62,Vizepräsident Peter Hintze,Peter Hintze,peter-hintze,,,"Danke schön. - Die nächste Frage stellt die Abgeordnete Frau Kollegin Haßelmann, Bündnis 90/Die Grünen.",TOP 1 Befragung der Bundesregierung,14094,chair,18
29,537223,https://www.abgeordnetenwatch.de/profile/britta-haselmann-0,29,62,Britta Haßelmann (BÜNDNIS 90/DIE GRÜ-NEN),Britta Haßelmann,britta-haßelmann,1807.0,gruene,"Vielen Dank, Herr Präsident. - Herr Minister, Sie sprachen gerade im Rahmen der zusätzlichen Vorschläge zur Lkw-Maut von einem Investitions-hochlauf. Ich glaube, wir können hier eher von ei-nem Fliegenschiss reden. Wir sprechen bei Ihren Änderungen bei der Lkw-Maut, die ja unzureichend ist im Hinblick auf die Nichterfassung von Fahr-zeugen mit einem Gewicht von 3,5 bis 7,5 Tonnen, von einer zusätzlichen Erfassung auf 1 100 Kilometern. Angesichts der Tatsache, dass wir 40 000 Kilometer Bundesstraßen haben, fra-gen wir uns als Grüne schon, weshalb Sie ein so kleinteiliges Konzeptchen so groß feiern.",TOP 1 Befragung der Bundesregierung,14094,speech,18
30,537224,https://www.abgeordnetenwatch.de/profile/alexander-dobrindt-0,30,62,"Alexander Dobrindt, Bundesminister für Ver-kehr und digitale Infrastruktur",Alexander Dobrindt,alexander-dobrindt,1847.0,,"Liebe Frau Haßelmann, wenn ich die Diskussi-onen der letzten Tage auch in den Medien richtig verfolgt habe, würde ich mich an Ihrer Stelle an noch mehr Punkten fragen; ich denke da an Äuße-rungen, die von maßgeblichen Personen aus Ihrer Partei zu diesem ganzen Thema zu lesen waren.

Wir haben aufgenommen, dass viele Beteiligte eine Unterfinanzierung im Investitionsbereich be-klagt haben, und wir haben einen Lösungsansatz erarbeitet. Dabei handelt es sich um eine Paketlö-sung, mit der wir - das habe ich gerade schon in meiner Antwort auf die Frage des Kollegen Bilger gesagt - die von der Daehre/Bodewig-Kommission formulierte Lücke füllen können.",TOP 1 Befragung der Bundesregierung,14094,speech,18
31,537225,https://www.abgeordnetenwatch.de/profile/britta-haselmann-0,31,62,Britta Haßelmann [BÜNDNIS 90/DIE GRÜNEN],Britta Haßelmann,britta-haßelmann,1807.0,gruene,Aber nicht durch Einbezie-hung von 1 100 Kilometern!,TOP 1 Befragung der Bundesregierung,14094,poi,18
32,537226,https://www.abgeordnetenwatch.de/profile/alexander-dobrindt-0,32,62,"Alexander Dobrindt, Bundesminister für Ver-kehr und digitale Infrastruktur",Alexander Dobrindt,alexander-dobrindt,1847.0,,Ein Teil dieser Paketlösung befindet sich in dem vorgelegten Gesetzentwurf: 380 Millionen Euro Mehreinnahmen pro Jahr. Dass Sie 380 Millionen Euro Mehreinnahmen pro Jahr als irrelevant bezeichnet haben - -,TOP 1 Befragung der Bundesregierung,14094,speech,18
