,id,profile_url,sequence,sitzung,speaker,speaker_cleaned,speaker_fp,speaker_key,speaker_party,text,top,top_id,type,wahlperiode
151,537345,,151,62,Vizepräsident Peter Hintze,Peter Hintze,peter-hintze,,,"Wir kommen damit zur Frage 2, die ebenfalls vom Abgeordneten Hubertus Zdebel, Fraktion Die Linke, gestellt wurde:

Wie begründet die Bundesregierung ihren Standpunkt, dass bereits nach geltendem Bergrecht eine ausreichende Gefahren-prävention bei der Gasförderung gegeben sei (siehe die Ant-wort der Bundesregierung auf meine mündliche Frage 59, Ple-narprotokoll 18/56) vor dem Hintergrund bekannter und mögli-cher Auswirkungen der Gasförderung mittels Fracking und der Entsorgung von Lagerstättenwasser auf Mensch und Natur (vergleiche zweites Fracking-Gutachten des Umweltbundesam-tes „Umweltauswirkungen von Fracking bei der Aufsuchung und Gewinnung von Erdgas aus unkonventionellen Lagerstätten“), und welche konkreten Maßnahmen zur Gefahrenprävention leitet sie aus den geltenden bergrechtlichen Regelungen ab?

Herr Staatssekretär, bitte.",TOP 2 Fragestunde,14095,chair,18
152,537346,https://www.abgeordnetenwatch.de/profile/uwe-beckmeyer,152,62,"Uwe Beckmeyer, Parl. Staatssekretär beim Bundesminister für Wirtschaft und Energie",Uwe Beckmeyer,uwe-beckmeyer,1870.0,,"Für die Bundesregierung beantworte ich die Frage wie folgt: Im Bundesberggesetz wird die Gefahrenprävention dadurch erreicht, dass im bergrechtlichen Genehmigungsverfahren Vorsor-ge gegen Gefahren für Leben und Gesundheit ge-troffen werden muss. Ausführende Vorschriften werden von den Ländern erlassen. Im Hinblick auf das besondere Risikopotenzial beim Einsatz der Fracking-Technologie sollen zudem Ergänzungen im Bergrecht sowie im Wasser- und Naturschutz-recht aufgenommen werden. Das ist die Aufgabe der Länder. Da die Bundesregierung nicht für die Ausführung der bergrechtlichen Regelungen zu-ständig ist, kann sie daraus keine konkreten Maß-nahmen zur Gefahrenprävention ableiten.",TOP 2 Fragestunde,14095,speech,18
153,537347,,153,62,Vizepräsident Peter Hintze,Peter Hintze,peter-hintze,,,"Zusatzfrage, Herr Kollege Zdebel? - Bitte schön.",TOP 2 Fragestunde,14095,chair,18
154,537348,https://www.abgeordnetenwatch.de/profile/hubertus-zdebel/archive/215508,154,62,Hubertus Zdebel (DIE LINKE),Hubertus Zdebel,hubertus-zdebel,1349.0,linke,"Herzlichen Dank, Herr Präsident. - Herr Staatssekretär, sind Sie nicht auch der Meinung wie ich, dass die Gefahrenprävention versagt hat, wenn erst nachdem erhöhte lokale Krebsraten be-kannt werden eine mögliche Gefährdung durch naheliegende Bohrungen untersucht wird?",TOP 2 Fragestunde,14095,speech,18
155,537349,,155,62,Vizepräsident Peter Hintze,Peter Hintze,peter-hintze,,,Herr Staatssekretär.,TOP 2 Fragestunde,14095,chair,18
156,537350,https://www.abgeordnetenwatch.de/profile/uwe-beckmeyer,156,62,"Uwe Beckmeyer, Parl. Staatssekretär beim Bundesminister für Wirtschaft und Energie",Uwe Beckmeyer,uwe-beckmeyer,1870.0,,"Die Aufklärung der Ursachen für die ungewöhn-liche Häufung der Krebsneuerkrankungen liegt in der Zuständigkeit der Landesbehörden. Ich unter-streiche das noch einmal. Die Ursachen der Häu-fung der Krebserkrankungen werden derzeit von den zuständigen Gesundheits-behörden im Land-kreis Rotenburg, in dem die Samt-gemeinde Bothel liegt, mit Unterstützung durch das Landes-amt für Bergbau, Energie und Geologie des Lan-des Niedersachsen untersucht. Sie sollen zeitnah in einer Arbeitsgruppe der Vertreter des Landkrei-ses, des Krebsregisters und der örtlichen Bürger-initiativen ausgewertet und kommuniziert werden.",TOP 2 Fragestunde,14095,speech,18
157,537351,,157,62,Vizepräsident Peter Hintze,Peter Hintze,peter-hintze,,,"Noch eine Zusatzfrage, Kollege Zdebel. Bitte schön.",TOP 2 Fragestunde,14095,chair,18
158,537352,https://www.abgeordnetenwatch.de/profile/hubertus-zdebel/archive/215508,158,62,Hubertus Zdebel (DIE LINKE),Hubertus Zdebel,hubertus-zdebel,1349.0,linke,"Nach meiner Meinung macht dies noch einmal -deutlich, wie schwach die Regelungen in dieser Angelegenheit sind. Ich frage deshalb nach, ob es unter den gegebenen Umständen - es geht ja auch um eine Bundesgesetzgebung bezüglich des Fracking, die Sie jetzt in Vorbereitung haben - nicht doch erforderlich wäre, bei einer solchen vermuteten Gesundheitsgefährdung bundesein-heitliche Regelungen für eine Gefahrenprävention zu treffen.",TOP 2 Fragestunde,14095,speech,18
159,537353,,159,62,Vizepräsident Peter Hintze,Peter Hintze,peter-hintze,,,Herr Staatssekretär.,TOP 2 Fragestunde,14095,chair,18
160,537354,https://www.abgeordnetenwatch.de/profile/uwe-beckmeyer,160,62,"Uwe Beckmeyer, Parl. Staatssekretär beim Bundesminister für Wirtschaft und Energie",Uwe Beckmeyer,uwe-beckmeyer,1870.0,,"Wir werden sehen, in welcher Form sich diese Gesundheitsgefährdung aufgrund von Fracking oder Erdgasgewinnung in dem dortigen Landkreis tatsächlich zeigt. Meines Erachtens wird es dann zu einer Bewertung durch das Land Niedersach-sen kommen, und wir werden dann eine erneute Diskussion auch auf Bundesebene führen. Zurzeit ist dieser Zusammenhang nicht abschließend si-cher bestätigt.",TOP 2 Fragestunde,14095,speech,18
161,537355,,161,62,Vizepräsident Peter Hintze,Peter Hintze,peter-hintze,,,"Zusatzfrage des Abgeordneten Krischer, Bünd-nis 90/Die Grünen. Bitte schön.",TOP 2 Fragestunde,14095,chair,18
162,537356,https://www.abgeordnetenwatch.de/profile/oliver-krischer/archive/215110,162,62,Oliver Krischer (BÜNDNIS 90/DIE GRÜNEN),Oliver Krischer,oliver-krischer,1450.0,gruene,"Herr Staatssekretär Beckmeyer, ich muss noch einmal bezüglich Ihrer Antwort auf meine Nach-frage von vorhin nachfragen. Sie haben gesagt, Sie wollen die Bergschadensvermutung und Be-weislastumkehr für unterirdische Bohrungen und Kavernen einführen; so habe ich es jedenfalls ver-standen.

Meine Frage, die Sie auch ganz kurz mit Ja o-der Nein beantworten können, lautet: Plant die Bundesregierung die Einführung der Bergscha-densvermutung für den obertägigen Braunkohle-abbau, ja oder nein?",TOP 2 Fragestunde,14095,speech,18
163,537357,,163,62,Vizepräsident Peter Hintze,Peter Hintze,peter-hintze,,,Herr Staatssekretär.,TOP 2 Fragestunde,14095,chair,18
164,537358,https://www.abgeordnetenwatch.de/profile/uwe-beckmeyer,164,62,"Uwe Beckmeyer, Parl. Staatssekretär beim Bundesminister für Wirtschaft und Energie",Uwe Beckmeyer,uwe-beckmeyer,1870.0,,"Wir sind dabei, bei typischen Bergschäden die Beweislastumkehr letztendlich anzudenken, und dies deshalb, weil Senkungen, Pressungen und Zerrungen der Erdoberfläche typische Bergschä-den aufgrund von untertägigen Bergbautätigkeiten sind, die dem Einblick der Betroffenen naturge-mäß entzogen sind. Das ist eigentlich der Grund für eine Beweislastumkehr.",TOP 2 Fragestunde,14095,speech,18
165,537359,https://www.abgeordnetenwatch.de/profile/oliver-krischer/archive/215110,165,62,Oliver Krischer [BÜNDNIS 90/DIE GRÜNEN],Oliver Krischer,oliver-krischer,1450.0,gruene,Ich habe gesagt: obertä-gig!,TOP 2 Fragestunde,14095,poi,18
166,537360,https://www.abgeordnetenwatch.de/profile/uwe-beckmeyer,166,62,"Uwe Beckmeyer, Parl. Staatssekretär beim Bundesminister für Wirtschaft und Energie",Uwe Beckmeyer,uwe-beckmeyer,1870.0,,"Eine Beweislastumkehr im Bergrecht, was den Umgang mit Chemikalien angeht, ist zurzeit nicht vorgesehen.",TOP 2 Fragestunde,14095,speech,18
167,537361,https://www.abgeordnetenwatch.de/profile/oliver-krischer/archive/215110,167,62,Oliver Krischer [BÜNDNIS 90/DIE GRÜNEN],Oliver Krischer,oliver-krischer,1450.0,gruene,Ich habe nach dem obertägi-gen Bergbau gefragt!,TOP 2 Fragestunde,14095,poi,18
168,537362,https://www.abgeordnetenwatch.de/profile/uwe-beckmeyer,168,62,"Uwe Beckmeyer, Parl. Staatssekretär beim Bundesminister für Wirtschaft und Energie",Uwe Beckmeyer,uwe-beckmeyer,1870.0,,- Und ich habe von dem unterirdischen Bergbau gesprochen.,TOP 2 Fragestunde,14095,speech,18
169,537363,https://www.abgeordnetenwatch.de/profile/oliver-krischer/archive/215110,169,62,Oliver Krischer [BÜNDNIS 90/DIE GRÜNEN],Oliver Krischer,oliver-krischer,1450.0,gruene,Sie reden über etwas ganz anderes!,TOP 2 Fragestunde,14095,poi,18
170,537364,https://www.abgeordnetenwatch.de/profile/uwe-beckmeyer,170,62,"Uwe Beckmeyer, Parl. Staatssekretär beim Bundesminister für Wirtschaft und Energie",Uwe Beckmeyer,uwe-beckmeyer,1870.0,,"Daraus können Sie den Schluss ziehen, dass es für den anderen Bereich nicht vorgesehen ist.",TOP 2 Fragestunde,14095,speech,18
171,537365,https://www.abgeordnetenwatch.de/profile/oliver-krischer/archive/215110,171,62,Oliver Krischer [BÜNDNIS 90/DIE GRÜNEN],Oliver Krischer,oliver-krischer,1450.0,gruene,"Aha, gut!",TOP 2 Fragestunde,14095,poi,18
172,537366,,172,62,Vizepräsident Peter Hintze,Peter Hintze,peter-hintze,,,"Die nächste Zusatzfrage stellt der Abgeordnete Behrens, Fraktion Die Linke.",TOP 2 Fragestunde,14095,chair,18
173,537367,https://www.abgeordnetenwatch.de/profile/herbert-behrens/archive/215393,173,62,Herbert Behrens (DIE LINKE),Herbert Behrens,herbert-behrens,1344.0,linke,"Herr Staatssekretär, habe ich Sie richtig ver-standen, dass es im Moment nicht erforderlich und auch nicht möglich sei, entsprechende bun-desgesetzliche Regelungen zu treffen, weil für verschiedene Bereiche die Länder zuständig sei-en? Sie sagten aber auch, dass man sich dieses Problems dann noch einmal annehmen müsse, wenn es entsprechende Berichte seitens der Lan-desbehörden gebe, die auf ein besonderes neues Gefahren-potenzial, nämlich erhöhte Krankheitsra-ten oder erhöhte Anzahl von Krebserkrankungen in der Nähe von Fracking-Bohrstellen, hinweisen, das vielleicht in der Vergangenheit noch nicht ausreichend reflektiert worden ist. Deutet das da-rauf hin, dass wir unter Umständen doch zu einer bundeseinheitlichen Regelung kommen müssen, um diese Unterschiedlichkeit in den Ländern für die Betroffenen zu verhindern?",TOP 2 Fragestunde,14095,speech,18
174,537368,,174,62,Vizepräsident Peter Hintze,Peter Hintze,peter-hintze,,,Herr Staatssekretär.,TOP 2 Fragestunde,14095,chair,18
175,537369,https://www.abgeordnetenwatch.de/profile/uwe-beckmeyer,175,62,"Uwe Beckmeyer, Parl. Staatssekretär beim Bundesminister für Wirtschaft und Energie",Uwe Beckmeyer,uwe-beckmeyer,1870.0,,"Ich wäre töricht, wenn ich sagte, das schließe ich generell aus. Gleichwohl ist Folgendes der entscheidende Punkt: Der Fragesteller bezieht sich ja auf einen Fall in der Nähe von Rotenburg in Niedersachsen. Der Zusammenhang mit Fra-cking-Technologien ist aus meiner Sicht zurzeit sehr unwahrscheinlich, da potenzielle Gefahren-quellen wie Benzol, Quecksilber oder auch freige-setztes Methan, die möglicherweise eine krebser-regende Wirkung haben, dort nicht vorhanden ge-wesen sind.

Nach meiner Kenntnis hat dort eine einzelne Erdgasförderung im Sandstein mit Einsatz von Fracking-Technologien stattgefunden - eine ein-zige! Dabei sind Frack-Flüssigkeiten mit Zusatz-stoffen verwendet worden, in denen lediglich ein einziger Bestandteil potenziell krebserregend ist, und sein Anteil belief sich auf einen verschwin-dend geringen Wert von 0,03 Prozent.

Es ist nun die Frage an das Land Niedersach-sen zu richten: Hat dieser Bestandteil in diesem Fluid dazu beigetragen, dass die Wirkung, die Sie beschrieben haben, tatsächlich eingetreten ist? Ich kann den Zusammenhang zurzeit nicht be-gründen. Ich denke, das Land Niedersachsen wird uns darüber aufklären.",TOP 2 Fragestunde,14095,speech,18
176,537370,,176,62,Vizepräsident Peter Hintze,Peter Hintze,peter-hintze,,,"Die nächste Zusatzfrage ist von dem Abgeord-neten Tiefensee, SPD-Fraktion.",TOP 2 Fragestunde,14095,chair,18
177,537371,,177,62,Wolfgang Tiefensee (SPD),Wolfgang Tiefensee,wolfgang-tiefensee,,spd,"Herr Staatssekretär, ich möchte unmittelbar an das anschließen, was Sie gerade ausgeführt ha-ben. Wir diskutieren nicht zum ersten Mal über Fracking. Sind Sie mit mir einer Meinung, dass wir auf der einen Seite zwar den hier in der Frage-stunde konkret angesprochenen Fall in Nieder-sachsen, veröffentlicht in den Medien, sehen müssen, auf der anderen Seite aber mehr dafür tun müssen, dass dieser konkrete Fall in der all-gemeinen Debatte von solchen Fällen unterschie-den wird, die zum Teil noch gar nicht aufgeklärt sind?

Die allgemeine Debatte ist nötig. Dabei muss die Diskussion über das konventionelle Fracking - das heißt, über das herkömmliche Fracking, wel-ches Fragen des Wasserhaushaltsgesetzes und des Bergrechts betrifft, nämlich wo gefrackt wer-den darf und wie es sich mit der Beweislastum-kehr verhält - von der Diskussion über das un-konventionelle Fracking getrennt werden, das jetzt auf der Tagesordnung steht und zu dem die Bun-desregierung und die Koalition eindeutig gesagt haben, dass wir umwelttoxische Bedingungen ausschließen wollen.

Müssen wir nicht mehr dafür tun, dass die heu-tige Debatte nicht mit der generellen Debatte ver-mischt wird und dass zwischen den beiden Fra-cking-Methoden unterschieden wird? Sonst leisten wir einer Diskussion in der Öffentlichkeit Vor-schub, die eher auf Angst als auf konkrete Fakten setzt.",TOP 2 Fragestunde,14095,speech,18
178,537372,https://www.abgeordnetenwatch.de/profile/uwe-beckmeyer,178,62,"Uwe Beckmeyer, Parl. Staatssekretär beim Bundesminister für Wirtschaft und Energie",Uwe Beckmeyer,uwe-beckmeyer,1870.0,,"Ich stimme Ihnen zu, dass wir vermeiden müs-sen, dass diese beiden Debatten vermischt wer-den. Die Kollegen wissen - zumindest einer kommt aus Niedersachsen -, dass seit mindes-tens 45 bis 50 Jahren in Niedersachsen Tight Gas gefördert wird. Die Technologie, über die wir jetzt reden, ist aber eine andere und könnte den Ein-satz anderer Stoffe umfassen, den wir in Deutsch-land nicht befürworten.",TOP 2 Fragestunde,14095,speech,18
179,537373,,179,62,Vizepräsident Peter Hintze,Peter Hintze,peter-hintze,,,"Herr Abgeordneter Lenkert, Fraktion Die Linke, bitte.",TOP 2 Fragestunde,14095,chair,18
180,537374,https://www.abgeordnetenwatch.de/profile/ralph-lenkert/archive/215580,180,62,Ralph Lenkert (DIE LINKE),Ralph Lenkert,ralph-lenkert,1442.0,linke,"Herr Staatssekretär, Sie sprachen eben davon, dass Sie vermutlich krebserregende Schädigun-gen durch Quecksilber, Methan etc. ausschließen können. Inwieweit sind Untersuchungen im Gan-ge, um zu prüfen, ob Lagerstättenwasser durch Verdrängung eventuell das Grundwasser erreicht haben könnte oder auf andere Art und Weise mit Menschen in Kontakt gekommen ist?",TOP 2 Fragestunde,14095,speech,18
181,537375,,181,62,Vizepräsident Peter Hintze,Peter Hintze,peter-hintze,,,Herr Staatssekretär.,TOP 2 Fragestunde,14095,chair,18
182,537376,https://www.abgeordnetenwatch.de/profile/uwe-beckmeyer,182,62,"Uwe Beckmeyer, Parl. Staatssekretär beim Bundesminister für Wirtschaft und Energie",Uwe Beckmeyer,uwe-beckmeyer,1870.0,,"Lagerstättenwasser ist - wer sich damit be-schäftigt hat, weiß das - ein natürlicher Bestand-teil von Erdgaslagerstätten und wird bei der Ge-winnung von Erdgas und Erdöl mit gefördert. Das ist bekannt. Das Wasser besteht aus verschiede-nen Substanzen, gelösten Salzen, Kohlenwasser-stoffen usw. Es kann teilweise bei Leckagen in bestimmten Bereichen zu einer Verunreinigung führen; das will ich gar nicht ausschließen.

Die Frage ist, ob das ursächlich miteinander verbunden werden kann und etwas miteinander zu tun hat. Ich denke, dass die niedersächsische Landesregierung und die einschlägigen Behörden auch das genau untersuchen werden. Wir werden darüber Nachricht bekommen.",TOP 2 Fragestunde,14095,speech,18
183,537377,,183,62,Vizepräsident Peter Hintze,Peter Hintze,peter-hintze,,,"Danke schön.

Wir verlassen damit den Geschäftsbereich des Bundesministeriums für Wirtschaft und Energie und kommen zum Geschäftsbereich des Auswär-tigen Amts.

Zur Beantwortung steht Staatsminister Michael Roth zur Verfügung.

Ich rufe die Frage 3 der Abgeordneten Inge Hö-ger auf:

Beabsichtigt die Bundesregierung, in der UN-Vollversammlung der bevorstehenden Ächtung von DU-Munition - Uranmunition - durch eine erneute Resolution zuzu-stimmen, und wenn nicht, wie begründet sie diese Änderung des Abstimmungsverhaltens angesichts der Tatsache, dass die Bundesrepublik Deutschland bisher den Resolutionen zum Thema DU-Munition immer zugestimmt hat und die einzige Än-derung gegenüber dem Text der früheren Resolutionen darin besteht, dass der Resolutionstext um die Forderung nach wei-teren Studien über den Einfluss von Uranmunition auf Gesund-heit und Umwelt sowie die Forderung, dass Staaten wie der Irak, die durch den Einsatz von Uranmunition langfristigen und schwerwiegenden Umwelt- und Gesundheitsschäden ausgesetzt sind, von der internationalen Gemeinschaft unterstützt werden sollen, erweitert wurde?

Herr Staatsminister, bitte.",TOP 2 Fragestunde,14095,chair,18
184,537378,https://www.abgeordnetenwatch.de/profile/michael-roth/archive/216871,184,62,"Michael Roth, Staatsminister im Auswärtigen Amt",Michael Roth,michael-roth,1687.0,,"Vielen Dank, Herr Präsident. - Frau Abgeordne-te Höger, ich möchte zu Beginn meiner Antwort feststellen: Anders als möglicherweise Ihre Frage nahelegt, geht es in der Resolution, auf die Sie in Ihrer Frage Bezug nehmen, nicht um eine Ent-scheidung zur Ächtung von Munition mit abgerei-chertem Uran, sondern es geht um mögliche Auswirkungen ihres Einsatzes.

Sie wissen auch, dass die Bundesregierung be-reits im Jahr 2012 der eingebrachten Vorgänger-resolution zu den Auswirkungen des Einsatzes von Waffen und Munition, die abgereichertes Uran enthalten, mit Einschränkungen zugestimmt hat. Diese Resolution aus dem Jahr 2012 ist damals von Indonesien und den blockfreien Staaten im Ersten Ausschuss der 69. VN-Generalversammlung eingebracht worden. In ei-ner Stimmerklärung hat die -Bundesregierung be-reits damals kritisiert, dass diese Resolution den Inhalt eines Berichts des Weltumweltprogramms vom 21. Juli 2010 nicht ausgewogen wiedergibt.

Die Bundesregierung begrüßt weiterhin Unter-suchungen, die zum Ziel haben, die Auswirkungen des Einsatzes von Munition mit abgereichertem Uran wissenschaftlich zu erforschen, und sie hatte deshalb ebenso wie zahlreiche weitere Mitglied-staaten der Europäischen Union gehofft, dass die bisherige Darstellung im Resolutionsentwurf 2014 richtiggestellt würde.

Diese Hoffnung stützte sich vor allem auf die Tatsache, dass das Umweltprogramm der Verein-ten Nationen, also UNEP, die Internationale Atom-energie-Organisation IAEA, die Weltgesundheits-organisation WHO und die EU bereits umfangrei-che Untersuchungen zu even-tuellen Gesundheits- und Umwelteinflüssen durch Munition mit abgerei-chertem Uran durchgeführt haben. Diese Studien ergaben übereinstimmend, dass Rückstände von abgereichertem Uran, das geringer radioaktiv ist als Natururan, in der Umwelt kein radiologisches Risiko für die Bevölkerung vor Ort darstellen.

Die Bundesregierung bedauert, dass diese Er-kenntnisse bei der diesjährigen Resolution aber-mals nicht berücksichtigt wurden und dass damit wiederum der Stand der Forschung zu diesem Thema nicht angemessen berücksichtigt wurde. Das war der Grund, warum sich die Bundesregie-rung in diesem Jahr bei der Abstimmung gemein-sam mit vielen weiteren EU-Mitgliedstaaten ent-halten hat. Wir haben die detaillierten Gründe für unsere Enthaltung in einer Stimmerklärung erläu-tert.",TOP 2 Fragestunde,14095,speech,18
185,537379,,185,62,Vizepräsident Peter Hintze,Peter Hintze,peter-hintze,,,"Zusatzfrage, Frau Abgeordnete Höger.",TOP 2 Fragestunde,14095,chair,18
186,537380,https://www.abgeordnetenwatch.de/profile/inge-hoger,186,62,Inge Höger (DIE LINKE),Inge Höger,inge-hoger,1789.0,linke,"Vielen Dank für die Antwort. - Da Sie 2012 ei-ner Resolution zur Ächtung von DU-Munition zu-gestimmt haben, erschließt sich mir nicht, wieso Sie es jetzt nicht mehr machen. Gerade in der neuen Resolution ist angemahnt, dass neue Stu-dien notwendig sind, um die Gefährlichkeit von DU-Munition nachzuweisen. Alles, was ansonsten darüber bekannt ist, ist - das habe ich zum Bei-spiel auf meinen Reisen auf dem Balkan erlebt und durch zahlreiche Berichte erfahren -, dass wir es in allen Bereichen, wo die DU-Munition einge-setzt wird, mit erheblich erhöhten Krebsraten zu tun haben, dass die Umwelt über Jahrzehnte, Jahrtausende verseucht ist und dass Menschen an den Folgen sterben. Darüber so einfach hin-wegzusehen, kann ich nicht verstehen.

Meine Nachfrage: Geht es Ihnen um zusätzliche Studien, oder geht es Ihnen darum, die Mittel zur Deckung der Folgekosten nicht finanzieren zu wol-len? Was ist der Unterschied zum bisherigen Ab-stimmungsverhalten?",TOP 2 Fragestunde,14095,speech,18
187,537381,,187,62,Vizepräsident Peter Hintze,Peter Hintze,peter-hintze,,,Herr Staatsminister.,TOP 2 Fragestunde,14095,chair,18
188,537382,https://www.abgeordnetenwatch.de/profile/michael-roth/archive/216871,188,62,"Michael Roth, Staatsminister im Auswärtigen Amt",Michael Roth,michael-roth,1687.0,,"Frau Abgeordnete Höger, ich habe in meiner ersten Antwort schon klargestellt, dass es in der von Ihnen in Rede gestellten Resolution nicht um eine Ächtung dieser Munition geht. Selbstver-ständlich nehmen wir die Sorgen, die dieser Reso-lution zugrunde liegen, sehr ernst. Ich habe aber auch schon darauf hingewiesen, dass es eine Reihe von Studien der genannten Organisationen, unter anderem der UNEP und der Europäischen Union, gibt, die den Zusammenhang, den Sie jetzt dargestellt haben, nicht bestätigen. Das haben wir noch einmal deutlich gemacht. Unsere klare Er-wartungshaltung ist, dass weitere Studien vorge-legt werden bzw. dass man die vorhandenen Stu-dien entsprechend bei der Bewertung und bei der Formulierung einer Resolution berücksichtigt.

Es geht um Ausgewogenheit, Frau Kollegin Höger - das ist der entscheidende Punkt -, und darum, dass einschlägige Studien, deren Qualität bislang niemand in Zweifel gezogen hat, ange-messen Berücksichtigung finden.",TOP 2 Fragestunde,14095,speech,18
189,537383,,189,62,Vizepräsident Peter Hintze,Peter Hintze,peter-hintze,,,"Noch eine Zusatzfrage, Frau Kollegin Höger.",TOP 2 Fragestunde,14095,chair,18
190,537384,https://www.abgeordnetenwatch.de/profile/inge-hoger,190,62,Inge Höger (DIE LINKE),Inge Höger,inge-hoger,1789.0,linke,"Hat diese Stimmenthaltung vielleicht etwas mit aktuellen Bürgerkriegssituationen in dieser Welt zu tun? Die USA haben angedroht, gegenüber dem IS DU-Munition zum Einsatz zu bringen oder die Peschmerga im Nordirak mit MILAN-Raketen zu beliefern. MILAN-Raketen enthalten ja Thorium. Das ist genauso gefährlich wie DU-Munition und würde genauso die Umwelt belasten.",TOP 2 Fragestunde,14095,speech,18
191,537385,https://www.abgeordnetenwatch.de/profile/michael-roth/archive/216871,191,62,"Michael Roth, Staatsminister im Auswärtigen Amt",Michael Roth,michael-roth,1687.0,,Nein.,TOP 2 Fragestunde,14095,speech,18
192,537386,,192,62,Vizepräsident Peter Hintze,Peter Hintze,peter-hintze,,,"Zusatzfrage des Abgeordneten Lenkert, Frakti-on Die Linke.",TOP 2 Fragestunde,14095,chair,18
193,537387,https://www.abgeordnetenwatch.de/profile/ralph-lenkert/archive/215580,193,62,Ralph Lenkert (DIE LINKE),Ralph Lenkert,ralph-lenkert,1442.0,linke,"Herr Kollege Staatsminister, ich möchte nicht in Zweifel ziehen, dass nach den Studien eine radio-logische Belastung durch die Uranmunition nicht stattfindet. Aber Uran ist ein Schwermetall und als solches hochgiftig. Nicht umsonst beträgt der Trinkwasservorsorgewert in Deutschland 10 Mikrogramm je Liter. Durch die mit Uran angerei-cherte Munition gelangen Unmengen eines Schwermetalls, das hochgiftig ist, nämlich Uran, in die Umgebung, in die Umwelt, und verseuchen das Trinkwasser und die Atemluft. Die Folgewir-kungen von Schwermetallbelastungen sind Fehl-geburten, Missbildungen bei neugeborenen Kin-dern und extrem erhöhte Krebsraten. All dies ist in den Gebieten, in denen Uranmunition angewendet wurde, nachweislich feststellbar.

Ich frage Sie: Sind außer den radiologischen Auswirkungen auch die sozusagen ganz einfachen Auswirkungen der erhöhten Schwermetallbelas-tung durch die massive Uranverwendung in den betroffenen Ländern untersucht worden, und ha-ben Sie diese in Ihrer Entscheidungsfindung be-rücksichtigt, oder haben Sie sie außer Acht ge-lassen?",TOP 2 Fragestunde,14095,speech,18
194,537388,https://www.abgeordnetenwatch.de/profile/michael-roth/archive/216871,194,62,"Michael Roth, Staatsminister im Auswärtigen Amt",Michael Roth,michael-roth,1687.0,,"Herr Abgeordneter, Ihre Überlegungen, Ihre Kri-tik widersprechen den einschlägigen Studien, die ich in meiner Antwort mehrfach zitiert habe. Das sind Studien von UNEP, WHO und IAEO. Diese Studien kommen übereinstimmend zu dem Ergeb-nis, dass ein unmittelbarer Zusammenhang zwi-schen Schädigungen und der Munition mit abge-reichertem Uran nicht besteht. Die Bundesregie-rung hat bislang überhaupt gar keinen Anlass, an der Seriosität dieser Studien zu zweifeln.

Weil es aber solche kritischen Stimmen wie die Ihrige gibt, haben wir nach wie vor ein großes In-teresse daran, dass weitere Untersuchungen vor-gelegt werden, die zum Ziel haben, ungeklärte Fragen hinsichtlich der Auswirkungen des Einsat-zes von Munition mit abgereichertem Uran wis-senschaftlich zu erforschen. Meine Antwort grün-det sich auf den vorliegenden Studien, und die wi-dersprechen dem, was Sie hier zum Ausdruck ge-bracht haben.",TOP 2 Fragestunde,14095,speech,18
195,537389,,195,62,Vizepräsident Peter Hintze,Peter Hintze,peter-hintze,,,"Ich darf die Damen und Herren von der Presse auf der Tribüne bitten, sich an die Akkreditie-rungsregeln zu halten, dort nicht mit Beleuchtung zu arbeiten und dort auch keine Interviews zu füh-ren. Ich bitte auch die Kollegen vom Plenarassis-tenzdienst, sich darum zu kümmern. - Schönen Dank.

Nächste Fragestellerin ist die Abgeordnete Hänsel, Fraktion Die Linke.",TOP 2 Fragestunde,14095,chair,18
