,id,sequence,sitzung,speaker,speaker_cleaned,speaker_fp,speaker_key,speaker_party,text,top,top_id,type,wahlperiode
243,165206,243,64,Sönke Rix (SPD),Sönke Rix,sonke-rix,441.0,spd,"Was wir jetzt machen, ist, dass wir die Partnerschaftlichkeit noch einmal erweitern. Denjenigen, die sich zu mehr Partnerschaftlichkeit bereit erklären, also sich dafür entscheiden, dass nicht nur ein Elternteil die Betreuung übernimmt - meistens, aber nicht immer ist es die Mutter -, bieten wir jetzt die Möglichkeit, die Zeit der Partnerschaftlichkeit und des Bezugs von Elterngeld zu verlängern.

Das Zweite ist: Wir gestalten es flexibler. Denn es wird zu Recht angemerkt: Die Zeit mit Kindern umfasst eben nicht nur die ersten drei Lebensjahre des Kindes oder die Zeit, in der das Kind in die Kindertagesstätte geht; es gibt auch die Zeit der Einschulung, die Zeit der ersten Jahre in der Grundschule und andere Zeiten, in denen das Kind vielleicht einer gezielten Betreuung bedarf und man mehr Zeit mit ihm verbringen möchte. Deshalb finde ich es gut, dass wir einen Bezug bis zum achten Lebensjahr ermöglichen und damit sogar weiter gehen, als es die Linkspartei gefordert hat.",TOP 30 Elterngeld Plus und flexiblere Elternzeit,1917,speech,18
244,165207,244,64,Jörn Wunderlich [DIE LINKE],Jörn Wunderlich,jorn-wunderlich,357.0,linke,Erstaunlich!,TOP 30 Elterngeld Plus und flexiblere Elternzeit,1917,poi,18
245,165208,245,64,Sönke Rix (SPD),Sönke Rix,sonke-rix,441.0,spd,"- Ja, genau: Es ist erstaunlich, dass wir auch mal weiter gehen als die Linkspartei, Herr Wunderlich.

Ich komme tatsächlich noch einmal zu Ihnen, Herr Wunderlich, nämlich zu Ihrer Kritik daran, dass der Kollege Felgentreu in der Debatte im Ausschuss gesagt hat, das sei auch ein Gesetz für die Wirtschaft, also ein wirtschaftsfreundliches Gesetz. Ist das denn so schlimm? Ist es denn wirklich so schlimm, wenn das Gesetz auch für den Arbeitsmarkt und für die Unternehmen gut ist, weil ihre Arbeitnehmerinnen und Arbeitnehmer zufrieden sind? Ich frage mich, warum ein Gegensatz zu denen aufgebaut wird, die sagen: Ich brauche gut ausgebildete Fachkräfte, die zufrieden sind, die nicht immer unter dem Druck stehen, es irgendwie hinzubekommen, mehr Zeit für die Familie zu haben. - Herr Wunderlich, ich finde, wir sollten diesen Gegensatz gar nicht erst aufbauen.",TOP 30 Elterngeld Plus und flexiblere Elternzeit,1917,speech,18
246,165209,246,64,,,,,,Beifall bei der SPD und der CDU/CSU,TOP 30 Elterngeld Plus und flexiblere Elternzeit,1917,poi,18
247,165210,247,64,Jörn Wunderlich [DIE LINKE],Jörn Wunderlich,jorn-wunderlich,357.0,linke,"Ja, aber nicht zulasten der Betroffenen!",TOP 30 Elterngeld Plus und flexiblere Elternzeit,1917,poi,18
248,165211,248,64,Sönke Rix (SPD),Sönke Rix,sonke-rix,441.0,spd,"Mich wundert, dass Herr Pols heute nicht da ist. Bestellen Sie ihm schöne Grüße! Er war derjenige, der bei der Anhörung insbesondere auf die Situation von Kleinbetrieben aufmerksam gemacht hat und die Frage aufgebracht hat, was eigentlich ist, wenn es betrieblich absolut nicht geht. Da haben wir jetzt mit unserem Änderungsantrag eine Regelung gefunden. Wir wollen den Arbeitgebern aber kein Einspruchs- oder Widerspruchsrecht geben; wir wissen auch, dass die Hürden hinsichtlich betrieblicher Gründe sehr hoch sind. Was wir wollen, ist, dass Arbeitnehmer und Arbeitgeber miteinander ins Gespräch kommen, damit es zu einem Konsens kommt. So stellen wir sicher, dass die Zufriedenheit des Arbeitnehmers nicht schwindet, nur weil er Angst hat, er könnte mit seinem Wunsch nach Elternzeit beim Arbeitgeber auflaufen. Wir haben mit dieser Regelung unseren Willen zum Konsens ausgedrückt.",TOP 30 Elterngeld Plus und flexiblere Elternzeit,1917,speech,18
249,165212,249,64,,,,,,Beifall bei Abgeordneten der SPD und der CDU/CSU,TOP 30 Elterngeld Plus und flexiblere Elternzeit,1917,poi,18
250,165213,250,64,Sönke Rix (SPD),Sönke Rix,sonke-rix,441.0,spd,"Ich bin froh, dass wir hier heute darüber beraten, welche Änderungen wir bei diesem Gesetz noch vornehmen können, dass wir also nicht über das Ob, sondern über das Wie diskutieren. Ich bin froh, dass wir das Gesetz nahezu einstimmig beschließen werden. Denn es ist wirklich ein gutes Gesetz; es hat eine große Zustimmung wirklich verdient.

Danke schön.",TOP 30 Elterngeld Plus und flexiblere Elternzeit,1917,speech,18
251,165214,251,64,,,,,,Beifall bei der SPD sowie bei Abgeordneten der CDU/CSU,TOP 30 Elterngeld Plus und flexiblere Elternzeit,1917,poi,18
252,165215,252,64,Vizepräsidentin Ulla Schmidt,Ulla Schmidt,ulla-schmidt,405.0,,"Vielen Dank. - Nächste Rednerin ist Katja Dörner, Bündnis 90/Die Grünen.",TOP 30 Elterngeld Plus und flexiblere Elternzeit,1917,chair,18
253,165216,253,64,Katja Dörner (BÜNDNIS 90/DIE GRÜNEN),Katja Dörner,katja-dorner,354.0,gruene,"Sehr geehrte Frau Präsidentin! Liebe Kolleginnen! Liebe Kollegen! Mit dem Elterngeld Plus wird tatsächlich eine Gerechtigkeitslücke geschlossen - das sehen wir auch so -, die für eine Gruppe von Eltern relevant ist, nämlich für diejenigen, die schon relativ kurz nach der Geburt ihres Kindes wieder Teilzeit arbeiten wollen. Dieser Webfehler im alten Gesetz, der dazu führte, dass diese Eltern in der Summe weniger Elterngeld bekamen als diejenigen, die ihren Alltag anders gestalteten, ist wirklich überhaupt nicht nachzuvollziehen. Insofern werden wir zustimmen.  Wir selbst haben lange gefordert, dass diese Gerechtigkeitslücke geschlossen wird. Deshalb ist es selbstverständlich - das ist der Kern dieses Gesetzes -, dass wir auch zustimmen werden.",TOP 30 Elterngeld Plus und flexiblere Elternzeit,1917,speech,18
254,165217,254,64,,,,,,Beifall beim BÜNDNIS 90/DIE GRÜNEN und bei der SPD sowie bei Abgeordneten der CDU/CSU,TOP 30 Elterngeld Plus und flexiblere Elternzeit,1917,poi,18
255,165218,255,64,Katja Dörner (BÜNDNIS 90/DIE GRÜNEN),Katja Dörner,katja-dorner,354.0,gruene,"Liebe Kolleginnen, liebe Kollegen, Sie können sich vorstellen, dass es jetzt leider mit einem großen Aber weitergeht.",TOP 30 Elterngeld Plus und flexiblere Elternzeit,1917,speech,18
256,165219,256,64,Paul Lehrieder [CDU/CSU],Paul Lehrieder,paul-lehrieder,487.0,cducsu,Das haben wir befürchtet!,TOP 30 Elterngeld Plus und flexiblere Elternzeit,1917,poi,18
257,165220,257,64,Katja Dörner (BÜNDNIS 90/DIE GRÜNEN),Katja Dörner,katja-dorner,354.0,gruene,"Begeistert sind wir von diesem Gesetzentwurf nämlich mitnichten. An einigen Stellen wurde schon angesprochen, dass eine ganz große Gerechtigkeitslücke in diesem Gesetzentwurf bleibt, nämlich die Anrechnung des Elterngeldes im ALG II. Gerade die Eltern, die eine finanzielle Unterstützung besonders nötig haben, werden weiterhin vom Elterngeldbezug faktisch ausgeschlossen. Das ist eine riesige Gerechtigkeitslücke, die weiterhin unbearbeitet bleibt.

Zu dieser ganz strikten Argumentation, das sei eine Lohnersatzleistung, muss ich sagen: Das Elterngeld ist ausdrücklich nicht allein als Lohnersatzleistung eingeführt worden,",TOP 30 Elterngeld Plus und flexiblere Elternzeit,1917,speech,18
258,165221,258,64,,,,,,Beifall bei Abgeordneten der LINKEN,TOP 30 Elterngeld Plus und flexiblere Elternzeit,1917,poi,18
259,165222,259,64,Katja Dörner (BÜNDNIS 90/DIE GRÜNEN),Katja Dörner,katja-dorner,354.0,gruene,"sondern wir haben immer gesagt, es müsse für alle Familien, also auch für arme Familien und für Familien im ALG-II-Bezug, diesen Schonraum von mindestens einem Jahr geben.

Das Elterngeld hat an das Erziehungsgeld angeschlossen, das eine ganz andere Struktur hat. Ich finde es immer noch gut, dass man das umgestellt hat; das war zweifelsfrei richtig. Aber dass wir jetzt am Ende der Strecke da landen, dass die Anrechnung des Elterngeldes beim ALG II das Einzige ist, was vom damals so groß angekündigten Sparpaket der schwarz-gelben Regierung übrig bleibt, ist eine riesige Gerechtigkeitslücke. Ich hätte mir wirklich gewünscht, dass die Koalition die Kraft gefunden hätte, das an dieser Stelle zu beheben. Deshalb bleibt das Gesetz zum Elterngeld weiterhin unbefriedigend.",TOP 30 Elterngeld Plus und flexiblere Elternzeit,1917,speech,18
260,165223,260,64,,,,,,Beifall beim BÜNDNIS 90/DIE GRÜNEN und bei der LINKEN,TOP 30 Elterngeld Plus und flexiblere Elternzeit,1917,poi,18
261,165224,261,64,Katja Dörner (BÜNDNIS 90/DIE GRÜNEN),Katja Dörner,katja-dorner,354.0,gruene,"Liebe Kolleginnen und Kollegen, ein gutes Jahr nach der Bundestagswahl verstärkt sich der Eindruck, dass die Familienministerin zwar gute kleine Schritte geht, die großen Herausforderungen aber geflissentlich ignoriert.

Wir haben unlängst die Ergebnisse der Evaluation der ehe- und familienbezogenen Leistungen vorgelegt bekommen. Wir wissen, dass in der Ehe- und Familienförderung Milliarden ausgegeben werden, die zentrale familienpolitische Zielsetzungen - beispielsweise Armutsprävention, materielle Stabilität von Familien, Vereinbarkeit von Familie und Beruf sowie partnerschaftliche Aufteilung von Erwerbs- und Familienarbeit - gerade nicht fördern, sondern ihnen sogar zuwiderlaufen. Das haben wir mittlerweile schwarz auf weiß. Und was passiert? Wir müssen leider sagen: Es passiert nichts. Auch das ist aus unserer Sicht ausgesprochen unbefriedigend.",TOP 30 Elterngeld Plus und flexiblere Elternzeit,1917,speech,18
262,165225,262,64,,,,,,Beifall beim BÜNDNIS 90/DIE GRÜNEN,TOP 30 Elterngeld Plus und flexiblere Elternzeit,1917,poi,18
263,165226,263,64,Katja Dörner (BÜNDNIS 90/DIE GRÜNEN),Katja Dörner,katja-dorner,354.0,gruene,"Liebe Kolleginnen und Kollegen, gestern hat der Kitagipfel stattgefunden; das hat die Ministerin auch angesprochen. Zukünftig soll es einheitliche Qualitätsstandards geben. Das finden wir gut und richtig. Aber die Familienministerin ist mit leeren Händen zu diesem Gipfel gefahren. Ich habe die große Sorge, dass eben die dringend notwendigen Qualitätsverbesserungen in den Kitas nicht nur jetzt auf die lange Bank geschoben werden, sondern dass die Finanzierung allein an den Ländern und den Kommunen hängen bleibt, weil der Bund nicht bereit ist, sich stärker zu engagieren. Das, finden wir, darf auf keinen Fall der Plan für die nächsten Jahre sein. Der Bund muss deutlich mehr für die Kitas tun und da mehr investieren. Auch das ist eine zentrale Frage von besserer Vereinbarkeit von Familie und Beruf.",TOP 30 Elterngeld Plus und flexiblere Elternzeit,1917,speech,18
264,165227,264,64,,,,,,Beifall beim BÜNDNIS 90/DIE GRÜNEN,TOP 30 Elterngeld Plus und flexiblere Elternzeit,1917,poi,18
265,165228,265,64,Katja Dörner (BÜNDNIS 90/DIE GRÜNEN),Katja Dörner,katja-dorner,354.0,gruene,"Liebe Kolleginnen und Kollegen, gestern war der Kitagipfel, vorgestern konnten wir in der Zeitung lesen, dass das Betreuungsgeld ein Rohrkrepierer ist,",TOP 30 Elterngeld Plus und flexiblere Elternzeit,1917,speech,18
266,165229,266,64,Paul Lehrieder [CDU/CSU],Paul Lehrieder,paul-lehrieder,487.0,cducsu,"70 Prozent in Bayern, Frau Kollegin!",TOP 30 Elterngeld Plus und flexiblere Elternzeit,1917,poi,18
267,165230,267,64,Katja Dörner (BÜNDNIS 90/DIE GRÜNEN),Katja Dörner,katja-dorner,354.0,gruene,"der fast im gesamten Bundesgebiet von den Eltern gar nicht nachgefragt wird. Die Bundesregierung sollte endlich ein Einsehen haben. Wir haben in der letzten Legislaturperiode lange Diskussionen zum Betreuungsgeld geführt. Es sprach schon immer alles gegen das Betreuungsgeld. Es wurde wider alle Vernunft eingeführt. Jetzt zeigt sich überall in der Republik, dass in der Breite die Eltern diese Leistung gar nicht haben wollen. Deshalb mein Appell: Halten Sie nicht an diesem unsinnigen Betreuungsgeld fest. Die vorgesehene Milliarde wäre in den Kitas deutlich besser aufgehoben.",TOP 30 Elterngeld Plus und flexiblere Elternzeit,1917,speech,18
268,165231,268,64,,,,,,Beifall beim BÜNDNIS 90/DIE GRÜNEN und bei der LINKEN,TOP 30 Elterngeld Plus und flexiblere Elternzeit,1917,poi,18
269,165232,269,64,Katja Dörner (BÜNDNIS 90/DIE GRÜNEN),Katja Dörner,katja-dorner,354.0,gruene,"Liebe Kolleginnen, liebe Kollegen, wir hatten eine Legislaturperiode unter Schwarz-Gelb, in der familienpolitisch so gut wie alles in die falsche Richtung gelaufen ist. Wir können uns jetzt keine Legislaturperiode leisten, in der wir nur in Trippelschritten vorankommen. Wir stimmen heute einem richtigen Schritt zu. Aber wenn wir wirklich etwas für die Kinder und Familien in unserem Land tun wollen, dann muss in den nächsten Jahren deutlich mehr kommen.

Vielen Dank.",TOP 30 Elterngeld Plus und flexiblere Elternzeit,1917,speech,18
270,165233,270,64,,,,,,Beifall beim BÜNDNIS 90/DIE GRÜNEN,TOP 30 Elterngeld Plus und flexiblere Elternzeit,1917,poi,18
271,165234,271,64,Vizepräsidentin Ulla Schmidt,Ulla Schmidt,ulla-schmidt,405.0,,Vielen Dank. - Nächster Redner für die CDU/CSU-Fraktion ist der Kollege Paul Lehrieder.,TOP 30 Elterngeld Plus und flexiblere Elternzeit,1917,chair,18
272,165235,272,64,,,,,,Beifall bei der CDU/CSU,TOP 30 Elterngeld Plus und flexiblere Elternzeit,1917,poi,18
273,165236,273,64,Paul Lehrieder (CDU/CSU),Paul Lehrieder,paul-lehrieder,487.0,cducsu,"Sehr geehrte Frau Präsidentin! Liebe Kollegin Brantner, Sie haben vorhin Bezug auf die Gedenkstunde heute Morgen genommen und gefragt, ob wir in 25 Jahren auch eine Gedenkstunde mit Blick auf das Elterngeld feiern. Ich weiß nicht, ob das Elterngeld Plus in 25 Jahren mit so einem großen Aufwand gefeiert wird wie heute die deutsche Einheit.",TOP 30 Elterngeld Plus und flexiblere Elternzeit,1917,speech,18
274,165237,274,64,,,,,,Heiterkeit beim BÜNDNIS 90/DIE GRÜNEN,TOP 30 Elterngeld Plus und flexiblere Elternzeit,1917,poi,18
275,165238,275,64,Paul Lehrieder (CDU/CSU),Paul Lehrieder,paul-lehrieder,487.0,cducsu,"In 25 Jahren wird man aber darauf hinweisen, dass diese Regierung kraftvoll auf die Veränderungen in der Gesellschaft reagiert hat, indem sie unter anderem das Elterngeld Plus auf den Weg gebracht hat.

Eigentlich hatte ich mir vorgenommen, die Grünen heute bedingungslos zu loben, Frau Kollegin Dörner, aber das, was Sie zum Schluss über das Betreuungsgeld gesagt haben, provoziert eine Richtigstellung.

Es gibt natürlich Länder, in denen durch die Aufklärung der Eltern eine Inanspruchnahmequote von 70 Prozent erreicht werden konnte, zum Beispiel in Bayern. Es gibt andere Länder - ich glaube, Mecklenburg-Vorpommern, Frau Ministerin -, in denen die Inanspruchnahmequote bei etwa 15 Prozent liegt. Ich wünsche mir, dass die Eltern in Mecklenburg-Vorpommern, die zu Hause erziehen wollen, noch etwas stärker auf die Möglichkeit des Betreuungsgeldes hingewiesen werden. Dann werden es auch dort 50, 60 oder 70 Prozent der Eltern in Anspruch nehmen. Davon bin ich überzeugt.",TOP 30 Elterngeld Plus und flexiblere Elternzeit,1917,speech,18
276,165239,276,64,,,,,,Beifall bei Abgeordneten der CDU/CSU,TOP 30 Elterngeld Plus und flexiblere Elternzeit,1917,poi,18
277,165240,277,64,Katja Dörner [BÜNDNIS 90/DIE GRÜNEN],Katja Dörner,katja-dorner,354.0,gruene,Die wollen nicht zwangsbeglückt werden!,TOP 30 Elterngeld Plus und flexiblere Elternzeit,1917,poi,18
278,165241,278,64,Jörn Wunderlich [DIE LINKE],Jörn Wunderlich,jorn-wunderlich,357.0,linke,"Schade, dass Bayern nicht über das Wohngeld aufklärt!",TOP 30 Elterngeld Plus und flexiblere Elternzeit,1917,poi,18
279,165242,279,64,Paul Lehrieder (CDU/CSU),Paul Lehrieder,paul-lehrieder,487.0,cducsu,"- Bitte? Stellen Sie eine Zwischenfrage, sonst läuft meine Zeit weiter, Herr Wunderlich.

Es ist richtig - meine Vorredner haben bereits darauf hingewiesen -: Umfragen zufolge wünschen sich die meisten Eltern mehr Zeit für ihren Nachwuchs. Doch leider ist der Vater, der oft erst dann nach Hause kommt, wenn die Kleinen schon schlafen, in vielen Familien Realität. Auf der einen Seite möchten die Väter gern mehr Zeit mit ihren Kindern verbringen und aktiv an der Erziehung teilhaben, auf der anderen Seite befürchten sie jedoch einen Karriereknick und schrecken deshalb oft vor Teil- und Elternzeit zurück. Sie haben die Sorge, dass eine längere Auszeit oder ein Wechsel in Teilzeit bei ihrem Chef und im Kollegenkreis nicht gut ankommt.

Laut einer repräsentativen forsa-Studie mit dem Titel „Väter 2014 - zwischen Wunsch und Wirklichkeit“ befürchten immerhin 41 Prozent der abhängig beschäftigten Väter, dass sich die Elternzeit sehr oder eher negativ auf ihre Karriere auswirken könnte, und verzichten daher auf Familienzeit. Der Verdienstausfall des Haupternährers mag ein weiterer Grund dafür sein, dass sich bislang nur wenige Männer mehr als zwei Partnermonate der Elternzeit genehmigen.

Liebe Frau Kollegin Dörner, unbeschadet der Inanspruchnahmequote beim Betreuungsgeld von 70 Prozent ist die Inanspruchnahmequote bei den Vätermonaten in Bayern, gerade in Unterfranken, überdurchschnittlich hoch. Das heißt also: Wir können auch Familienpolitik.",TOP 30 Elterngeld Plus und flexiblere Elternzeit,1917,speech,18
280,165243,280,64,Dr. Gesine Lötzsch [DIE LINKE],Dr. Gesine Lötzsch,gesine-lotzsch,328.0,linke,Unterfranken? Oberfranken? Wo ist es mehr?,TOP 30 Elterngeld Plus und flexiblere Elternzeit,1917,poi,18
281,165244,281,64,Paul Lehrieder (CDU/CSU),Paul Lehrieder,paul-lehrieder,487.0,cducsu,- Bitte?,TOP 30 Elterngeld Plus und flexiblere Elternzeit,1917,speech,18
282,165245,282,64,Dr. Gesine Lötzsch [DIE LINKE],Dr. Gesine Lötzsch,gesine-lotzsch,328.0,linke,Mehr Oberfranken oder mehr Unterfranken?,TOP 30 Elterngeld Plus und flexiblere Elternzeit,1917,poi,18
283,165246,283,64,Paul Lehrieder (CDU/CSU),Paul Lehrieder,paul-lehrieder,487.0,cducsu,"- Frau Kollegin, die Oberfranken sind nicht schlecht, aber an der Spitze dürfte Unterfranken stehen. Wir müssten einen Faktencheck machen; dann kann ich Ihnen das nächste Woche gerne sagen.

Weil Frauen im Schnitt weniger verdienen als Männer, entfällt der Großteil der bezahlten Elternzeit häufig auf die Mütter. Diese wiederum würden oftmals gerne stärker in ihren Job eingebunden sein; auch darauf wurde von den Vorrednern ausführlich hingewiesen.

Das Elterngeld, das zum 1. Januar 2007 von unserer damaligen Bundesfamilienministerin Frau Dr. Ursula von der Leyen eingeführt wurde, war die erste wichtige Maßnahme, um diese Aufteilung zu ändern. Besonders für besserverdienende Väter war es bis zum Stichtag 2007 nicht wirklich eine Option, zugunsten des Babys auf ihr Gehalt zu verzichten. Erst die Zahlung von mindestens 65 Prozent vom Netto- bzw. seit 2013 vom Bruttogehalt setzte einen attraktiven Anreiz, sich finanziell abgesichert um den Nachwuchs zu kümmern.

Beim alten Erziehungsgeld konnte der Elternteil, der sich vorwiegend um das Kind kümmert, für 24 Monate 300 Euro oder alternativ für zwölf Monate 450 Euro Unterstützung beantragen. Voraussetzung war auch damals, eine Teilzeitarbeit von maximal 30 Stunden pro Woche und das Einhalten bestimmter Einkommensgrenzen. Noch einmal, Herr Kollege Wunderlich: Das neue Elterngeld ist eine Lohnersatzleistung, konzipiert für den Ausfall des Einkommens. Es geht nicht darum, eine Erhöhung der Anzahl der Geburten zu erreichen. Das ist der Unterschied zum vorherigen Erziehungsgeld.

Umfangreiche Evaluierungen haben die positiven Wirkungen des Elterngeldes bewiesen. Ich weiß, dass Sie im Herzen liebend gern unserem guten Gesetzentwurf zustimmen würden, dass Sie das aber aus dogmatischen Gründen leider nicht machen können, Herr Kollege Wunderlich.",TOP 30 Elterngeld Plus und flexiblere Elternzeit,1917,speech,18
284,165247,284,64,,,,,,Heiterkeit bei Abgeordneten der CDU/CSU,TOP 30 Elterngeld Plus und flexiblere Elternzeit,1917,poi,18
285,165248,285,64,Jörn Wunderlich [DIE LINKE],Jörn Wunderlich,jorn-wunderlich,357.0,linke,Das ist jetzt eine falsche Wahrnehmung!,TOP 30 Elterngeld Plus und flexiblere Elternzeit,1917,poi,18
286,165249,286,64,Paul Lehrieder (CDU/CSU),Paul Lehrieder,paul-lehrieder,487.0,cducsu,"- Das habe ich Ihrer Rede zwischen den Zeilen entnehmen können.

Mit der von den Wissenschaftlerinnen und Wissenschaftlern ausdrücklich empfohlenen Weiterentwicklung des Elterngeldes haben Eltern künftig noch mehr Entscheidungsfreiheit bei der Ausgestaltung ihrer Lebens- und Berufswünsche.",TOP 30 Elterngeld Plus und flexiblere Elternzeit,1917,speech,18
287,165250,287,64,Vizepräsidentin Ulla Schmidt,Ulla Schmidt,ulla-schmidt,405.0,,"Herr Kollege Lehrieder, gestatten Sie eine Zwischenfrage des Kollegen Wunderlich?",TOP 30 Elterngeld Plus und flexiblere Elternzeit,1917,chair,18
288,165251,288,64,Paul Lehrieder (CDU/CSU),Paul Lehrieder,paul-lehrieder,487.0,cducsu,Ich bitte darum.,TOP 30 Elterngeld Plus und flexiblere Elternzeit,1917,speech,18
289,165252,289,64,Stefan Müller [Erlangen] [CDU/CSU],Stefan Müller,stefan-muller,463.0,cducsu,"Können Sie noch einmal fragen, wie das in Mittelfranken ausschaut?",TOP 30 Elterngeld Plus und flexiblere Elternzeit,1917,poi,18
290,165253,290,64,Vizepräsidentin Ulla Schmidt,Ulla Schmidt,ulla-schmidt,405.0,,Bitte schön.,TOP 30 Elterngeld Plus und flexiblere Elternzeit,1917,chair,18
291,165254,291,64,Jörn Wunderlich (DIE LINKE),Jörn Wunderlich,jorn-wunderlich,357.0,linke,"Es gibt einzelne gute Gründe dafür, dieses Gesetz gutzuheißen, es gibt aber auch einzelne gute Gründe, dieses Gesetz abzulehnen. In der Gesamtschau aber kann man ihm nicht zustimmen.

Wenn Sie mir jetzt, lieber Kollege Lehrieder, an dieser Stelle erklären können, wie eine alleinerziehende Mutter, die nach Auskunft des Familienministeriums im Durchschnitt 7 Stunden pro Woche arbeitet, diese Stundenzahl auf 15 Stunden reduzieren soll, dann überlege ich mir, ob ich nicht doch zustimme. Wie reduziert man 7 Stunden auf 15 Stunden?",TOP 30 Elterngeld Plus und flexiblere Elternzeit,1917,speech,18
292,165255,292,64,Paul Lehrieder (CDU/CSU),Paul Lehrieder,paul-lehrieder,487.0,cducsu,"Da ist keine Reduzierung, sondern allenfalls eine Aufstockung möglich. Das ist mit der Erziehung des Kindes aber sicherlich nicht kompatibel. Wir werden uns gerade die Auswirkungen auf Alleinerziehende anschauen müssen; das wurde auch in der Anhörung thematisiert. Wir müssen schauen, ob und inwieweit es auch für die alleinerziehende Mutter, die in Teilzeit berufstätig ist, eine Möglichkeit gibt, diese Leistung zu erhalten, wenn sie ihre Arbeitszeit reduziert. Ich verweise da auf das Struck’sche Prinzip des Gesetzgebungsverfahrens: Kein Gesetz verlässt den Bundestag so, wie es reingekommen ist. - Wir werden die Auswirkungen dieses Gesetzes in den Blick nehmen und schauen, ob für bestimmte Personengruppen, die möglicherweise noch nicht ausreichend berücksichtigt wurden, Veränderungen erforderlich sind.",TOP 30 Elterngeld Plus und flexiblere Elternzeit,1917,speech,18
293,165256,293,64,Jörn Wunderlich [DIE LINKE],Jörn Wunderlich,jorn-wunderlich,357.0,linke,Wir haben die Hoffnung bis zur Abstimmung!,TOP 30 Elterngeld Plus und flexiblere Elternzeit,1917,poi,18
294,165257,294,64,Paul Lehrieder (CDU/CSU),Paul Lehrieder,paul-lehrieder,487.0,cducsu,"Lieber Kollege Wunderlich, Sie können sehen, dass wir im Gesetzgebungsverfahren auf Änderungsbedarf mit Blick auf den sogenannten doppelten Anspruchsverbrauch reagiert haben.",TOP 30 Elterngeld Plus und flexiblere Elternzeit,1917,speech,18
295,165258,295,64,Jörn Wunderlich [DIE LINKE],Jörn Wunderlich,jorn-wunderlich,357.0,linke,Das ist gut!,TOP 30 Elterngeld Plus und flexiblere Elternzeit,1917,poi,18
