,id,sequence,sitzung,speaker,speaker_cleaned,speaker_fp,speaker_key,speaker_party,text,top,top_id,type,wahlperiode
549,165512,549,64,Waltraud Wolff (Wolmirstedt) (SPD),Waltraud Wolff,waltraud-wolff,356.0,spd,"Ich sage hier - ich denke, auch im Namen meiner Fraktion - ganz klar und deutlich, dass wir eine gesetzliche Regelung für notwendig erachten.",TOP 31 Schutz von Hinweisgebern,1918,speech,18
550,165513,550,64,,,,,,"Beifall bei der SPD, der LINKEN und dem BÜNDNIS 90/DIE GRÜNEN",TOP 31 Schutz von Hinweisgebern,1918,poi,18
551,165514,551,64,Hans-Christian Ströbele [BÜNDNIS 90/DIE GRÜNEN],Hans-Christian Ströbele,hans-christian-strobele,318.0,gruene,Bravo!,TOP 31 Schutz von Hinweisgebern,1918,poi,18
552,165515,552,64,Waltraud Wolff (Wolmirstedt) (SPD),Waltraud Wolff,waltraud-wolff,356.0,spd,"In den letzten Jahren hat das Bundesarbeitsgericht Kriterien dafür erarbeitet, wie ein Informant geschützt werden soll. Aber diese Kriterien sind sehr vage, sie sind unbestimmt, und die Abwägung im Einzelfall führt eigentlich zu mehr Unsicherheit als zu Sicherheit. Hier könnten gesetzliche Regelungen wirklich Klarheit schaffen. Wir würden einerseits Informantenschutz aufwerten, andererseits auch das öffentliche Interesse in der Abwägung stärken und so eine Kultur der Rechtstreue, wie es das Europäische Parlament bezeichnet hat, verankern.",TOP 31 Schutz von Hinweisgebern,1918,speech,18
553,165516,553,64,Dr. Konstantin von Notz [BÜNDNIS 90/DIE GRÜNEN],Dr. Konstantin von Notz,konstantin-notz,316.0,gruene,Man muss nur dem grünen Gesetzentwurf zustimmen!,TOP 31 Schutz von Hinweisgebern,1918,poi,18
554,165517,554,64,Waltraud Wolff (Wolmirstedt) (SPD),Waltraud Wolff,waltraud-wolff,356.0,spd,"Es ist zweifelsfrei wichtig, dem Schutz von Unternehmen vor unberechtigten Vorwürfen Rechnung zu tragen. Es ist aber auch wichtig, die Rechte von Menschen zu stärken, die eklatante Verstöße aufdecken. Wer sollte in Zeiten von Abhör , Lebensmittel- und Betrugsskandalen Rechtssicherheit für Unternehmen und Informanten schaffen können, wenn nicht diese Große Koalition?",TOP 31 Schutz von Hinweisgebern,1918,speech,18
555,165518,555,64,Dr. Konstantin von Notz [BÜNDNIS 90/DIE GRÜNEN],Dr. Konstantin von Notz,konstantin-notz,316.0,gruene,Die Grünen!,TOP 31 Schutz von Hinweisgebern,1918,poi,18
556,165519,556,64,Waltraud Wolff (Wolmirstedt) (SPD),Waltraud Wolff,waltraud-wolff,356.0,spd,Wir haben in dieser Legislaturperiode die abschlagsfreie Rente mit 63 umgesetzt. Wir haben den Mindestlohn eingeführt.,TOP 31 Schutz von Hinweisgebern,1918,speech,18
557,165520,557,64,Hans-Christian Ströbele [BÜNDNIS 90/DIE GRÜNEN],Hans-Christian Ströbele,hans-christian-strobele,318.0,gruene,Der muss auch überprüft werden!,TOP 31 Schutz von Hinweisgebern,1918,poi,18
558,165521,558,64,Waltraud Wolff (Wolmirstedt) (SPD),Waltraud Wolff,waltraud-wolff,356.0,spd,"Ich habe große Hoffnung, dass wir es im Rahmen der Diskussionen in der nächsten Sitzungswoche schaffen werden, den Informantenschutz auf rechtlich gute Füße zu stellen.

Herzlichen Dank.",TOP 31 Schutz von Hinweisgebern,1918,speech,18
559,165522,559,64,,,,,,Beifall bei der SPD und dem BÜNDNIS 90/DIE GRÜNEN sowie bei Abgeordneten der LINKEN,TOP 31 Schutz von Hinweisgebern,1918,poi,18
560,165523,560,64,Andrej Hunko [DIE LINKE],Andrej Hunko,andrej-hunko,218.0,linke,Da bin ich aber gespannt!,TOP 31 Schutz von Hinweisgebern,1918,poi,18
561,165524,561,64,Dr. Konstantin von Notz [BÜNDNIS 90/DIE GRÜNEN],Dr. Konstantin von Notz,konstantin-notz,316.0,gruene,Dann mal los!,TOP 31 Schutz von Hinweisgebern,1918,poi,18
562,165525,562,64,Vizepräsidentin Edelgard Bulmahn,Edelgard Bulmahn,edelgard-bulmahn,596.0,,Als nächster Redner hat der Kollege Uwe Lagosky das Wort.,TOP 31 Schutz von Hinweisgebern,1918,chair,18
563,165526,563,64,,,,,,Beifall bei Abgeordneten der CDU/CSU,TOP 31 Schutz von Hinweisgebern,1918,poi,18
564,165527,564,64,Dr. Konstantin von Notz [BÜNDNIS 90/DIE GRÜNEN],Dr. Konstantin von Notz,konstantin-notz,316.0,gruene,Da können Sie jetzt gut dran anschließen!,TOP 31 Schutz von Hinweisgebern,1918,poi,18
565,165528,565,64,Uwe Lagosky (CDU/CSU),Uwe Lagosky,uwe-lagosky,187.0,cducsu,"Sehr geehrte Frau Präsidentin! Liebe Kolleginnen und Kollegen! Aufgrund nationaler und internationaler Initiativen wird Whistleblowing, die Hinweisgebung, heutzutage als essenzieller Beitrag zu einer guten Unternehmensführung betrachtet. Es ist im Allgemeininteresse, dass Hinweise gegeben werden, unter anderem, damit korruptes Verhalten und Straftaten aufgedeckt werden können.",TOP 31 Schutz von Hinweisgebern,1918,speech,18
566,165529,566,64,Hans-Christian Ströbele [BÜNDNIS 90/DIE GRÜNEN],Hans-Christian Ströbele,hans-christian-strobele,318.0,gruene,So ist es!,TOP 31 Schutz von Hinweisgebern,1918,poi,18
567,165530,567,64,Uwe Lagosky (CDU/CSU),Uwe Lagosky,uwe-lagosky,187.0,cducsu,"Wenn Whistleblowing beschrieben wird, wird gern „moralisches Gewissen“ genannt, ebenso „Zivilcourage“, „Heldentat“ und „Mut“. Im Antrag der Grünen heißt es, dass Hinweisgeberinnen und Hinweisgeber neben Mobbing häufig auch arbeits- und dienstrechtlichen Konsequenzen ausgesetzt sind. Hierdurch entstehe für Mitarbeiterinnen und Mitarbeiter ein Gewissenskonflikt: Es ist zu entscheiden, ob sie über die Missstände sprechen oder schweigen.

Die Opposition ist der Meinung, dass es ein neues Gesetz geben soll. Von den Grünen und den Linken sind entsprechende Anträge bzw. Gesetzentwürfe sowohl in den Jahren 2011 und 2012 als auch jetzt, 2014, eingebracht worden.",TOP 31 Schutz von Hinweisgebern,1918,speech,18
568,165531,568,64,Dr. Konstantin von Notz [BÜNDNIS 90/DIE GRÜNEN],Dr. Konstantin von Notz,konstantin-notz,316.0,gruene,Ja! Sehr gute Anträge!,TOP 31 Schutz von Hinweisgebern,1918,poi,18
569,165532,569,64,Uwe Lagosky (CDU/CSU),Uwe Lagosky,uwe-lagosky,187.0,cducsu,Ihr gutes Recht.,TOP 31 Schutz von Hinweisgebern,1918,speech,18
570,165533,570,64,Dr. Konstantin von Notz [BÜNDNIS 90/DIE GRÜNEN],Dr. Konstantin von Notz,konstantin-notz,316.0,gruene,Danke!,TOP 31 Schutz von Hinweisgebern,1918,poi,18
571,165534,571,64,Uwe Lagosky (CDU/CSU),Uwe Lagosky,uwe-lagosky,187.0,cducsu,"CDU/CSU und SPD werden beim Hinweisgeberschutz prüfen, ob die internationalen Vorgaben hinreichend umgesetzt sind. Das haben wir im Koalitionsvertrag miteinander vereinbart. Ich bin der Auffassung, dass Sie und wir alle Möglichkeiten haben, eine entsprechende Regelung innerhalb der Koalition einzufordern.",TOP 31 Schutz von Hinweisgebern,1918,speech,18
572,165535,572,64,Hans-Christian Ströbele [BÜNDNIS 90/DIE GRÜNEN],Hans-Christian Ströbele,hans-christian-strobele,318.0,gruene,Sie haben ja jetzt eine gute Vorlage!,TOP 31 Schutz von Hinweisgebern,1918,poi,18
573,165536,573,64,Uwe Lagosky (CDU/CSU),Uwe Lagosky,uwe-lagosky,187.0,cducsu,"Insofern sage ich: Dieser Prüfauftrag wird aus meiner Sicht sicherlich erfolgen.

Jetzt zum Unternehmenskontext. Keine Frage, ein Mitarbeiter kann sich nicht einverstanden erklären, wenn unverantwortliche Risiken für das Gemeinwesen oder Straftaten bei ihm im Betrieb eingegangen werden. Es braucht - da sind wir uns einig - mutige Mitarbeiter zur Aufklärung solcher Fälle. Im Gegenzug muss der Hinweisgeber aber auch vor Nachteilen im Betrieb geschützt werden. Und genau dieser Aspekt wird von der deutschen Gesetzgebung aufgegriffen.

Der Arbeitgeber darf einen Arbeitnehmer bei einer Vereinbarung oder einer Maßnahme nicht benachteiligen, weil der Arbeitnehmer in zulässiger Weise seine Rechte ausübt.",TOP 31 Schutz von Hinweisgebern,1918,speech,18
574,165537,574,64,Hans-Christian Ströbele [BÜNDNIS 90/DIE GRÜNEN],Hans-Christian Ströbele,hans-christian-strobele,318.0,gruene,Aber die Rechte hat er ja bisher nicht!,TOP 31 Schutz von Hinweisgebern,1918,poi,18
575,165538,575,64,Uwe Lagosky (CDU/CSU),Uwe Lagosky,uwe-lagosky,187.0,cducsu,"Der Arbeitnehmer ist durch das eben genannte Maßregelungsverbot gemäß § 612 a BGB geschützt; das ist hier heute schon mehrfach gesagt worden. Arbeitnehmer in Deutschland dürfen ihren Arbeitgeber anzeigen, wenn er das Recht bricht. Darüber hinaus existieren bereits zahlreiche spezialgesetzliche Anzeigerechte für Beschäftigte - die Gesetze sind hier ebenfalls schon -genannt worden -, zum Beispiel nach dem Arbeitsschutzgesetz, dem Bundesdatenschutzgesetz oder dem Betriebsverfassungsgesetz.

Zur derzeitigen Rechtsprechung ist zu sagen: Bei Straftaten mit schweren Folgen für Einzelne oder für die Allgemeinheit kann auf den ersten wichtigen Gang, den Versuch einer innerbetrieblichen Klärung, verzichtet werden. In der Rechtsprechung ist dieses ungeschriebene Anzeigerecht der Arbeitnehmer so anerkannt.",TOP 31 Schutz von Hinweisgebern,1918,speech,18
576,165539,576,64,Hans-Christian Ströbele [BÜNDNIS 90/DIE GRÜNEN],Hans-Christian Ströbele,hans-christian-strobele,318.0,gruene,Ungeschrieben!,TOP 31 Schutz von Hinweisgebern,1918,poi,18
577,165540,577,64,Uwe Lagosky (CDU/CSU),Uwe Lagosky,uwe-lagosky,187.0,cducsu,"- Ungeschrieben, in der Tat.",TOP 31 Schutz von Hinweisgebern,1918,speech,18
578,165541,578,64,Hans-Christian Ströbele [BÜNDNIS 90/DIE GRÜNEN],Hans-Christian Ströbele,hans-christian-strobele,318.0,gruene,"Ja, leider! Das wollen wir ja reinschreiben!",TOP 31 Schutz von Hinweisgebern,1918,poi,18
579,165542,579,64,Uwe Lagosky (CDU/CSU),Uwe Lagosky,uwe-lagosky,187.0,cducsu,"Auch wenn es sich nicht um schwere Straftaten handelt, darf Hinweisgebern nicht gekündigt werden, wenn sie im Vorfeld einer Anzeige oder Veröffentlichung einige Regeln einhalten. So können sich Hinweisgeber an öffentliche Stellen wenden, wenn sie sich zuvor ernsthaft um eine innerbetriebliche Klärung bemüht haben. Es soll sich eben nicht sofort an die Polizei und die Medien gewendet werden. Auch darf eine Anzeige nicht leichtsinnig und mit dem Ziel erfolgen, einer Kollegin oder einem Kollegen erheblichen Schaden zuzufügen. Genau diese Punkte, die auf die bewährte Rechtsprechung zurückzuführen sind, finde ich ausgesprochen sinnvoll.

In einem Betrieb haben Unternehmensleitung, Führungskräfte und Betriebsrat eine Verantwortung für die Beschäftigten. Diese Verantwortung erfordert es, mit Hinweisen im Betrieb sorgsam umzugehen. Es ist zunächst einmal zu klären, ob sie zutreffen, indem man Gespräche mit dem Hinweisgeber, aber auch mit den von den Hinweisen betroffenen Kolleginnen und Kollegen führt,",TOP 31 Schutz von Hinweisgebern,1918,speech,18
580,165543,580,64,Karl Schiewerling [CDU/CSU],Karl Schiewerling,karl-schiewerling,419.0,cducsu,Sehr richtig!,TOP 31 Schutz von Hinweisgebern,1918,poi,18
581,165544,581,64,Uwe Lagosky (CDU/CSU),Uwe Lagosky,uwe-lagosky,187.0,cducsu,"kurzum, indem man eine Beurteilung der Gesamtsituation vornimmt. Wenn die Gesamtsituation es erfordert, sind auch arbeits- und strafrechtliche Maßnahmen einzuleiten.

Viele Unternehmen in Deutschland haben Ethikrichtlinien und entsprechende Betriebsvereinbarungen mit -ihren Betriebsräten abgeschlossen. Als ehemaliger -Konzernbetriebsratsvorsitzender eines Energieversorgungsunternehmens hatte ich einmal die Gelegenheit, eine derartige Ethikrichtlinie und Betriebsvereinbarung abzuschließen. Um sie umzusetzen, wird in der Regel auf eine Anlaufstelle im Betrieb Wert gelegt und diese installiert. Es findet eine Sensibilisierung, eine Belehrung der Beschäftigten statt, indem man unter anderem Korruptionssachverhalte deutlich macht. Korruptionsrelevante Straftaten werden ebenfalls dort benannt, sodass die Beschäftigten insgesamt auf diese Situation vorbereitet sind.

Ethikrichtlinien sollen dabei unterstützen, dass mögliche Straftaten oder korruptes Verhalten aufgedeckt werden und dass ein eventueller Rufschaden für den Betrieb oder für einzelne Mitarbeiter bei nicht korrekten Hinweisen abgewendet werden kann. Sie stellen auch den Hinweisgeber unter Schutz. Wenn man nach den betriebliche Richtlinien und dem geltenden Recht verfährt, sind Betrieb und Hinweisgeber in der Regel maximal geschützt.

Die betrieblichen Handlungsmöglichkeiten eröffnen auf der einen Seite den Rechtsweg, verhindern auf der anderen Seite aber auch, dass Beschäftigte und Arbeitgeber zu Unrecht von Hinweisgebern belastet werden. Unter welchen Rechtfertigungsdruck geraten Betriebe, wenn keine innerbetriebliche Aufklärung vorgeschaltet ist? Man muss sich das nur einmal vorstellen: Medien kommen auf den Vorstand oder Betriebsrat zu, und es herrscht völlige Unwissenheit bei den Entscheidern. Keine vorhergehende Information, keine Möglichkeit zur Umsetzung der innerbetrieblichen Regelungen, die der Regeltreue dienen, keine Aufklärung des Sachverhaltes, keine Chance, sich mit Vorwürfen auseinanderzusetzen, keine eigene Entscheidung über mögliche Strafanzeigen, keine Kommunikationsstrategie, falls falsche Hinweise an die Öffentlichkeit gelangt sind - kurz gesagt: Chaos.

Unzutreffende Anschuldigungen sind in der Öffentlichkeit nur schwer oder gar nicht mehr zu korrigieren. Ungerechtfertigte Anzeigen können finanzielle und existenzielle Folgen für den gesamten Betrieb haben und natürlich auch für die Arbeitsplätze, die dahinter stehen. Insofern ist die Darstellung, dass Hinweisgebern neben Mobbing häufig auch arbeits- und dienstrechtliche Folgen bis hin zur Kündigung sowie strafrechtliche Konsequenzen drohen, nur eine Sichtweise der Dinge.

Unternehmen haben mit der Einführung von Ethikrichtlinien und dazugehörigen Betriebsvereinbarungen erheblich zur Korruptionsprävention beigetragen oder haben noch die Möglichkeit dazu. Durch die Beteiligung an der Entwicklung von Ethikrichtlinien in Verbindung mit Betriebsvereinbarungen haben auch die Betriebsräte die Möglichkeit, ihren Einfluss in den Betrieben zu steigern. Es kommt nicht nur auf neue Gesetze an, sondern vielmehr auf eine Kultur im Betrieb, die die Sozialpartner gemeinsam gestalten, eine Kultur, die es den Beschäftigten von vornherein leicht macht, intern Hinweise zu geben und so ihren Beitrag zu leisten, grobe Missstände und Gefahren abzustellen.

Meine Meinung ist: Deutschland hat eine Gesetzgebung, die den Betrieben sowohl Möglichkeiten zur Aufklärung als auch einen ausgewogenen Hinweisgeberschutz bietet. Die im Koalitionsvertrag vorgesehene Prüfung werden wir vornehmen. Ich bin auf die Ergebnisse gespannt. Als Union lehnen wir den Inhalt des Antrags und des Gesetzentwurfs an dieser Stelle ab.

Herzlichen Dank.",TOP 31 Schutz von Hinweisgebern,1918,speech,18
582,165545,582,64,,,,,,Beifall bei der CDU/CSU,TOP 31 Schutz von Hinweisgebern,1918,poi,18
583,165546,583,64,Vizepräsidentin Edelgard Bulmahn,Edelgard Bulmahn,edelgard-bulmahn,596.0,,Als letzter Redner in der Debatte hat jetzt der Kollege Gerold Reichenbach das Wort.,TOP 31 Schutz von Hinweisgebern,1918,chair,18
584,165547,584,64,,,,,,Beifall bei der SPD,TOP 31 Schutz von Hinweisgebern,1918,poi,18
585,165548,585,64,Gerold Reichenbach (SPD),Gerold Reichenbach,gerold-reichenbach,437.0,spd,"Frau Präsidentin! Sehr geehrte Kolleginnen und Kollegen! Sehr geehrte Damen und Herren auf der Tribüne und am Fernseher! Wir reden hier nicht über den Schutz von Querulanten oder über den Schutz von denjenigen, die aus persönlichen Motiven heraus ihrem Arbeitgeber schaden, sondern wir reden über ganz andere Fälle.

Es ist 20 Jahre her. Der eine oder andere wird sich erinnern an Bilder von zuckenden Kühen aus England und die Berichte von Menschen, die sich an dieser tödlichen grausamen Krankheit durch in Umlauf gebrachtes Rindfleisch von erkrankten Tieren angesteckt haben. Gleichzeitig kam hier in Deutschland von der Fleischindustrie und auch von vielen offiziellen Stellen die Beteuerung: Das ist ein englisches Problem. Das gibt es bei uns in Deutschland nicht.

Im Jahr 1994 schilderte die Hygieneamtstierärztin Margrit Herbst in einem Interview, das im öffentlich-rechtlichen Fernsehen ausgestrahlt wurde, wie sie in einem Schlachthof bei der Tierbeschau BSE-Anzeichen an mehreren Tieren festgestellt hat. Diese Tiere wurden dann allerdings auf Entscheidung höherer Stellen trotzdem für die Schlachtung und die Inumlaufbringung freigegeben. Dann erst kam auch in Deutschland der BSE-Skandal ins Rollen.

Jetzt frage ich Sie: Welchen Schutz hat denn diese Frau genossen, die verhindert hat, dass auch in Deutschland Produzenten und Fleischbetriebe aus Profitgier weiter Fleisch in den Umlauf bringen, das die Gefahr in sich birgt, dass auch deutsche Bürger sich in Massen an dieser grausamen und tödlich endenden Krankheit infizieren? Sie hatte sich ja zuvor an ihren Vorgesetzten gewendet. Das Ergebnis war: Margrit Herbst wurde fristlos gekündigt.

Der hier schon ein paarmal angesprochene Fall der Pflegerin in einem Berliner Klinikum, die ihren Rechtsschutz bis zum EuGH durchklagen musste, macht deutlich: Offensichtlich sind die Schutzvorschriften, die wir in den unterschiedlichen Gesetzen durchaus haben, nicht ausreichend, um Beschäftigte, die Mut zeigen, dann auch zu schützen. Wer hat denn die Unterstützung und die Kraft, seine Rechte als Arbeitnehmer bis zum EuGH durchzuklagen?

Ich nenne Ihnen ein anderes Beispiel. In meinem Wahlkreis - zwei Ortschaften nebendran - wohnt Rudolf Schmenger. Das ist einer der hessischen Steuerfahnder, die sich ebenfalls an ihre Vorgesetzten gewendet haben und die weggemobbt wurden. Erst nachdem sie aus dem Dienst entfernt worden sind, konnten über Gerichte im Nachhinein die Unrechtmäßigkeit des Handelns ihrer Arbeitgeber und ein Schadenersatzanspruch festgestellt werden.",TOP 31 Schutz von Hinweisgebern,1918,speech,18
586,165549,586,64,Hans-Christian Ströbele [BÜNDNIS 90/DIE GRÜNEN],Hans-Christian Ströbele,hans-christian-strobele,318.0,gruene,"Die sagen, die Rechtslage reicht!",TOP 31 Schutz von Hinweisgebern,1918,poi,18
587,165550,587,64,Gerold Reichenbach (SPD),Gerold Reichenbach,gerold-reichenbach,437.0,spd,Jetzt komme ich zu den Grünen.,TOP 31 Schutz von Hinweisgebern,1918,speech,18
588,165551,588,64,Dr. Konstantin von Notz [BÜNDNIS 90/DIE GRÜNEN],Dr. Konstantin von Notz,konstantin-notz,316.0,gruene,Ja!,TOP 31 Schutz von Hinweisgebern,1918,poi,18
589,165552,589,64,Gerold Reichenbach (SPD),Gerold Reichenbach,gerold-reichenbach,437.0,spd,"Wir haben in der vergangenen Legislaturperiode genauso wie Sie einen Gesetzentwurf vorgelegt. Wir werden auch weiterhin dafür eintreten, dass wir Mehrheiten haben.",TOP 31 Schutz von Hinweisgebern,1918,speech,18
590,165553,590,64,Dr. Konstantin von Notz [BÜNDNIS 90/DIE GRÜNEN],Dr. Konstantin von Notz,konstantin-notz,316.0,gruene,Aber ihr regiert!,TOP 31 Schutz von Hinweisgebern,1918,poi,18
591,165554,591,64,Gerold Reichenbach (SPD),Gerold Reichenbach,gerold-reichenbach,437.0,spd,"- Ja, lieber Konstantin von Notz, wir regieren hier gemeinsam mit der CDU/CSU. Aber solange Sie sich - den Fall Schmenger vor Augen - nicht stolz hier hinstellen und sagen können, dass Sie gemeinsam mit der CDU in Hessen im hessischen Beamtengesetz einen Hinweisgeberschutz geschaffen haben,",TOP 31 Schutz von Hinweisgebern,1918,speech,18
592,165555,592,64,Hans-Christian Ströbele [BÜNDNIS 90/DIE GRÜNEN],Hans-Christian Ströbele,hans-christian-strobele,318.0,gruene,Abwarten!,TOP 31 Schutz von Hinweisgebern,1918,poi,18
593,165556,593,64,Gerold Reichenbach (SPD),Gerold Reichenbach,gerold-reichenbach,437.0,spd,"gilt für Sie das Gleiche wie für den Fußballfan auf der Tribüne, der lautstark etwas fordert, es aber auf dem Platz selbst nicht hinbekommt.",TOP 31 Schutz von Hinweisgebern,1918,speech,18
594,165557,594,64,,,,,,Beifall bei der SPD sowie bei Abgeordneten der CDU/CSU,TOP 31 Schutz von Hinweisgebern,1918,poi,18
595,165558,595,64,Gerold Reichenbach (SPD),Gerold Reichenbach,gerold-reichenbach,437.0,spd,"Letzter Satz. Wir werden über das Gesetz, übrigens auch über die Details, diskutieren. Kollege Ströbele, das, was Sie da so schön zitiert haben, das sind die Formulierungen, die wir gemeinsam in der Opposition",TOP 31 Schutz von Hinweisgebern,1918,speech,18
596,165559,596,64,Hans-Christian Ströbele [BÜNDNIS 90/DIE GRÜNEN],Hans-Christian Ströbele,hans-christian-strobele,318.0,gruene,Ein bisschen anders!,TOP 31 Schutz von Hinweisgebern,1918,poi,18
597,165560,597,64,Gerold Reichenbach (SPD),Gerold Reichenbach,gerold-reichenbach,437.0,spd,"bei dem zum Glück verfehlten Versuch der schwarz-gelben Koalition im Zusammenhang mit dem Überwachungsskandal bei Bahn und Post und bei anderen für -einen Hinweisgeberschutz im Beschäftigtendatenschutzgesetz gefunden haben.

Das sind die gleichen Formulierungen, die wir damals als völlig unzureichend und nicht bestimmt genug kritisiert haben. Jetzt kommen Sie selbst mit diesen Formulierungen. Das heißt, wenn Sie selbst Ihre Aussagen von damals ernst nehmen würden, dann würden Sie hier zumindest einen gewissen Diskussions- und Regelungsbedarf entdecken und sich nicht einfach nur so hinstellen und sagen: Wir haben den Stein der Weisen, und die anderen sind nur nicht in der Lage, das zu erkennen.",TOP 31 Schutz von Hinweisgebern,1918,speech,18
598,165561,598,64,,,,,,Beifall bei Abgeordneten der SPD und der CDU/CSU,TOP 31 Schutz von Hinweisgebern,1918,poi,18
599,165562,599,64,Dr. Konstantin von Notz [BÜNDNIS 90/DIE GRÜNEN],Dr. Konstantin von Notz,konstantin-notz,316.0,gruene,Das ist das Wohlfeilste überhaupt!,TOP 31 Schutz von Hinweisgebern,1918,poi,18
600,165563,600,64,Gerold Reichenbach (SPD),Gerold Reichenbach,gerold-reichenbach,437.0,spd,"Es gibt dazu die Beschlüsse auf europäischer Ebene; das ist gesagt worden. Auch das Europäische Parlament hat dazu mehrmals Beschlüsse gefasst. Wir als Sozialdemokraten werden sowohl in der Prüfung, die wir in der Koalition vereinbart haben, als auch darüber hinaus dafür kämpfen, dass wir hier in diesem Parlament die politischen Mehrheiten dafür bekommen, Menschen, die so mutig wie Frau Herbst waren, das Schicksal, anschließend arbeitslos auf der Straße zu stehen, in Zukunft zu ersparen.

Ich bedanke mich für Ihre Aufmerksamkeit.",TOP 31 Schutz von Hinweisgebern,1918,speech,18
601,165564,601,64,,,,,,Beifall bei der SPD,TOP 31 Schutz von Hinweisgebern,1918,poi,18
602,165565,602,64,Vizepräsidentin Edelgard Bulmahn,Edelgard Bulmahn,edelgard-bulmahn,596.0,,"Liebe Kolleginnen und Kollegen, ich bitte um etwas Zurückhaltung auch bei Zwischenfragen, weil wir sonst völlig aus dem Zeitrahmen laufen.",TOP 31 Schutz von Hinweisgebern,1918,chair,18
603,165566,603,64,Dr. Konstantin von Notz [BÜNDNIS 90/DIE GRÜNEN],Dr. Konstantin von Notz,konstantin-notz,316.0,gruene,"Das ist aber so ein wichtiges Thema, Frau Präsidentin!",TOP 31 Schutz von Hinweisgebern,1918,poi,18
604,165567,604,64,Vizepräsidentin Edelgard Bulmahn,Edelgard Bulmahn,edelgard-bulmahn,596.0,,"- Ich finde, dass diese Zwischenfragen für eine Debatte wichtig sind; deswegen habe ich sie auch zugelassen. Aber ich bitte Sie trotzdem, die Zeit ein bisschen im Auge zu behalten. Auch die Kolleginnen und Kollegen, die nach Ihnen zu den anderen Debattenpunkten reden werden, sollten nicht vor einem leeren Haus sprechen. Dazu sind die Debatten zu wichtig.

Wir kommen jetzt zu der Überweisung. Interfraktionell wird die Überweisung der Vorlagen auf den Drucksachen 18/3039 und 18/3043 an die in der Tagesordnung aufgeführten Ausschüsse vorgeschlagen. Die Federführung ist jedoch strittig. Deshalb muss ich darüber abstimmen lassen. Die Fraktionen der CDU/CSU und SPD wünschen Federführung beim Ausschuss für Arbeit und Soziales, und die Fraktionen Die Linke und Bündnis 90/Die Grünen wünschen Federführung beim Ausschuss für Recht und Verbraucherschutz.

Ich lasse zunächst über den Überweisungsvorschlag der Fraktionen Die Linke und Bündnis 90/Die Grünen, also Federführung beim Ausschuss für Recht und Verbraucherschutz, abstimmen. Wer stimmt diesem Überweisungsvorschlag zu? - Das sind Bündnis 90/Die Grünen und Die Linke. Wer stimmt dagegen? - Das ist die Koalition. Enthaltungen? - Niemand. Damit ist dieser Überweisungsvorschlag abgelehnt worden.

Ich lasse nun über den Überweisungsvorschlag der Fraktionen der CDU/CSU und SPD abstimmen, also Federführung beim Ausschuss für Arbeit und Soziales. Wer stimmt für diesen Überweisungsvorschlag? - Die Koalition. Wer stimmt dagegen? - Bündnis 90/Die Grünen und Die Linke. Wer enthält sich? - Niemand. Damit ist der Überweisungsvorschlag angenommen worden: Die Federführung hat der Ausschuss für Arbeit und Soziales.

Ich rufe jetzt den Tagesordnungspunkt 32 auf:

Beratung des Antrags der Abgeordneten Dr. Heinz Riesenhuber, Dr. Joachim Pfeiffer, Dr. Kristina Schröder (Wiesbaden), weiterer Abgeordneter und der Fraktion der CDU/CSU sowie der Abgeordneten Wolfgang Tiefensee, Hubertus Heil (Peine), Niels Annen, weiterer Abgeordneter und der Fraktion der SPD

Strategische Ziele für die Raumfahrt in dieser Legislaturperiode absichern

Drucksache 18/3040

Überweisungsvorschlag:

Ausschuss für Wirtschaft und Energie (f)

Auswärtiger Ausschuss

Ausschuss für Verkehr und digitale Infrastruktur

Ausschuss für Bildung, Forschung und Technikfolgenabschätzung

Ausschuss für die Angelegenheiten der Europäischen Union

Haushaltsausschuss

Nach einer interfraktionellen Vereinbarung sind für die Aussprache 38 Minuten vorgesehen. - Dazu höre ich keinen Widerspruch. Dann ist das so beschlossen.

Ich eröffne die Aussprache. Als erste Rednerin hat die Staatssekretärin Brigitte Zypries das Wort.",TOP 31 Schutz von Hinweisgebern,1918,chair,18
605,165568,605,64,,,,,,Beifall bei der SPD sowie des Abg. Andreas Mattfeldt [CDU/CSU],TOP 31 Schutz von Hinweisgebern,1918,poi,18
