,id,sequence,sitzung,speaker,speaker_cleaned,speaker_fp,speaker_key,speaker_party,text,top,top_id,type,wahlperiode
0,164963,0,64,Präsident Dr. Norbert Lammert,Dr. Norbert Lammert,norbert-lammert,494.0,,"Nehmen Sie bitte Platz. Die Sitzung ist eröffnet.

Liebe Kolleginnen und Kollegen! Verehrte Gäste auf der Besuchertribüne und an den Bildschirmen! Meine Damen und Herren Botschafter! Ich begrüße Sie alle herzlich zu dieser Plenarsitzung des Deutschen Bundestags, in der wir uns heute Morgen vor Eintritt in unsere übliche Tagesordnung mit der friedlichen Revolution in der damaligen DDR und dem Fall der Berliner Mauer vor 25 Jahren am 9. November 1989 befassen.

„Die Mauer ist weg!“ Ein einfacher Satz. Zu einfach. Damals unfassbar, vor 25 Jahren, als ein beiläufig vorgelesener Zettel auf einer inzwischen legendären Pressekonferenz in Ostberlin eine Lawine ins Rollen brachte, die sich dann nicht mehr stoppen ließ, eine Lawine, die sich freilich seit langem aufgestaut hatte. Die Unfassbarkeit dieses Satzes spiegelt sich in den Gesichtern der Menschen, die tatsächlich „unverzüglich“ der Ankündigung des neuen Parteisekretärs für Informationswesen folgten und die Grenzübergänge in Berlin buchstäblich stürmten.

Die Bilder gingen um die Welt, und sie gingen unter die Haut: konsternierte Grenzer, tränenüberströmte Gesichter der Menschen, die das Glück dieser Stunden nicht fassen konnten, Trabi-Kolonnen, elektrisierte Reporter und Jubel, Jubel, Jubel. „Wahnsinn“.

In der Nacht vom 9. zum 10. November 1989 ist wahr geworden, was in der inoffiziellen Hymne der Solidarnosc in Polen der 80er-Jahre besungen und beschworen wurde:

Ziehe den Mauern die Zähne der Gitter aus! Sprenge die Fesseln, zerbreche die Knute! Und die Mauern stürzen ein und begraben die alte Welt!

Meine Damen und Herren, in der Tat: Der Mauerfall beschleunigte durch die Symbolkraft der Bilder wie des Ortes den Zerfall der alten Welt des Kalten Krieges und des Ost-West-Konfliktes und führte binnen knapp eines Jahres zur deutschen Einheit.

Berlin war der Ausgangspunkt dieses Prozesses, aber nicht 1989, sondern im Juni 1953, als ein Volksaufstand blutig niedergeschlagen wurde. Die glückliche Verbindung von Freiheit und Einheit hat also eine lange Vorgeschichte. Der Mauerfall war der Siedepunkt des Schicksalsjahres 1989 und ein Ereignis, das vielen, die damals dabei waren, und manchen bis heute wie ein Wunder erscheint.

Ein Wunder war es aber nicht, ebenso wenig wie ein Naturereignis, sondern die Folge einer nicht nur in der deutschen Geschichte beispiellosen friedlichen Revolution, die seit Monaten in einem atemberaubenden Tempo von einem Höhepunkt zum anderen eilte. Sicher ist: Ohne die zahlreichen Bürgerrechtsbewegungen, die sich im Spätsommer 1989 zu Volksbewegungen entwickelten und ihren Veränderungswillen in friedlichen Massendemonstrationen ausdrückten, hätte es diesen 9. November in Berlin nicht gegeben.

„Wir bleiben hier“ war eine der trotzigen Schlagzeilen der mutigen Bürger, die erkannt hatten, dass sie das Volk sind. „Wir wollen raus“ war das Pendant der Des-illusionierten in der DDR. „Ich möchte am liebsten weg sein und bleibe am liebsten hier“ hat Wolf Biermann diese gespaltene Gefühlslage damals besungen. Ich freue mich, dass Wolf Biermann meine Einladung angenommen hat und der friedlichen Revolution auch heute seine unverwechselbare Stimme gibt.",TOP 29 Vereinbarte Debatte Friedliche Revolution – 25 Jahre nach Mauerfall,1916,chair,18
1,164964,1,64,,,,,,"Beifall bei der CDU/CSU, der SPD und dem BÜNDNIS 90/DIE GRÜNEN sowie bei Abgeordneten der LINKEN",TOP 29 Vereinbarte Debatte Friedliche Revolution – 25 Jahre nach Mauerfall,1916,poi,18
2,164965,2,64,Präsident Dr. Norbert Lammert,Dr. Norbert Lammert,norbert-lammert,494.0,,"Die Fernsehbilder der DDR-Flüchtlinge, die in Budapest, Prag und Warschau die Zäune der bundesdeutschen Botschaften überkletterten und schließlich in Sonderzügen nach Westdeutschland reisten, diese Bilder bislang unvorstellbarer Ereignisse entfalteten große Wirkung und destabilisierten das System: 1989 wurden allein bis zum 8. Oktober 53 576 gelungene Fluchtversuche registriert.

Häufig wird vergessen, dass auch der Entschluss Abertausender DDR-Bürger, ihr Land zu verlassen, sich auf eine Fluchtreise über Ungarn, Polen oder die Tschechoslowakei zu begeben, Mut verlangte. Ein glücklicher Ausgang dieses Unternehmens war keineswegs sicher. Sicher für die „Republikflüchtigen“ war nur, dass sie ihr Zuhause, ihr Hab und Gut aufgeben und Familienangehörige, Freunde, Bekannte und Nachbarn zurücklassen mussten. Das Wiedersehen, wann und ob überhaupt, war dabei ungewiss, schon gar in den Jahren vor 1989. Zu rechnen war allerdings mit Schikanen des Staatsapparates gegenüber den Verbliebenen.

Diese Abstimmung des Volkes mit den Füßen war 1989 kein neues Phänomen für die DDR. Bereits bis zum Mauerbau 1961 hatten etwa 3,5 Millionen Menschen die DDR verlassen. Die Berliner Mauer und der beinahe hermetisch abgeriegelte Grenzstreifen des „Arbeiter- und Bauernstaates“ sollten die „Republikflucht“ verhindern, die ein Straftatbestand dieser Republik war, die zwar deutsch, sicher aber nicht demokratisch gewesen ist.

Allein in Berlin sind bei Fluchtversuchen mindestens 136 Menschen umgekommen, drei noch im Jahr 1989. Auch an die Mauertoten und an die Schicksale ihrer Familien denken wir heute, wenn wir an die glücklichen Stunden und Tage des Mauerfalls vor 25 Jahren erinnern. Die weißen Kreuze, die nur wenige Meter vom Reichstagsgebäude an der Spree angebracht waren, sollen an sie erinnern. Sie sind vor einigen Tagen gestohlen worden - mit einer „heldenhaften“ Attitüde und einer pseudohumanitären Begründung, die man für blanken Zynismus halten muss.",TOP 29 Vereinbarte Debatte Friedliche Revolution – 25 Jahre nach Mauerfall,1916,chair,18
3,164966,3,64,,,,,,Beifall bei der CDU/CSU und der SPD sowie bei Abgeordneten der LINKEN und des BÜNDNISSES 90/DIE GRÜNEN,TOP 29 Vereinbarte Debatte Friedliche Revolution – 25 Jahre nach Mauerfall,1916,poi,18
4,164967,4,64,Präsident Dr. Norbert Lammert,Dr. Norbert Lammert,norbert-lammert,494.0,,"Wir werden selbstverständlich diese Kreuze ersetzen, und sie werden dort bleiben.",TOP 29 Vereinbarte Debatte Friedliche Revolution – 25 Jahre nach Mauerfall,1916,chair,18
5,164968,5,64,,,,,,Beifall bei der CDU/CSU und der SPD sowie bei Abgeordneten der LINKEN und des BÜNDNISSES 90/DIE GRÜNEN,TOP 29 Vereinbarte Debatte Friedliche Revolution – 25 Jahre nach Mauerfall,1916,poi,18
6,164969,6,64,Präsident Dr. Norbert Lammert,Dr. Norbert Lammert,norbert-lammert,494.0,,"Meine Damen und Herren, liebe Kolleginnen und Kollegen, mit einem Mahnmal an die Mauertoten und all die anderen Opfer der SED-Diktatur zu erinnern, ist der Deutsche Bundestag in diesen Tagen in einem von zahlreichen Bürgerrechtlern, Historikern, ehemaligen Abgeordneten und Künstlern unterzeichneten Aufruf aufgefordert worden, zur - ich zitiere - „Würdigung der Hoffnungen und Anstrengungen all jener, die dem Kommunismus widerstanden haben und ihren Glauben an eine demokratische Zukunft und ein Leben in Freiheit nicht preisgaben“, aber auch - ich zitiere weiter - „zur Ermunterung zum Widerstand gegen Diktatur und die Verletzung von Menschenrechten.“

Meine Damen und Herren, der Mauerfall hat sich in das kollektive Bewusstsein der Deutschen eingeprägt. Er ist weltweit zum Symbol der Überwindung autoritärer Systeme in Mittel- und Osteuropa geworden. Jeder, der dieses Ereignis miterlebt hat, weiß genau, wo er war, als es stattgefunden hat. Uns scheint es daher oft, als hätte Deutschland damals die Welt verändert. 1989 gab es aber vielerorts gigantische Umbrüche mit einer erstaunlichen Parallelität der Ereignisse, die einander bedingten, beförderten oder beeinflussten und erst durch ihr Zusammenwirken die Welt tatsächlich verändert haben. Dreh- und Angelpunkt war dabei die Perestroika-Politik des damaligen Staats- und Parteichefs der Sowjetunion, Michail Gorbatschow.

Ihre Folgen entfalteten im Laufe des Jahres in allen Staaten des Ostblocks eine bemerkenswert ähnliche Wirkung: Bereits im Januar 1989 gab es große Demonstrationen tschechischer Bürgerrechtler auf dem Prager Wenzelsplatz. Anfang Februar 1989 begannen in Warschau die Gespräche am ersten Runden Tisch im damaligen Ostblock, die zu den ersten halbwegs freien Parlamentswahlen in Polen am 4. Juni 1989 führten. Das „Bürgerkomitee“ als politische Plattform der wieder zugelassenen Solidarnosc errang einen überwältigenden Sieg. Am gleichen Tag, dem 4. Juni 1989, schlug das kommunistische Regime in China die studentische Demokratiebewegung mit Panzergewalt auf dem Tiananmen-Platz nieder. Die Volkskammer der DDR verkündete vier Tage später in einer öffentlichen Erklärung in alter Manier ihre Verbundenheit mit der chinesischen Staatsführung, die - Zitat - „infolge der gewaltsamen, blutigen Ausschreitungen verfassungsfeindlicher Elemente“ für Sicherheit und Ordnung habe sorgen müssen. Soweit dies als Einschüchterung oder Drohung in Richtung der Bürgerbewegung in der DDR gemeint war und verstanden wurde, hatte es offensichtlich die gegenteilige Wirkung.

Ungarn machte schon Anfang Mai 1989 den Eisernen Vorhang an seinen Westgrenzen durchlässig und begann mit dem Abbau seiner elektronischen Sicherungsanlagen. Am 10. September folgte die Öffnung der ungarischen Grenzen für die flüchtigen Bürger der DDR: „Ungarn hat den ersten Stein aus der Berliner Mauer geschlagen“ - so Bundeskanzler Helmut Kohl, der dann just in den Stunden des Mauerfalls seinen offiziellen Besuch in Polen abstattete, und diese gerade zitierte Bemerkung bei einer Tischrede beim Abendessen auf Einladung von Tadeusz Mazowiecki machte, des im August gewählten ersten nichtkommunistischen Ministerpräsidenten Polens nach dem Zweiten Weltkrieg.

Auch die baltischen Staaten sind Austragungsorte dieses grandiosen Transformationsprozesses gewesen: Am 23. August, dem 50. Jahrestag des Hitler-Stalin-Paktes, bildeten rund 1 Million Menschen eine mehr als 600 Kilometer lange Menschenkette - von Vilnius in Litauen über Riga in Lettland bis Tallinn in Estland. Sie demonstrierten für nationale Selbstbestimmung und Unabhängigkeit der baltischen Staaten von der Sowjetunion.  Es war der Höhepunkt der bei uns kaum wahrgenommenen „singenden Revolution“. Ihr Markenzeichen waren verbotene Volkslieder. Gegen sie konnte man mit Panzern nicht vorgehen. Gegen Kerzen auch nicht.

In der Tschechoslowakei spitzte sich die Lage im November zu. Am 29. Dezember, zum Abschluss der „samtenen Revolution“, wurde Václav Havel, der zu Beginn des Jahres noch wegen „Rowdytums“ zu einer Gefängnisstrafe verurteilt worden war, zum Staatspräsidenten gewählt. In Bulgarien und Rumänien beseitigten Palastrevolutionen die Regime. Der Drang nach Freiheit und Demokratie war Ende des Jahres so stark, dass keine der kommunistischen Regierungen im damaligen Ostblock mehr fest im Sattel saß oder überhaupt noch im Amte war.

Liebe Kolleginnen und Kollegen, ich glaube, es tut uns gut gerade an dem Wochenende, an dem wir einen unstreitigen Höhepunkt der deutschen Geschichte in besonderer Weise würdigen, uns ins Bewusstsein zu heben, dass nicht nur in Deutschland Anstrengungen unternommen und mit bemerkenswertem Mut bemerkenswerte Veränderungen herbeigeführt worden sind. Manches spricht für die Vermutung: Wenn die damalige Entwicklung nur in Deutschland stattgefunden hätte, hätte sie vermutlich auch in Deutschland so nicht stattgefunden.",TOP 29 Vereinbarte Debatte Friedliche Revolution – 25 Jahre nach Mauerfall,1916,chair,18
7,164970,7,64,,,,,,Beifall im ganzen Hause,TOP 29 Vereinbarte Debatte Friedliche Revolution – 25 Jahre nach Mauerfall,1916,poi,18
8,164971,8,64,Präsident Dr. Norbert Lammert,Dr. Norbert Lammert,norbert-lammert,494.0,,"In der DDR vollzog sich eine durchaus andere, aber im Kontext dieser Entwicklung folgerichtige Veränderung, die - was einem auch mit dem zeitlichen Abstand von 25 Jahren immer noch beinahe wie ein Wunder vorkommen muss - unblutig, ohne Gewaltanwendung und trotzdem oder vielleicht gerade deshalb unwiderstehlich war. Dieses Jahr 1989 hat nicht nur die DDR verändert und schließlich abgeschafft. Es hat Europa in einer Weise verändert, wie es selten in einem einzelnen Jahr in der Geschichte durchgreifende und nachhaltige Veränderungen auf unserem Kontinent gegeben hat. Innerhalb weniger Monate hat sich die politische Landschaft Europas grundlegend neu gestaltet.

Die Ereignisse von 1989 gleichen jeweils für sich betrachtet einem Mosaik. Jedes einzelne Element für sich genommen ist wie eine Kerze, die zwar Licht gibt in der Finsternis, diese aber alleine ganz sicher nicht bezwingen kann. Erst ein Kerzenmeer - so wie in Leipzig - vermag es. Heute sind wir für jedes dieser Lichter und jedes der einzelnen Ereignisse auf den politischen Bühnen wie auf den Straßen Europas dankbar. Sie alle zusammen haben das „legendäre Revolutionsjahr 1989“ bewirkt und dazu beigetragen, das Ende der Teilung Deutschlands und Europas einzuleiten.

Meine Damen und Herren, Eric Hobsbawm, der große britische Historiker, hat das 20. Jahrhundert als „Zeitalter der Extreme“ beschrieben - was es ganz offensichtlich war - und zugleich als das kurze Jahrhundert, das 1914 begonnen habe und 1989 zu Ende gewesen sei. Das ist jedenfalls eine interessante und, wie ich finde, kluge Interpretation. Tatsächlich ist das 19. Jahrhundert, das Zeitalter der rivalisierenden Nationalstaaten, im Ersten Weltkrieg kollabiert. Mit der Überwindung des Eisernen Vorhangs sowie der Etablierung demokratischer, frei gewählter Parlamente und Regierungen überall in Europa hat das 21. Jahrhundert begonnen.

Die friedlichen Revolutionen vor 25 Jahren waren ein Glücksfall der Geschichte. Die Beispiele der allerjüngsten Demokratisierungsbewegungen - auch direkt vor unserer Haustür - zeigen allerdings, dass der glückliche Ausgang einer Freiheitsbewegung keiner Regel folgt, schon gar keinem Terminkalender und der Erfolg nicht sicher ist. Auch der Glaube, dass individuelle Freiheit, nationale Selbstbestimmung und territoriale Integrität jedenfalls in Europa nun unangefochten seien, erweist sich als gut gemeinte Illusion.

Liebe Kolleginnen und Kollegen, meine Damen und Herren, vom südafrikanischen Friedensnobelpreisträger Desmond Tutu stammt ein Satz, der nicht nur die Ereignisse des Jahres 1989, wie ich finde, zusammenfasst, sondern auch für ähnliche Entwicklungen in anderen Ländern seine Gültigkeit behält. Desmond Tutu schreibt:

Nichts, nicht einmal die modernste Waffe, nicht einmal die auf brutalste Weise schlagkräftige Polizei, nein, überhaupt gar nichts wird die Menschen aufhalten können, wenn sie erst einmal entschlossen sind, ihre Freiheit und ihr Menschenrecht zu erringen.",TOP 29 Vereinbarte Debatte Friedliche Revolution – 25 Jahre nach Mauerfall,1916,chair,18
9,164972,9,64,,,,,,Beifall im ganzen Hause,TOP 29 Vereinbarte Debatte Friedliche Revolution – 25 Jahre nach Mauerfall,1916,poi,18
10,164973,10,64,Präsident Dr. Norbert Lammert,Dr. Norbert Lammert,norbert-lammert,494.0,,"Diese Einsicht, meine Damen und Herren, ist eine Ermutigung und eine Verpflichtung zugleich. Beides wollen wir heute bekräftigen.

Vielen Dank.",TOP 29 Vereinbarte Debatte Friedliche Revolution – 25 Jahre nach Mauerfall,1916,chair,18
11,164974,11,64,,,,,,Beifall im ganzen Hause,TOP 29 Vereinbarte Debatte Friedliche Revolution – 25 Jahre nach Mauerfall,1916,poi,18
12,164975,12,64,Präsident Dr. Norbert Lammert,Dr. Norbert Lammert,norbert-lammert,494.0,,,TOP 29 Vereinbarte Debatte Friedliche Revolution – 25 Jahre nach Mauerfall,1916,chair,18
13,164976,13,64,,,,,,Gitarrenvorspiel Wolf Biermann,TOP 29 Vereinbarte Debatte Friedliche Revolution – 25 Jahre nach Mauerfall,1916,poi,18
14,164977,14,64,Präsident Dr. Norbert Lammert,Dr. Norbert Lammert,norbert-lammert,494.0,,"Wolf Biermann:

Herr Lammert, ich freue mich, dass Sie mich hierhergelockt haben. Ich ahne schon, weil ich Sie ja als Ironiker kenne, dass Sie hoffen, dass ich den Linken ein paar Ohrfeigen verpasse.",TOP 29 Vereinbarte Debatte Friedliche Revolution – 25 Jahre nach Mauerfall,1916,chair,18
15,164978,15,64,Volker Kauder [CDU/CSU],Volker Kauder,volker-kauder,515.0,cducsu,Nein!,TOP 29 Vereinbarte Debatte Friedliche Revolution – 25 Jahre nach Mauerfall,1916,poi,18
16,164979,16,64,Präsident Dr. Norbert Lammert,Dr. Norbert Lammert,norbert-lammert,494.0,,Aber das kann ich nicht liefern. Mein Beruf war doch Drachentöter.,TOP 29 Vereinbarte Debatte Friedliche Revolution – 25 Jahre nach Mauerfall,1916,chair,18
17,164980,17,64,Präsident Dr. Norbert Lammert,Dr. Norbert Lammert,norbert-lammert,494.0,,"Ich kann Ihnen, Herr Biermann, mit einem Hinweis auf unsere Geschäftsordnung helfen:",TOP 29 Vereinbarte Debatte Friedliche Revolution – 25 Jahre nach Mauerfall,1916,chair,18
18,164981,18,64,,,,,,Heiterkeit und Beifall im ganzen Hause,TOP 29 Vereinbarte Debatte Friedliche Revolution – 25 Jahre nach Mauerfall,1916,poi,18
19,164982,19,64,Präsident Dr. Norbert Lammert,Dr. Norbert Lammert,norbert-lammert,494.0,,"Sobald Sie für den Deutschen Bundestag kandidieren und gewählt werden, dürfen Sie hier auch reden.",TOP 29 Vereinbarte Debatte Friedliche Revolution – 25 Jahre nach Mauerfall,1916,chair,18
20,164983,20,64,,,,,,Heiterkeit und Beifall im ganzen Hause,TOP 29 Vereinbarte Debatte Friedliche Revolution – 25 Jahre nach Mauerfall,1916,poi,18
21,164984,21,64,Präsident Dr. Norbert Lammert,Dr. Norbert Lammert,norbert-lammert,494.0,,"Heute sind Sie zum Singen eingeladen.

Wolf Biermann:

Ja. Aber natürlich habe ich mir in der DDR das Reden nicht abgewöhnt, und das werde ich hier schon gar nicht tun.",TOP 29 Vereinbarte Debatte Friedliche Revolution – 25 Jahre nach Mauerfall,1916,chair,18
22,164985,22,64,,,,,,Heiterkeit und Beifall im ganzen Hause,TOP 29 Vereinbarte Debatte Friedliche Revolution – 25 Jahre nach Mauerfall,1916,poi,18
23,164986,23,64,Präsident Dr. Norbert Lammert,Dr. Norbert Lammert,norbert-lammert,494.0,,Ein Drachentöter kann nicht mit großer Gebärde die Reste der Drachenbrut tapfer niederschlagen. Die sind geschlagen.,TOP 29 Vereinbarte Debatte Friedliche Revolution – 25 Jahre nach Mauerfall,1916,chair,18
24,164987,24,64,,,,,,"Beifall bei Abgeordneten der CDU/CSU, der SPD und des BÜNDNISSES 90/DIE GRÜNEN",TOP 29 Vereinbarte Debatte Friedliche Revolution – 25 Jahre nach Mauerfall,1916,poi,18
25,164988,25,64,Präsident Dr. Norbert Lammert,Dr. Norbert Lammert,norbert-lammert,494.0,,"Es ist für mich Strafe genug, dass sie hier sitzen müssen, dass sie das anhören müssen.",TOP 29 Vereinbarte Debatte Friedliche Revolution – 25 Jahre nach Mauerfall,1916,chair,18
26,164989,26,64,Dr. Dietmar Bartsch [DIE LINKE],Dr. Dietmar Bartsch,dietmar-bartsch,611.0,linke,Wir wollen!,TOP 29 Vereinbarte Debatte Friedliche Revolution – 25 Jahre nach Mauerfall,1916,poi,18
27,164990,27,64,Präsident Dr. Norbert Lammert,Dr. Norbert Lammert,norbert-lammert,494.0,,- „Wollen“. Ihr wollt immer; das weiß ich ja. Aber ihr könnt nicht.,TOP 29 Vereinbarte Debatte Friedliche Revolution – 25 Jahre nach Mauerfall,1916,chair,18
28,164991,28,64,,,,,,"Heiterkeit und Beifall bei Abgeordneten der CDU/CSU, der SPD und des BÜNDNISSES 90/DIE GRÜNEN",TOP 29 Vereinbarte Debatte Friedliche Revolution – 25 Jahre nach Mauerfall,1916,poi,18
29,164992,29,64,Präsident Dr. Norbert Lammert,Dr. Norbert Lammert,norbert-lammert,494.0,,Aber so neu bin ich nicht in der Welt. Einige Gesichter kenne ich ja. Jeder Einzelne ist ein Roman. Das muss mir keiner breitärschig erklären.,TOP 29 Vereinbarte Debatte Friedliche Revolution – 25 Jahre nach Mauerfall,1916,chair,18
30,164993,30,64,Wolfgang Gehrcke [DIE LINKE],Wolfgang Gehrcke,wolfgang-gehrcke,33.0,linke,Aber selber!,TOP 29 Vereinbarte Debatte Friedliche Revolution – 25 Jahre nach Mauerfall,1916,poi,18
31,164994,31,64,Präsident Dr. Norbert Lammert,Dr. Norbert Lammert,norbert-lammert,494.0,,"Sehr kompliziert. Aber als Gruppe, die ihr ja auch seid, seid ihr eben aus meiner Sicht keine Linken.",TOP 29 Vereinbarte Debatte Friedliche Revolution – 25 Jahre nach Mauerfall,1916,chair,18
32,164995,32,64,Dr. Petra Sitte [DIE LINKE],Dr. Petra Sitte,petra-sitte,319.0,linke,Gewählt!,TOP 29 Vereinbarte Debatte Friedliche Revolution – 25 Jahre nach Mauerfall,1916,poi,18
33,164996,33,64,Präsident Dr. Norbert Lammert,Dr. Norbert Lammert,norbert-lammert,494.0,,"- „Gewählt“. Im Deutschen Bundestag kann man doch nicht erzählen, dass eine Wahl ein Gottesurteil ist, wenn man die deutsche Geschichte kennt. Sei nicht zu clever! - Gefährlich!",TOP 29 Vereinbarte Debatte Friedliche Revolution – 25 Jahre nach Mauerfall,1916,chair,18
34,164997,34,64,Dr. Dietmar Bartsch [DIE LINKE],Dr. Dietmar Bartsch,dietmar-bartsch,611.0,linke,"Wenn man mit dem Zeigefinger auf jemanden zeigt, zeigen drei auf einen zurück!",TOP 29 Vereinbarte Debatte Friedliche Revolution – 25 Jahre nach Mauerfall,1916,poi,18
35,164998,35,64,Präsident Dr. Norbert Lammert,Dr. Norbert Lammert,norbert-lammert,494.0,,"- Weiß ich doch. Eure Sprüche, die habt ihr drauf; ich weiß. Ich habe meine auch drauf. Wir müssen uns gar nichts erzählen. Also, ihr seid dazu verurteilt, das hier zu ertragen.",TOP 29 Vereinbarte Debatte Friedliche Revolution – 25 Jahre nach Mauerfall,1916,chair,18
36,164999,36,64,Dr. Petra Sitte [DIE LINKE],Dr. Petra Sitte,petra-sitte,319.0,linke,Genau!,TOP 29 Vereinbarte Debatte Friedliche Revolution – 25 Jahre nach Mauerfall,1916,poi,18
37,165000,37,64,Präsident Dr. Norbert Lammert,Dr. Norbert Lammert,norbert-lammert,494.0,,"Ich gönne es euch. Ich weiß ja, dass die, die sich Linke nennen, nicht links sind, auch nicht rechts, sondern reaktionär, dass diejenigen, die hier sitzen, der elende Rest dessen sind, was zum Glück überwunden ist.

Ich freue mich, dass ich hier ein Lied singen kann, die Ermutigung.",TOP 29 Vereinbarte Debatte Friedliche Revolution – 25 Jahre nach Mauerfall,1916,chair,18
38,165001,38,64,Zuruf von der LINKEN,von der LINKEN,von-der-linken,,linke,Ein Lied!,TOP 29 Vereinbarte Debatte Friedliche Revolution – 25 Jahre nach Mauerfall,1916,poi,18
39,165002,39,64,Präsident Dr. Norbert Lammert,Dr. Norbert Lammert,norbert-lammert,494.0,,"- Natürlich, ihr wollt lieber zersungen werden. Ich habe euch zersungen mit den Liedern, als ihr noch an der Macht wart.",TOP 29 Vereinbarte Debatte Friedliche Revolution – 25 Jahre nach Mauerfall,1916,chair,18
40,165003,40,64,,,,,,Beifall bei der CDU/CSU sowie bei Abgeordneten der SPD und des BÜNDNISSES 90/DIE GRÜNEN,TOP 29 Vereinbarte Debatte Friedliche Revolution – 25 Jahre nach Mauerfall,1916,poi,18
41,165004,41,64,Präsident Dr. Norbert Lammert,Dr. Norbert Lammert,norbert-lammert,494.0,,"Dieses Lied, das Herr Lammert gerne hören möchte und das ich auch gerne singe, Ermutigung - das sei bei dieser Gelegenheit angemerkt -, war bei denen, die Widerspruch anmeldeten, in verschiedenem Grade - manche sehr feige, manche sehr mutig, manche zu mutig -, wie ein Stück Seelenbrot, das sie gegessen haben. Ich weiß, dass manche, die im Gefängnis saßen, wie mein Freund Pastor Matthias Storck und seine Frau Tine, mit diesem Lied in der Zelle überlebt haben. Ich finde es wunderbar, dass dieses Lied aus den Gefängnissen der DDR heute im Parlament der deutschen Demokratie gesungen werden kann. Ist das nicht toll?",TOP 29 Vereinbarte Debatte Friedliche Revolution – 25 Jahre nach Mauerfall,1916,chair,18
42,165005,42,64,,,,,,"Beifall bei der CDU/CSU, der SPD und dem BÜNDNIS 90/DIE GRÜNEN sowie bei Abgeordneten der LINKEN",TOP 29 Vereinbarte Debatte Friedliche Revolution – 25 Jahre nach Mauerfall,1916,poi,18
43,165006,43,64,Präsident Dr. Norbert Lammert,Dr. Norbert Lammert,norbert-lammert,494.0,,,TOP 29 Vereinbarte Debatte Friedliche Revolution – 25 Jahre nach Mauerfall,1916,chair,18
44,165007,44,64,Liedvortrag Wolf Biermann,Wolf Biermann,wolf-biermann,,,Ermutigung,TOP 29 Vereinbarte Debatte Friedliche Revolution – 25 Jahre nach Mauerfall,1916,poi,18
45,165008,45,64,Präsident Dr. Norbert Lammert,Dr. Norbert Lammert,norbert-lammert,494.0,,,TOP 29 Vereinbarte Debatte Friedliche Revolution – 25 Jahre nach Mauerfall,1916,chair,18
46,165009,46,64,,,,,,Anhaltender Beifall im ganzen Hause,TOP 29 Vereinbarte Debatte Friedliche Revolution – 25 Jahre nach Mauerfall,1916,poi,18
47,165010,47,64,,,,,,Bundesminister Sigmar Gabriel und Bundeskanzlerin Dr. Angela Merkel begeben sich zu Wolf Biermann und beglückwünschen ihn,TOP 29 Vereinbarte Debatte Friedliche Revolution – 25 Jahre nach Mauerfall,1916,poi,18
48,165011,48,64,,,,,,Beifall bei der CDU/CSU und der SPD,TOP 29 Vereinbarte Debatte Friedliche Revolution – 25 Jahre nach Mauerfall,1916,poi,18
49,165012,49,64,Präsident Dr. Norbert Lammert,Dr. Norbert Lammert,norbert-lammert,494.0,,"Das war jetzt nicht Kanzlerwahl mit den üblichen Gratulationscouren am Präsidentenpult.

Lieber Herr Biermann, ich möchte den Dank für diese Ermutigung aus gegebenem Anlass mit einer Gratulation verbinden. Sie feiern heute mit Ihrer Frau Pamela Ihre Silberhochzeit.",TOP 29 Vereinbarte Debatte Friedliche Revolution – 25 Jahre nach Mauerfall,1916,chair,18
50,165013,50,64,,,,,,Beifall,TOP 29 Vereinbarte Debatte Friedliche Revolution – 25 Jahre nach Mauerfall,1916,poi,18
51,165014,51,64,Wolf Biermann,Wolf Biermann,wolf-biermann,,,Ich feiere heute auch den Sieg der Großen Sozialistischen Oktoberrevolution!,TOP 29 Vereinbarte Debatte Friedliche Revolution – 25 Jahre nach Mauerfall,1916,poi,18
52,165015,52,64,,,,,,Heiterkeit bei der CDU/CSU,TOP 29 Vereinbarte Debatte Friedliche Revolution – 25 Jahre nach Mauerfall,1916,poi,18
