,id,profile_url,sequence,sitzung,speaker,speaker_cleaned,speaker_fp,speaker_key,speaker_party,text,top,top_id,type,wahlperiode
583,797163,https://www.abgeordnetenwatch.de/profile/markus-paschke/archive/216644,583,77,Markus Paschke (SPD),Markus Paschke,markus-paschke,1416.0,spd,"möchte ich an dieser Stelle allen Zuhörerinnen und Zuhörern geruhsame und vor allem friedliche Feiertage sowie einen guten Rutsch ins neue Jahr wünschen, damit wir auch 2015 unsere gute Arbeit fortsetzen können.

Danke.",TOP 23 Gute Arbeit und sanktionsfreie Mindestsicherung,14191,speech,18
584,797164,,584,77,,,,,,Beifall bei der SPD sowie bei Abgeordneten der CDU/CSU,TOP 23 Gute Arbeit und sanktionsfreie Mindestsicherung,14191,poi,18
585,797165,https://www.abgeordnetenwatch.de/profile/edelgard-bulmahn,585,77,Vizepräsidentin Edelgard Bulmahn,Edelgard Bulmahn,edelgard-bulmahn,1856.0,,Als nächste Rednerin spricht Christel Voßbeck-Kayser von der CDU/CSU-Fraktion.,TOP 23 Gute Arbeit und sanktionsfreie Mindestsicherung,14191,chair,18
586,797166,,586,77,,,,,,Beifall bei der CDU/CSU,TOP 23 Gute Arbeit und sanktionsfreie Mindestsicherung,14191,poi,18
587,797167,https://www.abgeordnetenwatch.de/profile/christel-vosbeck-kayser-0,587,77,Christel Voßbeck-Kayser (CDU/CSU),Christel Voßbeck-Kayser,christel-voßbeck-kayser,1361.0,cducsu,"Frau Präsidentin! Liebe Kolleginnen und Kollegen! „Alle Jahre wieder“, so lautet der Anfang eines schönen Weihnachtsliedes. Aber bei Ihrer wiederkehrenden Liederplatte, Kollegen und Kolleginnen der Fraktion Die Linke, geht es mir nicht so. Seit 2010 in Ihren Anträgen immer wieder die gleichen Themen: Abschaffung von Sanktionen, Mindestsicherung und Mindesteinkommen.",TOP 23 Gute Arbeit und sanktionsfreie Mindestsicherung,14191,speech,18
588,797168,https://www.abgeordnetenwatch.de/profile/sabine-weiss/archive/214664,588,77,Sabine Weiss [Wesel I] [CDU/CSU],Sabine Weiss,sabine-weiss,1353.0,cducsu,Es wird dadurch nicht besser!,TOP 23 Gute Arbeit und sanktionsfreie Mindestsicherung,14191,poi,18
589,797169,https://www.abgeordnetenwatch.de/profile/christel-vosbeck-kayser-0,589,77,Christel Voßbeck-Kayser (CDU/CSU),Christel Voßbeck-Kayser,christel-voßbeck-kayser,1361.0,cducsu,"Der Antrag, der uns heute vorliegt, trägt die Überschrift „Gute Arbeit und eine sanktionsfreie Mindestsicherung statt Hartz IV“.",TOP 23 Gute Arbeit und sanktionsfreie Mindestsicherung,14191,speech,18
590,797170,,590,77,,,,,,Beifall bei Abgeordneten der LINKEN,TOP 23 Gute Arbeit und sanktionsfreie Mindestsicherung,14191,poi,18
591,797171,https://www.abgeordnetenwatch.de/profile/christel-vosbeck-kayser-0,591,77,Christel Voßbeck-Kayser (CDU/CSU),Christel Voßbeck-Kayser,christel-voßbeck-kayser,1361.0,cducsu,Was bedeutet „sanktionsfreie Mindestsicherung“?,TOP 23 Gute Arbeit und sanktionsfreie Mindestsicherung,14191,speech,18
592,797172,https://www.abgeordnetenwatch.de/profile/kai-whittaker/archive/214866,592,77,Kai Whittaker [CDU/CSU],Kai Whittaker,kai-whittaker,1313.0,cducsu,"Nur der Titel ändert sich, der Inhalt bleibt gleich!",TOP 23 Gute Arbeit und sanktionsfreie Mindestsicherung,14191,poi,18
593,797173,https://www.abgeordnetenwatch.de/profile/christel-vosbeck-kayser-0,593,77,Christel Voßbeck-Kayser (CDU/CSU),Christel Voßbeck-Kayser,christel-voßbeck-kayser,1361.0,cducsu,"Ohne Wenn und Aber, ohne Bedingungen, egal wie man sich verhält: Man soll auf jeden Fall Geld vom Staat bekommen. Ich kann nur sagen: schön märchenhaft - mehr nicht.",TOP 23 Gute Arbeit und sanktionsfreie Mindestsicherung,14191,speech,18
594,797174,,594,77,,,,,,Beifall bei der CDU/CSU,TOP 23 Gute Arbeit und sanktionsfreie Mindestsicherung,14191,poi,18
595,797175,https://www.abgeordnetenwatch.de/profile/dr-kirsten-tackmann-0,595,77,Dr. Kirsten Tackmann [DIE LINKE],Dr. Kirsten Tackmann,kirsten-tackmann,1829.0,linke,So wie viele Unternehmer!,TOP 23 Gute Arbeit und sanktionsfreie Mindestsicherung,14191,poi,18
596,797176,https://www.abgeordnetenwatch.de/profile/christel-vosbeck-kayser-0,596,77,Christel Voßbeck-Kayser (CDU/CSU),Christel Voßbeck-Kayser,christel-voßbeck-kayser,1361.0,cducsu,"Auch wenn Sie diesen Antrag jedes Jahr wiederholen, so ändert sich unsere Position nicht und wird sich auch nicht ändern; denn wir halten das Prinzip des Forderns und Förderns für ein geeignetes Instrument. Dieses Prinzip spiegelt die Realität der Arbeitswelt wider. Warum sollen Menschen, die vorübergehend nicht in der Arbeitswelt sind, sich diesem Prinzip entziehen? In jedem Beruf wird man gefordert und gefördert.",TOP 23 Gute Arbeit und sanktionsfreie Mindestsicherung,14191,speech,18
597,797177,https://www.abgeordnetenwatch.de/profile/dr-kirsten-tackmann-0,597,77,Dr. Kirsten Tackmann [DIE LINKE],Dr. Kirsten Tackmann,kirsten-tackmann,1829.0,linke,Dann fördern Sie doch einmal!,TOP 23 Gute Arbeit und sanktionsfreie Mindestsicherung,14191,poi,18
598,797178,https://www.abgeordnetenwatch.de/profile/christel-vosbeck-kayser-0,598,77,Christel Voßbeck-Kayser (CDU/CSU),Christel Voßbeck-Kayser,christel-voßbeck-kayser,1361.0,cducsu,"Warum soll dieses gesellschaftlich anerkannte Prinzip für Menschen im Rahmen des Bezuges von SGB-II-Leistungen nun nicht mehr gelten? Abgesehen davon - das haben meine Vorredner schon gesagt -: Hat die Solidargemeinschaft nicht ein Recht darauf, dass die Menschen, die der Hilfe bedürfen und Geld von und aus der Solidargemeinschaft erhalten, aktiv einen Beitrag leisten, so wie sie es können?",TOP 23 Gute Arbeit und sanktionsfreie Mindestsicherung,14191,speech,18
599,797179,,599,77,,,,,,Beifall bei der CDU/CSU,TOP 23 Gute Arbeit und sanktionsfreie Mindestsicherung,14191,poi,18
600,797180,https://www.abgeordnetenwatch.de/profile/christel-vosbeck-kayser-0,600,77,Christel Voßbeck-Kayser (CDU/CSU),Christel Voßbeck-Kayser,christel-voßbeck-kayser,1361.0,cducsu,"Wir reden hier schließlich von Geld, das Menschen für Menschen, die Unterstützung benötigen, erst einmal erwirtschaften müssen.

Zum anderen reden wir hier nicht von unmöglichen Regeln. Es geht darum, sich an Verabredungen zu halten, Termine einzuhalten. Inzwischen werden sogar, wie wir wissen, Erinnerungs-SMS versendet. Also, mich hat morgens noch nie jemand daran erinnert, dass ich zur Arbeit gehen soll.",TOP 23 Gute Arbeit und sanktionsfreie Mindestsicherung,14191,speech,18
601,797181,,601,77,,,,,,Beifall bei der CDU/CSU,TOP 23 Gute Arbeit und sanktionsfreie Mindestsicherung,14191,poi,18
602,797182,https://www.abgeordnetenwatch.de/profile/christel-vosbeck-kayser-0,602,77,Christel Voßbeck-Kayser (CDU/CSU),Christel Voßbeck-Kayser,christel-voßbeck-kayser,1361.0,cducsu,Den Mitarbeitern in den Jobcentern steht ein großes Repertoire an verschiedenen Instrumenten zur Verfügung. Die Mitarbeiter in den Jobcentern setzen diese auch verantwortungsvoll ein.,TOP 23 Gute Arbeit und sanktionsfreie Mindestsicherung,14191,speech,18
603,797183,,603,77,,,,,,Zuruf von der LINKEN,TOP 23 Gute Arbeit und sanktionsfreie Mindestsicherung,14191,poi,18
604,797184,https://www.abgeordnetenwatch.de/profile/christel-vosbeck-kayser-0,604,77,Christel Voßbeck-Kayser (CDU/CSU),Christel Voßbeck-Kayser,christel-voßbeck-kayser,1361.0,cducsu,Kurz zum Thema Sanktionen. Wir haben die aktuellen Zahlen aus dem Jahr 2013 gehört. 3 Prozent der Leistungsbezieher im SGB II sind überhaupt von Sanktionen betroffen. Das heißt im Umkehrschluss: 97 Prozent der Leistungsbezieher sind nicht betroffen.,TOP 23 Gute Arbeit und sanktionsfreie Mindestsicherung,14191,speech,18
605,797185,https://www.abgeordnetenwatch.de/profile/katja-kipping/archive/215539,605,77,Katja Kipping [DIE LINKE],Katja Kipping,katja-kipping,1883.0,linke,Sie leiden unter der Androhung!,TOP 23 Gute Arbeit und sanktionsfreie Mindestsicherung,14191,poi,18
606,797186,https://www.abgeordnetenwatch.de/profile/christel-vosbeck-kayser-0,606,77,Christel Voßbeck-Kayser (CDU/CSU),Christel Voßbeck-Kayser,christel-voßbeck-kayser,1361.0,cducsu,Sie stellen diese Sanktionen als Massenphänomen dar; Sie wollen die Menschen dies glauben machen.,TOP 23 Gute Arbeit und sanktionsfreie Mindestsicherung,14191,speech,18
607,797187,,607,77,,,,,,Beifall bei der CDU/CSU,TOP 23 Gute Arbeit und sanktionsfreie Mindestsicherung,14191,poi,18
608,797188,https://www.abgeordnetenwatch.de/profile/christel-vosbeck-kayser-0,608,77,Christel Voßbeck-Kayser (CDU/CSU),Christel Voßbeck-Kayser,christel-voßbeck-kayser,1361.0,cducsu,"Ihr Lied mit der Forderung nach einer bedingungslosen Grundsicherung - das Sie auch noch soziale Gerechtigkeit nennen - hat in dieser Form gar nichts mit dem Prinzip der sozialen Marktwirtschaft, an der sich unsere Wirtschafts- und Gesellschaftsordnung erfolgreich orientiert, zu tun. Wohlstand per Gesetz gibt es nicht. Wohlstand wird, flankiert von entsprechenden gesetzlichen Rahmenbedingungen, erarbeitet. Das war immer so, und das wird auch immer so bleiben.",TOP 23 Gute Arbeit und sanktionsfreie Mindestsicherung,14191,speech,18
609,797189,,609,77,,,,,,Beifall bei der CDU/CSU,TOP 23 Gute Arbeit und sanktionsfreie Mindestsicherung,14191,poi,18
610,797190,https://www.abgeordnetenwatch.de/profile/christel-vosbeck-kayser-0,610,77,Christel Voßbeck-Kayser (CDU/CSU),Christel Voßbeck-Kayser,christel-voßbeck-kayser,1361.0,cducsu,"Auch wenn bald Weihnachten ist und Sie meinen, Kolleginnen und Kollegen der Fraktion Die Linke, das Märchen vom Sterntaler erzählen zu müssen - Sie wissen, das arme Mädchen, das die Schürze aufhält, in die die goldenen Taler hineinfallen -: Das glauben ja nicht einmal Ihre eigenen Kollegen, wie wir in den letzten Tagen in den Medien lesen konnten. Viele aus Ihrer Partei glauben nicht an Ihr Märchen vom bedingungslosen Grundeinkommen, weil es nicht bezahlbar ist.",TOP 23 Gute Arbeit und sanktionsfreie Mindestsicherung,14191,speech,18
611,797191,,611,77,,,,,,Beifall des Abg. Dr. Matthias Zimmer [CDU/CSU],TOP 23 Gute Arbeit und sanktionsfreie Mindestsicherung,14191,poi,18
612,797192,,612,77,Matthias W. Birkwald [DIE LINKE],Matthias W. Birkwald,matthias-birkwald,,linke,"Das steht in dem Antrag auch nicht drin, Frau Kollegin!",TOP 23 Gute Arbeit und sanktionsfreie Mindestsicherung,14191,poi,18
613,797193,,613,77,Weiterer Zuruf von der LINKEN,von der LINKEN,von-der-linken,,linke,"Sie wissen, ehrlich gesagt, gar nicht, was das ist!",TOP 23 Gute Arbeit und sanktionsfreie Mindestsicherung,14191,poi,18
614,797194,https://www.abgeordnetenwatch.de/profile/christel-vosbeck-kayser-0,614,77,Christel Voßbeck-Kayser (CDU/CSU),Christel Voßbeck-Kayser,christel-voßbeck-kayser,1361.0,cducsu,"Deshalb mein Vorschlag zum Ende: Bringen Sie sich doch mal im neuen Jahr mit einer neuen Platte zu den Themen „SGB-II-Leistungen“ und „arbeitsmarktpolitische Maßnahmen“ konstruktiv in unsere gemeinsame Arbeit ein!

Den Rest meiner Redezeit schenke ich dem Deutschen Bundestag. Ich wünsche uns allen schöne Weihnachten.",TOP 23 Gute Arbeit und sanktionsfreie Mindestsicherung,14191,speech,18
615,797195,,615,77,,,,,,Beifall bei der CDU/CSU und der SPD,TOP 23 Gute Arbeit und sanktionsfreie Mindestsicherung,14191,poi,18
616,797196,https://www.abgeordnetenwatch.de/profile/edelgard-bulmahn,616,77,Vizepräsidentin Edelgard Bulmahn,Edelgard Bulmahn,edelgard-bulmahn,1856.0,,Vielen Dank. - Als letzter Redner in dieser Debatte spricht jetzt Ewald Schurer von der SPD.,TOP 23 Gute Arbeit und sanktionsfreie Mindestsicherung,14191,chair,18
617,797197,,617,77,,,,,,Beifall bei der SPD,TOP 23 Gute Arbeit und sanktionsfreie Mindestsicherung,14191,poi,18
618,797198,https://www.abgeordnetenwatch.de/profile/ewald-schurer/archive/216940,618,77,Ewald Schurer (SPD),Ewald Schurer,ewald-schurer,1658.0,spd,"Frau Präsidentin! Werte Kolleginnen und Kollegen! Wenn wir heute diese Debatte führen - es ist kein Fehler, kurz vor Weihnachten inhaltlich über den Arbeitsmarkt zu reden -, dann muss man konstatieren: Wir hatten vor einem Jahrzehnt in der Tat größere Probleme am Arbeitsmarkt. Damals traf der Begriff „Massenarbeitslosigkeit“ eher zu, da sich die Situation dramatisch dargestellt hat. Ich konstatiere auch: Der Druck, eine Arbeitsmarktreform durchzuführen, war damals in der Tat groß. Wie auch immer Sie es bewerten: Der Deutsche Gewerkschaftsbund bzw. das Wirtschafts- und Sozialwissenschaftliche Institut der Hans-Böckler-Stiftung hat damals festgestellt, dass durch die Sozialhilfeintegration fast 800 000 Menschen im Vergleich zu vorher bessergestellt worden sind und überhaupt erst wahrgenommen wurden, was den Arbeitsmarktbereich und die Integration in die Gesellschaft anbelangt.",TOP 23 Gute Arbeit und sanktionsfreie Mindestsicherung,14191,speech,18
619,797199,,619,77,,,,,,Beifall bei der SPD,TOP 23 Gute Arbeit und sanktionsfreie Mindestsicherung,14191,poi,18
620,797200,https://www.abgeordnetenwatch.de/profile/ewald-schurer/archive/216940,620,77,Ewald Schurer (SPD),Ewald Schurer,ewald-schurer,1658.0,spd,"Es gab in der Tat auch Verwerfungen durch diese Reform. Ich gebe ganz ehrlich zu: Ich glaube, die Reform ist damals mit heißer Nadel gestrickt worden. Der Chefingenieur, Peter Hartz, hat Jahre später selbst gesagt, dass er nicht nur handwerkliche Fehler sieht, sondern auch strukturelle Fehler; er hat es offen zugegeben. Er wünschte sich, dass bei der Dualität aus Fördern und Fordern der Aspekt des Förderns stärker berücksichtigt wird. Diese Verwerfungen möchte ich hier ganz offen konstatieren.

Dennoch: Die Reform war unter den damaligen gesellschaftlichen Umständen notwendig; das Übrige habe ich dazu gesagt.

Man darf aber auch, werte Freundinnen und Freunde auch der Linken, nicht vergessen: Der Arbeitsmarkt ist in den letzten zehn Jahren nicht nur von der Hartz-IV-Reform geprägt gewesen - von ihren guten und vielleicht auch verbesserungswürdigen Tatbeständen -, sondern es gab auch massive strukturelle und inhaltliche Veränderungen. Menschen mit niedriger Qualifikation, denen die Bildungsvoraussetzungen fehlen, tun sich heute in einer Wirtschaft, die ständig nach mehr Qualifikationen, nach mehr beruflicher Bildung verlangt, signifikant schwerer, mitzuhalten. Deswegen sind Fördermaßnahmen aller Art auf dem jeweiligen Qualifikationsniveau für die Menschen von größter Bedeutung.",TOP 23 Gute Arbeit und sanktionsfreie Mindestsicherung,14191,speech,18
621,797201,,621,77,,,,,,Beifall bei Abgeordneten der SPD,TOP 23 Gute Arbeit und sanktionsfreie Mindestsicherung,14191,poi,18
622,797202,https://www.abgeordnetenwatch.de/profile/ewald-schurer/archive/216940,622,77,Ewald Schurer (SPD),Ewald Schurer,ewald-schurer,1658.0,spd,"Wir machen da jetzt etwas, auch wenn es - das gebe ich gerne zu - nur Modellbausteine sind, einmal mit 30 000, einmal mit 10 000 Menschen. Das ist der richtige Weg.

Man darf auch nicht vergessen, dass wir, nachdem es unter der damaligen Sozialministerin - ich will hier höflich sein - einen relativen Kahlschlag im Bereich der Jobcenter gab, gemeinsam mit der CDU/CSU versuchen, die Ausstattung der Jobcenter mit Mitteln in Höhe von viermal 350 Millionen Euro, sprich 1,4 Milliarden Euro - ich sage das auch als Haushälter für den Bereich Arbeit und Soziales -, deutlich zu verbessern.",TOP 23 Gute Arbeit und sanktionsfreie Mindestsicherung,14191,speech,18
623,797203,,623,77,,,,,,Beifall bei der SPD,TOP 23 Gute Arbeit und sanktionsfreie Mindestsicherung,14191,poi,18
624,797204,https://www.abgeordnetenwatch.de/profile/ewald-schurer/archive/216940,624,77,Ewald Schurer (SPD),Ewald Schurer,ewald-schurer,1658.0,spd,"Das reicht noch nicht; aber wir sind da in struktureller Hinsicht auf dem richtigen Wege.

Ich will es in diesem letzten Debattenbeitrag auf den Punkt bringen: Wir brauchen jetzt ohne Wenn und Aber - das hat Peter Hartz selbst moniert - klare Konturen im Werkvertragswesen und im Leihvertragswesen. Die Ministerin - da bin ich ihr dankbar; die Staatssekretärin hört es sicherlich mit Überzeugung - hat angekündigt, dass die SPD und die Union im Jahr 2015 beim Kampf gegen den Missbrauch und das Ausfluten im Werkvertragswesen klare Konturen schaffen wollen,",TOP 23 Gute Arbeit und sanktionsfreie Mindestsicherung,14191,speech,18
625,797205,https://www.abgeordnetenwatch.de/profile/beate-muller-gemmeke-0,625,77,Beate Müller-Gemmeke [BÜNDNIS 90/DIE GRÜNEN],Beate Müller-Gemmeke,beate-muller-gemmeke,1634.0,gruene,Das ist doch auf 2016 verschoben!,TOP 23 Gute Arbeit und sanktionsfreie Mindestsicherung,14191,poi,18
626,797206,https://www.abgeordnetenwatch.de/profile/ewald-schurer/archive/216940,626,77,Ewald Schurer (SPD),Ewald Schurer,ewald-schurer,1658.0,spd,um den ursprünglichen Charakter der Werkverträge wiederherzustellen; denn Werkverträge sind nicht für Massenbeschäftigung gedacht.,TOP 23 Gute Arbeit und sanktionsfreie Mindestsicherung,14191,speech,18
627,797207,,627,77,,,,,,Beifall bei der SPD sowie des Abg. Heinz Wiese [Ehingen] [CDU/CSU],TOP 23 Gute Arbeit und sanktionsfreie Mindestsicherung,14191,poi,18
628,797208,https://www.abgeordnetenwatch.de/profile/ewald-schurer/archive/216940,628,77,Ewald Schurer (SPD),Ewald Schurer,ewald-schurer,1658.0,spd,"Was die Leiharbeit angeht, hat Peter Hartz damals deutlich beschrieben, dass die Öffnung zu Beliebigkeit am Arbeitsmarkt geführt hat und kontraproduktiv war. Es hat den Menschen in der Tat nicht geholfen. Wir brauchen auch bei der Leiharbeit künftig klare Konturen.",TOP 23 Gute Arbeit und sanktionsfreie Mindestsicherung,14191,speech,18
629,797209,,629,77,,,,,,Beifall bei Abgeordneten der SPD,TOP 23 Gute Arbeit und sanktionsfreie Mindestsicherung,14191,poi,18
630,797210,https://www.abgeordnetenwatch.de/profile/ewald-schurer/archive/216940,630,77,Ewald Schurer (SPD),Ewald Schurer,ewald-schurer,1658.0,spd,"Die Auswirkungen der Einführung des Mindestlohns - davon bin ich fest überzeugt - werden von den Linken aus rein rhetorischen und strategischen Gründen eindeutig unterschätzt. Schauen Sie sich mal an, mit welch einer Unvernunft ein Teil der Wirtschaft bzw. der Unternehmen heute schon, vor dem 1. Januar 2015, versucht, den Mindestlohn zu unterlaufen. Mir war immer klar: Ein Mindestlohn in Höhe von zunächst einmal 8,50 Euro wird nicht automatisch in allen Kreisen der Wirtschaft Gefallen finden, vor allen Dingen bei denen, die ihn inhaltlich und intellektuell nicht verstanden haben.

Mir geht es letzten Endes darum, klarzumachen: Es gehört zur Würde aller Menschen, dass sie von ihrer Arbeit - zumindest in der Regel - auch leben können. Das ist auch eine Voraussetzung für die Integration in unsere Gesellschaft. Dass wir diese Philosophie gemeinsam mit den Freunden der Union durchsetzen, das ist schon ein Paradigmenwechsel in unserer Gesellschaft,",TOP 23 Gute Arbeit und sanktionsfreie Mindestsicherung,14191,speech,18
631,797211,,631,77,,,,,,Beifall bei der SPD,TOP 23 Gute Arbeit und sanktionsfreie Mindestsicherung,14191,poi,18
632,797212,https://www.abgeordnetenwatch.de/profile/ewald-schurer/archive/216940,632,77,Ewald Schurer (SPD),Ewald Schurer,ewald-schurer,1658.0,spd,"der in Zukunft noch ausgebaut werden muss.

Als Haushälter habe ich zusammen mit dem Kollegen Axel Fischer dafür gesorgt, dass die Mindestlohnkommission von einer Geschäftsstelle unterstützt wird. Auf der Grundlage der Arbeit von Wissenschaftlern ist die Mindestlohnkommission in der Lage, alle Folgeentwicklungen zu evaluieren: Wie wirkt sich der Mindestlohn auf Tarifverträge aus? Wie kann sichergestellt werden, dass der Mindestlohn nicht unterlaufen werden kann? Wie wird sich der Mindestlohn auf die Steuereinnahmen und die Sozialsysteme auswirken? Eine Evaluierung dieser Themen ist eine enorm wichtige Aufgabe.

Es geht darum, dass der Mindestlohn nicht statisch ist, Frau Präsidentin, sondern sich mit der Dynamik in unserer Gesellschaft entwickelt. Nur so können die Menschen von ihrer Arbeit auch wirklich leben. Das zu erreichen, wäre, zusammen mit der Begrenzung des Missbrauchs von Werkverträgen und Leiharbeit, das größte Ziel. Dann würde es wieder möglich, die Menschen in unsere Gesellschaft zu integrieren, und zwar durch gute Arbeit, was das Thema der heutigen Debatte war.

Herzlichen Dank.",TOP 23 Gute Arbeit und sanktionsfreie Mindestsicherung,14191,speech,18
633,797213,,633,77,,,,,,Beifall bei der SPD und der CDU/CSU,TOP 23 Gute Arbeit und sanktionsfreie Mindestsicherung,14191,poi,18
634,797214,https://www.abgeordnetenwatch.de/profile/edelgard-bulmahn,634,77,Vizepräsidentin Edelgard Bulmahn,Edelgard Bulmahn,edelgard-bulmahn,1856.0,,"Wie Sie sehen, ist die Geduld der Präsidentin auch nicht statisch, sondern dynamisch. Das war schon eine kleine Geduldsprobe, lieber Kollege.",TOP 23 Gute Arbeit und sanktionsfreie Mindestsicherung,14191,chair,18
635,797215,https://www.abgeordnetenwatch.de/profile/ewald-schurer/archive/216940,635,77,Ewald Schurer [SPD],Ewald Schurer,ewald-schurer,1658.0,spd,Ich danke Ihnen!,TOP 23 Gute Arbeit und sanktionsfreie Mindestsicherung,14191,poi,18
636,797216,,636,77,,,,,,Heiterkeit bei Abgeordneten der SPD und der CDU/CSU,TOP 23 Gute Arbeit und sanktionsfreie Mindestsicherung,14191,poi,18
637,797217,https://www.abgeordnetenwatch.de/profile/edelgard-bulmahn,637,77,Vizepräsidentin Edelgard Bulmahn,Edelgard Bulmahn,edelgard-bulmahn,1856.0,,"Aber da es im Sinne der Debatte ist, einen Gedanken vollständig auszuführen, habe ich es zugelassen, dass sie ein bisschen länger reden.

Ich schließe die Aussprache.

Interfraktionell wird die Überweisung der Vorlage auf Drucksache 18/3549 an die in der Tagesordnung aufgeführten Ausschüsse vorgeschlagen. Sind Sie damit einverstanden? - Das ist der Fall. Dann ist die Überweisung so beschlossen.

Ich rufe die Tagesordnungspunkte 24 a und 24 b auf:

a)	Beratung des Antrags der Fraktionen der CDU/CSU und SPD

Regionale Wirtschaftspolitik - Die richtigen Weichen für die Zukunft stellen

Drucksache 18/3404

Überweisungsvorschlag:

Ausschuss für Wirtschaft und Energie (f)

Innenausschuss

Finanzausschuss

Ausschuss für Ernährung und Landwirtschaft

Ausschuss für Verkehr und digitale Infrastruktur

Ausschuss für Umwelt, Naturschutz, Bau und Reaktorsicherheit

Ausschuss für Tourismus

Ausschuss für die Angelegenheiten der Europäischen Union

Ausschuss Digitale Agenda

Haushaltsausschuss

b)	Beratung der Unterrichtung durch die Bundesregierung

Koordinierungsrahmen der Gemeinschaftsaufgabe „Verbesserung der regionalen Wirtschaftsstruktur“ ab 1. Juli 2014

Drucksache 18/2200

Überweisungsvorschlag:

Ausschuss für Wirtschaft und Energie (f)

Ausschuss für Ernährung und Landwirtschaft

Ausschuss für Tourismus

Ausschuss für die Angelegenheiten der Europäischen Union

Haushaltsauschuss

Nach einer interfraktionellen Vereinbarung, liebe Kolleginnen und Kollegen, sind für die Aussprache 25 Minuten vorgesehen. - Ich höre dazu keinen Widerspruch. Dann ist das auch so beschlossen.

Wenn die Kolleginnen und Kollegen sich jetzt gesetzt haben, kann ich die Aussprache eröffnen, und wir können die Debatte beginnen.

Als erste Rednerin in der Debatte erhält Andrea Wicklein von der SPD das Wort.",TOP 23 Gute Arbeit und sanktionsfreie Mindestsicherung,14191,chair,18
638,797218,,638,77,,,,,,Beifall bei der SPD sowie bei Abgeordneten der CDU/CSU,TOP 23 Gute Arbeit und sanktionsfreie Mindestsicherung,14191,poi,18
639,797219,https://www.abgeordnetenwatch.de/profile/andrea-wicklein,639,77,Andrea Wicklein (SPD),Andrea Wicklein,andrea-wicklein,1618.0,spd,"Sehr geehrte Frau Präsidentin! Liebe Kolleginnen und Kollegen! Heute beraten wir den Antrag der Fraktionen der CDU/CSU und SPD „Regionale Wirtschaftspolitik - Die richtigen Weichen für die Zukunft stellen“. Kern der regionalen Wirtschaftspolitik ist die Gemeinschaftsaufgabe „Verbesserung der regionalen Wirtschaftsstruktur“, GRW, zur Unterstützung strukturschwacher Regionen. Wir, die Koalitionsfraktionen, bekennen uns mit unserem Antrag zu diesem bewährten Förderinstrument.

Die GRW ist eine Erfolgsgeschichte. Allein zwischen 1991 und 2013 wurden mit 45 Milliarden Euro GRW-Mitteln Investitionen der gewerblichen Wirtschaft in Höhe von sage und schreibe 239 Milliarden Euro ausgelöst. Dadurch wurden 1,2 Millionen Arbeitsplätze geschaffen sowie über 2,3 Millionen Arbeitsplätze gesichert.",TOP 24 Regionale Wirtschaftspolitik,14192,speech,18
640,797220,,640,77,,,,,,Beifall bei der SPD und der CDU/CSU,TOP 24 Regionale Wirtschaftspolitik,14192,poi,18
641,797221,https://www.abgeordnetenwatch.de/profile/andrea-wicklein,641,77,Andrea Wicklein (SPD),Andrea Wicklein,andrea-wicklein,1618.0,spd,"Diese Bilanz zeigt: Ohne die GRW hätten viele Investitionen nicht stattgefunden, hätten sich viele Regionen in unserem Land nicht so gut entwickeln können. Die GRW ist deshalb ein Stück gelebter Solidarität zwischen dem Bund und den Ländern. Darauf können wir mit Recht stolz sein.",TOP 24 Regionale Wirtschaftspolitik,14192,speech,18
642,797222,,642,77,,,,,,Beifall bei der SPD und der CDU/CSU,TOP 24 Regionale Wirtschaftspolitik,14192,poi,18
