,id,sequence,sitzung,speaker,speaker_cleaned,speaker_fp,speaker_key,speaker_party,text,top,top_id,type,wahlperiode
421,322121,421,118,Ralph Brinkhaus (CDU/CSU),Ralph Brinkhaus,ralph-brinkhaus,266.0,cducsu,"wenn es denn umgesetzt wird. Da haben wir natürlich Zweifel: Wird es denn umgesetzt? Ist die Regierung in Griechenland so stabil, dass sie die Mehrheit hat, dass sie auch den Willen hat, das Ganze umzusetzen, wenn es unterschrieben ist und wenn die erste Tranche geflossen ist? Die Bundesregierung hat hier Folgendes gesagt: Leistung nur gegen Gegenleistung. Deswegen ist es auch so wichtig, dass, bevor die erste Tranche gezahlt wird - der Kollege Spinrath hat darauf hingewiesen, über 50 Maßnahmen sind im Rahmen der Prior Actions vom griechischen Parlament schon umgesetzt worden; noch nicht in der Praxis, auch das gehört zur Wahrheit -, das Prinzip „Leistung gegen Gegenleistung“ als essenzieller Bestandteil dieses Paketes sichergestellt ist.

Liebe Kolleginnen und Kollegen von den Grünen, wir lassen uns gerne von Ihnen beschimpfen, wenn wir sagen: Wir haben an dieser Stelle zu hart verhandelt. Ich glaube, das ist wichtig, damit dieses Paket erfolgreich ist.",TOP 1 Regierungserklärung Stabilitätshilfe für Griechenland,2291,speech,18
422,322122,422,118,Dr. Anton Hofreiter [BÜNDNIS 90/DIE GRÜNEN],Dr. Anton Hofreiter,anton-hofreiter,533.0,gruene,"Es geht darum, sinnvoll zu verhandeln und zu sinnvollen Ergebnissen zu kommen!",TOP 1 Regierungserklärung Stabilitätshilfe für Griechenland,2291,poi,18
423,322123,423,118,Ralph Brinkhaus (CDU/CSU),Ralph Brinkhaus,ralph-brinkhaus,266.0,cducsu,"Insofern ist es auch uns zu verdanken, dass es so ist, wie es ist.

Trotzdem, meine Damen und Herren, bleiben immer noch Restzweifel: Wird das Ganze Erfolg haben, oder wird es keinen Erfolg haben? Diesen Restzweifel kann ich Ihnen nicht nehmen. Auch ich weiß nicht, was im Herbst passiert. Ich weiß nicht, ob wir hier irgendwann wieder stehen und sagen, wir brauchen ein viertes Paket, ob der IWF sagt, dass es soundso nicht geht, oder ob eine griechische Regierung eine Reform doch nicht umsetzt. Das kann ich Ihnen nicht sagen. Es ist ein langsamer, mühsamer Prozess. Wir haben in der Politik immer gerne die Schwarz-Weiß-Lösung, bei der man sagt: Jetzt machen wir etwas, und das funktioniert. Aber das wird auf europäischer Ebene nie funktionieren. Deswegen ist es ein mühsamer Prozess, der vor uns steht. Aber ich glaube, dass es sich am Ende des Tages lohnt, sich auf diesen Prozess einzulassen und unsere Kraft in diesen Prozess zu investieren.",TOP 1 Regierungserklärung Stabilitätshilfe für Griechenland,2291,speech,18
424,322124,424,118,,,,,,Beifall bei der CDU/CSU sowie bei Abgeordneten der SPD,TOP 1 Regierungserklärung Stabilitätshilfe für Griechenland,2291,poi,18
425,322125,425,118,Ralph Brinkhaus (CDU/CSU),Ralph Brinkhaus,ralph-brinkhaus,266.0,cducsu,"Wir müssen an dieser Stelle vielleicht aber auch etwas selbstkritisch zurückblicken, und zwar insofern, dass es nicht von ungefähr gekommen ist, dass man im Januar in Griechenland eine Regierung gewählt hat, die nach unseren Maßstäben absurd war und damals auch absurd gehandelt hat. Wir müssen selbstkritisch eines sehen: Man kann den Menschen in einem Land nicht nur sagen: „Ihr müsst fünf Jahre lang reformieren!“. Es war zwar total richtig, Reformen einzufordern, weil Griechenland von einem ganz schlimmen Ausgangspunkt kam. Aber die Menschen in Griechenland, die im Übrigen nie das Gefühl hatten, dass sie dort ein falsches Leben gelebt hätten oder alles nicht richtig gewesen wäre, sahen zu Beginn dieser fünf Jahre kein Licht am Ende des Tunnels; sie sahen nicht, dass sich irgendetwas verbessert. Man muss auch irgendwie dafür sorgen, dass es kurzfristige Erfolge gibt. Deswegen ist es wichtig - Kollege Oppermann hat es angesprochen -, dass in diesem Paket auch Aussagen zu Mindestlöhnen und zur sozialen Stabilität getroffen werden. Wir müssen bei allen Paketen, die wir zukünftig auf den Weg bringen, mehr daran denken; denn wir dürfen die Menschen in dem Land, in dem die Reformen stattfinden, nicht verlieren.",TOP 1 Regierungserklärung Stabilitätshilfe für Griechenland,2291,speech,18
426,322126,426,118,,,,,,Beifall bei der CDU/CSU sowie bei Abgeordneten der SPD,TOP 1 Regierungserklärung Stabilitätshilfe für Griechenland,2291,poi,18
427,322127,427,118,Ralph Brinkhaus (CDU/CSU),Ralph Brinkhaus,ralph-brinkhaus,266.0,cducsu,"Wenn ich die ganze Sache zusammenfasse, dann sage ich flapsig - erste Bemerkung -: Griechenland bleibt so oder so auf unserem Deckel. Zweite Bemerkung: Dieses Reformpaket ist gut angelegt, auch angesichts der Tatsache, dass wir Griechenland Zeit geben. Dass die Gläubiger das Land nicht angreifen können oder nichts gegen das Land machen können, ist richtig. Wenn das Paket denn vernünftig umgesetzt wird. Das ist die Frage, die niemand klären kann.

Es ist so, dass wir wirklich hart verhandelt haben. Es ist auch so - das gilt zumindest für die Union -, dass das Paket, wenn wir es alleine hätten backen können, sicherlich an der einen oder anderen Stelle schärfer oder -anders gewesen wäre, dass die Ziele verbindlicher gewesen wären, dass die Zeitpläne ehrgeiziger gewesen wären. Das ist überhaupt keine Frage. Aber eines ist auch richtig: Wir sind 19 Länder in der Euro-Zone. Bei 19 Ländern kann man nicht sagen, dass alles so ticken und laufen muss, wie es in Deutschland für richtig erachtet wird. Da muss man Kompromisse eingehen. Ich glaube, wir als Deutsche sind in einer ganz besonderen Verantwortung, diese Kompromisse zu organisieren. Wir sind eines der größten und wirtschaftsstärksten Länder in Europa. Wenn wir diese Kompromisse nicht organisieren, wer soll es dann machen? Wir haben eine Verantwortung für dieses Europa.",TOP 1 Regierungserklärung Stabilitätshilfe für Griechenland,2291,speech,18
428,322128,428,118,,,,,,Beifall bei der CDU/CSU und der SPD,TOP 1 Regierungserklärung Stabilitätshilfe für Griechenland,2291,poi,18
429,322129,429,118,Ralph Brinkhaus (CDU/CSU),Ralph Brinkhaus,ralph-brinkhaus,266.0,cducsu,"Weil das so ist, halte ich dieses Paket - bei allen Bedenken auch von einigen Kolleginnen und Kollegen aus meiner Fraktion, die ich respektiere und zum Teil sogar teile - unter dem Strich für nachvollziehbar und für vertretbar und werbe um Ihre Zustimmung.

Danke schön.",TOP 1 Regierungserklärung Stabilitätshilfe für Griechenland,2291,speech,18
430,322130,430,118,,,,,,Beifall bei der CDU/CSU und der SPD,TOP 1 Regierungserklärung Stabilitätshilfe für Griechenland,2291,poi,18
431,322131,431,118,Präsident Dr. Norbert Lammert,Dr. Norbert Lammert,norbert-lammert,494.0,,Ich erteile das Wort nun dem Kollegen Heinz-Joachim Barchmann für die SPD-Fraktion.,TOP 1 Regierungserklärung Stabilitätshilfe für Griechenland,2291,chair,18
432,322132,432,118,,,,,,Beifall bei der SPD,TOP 1 Regierungserklärung Stabilitätshilfe für Griechenland,2291,poi,18
433,322133,433,118,Heinz-Joachim Barchmann (SPD),Heinz-Joachim Barchmann,heinz-joachim-barchmann,36.0,spd,"Herr Präsident! Liebe Kolleginnen und Kollegen! Über die verschiedenen Inhalte des ESM-Programms für Griechenland wurde heute schon in aller Breite diskutiert. Es ist viel über die zahlreichen Maßnahmen gesprochen worden, die Griechenland in den kommenden drei Jahren umsetzen muss, als Gegenleistung für die -Finanzmittel von bis zu 86 Milliarden Euro. Als Berichterstatter der SPD-Fraktion für Griechenland im Europaausschuss möchte ich hier nicht noch einmal auf die Zahlen eingehen, die mit dem Programm zusammenhängen, obwohl sie sehr wichtig sind. Ich möchte stattdessen auf Punkte eingehen, die mir zum einen als Sozial-demokrat und alter Gewerkschafter wichtig sind und mir zum anderen als einfacher, normaler europäischer Bürger am Herzen liegen.

Aus sozialdemokratischer Sicht möchte ich hier noch einmal deutlich machen, dass wir das Programm, wie es jetzt ausgehandelt wurde, als deutlich ausgereifter ansehen können als frühere Vorschläge, vor allem deshalb, weil bei diesem Programm viel stärker auf die sozialen Auswirkungen der Maßnahmen geachtet wurde, die von der griechischen Regierung nun umzusetzen sind. Diese Reformen können die Grundlage für eine vernünftige soziale Basisabsicherung der griechischen Bevölkerung und auch für einen vernünftigen Zugang der Bevölkerung zur Gesundheitsversorgung legen. Die Strukturen, um diese Grundfunktionen sicherzustellen, werden mit dem vorliegenden Programm geschaffen. Es geht nicht mehr nur ums Sparen. Auch die Auswirkungen auf die Menschen vor Ort werden nun endlich in den Blick genommen. Dies ist aus meiner Sicht eine klare Abkehr von der strikten Austeritätspolitik, die über einen viel zu langen Zeitraum in ganz Europa den Umgang mit der Finanzkrise beherrscht hat und die auch von der letzten Bundesregierung mit geprägt wurde.",TOP 1 Regierungserklärung Stabilitätshilfe für Griechenland,2291,speech,18
434,322134,434,118,,,,,,Beifall bei Abgeordneten der SPD,TOP 1 Regierungserklärung Stabilitätshilfe für Griechenland,2291,poi,18
435,322135,435,118,Heinz-Joachim Barchmann (SPD),Heinz-Joachim Barchmann,heinz-joachim-barchmann,36.0,spd,"Dass es hier nun endlich zu Veränderungen mit einem viel stärkeren Fokus auf soziale Aspekte gekommen ist, ist nach meinem Dafürhalten ganz besonders den Stimmen der deutschen und der europäischen Sozialdemokraten zu verdanken. Dafür haben wir uns seit Jahren starkgemacht.",TOP 1 Regierungserklärung Stabilitätshilfe für Griechenland,2291,speech,18
436,322136,436,118,,,,,,Beifall bei der SPD,TOP 1 Regierungserklärung Stabilitätshilfe für Griechenland,2291,poi,18
437,322137,437,118,Heinz-Joachim Barchmann (SPD),Heinz-Joachim Barchmann,heinz-joachim-barchmann,36.0,spd,"Die Abkehr von einem strikten Sparkurs und das Eröffnen von Perspektiven für die griechischen Bürgerinnen und Bürger ist der entscheidende Punkt. Mit dem neuen Programm werden dringend notwendige Strukturveränderungen in Gang gesetzt, von denen Griechenland hoffentlich langfristig profitieren wird. Mit dem Ziel, effizientere Verwaltungsstrukturen zu schaffen und ein transparentes, funktionierendes Steuersystem zu etablieren, werden genau die richtigen Akzente gesetzt. Das Aufbrechen des oligarchischen und teilweise verkrusteten Wirtschaftssystems wird zu mehr Berechenbarkeit, mehr Stabilität, aber auch zu funktionierenden staatlichen Strukturen führen, an denen es in der Vergangenheit oft gefehlt hat.",TOP 1 Regierungserklärung Stabilitätshilfe für Griechenland,2291,speech,18
438,322138,438,118,,,,,,Beifall bei Abgeordneten der SPD,TOP 1 Regierungserklärung Stabilitätshilfe für Griechenland,2291,poi,18
439,322139,439,118,Heinz-Joachim Barchmann (SPD),Heinz-Joachim Barchmann,heinz-joachim-barchmann,36.0,spd,"Nur so können Staatseinnahmen generiert und Investitionen nach Griechenland geholt werden; denn eine politische und verwaltungstechnische Stabilität ist hierfür notwendig. Das kann zum Abbau von Massenarbeitslosigkeit führen. Ein weiteres großes Problem, was ich dabei sehe, ist die hohe Jugendarbeitslosigkeit, die weiter abgebaut werden muss, von der heute aber überhaupt noch nicht gesprochen wurde; darauf möchte ich noch einmal besonders hinweisen.",TOP 1 Regierungserklärung Stabilitätshilfe für Griechenland,2291,speech,18
440,322140,440,118,,,,,,Beifall bei der SPD,TOP 1 Regierungserklärung Stabilitätshilfe für Griechenland,2291,poi,18
441,322141,441,118,Heinz-Joachim Barchmann (SPD),Heinz-Joachim Barchmann,heinz-joachim-barchmann,36.0,spd,"Als letzten Punkt möchte ich die aktuelle Situation der Flüchtlinge auf den griechischen Inseln ansprechen. Jeder von uns hat mitbekommen, was auf der Insel Kos los ist. Die Frage der Flüchtlinge im Mittelmeer ist ein gesamteuropäisches Problem, das von allen gemeinsam gelöst werden muss. Griechenland ist aufgrund seiner geografischen Lage besonders davon betroffen. Die Finanz- und Verwaltungskrise trägt allerdings zu einer weiteren Verschärfung der Situation bei. Wenn kein Geld da ist, können Menschen, die vor Krieg und Elend geflüchtet sind, nicht einmal mit dem Lebensnotwendigen versorgt werden. Hier ist die europäische Solidarität gefragt, und da müssen auch wir in Deutschland uns fragen, ob wir als europäische Bürger an der einen oder anderen Stelle nicht noch mehr tun können. Da bitte ich um Ihre Unterstützung. Ich denke, das ist eine ganz notwendige Sache, bei der wir Griechenland unterstützen müssen.

Danke schön.",TOP 1 Regierungserklärung Stabilitätshilfe für Griechenland,2291,speech,18
442,322142,442,118,,,,,,Beifall bei der SPD sowie des Abg. Tom Koenigs [BÜNDNIS 90/DIE GRÜNEN],TOP 1 Regierungserklärung Stabilitätshilfe für Griechenland,2291,poi,18
443,322143,443,118,Präsident Dr. Norbert Lammert,Dr. Norbert Lammert,norbert-lammert,494.0,,Michael Stübgen ist der nächste Redner für die CDU/CSU-Fraktion.,TOP 1 Regierungserklärung Stabilitätshilfe für Griechenland,2291,chair,18
444,322144,444,118,,,,,,Beifall bei Abgeordneten der CDU/CSU,TOP 1 Regierungserklärung Stabilitätshilfe für Griechenland,2291,poi,18
445,322145,445,118,Michael Stübgen (CDU/CSU),Michael Stübgen,michael-stubgen,384.0,cducsu,"Herr Präsident! Meine sehr verehrten Damen und Herren! Liebe Kolleginnen und Kollegen! Als wir hier vor etwas über vier Wochen - am 17. Juli - eine Sondersitzung hatten, hat mir - ich will es ehrlich zugeben - die Fantasie gefehlt, mir vorzustellen, dass wir in vier Wochen in der Lage sein würden, über ein Memorandum of Understanding für Griechenland einschließlich eines dritten Hilfspakets, das auch nur ansatzweise tragfähig ist, abzustimmen.

Ich gebe es ehrlich zu: Ich war vor vier Wochen empört darüber, welche europaweite Kampagne gegen Bundesfinanzminister Schäuble - auch in Deutschland - lief, und dies nur deshalb, weil er eine fast triviale Wahrheit ausgesprochen hat. Er hat nämlich gesagt und argumentiert, dass es, wenn ein Euro-Mitgliedsland - in diesem Fall Griechenland - fundamental und nachhaltig nicht bereit sei, die Regeln des Euro-Systems einzuhalten, wenn es auch nicht bereit sei, und zwar auch noch durch ein Referendum bestätigt, Reformen vorzunehmen, um die fiskalische Tragfähigkeit wiederherzustellen, für dieses Land keine Zukunft in der Euro-Zone geben werde. Er hat niemals gesagt, dass dieses Land rausgeworfen werden soll. Im Übrigen haben 15 der 19 Finanzminister der Euro-Gruppe dies genauso gesehen und sich dementsprechend artikuliert. Ich werfe niemandem vor, dass er eine andere Meinung hat und sie artikuliert. Nur die Art und Weise dieser Kritik, die darauf abzielte, die persönliche Integrität des Andersdenkenden zu verletzen, hielt ich für absolut inakzeptabel.",TOP 1 Regierungserklärung Stabilitätshilfe für Griechenland,2291,speech,18
446,322146,446,118,,,,,,Beifall bei Abgeordneten der CDU/CSU sowie des Abg. Thomas Oppermann [SPD],TOP 1 Regierungserklärung Stabilitätshilfe für Griechenland,2291,poi,18
447,322147,447,118,Michael Stübgen (CDU/CSU),Michael Stübgen,michael-stubgen,384.0,cducsu,"Außerdem war ich bestürzt über die in den Medien kursierenden öffentlichen Äußerungen von Regierungsvertretern aus Italien und Frankreich, gezielt gegen die deutsche Bundesregierung gerichtet und in einem Ton und in einer Art und Weise, von der ich hoffte, dass wir sie in der Europäischen Union nicht haben. Hinzu kam, dass sich wenige Tage zuvor eine klare Mehrheit der griechischen Bevölkerung in einem Referendum dafür ausgesprochen hat, dass sie nicht bereit ist, Reformen zur Wiedererlangung der fiskalischen Tragfähigkeit umzusetzen. Vor diesem Hintergrund hatte ich Schwierigkeiten, mir vorzustellen, was uns heute zur Abstimmung vorgelegt wird.

Ich will jetzt aufhören, Ihnen weiter über meine Gemütszustände zu berichten. Ich wollte nur sagen: Es war auch für mich ein sehr langer Weg vom 17. Juli bis heute. Heute stehe ich hier und werbe voller innerer Überzeugung dafür, dass Sie diesem Memorandum of Understanding und dem dritten Hilfspaket für Griechenland zustimmen.",TOP 1 Regierungserklärung Stabilitätshilfe für Griechenland,2291,speech,18
448,322148,448,118,,,,,,Beifall bei Abgeordneten der CDU/CSU und der SPD,TOP 1 Regierungserklärung Stabilitätshilfe für Griechenland,2291,poi,18
449,322149,449,118,Michael Stübgen (CDU/CSU),Michael Stübgen,michael-stubgen,384.0,cducsu,"Ich will das an einzelnen Beispielen deutlich machen. Ich kenne alle Memorandums of Understanding, die die Euro-Gruppe und Griechenland beschlossen haben. Das erste Memorandum aus dem Jahr 2010 hat sich sehr stark dadurch ausgezeichnet, dass wir das Ausmaß der Krise und die wahre Situation in Griechenland maßlos unterschätzt hatten. Das zweite Memorandum Anfang 2012, noch mit Papandreou, wurde nach dem Sturz des Ministerpräsidenten nicht mehr umgesetzt. Ende 2012 gab es ein drittes Memorandum of Understanding - auch dem hat der Bundestag zugestimmt -, das dann umgesetzt wurde, einschließlich einer deutlich über 50-prozentigen Reduzierung der Schulden aller privaten Gläubiger.

Ich kann Ihnen sagen: Das Memorandum, das uns heute zur Beschlussfassung vorliegt, ist nach meiner Einschätzung das beste, das fundierteste und das eng-maschigste, das es bisher gab. Es zeigt auch sehr deutlich, dass die Euro-Gruppe aus den Fehlern der letzten Jahre gelernt hat. Ich möchte drei für mich ganz wesentliche Punkte dieses Memorandums nennen. Es hat auch viel mit Fehleinschätzung und Nichtwissen zu tun.

Punkt eins. Höchste Priorität in diesem Memorandum hat die Unterstützung der sozial Schwächsten in Griechenland. Diese Priorität ist deshalb von so besonderer Bedeutung, weil es in Griechenland - das können wir uns in Deutschland gar nicht vorstellen - keine soziale Grundsicherung gibt. Wenn ein griechischer Arbeitnehmer arbeitslos wird, bekommt er für eine befristete Zeit Übergangsgeld oder Arbeitslosengeld, aber dann bekommt er null Leistungen. Ein Arbeitsloser in Griechenland steht also sehr bald vor der existenziellen Frage: Kann ich meine Familie und mich überhaupt noch ernähren? Wenn ich null Leistungen empfange, kann ich auch keine Krankenversicherungsbeiträge zahlen, dann erhalte ich im Krankheitsfall nicht die notwendige Versorgung. Dieses Leck gibt es in Griechenland übrigens schon seit Jahrzehnten, also auch schon vor der Finanzkrise. Diese Problematik ist im vorliegenden Memorandum of Understanding nun adressiert worden, um Griechenland die entsprechende Hilfestellung für den notwendigen Umbau zukommen zu lassen. Eine soziale Grundsicherung zu gewährleisten, halte ich für sehr richtig und für sehr angemessen. Das hat meine volle Unterstützung.",TOP 1 Regierungserklärung Stabilitätshilfe für Griechenland,2291,speech,18
450,322150,450,118,,,,,,Beifall bei Abgeordneten der CDU/CSU,TOP 1 Regierungserklärung Stabilitätshilfe für Griechenland,2291,poi,18
451,322151,451,118,Michael Stübgen (CDU/CSU),Michael Stübgen,michael-stubgen,384.0,cducsu,Ich komme zum zweiten Punkt. Herr Gysi - ich sehe ihn nicht mehr -,TOP 1 Regierungserklärung Stabilitätshilfe für Griechenland,2291,speech,18
452,322152,452,118,Dr. Gesine Lötzsch [DIE LINKE],Dr. Gesine Lötzsch,gesine-lotzsch,328.0,linke,Er kommt gleich wieder!,TOP 1 Regierungserklärung Stabilitätshilfe für Griechenland,2291,poi,18
453,322153,453,118,Michael Stübgen (CDU/CSU),Michael Stübgen,michael-stubgen,384.0,cducsu,"hat heute - ich habe es erwartet - wieder Krokodilstränen vergossen und gesagt: Dieses dritte Rettungsprogramm beinhaltet zum großen Teil die Refinanzierung und Bedienung vorhandener Schulden. Herr Gysi, Sie könnten sich auch darüber beschweren, dass ein Auto fährt. Aber das Wesen eines Autos ist, zu fahren. Das Wesen des ESM, des Europäischen Stabilitätsmechanismus, ist ganz eindeutig, einen ungeordneten Staatsbankrott zu verhindern. Der passiert nämlich dann, wenn man den Schuldendienst nicht mehr leisten kann. Ungeordneter Staatsbankrott heißt Zusammenbruch sämtlicher Sozialleistungen eines Staates - ich will das jetzt gar nicht weiter ausführen -; aber das sagt Herr Gysi nie dazu.",TOP 1 Regierungserklärung Stabilitätshilfe für Griechenland,2291,speech,18
454,322154,454,118,,,,,,Beifall bei Abgeordneten der CDU/CSU,TOP 1 Regierungserklärung Stabilitätshilfe für Griechenland,2291,poi,18
455,322155,455,118,Michael Stübgen (CDU/CSU),Michael Stübgen,michael-stubgen,384.0,cducsu,"Natürlich ist es das Wesen des ESM, dass wir einen Staatsbankrott in Griechenland verhindern - in anderen Ländern haben wir das erfolgreich gemacht -, mit dem Ziel, dass das Land seine fiskalische Stabilität wiedererlangt.

Der dritte Punkt - auch da fließen Krokodilstränen, und es wird regelmäßig gesagt -: Es werden ja bis zu 25 Milliarden Euro für die Banken gegeben, nicht für die Menschen, sondern für die Banken. - Was die Linken in diesem Zusammenhang niemals sagen, ist, dass bei den griechischen Banken, die samt und sonders illiquide sind und kurz vor dem Bankrott stehen, Millionen von kleinen Sparkonten von normalen Griechen geführt werden, von Rentnern, die ein paar Hundert Euro angespart haben, und von Familien, die vielleicht ein paar Tausend Euro angespart haben, um sich etwas leisten zu können. Bei einem ungeordneten Bankrott dieser Banken, bei einem ungeordneten Staatsbankrott Griechenlands wäre das alles weg und stünde auf null. Das heißt, Bankenrekapitalisierung ist auch eine soziale Aufgabe, die wir erfüllen müssen. Deshalb stehe ich ausdrücklich hinter der Bankenrekapitalisierung.",TOP 1 Regierungserklärung Stabilitätshilfe für Griechenland,2291,speech,18
456,322156,456,118,,,,,,Beifall bei Abgeordneten der CDU/CSU und der SPD,TOP 1 Regierungserklärung Stabilitätshilfe für Griechenland,2291,poi,18
457,322157,457,118,Michael Stübgen (CDU/CSU),Michael Stübgen,michael-stubgen,384.0,cducsu,"Lassen Sie mich ein Thema noch nennen, das vor allen Dingen in meiner Fraktion in der Debatte eine wesentliche Rolle gespielt hat, wie ich glaube, zu Recht. Es geht um die Schuldentragfähigkeit. Es ist richtig, dass uns bis jetzt noch keine Schuldentragfähigkeitsbestätigung für dieses Programm durch den IWF vorliegt. Es ist auch richtig, dass gerade meine Fraktion immer klar kommuniziert hat, dass das Vorliegen dieser Schuldentragfähigkeitsbestätigung für uns eine ganz wesentliche Voraussetzung ist. Ich will Ihnen sagen, warum ich zu diesem Zeitpunkt trotzdem zustimme, warum ich das für ausreichend halte.

Punkt eins. Wir wissen - das ist unter Ökonomen umstritten, ein bisschen auch beim IWF -, dass die Betrachtung allein des Nominalwerts der Schulden im Verhältnis zum Bruttoinlandsprodukt nicht die gesamte Vielfalt der fiskalischen Realität abdeckt. Wenn das stimmte, dürfte es Japan als Industrienation längst nicht mehr geben.

Punkt zwei. Ich halte die Analyse des ESM für sehr interessant und lesenswert. Darin wird die Schuldentragfähigkeit an der Bruttofinanzierungsquote festgemacht, also daran, was ein Land in den nächsten 15 Jahren an Schuldendienstleistungen im Verhältnis zum Gesamthaushalt aufbringen muss. Klar ist, dass in den 2020er-Jahren, also bis 2030, diese Bruttofinanzierungsquote in Griechenland unter 15 Prozent liegen wird. Das gilt - das ist nachgewiesen - allgemein als tragfähig. Insofern ist, denke ich, heute ein ausreichender Ansatz bei der Schuldentragfähigkeit da.

Es bleibt aber dabei - Bundesfinanzminister Wolfgang Schäuble hat darauf hingewiesen -: Für uns ist eine aktive Beteiligung des IWF, auch eine finanzielle Beteiligung, unverzichtbar. In wenigen Wochen werden wir in diesem Hause darüber diskutieren, wie wir im Oktober zu einer Beteiligung des IWF kommen können.

Meine sehr verehrten Damen und Herren, noch zwei kurze Sätze zu einem Thema -",TOP 1 Regierungserklärung Stabilitätshilfe für Griechenland,2291,speech,18
458,322158,458,118,Präsident Dr. Norbert Lammert,Dr. Norbert Lammert,norbert-lammert,494.0,,"Nein, einer, Herr Stübgen.",TOP 1 Regierungserklärung Stabilitätshilfe für Griechenland,2291,chair,18
459,322159,459,118,Michael Stübgen (CDU/CSU),Michael Stübgen,michael-stubgen,384.0,cducsu,"- einer; ich danke für die Großzügigkeit -, das viele meiner Kollegen umtreibt. Es geht um die Frage: Wie groß kann eigentlich die Hoffnung sein, dass in Griechenland jetzt alles anders wird, als wir das im letzten halben Jahr, aber auch in den letzten Jahren erlebt haben? Ich glaube, es gibt genug Anzeichen dafür, dass es besser wird. Zum Ersten hat sich die Verhandlungssituation deutlich verändert. Zum Zweiten gibt es eine breite Mehrheit im Parlament, eine Nichtregierungsmehrheit, für diese Reform. Die Prior Actions sind durchweg umgesetzt worden. Zum Dritten. Es wird mit allergrößter Wahrscheinlichkeit im September dieses Jahres Neuwahlen in Griechenland geben. Wir werden sehr genau beobachten können, wie sich die Parteien dort aufstellen.",TOP 1 Regierungserklärung Stabilitätshilfe für Griechenland,2291,speech,18
460,322160,460,118,Präsident Dr. Norbert Lammert,Dr. Norbert Lammert,norbert-lammert,494.0,,"Herr Kollege, wenn mich mein Eindruck nicht täuscht - -",TOP 1 Regierungserklärung Stabilitätshilfe für Griechenland,2291,chair,18
461,322161,461,118,Michael Stübgen (CDU/CSU),Michael Stübgen,michael-stubgen,384.0,cducsu,"Wenn es dazu kommt - was wir alle hoffen -, dass eine Reformregierung die Mehrheit erhält, werden wir die Schuldentragfähigkeit erreichen. Wenn nicht, werden wir, glaube ich, wieder über die Frage eines Verbleibs Griechenlands in der Euro-Zone diskutieren müssen. Das will aber keiner von uns.

Ich danke für Ihre Aufmerksamkeit und für die Großmut des Präsidenten.",TOP 1 Regierungserklärung Stabilitätshilfe für Griechenland,2291,speech,18
