,id,sequence,sitzung,speaker,speaker_cleaned,speaker_fp,speaker_key,speaker_party,text,top,top_id,type,wahlperiode
500,118472,500,126,Alexander Ulrich (DIE LINKE),Alexander Ulrich,alexander-ulrich,315.0,linke,"Deutschland muss gerade vor dem Hintergrund seiner Geschichte auf nukleare Teilhabe in der NATO verzichten. Deutschland besitzt zwar formal keine Atomwaffen; aber die Bundeswehr ist in US-Planspiele für Atomkriege eingebunden. In Büchel stehen deutsche Piloten mit Kampfjets der Bundeswehr für Einsätze bereit. Mit dieser Beteiligung bricht die Bundesregierung ihre völkerrechtlichen Pflichten auf eine Art, die sie bei Nicht-NATO-Staaten zu Recht nie akzeptieren würde. Übrigens geht es auch innerhalb der NATO anders. So sind Griechenland und Kanada schon vor Jahren aus der nuklearen Teilhabe ausgestiegen.

Wir sagen: Die Modernisierung von Atomwaffen in Büchel muss gestoppt werden. Sonst wird ein fatales Zeichen gesetzt, dass das Wettrüsten weitergeht.",TOP ZP 1 Aktuelle Stunde zu Atombomben in Rheinland-Pfalz,2328,speech,18
501,118473,501,126,,,,,,Beifall bei der LINKEN und dem BÜNDNIS 90/DIE GRÜNEN,TOP ZP 1 Aktuelle Stunde zu Atombomben in Rheinland-Pfalz,2328,poi,18
502,118474,502,126,Alexander Ulrich (DIE LINKE),Alexander Ulrich,alexander-ulrich,315.0,linke,"Oder andersherum: Wenn die Bundesregierung hier und jetzt aussteigt, wäre das ein starkes, glaubwürdiges Signal für globale atomare Abrüstung und ein ehrliches Engagement für eine atomwaffenfreie Welt. Gerade in dieser aufgeheizten Zeit mit der angespannten Lage in der Ukraine und den Massen an Kriegsflüchtlingen wäre ein solches Zeichen unglaublich wichtig.

Wir fordern die Bundesregierung auf, den Abzug sämtlicher Atomwaffen aus Deutschland endlich durchzusetzen",TOP ZP 1 Aktuelle Stunde zu Atombomben in Rheinland-Pfalz,2328,speech,18
503,118475,503,126,,,,,,Beifall bei der LINKEN sowie der Abg. Sylvia Kotting-Uhl [BÜNDNIS 90/DIE GRÜNEN],TOP ZP 1 Aktuelle Stunde zu Atombomben in Rheinland-Pfalz,2328,poi,18
504,118476,504,126,Alexander Ulrich (DIE LINKE),Alexander Ulrich,alexander-ulrich,315.0,linke,"und auf jegliche Art der nuklearen Teilhabe vollumfänglich zu verzichten. Ganz nebenbei könnte auf diese Weise in Büchel ein dreistelliger Millionenbetrag eingespart werden; denn wir wissen, dass der Fliegerhorst ebenfalls modernisiert werden soll und wir schon jetzt mit 120 Millionen Euro dabei sind. Ähnlich ist es beim US-Hospital in Ramstein, wo wir mit 130 Millionen dabei sind. Dieses Geld könnte sinnvoller eingesetzt werden, und zwar für Arbeitsplätze, für die Zukunft einer Region, die es dringend nötig hat, als für Kriegsspiele mit Atomwaffen.

Die Linke streitet weiter für eine atomwaffenfreie Welt und für ein atomwaffenfreies Deutschland. Beenden Sie endlich Ihre Hörigkeit gegenüber den USA! Machen Sie damit endlich Schluss!

Ich bin froh, dass auch die Grünen meiner Rede zum Teil durch Applaus zugestimmt haben.",TOP ZP 1 Aktuelle Stunde zu Atombomben in Rheinland-Pfalz,2328,speech,18
505,118477,505,126,Manfred Grund [CDU/CSU],Manfred Grund,manfred-grund,554.0,cducsu,Teilweise!,TOP ZP 1 Aktuelle Stunde zu Atombomben in Rheinland-Pfalz,2328,poi,18
506,118478,506,126,Zuruf vom BÜNDNIS 90/DIE GRÜNEN,vom BÜNDNIS 90/DIE GRÜNEN,vom-bundnis-90-die-grunen,,gruene,Mehr als bei der Linkspartei!,TOP ZP 1 Aktuelle Stunde zu Atombomben in Rheinland-Pfalz,2328,poi,18
507,118479,507,126,Alexander Ulrich (DIE LINKE),Alexander Ulrich,alexander-ulrich,315.0,linke,"Aber auch von der rheinland-pfälzischen Landesregierung erwarte ich deutlich mehr; denn die rheinland-pfälzische Landesregierung aus SPD und Grünen ist mir viel zu ruhig. Man hat sich wohl mit den Plänen der Amerikaner in Büchel abgefunden. Liebe grüne Bundestagsfraktion, sagen Sie Ihren Kollegen im Mainzer Landtag und Ihrer zuständigen Ministerin dort, dass sie endlich handeln sollen, damit nicht nur die Bundesregierung Druck macht, sondern auch die Landesregierung in Rheinland-Pfalz.

Vielen Dank.",TOP ZP 1 Aktuelle Stunde zu Atombomben in Rheinland-Pfalz,2328,speech,18
508,118480,508,126,,,,,,Beifall bei der LINKEN,TOP ZP 1 Aktuelle Stunde zu Atombomben in Rheinland-Pfalz,2328,poi,18
509,118481,509,126,Vizepräsidentin Claudia Roth,Claudia Roth,claudia-roth,426.0,,"Vielen Dank, Herr Kollege Ulrich. - Der nächste Redner ist der Kollege Roderich Kiesewetter für die CDU/CSU-Fraktion.",TOP ZP 1 Aktuelle Stunde zu Atombomben in Rheinland-Pfalz,2328,chair,18
510,118482,510,126,,,,,,Beifall bei der CDU/CSU,TOP ZP 1 Aktuelle Stunde zu Atombomben in Rheinland-Pfalz,2328,poi,18
511,118483,511,126,Roderich Kiesewetter (CDU/CSU),Roderich Kiesewetter,roderich-kiesewetter,200.0,cducsu,"Frau Präsidentin! Liebe Kolleginnen und Kollegen! Meine Damen und Herren! Wir sind eben leider Zeuge einer Rede geworden, in der der Wunsch vor die Wirklichkeit gestellt wurde. Es ist schon absolut bedauerlich, dass die Ukraine als Beispiel für nukleare Abrüstung angeführt wird. Es war doch gerade die Ukraine, die 1994 um den Preis ihrer Unabhängigkeit die Nuklearwaffen an Russland übergeben und 20 Jahre später ihre Souveränität verloren hat. Ich glaube, wäre die Ukraine Nuklearmacht geblieben, müssten wir den hybriden Krieg, den wir dort gerade erleben, nicht erleben.

Mir geht es aber um Sachlichkeit in der Diskussion. Ich möchte deutlich hervorheben, dass gegenseitige Rückversicherung und Abrüstung an sich kein Selbstzweck sind. Ziel unserer Außenpolitik ist, dass wir auf der einen Seite Verlässlichkeit im Bündnis bieten und auf der anderen Seite sowohl Sicherheit nach innen als auch Sicherheit im Bündnis nach außen leisten können. Das können wir durch eine Bundeswehr im Bündnis.",TOP ZP 1 Aktuelle Stunde zu Atombomben in Rheinland-Pfalz,2328,speech,18
512,118484,512,126,Sylvia Kotting-Uhl [BÜNDNIS 90/DIE GRÜNEN],Sylvia Kotting-Uhl,sylvia-kotting-uhl,332.0,gruene,Und mit Atomwaffen!,TOP ZP 1 Aktuelle Stunde zu Atombomben in Rheinland-Pfalz,2328,poi,18
513,118485,513,126,Roderich Kiesewetter (CDU/CSU),Roderich Kiesewetter,roderich-kiesewetter,200.0,cducsu,"Das machen wir durch sehr stark orientierte Entwicklungszusammenarbeit und einen vernetzten Ansatz, der in den letzten Jahren erhebliche Fortschritte gemacht hat.",TOP ZP 1 Aktuelle Stunde zu Atombomben in Rheinland-Pfalz,2328,speech,18
514,118486,514,126,,,,,,Beifall bei der CDU/CSU sowie des Abg. Dr. Karl-Heinz Brunner [SPD],TOP ZP 1 Aktuelle Stunde zu Atombomben in Rheinland-Pfalz,2328,poi,18
515,118487,515,126,Roderich Kiesewetter (CDU/CSU),Roderich Kiesewetter,roderich-kiesewetter,200.0,cducsu,"Ich möchte herausstellen, dass uns Russland zurzeit in drei Bereichen nuklear bedroht:

Erstens. Russland macht Volltruppenübungen und übt die Verlegung von Kurzstreckenraketen, von sogenannten Iskander-Raketen; davon hat Russland mehr als 4 000 Stück. Solche Übungen gab es auf deutschem Boden letztmals in der 80erJahren. Heute, 30 Jahre danach, wird dies auf russischem Boden wieder praktiziert.

Zweitens. Russische strategische Bomber verletzen den Luftraum der Europäischen Union. Wir wissen nicht, was sie transportieren. Sie sind aber nuklearfähig. Das findet umgekehrt nicht statt.

Drittens. Russland übt derzeit mit etwa 50 000 bis 60 000 Soldaten die schnelle Verlegung über weite Strecken und dabei auch die Anwendung von Nuklearwaffen. Auch das gab es zuletzt in den 80er-Jahren und wird heute nicht mehr gemacht.

Wir müssen also schon die Kirche im Dorf lassen und sehr deutlich sagen, dass die nukleare Bedrohung von Russland ausgeht.",TOP ZP 1 Aktuelle Stunde zu Atombomben in Rheinland-Pfalz,2328,speech,18
516,118488,516,126,,,,,,Beifall bei der CDU/CSU sowie des Abg. Dr. Karl-Heinz Brunner [SPD],TOP ZP 1 Aktuelle Stunde zu Atombomben in Rheinland-Pfalz,2328,poi,18
517,118489,517,126,Alexander Ulrich [DIE LINKE],Alexander Ulrich,alexander-ulrich,315.0,linke,Von Russland geht sie aus? Das ist ja ein Witz!,TOP ZP 1 Aktuelle Stunde zu Atombomben in Rheinland-Pfalz,2328,poi,18
518,118490,518,126,Roderich Kiesewetter (CDU/CSU),Roderich Kiesewetter,roderich-kiesewetter,200.0,cducsu,"Für uns Deutsche ist die nukleare Teilhabe ein Thema, auf das ich gerne noch etwas Zeit verwenden möchte. Wir haben es im Jahr 2010 fast parteienübergreifend geschafft - Agnieszka Brugger war seinerzeit dabei -, einen Antrag auf nukleare Abrüstung im Bundestag durchzusetzen. Damals war aber nicht von einem einseitigen Abzug von Nuklearwaffen die Rede, sondern davon, dass wir im strategischen Konzept der NATO eindeutige Hinweise auf einen Abbau der Bedeutung von Nuklearwaffen verankert haben wollten. Das ist uns gelungen; das ging von diesem Bundestag aus. Wir können heute noch froh darüber sein, dass wir das geschafft haben. Die Entwicklung seit 2010 ist aber eine andere; die Bedrohung unserer östlichen Grenze - insbesondere der souveränen Ukraine - ist sehr sichtbar.

Der zweite Punkt ist: Wir wollen das strategische Konzept der NATO weiterhin mit beeinflussen. Das geht nicht, indem wir einseitig sagen: „Wir verzichten auf nukleare Teilhabe“, sondern das geht, indem wir konzeptionell mitarbeiten und an den politischen Dokumenten der NATO mitwirken. Das ist eine Besonderheit. Die Bundesrepublik Deutschland ist neben Frankreich, Großbritannien und den USA einer von vier Staaten, die daran mitwirken. Wir haben hier also eine ganz besondere Rolle.

Der dritte Punkt ist - er sollte dem Kollegen von der Linken etwas mehr zu Herzen gehen; da waren Sie sehr oberflächlich, Herr Kollege Ulrich -:",TOP ZP 1 Aktuelle Stunde zu Atombomben in Rheinland-Pfalz,2328,speech,18
519,118491,519,126,Alexander Ulrich [DIE LINKE],Alexander Ulrich,alexander-ulrich,315.0,linke,Fünf Minuten sind kurz!,TOP ZP 1 Aktuelle Stunde zu Atombomben in Rheinland-Pfalz,2328,poi,18
520,118492,520,126,Roderich Kiesewetter (CDU/CSU),Roderich Kiesewetter,roderich-kiesewetter,200.0,cducsu,"Dadurch, dass wir als Bundesrepublik Deutschland an der nuklearen Teilhabe festhalten, verhindern wir, dass die Staaten in Osteuropa die NATO-Russland-Grundakte aufkündigen. In der NATO-Russland-Grundakte von 1997 ist eindeutig festgehalten: keine Stationierung von Nuklearwaffen in diesen Staaten. - Warum wollen wir das? Wir wollen keine Zone neuer Unsicherheit schaffen, sondern wir wollen, dass die Verlässlichkeit des amerikanischen Nuklearschirms konstant bleibt und wir nicht durch einen einseitigen Verzicht eine Diskussion innerhalb der NATO entfachen, wer dann in Europa die deutsche, die belgische, die niederländische, die italienische oder die türkische Rolle übernimmt. Ich glaube, hier muss uns sehr stark an Stabilität gelegen sein.",TOP ZP 1 Aktuelle Stunde zu Atombomben in Rheinland-Pfalz,2328,speech,18
521,118493,521,126,,,,,,Beifall bei der CDU/CSU,TOP ZP 1 Aktuelle Stunde zu Atombomben in Rheinland-Pfalz,2328,poi,18
522,118494,522,126,Roderich Kiesewetter (CDU/CSU),Roderich Kiesewetter,roderich-kiesewetter,200.0,cducsu,"Ein letzter Punkt: Es handelt sich um eine Modernisierung. Wie uns Parlamentariern es über die Medien zugänglich gemacht worden ist, haben die vorhandenen Nuklearwaffen ein bestimmtes Alter. Wer setzt denn auf Abschreckung oder auf verlässliche Rückversicherung, wenn die Waffen veraltet sind und dadurch möglicherweise sogar eine schädliche Wirkung in ihrem Umfeld entfalten? Das bedeutet, die Modernisierung stärkt die transatlantische Zusammenarbeit und unsere eigene Verlässlichkeit im Rahmen der nuklearen Teilhabe.

Ich möchte bewusst sehr sachlich unterstreichen - und dafür habe ich eine Reihe von Argumenten genannt, auf denen man aufbauen kann -: Mittelfristig halten wir alle am Ziel einer abnehmenden Bedeutung von Nuklearwaffen fest. Aber Russland belehrt uns zurzeit eines Besseren.

Herzlichen Dank für die Aufmerksamkeit.",TOP ZP 1 Aktuelle Stunde zu Atombomben in Rheinland-Pfalz,2328,speech,18
523,118495,523,126,,,,,,Beifall bei der CDU/CSU,TOP ZP 1 Aktuelle Stunde zu Atombomben in Rheinland-Pfalz,2328,poi,18
524,118496,524,126,Vizepräsidentin Claudia Roth,Claudia Roth,claudia-roth,426.0,,"Vielen Dank, Herr Kollege Kiesewetter. - Nächste Rednerin in der Debatte: Agnieszka Brugger für Bündnis 90/Die Grünen.",TOP ZP 1 Aktuelle Stunde zu Atombomben in Rheinland-Pfalz,2328,chair,18
525,118497,525,126,Agnieszka Brugger (BÜNDNIS 90/DIE GRÜNEN),Agnieszka Brugger,agnieszka-brugger,75.0,gruene,"Frau Präsidentin! Meine Damen und Herren! 25 Jahre nach Ende des Kalten Krieges sind immer noch US-amerikanische Atomwaffen im Rahmen der nuklearen Teilhabe in der NATO in Büchel, in Rheinland-Pfalz, stationiert, und die Bundeswehr hält Trägermittel - Tornados - bereit, um diese Waffen im Ernstfall abzuwerfen. Wir sagen als Grüne nicht erst seit heute: Es ist höchste Zeit, dass diese Waffen abgezogen werden.",TOP ZP 1 Aktuelle Stunde zu Atombomben in Rheinland-Pfalz,2328,speech,18
526,118498,526,126,,,,,,Beifall beim BÜNDNIS 90/DIE GRÜNEN sowie bei Abgeordneten der LINKEN,TOP ZP 1 Aktuelle Stunde zu Atombomben in Rheinland-Pfalz,2328,poi,18
527,118499,527,126,Agnieszka Brugger (BÜNDNIS 90/DIE GRÜNEN),Agnieszka Brugger,agnieszka-brugger,75.0,gruene,"Lieber Kollege Ulrich, wir sind Ihnen sehr dankbar, dass Sie als Linksfraktion das heute zum Thema machen. Wir Grüne haben in den letzten Jahren auch schon zahlreiche Anträge dazu gestellt. Bei Ihrer Rede haben wir nur teilweise geklatscht, weil nicht alles richtig war. Ich möchte Sie explizit darauf hinweisen, dass sich unsere grüne stellvertretende Ministerpräsidentin in Rheinland-Pfalz, Eveline Lemke, in dieser Frage sehr klar und deutlich positioniert hat.",TOP ZP 1 Aktuelle Stunde zu Atombomben in Rheinland-Pfalz,2328,speech,18
528,118500,528,126,,,,,,Beifall beim BÜNDNIS 90/DIE GRÜNEN,TOP ZP 1 Aktuelle Stunde zu Atombomben in Rheinland-Pfalz,2328,poi,18
529,118501,529,126,Agnieszka Brugger (BÜNDNIS 90/DIE GRÜNEN),Agnieszka Brugger,agnieszka-brugger,75.0,gruene,"Meine Damen und Herren, das Thema ist sehr aktuell. Vor Jahren hat Obama entschieden, dass das amerikanische Nuklearwaffenarsenal modernisiert werden soll, und die Anzeichen mehren sich, dass das jetzt in die Tat umgesetzt wird. Hinter dem netten und verharmlosenden Begriff „Lebensdauerverlängerung“, der in diesem Zusammenhang gebraucht wird, verbirgt sich ein milliardenschweres Aufrüstungsprogramm, von dem auch die in Büchel gelagerten Waffen betroffen sind. Das bedeutet in der Konsequenz, dass aus der Bombe B61 die noch präzisiere und gefährlichere Variante B61-12 wird. Infolge dessen müssen auch die Flugzeuge, die Tornados, für Millionen Euro umgerüstet werden. Sie werden länger in Betrieb gehalten, als es ursprünglich geplant war. Auch das kostet ordentlich Geld. Gleichzeitig sagen alle Experten - Herr Kiesewetter, hier werden Sie nicht widersprechen -, dass diese Waffen keinen militärischen Nutzen mehr haben.",TOP ZP 1 Aktuelle Stunde zu Atombomben in Rheinland-Pfalz,2328,speech,18
530,118502,530,126,Roderich Kiesewetter [CDU/CSU],Roderich Kiesewetter,roderich-kiesewetter,200.0,cducsu,Das sind politische Waffen! Richtig!,TOP ZP 1 Aktuelle Stunde zu Atombomben in Rheinland-Pfalz,2328,poi,18
531,118503,531,126,Agnieszka Brugger (BÜNDNIS 90/DIE GRÜNEN),Agnieszka Brugger,agnieszka-brugger,75.0,gruene,"Es ist doch naiv, zu glauben, dass, wenn diese Waffen für Unsummen modernisiert werden und die Trägermittel ebenfalls, es zu einem baldigen Abzug dieser Waffen kommen wird. Deshalb können wir die Bundesregierung nur auffordern: Ziehen Sie endlich die Notbremse!",TOP ZP 1 Aktuelle Stunde zu Atombomben in Rheinland-Pfalz,2328,speech,18
532,118504,532,126,,,,,,Beifall beim BÜNDNIS 90/DIE GRÜNEN sowie bei Abgeordneten der LINKEN,TOP ZP 1 Aktuelle Stunde zu Atombomben in Rheinland-Pfalz,2328,poi,18
533,118505,533,126,Agnieszka Brugger (BÜNDNIS 90/DIE GRÜNEN),Agnieszka Brugger,agnieszka-brugger,75.0,gruene,"Ich zitiere aus der Bundestagsdrucksache 17/11323 - sie ist aus der letzten Legislaturperiode -, die den Titel trägt: „Keine Modernisierung der US-Nuklearwaffen in Europa und Deutschland - Abrüstungschancen nicht ungenutzt lassen“. Die antragstellende Fraktion fordert darin die Bundesregierung auf, „deutlich klarzustellen, dass die Bundesregierung gegen die Stationierung modernisierter B61 in Deutschland und Europa ist“ und „auf eine Modernisierung, Anpassung und Lebensdauerverlängerung des deutschen Trägersystems für substrategische Nuklearwaffen zu verzichten und hierfür auch keine Haushaltsmittel einzuplanen“.",TOP ZP 1 Aktuelle Stunde zu Atombomben in Rheinland-Pfalz,2328,speech,18
534,118506,534,126,Niels Annen [SPD],Niels Annen,niels-annen,621.0,spd,Guter Antrag!,TOP ZP 1 Aktuelle Stunde zu Atombomben in Rheinland-Pfalz,2328,poi,18
535,118507,535,126,Sylvia Kotting-Uhl [BÜNDNIS 90/DIE GRÜNEN],Sylvia Kotting-Uhl,sylvia-kotting-uhl,332.0,gruene,Wer hat’s erfunden?,TOP ZP 1 Aktuelle Stunde zu Atombomben in Rheinland-Pfalz,2328,poi,18
536,118508,536,126,Agnieszka Brugger (BÜNDNIS 90/DIE GRÜNEN),Agnieszka Brugger,agnieszka-brugger,75.0,gruene,"Sie denken wahrscheinlich, dieser Antrag stamme von den Grünen oder den Linken; aber er stammt aus der Feder der SPD. Als Antragsteller wird oben namentlich genannt der aktuelle Außenminister Frank-Walter Steinmeier.",TOP ZP 1 Aktuelle Stunde zu Atombomben in Rheinland-Pfalz,2328,speech,18
537,118509,537,126,Niels Annen [SPD],Niels Annen,niels-annen,621.0,spd,Guter Mann!,TOP ZP 1 Aktuelle Stunde zu Atombomben in Rheinland-Pfalz,2328,poi,18
538,118510,538,126,Agnieszka Brugger (BÜNDNIS 90/DIE GRÜNEN),Agnieszka Brugger,agnieszka-brugger,75.0,gruene,"Liebe Kolleginnen und Kollegen von der SPD, ich kann Sie nur an das erinnern, was Sie vor nicht allzu langer Zeit gefordert haben. Jetzt, wo Sie Regierungsverantwortung tragen und den Außenminister stellen, haben Sie die Gelegenheit, es in die Realität umzusetzen. Stoppen Sie diesen finanziellen und sicherheitspolitischen Irrsinn!",TOP ZP 1 Aktuelle Stunde zu Atombomben in Rheinland-Pfalz,2328,speech,18
539,118511,539,126,,,,,,Beifall beim BÜNDNIS 90/DIE GRÜNEN sowie des Abg. Alexander Ulrich [DIE LINKE],TOP ZP 1 Aktuelle Stunde zu Atombomben in Rheinland-Pfalz,2328,poi,18
540,118512,540,126,Agnieszka Brugger (BÜNDNIS 90/DIE GRÜNEN),Agnieszka Brugger,agnieszka-brugger,75.0,gruene,"Meine Damen und Herren, die Bundesregierung betont immer auf dem internationalen Parkett, dass sie sich für eine Welt frei von Atomwaffen einsetzt und die nukleare Abrüstung voranbringen will. Das predigen Sie auf der einen Seite; auf der anderen Seite aber lassen Sie de facto die Aufrüstung dieser Massenvernichtungswaffen im eigenen Land zu. Das ist völlig unglaubwürdig.",TOP ZP 1 Aktuelle Stunde zu Atombomben in Rheinland-Pfalz,2328,speech,18
541,118513,541,126,,,,,,Beifall beim BÜNDNIS 90/DIE GRÜNEN,TOP ZP 1 Aktuelle Stunde zu Atombomben in Rheinland-Pfalz,2328,poi,18
542,118514,542,126,Agnieszka Brugger (BÜNDNIS 90/DIE GRÜNEN),Agnieszka Brugger,agnieszka-brugger,75.0,gruene,"Ich sage Ihnen, was ich ebenso inakzeptabel finde: Wenn wir die Bundesregierung zu diesen Plänen befragen, versteckt sie sich seit Jahren hinter der Geheimhaltung im Rahmen der NATO. Ich muss Ihnen sagen: Man kann, wenn man denn möchte, die entsprechenden Informationen aus den USA nutzen. Man kann die Dokumente der dortigen Regierung lesen, die dortigen Plenardebatten mitverfolgen und nachlesen und sich in Blogs und Zeitschriften die Meinungen der dortigen Experten anschauen. Da steht alles drin. Ich finde, die Bundesregierung ist an dieser Stelle in der Pflicht, die Fragen der Parlamentarierinnen und Parlamentarier zu beantworten und hier auch gegenüber der Öffentlichkeit und den Medien Transparenz herzustellen.",TOP ZP 1 Aktuelle Stunde zu Atombomben in Rheinland-Pfalz,2328,speech,18
543,118515,543,126,,,,,,Beifall beim BÜNDNIS 90/DIE GRÜNEN,TOP ZP 1 Aktuelle Stunde zu Atombomben in Rheinland-Pfalz,2328,poi,18
544,118516,544,126,Agnieszka Brugger (BÜNDNIS 90/DIE GRÜNEN),Agnieszka Brugger,agnieszka-brugger,75.0,gruene,"Der gute Antrag aus der letzten Wahlperiode, in dem wir uns gemeinsam über die Partei- und Fraktionsgrenzen hinweg darauf geeinigt haben, den Abzug der nuklearen Waffen zu fordern, ist schon von den Kollegen Ulrich und Kiesewetter angesprochen worden. Es ist ja nicht alltäglich, dass wir alle einer Meinung sind. Liebe Kolleginnen und Kollegen von der Koalition, ich kann Sie nur auffordern: Rücken Sie davon nicht ab! Lassen Sie uns an diesem guten Konsens festhalten!

Auch in den Niederlanden sind Atomwaffen im Rahmen der nuklearen Teilhabe stationiert. Die Freundinnen und Freunde im niederländischen Parlament haben sich getraut, ein klares Zeichen zu setzen, und beschlossen, den Modernisierungsplänen, die die Waffen im eigenen Land betreffen, eine klare Absage zu erteilen. Ebenso haben sie beschlossen, dass die niederländischen Kampfflugzeuge in Zukunft keine Atomwaffen mehr tragen dürfen.",TOP ZP 1 Aktuelle Stunde zu Atombomben in Rheinland-Pfalz,2328,speech,18
545,118517,545,126,,,,,,Beifall beim BÜNDNIS 90/DIE GRÜNEN,TOP ZP 1 Aktuelle Stunde zu Atombomben in Rheinland-Pfalz,2328,poi,18
546,118518,546,126,Sylvia Kotting-Uhl [BÜNDNIS 90/DIE GRÜNEN],Sylvia Kotting-Uhl,sylvia-kotting-uhl,332.0,gruene,Aha! Geht doch!,TOP ZP 1 Aktuelle Stunde zu Atombomben in Rheinland-Pfalz,2328,poi,18
547,118519,547,126,Agnieszka Brugger (BÜNDNIS 90/DIE GRÜNEN),Agnieszka Brugger,agnieszka-brugger,75.0,gruene,"Insofern würde ich meine Rede gerne mit einem versöhnlichen Appell und einem Angebot insbesondere an Sie, liebe Kolleginnen und Kollegen von der Koalition, schließen: Lassen Sie uns doch einen ähnlichen Beschluss fassen und einen mutigen Schritt in Richtung eines atomwaffenfreien Deutschlands gehen.",TOP ZP 1 Aktuelle Stunde zu Atombomben in Rheinland-Pfalz,2328,speech,18
548,118520,548,126,,,,,,Beifall beim BÜNDNIS 90/DIE GRÜNEN sowie des Abg. Alexander Ulrich [DIE LINKE],TOP ZP 1 Aktuelle Stunde zu Atombomben in Rheinland-Pfalz,2328,poi,18
549,118521,549,126,Agnieszka Brugger (BÜNDNIS 90/DIE GRÜNEN),Agnieszka Brugger,agnieszka-brugger,75.0,gruene,"Am Ende ist es eigentlich ganz einfach: Atomwaffen machen die Welt nie, unter keinen Umständen sicherer.",TOP ZP 1 Aktuelle Stunde zu Atombomben in Rheinland-Pfalz,2328,speech,18
550,118522,550,126,Roderich Kiesewetter [CDU/CSU],Roderich Kiesewetter,roderich-kiesewetter,200.0,cducsu,Das hat noch keiner gemerkt!,TOP ZP 1 Aktuelle Stunde zu Atombomben in Rheinland-Pfalz,2328,poi,18
551,118523,551,126,Agnieszka Brugger (BÜNDNIS 90/DIE GRÜNEN),Agnieszka Brugger,agnieszka-brugger,75.0,gruene,"Nur Abrüstung bedeutet am Ende mehr Frieden und Sicherheit für alle.

Vielen Dank.",TOP ZP 1 Aktuelle Stunde zu Atombomben in Rheinland-Pfalz,2328,speech,18
552,118524,552,126,,,,,,Beifall beim BÜNDNIS 90/DIE GRÜNEN,TOP ZP 1 Aktuelle Stunde zu Atombomben in Rheinland-Pfalz,2328,poi,18
553,118525,553,126,Vizepräsidentin Claudia Roth,Claudia Roth,claudia-roth,426.0,,"Vielen Dank, Frau Kollegin Brugger. - Nächster Redner ist Niels Annen für die SPD.",TOP ZP 1 Aktuelle Stunde zu Atombomben in Rheinland-Pfalz,2328,chair,18
554,118526,554,126,,,,,,Beifall bei der SPD sowie bei Abgeordneten der CDU/CSU,TOP ZP 1 Aktuelle Stunde zu Atombomben in Rheinland-Pfalz,2328,poi,18
555,118527,555,126,Niels Annen (SPD),Niels Annen,niels-annen,621.0,spd,"Vielen Dank, liebe Frau Präsidentin. - Liebe Kolleginnen und Kollegen! Frau Brugger, es ist nett, dass Sie uns an diesen guten Antrag erinnern. Das wäre nicht nötig gewesen,",TOP ZP 1 Aktuelle Stunde zu Atombomben in Rheinland-Pfalz,2328,speech,18
556,118528,556,126,Steffi Lemke [BÜNDNIS 90/DIE GRÜNEN],Steffi Lemke,steffi-lemke,183.0,gruene,"Doch, sehr nötig!",TOP ZP 1 Aktuelle Stunde zu Atombomben in Rheinland-Pfalz,2328,poi,18
557,118529,557,126,Niels Annen (SPD),Niels Annen,niels-annen,621.0,spd,weil sich unsere Haltung gar nicht verändert hat. Unsere Fraktion und auch die Große Koalition sprechen sich weiterhin eindeutig für das Ziel der nuklearen Abrüstung aus.,TOP ZP 1 Aktuelle Stunde zu Atombomben in Rheinland-Pfalz,2328,speech,18
558,118530,558,126,Sylvia Kotting-Uhl [BÜNDNIS 90/DIE GRÜNEN],Sylvia Kotting-Uhl,sylvia-kotting-uhl,332.0,gruene,Das ist doch Heuchelei!,TOP ZP 1 Aktuelle Stunde zu Atombomben in Rheinland-Pfalz,2328,poi,18
559,118531,559,126,Alexander Ulrich [DIE LINKE],Alexander Ulrich,alexander-ulrich,315.0,linke,Dann muss man aber auch etwas dafür machen!,TOP ZP 1 Aktuelle Stunde zu Atombomben in Rheinland-Pfalz,2328,poi,18
560,118532,560,126,Niels Annen (SPD),Niels Annen,niels-annen,621.0,spd,"Wir haben uns in den letzten Jahren in diesem Haus immer darauf verständigt; das war auch gemeinsame Position der letzten Bundesregierungen. Ich bin froh, dass wir uns bei all der Rhetorik, die man zu solch einer Gelegenheit gerne vortragen kann - das ist ja in Ordnung -, auch heute über dieses Ziel einig sind.",TOP ZP 1 Aktuelle Stunde zu Atombomben in Rheinland-Pfalz,2328,speech,18
561,118533,561,126,Sylvia Kotting-Uhl [BÜNDNIS 90/DIE GRÜNEN],Sylvia Kotting-Uhl,sylvia-kotting-uhl,332.0,gruene,"Wenn man das Gegenteil tut, ist das keine Einigkeit!",TOP ZP 1 Aktuelle Stunde zu Atombomben in Rheinland-Pfalz,2328,poi,18
