,id,profile_url,sequence,sitzung,speaker,speaker_cleaned,speaker_fp,speaker_key,speaker_party,text,top,top_id,type,wahlperiode
379,634632,https://www.abgeordnetenwatch.de/profile/harald-ebner/archive/215319,379,150,Harald Ebner (BÜNDNIS 90/DIE GRÜNEN),Harald Ebner,harald-ebner,1551,gruene,"außer natürlich die Industrie, die Pestizide herstellt und damit seit Jahren Rekordumsätze einfährt. Leider verweigert der Bundesminister, der auch heute lieber auf der IGW als im Parlament ist, in Sachen Pestizidreduktion wie bei vielen anderen Themen eindeutig die Arbeit. Das zeigt, lieber Kollege Saathoff, der Nationale Aktionsplan, der nach wie vor nicht mehr als das geduldige Papier ist, das sich gefällig liest, aber zu dessen Umsetzung nichts passiert. Eine ganze Reihe von Verbänden - das wurde schon gesagt - mit Sachverstand sind schon vor Jahren aus dem NAP-Forum ausgestiegen, weil sie sagen: Bei einem Aktionsverhinderungsplan machen wir nicht mit. Wir lassen uns nicht zu Tode partizipieren, und am Ende kommt nichts dabei heraus.",TOP 18 Pestizide,14705,speech,18
380,634633,,380,150,,,,,,Beifall beim BÜNDNIS 90/DIE GRÜNEN,TOP 18 Pestizide,14705,poi,18
381,634634,https://www.abgeordnetenwatch.de/profile/harald-ebner/archive/215319,381,150,Harald Ebner (BÜNDNIS 90/DIE GRÜNEN),Harald Ebner,harald-ebner,1551,gruene,"Dies zeigt: Die Bundesregierung ist an dieser Stelle nicht Sachwalter der Interessen der Bürgerinnen und Bürger in diesem Land.

Da muss ich auch an die Adresse des Kollegen Färber und der Kollegin Pahlmann sagen: Uns geht es darum, die Forschungen zu Alternativen zum chemischen Pflanzenschutz zu einem Schwerpunkt der öffentlichen Agrarforschung zu machen. Wir haben das in unseren Haushaltsanträgen mehrfach gefordert. Da ist noch lange nicht genug passiert. Das kommt dann den konventionellen Landwirten und den Ökolandwirten zugute. Auch der Deutsche Bauernverband hat dies jüngst gefordert: 60 Millionen Euro für den Ökolandbau! - Das ist richtig. Das findet unsere volle Unterstützung.",TOP 18 Pestizide,14705,speech,18
382,634635,,382,150,,,,,,Beifall beim BÜNDNIS 90/DIE GRÜNEN,TOP 18 Pestizide,14705,poi,18
383,634636,https://www.abgeordnetenwatch.de/profile/hermann-farber/archive/214848,383,150,Hermann Färber [CDU/CSU],Hermann Färber,hermann-farber,1512,cducsu,Der größte Bauernverband fordert das!,TOP 18 Pestizide,14705,poi,18
384,634637,https://www.abgeordnetenwatch.de/profile/harald-ebner/archive/215319,384,150,Harald Ebner (BÜNDNIS 90/DIE GRÜNEN),Harald Ebner,harald-ebner,1551,gruene,"- Ja, natürlich. - Aber schade, dass es just nach den Haushaltsberatungen im Dezember passiert ist. Ich baue darauf, dass der Bauernverband diese Forderungen auch aufrechterhält, wenn es an die nächsten Haushaltsberatungen geht. Ich baue darauf, dass Sie, liebe Kolleginnen und Kollegen von der Union, dieses Mal auch, wie sonst immer, den Forderungen des Bauernverbandes entsprechen und hier mit dabei sind. Dann kommen wir einen wesentlichen Schritt weiter. Das wäre schön.",TOP 18 Pestizide,14705,speech,18
385,634638,,385,150,,,,,,Beifall beim BÜNDNIS 90/DIE GRÜNEN,TOP 18 Pestizide,14705,poi,18
386,634639,https://www.abgeordnetenwatch.de/profile/harald-ebner/archive/215319,386,150,Harald Ebner (BÜNDNIS 90/DIE GRÜNEN),Harald Ebner,harald-ebner,1551,gruene,"Das würde uns nämlich auch als Verbraucherinnen und Verbraucher nutzen.

Die aktuelle Auswertung unserer Fraktion zu Pestiziden auf Lebensmitteln zeigt: Ökolebensmittel schneiden bei allen Parametern der Pestizidbelastung deutlich besser ab. Wenn Pestizidrückstände auf Ökolebensmitteln auftauchen, dann kommen sie leider Gottes zu 90 Prozent vom konventionellen Nachbarn. Das kann ja keiner wirklich gutheißen.

Es wurde schon angesprochen, Pestizidrückstände, Kollege Saathoff, seien ja immer unter dem Grenzwert. Aber die Grenzwerte sind die halbe Wahrheit. Wir haben keine Grenzwerte für Cocktails. Es ist auch der Dreh- und Angelpunkt bei den Zulassungsverfahren, dass wir keine Prüfungen für die Mischung von Pestiziden haben, dass wir über deren Risiken überhaupt nichts wissen.

Ein weiteres Problem - ich komme demnächst zum Schluss - bei Zulassungsverfahren ist: Wir haben keine Kenntnis über das, was die Industrie im Vorfeld, bevor sie Studien abliefert, für ihre Good-Laboratory-Practice-Prüfungen durchführt. Sie können lange untersuchen, bevor sie ein Untersuchungsdesign festlegen, das sie am Ende abliefern. Wir haben gesehen, dass ein Pestizidzyklus immer läuft: Pestizide prüfen, Ungefährlichkeit feststellen, zulassen.",TOP 18 Pestizide,14705,speech,18
387,634640,https://www.abgeordnetenwatch.de/profile/petra-pau/archive/215458,387,150,Vizepräsidentin Petra Pau,Petra Pau,petra-pau,1713,,"Herr Kollege Ebner, nicht nur die Ankündigung, sondern der tatsächliche Schluss ist jetzt erreicht.",TOP 18 Pestizide,14705,chair,18
388,634641,https://www.abgeordnetenwatch.de/profile/harald-ebner/archive/215319,388,150,Harald Ebner (BÜNDNIS 90/DIE GRÜNEN),Harald Ebner,harald-ebner,1551,gruene,"Ich komme zum Schluss. - Am Ende stellen wir fest, es wird gefährlich, und erst dann werden die Pestizide vom Markt genommen. Wir kennen das von DDT und anderen Substanzen. Damit muss endlich Schluss sein. Wir müssen im Rahmen eines Humanbiomonitorings bessere Daten zur Exposition gewinnen. Wir wollen, dass die Landwirtschaft mit weniger Pestiziden, besser noch: ohne Pestizide auskommt. Machen Sie endlich etwas dafür.

Danke schön.",TOP 18 Pestizide,14705,speech,18
389,634642,,389,150,,,,,,Beifall beim BÜNDNIS 90/DIE GRÜNEN,TOP 18 Pestizide,14705,poi,18
390,634643,https://www.abgeordnetenwatch.de/profile/petra-pau/archive/215458,390,150,Vizepräsidentin Petra Pau,Petra Pau,petra-pau,1713,,Das Wort hat der Kollege Waldemar Westermayer für die CDU/CSU-Fraktion.,TOP 18 Pestizide,14705,chair,18
391,634644,,391,150,,,,,,Beifall bei der CDU/CSU,TOP 18 Pestizide,14705,poi,18
392,634645,https://www.abgeordnetenwatch.de/profile/waldemar-westermayer,392,150,Waldemar Westermayer (CDU/CSU),Waldemar Westermayer,waldemar-westermayer,1297,cducsu,"Frau Präsidentin! Meine Damen und Herren! Werte Kolleginnen und Kollegen! Wir diskutieren heute gemeinsam den Einsatz von Pflanzenschutzmitteln in unserer Landwirtschaft. Zunächst möchte ich festhalten, dass unsere Lebensmittel niemals zuvor so sicher, bezahlbar und vielfältig waren.",TOP 18 Pestizide,14705,speech,18
393,634646,,393,150,,,,,,Beifall bei der CDU/CSU,TOP 18 Pestizide,14705,poi,18
394,634647,https://www.abgeordnetenwatch.de/profile/waldemar-westermayer,394,150,Waldemar Westermayer (CDU/CSU),Waldemar Westermayer,waldemar-westermayer,1297,cducsu,"Beim Thema Pflanzenschutz sind die Verbraucher aber zu Recht sehr sensibel. Deshalb sollten wir uns sachlich fundiert damit auseinandersetzen. Zu diesem sachlich fundierten Umgang gehört für mich aber auch, dass wir auf Basis gesicherter Erkenntnisse argumentieren. Diesem Anspruch werden Ihr Antrag und auch Ihre Rede, Herr Hofreiter, leider nicht gerecht.

Übrigens, der Betrieb meines Sohnes befindet sich gerade in der Phase der Umstellung auf Ökolandbau. Das möchte ich auch einmal erwähnen.",TOP 18 Pestizide,14705,speech,18
395,634648,,395,150,,,,,,Beifall bei Abgeordneten der LINKEN und des BÜNDNISSES 90/DIE GRÜNEN,TOP 18 Pestizide,14705,poi,18
396,634649,https://www.abgeordnetenwatch.de/profile/waldemar-westermayer,396,150,Waldemar Westermayer (CDU/CSU),Waldemar Westermayer,waldemar-westermayer,1297,cducsu,"Ich selber habe 40 Jahre lang den Betrieb geführt, habe einige Jahre das Modell MEKA, das übrigens in Baden-Württemberg von einer CDU-Regierung ins Leben gerufen wurde, genutzt und über Jahrzehnte keine Pflanzenschutzmittel eingesetzt.",TOP 18 Pestizide,14705,speech,18
397,634650,https://www.abgeordnetenwatch.de/profile/harald-ebner/archive/215319,397,150,Harald Ebner [BÜNDNIS 90/DIE GRÜNEN],Harald Ebner,harald-ebner,1551,gruene,Deshalb sind Sie noch so fit und rüstig!,TOP 18 Pestizide,14705,poi,18
398,634651,https://www.abgeordnetenwatch.de/profile/dr-anton-hofreiter-0,398,150,Dr. Anton Hofreiter [BÜNDNIS 90/DIE GRÜNEN],Dr. Anton Hofreiter,anton-hofreiter,1793,gruene,"Das heißt, es geht ja!",TOP 18 Pestizide,14705,poi,18
399,634652,https://www.abgeordnetenwatch.de/profile/waldemar-westermayer,399,150,Waldemar Westermayer (CDU/CSU),Waldemar Westermayer,waldemar-westermayer,1297,cducsu,"Sie behaupten, dass in Deutschland Jahr für Jahr mehr Pflanzenschutzmittel eingesetzt werden, und stellen einen direkten Zusammenhang zwischen den Gewinnen der Hersteller und Gesundheitsgefahren für die Menschen her. So ist das falsch. Zum einen geben die Zahlen den von Ihnen beschriebenen Trend nicht her; denn der Absatz der Wirkstoffe - darum geht es im Kern - ist seit 2011 ungefähr konstant geblieben. Zwischendurch ist der Absatz sogar leicht gesunken. Sie, Herr Hofreiter, haben vorhin von 100 000 Tonnen gesprochen. Dazu muss man sagen: 44 000 Tonnen entfallen auf den Wirkstoff, das andere sind Füllstoffe. Im europaweiten Vergleich der Zahlen liegt Deutschland nach Daten von Eurostat beim Verkauf von Pflanzenschutzmitteln pro Hektar landwirtschaftlicher Nutzfläche sogar leicht unter dem EU-Durchschnitt.

Irreführend und populistisch finde ich zum anderen auch Ihre Gegenüberstellung von Gewinnen der Hersteller auf der einen Seite und Gesundheitsgefahren für den Menschen auf der anderen Seite. Sie legen damit ganz bewusst nahe, dass hier ein Zusammenhang besteht, und wollen damit das Bild einer menschenverachtenden Industrie zeichnen. Das hat aus meiner Sicht nichts mehr mit seriöser Politik zu tun. Schließlich stellen diese Unternehmen Wirkstoffe her, die - das sage ich ganz bewusst - nach unabhängigen wissenschaftlichen Untersuchungen mit hohem Sachverstand zugelassen wurden. An dieser Stelle möchte ich ausdrücklich sagen: Ich bin davon überzeugt, dass wir einen solchen unabhängigen Sachverstand im Bundesamt für Verbraucherschutz und Lebensmittelsicherheit und im Bundesinstitut für Risikobewertung haben.",TOP 18 Pestizide,14705,speech,18
400,634653,,400,150,,,,,,Beifall bei Abgeordneten der CDU/CSU sowie des Abg. Willi Brase [SPD],TOP 18 Pestizide,14705,poi,18
401,634654,https://www.abgeordnetenwatch.de/profile/waldemar-westermayer,401,150,Waldemar Westermayer (CDU/CSU),Waldemar Westermayer,waldemar-westermayer,1297,cducsu,"Insbesondere wird die nationale Zulassung durch das BVL internationalen Standards gerecht, vor allem auch durch die intensive Zusammenarbeit mit dem Julius-Kühn-Institut und dem Umweltbundesamt. Vor diesem Hintergrund kann ich die Fundamentalkritik am Zulassungsverfahren in Ihrem Antrag nicht nachvollziehen.

Nach meiner Auffassung setzt Ihr Antrag im Kern den falschen Schwerpunkt. Sie fordern primär ein Programm zur Reduzierung des Einsatzes von Pflanzenschutzmitteln mit dem Ziel des vollkommenen Verzichts auf diese Mittel. Unabhängig davon, dass Sie damit den erheblichen gesamtgesellschaftlichen Nutzen von Pflanzenschutzmitteln außer Acht lassen, bringt eine pauschale Reduktion erst mal gar nichts. Gute und nachhaltige Agrarpolitik bemisst sich nämlich nicht isoliert nach der bloßen Menge der eingesetzten Pflanzenschutzmittel. Sonst würde ein risikoreicheres Mittel, das schon in geringen Mengen wirkt, besser bewertet werden als ein risikoärmeres mit einer höheren Wirkungsschwelle. Das kann deshalb nicht unser Ansatz sein.

Entscheidend ist vielmehr, dass man sich die Eigenschaften der eingesetzten Stoffe genau anschaut, eventuelle Risiken identifiziert und dementsprechend Maßnahmen trifft. Letztlich ist demnach keine Mengen-, sondern eine Risikoreduktion entscheidend. Das ist aus meiner Sicht der nachhaltige und dem Vorsorgeprinzip entsprechende Ansatz, den wir verfolgen sollten.

Ausdrücklich möchte ich in diesem Zusammenhang auch auf die Untersuchung der WHO hinsichtlich Glyphosat eingehen. Der vermeintliche Gegensatz zwischen dem Ergebnis der WHO und dem Ergebnis des BfR und der klaren Mehrheit der Zulassungsbehörden ist schlicht im unterschiedlichen Ansatz der Untersuchung begründet. Die WHO hat in ihrer Betrachtung nämlich keine Risikobewertung im eigentlichen Sinn durchgeführt, sondern lediglich abstrakt und allgemein das potenzielle Krebsrisiko durch Glyphosat begutachtet. Das sagt jedoch erst einmal nichts über das tatsächliche Risiko für den einzelnen Bürger aus, welches maßgeblich für die Zulassung ist. Ich ziehe daraus für mich den Schluss, dass wir vor allem in der Forschung weiter vorankommen müssen. Hierfür übernimmt die Bundesregierung in ihrem Aktionsplan auch einiges, vor allem mit der Nationalen Forschungsstrategie BioÖkonomie 2030.

Außerdem wird die Bundesregierung ihrem Anspruch an eine nachhaltige Anwendung von Pflanzenschutzmitteln auch international gerecht. So betreibt das Bundesministerium für wirtschaftliche Zusammenarbeit und Entwicklung - in diesem Ausschuss bin ich auch vertreten - zusammen mit der GIZ in Entwicklungsländern Resistenzforschung und bildet Bauern vor Ort in der Anwendung des integrierten Pflanzenschutzes aus. Außerdem wird die Anwendung von Nachhaltigkeitsstandards beim Einsatz von Pflanzenschutzmitteln in Zusammenarbeit mit der Privatwirtschaft gefördert, zum Beispiel in einem regionalen Projekt zur Baumwollproduktion in Afrika. Das zeigt den ganzheitlichen Ansatz, den wir bei unserer Pflanzenschutzstrategie verfolgen, und beweist, dass wir in der Sache auf einem guten Weg sind. Denn wer eine Welt ohne Hunger will, kann nicht auf Pflanzenschutzmittel verzichten. Deshalb ist Ihr Antrag abzulehnen.

Herzlichen Dank.",TOP 18 Pestizide,14705,speech,18
402,634655,,402,150,,,,,,Beifall bei der CDU/CSU sowie des Abg. Willi Brase [SPD],TOP 18 Pestizide,14705,poi,18
403,634656,https://www.abgeordnetenwatch.de/profile/petra-pau/archive/215458,403,150,Vizepräsidentin Petra Pau,Petra Pau,petra-pau,1713,,Der Kollege Carsten Träger hat für die SPD-Fraktion das Wort.,TOP 18 Pestizide,14705,chair,18
404,634657,,404,150,,,,,,Beifall bei der SPD,TOP 18 Pestizide,14705,poi,18
405,634658,https://www.abgeordnetenwatch.de/profile/carsten-trager-0,405,150,Carsten Träger (SPD),Carsten Träger,carsten-trager,1316,spd,"Sehr geehrte Frau Präsidentin! Liebe Kolleginnen und Kollegen! Sehr geehrte Damen und Herren! Am Mittwoch fand im Umweltausschuss eine Anhörung zum Verlust der Artenvielfalt bei Insekten statt. Das mag von dem einen oder anderen belächelt werden: Wen interessieren schon ein paar Mücken mehr oder weniger? Ich sage Ihnen: Mir ist das Schmunzeln vergangen. In der Anhörung zeigten alle Sachverständigen die Dramatik des Artensterbens auf, hier in Deutschland, in unserer Heimat, vor unserer Haustür. In manchen Teilen Deutschlands ist die Zahl der Fluginsekten um 80 Prozent zurückgegangen, das ist der Anteil der Individuen, die verloren sind.

Das Aussterben von Arten hat ein unerkanntes Ausmaß erreicht. Mehr als 20 Prozent der Großschmetterlinge - das haben Messungen an den jeweiligen Standorten ergeben - sind verloren. Diese Arten sind in Deutschland ausgestorben. Kann uns das kaltlassen?",TOP 18 Pestizide,14705,speech,18
406,634659,https://www.abgeordnetenwatch.de/profile/harald-ebner/archive/215319,406,150,Harald Ebner [BÜNDNIS 90/DIE GRÜNEN],Harald Ebner,harald-ebner,1551,gruene,Nein!,TOP 18 Pestizide,14705,poi,18
407,634660,https://www.abgeordnetenwatch.de/profile/carsten-trager-0,407,150,Carsten Träger (SPD),Carsten Träger,carsten-trager,1316,spd,"Der Verlust der Arten ist nicht nur bedrohlich, weil sie ein wichtiger Bestandteil der Nahrungskette sind. Weniger Insekten bedeuten auch weniger Futter, zum Beispiel für Jungvögel. Der Verlust der Insekten ist nicht nur bedrohlich, weil sie verantwortlich sind für das Bestäuben eines Großteils der Pflanzen. Alle reden über Bienen, aber die Wahrheit ist: Nicht nur die Bienen sind für die Bestäubung zuständig. Der Verlust der Insekten ist auch bedrohlich, weil sie Frühindikatoren für den Zustand unseres Lebensumfeldes sind. Kann uns das kaltlassen?

Liebe Kolleginnen und Kollegen, werfen wir doch gerade anlässlich der Grünen Woche einen Blick auf die Gründe. Alle Experten in der Anhörung vermuten Neonikotinoide als Hauptursache für das Massensterben. Das sind Pestizide, die seit Mitte der 90er-Jahre in der Landwirtschaft eingesetzt werden. Seit es sie gibt, hat die Geschwindigkeit des Sterbens von Insekten dramatisch zugenommen. Und, seien wir ehrlich: So ganz überraschend ist der Befund nicht; dafür sind sie schließlich da, die Neoniks. Landen sie in unserer Nahrung, mit Folgen für unsere Gesundheit? Wer kann das mit Sicherheit ausschließen?

Liebe Kolleginnen und Kollegen, uns muss daran gelegen sein, den Einsatz von Pestiziden zu verringern.",TOP 18 Pestizide,14705,speech,18
408,634661,,408,150,,,,,,"Beifall bei der SPD, der LINKEN und dem BÜNDNIS 90/DIE GRÜNEN",TOP 18 Pestizide,14705,poi,18
409,634662,https://www.abgeordnetenwatch.de/profile/carsten-trager-0,409,150,Carsten Träger (SPD),Carsten Träger,carsten-trager,1316,spd,"Jeder Zustandsbericht zur Lage der Natur zeigt es immer wieder: Der Indikator für Artenvielfalt gerade im Agrarland hat sich deutlich verschlechtert. Er ist auf den bisher tiefsten Wert gesunken, und er ist weiter vom Zielwert entfernt als alle anderen Indikatoren.

Die Landwirtschaft erhält in großem Umfang Agrarsubventionen aus Steuermitteln. Die daran geknüpften Umweltanforderungen sind allerdings wenig anspruchsvoll und können am negativen Trend nichts ändern. Ich unterstütze daher ausdrücklich unsere Umweltministerin Barbara Hendricks bei ihrer Naturschutzoffensive für eine Umgestaltung dieser Landwirtschaftssubventionen.",TOP 18 Pestizide,14705,speech,18
410,634663,,410,150,,,,,,Beifall bei der SPD sowie des Abg. Dr. Anton Hofreiter [BÜNDNIS 90/DIE GRÜNEN],TOP 18 Pestizide,14705,poi,18
411,634664,https://www.abgeordnetenwatch.de/profile/carsten-trager-0,411,150,Carsten Träger (SPD),Carsten Träger,carsten-trager,1316,spd,"Es muss das Prinzip gelten: öffentliche Mittel für öffentliche Leistungen.

Kolleginnen und Kollegen, ich bin sehr dafür, dass wir unsere Landwirte kräftig unterstützen. Ich bin aber auch dafür, dass wir unsere Unterstützung an Leistungen für den Naturschutz knüpfen.",TOP 18 Pestizide,14705,speech,18
412,634665,,412,150,,,,,,Beifall bei der SPD,TOP 18 Pestizide,14705,poi,18
413,634666,https://www.abgeordnetenwatch.de/profile/carsten-trager-0,413,150,Carsten Träger (SPD),Carsten Träger,carsten-trager,1316,spd,"Wenn nicht mit Rücksicht auf Umwelt und Natur bewirtschaftet wird, sollten die Subventionen nicht mehr fließen. Das wird nicht von heute auf morgen gehen; gleichwohl müssen wir uns auf den Weg machen; denn der Verlust der Artenvielfalt kann uns nicht kaltlassen.

Vielen Dank.",TOP 18 Pestizide,14705,speech,18
414,634667,,414,150,,,,,,Beifall bei der SPD sowie bei Abgeordneten der CDU/CSU und des BÜNDNISSES 90/DIE GRÜNEN,TOP 18 Pestizide,14705,poi,18
415,634668,https://www.abgeordnetenwatch.de/profile/petra-pau/archive/215458,415,150,Vizepräsidentin Petra Pau,Petra Pau,petra-pau,1713,,Für die CDU/CSU-Fraktion hat nun der Kollege Thomas Mahlberg das Wort.,TOP 18 Pestizide,14705,chair,18
416,634669,,416,150,,,,,,Beifall bei der CDU/CSU,TOP 18 Pestizide,14705,poi,18
417,634670,https://www.abgeordnetenwatch.de/profile/thomas-mahlberg/archive/214668,417,150,Thomas Mahlberg (CDU/CSU),Thomas Mahlberg,thomas-mahlberg,1738,cducsu,"Frau Präsidentin! Liebe Kolleginnen und Kollegen! Meine Damen und Herren! Herr Kollege Hofreiter, ich muss sagen: Sie sind wirklich sehr konsequent gewesen. Sie haben genau das getan, was man von Ihnen erwartet hat. Sie wollen den Markenkern, den Sie für Ihre Partei entwickeln, Angstpolitik zu machen und Panik zu verbreiten, auch mit diesem Antrag heute umsetzen. Ich kann Ihnen sagen: Das ist Ihnen nicht gelungen.",TOP 18 Pestizide,14705,speech,18
418,634671,,418,150,,,,,,Beifall bei der CDU/CSU,TOP 18 Pestizide,14705,poi,18
419,634672,https://www.abgeordnetenwatch.de/profile/dr-kirsten-tackmann-0,419,150,Dr. Kirsten Tackmann [DIE LINKE],Dr. Kirsten Tackmann,kirsten-tackmann,1829,linke,Sie sind unbelehrbar!,TOP 18 Pestizide,14705,poi,18
420,634673,https://www.abgeordnetenwatch.de/profile/thomas-mahlberg/archive/214668,420,150,Thomas Mahlberg (CDU/CSU),Thomas Mahlberg,thomas-mahlberg,1738,cducsu,"Sie haben in Ihrer Rede angesprochen, wie es in den einzelnen Bundesländern aussieht. Sie haben die Bundesländer wegen der Kontrollen gelobt. Ich bitte Sie, zur Kenntnis zu nehmen, dass wir gestern über den Ticker eine Meldung aus Mecklenburg-Vorpommern zu Ihrem Lieblingsthema Glyphosat erhalten haben:

Ministerium: Keine Glyphosatrückstände in Lebensmitteln aus MV

... in keiner der 135 Proben eine Überschreitung des Grenzwertes nachgewiesen.",TOP 18 Pestizide,14705,speech,18
421,634674,https://www.abgeordnetenwatch.de/profile/dr-anton-hofreiter-0,421,150,Dr. Anton Hofreiter [BÜNDNIS 90/DIE GRÜNEN],Dr. Anton Hofreiter,anton-hofreiter,1793,gruene,Ja! Grenzwerte!,TOP 18 Pestizide,14705,poi,18
422,634675,https://www.abgeordnetenwatch.de/profile/harald-ebner/archive/215319,422,150,Harald Ebner [BÜNDNIS 90/DIE GRÜNEN],Harald Ebner,harald-ebner,1551,gruene,Lesen Sie die Studie!,TOP 18 Pestizide,14705,poi,18
423,634676,https://www.abgeordnetenwatch.de/profile/thomas-mahlberg/archive/214668,423,150,Thomas Mahlberg (CDU/CSU),Thomas Mahlberg,thomas-mahlberg,1738,cducsu,"Untersucht wurden den Angaben zufolge frisches Obst wie Äpfel ...

Und so weiter. Das sind genau die Äpfel, die Sie eben angesprochen haben.",TOP 18 Pestizide,14705,speech,18
424,634677,https://www.abgeordnetenwatch.de/profile/dr-anton-hofreiter-0,424,150,Dr. Anton Hofreiter [BÜNDNIS 90/DIE GRÜNEN],Dr. Anton Hofreiter,anton-hofreiter,1793,gruene,Zwischen Grenzwerten und nichts drin ist ein Unterschied! Kennen Sie den?,TOP 18 Pestizide,14705,poi,18
425,634678,https://www.abgeordnetenwatch.de/profile/thomas-mahlberg/archive/214668,425,150,Thomas Mahlberg (CDU/CSU),Thomas Mahlberg,thomas-mahlberg,1738,cducsu,Ich frage Sie: Was für Geschichten erzählen Sie eigentlich hier im Parlament?,TOP 18 Pestizide,14705,speech,18
426,634679,,426,150,,,,,,Beifall bei der CDU/CSU,TOP 18 Pestizide,14705,poi,18
427,634680,https://www.abgeordnetenwatch.de/profile/harald-ebner/archive/215319,427,150,Harald Ebner [BÜNDNIS 90/DIE GRÜNEN],Harald Ebner,harald-ebner,1551,gruene,Kennen Sie unsere Studie?,TOP 18 Pestizide,14705,poi,18
428,634681,https://www.abgeordnetenwatch.de/profile/thomas-mahlberg/archive/214668,428,150,Thomas Mahlberg (CDU/CSU),Thomas Mahlberg,thomas-mahlberg,1738,cducsu,"Das ist genau der Punkt. Wir sprechen über Grenzwerte, die natürlich sinnvoll sind und zur Sicherung unserer Bevölkerung festgelegt werden, und Sie sagen: Wenn man etwas findet, dann ist das per se schlecht und muss raus.",TOP 18 Pestizide,14705,speech,18
429,634682,https://www.abgeordnetenwatch.de/profile/dr-anton-hofreiter-0,429,150,Dr. Anton Hofreiter [BÜNDNIS 90/DIE GRÜNEN],Dr. Anton Hofreiter,anton-hofreiter,1793,gruene,Wieso sind sie dann um den Faktor 100 erhöht worden?,TOP 18 Pestizide,14705,poi,18
430,634683,https://www.abgeordnetenwatch.de/profile/thomas-mahlberg/archive/214668,430,150,Thomas Mahlberg (CDU/CSU),Thomas Mahlberg,thomas-mahlberg,1738,cducsu,"Gut ist, Herr Hofreiter, dass nicht nur wir erkennen, was Sie hier machen, sondern mittlerweile auch andere Leute Ihnen auf die Schliche kommen, auch die Leute, die das, was Sie machen, transportieren sollen.",TOP 18 Pestizide,14705,speech,18
431,634684,,431,150,,,,,,Beifall bei Abgeordneten der CDU/CSU,TOP 18 Pestizide,14705,poi,18
432,634685,https://www.abgeordnetenwatch.de/profile/thomas-mahlberg/archive/214668,432,150,Thomas Mahlberg (CDU/CSU),Thomas Mahlberg,thomas-mahlberg,1738,cducsu,"So hat zum Beispiel Der Tagesspiegel im September letzten Jahres einen Kommentar mit der Überschrift „Glyphosat: Wie groß ist die Gefahr?“ veröffentlicht. Im Teaser kann man lesen:

Glyphosat in der Muttermilch? Eine höchst zweifelhafte Annahme. Bei der Bewertung von Pestiziden sollte Sachlichkeit der Maßstab sein.

Herr Hofreiter, es geht um Sachlichkeit. Dieser Kommentar bezieht sich auf eine - das kann man nur in ganz dicken Anführungszeichen sagen - „Studie“, die im Auftrag Ihrer Fraktion, der Fraktion der Grünen, bei stillenden Müttern durchgeführt wurde.",TOP 18 Pestizide,14705,speech,18
433,634686,https://www.abgeordnetenwatch.de/profile/harald-ebner/archive/215319,433,150,Harald Ebner [BÜNDNIS 90/DIE GRÜNEN],Harald Ebner,harald-ebner,1551,gruene,Das war eine Untersuchung!,TOP 18 Pestizide,14705,poi,18
434,634687,https://www.abgeordnetenwatch.de/profile/thomas-mahlberg/archive/214668,434,150,Thomas Mahlberg (CDU/CSU),Thomas Mahlberg,thomas-mahlberg,1738,cducsu,"Sich auf die Ergebnisse dieser Studie stützend, rief Ihre Kollegin Bärbel Höhn - sie sitzt ja da; sie ist eine sehr geschätzte Kollegin; wir waren früher ja zusammen im Landtag von Nordrhein-Westfalen - der Bundesregierung zu:

Die Bundesregierung muss Glyphosat aus dem Verkehr ziehen.

Was können wir in dem Artikel weiter lesen? Ich zitiere das einmal:

Aber die Grünen verschwiegen nicht nur, dass die gefundenen Glyphosat-Mengen weit unterhalb der Schadensschwelle lagen. Schlimmer noch, das verwendete Testverfahren war gar nicht für Muttermilch geeignet, die Ergebnisse daher unbrauchbar.

Deshalb kann ich nur sagen, im Klartext: Das war großer Murks, was Sie da veranstaltet haben.",TOP 18 Pestizide,14705,speech,18
435,634688,,435,150,,,,,,Beifall bei der CDU/CSU,TOP 18 Pestizide,14705,poi,18
436,634689,https://www.abgeordnetenwatch.de/profile/petra-pau/archive/215458,436,150,Vizepräsidentin Petra Pau,Petra Pau,petra-pau,1713,,"Kollege Mahlberg, gestatten Sie eine Frage oder Bemerkung der Kollegin Höhn?",TOP 18 Pestizide,14705,chair,18
