,id,profile_url,sequence,sitzung,speaker,speaker_cleaned,speaker_fp,speaker_key,speaker_party,text,top,top_id,type,wahlperiode
606,634859,https://www.abgeordnetenwatch.de/profile/katja-keul/archive/215046,606,150,Katja Keul (BÜNDNIS 90/DIE GRÜNEN),Katja Keul,katja-keul,1461,gruene,"Sehr geehrte Frau Präsidentin! Liebe Kolleginnen und Kollegen! Mit dem vorliegenden Gesetzentwurf schlägt die Bundesregierung Änderungen an der Insolvenzordnung vor, die insbesondere das Anfechtungsrecht betreffen. Parallel dazu sollen im Anfechtungsgesetz entsprechende Änderungen für Anfechtungen außerhalb eines Insolvenzverfahrens vorgenommen werden.

Aber was ist das Anfechtungsrecht eigentlich? Es dient dazu, zu verhindern, dass bei einer Insolvenz einzelne Gläubiger bessergestellt werden, weil sie früh Informationen über die finanziellen Verhältnisse des Schuldners haben und daher noch kurz vor der Insolvenz ihr Geld eintreiben können. Das Anfechtungsrecht dient somit der Gläubigergleichbehandlung. Dennoch soll dieses Recht nunmehr an mehreren Stellen eingeschränkt werden, um überlange Unsicherheiten über den Bestand eines Rechtsgeschäftes zu vermeiden.

Unproblematisch und zu begrüßen ist zunächst einmal die Verkürzung der Anfechtungsfrist von zehn auf vier Jahre ab Insolvenzantragstellung. Nach vier Jahren sollte klar sein, ob eine Leistung zurückgezahlt werden muss oder nicht. Auch die Verknüpfung der Verzinsung von Rückzahlungsansprüchen an die üblichen Verzugsvoraussetzungen ist nicht mehr als fair.

Kritisch ist aber die künftige umfassende Privilegierung von Vollstreckungsmaßnahmen, die dann nicht mehr anfechtbar sein sollen. Der Vorschlag hat folgenden Hintergrund: Wenn Gläubiger ihre berechtigte Forderung in jahrelangem Rechtsstreit endlich tituliert haben und dann mit hohem Zeit- und Kostenaufwand vollstrecken, ist nicht einzusehen, dass sie so behandelt werden, als ob ihnen dieses Recht nie zugestanden hätte. Problematisch dabei ist aber, dass das jetzt auch für alle öffentlich-rechtlichen Gläubiger wie Finanzämter und Sozialversicherungsträger gelten soll, die sich ihre Titel selbst erstellen und vollstrecken können. Mit Einführung der Insolvenzordnung hatte man sich bewusst von dieser Fiskusprivilegierung verabschiedet, um Insolvenzverfahren frühzeitiger zu ermöglichen, wenn noch genug Masse zur Verteilung bzw. Chancen zur Fortsetzung des Unternehmens vorhanden sind.

Sozialversicherungsträger und Finanzämter sind die wichtigsten Insolvenzantragsteller. Wenn diese nun die Möglichkeit erhalten, bis zum bitteren Ende unanfechtbar zu vollstrecken, haben sie kaum noch Interesse an einem frühzeitigen Insolvenzantrag.",TOP 20 Insolvenzanfechtungsrecht,14707,speech,18
607,634860,https://www.abgeordnetenwatch.de/profile/dr-johannes-fechner/archive/217041,607,150,Dr. Johannes Fechner [SPD],Dr. Johannes Fechner,johannes-fechner,1838,spd,So ist es ja nicht!,TOP 20 Insolvenzanfechtungsrecht,14707,poi,18
608,634861,https://www.abgeordnetenwatch.de/profile/katja-keul/archive/215046,608,150,Katja Keul (BÜNDNIS 90/DIE GRÜNEN),Katja Keul,katja-keul,1461,gruene,"Im Ergebnis werden damit wieder mehr Privatgläubiger leer ausgehen, so wie früher nach der Konkursordnung. Ich denke, Sie sollten die Vorschläge der Verbände übernehmen und die Privilegierung auf gerichtlich erlangte Vollstreckungstitel beschränken.

Kommen wir zu den Änderungen in § 133 Insolvenzordnung. Danach soll der Gläubiger, dessen berechtigte Forderung vom Schuldner erfüllt wird, nur noch dann mit einer Anfechtung rechnen müssen, wenn er die eingetretene Zahlungsunfähigkeit kannte. Kenntnis von drohender Zahlungsunfähigkeit soll nicht mehr reichen. Dieser zusätzliche Schutz ist angemessen und nachvollziehbar. Ob es aber darüber hinaus auch noch angemessen ist, gleich bei jeder Ratenzahlungsvereinbarung zu vermuten, dass der Gläubiger die Zahlungsunfähigkeit nicht kannte, finde ich zumindest zweifelhaft. Hier bleibt die Expertenanhörung abzuwarten.

Mit der Änderung des § 142 Insolvenzordnung sollen die sogenannten Bargeschäfte konkretisiert werden, also die Geschäfte, bei denen eine Gegenleistung unmittelbar bezahlt wird, wie vor allem beim Arbeitslohn. Das finde ich richtig. Gerade in Bezug auf Arbeitnehmer war es an der Zeit, die umfangreiche höchstrichterliche Rechtsprechung zum Zwecke der Rechtsklarheit im Gesetz aufzunehmen. Jetzt kann es jeder schwarz auf weiß nachlesen: Der Lohn für Arbeitsleistungen der letzten drei Monate ist vor der Anfechtung sicher.

Nicht ganz so klar ist leider die Ausnahmevorschrift. Hat der Arbeitnehmer erkannt, dass der Arbeitgeber unlauter handelte, soll der Anfechtungsschutz nicht gelten. Aber was bitte ist „unlauter“? Warum man jetzt hier wieder einen neuen Begriff einführt, der erst wieder im Wege der Rechtsprechung konkretisiert werden muss, erschließt sich mir nicht. Ich denke, auf diese Ausnahme sollten Sie schlicht verzichten oder zumindest auf leitende Angestellte beschränken.",TOP 20 Insolvenzanfechtungsrecht,14707,speech,18
609,634862,,609,150,,,,,,Beifall beim BÜNDNIS 90/DIE GRÜNEN sowie bei Abgeordneten der LINKEN,TOP 20 Insolvenzanfechtungsrecht,14707,poi,18
610,634863,https://www.abgeordnetenwatch.de/profile/katja-keul/archive/215046,610,150,Katja Keul (BÜNDNIS 90/DIE GRÜNEN),Katja Keul,katja-keul,1461,gruene,"Am Ende schlagen Sie noch eine Änderung vor, die mit dem Anfechtungsrecht nichts zu tun hat: Gläubiger sollen schneller und leichter einen Insolvenzantrag stellen können als bisher. Bislang konnte ein Schuldner den Insolvenzantrag eines Gläubigers einmal abwenden, indem er die Forderung doch noch bezahlt, wenn nicht bereits ein Insolvenzantrag in den letzten zwei Jahren gestellt worden war. Diese Möglichkeit soll für den Schuldner jetzt gänzlich entfallen. Begründet wird dies insbesondere damit, dass Sozialversicherungsträger schneller eine Klärung der Zahlungsfähigkeit herbeiführen sollen. Im Ergebnis kann dann aber jeder Gläubiger eines säumigen Schuldners ohne weitere Voraussetzungen jederzeit eine insolvenzgerichtliche Entscheidung in der Sache veranlassen. Ich frage mich schon, ob das wirklich praktikabel sein wird und nicht einfach zu einer unnötigen Mehrbelastung der Insolvenzgerichte führt. Leider liegen gerade zu diesem Punkt kaum schriftliche Stellungnahmen der Verbände vor, sodass wir auch hier die Expertenanhörung abwarten müssen.

Fazit: Der Gesetzentwurf ist eine gute Diskussionsgrundlage. Allerdings sollte auch dieses Gesetz keinesfalls aus dem Parlament so herauskommen, wie es hineingekommen ist.

Vielen Dank.",TOP 20 Insolvenzanfechtungsrecht,14707,speech,18
611,634864,,611,150,,,,,,Beifall beim BÜNDNIS 90/DIE GRÜNEN und bei der LINKEN,TOP 20 Insolvenzanfechtungsrecht,14707,poi,18
612,634865,https://www.abgeordnetenwatch.de/profile/claudia-roth-0,612,150,Vizepräsidentin Claudia Roth,Claudia Roth,claudia-roth,1686,,"Vielen Dank, Katja Keul. - Nächster Redner in der Debatte: Dr. Heribert Hirte für die CDU/CSU-Fraktion.",TOP 20 Insolvenzanfechtungsrecht,14707,chair,18
613,634866,,613,150,,,,,,Beifall bei der CDU/CSU sowie bei Abgeordneten der SPD,TOP 20 Insolvenzanfechtungsrecht,14707,poi,18
614,634867,https://www.abgeordnetenwatch.de/profile/prof-dr-iur-heribert-hirte/archive/214630,614,150,Dr. Heribert Hirte (CDU/CSU),Dr. Heribert Hirte,heribert-hirte,1483,cducsu,"Frau Präsidentin! Liebe Kolleginnen und Kollegen! Liebe Zuhörer! Es sind an diesem Freitagnachmittag ja nicht mehr ganz so viele. Zunächst einmal: Worum geht es eigentlich bei diesem Gesetzentwurf zur Reform des Insolvenzanfechtungsrechts? Die Insolvenzanfechtung dient dazu - wir haben es schon einmal gehört -, sogenannte vorinsolvenzliche Vermögensverschiebungen rückabzuwickeln. Wer also etwas aus einem später insolvent gehenden Unternehmen herausbekommen hat, muss es unter bestimmten Voraussetzungen an den Insolvenzverwalter zurückführen, wenn er es innerhalb bestimmter Fristen vor der Insolvenz bekommen hat. Das dient dazu - auch das hat der Minister richtigerweise gesagt -, die Gleichbehandlung der Gläubiger im Insolvenzverfahren sicherzustellen. Es soll nicht derjenige einen Vorteil haben, der noch kurz vor der Insolvenz seine Schäfchen ins Trockene gebracht hat.

Um es deutlich zu sagen: Das ist nicht etwa neu, sondern das ist ein Rechtsinstitut, das es seit der Römerzeit gibt und das deshalb weitgehend anerkannt ist, auch in seiner Konzeption. Es wurde in den letzten Jahren allerdings ausgebaut, weil wir den Gläubigerschutz an anderer Stelle, bei den Gesellschaften, zurückgefahren haben. Insofern ist es nicht ganz überraschend, dass wir jetzt auch hier über die Grenzen nachdenken.

Herr Pitterle hat gesagt, in einem Bereich, was die Anfechtung von Lohnzahlungen an Arbeitnehmer angeht, hat sich seit der Konkursordnung etwas geändert. Das ist richtig. Die Konkursordnung sah ein spezielles Privileg für die Arbeitnehmer vor, das in dieser Weise jetzt nicht mehr existiert. Aber die Zahl der Anfechtungen von Lohnzahlungen hat nicht etwa wegen der Einführung der Insolvenzordnung zugenommen, sondern aus einem ganz anderen Grund, nämlich weil die Sozialversicherungsträger der Sache nach durch eine etwas versteckte Sonderregelung - § 28 e SGB IV - privilegiert wurden. Insofern gibt es einen Zusammenhang mit dem, was Frau Keul angesprochen hat, mit der Privilegierung der Sozialversicherungsträger. Darauf komme ich gleich noch einmal zu sprechen.

Diese Regelungen - ich betone es noch einmal - sind im Grundsatz richtig. Sie dienen der Verwirklichung des Gläubigerschutzes und haben deshalb eine hohe ordnungspolitische Bedeutung. Allerdings ist die Reichweite umstritten. In einem zentralen Punkt sind die Regelungen zu Recht auf Kritik gestoßen. Dabei geht es um die Regelung des § 133 Insolvenzordnung, um die sogenannte Vorsatzanfechtung. Leistungen, die bis zu zehn Jahre vor der Eröffnung des Insolvenzverfahrens zurückliegen, können zurückgefordert werden, und das eigentlich nur bei Vorsatz. Die zehn Jahre wären nicht so schlimm, wenn nicht der Begriff „Vorsatz“ von der Rechtsprechung ausgelegt, will heißen: abgemildert worden wäre. Das bedeutet für die Gläubiger, die Adressaten dieser Insolvenzanfechtung, dass sie ziemlich überraschend mit solchen Rückforderungen konfrontiert werden. Das wollen wir ändern. Es ist richtig, dass wir das ändern. In der Koalitionsvereinbarung haben wir vereinbart, dass wir im Interesse des Mittelstandes und im Interesse der Arbeitnehmer in diesem Punkt mehr Rechtssicherheit herstellen wollen.",TOP 20 Insolvenzanfechtungsrecht,14707,speech,18
615,634868,,615,150,,,,,,Beifall bei der CDU/CSU sowie bei Abgeordneten der SPD,TOP 20 Insolvenzanfechtungsrecht,14707,poi,18
616,634869,https://www.abgeordnetenwatch.de/profile/prof-dr-iur-heribert-hirte/archive/214630,616,150,Dr. Heribert Hirte (CDU/CSU),Dr. Heribert Hirte,heribert-hirte,1483,cducsu,"Aus diesem Grunde adressiert der Gesetzentwurf zu Recht drei Bereiche, in denen Änderungen vorgenommen werden:

Zum einen geht es um Änderungen bei der schon angesprochenen Vorsatzanfechtung. Die Frist, die bisher zehn Jahre beträgt, soll, jedenfalls für wesentliche Teile, auf vier Jahre verkürzt werden. Es soll dabei auch die Kenntnis, die der andere, der das Geld bekommen hat, hat, erhöht werden. Er muss wissen, dass die Insolvenz schon eingetreten ist. Es soll nicht mehr nur ausreichen, dass er von einer drohenden Insolvenz Kenntnis hat.

Zweitens. Zahlungserleichterungen, die irgendwann einmal im Vorfeld gewährt wurden, sollen nicht mehr dazu führen können, dass man sein Geld zurückgeben muss. Über die genaue Formulierung - auch das ist schon angesprochen worden - müssen wir allerdings noch nachdenken; das ist zu evaluieren.

Drittens. Richtig ist auch, dass das sogenannte Bargeschäft - § 142 Insolvenzordnung - erweitert wird, und zwar klarstellend erweitert wird, in Aufnahme der Rechtsprechung des Bundesarbeitsgerichts zur Anfechtbarkeit von Lohnzahlung an Arbeitnehmer. Allerdings müssen wir noch ein bisschen schauen, ob jetzt auch innerhalb dieser Norm die Gleichbehandlung hergestellt ist. Auch darüber werden wir noch nachzudenken haben.",TOP 20 Insolvenzanfechtungsrecht,14707,speech,18
617,634870,,617,150,,,,,,Beifall bei Abgeordneten der CDU/CSU,TOP 20 Insolvenzanfechtungsrecht,14707,poi,18
618,634871,https://www.abgeordnetenwatch.de/profile/prof-dr-iur-heribert-hirte/archive/214630,618,150,Dr. Heribert Hirte (CDU/CSU),Dr. Heribert Hirte,heribert-hirte,1483,cducsu,"Völlig unstreitig, wenn ich das hier Revue passieren lasse, ist, dass der Zinslauf bei der Rückforderung jetzt ab Verzug einsetzen soll und nicht etwa nur, wie es im Augenblick der Fall ist, ab Eröffnung des Insolvenzverfahrens. Auch das hat dazu beigetragen, dass Adressaten einer solchen Insolvenzanfechtung mit den Forderungen überrascht werden konnten. Das wird jetzt anders. Das ist ein wichtiger Punkt. Wir hätten diesen Punkt meines Erachtens schon viel, viel früher regeln können, als wir am Anfang der Legislaturperiode gesagt haben, wir könnten mit kleinen Detailänderungen das Problem schon lösen. Das sind einige wesentliche Punkte.

Ein Punkt ist zweifelhaft. Das ist der Punkt, dass auch Deckungen und Sicherungen, die man im Wege der Zwangsvollstreckung erreicht hat, privilegiert werden, also von der Insolvenzanfechtung ausgenommen werden sollen. Denn das betrifft jedenfalls in der Praxis vor allen Dingen Forderungen des Fiskus und der Sozialversicherungsträger. Wenn die nicht mehr anfechtbar sind, obwohl die Beteiligten genau wussten, dass es sich um ein insolventes Unternehmen handelt, heißt das, dass die Insolvenzmasse so ausgedünnt wird, dass am Ende nicht mehr genügend Masse zur Eröffnung der Verfahren zur Verfügung steht. Ich stimme der Kollegin Keul, die sehr deutlich darauf hingewiesen hat, ausdrücklich zu. Das würde mich mit großer Sorge erfüllen. Darüber müssen wir nachdenken, unter anderem auch deshalb, weil sonst anschließend nicht mehr genügend Geld für die Arbeitnehmer, für einen Sozialplan, zur Verfügung steht.

Es gibt noch genügend zu beraten. Auf diese Beratungen freue ich mich.

Vielen Dank Ihnen allen.",TOP 20 Insolvenzanfechtungsrecht,14707,speech,18
619,634872,,619,150,,,,,,Beifall bei der CDU/CSU sowie bei Abgeordneten der SPD,TOP 20 Insolvenzanfechtungsrecht,14707,poi,18
620,634873,https://www.abgeordnetenwatch.de/profile/claudia-roth-0,620,150,Vizepräsidentin Claudia Roth,Claudia Roth,claudia-roth,1686,,"Danke schön, Dr. Hirte. - Nächster Redner: Dr. Brunner für die SPD.",TOP 20 Insolvenzanfechtungsrecht,14707,chair,18
621,634874,,621,150,,,,,,Beifall bei der SPD sowie bei Abgeordneten der CDU/CSU,TOP 20 Insolvenzanfechtungsrecht,14707,poi,18
622,634875,https://www.abgeordnetenwatch.de/profile/dr-karl-heinz-brunner-0,622,150,Dr. Karl-Heinz Brunner (SPD),Dr. Karl-Heinz Brunner,karl-heinz-brunner,1337,spd,"Verehrte Frau Präsidentin! Meine Kolleginnen und Kollegen! Meine sehr verehrten Damen und Herren und Gäste, die Sie an diesem Freitagmittag auf den Zuhörerrängen ausgeharrt haben! Die Koalitionsparteien haben in dem Koalitionsvertrag „Deutschlands Zukunft gestalten“ vorgeschlagen, eine Reihe von gesellschafts- und insolvenzrechtlichen Aspekten zu regeln. Ich zitiere aus dem Koalitionsvertrag:

Zudem werden wir das Insolvenzanfechtungsrecht im Interesse der Planungssicherheit ... sowie des Vertrauens der Arbeitnehmerinnen und Arbeitnehmer in ausgezahlte Löhne auf den Prüfstand stellen.

Kernstück der Regelungen heute ist daher die Verbesserung der Rechtssicherheit bei Anfechtungen nach der Insolvenzordnung. Hier gab es oft Probleme, nicht zuletzt - das wurde ja schon von einigen Rednern angesprochen - durch die unterschiedlichen Rechtsprechungen des Bundesarbeitsgerichtes, des Bundesgerichtshofs - und nicht zu vergessen - die zahlreichen obergerichtlichen Entscheidungen zu den Haftungsansprüchen von Insolvenzverwaltern, wenn sie in der gängigen Praxis früherer Jahre nicht angefochten haben; denn Rechtsgeschäfte mit dem Schuldner unterliegen bis zu zehn Jahren rückwirkend der Anfechtung.

Lassen Sie mich kurz die häufigsten drei Beispiele nennen, in denen dies zum Tragen kam.

Erstens. Arbeitnehmer vereinbaren mit ihrem Betrieb, der sich in Schieflage befindet - manchmal ist dies noch nicht ersichtlich -, dass sie für ein geringeres Gehalt arbeiten, um nach Insolvenzeröffnung nicht nur zu erfahren, dass der Arbeitsplatz weg ist, sondern nun auch noch erfahren, dass bereits gezahltes Gehalt an den Insolvenzverwalter zurückzuzahlen ist.

Zweitens. Handwerker, meist kleine und mittelständische Unternehmer, gestatten ihren Lieferanten, mit denen sie schon lange in Geschäftsbeziehungen stehen, Stundungen oder Ratenzahlungen, um deren Liquidität und letztendlich die Geschäftsbeziehung zu erhalten. Der Geschäftspartner geht in Insolvenz, und es passiert, dass die Zahlungen an den Insolvenzverwalter zurückzuzahlen sind.

Drittens. Ein Gläubiger bemüht sich, wegen mangelnder Zahlung bei Gericht ein Urteil zu erwirken, beauftragt den Gerichtsvollzieher, und der vereinbart ordnungsgemäß, so wie es das Gesetz will, eine Ratenzahlung. Am Schluss bleibt der kleine Unternehmer auf den Kosten sitzen, weil er zurückzuerstatten hat.

Alle drei Fälle führen zu Ergebnissen, die im schlimmsten Fall sogar die Existenzgrundlage der betroffenen Gläubiger ernsthaft bedrohen, weil die Rückforderungen bis zu zehn Jahre danach erhoben werden können. Verständlich ist das nicht - und gerecht allemal nicht.",TOP 20 Insolvenzanfechtungsrecht,14707,speech,18
623,634876,,623,150,,,,,,Beifall bei Abgeordneten der SPD und der CDU/CSU,TOP 20 Insolvenzanfechtungsrecht,14707,poi,18
624,634877,https://www.abgeordnetenwatch.de/profile/dr-karl-heinz-brunner-0,624,150,Dr. Karl-Heinz Brunner (SPD),Dr. Karl-Heinz Brunner,karl-heinz-brunner,1337,spd,"Diese Ungerechtigkeit zu beseitigen, nachzujustieren, wo es notwendig ist, gleichzeitig aber möglichst wenig in die Systematik der Insolvenzordnung einzugreifen, das unternimmt der heute in erster Lesung vorliegende Gesetzentwurf.

Kern der Änderung, die ausdrücklich Vermögensverschiebungen oder Bankrotthandlungen ausnimmt, weil diese keine Privilegierung verdienen, ist die Beseitigung von Rechtsunsicherheiten bei Arbeitnehmerinnen und Arbeitnehmern. Es geht dabei - das wurde bereits angesprochen - um die Kodifizierung der Rechtsprechung des Bundesarbeitsgerichts.

Außerdem wollen wir, um das Vertrauen von Arbeitnehmerinnen und Arbeitnehmern zu stärken, verdienten Arbeitslohn auch behalten zu dürfen, einen Teil der Vorsatzanfechtung in das Bargeschäftsprivileg einbeziehen. Nach § 142 Absatz 1 der Insolvenzordnung soll die Anfechtung nur noch möglich sein, wenn erstens der Schuldner unlauter handelte und zweitens der Gläubiger dies auch erkannte.

Zudem wollen wir die Anfechtungsfrist von zehn auf vier Jahre verkürzen.

Wenig interessensgerecht fand ich auch die bisherige Regelung zur Verzinsung des Anfechtungsanspruchs, weil sie Anreize zu dessen verzögerter Geltendmachung schaffte. Deshalb sollen, wie im Gesetzentwurf vorgesehen, die Zinsen begrenzt werden, indem sie den allgemeinen schuldrechtlichen Verzugsregeln unterstellt werden.

Mein Dank an dieser Stelle, meine Damen und Herren, geht vor allen Dingen an Sie, lieber Justizminister Heiko Maas, für diesen Entwurf und die konstruktiven Lösungsansätze. Ich hoffe, dass bei der öffentlichen Anhörung noch viele konstruktive Vorschläge zu den noch wenigen offenen Fragen kommen. Ich sage dies deshalb, weil ich glaube, dass an einigen Stellen noch Diskussionsbedarf besteht. So glaube ich, dass der Vorschlag im Referentenentwurf aus Ihrem Haus, Herr Minister, lediglich den zivilprozessualen, also auf dem Rechtsweg erstrittenen Titeln ein Privileg in der Zwangsvollstreckung einzuräumen, also denjenigen, die einen Zahlungsbefehl oder ein Urteil erwirken wie der einfache Handwerker, sachgerecht und angemessen war.",TOP 20 Insolvenzanfechtungsrecht,14707,speech,18
625,634878,,625,150,,,,,,Beifall des Abg. Dr. Heribert Hirte [CDU/CSU],TOP 20 Insolvenzanfechtungsrecht,14707,poi,18
626,634879,https://www.abgeordnetenwatch.de/profile/dr-karl-heinz-brunner-0,626,150,Dr. Karl-Heinz Brunner (SPD),Dr. Karl-Heinz Brunner,karl-heinz-brunner,1337,spd,"Dass jedoch jetzt, vermutlich bei der Ressortabstimmung, durch Streichung des kleinen Wortes „gerichtlich“ quasi durch die Hintertür die alten, aus der Konkursordnung bekannten Fiskal- und Sozialversicherungsprivilegien wieder Einzug halten könnten - auch als Ausstandsverzeichnisse, die im einfachen Weg erstritten werden, bekannt -, dient weder der Sache und, wie ich glaube, schon gar nicht der Masse.",TOP 20 Insolvenzanfechtungsrecht,14707,speech,18
627,634880,,627,150,,,,,,Beifall bei Abgeordneten der SPD sowie der Abg. Dr. Heribert Hirte [CDU/CSU] und Richard Pitterle [DIE LINKE],TOP 20 Insolvenzanfechtungsrecht,14707,poi,18
628,634881,https://www.abgeordnetenwatch.de/profile/dr-karl-heinz-brunner-0,628,150,Dr. Karl-Heinz Brunner (SPD),Dr. Karl-Heinz Brunner,karl-heinz-brunner,1337,spd,"Deshalb, meine sehr verehrten Damen und Herren, freue ich mich, auch nach den Wortbeiträgen und Reden des heutigen Tages, auf einen intensiven Gedankenaustausch, auf gute Anregungen in der öffentlichen Anhörung am 24. Februar und gute Ergebnisse bis zur zweiten und dritten Lesung.

Vielen herzlichen Dank für die Aufmerksamkeit.",TOP 20 Insolvenzanfechtungsrecht,14707,speech,18
629,634882,,629,150,,,,,,Beifall bei Abgeordneten der SPD und der CDU/CSU,TOP 20 Insolvenzanfechtungsrecht,14707,poi,18
630,634883,https://www.abgeordnetenwatch.de/profile/claudia-roth-0,630,150,Vizepräsidentin Claudia Roth,Claudia Roth,claudia-roth,1686,,"Vielen Dank, Kollege Brunner. - Der letzte Redner in dieser Debatte ist Philipp Graf Lerchenfeld für die CDU/CSU-Fraktion.",TOP 20 Insolvenzanfechtungsrecht,14707,chair,18
631,634884,,631,150,,,,,,Beifall bei Abgeordneten der CDU/CSU,TOP 20 Insolvenzanfechtungsrecht,14707,poi,18
632,634885,,632,150,Philipp Graf Lerchenfeld (CDU/CSU),Philipp Graf Lerchenfeld,philipp-graf-lerchenfeld,,cducsu,"Frau Präsidentin! Liebe Kolleginnen und Kollegen! Hohes Haus! Der vorliegende Gesetzentwurf soll den Wirtschaftsverkehr und die Arbeitnehmer von Unsicherheiten im Insolvenzverfahren entlasten, die eben gerade durch die Praxis des Insolvenzverfahrens in den letzten Jahren stark hervorgerufen wurden.

Es ist Ziel der Reform, die Insolvenzanfechtungen in bestimmten Punkten neu zu ordnen, wie von vielen schon dargestellt worden ist, die Gläubiger in ihren Rechten zu stärken, sodass übermäßige Belastungen des Geschäftsverkehrs und gleichzeitig vor allem auch Rechtsunsicherheiten bei Arbeitnehmern und Arbeitnehmerinnen vermieden werden können. Es sollte dabei allerdings nicht aus den Augen verloren werden, dass das große Ziel der Reform der Konkursordnung im Jahre 1994 darin bestand, anstelle der damals üblichen Zerschlagung der in Krise geratenen Unternehmen vor allem die Möglichkeit der Fortführung der Unternehmen in den Vordergrund zu stellen. Dieses Ziel hat sich bewährt, und es sind in den letzten Jahren viele Unternehmen und damit auch viele Arbeitsplätze erhalten worden. Alle Änderungen, die wir an der Insolvenzordnung vornehmen, müssen sich deshalb an diesem Ziel messen lassen.

Während der Insolvenz eines Unternehmens verändert sich grundsätzlich das Recht des Gläubigers auf Vollstreckung seiner Forderung. Ziel ist die Sicherstellung der gleichmäßigen Befriedung aller Gläubiger. Konsequenterweise können deshalb Zahlungen, die vom Schuldner in der Krise geleistet worden sind, zurückgefordert werden, damit die Gelder dann gleichmäßig auf alle Gläubiger verteilt werden können.

Die Frist für diese Rückforderung betrug zehn Jahre. Man muss sich nun einmal vorstellen, was das bedeutet: Im Laufe von zehn Jahren kann es leicht passieren, dass sich ein Unternehmen, das in der Krise war, einigermaßen erholt und dann wieder in Konkurs oder Vermögensverfall gerät. Aber eine Rückforderung konnte, obwohl jeder gewusst hat, dass es dem Unternehmen wieder deutlich besser geht, zehn Jahre lang geltend gemacht werden. Das ist ungerecht, und das führt nicht dazu, dass man mit den Gläubigern vernünftig umgeht.",TOP 20 Insolvenzanfechtungsrecht,14707,speech,18
633,634886,,633,150,,,,,,Beifall bei der CDU/CSU sowie des Abg. Dr. Karl-Heinz Brunner [SPD],TOP 20 Insolvenzanfechtungsrecht,14707,poi,18
634,634887,,634,150,Philipp Graf Lerchenfeld (CDU/CSU),Philipp Graf Lerchenfeld,philipp-graf-lerchenfeld,,cducsu,"Diese Frist wird durch den Gesetzentwurf nun auf vier Jahre verkürzt, und die Kenntnis der drohenden Zahlungsunfähigkeit wird durch die Kenntnis der eingetretenen Zahlungsunfähigkeit ersetzt. § 142 Insolvenzordnung, der die Bargeschäfte betrifft, wird klarer formuliert, und die Arbeitnehmerrechte werden dadurch gestärkt; das ist von allen Vorrednern schon ausführlich dargestellt worden.

Wichtig sind in diesem Zusammenhang natürlich auch die Zinsforderungen, für die nunmehr die allgemeinen Grundsätze gelten und die nicht mehr, wie bisher, eine Sonderstellung erhalten sollen.

Problematisch sehe ich die im Gesetzentwurf vorgesehene Neuregelung des § 131 Insolvenzordnung, nach dem für alle Zwangsvollstreckungen und damit auch für die sogenannten Zwangsgläubiger der Tatbestand der Inkongruenzanforderung entfallen soll. Eine behutsame Änderung des Gesetzes ist das eigentlich nicht.",TOP 20 Insolvenzanfechtungsrecht,14707,speech,18
635,634888,,635,150,,,,,,Beifall des Abg. Dr. Heribert Hirte [CDU/CSU],TOP 20 Insolvenzanfechtungsrecht,14707,poi,18
