,id,profile_url,sequence,sitzung,speaker,speaker_cleaned,speaker_fp,speaker_key,speaker_party,text,top,top_id,type,wahlperiode
0,634253,https://www.abgeordnetenwatch.de/profile/norbert-lammert,0,150,Präsident Dr. Norbert Lammert,Dr. Norbert Lammert,norbert-lammert,1754,,"Nehmen Sie bitte Platz. Die Sitzung ist eröffnet.

Guten Morgen, liebe Kolleginnen und Kollegen! Ich begrüße Sie zur 150. Plenarsitzung dieser Legislaturperiode. Dieses kleine Jubiläum hätte eigentlich eine größere Beteiligung verdient.",TOP 17 Umsetzung der EU-Richtlinie zu Bankkonten,14704,chair,18
1,634254,,1,150,,,,,,Beifall,TOP 17 Umsetzung der EU-Richtlinie zu Bankkonten,14704,poi,18
2,634255,https://www.abgeordnetenwatch.de/profile/norbert-lammert,2,150,Präsident Dr. Norbert Lammert,Dr. Norbert Lammert,norbert-lammert,1754,,"Immerhin können Sie von sich sagen, dabei gewesen zu sein.

Ich rufe Tagesordnungspunkt 17 auf:

Erste Beratung des von der Bundesregierung eingebrachten Entwurfs eines Gesetzes zur Umsetzung der Richtlinie über die Vergleichbarkeit von Zahlungskontoentgelten, den Wechsel von Zahlungskonten sowie den Zugang zu Zahlungskonten mit grundlegenden Funktionen

Drucksache 18/7204

Überweisungsvorschlag:

Finanzausschuss (f)

Innenausschuss

Ausschuss für Recht und Verbraucherschutz

Was man sich darunter vorzustellen hat, wird nicht jedem auf der Besuchertribüne sofort einleuchten, sich aber sicher im Laufe der Debatte erschließen,",TOP 17 Umsetzung der EU-Richtlinie zu Bankkonten,14704,chair,18
3,634256,https://www.abgeordnetenwatch.de/profile/michael-grosse-bromer-2/archive/217189,3,150,Michael Grosse-Brömer [CDU/CSU],Michael Grosse-Brömer,michael-grosse-bromer,1544,cducsu,Im günstigsten Fall!,TOP 17 Umsetzung der EU-Richtlinie zu Bankkonten,14704,poi,18
4,634257,https://www.abgeordnetenwatch.de/profile/norbert-lammert,4,150,Präsident Dr. Norbert Lammert,Dr. Norbert Lammert,norbert-lammert,1754,,"die 77 Minuten dauern soll, es sei denn, jemand macht jetzt einen konkreten Gegenvorschlag. - Darauf war keiner vorbereitet. Also stelle ich dazu Einvernehmen fest.

Ich eröffne die Aussprache und erteile das Wort dem Parlamentarischen Staatssekretär beim Bundesminister der Finanzen, Michael Meister.",TOP 17 Umsetzung der EU-Richtlinie zu Bankkonten,14704,chair,18
5,634258,,5,150,,,,,,Beifall bei der CDU/CSU sowie bei Abgeordneten der SPD,TOP 17 Umsetzung der EU-Richtlinie zu Bankkonten,14704,poi,18
6,634259,https://www.abgeordnetenwatch.de/profile/dr-michael-meister-0,6,150,"Dr. Michael Meister, Parl. Staatssekretär beim Bundesminister der Finanzen",Dr. Michael Meister,michael-meister,1732,,"Herr Präsident! Meine sehr verehrten Damen und Herren! Ich hoffe, dass ich zur Erhellung Ihrer Frage bei allen Beteiligten, die hier anwesend sind und zuhören, beitragen kann. Ich glaube, heute ist ein großer Tag für viele Menschen in unserem Land, denen über dieses Gesetz in Zukunft die Teilhabe am Zahlungsverkehr rechtlich abgesichert und ermöglicht wird. Insoweit ist es, glaube ich, für eine große Zahl von Menschen ein bedeutender Tag.

Die Regierung bittet den Bundestag, die sogenannte Zahlungskontenrichtlinie mit diesem Gesetzentwurf umzusetzen. Wir haben uns im Koalitionsvertrag verpflichtet, eine schnelle, zügige Umsetzung dieser Richtlinie vorzunehmen. Das haben wir auch eingehalten. Deutschland ist das Land unter den Mitgliedstaaten der Europäischen Union, das bei diesem Vorhaben bisher am weitesten vorangeschritten ist. Meine Bitte wäre, dass Sie in den anstehenden Beratungen in Bundestag und Bundesrat dafür Sorge tragen, dass wir das am Ende auch als Erste im Gesetzblatt stehen haben und umsetzen.

Der Entwurf, den das Bundeskabinett verabschiedet hat, ist sowohl auf der Seite der Verbraucher, in den Medien, aber auch von den Vertretern der Rechtswissenschaften begrüßt worden. Ich glaube deshalb, dass wir eine breite Unterstützung haben. Nicht ganz so breit ist die Unterstützung im Bereich der Kreditwirtschaft. Dort ist die Meinung der Beteiligten etwas geteilt. Allerdings zielen die kritischen Meinungsäußerungen weniger in Richtung dieses Gesetzentwurfes, den wir diskutieren, sondern mehr in Richtung des Inhalts der ihm zugrundeliegenden Richtlinie. Diese werden wir bei unseren Gesetzesberatungen allerdings nicht mehr verändern können.

Was sieht die Richtlinie vor? Die Richtlinie sieht zunächst einen Kontrahierungszwang für sogenannte Basiskonten vor. Das heißt, jeder Mensch in diesem Land hat in Zukunft den Anspruch, ein sogenanntes Basiskonto eröffnen zu können. Dieser Anspruch besteht zwar seit Jahren, aber er wird heute im Prinzip nur von den Sparkassen durch das Sparkassenrecht in Deutschland zur Umsetzung gebracht. In Zukunft wird er nicht nur für Sparkassen, sondern für alle Kreditinstitute Gültigkeit haben.",TOP 17 Umsetzung der EU-Richtlinie zu Bankkonten,14704,speech,18
7,634260,,7,150,,,,,,Beifall bei der SPD sowie bei Abgeordneten der CDU/CSU,TOP 17 Umsetzung der EU-Richtlinie zu Bankkonten,14704,poi,18
8,634261,https://www.abgeordnetenwatch.de/profile/dr-michael-meister-0,8,150,"Dr. Michael Meister, Parl. Staatssekretär beim Bundesminister der Finanzen",Dr. Michael Meister,michael-meister,1732,,"Mit dem vorliegenden Gesetzentwurf wollen wir den Zahlungsverkehr innerhalb der Europäischen Union über die dafür notwendigen Konten auf zwei Ebenen verbessern:

Den ersten Pfeiler hatte ich angesprochen: den zivilrechtlichen Anspruch jedes Menschen auf ein sogenanntes Basiskonto. Was ist ein Basiskonto? Es bietet die Möglichkeit, Ein- und Auszahlungen auf ein Bankkonto vorzunehmen, an Geldautomaten Geld abzuheben und einzuzahlen, am Lastschriftverkehr teilzunehmen und Überweisungen zu tätigen - all das, wovon viele Menschen in unserem Lande bisher ausgegrenzt sind.

Es geht um die Frage: Zu welchen Preisen wird diese Leistung bzw. dieses Basiskonto angeboten? Die Transparenz der Kontogebühren wird durch diesen Gesetzentwurf erhöht, und die Vergleichbarkeit der Preise für die verschiedenen Angebote wird verbessert. Im Interesse der Kunden soll auch der Wechsel des Anbieters des Basiskontos - sprich: des Kreditinstituts - erleichtert werden.

Wir haben versucht, das Recht auf ein Basiskonto für alle Menschen als ein Thema zu betrachten, das nicht nur den Verbraucherschutz betrifft. Wir müssen, gerade in diesen Tagen, berücksichtigen, dass es auch Asylbewerber, Wohnsitzlose und Drittstaatsangehörige, die sich innerhalb der EU und damit auch innerhalb Deutschlands befinden, berührt, weil sie nicht automatisch Zugang zu einem Konto haben. Es gibt Schätzungen - natürlich kann man die Betroffenen nicht genau zählen -, nach denen bis zu 1 Million Menschen in unserem Land von diesem Problem betroffen sind. Es ist also ein Thema, das weiter zu fassen ist.

Beim zweiten Pfeiler dieses Gesetzentwurfes geht es um das Funktionieren eines harmonisierten Zahlungsverkehrs im europäischen Binnenmarkt. Ein Zahlungskonto ist ja der Schlüssel, um an unbaren Zahlungsvorgängen überhaupt teilnehmen zu können. Nach der Schaffung eines einheitlichen europäischen Zahlungsverkehrsraums - das Stichwort lautet „SEPA“ - bildet die Zahlungskontenrichtlinie einen weiteren Meilenstein im Hinblick auf den europäischen Zahlungsmarkt. Es gab in diesem Zusammenhang die Empfehlung des Europäischen Parlaments, den Zugang zum Zahlungsmarkt im Privatkundengeschäft zu verbessern. Wir als Bundesregierung versuchen, diese Forderung des Europäischen Parlaments aufzugreifen.

Meine Damen und Herren, was den Kontenwechsel und in diesem Kontext auch die Vergleichbarkeit der Leistungen betrifft, wollen wir jedem Konsumenten in der Europäischen Union die Möglichkeit geben, ohne technische und bürokratische Hürden das Konto zu wählen, das für seine Bedürfnisse am besten geeignet ist. Wir hoffen, dass es entsprechende Websites geben wird, auf denen man sich relativ zügig informieren kann: „Welche Konten gibt es, und wie sehen die Konditionen dieser Konten aus?“, sodass der Verbraucher die Möglichkeit hat, Entgelte und Leistungen zu vergleichen, und Schwierigkeiten beim Wechsel des Anbieters überwinden kann. Heutzutage gibt es in diesem Bereich eine relativ geringe Mobilität. Wir hoffen, dass dieses Gesetz dazu beiträgt, dass die Mobilität steigt. Auch das wäre, glaube ich, im Interesse des Verbrauchers, weil er das Ganze, wenn er die Marktgegebenheiten hinsichtlich der Entgelte und der Kosten überblickt, besser für sich nutzen kann.

Wer ist verpflichtet, ein Basiskonto anzubieten? Ich habe vorhin schon erwähnt, dass es im Sparkassenrecht entsprechende Vorgaben gibt, dass andere Banken davon aber nicht betroffen sind. An dieser Stelle führen wir eine Diskussion über den Identitätsnachweis von Kunden, die ein solches Konto eröffnen wollen. Es geht um die Frage, ob es hier einen Konflikt mit der Geldwäscheprävention gibt. Natürlich ist uns die Geldwäscheprävention ein riesiges Anliegen. Wir sehen hier aber keinerlei Konfliktlage. Wir fordern zwar eine Identifikation, knüpfen sie aber nicht unbedingt an Ausweispapiere, etwa an einen Personalausweis oder Ähnliches; denn solche Papiere können zum Beispiel Drittstaatsangehörige nicht vorlegen. Nichtsdestotrotz ist eine Identifikation sehr wohl notwendig, um einen Beitrag zur Geldwäscheprävention zu leisten. Ich möchte auch darauf hinweisen, dass, wenn man den Zahlungsverkehr über Konten abgewickelt, die Möglichkeiten, Geldwäsche zu betreiben, mit Sicherheit geringer sind als beim Bargeldverkehr. Insofern glauben wir, dass wir das Problem identifiziert haben, mit diesem Gesetzentwurf einen Schritt in die richtige Richtung gehen und an dieser Stelle nicht kontraproduktiv handeln.",TOP 17 Umsetzung der EU-Richtlinie zu Bankkonten,14704,speech,18
9,634262,,9,150,,,,,,Beifall bei der CDU/CSU und der SPD,TOP 17 Umsetzung der EU-Richtlinie zu Bankkonten,14704,poi,18
10,634263,https://www.abgeordnetenwatch.de/profile/dr-michael-meister-0,10,150,"Dr. Michael Meister, Parl. Staatssekretär beim Bundesminister der Finanzen",Dr. Michael Meister,michael-meister,1732,,"Wir versuchen, die möglichen Ablehnungsgründe für die Anbieter eines Basiskontos im Gesetzentwurf klar zu präzisieren. Eine solche Präzisierung gibt es in unserem Rechtssystem bisher nicht. Außerdem setzen wir eine Frist und sagen: Wenn abgelehnt wird, dann muss das binnen einer Frist von zehn Tagen geschehen. - Das kann sich also nicht ewig hinziehen.

Wenn die Einrichtung eines Basiskontos abgelehnt wird, muss also gesagt werden, aufgrund welchen Tatbestands im Gesetz diese Ablehnung erfolgt. Diese möglichen Ablehnungsgründe sind im Gesetz abschließend aufgezählt und klar benannt. Ein solcher Ablehnungsgrund kann zum Beispiel sein, dass der Betreffende schon an anderer Stelle über ein Basiskonto verfügt. Dann ist eine Ablehnung, glaube ich, nachvollziehbar. Ein anderer Ablehnungsgrund wäre zum Beispiel, dass jemand bei dem gleichen Kreditinstitut, bei dem er ein Basiskonto einrichten möchte, in der Vergangenheit durch strafbare Handlungen wegen Geldwäsche aufgefallen ist.

Selbstverständlich ist in einem Rechtsstaat jede Ablehnung auch vor Gerichten überprüfbar. Wir gehen hier aber den Weg, bei einer Ablehnung nicht nur auf den Gerichtsweg zu verweisen - das kann Monate oder auch Jahre dauern -, sondern unabhängig von der gerichtlichen Überprüfung eröffnen wir auch die Möglichkeit, die Ablehnung durch die BaFin überprüfen zu lassen, was schneller geht und möglicherweise auch mit weniger Kosten verbunden ist. Insofern glauben wir, dass man hier tatsächlich im Interesse der Verbraucher zügig zu einer Entscheidung kommt.

Auch für die BaFin setzen wir eine Frist von maximal einem Monat, in dem diese Ablehnungsentscheidung überprüft werden muss. Wenn man die zehn Tage und den einen Monat zusammenrechnet, dann sieht man, dass es auf jeden Fall schnell zu einer Entscheidung kommen wird. Außerdem wird es bei der BaFin keinen Anwaltszwang geben, sodass auch an dieser Stelle für einen potenziellen Kunden keine Kosten entstehen.

Meine Damen und Herren, ich hoffe, dass wir eine gute Beratung zu diesem Gesetzentwurf haben werden. Ich habe es eingangs bereits gesagt: Mit diesem Gesetzentwurf eröffnen wir in Zukunft für die vielen Menschen in unserem Lande, denen heute noch der Zugang zum bargeldlosen Zahlungsverkehr fehlt, einen unbürokratischen und auch kostengünstigen Weg, um daran teilnehmen zu können.

Herr Präsident, ich hoffe, dass ich mit meinem Beitrag ein klein wenig zur Erhellung des Beratungsgegenstandes beigetragen habe.

Vielen Dank.",TOP 17 Umsetzung der EU-Richtlinie zu Bankkonten,14704,speech,18
11,634264,,11,150,,,,,,Beifall bei der CDU/CSU und der SPD,TOP 17 Umsetzung der EU-Richtlinie zu Bankkonten,14704,poi,18
12,634265,https://www.abgeordnetenwatch.de/profile/norbert-lammert,12,150,Präsident Dr. Norbert Lammert,Dr. Norbert Lammert,norbert-lammert,1754,,"Herr Staatssekretär, zumindest ich habe den Eindruck, dass ich es begriffen habe.",TOP 17 Umsetzung der EU-Richtlinie zu Bankkonten,14704,chair,18
13,634266,,13,150,,,,,,Heiterkeit bei Abgeordneten der CDU/CSU und der SPD,TOP 17 Umsetzung der EU-Richtlinie zu Bankkonten,14704,poi,18
14,634267,https://www.abgeordnetenwatch.de/profile/norbert-lammert,14,150,Präsident Dr. Norbert Lammert,Dr. Norbert Lammert,norbert-lammert,1754,,"Ob das repräsentativ ist, kann ich jetzt nicht hinreichend beurteilen.

Es gibt jedenfalls noch weitere vertiefende Erläuterungen, zum Beispiel von der Kollegin Caren Lay, die nun für die Fraktion Die Linke zu diesem Thema Stellung nimmt.",TOP 17 Umsetzung der EU-Richtlinie zu Bankkonten,14704,chair,18
15,634268,,15,150,,,,,,Beifall bei der LINKEN,TOP 17 Umsetzung der EU-Richtlinie zu Bankkonten,14704,poi,18
16,634269,https://www.abgeordnetenwatch.de/profile/caren-lay-0,16,150,Caren Lay (DIE LINKE),Caren Lay,caren-lay,1445,linke,"Meine Damen und Herren! Herr Präsident! Stellen Sie sich ein Leben ohne Girokonto vor. Die Schwierigkeiten fangen damit an, dass man an der Kasse eines Supermarktes bzw. eines Geschäftes nicht einfach mit der EC-Karte bezahlen kann. Man kann auch nicht einfach Geld überweisen und seine Rechnungen per Überweisung begleichen. Man bekommt keinen Handyvertrag und schon gar keine neue Wohnung.

Ein Girokonto ist in der modernen Welt einfach unverzichtbar, und ich finde, es ist ein Skandal, dass immer noch über 700 000 Menschen in Deutschland - Flüchtlinge bzw. Geflüchtete sind hier noch nicht eingerechnet - kein Girokonto haben.",TOP 17 Umsetzung der EU-Richtlinie zu Bankkonten,14704,speech,18
17,634270,,17,150,,,,,,Beifall bei der LINKEN sowie der Abg. Lisa Paus [BÜNDNIS 90/DIE GRÜNEN],TOP 17 Umsetzung der EU-Richtlinie zu Bankkonten,14704,poi,18
18,634271,https://www.abgeordnetenwatch.de/profile/caren-lay-0,18,150,Caren Lay (DIE LINKE),Caren Lay,caren-lay,1445,linke,"Insofern freuen auch wir uns, dass endlich ein Basiskonto für alle kommen soll. Das wird auch höchste Zeit.",TOP 17 Umsetzung der EU-Richtlinie zu Bankkonten,14704,speech,18
19,634272,,19,150,,,,,,Beifall bei der LINKEN sowie bei Abgeordneten des BÜNDNISSES 90/DIE GRÜNEN,TOP 17 Umsetzung der EU-Richtlinie zu Bankkonten,14704,poi,18
20,634273,https://www.abgeordnetenwatch.de/profile/caren-lay-0,20,150,Caren Lay (DIE LINKE),Caren Lay,caren-lay,1445,linke,"Ich spreche an dieser Stelle nicht zum ersten Mal zu diesem Thema. Gestatten Sie mir deshalb einen kleinen Ausflug in die Geschichte der Debatte, die wir hier im Bundestag dazu geführt haben; denn das Recht auf ein Girokonto hätte es natürlich schon sehr viel früher geben können.

Die PDS hat hier im Bundestag 1994 zum ersten Mal ein Girokonto für alle gefordert. Die Linke hat seither sage und schreibe fünf Anträge gestellt, in denen wir ein Recht auf ein Girokonto für alle gefordert haben. Alle diese Anträge wurden hier mit Mehrheit abgelehnt.

Die Argumente, die damals vor allen Dingen die Union ins Feld geführt hat, waren wirklich abenteuerlich. Es waren die üblichen Vorurteile vor allen Dingen gegenüber uns Linken.",TOP 17 Umsetzung der EU-Richtlinie zu Bankkonten,14704,speech,18
21,634274,https://www.abgeordnetenwatch.de/profile/michael-grosse-bromer-2/archive/217189,21,150,Michael Grosse-Brömer [CDU/CSU],Michael Grosse-Brömer,michael-grosse-bromer,1544,cducsu,Die meisten davon sind bestätigt!,TOP 17 Umsetzung der EU-Richtlinie zu Bankkonten,14704,poi,18
22,634275,,22,150,,,,,,Lachen bei der LINKEN,TOP 17 Umsetzung der EU-Richtlinie zu Bankkonten,14704,poi,18
23,634276,https://www.abgeordnetenwatch.de/profile/caren-lay-0,23,150,Caren Lay (DIE LINKE),Caren Lay,caren-lay,1445,linke,"Das alles sei gegen den freien Markt, staatsfixiert usw.

Der ehemalige Kollege Leo Dautzenberg sagte zum Beispiel 2006: Das Girokonto für alle ist geradezu ein Beispiel dafür, dass der Staat nicht alles regeln kann und schon gar nicht besser regeln kann als die Wirtschaftsteilnehmer im Rahmen einer bestimmten Selbstregulierung.

Und der Kollege Brinkhaus entgegnete mir noch vor einigen Jahren an dieser Stelle zu diesem Thema: Es gibt kein Menschenrecht auf ein Girokonto.",TOP 17 Umsetzung der EU-Richtlinie zu Bankkonten,14704,speech,18
24,634277,https://www.abgeordnetenwatch.de/profile/ralph-brinkhaus/archive/214698,24,150,Ralph Brinkhaus [CDU/CSU],Ralph Brinkhaus,ralph-brinkhaus,1526,cducsu,Und dabei bleibe ich!,TOP 17 Umsetzung der EU-Richtlinie zu Bankkonten,14704,poi,18
25,634278,https://www.abgeordnetenwatch.de/profile/caren-lay-0,25,150,Caren Lay (DIE LINKE),Caren Lay,caren-lay,1445,linke,"Meine Damen und Herren, ich finde schon. Und ich freue mich sehr, dass auch Sie heute, so hoffe ich, endlich zur Einsicht gekommen sind.",TOP 17 Umsetzung der EU-Richtlinie zu Bankkonten,14704,speech,18
26,634279,,26,150,,,,,,Beifall bei der LINKEN sowie bei Abgeordneten des BÜNDNISSES 90/DIE GRÜNEN,TOP 17 Umsetzung der EU-Richtlinie zu Bankkonten,14704,poi,18
27,634280,https://www.abgeordnetenwatch.de/profile/caren-lay-0,27,150,Caren Lay (DIE LINKE),Caren Lay,caren-lay,1445,linke,"Es wurden zwar regelmäßig die Zahlen erhoben, wie viele Menschen in Deutschland ohne ein Girokonto sind. Man hat sich aber nicht dazu durchringen können, endlich gesetzlich verbindliche Regeln zu schaffen. Stattdessen hat man mit den Banken eine freiwillige Selbstverpflichtung ausgehandelt. „Freiwillige Selbstverpflichtung“ war jahrelang - das ist es, glaube ich, bis heute - die beliebteste Worthülse vor allen Dingen der Union in der Verbraucherpolitik, die eigentlich nur darüber hinwegtäuschen soll, dass man nicht in der Lage ist, verbindliche Regelungen gesetzlich zu verankern. Ich finde, wir brauchen verbindliche gesetzliche Regelungen für Menschen, die überschuldet sind, für obdachlose Menschen und für Geflüchtete. All jene haben das Recht auf ein Konto.",TOP 17 Umsetzung der EU-Richtlinie zu Bankkonten,14704,speech,18
28,634281,,28,150,,,,,,Beifall bei der LINKEN sowie bei Abgeordneten des BÜNDNISSES 90/DIE GRÜNEN,TOP 17 Umsetzung der EU-Richtlinie zu Bankkonten,14704,poi,18
29,634282,https://www.abgeordnetenwatch.de/profile/caren-lay-0,29,150,Caren Lay (DIE LINKE),Caren Lay,caren-lay,1445,linke,"Auch dieses Mal sind Sie nicht so ganz allein auf diese Idee bzw. zur Einsicht gekommen. Im Gegenteil: Es gibt eine EU-Richtlinie, die auch Deutschland dazu verpflichtet, dieses Recht noch in diesem Jahr umzusetzen. Also - so gut es ist, dass es ein Basiskonto für alle geben wird -: Schmücken Sie sich an dieser Stelle bitte nicht mit fremden Federn!",TOP 17 Umsetzung der EU-Richtlinie zu Bankkonten,14704,speech,18
30,634283,,30,150,,,,,,Beifall bei der LINKEN sowie bei Abgeordneten des BÜNDNISSES 90/DIE GRÜNEN,TOP 17 Umsetzung der EU-Richtlinie zu Bankkonten,14704,poi,18
31,634284,https://www.abgeordnetenwatch.de/profile/caren-lay-0,31,150,Caren Lay (DIE LINKE),Caren Lay,caren-lay,1445,linke,"Bei der Umsetzung gibt es leider einen Pferdefuß bzw. einen entscheidenden Nachteil: Das Konto soll nämlich nicht verbindlich kostenfrei oder gebührenfrei sein. Im Gegenteil: Im Gesetzentwurf ist von marktüblichen Gebühren und Entgelten die Rede. Da schwant mir nichts Gutes. Einige Banken haben ja ein sogenanntes Bürgerkonto auf Grundlage dieser freiwilligen Selbstverpflichtung eingerichtet. Sie verlangen aber stattliche Gebühren in Höhe von 10 Euro im Monat. Es kostet also viel mehr als ein normales Girokonto, hat aber viel weniger Funktionen. Ich finde das wirklich unmöglich.",TOP 17 Umsetzung der EU-Richtlinie zu Bankkonten,14704,speech,18
32,634285,,32,150,,,,,,Beifall bei der LINKEN sowie der Abg. Lisa Paus [BÜNDNIS 90/DIE GRÜNEN],TOP 17 Umsetzung der EU-Richtlinie zu Bankkonten,14704,poi,18
33,634286,https://www.abgeordnetenwatch.de/profile/caren-lay-0,33,150,Caren Lay (DIE LINKE),Caren Lay,caren-lay,1445,linke,"Es wäre möglich gewesen, bereits im Gesetzentwurf die Gebührenfreiheit des Kontos festzulegen oder zumindest die Gebühren zu deckeln. Dafür haben sich auch die Verbraucherschutzminister einstimmig ausgesprochen. Auch das Land Brandenburg hat dafür im Bundesrat gekämpft und gefordert, dass das Konto gebührenfrei sein soll oder dass die Kosten zumindest gedeckelt werden sollen. Leider hat das keine Mehrheit gefunden. Ich finde, das muss im Gesetzgebungsverfahren geändert werden.",TOP 17 Umsetzung der EU-Richtlinie zu Bankkonten,14704,speech,18
34,634287,,34,150,,,,,,Beifall bei der LINKEN,TOP 17 Umsetzung der EU-Richtlinie zu Bankkonten,14704,poi,18
35,634288,https://www.abgeordnetenwatch.de/profile/caren-lay-0,35,150,Caren Lay (DIE LINKE),Caren Lay,caren-lay,1445,linke,"10 Euro im Monat, meine Damen und Herren, mögen in diesem Hohen Hause vielleicht nicht als große Summe gelten. Für Menschen aber, die obdachlos, geflüchtet oder überschuldet sind, sind 10 Euro im Monat jede Menge Geld. Es wird sie im Zweifel davon abhalten, das Recht auf ein Girokonto in Anspruch zu nehmen. Das können wir so nicht stehen lassen. Ich bitte Sie wirklich eindringlich: Lassen Sie uns im Beratungsverfahren gemeinsam dafür sorgen, dass das Basiskonto für alle kostenfrei sein wird. Das sind wir den Betroffenen schuldig.

Vielen Dank.",TOP 17 Umsetzung der EU-Richtlinie zu Bankkonten,14704,speech,18
36,634289,,36,150,,,,,,Beifall bei der LINKEN,TOP 17 Umsetzung der EU-Richtlinie zu Bankkonten,14704,poi,18
37,634290,https://www.abgeordnetenwatch.de/profile/norbert-lammert,37,150,Präsident Dr. Norbert Lammert,Dr. Norbert Lammert,norbert-lammert,1754,,Nächster Redner ist der Parlamentarische Staatssekretär Ulrich Kelber für das Justiz- und Verbraucherschutzministerium. - Bitte schön.,TOP 17 Umsetzung der EU-Richtlinie zu Bankkonten,14704,chair,18
38,634291,,38,150,,,,,,Beifall bei der SPD und der CDU/CSU,TOP 17 Umsetzung der EU-Richtlinie zu Bankkonten,14704,poi,18
39,634292,,39,150,"Ulrich Kelber, Parl. Staatssekretär beim Bundesminister der Justiz und für Verbraucherschutz",Ulrich Kelber,ulrich-kelber,,,"Guten Morgen, Herr Präsident! Meine sehr geehrten Damen und Herren! Es geht um ein zentrales verbraucherpolitisches Thema. Mit dem heute eingebrachten Gesetzentwurf schaffen wir in der Tat erstens einen Anspruch aller Verbraucherinnen und Verbraucher auf ein Girokonto. Zweitens werden die Transparenz von Kontogebühren und die Vergleichbarkeit von Angeboten deutlich verbessert. Und drittens wird auch allen Verbraucherinnen und Verbrauchern der Anbieterwechsel ihres Zahlungskontos erleichtert.

Wir setzen erstens ein Verbraucherrecht durch, und zweitens sorgen wir dafür, dass der Wettbewerb in diesem Bereich in Gang kommt.",TOP 17 Umsetzung der EU-Richtlinie zu Bankkonten,14704,speech,18
40,634293,,40,150,,,,,,Beifall bei der SPD sowie bei Abgeordneten der CDU/CSU,TOP 17 Umsetzung der EU-Richtlinie zu Bankkonten,14704,poi,18
41,634294,,41,150,"Ulrich Kelber, Parl. Staatssekretär beim Bundesminister der Justiz und für Verbraucherschutz",Ulrich Kelber,ulrich-kelber,,,"Frau Lay, aber auch Herr Meister haben es bereits anklingen lassen: In der Tat ist dies - nämlich der Zugang zu bargeldlosem Zahlungsverkehr - ein Thema, das schon lange in Deutschland und Europa diskutiert wird und bei dem die Dringlichkeit größer geworden ist. Es gibt auch in Deutschland eine große Zahl von Menschen, die bisher kein Girokonto bekommen konnten. Dieser Missstand soll durch diesen Gesetzentwurf behoben werden.

Wir folgen damit der Zielsetzung des Koalitionsvertrages, Frau Lay, diese europäische Initiative zu unterstützen - diese Initiativen fallen nicht vom Himmel, sondern müssen beschlossen werden - und sie dann unter Einbeziehung aller Kreditinstitute, nicht nur der Sparkassen, umzusetzen. Ich finde es gut, dass dieses Recht auf gesamteuropäischer Ebene für alle Verbraucherinnen und Verbraucher in Europa in Kraft tritt.

Ich bedanke mich auch für die gute Zusammenarbeit mit dem Finanzministerium. Ich hoffe, das beruht auf Gegenseitigkeit, auch wenn der Kollege Meister das bei seinen erhellenden Ausführungen nicht dargelegt hat.",TOP 17 Umsetzung der EU-Richtlinie zu Bankkonten,14704,speech,18
42,634295,,42,150,,,,,,Beifall bei der SPD,TOP 17 Umsetzung der EU-Richtlinie zu Bankkonten,14704,poi,18
43,634296,https://www.abgeordnetenwatch.de/profile/lothar-binding/archive/217026,43,150,Lothar Binding [Heidelberg] [SPD],Lothar Binding,lothar-binding,1866,spd,Man konnte es aber raushören!,TOP 17 Umsetzung der EU-Richtlinie zu Bankkonten,14704,poi,18
