,id,profile_url,sequence,sitzung,speaker,speaker_cleaned,speaker_fp,speaker_key,speaker_party,text,top,top_id,type,wahlperiode
179,634432,https://www.abgeordnetenwatch.de/profile/alexander-radwan-0,179,150,Alexander Radwan (CDU/CSU),Alexander Radwan,alexander-radwan,1558,cducsu,"In diesem Zusammenhang sind drei Bereiche genannt worden. Das Basiskonto wurde erwähnt. Dann ist der Wechsel zwischen Banken zu nennen. Das ist ein gutes Ziel, ein Ziel, das den Wettbewerb stärkt. Wir werden darüber diskutieren, inwieweit wir es zukünftig mit einem Systembruch zu tun haben; denn die Digitalisierung schreitet hier voran. Zukünftig wird es nicht um die Frage gehen, ob einer beispielsweise von der Sparkasse zu einer Genossenschaftsbank wechselt. Vielmehr werden wir verstärkt darüber diskutieren müssen, ob jemand von einer traditionellen Bank zu einer im digitalen Bereich tätigen Bank wechselt. Es ist sehr wichtig, zu schauen, inwieweit diese Möglichkeit vorhanden ist und inwieweit ein Systembruch notwendig ist oder nicht.

Ich begrüße sehr stark den Vorstoß zum Thema Entgelttransparenz. Ich möchte an die Finanzwirtschaft die mit einer Kritik verbundene Bitte richten: Natürlich gibt es unterschiedliche Produkte, die unterschiedliche Bestandteile aufweisen, aber wichtig ist - das ist schon sehr lange Thema -, eine einfache Information zu geben, eine Information, die Produkte relativ schnell vergleichbar macht. Wenn man dann immer auf verschiedene Pakete verweist, kann man natürlich gut in die Irre führen. Die Finanzwirtschaft hat die Chance, entsprechende Vorschläge zu machen. Bis jetzt habe ich hierzu leider keine Vorschläge gesehen.

Die Geldwäscherichtlinie und -verordnung wurden erwähnt. Ich halte den Aspekt, den der Staatssekretär im Hinblick auf die Geldwäscheverordnung erwähnt hat, für richtig. Trotzdem sollten wir in der weiteren Beratung gerade vor dem Hintergrund der Terrorismusfinanzierung und der in Europa und weltweit aufkommenden höheren Sensibilität dazu kommen, dass wir auch andere Rechtsgebiete prüfen. Wir wollen nicht, dass durch ein Gesetz für einen Bereich in anderen Rechtsbereichen zusätzliche Gefährdungen entstehen. Man muss sich anschauen, inwieweit eine entsprechende Problematik besteht, Stichwort: USA, bzw. inwieweit wir Gefährdungen mit gutem Gewissen ausschließen können.

Ich begrüße es sehr, dass wir die Richtlinie jetzt umsetzen. Sie stammt übrigens aus dem Jahr 2013/2014. Damals hatten wir nicht die jetzt aktuelle Situation mit den Flüchtlingen. Die BaFin hat aus meiner Sicht völlig zu Recht für Erleichterung beim Zugang zu Konten gesorgt. Das ist zu begrüßen. Wir müssen das aber gerade unter dem Gesichtspunkt der Umsetzung der Geldwäscherichtlinie und der Geldwäscheverordnung entsprechend handhaben.

Einen letzten Aspekt kann ich mir nicht verkneifen. Vorhin wurde darüber geredet, dass wir für die neuen Regelungen Werbung machen müssen. Viele Redner haben zu Recht betont, wie wichtig ein Konto ist, um am sozialen Leben in Deutschland teilhaben zu können. Das betrifft die Miete, den Arbeitsvertrag und andere Bereiche. Aber wenn der Druck so groß ist - und das ist unter allen Fraktionen unbestritten -, dann ist, glaube ich, keine Werbung notwendig.

Es ist schlicht und ergreifend so, dass mit diesem Gesetz ein gangbarer Weg gegangen wird. Ihn werden wir jetzt mit den Beratungen eröffnen. Ich denke, wir werden am Schluss ein gutes Gesetz hinbekommen.

Besten Dank.",TOP 17 Umsetzung der EU-Richtlinie zu Bankkonten,14704,speech,18
180,634433,,180,150,,,,,,Beifall bei der CDU/CSU sowie bei Abgeordneten der SPD,TOP 17 Umsetzung der EU-Richtlinie zu Bankkonten,14704,poi,18
181,634434,https://www.abgeordnetenwatch.de/profile/norbert-lammert,181,150,Präsident Dr. Norbert Lammert,Dr. Norbert Lammert,norbert-lammert,1754,,Nächster Redner ist der Kollege Jens Zimmermann für die SPD-Fraktion.,TOP 17 Umsetzung der EU-Richtlinie zu Bankkonten,14704,chair,18
182,634435,,182,150,,,,,,Beifall bei der SPD,TOP 17 Umsetzung der EU-Richtlinie zu Bankkonten,14704,poi,18
183,634436,https://www.abgeordnetenwatch.de/profile/dr-jens-zimmermann-0,183,150,Dr. Jens Zimmermann (SPD),Dr. Jens Zimmermann,jens-zimmermann,1308,spd,"Herr Präsident! Meine Damen und Herren! Lassen Sie mich nach der Rede des Kollegen Radwan noch einmal klarstellen, was wir eigentlich wollen und warum wir dieses Gesetz machen: Wir wollen ein Konto für alle, darum geht es heute Morgen, liebe Kolleginnen und Kollegen.",TOP 17 Umsetzung der EU-Richtlinie zu Bankkonten,14704,speech,18
184,634437,,184,150,,,,,,Beifall bei der SPD und dem BÜNDNIS 90/DIE GRÜNEN,TOP 17 Umsetzung der EU-Richtlinie zu Bankkonten,14704,poi,18
185,634438,https://www.abgeordnetenwatch.de/profile/dr-jens-zimmermann-0,185,150,Dr. Jens Zimmermann (SPD),Dr. Jens Zimmermann,jens-zimmermann,1308,spd,"Über alle anderen Nebenkriegsschauplätze werden wir uns noch in anderen Debatten austauschen können.

Es ist angesprochen worden: Ohne Konto steht man im Alltag vor vielen Problemen, sei es bei der Miete, sei es im Beruf. Aber ich will auch noch einmal auf einen Bereich bzw. eine Personengruppe eingehen, die immer größer wird: Das sind die Geflüchteten, die wir in Deutschland haben. Wir müssen uns doch fragen: Ist es wirklich sinnvoll, dass sie ganz viele Geschäfte mit Bargeld abwickeln müssen? Ist es sinnvoll, dass sie auf Prepaidkarten usw. ausweichen müssen? Aus Gesprächen mit Bürgermeisterinnen und Bürgermeistern und Landrätinnen und Landräten weiß ich, welchen Aufwand das Hantieren mit großen Bargeldsummen für die Behörden und Ämter bedeutet. Auch in einer Unterkunft mit nur 100 Leuten machen kleine Beträge am Ende große Summen aus. Ich glaube, es kann nicht in unserem Interesse sein, dass diese Menschen auch langfristig alles nur bar abwickeln können.",TOP 17 Umsetzung der EU-Richtlinie zu Bankkonten,14704,speech,18
186,634439,,186,150,,,,,,Beifall bei der SPD sowie des Abg. Dr. Wolfgang Strengmann-Kuhn [BÜNDNIS 90/DIE GRÜNEN],TOP 17 Umsetzung der EU-Richtlinie zu Bankkonten,14704,poi,18
187,634440,https://www.abgeordnetenwatch.de/profile/dr-jens-zimmermann-0,187,150,Dr. Jens Zimmermann (SPD),Dr. Jens Zimmermann,jens-zimmermann,1308,spd,"Als jemand, der sich sehr intensiv mit dem Thema Geldwäsche beschäftigt, will ich an dieser Stelle eines ganz klar sagen: Unser Ziel muss es sein, dass möglichst viele Menschen ihre Geschäfte elektronisch abwickeln, über regulierte Konten, weil wir dadurch die Möglichkeit haben, entsprechende Erkenntnisse zu gewinnen und Ermittlungsansätze für die Strafverfolgungsbehörden zu finden. Also ist das Konto für alle eben gerade nichts, was der Geldwäsche Vorschub leistet, sondern ein Instrument zur Geldwäschebekämpfung.",TOP 17 Umsetzung der EU-Richtlinie zu Bankkonten,14704,speech,18
188,634441,,188,150,,,,,,Beifall bei der SPD,TOP 17 Umsetzung der EU-Richtlinie zu Bankkonten,14704,poi,18
189,634442,https://www.abgeordnetenwatch.de/profile/dr-jens-zimmermann-0,189,150,Dr. Jens Zimmermann (SPD),Dr. Jens Zimmermann,jens-zimmermann,1308,spd,"An dieser Stelle will ich auf die Bedenken eingehen, die von einigen Banken jetzt ins Feld geführt werden. Über diese Bedenken muss ich mich sehr wundern. Unsere deutschen Banken in den USA - die USA sind als Problemfeld explizit angesprochen worden - haben doch ein wesentliches Problem: Sie werden in den USA von einem Prozess zum nächsten gezerrt, weil sie sich nicht an die dortigen Gesetze gehalten haben. Ich finde es - das muss ich schon sagen - billig, wenn diese Probleme, die deutsche Banken mit den Strafermittlungs- und Strafverfolgungsbehörden in den USA haben, jetzt herangezogen werden, um zu sagen: Vielleicht bieten wir lieber doch kein Konto für alle an, weil uns in den USA Ärger drohen könnte. - Das halte ich für nicht gerechtfertigt.",TOP 17 Umsetzung der EU-Richtlinie zu Bankkonten,14704,speech,18
190,634443,,190,150,,,,,,Beifall bei der SPD sowie bei Abgeordneten des BÜNDNISSES 90/DIE GRÜNEN,TOP 17 Umsetzung der EU-Richtlinie zu Bankkonten,14704,poi,18
191,634444,https://www.abgeordnetenwatch.de/profile/dr-jens-zimmermann-0,191,150,Dr. Jens Zimmermann (SPD),Dr. Jens Zimmermann,jens-zimmermann,1308,spd,"Wir haben vorgestern im Finanzausschuss auch dieses Thema diskutiert. Ich finde es erstaunlich, dass diejenigen, die dieses Argument vorbringen, auf die Frage: „Welche Gesetze stehen dem denn entgegen?“ mit großem Schweigen antworten. Das zeigt mir, dass das ein vorgeschobenes Argument ist, um dieses Konto nicht anbieten zu müssen.

Wir als SPD-Fraktion werden in den anstehenden Verhandlungen und in der Anhörung sehr genau darauf achten, dass wir uns um die Dinge kümmern, die wirklich wichtig sind: Am Ende sollen alle Menschen Zugang zu einem Basiskonto erhalten. Diese Manöver zielen nur darauf, ökonomisch vermeintlich uninteressante Kunden nicht bedienen zu müssen. Das werden wir verhindern.

Ich will auch eines sagen: Einer der bekanntesten Unternehmensgründer der USA, ein Milliardär, hat syrische Eltern gehabt: Das war Steve Jobs. Vielleicht sollte sich die eine oder andere Bank einmal Gedanken darüber machen, ob nicht der zukünftige Steve Jobs und damit ein potenter Kunde heute unter diesen vermeintlich ökonomisch uninteressanten Kunden ist.

Vielen Dank.",TOP 17 Umsetzung der EU-Richtlinie zu Bankkonten,14704,speech,18
192,634445,,192,150,,,,,,Beifall bei der SPD sowie der Abg. Antje Tillmann [CDU/CSU],TOP 17 Umsetzung der EU-Richtlinie zu Bankkonten,14704,poi,18
193,634446,https://www.abgeordnetenwatch.de/profile/norbert-lammert,193,150,Präsident Dr. Norbert Lammert,Dr. Norbert Lammert,norbert-lammert,1754,,Letzte Rednerin zu diesem Tagesordnungspunkt ist die Kollegin Mechthild Heil für die CDU/CSU-Fraktion.,TOP 17 Umsetzung der EU-Richtlinie zu Bankkonten,14704,chair,18
194,634447,,194,150,,,,,,Beifall bei der CDU/CSU,TOP 17 Umsetzung der EU-Richtlinie zu Bankkonten,14704,poi,18
195,634448,https://www.abgeordnetenwatch.de/profile/mechthild-heil/archive/214814,195,150,Mechthild Heil (CDU/CSU),Mechthild Heil,mechthild-heil,1776,cducsu,"Sehr geehrter Herr Präsident! Liebe Kolleginnen und Kollegen! Die Zeiten, in denen man am Ende des Monats sein Gehalt in einer Lohntüte bekommen hat, sind wirklich schon lange vorbei. Schon seit 1957 kann man sein Gehalt auf ein Girokonto überweisen lassen. Wir haben es heute schon mehrfach gehört: Die Miete, der Strom, aber auch der Vereinsbeitrag und vieles andere mehr werden heute nicht mehr bar bezahlt. Ein eigenes Konto und eine eigene Zahlkarte sind heute eine Selbstverständlichkeit. Ich glaube, die jungen Leute auf der Tribüne können sich das gar nicht anders vorstellen. Dazu kommen natürlich neue Tendenzen: der wachsende Internethandel, aber auch die Digitalisierung der Verwaltungen. Egal ob Sie Steuern zahlen, Steuern nachzahlen, Steuern zurückbekommen oder zum Beispiel Hartz IV bekommen, eigentlich geht alles bargeldlos.

Im meinem Landkreis Mayen-Koblenz - immerhin der größte Landkreis in Rheinland-Pfalz - gibt es heute keinen Hartz-IV-Empfänger mehr, der kein Konto hat. Er ist schwarz regiert. Ich sage Ihnen: Wenn man sich ein bisschen darum gekümmert hat, war das Konto für alle auch schon in der Vergangenheit möglich.

Die Tendenz zum bargeldlosen Zahlen ist steigend. In den Supermärkten und auch an der Tankstelle wird bargeldlos gezahlt. Ich gehöre zu denjenigen, die das Zahlen mit Bargeld nicht abschaffen wollen. Ich bin nach wie vor dafür, dass man Bargeld verwendet, und ich finde, dass es in Deutschland eine gute Entwicklung ist, dass man weiterhin Bargeld benutzt. Aber ich will natürlich nicht, dass manche Verbraucher auf Bargeldgeschäfte beschränkt werden, weil sie kein Konto haben können.

Bislang - wir haben das schon erwähnt - haben die Sparkassen diese Lücke geschlossen, wenn auch nicht in allen Bundesländern. Sie haben vollkommen recht: Auch da ist Berlin ein Negativbeispiel; hier haben die Sparkassen ihre Aufgabe nicht übernommen. Die Europäische Union sagt, dass 1 Million Menschen bei uns in Deutschland kein Konto haben; wir gehen von 700 000 oder 600 000 Menschen aus. Ich will mich über die Zahlen gar nicht streiten. Es sind auf jeden Fall eine Menge Menschen zu viel, die kein eigenes Konto haben. Manch einer von denen will gar kein Konto; diesen Menschen wollen wir auch kein Konto aufzwingen. Aber das ist kein Grund, es denjenigen zu verweigern, die Zugang zu einem Konto benötigen.

Deshalb begrüße ich es, dass wir heute in der ersten Lesung dieses Zahlungskontengesetz auf den Weg bringen. Die Frage ist natürlich: Wer hat jetzt ein Recht, ein solches Basiskonto zu eröffnen? Das ist jeder Verbraucher mit einem rechtmäßigen Aufenthalt in der Europäischen Union. Das sind erstmals aber auch Personen ohne festen Wohnsitz. Das sind alle Asylsuchenden sowie Personen ohne Aufenthaltstitel, die aber aus rechtlichen oder tatsächlichen Gründen nicht abgeschoben werden können.

Bereits 1995 haben sich die Banken in Deutschland selbst zu der Einrichtung eines sogenannten Jedermann-Kontos verpflichtet. Das ist 20 Jahre her. Einige Banken sind dieser Selbstverpflichtung nachgekommen, aber viel zu viele haben sich in diesem Bereich nicht engagiert. Auch wenn jetzt in Deutschland verhältnismäßig viele Menschen ein eigenes Konto haben - wir haben die Zahlen gehört -, muss ich ganz ehrlich sagen: Das Engagement der gesamten Branche hat nicht ausgereicht. Ehrlich gesagt, ich finde es schade, dass gerade eine Branche, die immer mehr und manchmal - auch das sage ich - durchaus berechtigt über zunehmende Reglementierung lamentiert, in diesen 20 Jahren keine Kraft hatte, eine solche Selbstverpflichtung umzusetzen.

Deshalb bessern wir als Gesetzgeber jetzt nach, und zwar auch - Sie haben recht - mithilfe der Europäischen Union. Wir bessern so nach, dass alle Institutsgruppen - dies wurde übrigens schon im Koalitionsvertrag vereinbart - in angemessener Weise beteiligt sind. Das geht nicht ohne gewisse Eingriffe in die Vertragsfreiheit der Banken. Ein Konto für alle bedeutet dann eben auch für alle und nicht nur für den, den sich die Bank aussucht.

Was muss ein Basiskonto alles können? Wir haben es schon gehört: Überweisungen sowie Barein- und -auszahlungen müssen möglich sein, man muss Lastschriften tätigen können, und natürlich müssen auch Kartenzahlungen möglich sein. Die Kosten müssen angemessen, marktüblich und verhältnismäßig sein. Ich finde es richtig, dass es nicht kostenlos ist. Die Bedingungen für das Basiskonto dürfen nicht schlechter sein als die bei anderen Zahlungskonten des gleichen Institutes.

Ein Basiskonto - das möchte ich an dieser Stelle auch ganz klar sagen - ist keinesfalls ein Freifahrtschein zum Leben auf Pump. Denn es besteht lediglich ein Recht auf ein Guthabenkonto. Das Recht auf einen Kredit oder auf einen Disporahmen hat man damit nicht. Es geht also wirklich nur um die Grundfunktionen eines Kontos. Alles andere ist freiwillig: Überziehungskredite müssen nach wie vor frei zwischen der Bank und dem Kunden ausgehandelt werden. Wenn es dann zu Problemen mit dem Kreditinstitut kommt, kann der Kunde sich auf drei Wegen Hilfe suchen:

Erstens. Er kann sich an die BaFin wenden. Die Bundesanstalt für Finanzdienstleistungsaufsicht kann dann als zuständige Behörde den Anspruch des Verbrauchers auf ein Basiskonto mit den Mitteln eines Verwaltungsaktes durchsetzen, natürlich nur, wenn auch keine Ablehnungsgründe vorliegen.

Zweitens. Wie immer kann der Verbraucher den ordentlichen Rechtsweg beschreiten.

Drittens. Er kann sich für eine alternative Streitbeilegung - wir sprechen von Schlichtungsstellen - entscheiden. Die Schlichtungsverfahren, die dann bei der BaFin angesiedelt sind, sind für den Kunden kostenlos.

Sie sehen daran, meine Damen und Herren: Wir schreiben nicht einfach nur die Ziele in ein Gesetz hinein, nein, wir sorgen auch dafür, dass die Verbraucher ihr Recht auch wirklich durchsetzen können.

Und ein weiteres Thema packen wir an: Wir erleichtern den Wechsel zwischen den Kreditinstituten. Bisher war es wirklich eine große Arbeit und war mit gewissen Hürden und Mühen verbunden, die Bank zu wechseln; der eine oder andere von uns oder von Ihnen wird es schon einmal gemacht haben. Das soll jetzt leichter werden. Dass Lastschriften, Auf- und Abbuchungen und Daueraufträge einzeln geändert und übertragen werden mussten, das ändern wir nun. Künftig wird die übertragende Bank verpflichtet, Lastschriften und dergleichen an die empfangende Bank zu melden. Ich gehe wirklich davon aus, dass wir mit diesem Mittel bald deutlich mehr unzufriedene Kunden dazu bewegen können, von dem Recht Gebrauch zu machen und die Bank zu wechseln. Das ist gut so; denn das erhöht noch einmal den Wettbewerb unter den Banken.

Den Wettbewerb zwischen den Banken zugunsten der Verbraucher fördern wir auch beim Thema „Vergleichbarkeit von Zahlungsentgelten“. Wie kommt - auch das war vorhin schon die Frage - der Kunde an diese Informationen? Klar, zuerst einmal ist die Bank in der Verpflichtung - das haben wir auch schon geregelt -, die Informationen an den Kunden zu geben. Aber gleichzeitig können Verbraucher auch auf einer zertifizierten Webseite - zumindest wollen wir das so - diese Informationen in Zukunft abrufen.

Insgesamt kann ich sagen: Das wird ein gelungenes Gesetz, wenn wir es dann nach der dritten Lesung verabschiedet haben. Auch mit diesem Gesetz steht die CDU/CSU für klare Kundeninformation. Wir stehen für mehr Wettbewerb zwischen den Kreditinstituten, und wir stärken auch hier einmal wieder die Marktmacht der Verbraucher. Ein guter Schritt in Richtung „Verbraucher auf Augenhöhe“.

Vielen Dank.",TOP 17 Umsetzung der EU-Richtlinie zu Bankkonten,14704,speech,18
196,634449,,196,150,,,,,,Beifall bei der CDU/CSU sowie bei Abgeordneten der SPD,TOP 17 Umsetzung der EU-Richtlinie zu Bankkonten,14704,poi,18
197,634450,https://www.abgeordnetenwatch.de/profile/norbert-lammert,197,150,Präsident Dr. Norbert Lammert,Dr. Norbert Lammert,norbert-lammert,1754,,"Ich schließe die Aussprache.

Interfraktionell wird die Überweisung des Gesetzentwurfes auf Drucksache 18/7204 an die in der Tagesordnung aufgeführten Ausschüsse vorgeschlagen. Gibt es dazu andere Vorschläge? - Das ist nicht der Fall. Dann ist die Überweisung so beschlossen.

Dann kann ich nun Tagesordnungspunkt 18 aufrufen:

Beratung des Antrags der Abgeordneten Harald Ebner, Steffi Lemke, Nicole Maisch, weiterer Abgeordneter und der Fraktion BÜNDNIS 90/DIE GRÜNEN

Pestizide reduzieren - Mensch und Umwelt schützen

Drucksache 18/7240

Überweisungsvorschlag:

Ausschuss für Ernährung und Landwirtschaft (f)

Ausschuss für Gesundheit

Ausschuss für Umwelt, Naturschutz, Bau und Reaktorsicherheit

Nach einer interfraktionellen Vereinbarung sind auch für diese Aussprache 77 Minuten vorgesehen. - Das scheint einvernehmlich zu sein. Also können wir so verfahren.

Ich eröffne die Aussprache und erteile dem Kollegen Anton Hofreiter für die Antragsteller das Wort.",TOP 17 Umsetzung der EU-Richtlinie zu Bankkonten,14704,chair,18
198,634451,https://www.abgeordnetenwatch.de/profile/dr-anton-hofreiter-0,198,150,Dr. Anton Hofreiter (BÜNDNIS 90/DIE GRÜNEN),Dr. Anton Hofreiter,anton-hofreiter,1793,gruene,"Sehr geehrter Herr Präsident! Liebe Kolleginnen und Kollegen! Glyphosat ist das am häufigsten in Deutschland verwendete Ackergift. Allein 5 Millionen Liter des reinen Wirkstoffes werden Jahr für Jahr auf unsere Felder und Äcker ausgebracht. Die WHO, die Weltgesundheitsorganisation, hat in ihrer jüngsten Untersuchung Glyphosat als wahrscheinlich krebserregend eingestuft. Das ist die zweithöchste Stufe, die die WHO überhaupt kennt. Wenn man weiß, wie vorsichtig, wie konservativ, wie zurückhaltend die WHO bei diesen Einstufungen agiert, dann heißt das: Glyphosat ist nach menschlichem Ermessen in Wirklichkeit krebserregend.",TOP 18 Pestizide,14705,speech,18
199,634452,,199,150,,,,,,Beifall beim BÜNDNIS 90/DIE GRÜNEN,TOP 18 Pestizide,14705,poi,18
200,634453,https://www.abgeordnetenwatch.de/profile/dr-anton-hofreiter-0,200,150,Dr. Anton Hofreiter (BÜNDNIS 90/DIE GRÜNEN),Dr. Anton Hofreiter,anton-hofreiter,1793,gruene,"Glyphosat findet sich inzwischen in den Körpern vieler Menschen, nicht nur derer, die in der Nähe von Äckern wohnen, sondern auch derer, die in den Innenstädten beispielsweise von München oder Berlin wohnen. Woran liegt das? Das liegt schlichtweg daran, dass Glyphosat vom Acker in die Lebensmittel und so in unsere Körper kommt. Es ist endlich an der Zeit, dass die Große Koalition, dass ihr zuständiger Minister aufhört, diese wissenschaftlichen Erkenntnisse zu ignorieren. Handeln Sie endlich; denn es ist überfällig!",TOP 18 Pestizide,14705,speech,18
201,634454,,201,150,,,,,,Beifall beim BÜNDNIS 90/DIE GRÜNEN,TOP 18 Pestizide,14705,poi,18
202,634455,https://www.abgeordnetenwatch.de/profile/dr-anton-hofreiter-0,202,150,Dr. Anton Hofreiter (BÜNDNIS 90/DIE GRÜNEN),Dr. Anton Hofreiter,anton-hofreiter,1793,gruene,"Aber, liebe Kolleginnen und Kollegen, es ist sogar noch schlimmer. Was hat denn die Bundesregierung trotz dieser Erkenntnis getan? Sie hat das Gegenteil von dem getan, was notwendig ist, und hat in Brüssel mit ihrer ganzen Lobbykraft darauf hingewirkt, dass die Zulassung für Glyphosat noch einmal um volle zehn Jahre verlängert wird. Das ist angesichts dieser Erkenntnisse mehr als skandalös.",TOP 18 Pestizide,14705,speech,18
203,634456,,203,150,,,,,,Beifall beim BÜNDNIS 90/DIE GRÜNEN sowie bei Abgeordneten der LINKEN,TOP 18 Pestizide,14705,poi,18
204,634457,https://www.abgeordnetenwatch.de/profile/dr-anton-hofreiter-0,204,150,Dr. Anton Hofreiter (BÜNDNIS 90/DIE GRÜNEN),Dr. Anton Hofreiter,anton-hofreiter,1793,gruene,"Liebe Kolleginnen und Kollegen, wenn man sich in Brüssel umhört, dann beschleicht einen der Verdacht, dass das überhaupt nichts mit wissenschaftlicher Erkenntnis zu tun hat und auch nicht allein mit der Lobbykraft der Agroindustrie oder der deutschen Bundesregierung, sondern dass das schon ein peinlicher Vorgriff auf die TTIP-Verhandlungen ist; denn in den USA wird Glyphosat noch umfangreicher verwendet als in Deutschland. Glyphosat kommt bei uns - zum Glück - nur zum Einsatz, bevor die Nutzpflanzen keimen; denn es ist ein Totalherbizid, das nach der Ernte eingesetzt wird. Aber in den USA gibt es gentechnisch veränderte, herbizidresistente Pflanzen. Auch in anderen Ländern wie Brasilien und Argentinien werden in großem Umfang glyphosatresistente Pflanzen eingesetzt. Deshalb liegt der Verdacht auf der Hand, dass Sie bereits im Vorfeld der Verhandlungen wissenschaftliche Erkenntnisse ignorieren und sich hier entsprechend dem Diktat unterwerfen.",TOP 18 Pestizide,14705,speech,18
205,634458,,205,150,,,,,,Beifall beim BÜNDNIS 90/DIE GRÜNEN,TOP 18 Pestizide,14705,poi,18
206,634459,https://www.abgeordnetenwatch.de/profile/katharina-landgraf-0,206,150,Katharina Landgraf [CDU/CSU],Katharina Landgraf,katharina-landgraf,1755,cducsu,Jetzt wird es gerade langsam spanisch!,TOP 18 Pestizide,14705,poi,18
207,634460,https://www.abgeordnetenwatch.de/profile/manfred-grund/archive/213924,207,150,Manfred Grund [CDU/CSU],Manfred Grund,manfred-grund,1814,cducsu,Konstruiert! Verdammt konstruiert!,TOP 18 Pestizide,14705,poi,18
208,634461,https://www.abgeordnetenwatch.de/profile/dr-anton-hofreiter-0,208,150,Dr. Anton Hofreiter (BÜNDNIS 90/DIE GRÜNEN),Dr. Anton Hofreiter,anton-hofreiter,1793,gruene,"Das Bittere ist, dass der Pestizidverbrauch in Deutschland trotz der problematischen Auswirkungen auf Natur und Gesundheit steigt. Wir sind inzwischen bei einem Pestizideinsatz von über 100 000 Tonnen pro Jahr. Das sind umgerechnet 270 Tonnen, die täglich auf unsere Felder und Äcker gespritzt werden.",TOP 18 Pestizide,14705,speech,18
209,634462,https://www.abgeordnetenwatch.de/profile/friedrich-ostendorff/archive/215152,209,150,Friedrich Ostendorff [BÜNDNIS 90/DIE GRÜNEN],Friedrich Ostendorff,friedrich-ostendorff,1714,gruene,Skandalös!,TOP 18 Pestizide,14705,poi,18
210,634463,https://www.abgeordnetenwatch.de/profile/dr-anton-hofreiter-0,210,150,Dr. Anton Hofreiter (BÜNDNIS 90/DIE GRÜNEN),Dr. Anton Hofreiter,anton-hofreiter,1793,gruene,"Diese Gifte sind nicht nur krebserregend, sondern auch hormonschädigend. Da sie interagieren und sich ihre Effekte addieren und multiplizieren, sind viele der gesundheitsschädlichen Auswirkungen schwer abzuschätzen; das ist noch nicht erforscht. Sorgen Sie deshalb nach dem Vorsorgeprinzip endlich dafür, dass diese Gesundheitsschäden ausbleiben, dass diese Schweinereien abgestellt werden!",TOP 18 Pestizide,14705,speech,18
211,634464,,211,150,,,,,,Beifall beim BÜNDNIS 90/DIE GRÜNEN,TOP 18 Pestizide,14705,poi,18
212,634465,https://www.abgeordnetenwatch.de/profile/manfred-grund/archive/213924,212,150,Manfred Grund [CDU/CSU],Manfred Grund,manfred-grund,1814,cducsu,Das Angstprinzip ist das!,TOP 18 Pestizide,14705,poi,18
213,634466,https://www.abgeordnetenwatch.de/profile/dr-anton-hofreiter-0,213,150,Dr. Anton Hofreiter (BÜNDNIS 90/DIE GRÜNEN),Dr. Anton Hofreiter,anton-hofreiter,1793,gruene,"Nehmen wir als Beispiel Äpfel. Äpfel sind ein eigentlich hervorragendes und gesundes Obst, das bei uns einheimisch ist. Äpfel werden bei uns bis zu 24-mal mit 17 unterschiedlichen Mitteln gespritzt. Es ist daher überhaupt nicht erstaunlich, dass konventionelles Obst zum Teil 350-mal höher belastet ist als Bioobst. Und was unternehmen Sie? Was tun Sie, um die Verbraucher zu schützen?",TOP 18 Pestizide,14705,speech,18
214,634467,https://www.abgeordnetenwatch.de/profile/friedrich-ostendorff/archive/215152,214,150,Friedrich Ostendorff [BÜNDNIS 90/DIE GRÜNEN],Friedrich Ostendorff,friedrich-ostendorff,1714,gruene,Gar nichts!,TOP 18 Pestizide,14705,poi,18
