,id,profile_url,sequence,sitzung,speaker,speaker_cleaned,speaker_fp,speaker_key,speaker_party,text,top,top_id,type,wahlperiode
74,533553,https://www.abgeordnetenwatch.de/profile/rainer-spiering/archive/216665,74,166,Rainer Spiering (SPD),Rainer Spiering,rainer-spiering,1383.0,spd,"Frau Ministerin, Sie haben die „Qualitätsoffensive Lehrerbildung“ angesprochen. Ich würde gerne von Ihnen wissen, ob alle Mittel aus dieser Qualitätsoffensive abgeflossen sind, wenn nein, wie groß die Restbestände sind, und ob sich die Bundesregierung vorstellen kann, diese Mittel speziell für die Ausbildung von Berufsschullehrern mit Blick auf die Kernkompetenz Methodik/Didaktik auszuloben.",TOP 1 Befragung der Bundesregierung,14827,speech,18
75,533554,,75,166,"Dr. Johanna Wanka, Bundesministerin für Bildung und Forschung",Dr. Johanna Wanka,johanna-wanka,,,"Bei der Qualitätsoffensive gehen gerade die Projekte der zweiten Bewilligungsrunde an den Start. Danach muss geschaut werden: Wie viele Mittel sind abgeflossen, und welche Maßnahmen werden nach der Zwischenevaluation weiterhin gefördert? Ich gehe davon aus, dass wir eine bestimmte Summe zur Verfügung haben werden. Die Überlegung, die Ausbildung von Berufsschullehrern bzw. von Lehrern im Allgemeinen eventuell besonders in den Fokus zu nehmen, wird in unserem Haus angestellt.",TOP 1 Befragung der Bundesregierung,14827,speech,18
76,533555,https://www.abgeordnetenwatch.de/profile/norbert-lammert,76,166,Präsident Dr. Norbert Lammert,Dr. Norbert Lammert,norbert-lammert,1754.0,,Letzte Nachfrage zu diesem Themenkomplex: Kai Gehring.,TOP 1 Befragung der Bundesregierung,14827,chair,18
77,533556,https://www.abgeordnetenwatch.de/profile/kai-gehring/archive/215144,77,166,Kai Gehring (BÜNDNIS 90/DIE GRÜNEN),Kai Gehring,kai-gehring,1821.0,gruene,"Vielen Dank. - Frau Ministerin, in dieser Woche ist der bundesweite Girls’ and Boys’ Day. Was unternimmt die Bundesregierung eigentlich jenseits dieses symbolischen Aktionstages, um das nach wie vor sehr geschlechtsspezifische Ausbildungs- und Berufswahlverhalten von Mädchen und Jungen aufzubrechen und beiden Geschlechtern ein möglichst breites Spektrum an Ausbildungs- und Jobmöglichkeiten aufzuzeigen? Wir glauben, das würde beim Matching helfen, und das wäre auch ein Beitrag dazu, kein Talent zurückzulassen.",TOP 1 Befragung der Bundesregierung,14827,speech,18
78,533557,,78,166,"Dr. Johanna Wanka, Bundesministerin für Bildung und Forschung",Dr. Johanna Wanka,johanna-wanka,,,"Ganz klar: Das ist ein Instrument. Ich zum Beispiel bin morgen im Naturkundemuseum,",TOP 1 Befragung der Bundesregierung,14827,speech,18
79,533558,https://www.abgeordnetenwatch.de/profile/kai-gehring/archive/215144,79,166,Kai Gehring [BÜNDNIS 90/DIE GRÜNEN],Kai Gehring,kai-gehring,1821.0,gruene,Viel Spaß!,TOP 1 Befragung der Bundesregierung,14827,poi,18
80,533559,,80,166,"Dr. Johanna Wanka, Bundesministerin für Bildung und Forschung",Dr. Johanna Wanka,johanna-wanka,,,"und zwar gemeinsam mit jungen Frauen, die sich dafür interessieren. Unser Haus hat im Rahmen seiner 20 000 Projekte ein großes Paket von Maßnahmen zusammengestellt - ich stelle es Ihnen gerne schriftlich zur Verfügung -, um die MINT-Fächer zu stärken und Frauen mehr als bisher für eine berufliche Ausbildung oder ein Studium in diesem Bereich zu motivieren. Ich kann diese Maßnahmen hier nicht alle aufzählen. Ich kann Ihnen aber einen Erfolg im Bereich der akademischen Ausbildung nennen: Mittlerweile sind 40 Prozent aller Bachelorstudenten der MINT-Fächer Frauen; im OECD-Durchschnitt sind es 26 Prozent.

Auf dem Gebiet der beruflichen Ausbildung ist die Situation leider eine andere. Gerade bei den technischen Berufen haben wir einen vergleichbaren Erfolg bisher noch nicht erzielt. Das Interesse ist noch zu gering, und der Anteil junger Frauen in der beruflichen Ausbildung ist hier viel geringer als im akademischen Bereich. Deswegen ist es in meinem Haus ein Schwerpunkt, die Dinge, die bei der akademischen Ausbildung gut funktioniert haben, genau zu analysieren, um herauszufinden, was man mit Blick auf die berufliche Bildung tun kann, vor allen Dingen im Hinblick auf die Mädchen. Mit Blick auf Studentinnen der Informatik und solche Frauen, die in diesem Bereich eine berufliche Ausbildung machen, gehen wir das jetzt an. Aber hier ist, wie gesagt, noch mehr zu tun als im akademischen Bereich.",TOP 1 Befragung der Bundesregierung,14827,speech,18
81,533560,https://www.abgeordnetenwatch.de/profile/norbert-lammert,81,166,Präsident Dr. Norbert Lammert,Dr. Norbert Lammert,norbert-lammert,1754.0,,"Vielen Dank, Frau Ministerin, für Ihren Bericht und die Beantwortung der Fragen.

Ich hatte bei der Nachfrage des Kollegen Gehring einen Augenblick lang die Sorge, dass er mit Blick auf den Boys’ and Girls’ Day fragen wollte, ob nicht auch dies gesetzliche Feiertage werden müssten,",TOP 1 Befragung der Bundesregierung,14827,chair,18
82,533561,,82,166,,,,,,Heiterkeit,TOP 1 Befragung der Bundesregierung,14827,poi,18
83,533562,https://www.abgeordnetenwatch.de/profile/kai-gehring/archive/215144,83,166,Kai Gehring [BÜNDNIS 90/DIE GRÜNEN],Kai Gehring,kai-gehring,1821.0,gruene,"Die dann nachzuholen wären, ja!",TOP 1 Befragung der Bundesregierung,14827,poi,18
84,533563,https://www.abgeordnetenwatch.de/profile/norbert-lammert,84,166,Präsident Dr. Norbert Lammert,Dr. Norbert Lammert,norbert-lammert,1754.0,,"und zwar jeweils gesondert. Ich bin vollständig beruhigt, dass uns diese Frage, jedenfalls heute, nicht als akuter Handlungsbedarf erreicht.

Ich darf jetzt fragen, ob es weitere Fragen an die Bundesregierung gibt. - Bitte schön, Frau Haßelmann.",TOP 1 Befragung der Bundesregierung,14827,chair,18
85,533564,https://www.abgeordnetenwatch.de/profile/britta-haselmann-0,85,166,Britta Haßelmann (BÜNDNIS 90/DIE GRÜNEN),Britta Haßelmann,britta-haßelmann,1807.0,gruene,"Vielen Dank, Herr Präsident. - Ich habe eine Frage an die Bundesregierung in Bezug auf einen möglichen Gesetzentwurf zur Abschaffung des § 103 Strafgesetzbuch, in dem es um die sogenannte Majestätsbeleidigung geht.

Die Bundeskanzlerin hat ja letzte Woche in einer Pressekonferenz angekündigt, dass sie beabsichtigt, den § 103 Strafgesetzbuch - Majestätsbeleidigung - jetzt sehr schnell und sehr zeitnah abzuschaffen. Ich habe daneben öffentliche Äußerungen von Herrn Kauder, dem Fraktionsvorsitzenden, dazu gelesen, und auch von Herrn Oppermann war zu vernehmen, dass er hier initiativ werden möchte.

Meine Frage an die Bundesregierung lautet deshalb: Wann gedenken Sie, den Gesetzentwurf zeitnah in den Deutschen Bundestag einzubringen?",TOP 1 Befragung der Bundesregierung,14827,speech,18
86,533565,https://www.abgeordnetenwatch.de/profile/dr-philipp-lengsfeld,86,166,Dr. Philipp Lengsfeld [CDU/CSU],Dr. Philipp Lengsfeld,philipp-lengsfeld,1287.0,cducsu,"Das sind Fragen, die man gleich selbst beantworten kann!",TOP 1 Befragung der Bundesregierung,14827,poi,18
87,533566,,87,166,"Dr. Johanna Wanka, Bundesministerin für Bildung und Forschung",Dr. Johanna Wanka,johanna-wanka,,,Das war nicht Gegenstand der Beratungen im Kabinett.,TOP 1 Befragung der Bundesregierung,14827,speech,18
88,533567,https://www.abgeordnetenwatch.de/profile/britta-haselmann-0,88,166,Britta Haßelmann [BÜNDNIS 90/DIE GRÜNEN],Britta Haßelmann,britta-haßelmann,1807.0,gruene,"Ich habe nicht danach gefragt, ob es im Kabinett behandelt worden ist!",TOP 1 Befragung der Bundesregierung,14827,poi,18
89,533568,,89,166,Gegenruf der CDU/CSU,der CDU/CSU,der-cdu-csu,,cducsu,Deswegen kann sie es trotzdem sagen!,TOP 1 Befragung der Bundesregierung,14827,poi,18
90,533569,,90,166,"Dr. Johanna Wanka, Bundesministerin für Bildung und Forschung",Dr. Johanna Wanka,johanna-wanka,,,"- Ja, das darf ich doch.",TOP 1 Befragung der Bundesregierung,14827,speech,18
91,533570,https://www.abgeordnetenwatch.de/profile/norbert-lammert,91,166,Präsident Dr. Norbert Lammert,Dr. Norbert Lammert,norbert-lammert,1754.0,,"Im Rahmen unserer Geschäftsordnung ist gefragt worden, ob es unabhängig von den heutigen Themen in der Sitzung des Kabinetts Überlegungen oder gar Festlegungen der Bundesregierung dazu gibt.",TOP 1 Befragung der Bundesregierung,14827,chair,18
92,533571,https://www.abgeordnetenwatch.de/profile/kai-gehring/archive/215144,92,166,Kai Gehring [BÜNDNIS 90/DIE GRÜNEN],Kai Gehring,kai-gehring,1821.0,gruene,Oder auf dem Flur vom Kabinettsaal!,TOP 1 Befragung der Bundesregierung,14827,poi,18
93,533572,,93,166,"Dr. Johanna Wanka, Bundesministerin für Bildung und Forschung",Dr. Johanna Wanka,johanna-wanka,,,"Bei der Abschaffung des § 103 StGB geht es ja auch um die Fragen, wie das Verhältnis zum Bundespräsidenten ist usw. Hier sind wir in einer intensiven Diskussion und Abstimmung. Es ist unsere Absicht, alle Folgerungen genau zu bedenken, bevor wir an eine Änderung des Gesetzes gehen.",TOP 1 Befragung der Bundesregierung,14827,speech,18
94,533573,https://www.abgeordnetenwatch.de/profile/norbert-lammert,94,166,Präsident Dr. Norbert Lammert,Dr. Norbert Lammert,norbert-lammert,1754.0,,Herr Kollege Ströbele.,TOP 1 Befragung der Bundesregierung,14827,chair,18
95,533574,https://www.abgeordnetenwatch.de/profile/hans-christian-strobele,95,166,Hans-Christian Ströbele (BÜNDNIS 90/DIE GRÜNEN),Hans-Christian Ströbele,hans-christian-strobele,1578.0,gruene,"Danke, Herr Präsident. - Ich habe dazu eine Ergänzungsfrage.

Mindestens genauso interessant wie die Frage, wann das eingebracht wird, ist ja die Frage, was in dem Gesetzentwurf dazu stehen wird, ab wann dieses Gesetz in Kraft tritt. Wird bei den Überlegungen, die Sie ja in den Raum gestellt haben, auch berücksichtigt, ob das Verfahren gegen Herrn Böhmermann zu diesem Zeitpunkt schon zu Ende ist, weshalb ihm die Aufhebung der Bestimmung nicht mehr zugutekommen kann, oder geht das seinen normalen rechtlichen Gang, sodass möglicherweise auch Herr Böhmermann noch in den Genuss der Aufhebung dieses Paragrafen kommen kann?",TOP 1 Befragung der Bundesregierung,14827,speech,18
96,533575,,96,166,"Dr. Johanna Wanka, Bundesministerin für Bildung und Forschung",Dr. Johanna Wanka,johanna-wanka,,,"Sehr geehrter Herr Abgeordneter, wir haben über diesen Punkt noch nicht entschieden.",TOP 1 Befragung der Bundesregierung,14827,speech,18
97,533576,https://www.abgeordnetenwatch.de/profile/norbert-lammert,97,166,Präsident Dr. Norbert Lammert,Dr. Norbert Lammert,norbert-lammert,1754.0,,"Ich darf im Übrigen darauf aufmerksam machen: Auch der Gesetzgeber wird sich mit diesem Text beschäftigen müssen. - Frau Künast, vielleicht können Sie das für den Rechtsausschuss auch noch einmal unterstreichen.",TOP 1 Befragung der Bundesregierung,14827,chair,18
98,533577,,98,166,,,,,,Heiterkeit bei Abgeordneten der CDU/CSU,TOP 1 Befragung der Bundesregierung,14827,poi,18
99,533578,https://www.abgeordnetenwatch.de/profile/renate-kunast/archive/215098,99,166,Renate Künast (BÜNDNIS 90/DIE GRÜNEN),Renate Künast,renate-kunast,1759.0,gruene,"Danke für den Hinweis, Herr Präsident. Natürlich werden dazu am Ende intensivste Beratungen im Rechtsausschuss dieses Hauses und drei Lesungen stattfinden müssen. Das war aber gar nicht der Kern meiner Frage.

Frau Wanka hat gesagt, sie würden das alles beraten. Die Kanzlerin hat aber selber verlautbart bzw. unwidersprochen verlautbaren lassen, dass sie eine Aufhebung des § 103 StGB will, in dem es um die sogenannte Majestätsbeleidigung geht. Dies solle aber erst 2018 in Kraft treten.

Daran schließt sich ja die Frage an: Soll das so sein, oder ist das noch offen in der Diskussion, sodass man das unter gehöriger Beteiligung des Rechtsausschusses auch innerhalb von drei bis vier Monaten - selbst inklusive einer Anhörung - entscheiden kann? Ich frage danach, weil ich jetzt gerne einmal wissen möchte, ob 2018 stimmt oder ob Sie das hier widerrufen.",TOP 1 Befragung der Bundesregierung,14827,speech,18
100,533579,,100,166,,,,,,Lachen bei Abgeordneten der CDU/CSU,TOP 1 Befragung der Bundesregierung,14827,poi,18
101,533580,https://www.abgeordnetenwatch.de/profile/renate-kunast/archive/215098,101,166,Renate Künast (BÜNDNIS 90/DIE GRÜNEN),Renate Künast,renate-kunast,1759.0,gruene,"Wenn es stimmen sollte, dann stellt sich natürlich die Frage: Warum sollte aus heutiger Sicht 2018 etwas richtig sein, was 2016 noch nicht richtig sein soll, nämlich die Abschaffung?",TOP 1 Befragung der Bundesregierung,14827,speech,18
102,533581,https://www.abgeordnetenwatch.de/profile/norbert-lammert,102,166,Präsident Dr. Norbert Lammert,Dr. Norbert Lammert,norbert-lammert,1754.0,,"Frau Ministerin, es hat selten die Gelegenheit zu Widerrufen gegeben. Das ist eine seltene Vorlage.",TOP 1 Befragung der Bundesregierung,14827,chair,18
103,533582,,103,166,"Dr. Johanna Wanka, Bundesministerin für Bildung und Forschung",Dr. Johanna Wanka,johanna-wanka,,,"Ich wollte nur sagen: Netter Versuch, aber meine Antwort ist klar.",TOP 1 Befragung der Bundesregierung,14827,speech,18
104,533583,https://www.abgeordnetenwatch.de/profile/kai-gehring/archive/215144,104,166,Kai Gehring [BÜNDNIS 90/DIE GRÜNEN],Kai Gehring,kai-gehring,1821.0,gruene,"Nein, gar nicht! Welche Antwort?",TOP 1 Befragung der Bundesregierung,14827,poi,18
105,533584,,105,166,"Dr. Johanna Wanka, Bundesministerin für Bildung und Forschung",Dr. Johanna Wanka,johanna-wanka,,,"- Die, die ich gerade gegeben habe.",TOP 1 Befragung der Bundesregierung,14827,speech,18
106,533585,https://www.abgeordnetenwatch.de/profile/renate-kunast/archive/215098,106,166,Renate Künast [BÜNDNIS 90/DIE GRÜNEN],Renate Künast,renate-kunast,1759.0,gruene,"Sie sind frei, die Frage nicht zu beantworten!",TOP 1 Befragung der Bundesregierung,14827,poi,18
107,533586,https://www.abgeordnetenwatch.de/profile/norbert-lammert,107,166,Präsident Dr. Norbert Lammert,Dr. Norbert Lammert,norbert-lammert,1754.0,,"Liebe Frau Künast, der Gesetzgeber sitzt nicht auf der Regierungsbank. Völlig unabhängig, zu welchem Zeitpunkt die Regierung einen Gesetzentwurf einbringen will: Ob und wann dieser Gesetzentwurf verabschiedet wird, entscheidet der Bundestag. Das könnte früher oder später sein, als die Überlegungen der Bundesregierung vorsehen,",TOP 1 Befragung der Bundesregierung,14827,chair,18
108,533587,https://www.abgeordnetenwatch.de/profile/kai-gehring/archive/215144,108,166,Kai Gehring [BÜNDNIS 90/DIE GRÜNEN],Kai Gehring,kai-gehring,1821.0,gruene,Später als 2018?,TOP 1 Befragung der Bundesregierung,14827,poi,18
109,533588,https://www.abgeordnetenwatch.de/profile/norbert-lammert,109,166,Präsident Dr. Norbert Lammert,Dr. Norbert Lammert,norbert-lammert,1754.0,,die offenkundig noch nicht abgeschlossen sind. - Frau Haßelmann.,TOP 1 Befragung der Bundesregierung,14827,chair,18
110,533589,https://www.abgeordnetenwatch.de/profile/britta-haselmann-0,110,166,Britta Haßelmann (BÜNDNIS 90/DIE GRÜNEN),Britta Haßelmann,britta-haßelmann,1807.0,gruene,"Vielen Dank, Herr Präsident. - Seien Sie versichert, Herr Präsident, dass wir wissen, dass wir das Parlament und damit der Gesetzgeber sind. Noch lieber wäre es mir, wenn Frau Wanka sagen würde: Wir bereiten gar keinen Gesetzentwurf vor, sondern wir schließen uns dem Gesetzentwurf zur Abschaffung des § 103 StGB von Bündnis 90/Die Grünen an, der schon eingebracht ist, und müssen gar keine eigene Arbeit mehr leisten. - Von daher ist meine Frage: Haben Sie sich denn mit unserem Gesetzentwurf vielleicht schon befasst, da Sie im Moment doch alle Aspekte erörtern?",TOP 1 Befragung der Bundesregierung,14827,speech,18
111,533590,,111,166,"Dr. Johanna Wanka, Bundesministerin für Bildung und Forschung",Dr. Johanna Wanka,johanna-wanka,,,"Ich betone noch einmal, dass dies der Bereich des regierungsinternen Handelns ist. Über diesen befinden wir in der Regierung und informieren dann.",TOP 1 Befragung der Bundesregierung,14827,speech,18
112,533591,https://www.abgeordnetenwatch.de/profile/norbert-lammert,112,166,Präsident Dr. Norbert Lammert,Dr. Norbert Lammert,norbert-lammert,1754.0,,Jetzt liegt mir noch der Wunsch des Kollegen Kekeritz nach einer Frage zu anderen Themen vor. Oder hat sich das erledigt?,TOP 1 Befragung der Bundesregierung,14827,chair,18
113,533592,https://www.abgeordnetenwatch.de/profile/britta-haselmann-0,113,166,Britta Haßelmann [BÜNDNIS 90/DIE GRÜNEN],Britta Haßelmann,britta-haßelmann,1807.0,gruene,Er ist schon zum Ausschuss gegangen!,TOP 1 Befragung der Bundesregierung,14827,poi,18
114,533593,https://www.abgeordnetenwatch.de/profile/norbert-lammert,114,166,Präsident Dr. Norbert Lammert,Dr. Norbert Lammert,norbert-lammert,1754.0,,"- Wer nicht da ist, kann auch keine Fragen stellen. - Dann schließe ich damit die Regierungsbefragung ab.

Ich rufe den Tagesordnungspunkt 2 auf:

Fragestunde

Drucksache 18/8190

Wir beginnen in dieser Woche mit dem Geschäftsbereich des Bundesministeriums für Familie, Senioren, Frauen und Jugend. Die Frage 1 der Kollegin Beate Walter-Rosenheimer wird schriftlich beantwortet. Damit können wir diesen Bereich wieder verlassen.

Wir kommen dann zum Geschäftsbereich des Bundesministeriums für Gesundheit. Hier steht die Kollegin Fischbach zur Beantwortung zur Verfügung.

Auch die Fragen 2 und 3 der Kollegin Scharfenberg werden schriftlich beantwortet.

Wir kommen zur Frage 4 der Kollegin Pia Zimmermann:

Seit wann haben nach Kenntnis der Bundesregierung welche staatlichen bzw. im öffentlichen Auftrag tätigen Institutionen Kenntnis von dem jetzt bekanntgewordenen systematisch organisierten Betrug in der Pflege?",TOP 1 Befragung der Bundesregierung,14827,chair,18
115,533594,https://www.abgeordnetenwatch.de/profile/ingrid-fischbach,115,166,"Ingrid Fischbach, Parl. Staatssekretärin beim Bundesminister für Gesundheit",Ingrid Fischbach,ingrid-fischbach,1834.0,,"Liebe Frau Kollegin Zimmermann, ich beantworte Ihre Frage wie folgt: Der Bericht des Bundeskriminalamtes vom Oktober 2015 wurde dem Bundesministerium für Gesundheit am 22. April 2016 übermittelt. Darüber hinaus stand nach Informationen der Bundesregierung eine Information des BKA über die Erkenntnisse zum Abrechnungsbetrug im Gesundheitswesen durch sogenannte russische Pflegedienste in Berlin auf der Tagesordnung der Sitzung vom 10. und 11. März 2016 der Konferenz der obersten Landessozialbehörden. An dieser Veranstaltung hat kein Ressort der Bundesregierung teilgenommen. Der dortige Vortrag des BKA sollte der Sensibilisierung der nachrangigen Träger der Sozialhilfe dienen.

Dem Bundesministerium des Innern wurde der Auswertebericht des BKA am 19. April 2016 zugesendet. Das BKA hat das BMI am 25. April 2016 darüber informiert, dass die gesetzlichen Kranken- und Pflegekassen über den GKV-Spitzenverband seit November 2014 in die Auswertung eingebunden waren, dass das BKA die Bundesvereinigung der kommunalen Spitzenverbände im Dezember 2015 über die Ereignisse der strategischen Auswertung informiert und um Sensibilisierung nachgeordneter Stellen in eigener Zuständigkeit gebeten hat, dass im Dezember 2015 das Ministerium für Arbeit, Integration und Soziales, NRW, als Geschäftsstelle der Konferenz der obersten Landessozialbehörden durch Versand eines Berichts informiert worden ist, dass mit Schreiben vom 30. September 2015 das Ministerium für Arbeit, Integration und Soziales dem BKA mitteilte, dass das Anliegen des BKA am 4. Dezember 2015 in der Arbeitsgruppe der KOLS „Auswirkungen des neuen Pflegebedürftigkeitsbegriffs/des Zweiten Pflegestärkungsgesetzes - PSG II - auf die Hilfe zur Pflege nach dem Zwölften Buch Sozialgesetzbuch“ behandelt wurde. Das Ministerium für Gesundheit ist kein Mitglied dieser Konferenz.",TOP 2 Fragestunde,14828,speech,18
116,533595,https://www.abgeordnetenwatch.de/profile/norbert-lammert,116,166,Präsident Dr. Norbert Lammert,Dr. Norbert Lammert,norbert-lammert,1754.0,,Nachfrage? - Bitte schön.,TOP 2 Fragestunde,14828,chair,18
117,533596,https://www.abgeordnetenwatch.de/profile/pia-zimmermann/archive/215413,117,166,Pia Zimmermann (DIE LINKE),Pia Zimmermann,pia-zimmermann,1345.0,linke,"Vielen Dank, Herr Präsident. - Vielen Dank für die Beantwortung der Frage. Allerdings fehlt mir ein bisschen die Bezugnahme auf die Systematik in der ganzen Geschichte. Das ist der erste Punkt. Der zweite Punkt: Mir fehlt eine Aussage zur Mitverantwortung der Bundesregierung.

Deshalb möchte ich auf Ihre Antwort eingehen und Sie fragen: Worin sieht die Bundesregierung denn die Ursachen für diesen systematischen Betrug in der Abrechnung von Pflegeleistungen, und wie bewertet sie ein mögliches Mitverschulden ihrerseits, was die bestehende Gesetzgebung angeht?

Ich muss noch dazu sagen: Ich finde es einigermaßen verwunderlich, dass vonseiten der Bundesregierung so wenig Selbstkritik kommt. Wenn ich mich recht erinnere, haben Sie es doch befürwortet, dass Pflege auch in private Hände kommt, dass man sich mit der Pflege finanziell verbessern kann bzw. dass man mit der Versorgung von kranken und pflegebedürftigen Menschen Gewinn machen kann. Insofern wäre es doch gut, zu sagen, welche Mitverantwortung die Bundesregierung in Bezug auf die vorliegenden Sachverhalte hat.",TOP 2 Fragestunde,14828,speech,18
118,533597,https://www.abgeordnetenwatch.de/profile/ingrid-fischbach,118,166,"Ingrid Fischbach, Parl. Staatssekretärin beim Bundesminister für Gesundheit",Ingrid Fischbach,ingrid-fischbach,1834.0,,"Frau Kollegin, ich kann Ihnen versichern, dass wir mit unseren Gesetzentwürfen gerade für den Pflegebereich alles tun, damit die Menschen, die Pflegeleistungen brauchen, diese auch bekommen. Wir tun alles, damit sie die hochqualitativen Pflegeleistungen und die Unterstützung bekommen, die sie brauchen.

Ich weise darauf hin, dass die Machenschaften, die jetzt bekannt geworden sind, nicht der organisierten Kriminalität zuzuordnen sind, weil sie sich unterhalb der Schwelle befinden. Es handelt sich hier um organisierten Betrug, mit dem man in dieser Weise nicht rechnen konnte. Wir haben dann aber die notwendigen Schritte veranlasst. Das heißt, wenn ein Betrugsfall durch Hinweise aufgedeckt wird, dann müssen an erster Stelle die Strafverfolgungsbehörden eingeschaltet werden. Sie müssen ihre Arbeit tun; denn den Hinweisen muss natürlich in strafrechtlicher Hinsicht nachgegangen werden.

Ein zweiter Schritt besteht dann darin, dass die verantwortlichen Stellen im Gesundheitswesen an einen Tisch geholt werden müssen, um die Sache zu klären. Das hat der Bundesminister für Gesundheit sofort getan, nachdem er Kenntnis von diesem Sachverhalt bekommen hatte. Ich denke, damit sind wir in einem ersten Schritt unserer Verantwortung nachgekommen.",TOP 2 Fragestunde,14828,speech,18
119,533598,https://www.abgeordnetenwatch.de/profile/norbert-lammert,119,166,Präsident Dr. Norbert Lammert,Dr. Norbert Lammert,norbert-lammert,1754.0,,Frau Klein-Schmeink.,TOP 2 Fragestunde,14828,chair,18
120,533599,https://www.abgeordnetenwatch.de/profile/maria-klein-schmeink-0,120,166,Maria Klein-Schmeink (BÜNDNIS 90/DIE GRÜNEN),Maria Klein-Schmeink,maria-klein-schmeink,1455.0,gruene,"Waren der Bundesregierung und dem Gesundheitsministerium die Problemanzeigen des Berliner Senats aus dem Jahre 2012 sowie die Veröffentlichungen der AOK Nordost dazu bekannt, mit denen darauf hingewiesen wurde, dass ein Drittel der 560 in Berlin zugelassenen ambulanten Pflegedienste falsch abrechnet? Wenn ja, was haben Sie dann nachfolgend ab dem Jahr 2012 in dieser Hinsicht unternommen?",TOP 2 Fragestunde,14828,speech,18
121,533600,https://www.abgeordnetenwatch.de/profile/ingrid-fischbach,121,166,"Ingrid Fischbach, Parl. Staatssekretärin beim Bundesminister für Gesundheit",Ingrid Fischbach,ingrid-fischbach,1834.0,,"Frau Kollegin, nachdem diese Dinge damals in der Amtszeit des Vorgängers von Hermann Gröhe im Gesundheitsministerium besprochen worden waren, wurden mit dem Inkrafttreten des Assistenzpflegegesetzes zum 1. Januar 2013 - dabei geht es um Änderungen im SGB XI - die Zusammenarbeit und der Datenaustausch zwischen Pflegekassen, Krankenkassen und Sozialhilfeträgern bei Fehlverhalten und in Betrugsfällen verbessert.",TOP 2 Fragestunde,14828,speech,18
122,533601,https://www.abgeordnetenwatch.de/profile/norbert-lammert,122,166,Präsident Dr. Norbert Lammert,Dr. Norbert Lammert,norbert-lammert,1754.0,,Herr Kollege Terpe.,TOP 2 Fragestunde,14828,chair,18
123,533602,https://www.abgeordnetenwatch.de/profile/harald-terpe,123,166,Dr. Harald Terpe (BÜNDNIS 90/DIE GRÜNEN),Dr. Harald Terpe,harald-terpe,1642.0,gruene,"Vielen Dank, Herr Präsident. - Frau Staatssekretärin, ich möchte da noch einmal nachhaken. Gibt es denn konkrete Gegenmaßnahmen, die die Vorgänger von Herrn Gröhe - vielleicht auch Herr Gröhe selbst - eingeleitet haben, als diese zwei Hinweise aus Berlin in den Jahren 2012 und 2014 - es war ja nicht nur ein Hinweis, sondern es waren zwei - bekannt wurden?",TOP 2 Fragestunde,14828,speech,18
124,533603,https://www.abgeordnetenwatch.de/profile/ingrid-fischbach,124,166,"Ingrid Fischbach, Parl. Staatssekretärin beim Bundesminister für Gesundheit",Ingrid Fischbach,ingrid-fischbach,1834.0,,"Herr Kollege, wir haben bei den Gesetzgebungsverfahren zu den Pflegestärkungsgesetzen I und II alle Hinweise und Informationen, die uns vorlagen, in die Beratungen miteingebracht. Mit beiden Pflegestärkungsgesetzen haben wir eine Vielzahl von Regelungen auf den Weg gebracht, um die Qualität und auch die Prüfungs- bzw. Kontrollmöglichkeiten zu verbessern. Ich nenne in dem Zusammenhang beispielhaft die unangemeldeten Besuche, die in Verdachtsfällen möglich sind. Weiter nenne ich das Beispiel, dass seit Januar dieses Jahres der MDK im Bereich der Abrechnungen Prüfungen vornehmen muss. Vorher war es eine Kannleistung. Es gibt also eine Menge von Regelungen, die wir mit den beiden Pflegestärkungsgesetzen eingeführt haben.",TOP 2 Fragestunde,14828,speech,18
