,id,profile_url,sequence,sitzung,speaker,speaker_cleaned,speaker_fp,speaker_key,speaker_party,text,top,top_id,type,wahlperiode
203,533682,https://www.abgeordnetenwatch.de/profile/brigitte-zypries,203,166,"Brigitte Zypries, Parl. Staatssekretärin beim Bundesminister für Wirtschaft und Energie",Brigitte Zypries,brigitte-zypries,1613.0,,"Es muss ja gesagt werden, dass das nicht nur Drittländer betrifft.",TOP 2 Fragestunde,14828,speech,18
204,533683,,204,166,Vizepräsident Peter Hintze,Peter Hintze,peter-hintze,,,"Herr Abgeordneter Ströbele, haben Sie eine Zusatzfrage?",TOP 2 Fragestunde,14828,chair,18
205,533684,https://www.abgeordnetenwatch.de/profile/hans-christian-strobele,205,166,Hans-Christian Ströbele (BÜNDNIS 90/DIE GRÜNEN),Hans-Christian Ströbele,hans-christian-strobele,1578.0,gruene,"Meine erste Frage: Welche Kriterien müssen erfüllt sein, damit eine Firma in Deutschland als unzuverlässig gilt und ihr keine Ausfuhrgenehmigungen für Kriegswaffen erteilt werden? Reicht dafür nicht, dass gegen Geschäftsführer und Mitarbeiter der Firma nicht nur strafrechtliche Ermittlungsverfahren eingeleitet werden, sondern auch Anklage erhoben wird? Mit anderen Worten: Warum bekommt die Firma Heckler & Koch immer noch Ausfuhrgenehmigungen, obwohl ein Verfahren gegen sie inzwischen bei Gericht anhängig ist, nicht bei der Staatsanwaltschaft? Das konnte man gestern sehr schön im Fernsehen verfolgen.",TOP 2 Fragestunde,14828,speech,18
206,533685,https://www.abgeordnetenwatch.de/profile/brigitte-zypries,206,166,"Brigitte Zypries, Parl. Staatssekretärin beim Bundesminister für Wirtschaft und Energie",Brigitte Zypries,brigitte-zypries,1613.0,,"Die Frage kann ich nur eingeschränkt beantworten. Als Juristin weiß ich natürlich, dass die Beurteilung der Frage nach der Zuverlässigkeit immer vom Einzelfall abhängig ist. Es gibt im Zweifel keine allgemeingültige Definition dessen, was unzuverlässig ist. Ich weiß nicht, ob die Firma Heckler & Koch noch Genehmigungen für den Bereich bekommt, wo Zuverlässigkeit die Voraussetzung ist. Ich will Ihnen das aber gerne schriftlich nachreichen.",TOP 2 Fragestunde,14828,speech,18
207,533686,,207,166,Vizepräsident Peter Hintze,Peter Hintze,peter-hintze,,,Noch eine Zusatzfrage?,TOP 2 Fragestunde,14828,chair,18
208,533687,https://www.abgeordnetenwatch.de/profile/hans-christian-strobele,208,166,Hans-Christian Ströbele (BÜNDNIS 90/DIE GRÜNEN),Hans-Christian Ströbele,hans-christian-strobele,1578.0,gruene,"Ja, sie ist ganz kurz. - Spielt es bei den Überlegungen, ob eine Genehmigung erteilt wird, eine Rolle, in welchem Landesteil oder in welchem Wahlkreis eine Firma liegt, wie zum Beispiel bei der Firma Heckler & Koch?",TOP 2 Fragestunde,14828,speech,18
209,533688,https://www.abgeordnetenwatch.de/profile/brigitte-zypries,209,166,"Brigitte Zypries, Parl. Staatssekretärin beim Bundesminister für Wirtschaft und Energie",Brigitte Zypries,brigitte-zypries,1613.0,,Das kann ich mir nicht vorstellen.,TOP 2 Fragestunde,14828,speech,18
210,533689,,210,166,Vizepräsident Peter Hintze,Peter Hintze,peter-hintze,,,"Danke schön. - Wir sind damit am Ende dieses Geschäftsbereiches. Vielen Dank, Frau Staatssekretärin.

Wir kommen zum Geschäftsbereich des Auswärtigen Amtes. Zur Beantwortung der Fragen steht Staatsminister Michael Roth bereit.

Die Frage 25 des Abgeordneten Niema Movassat, die Frage 26 des Abgeordneten Özcan Mutlu, die Fragen 27 und 28 der Abgeordneten Sevim Dağdelen sowie die Frage 29 der Abgeordneten Luise Amtsberg werden schriftlich beantwortet.

Wir kommen zur Frage 30 der Abgeordneten Katja Keul, Bündnis 90/Die Grünen:

Inwiefern hat die Bundesregierung Kenntnisse darüber, ob im Januar 2016 in Sidi Bouzid (Tunesien) Minderjährige im Anschluss an politische Demonstrationen verhaftet, mehrere Wochen gefangen gehalten und dabei gefoltert wurden, und wie fließen solche staatlichen Handlungen in die Einstufung Tunesiens als „sicherer Herkunftsstaat“ ein?

Herr Staatsminister, bitte.",TOP 2 Fragestunde,14828,chair,18
211,533690,https://www.abgeordnetenwatch.de/profile/michael-roth/archive/216871,211,166,"Michael Roth, Staatsminister im Auswärtigen Amt",Michael Roth,michael-roth,1687.0,,"Vielen Dank, Herr Präsident. - Frau Abgeordnete Keul, über den konkreten Sachverhalt, den Sie in Ihrer Frage, bezogen auf die Situation in Sidi Bouzid, schildern, hat die Bundesregierung keine Kenntnis.

Mitte Januar dieses Jahres war es in vielen Teilen Tunesiens zu Protesten gegen die hohe Arbeitslosigkeit sowie gegen Korruption und Vetternwirtschaft gekommen. Dabei kam es stellenweise zu Vandalismus und auch zu Plünderungen. Die tunesische Regierung betonte ausdrücklich, dass die Demonstrationen selbst rechtmäßig seien und von den Ordnungskräften auch pflichtgemäß geschützt worden seien. Aus Kreisen der Zivilgesellschaft wurde geäußert, dass der Unmut aus der Mitte der Demonstranten gegenüber den Plünderungen dazu geführt habe, dass die Proteste schlussendlich wieder abgeflaut seien.

Dann befragen Sie uns noch zu unserem Vorschlag zur Einstufung Tunesiens als sogenannter sicherer Herkunftsstaat. Dieser Vorschlag erfolgte auf Grundlage einer umfassenden Prüfung anhand der vom Bundesverfassungsgericht aufgestellten Kriterien. Dabei hat sich die Bundesregierung anhand der Rechtslage, aber auch der konkreten Rechtsanwendung und der allgemeinen politischen Verhältnisse in Tunesien ein Gesamturteil über die für eine Verfolgung bedeutsamen Verhältnisse in Tunesien gebildet. Die Bundesregierung kam zu dem bekannten Urteil, dass die Voraussetzungen für die Einstufung als sicheres Herkunftsland erfüllt sind.",TOP 2 Fragestunde,14828,speech,18
212,533691,,212,166,Vizepräsident Peter Hintze,Peter Hintze,peter-hintze,,,"Haben Sie eine Zusatzfrage, Frau Abgeordnete Keul?",TOP 2 Fragestunde,14828,chair,18
213,533692,https://www.abgeordnetenwatch.de/profile/katja-keul/archive/215046,213,166,Katja Keul (BÜNDNIS 90/DIE GRÜNEN),Katja Keul,katja-keul,1461.0,gruene,"Ja, habe ich. Vielen Dank. - Sie haben jetzt gesagt, dass Sie von diesem konkreten Vorfall keine Kenntnis haben. Das kann ich nachvollziehen. Mir ist dieser Vorfall konkret und glaubwürdig geschildert worden. Werden Sie denn weiteren Berichten zu diesen Vorgängen nachgehen und sie prüfen? Wenn sich herausstellte, dass Bürgerinnen und Bürger in Tunesien tatsächlich bei der Wahrnehmung des Demonstrationsrechts willkürlich verhaftet und anschließend auch körperlich misshandelt werden, wäre das dann etwas, was Sie bei Ihrer Entscheidung möglicherweise berücksichtigen müssten?",TOP 2 Fragestunde,14828,speech,18
214,533693,https://www.abgeordnetenwatch.de/profile/michael-roth/archive/216871,214,166,"Michael Roth, Staatsminister im Auswärtigen Amt",Michael Roth,michael-roth,1687.0,,"Selbstverständlich nehmen wir mit großer Aufmerksamkeit die Menschenrechtslage nicht nur in Tunesien wahr. Wir beobachten sie kontinuierlich, zumal Folter ein wesentliches Kriterium bei der Beurteilung der Lage und der Entscheidung darüber ist, ob man ein Land zu einem sogenannten sicheren Herkunftsland erklären kann.

Für uns ist aber auch die Rechtslage ausschlaggebend - nicht allein, aber auch. Die Rechtslage in Tunesien sieht folgendermaßen aus: Nach Artikel 23 der tunesischen Verfassung - sie stammt aus dem Jahr 2014 - wird jede Form von seelischer und physischer Folter als ein Verbrechen eingestuft, das auch nicht verjährbar ist. Dessen ungeachtet leugnet die tunesische Regierung jedoch nicht, dass Folter im Bereich von Polizei und Justiz in Einzelfällen noch zur Anwendung kommt. Sie bekennt sich zu ihrer Bestrafung auf Grundlage der entsprechenden Vorgaben der Verfassung. Entsprechende Zeichen sind auch der Beitritt Tunesiens zur Antifolterkonvention und die Einrichtung einer nationalen Behörde gegen die Folter.",TOP 2 Fragestunde,14828,speech,18
215,533694,,215,166,Vizepräsident Peter Hintze,Peter Hintze,peter-hintze,,,Noch eine Zusatzfrage?,TOP 2 Fragestunde,14828,chair,18
216,533695,https://www.abgeordnetenwatch.de/profile/katja-keul/archive/215046,216,166,Katja Keul (BÜNDNIS 90/DIE GRÜNEN),Katja Keul,katja-keul,1461.0,gruene,"Ja. - Es ist völlig unstrittig, dass in der Verfassung jede Menge sehr lobenswerte Dinge stehen. Nichtsdestotrotz muss ich nachfragen; denn in der vergangenen Woche hat sich der UN-Ausschuss gegen Folter mit Tunesien beschäftigt. Im offiziellen Bericht der tunesischen Organisation gegen Folter sind auch Fälle von Folter an Minderjährigen aufgeführt. Amnesty International hat bei der Anhörung vor dem Ausschuss erneut dargestellt, dass Folter in Tunesien trotz aller Bemühungen der Regierung weiterhin an der Tagesordnung ist. Haben Sie Kenntnis von den UN-Berichten, die jetzt vorliegen, und sind sie in Ihre Entscheidung eingeflossen?",TOP 2 Fragestunde,14828,speech,18
217,533696,https://www.abgeordnetenwatch.de/profile/michael-roth/archive/216871,217,166,"Michael Roth, Staatsminister im Auswärtigen Amt",Michael Roth,michael-roth,1687.0,,"Ich habe versucht, Ihnen deutlich zu machen, dass die Bundesregierung über den konkreten Fall, den Sie in Ihrer Frage schildern, keine eigenen Erkenntnisse hat. Selbstverständlich sind uns die Berichte von Amnesty International, aber auch von anderen Nichtregierungsorganisationen oder auch UN-Organisationen bekannt. Wir lassen natürlich all diese Berichte in unser Urteil einfließen. Wir werden auch die Menschenrechtslage in Tunesien weiterhin sehr aufmerksam verfolgen.",TOP 2 Fragestunde,14828,speech,18
218,533697,,218,166,Vizepräsident Peter Hintze,Peter Hintze,peter-hintze,,,"Danke schön. - Wir kommen zum Geschäftsbereich des Bundesministeriums des Innern. Zur Beantwortung steht der Parlamentarische Staatssekretär Professor Dr. Günter Krings bereit.

Ich rufe die Frage 31 des Abgeordneten Hans-Christian Ströbele auf:

Teilt die Bundesregierung die kritische Bewertung des Bundesministers des Innern der Entscheidung des Bundesverfassungsgerichts zu den Ermittlungsbefugnissen des Bundeskriminalamtes vom 20. April 2016, diese erleichtere nicht den Kampf gegen den internationalen Terrorismus, was nach dieser Meinung offenbar Aufgabe der Rechtsprechung sein soll, und auf welche Punkte und Passagen des Urteils des Gerichts wird diese Bewertung gegebenenfalls bezogen bzw. gestützt?

Herr Staatssekretär, bitte.",TOP 2 Fragestunde,14828,chair,18
219,533698,https://www.abgeordnetenwatch.de/profile/gunter-krings/archive/214657,219,166,"Dr. Günter Krings, Parl. Staatssekretär beim Bundesminister des Innern",Dr. Günter Krings,gunter-krings,1766.0,,"Ganz herzlichen Dank, Herr Präsident. - Meine sehr verehrten Damen und Herren! Lieber Herr Ströbele, die Befugnisse des Bundeskriminalamts zur Abwehr von Gefahren durch den internationalen Terrorismus sind von besonderer Bedeutung. Aufgabe der Rechtsprechung ist - da stimmen wir Ihnen zu - die Wahrung und Durchsetzung des Rechts. Die Vorgaben des Bundesverfassungsgerichts werden von der Bundesregierung umgesetzt.",TOP 2 Fragestunde,14828,speech,18
220,533699,,220,166,Vizepräsident Peter Hintze,Peter Hintze,peter-hintze,,,"Haben Sie eine Zusatzfrage, Herr Abgeordneter Ströbele?",TOP 2 Fragestunde,14828,chair,18
221,533700,https://www.abgeordnetenwatch.de/profile/hans-christian-strobele,221,166,Hans-Christian Ströbele (BÜNDNIS 90/DIE GRÜNEN),Hans-Christian Ströbele,hans-christian-strobele,1578.0,gruene,"Ich will die Frage, wie Ihre Erklärung mit der Äußerung des Bundesinnenministers zu vereinbaren ist, nicht wiederholen; vielmehr möchte ich mich auf den neu bekannt gewordenen Sachverhalt beziehen, wonach sich der Bundesinnenminister, der Verfassungsminister, in einem Interview dahin gehend geäußert haben soll, dass das Bundesverfassungsgericht dem Gesetzgeber, also dem Deutschen Bundestag, nicht so häufig „in den Arm fallen“ soll. Ist das nach Auffassung der gesamten Bundesregierung die richtige Reaktion darauf, dass das Bundesverfassungsgericht bei 14 von 15 Bestimmungen eines Gesetzpakets gesagt hat: „Entweder sind sie nichtig, weil sie verfassungswidrig sind, oder sie sind verfassungswidrig und müssen nachgebessert werden“? Ist das nicht ein Grund dafür, dass sich der Bundesinnenminister vielleicht einen anderen Job suchen sollte?",TOP 2 Fragestunde,14828,speech,18
222,533701,https://www.abgeordnetenwatch.de/profile/gunter-krings/archive/214657,222,166,"Dr. Günter Krings, Parl. Staatssekretär beim Bundesminister des Innern",Dr. Günter Krings,gunter-krings,1766.0,,"Wenn ich darf, Herr Präsident?",TOP 2 Fragestunde,14828,speech,18
223,533702,,223,166,Vizepräsident Peter Hintze,Peter Hintze,peter-hintze,,,Ich bitte darum.,TOP 2 Fragestunde,14828,chair,18
224,533703,https://www.abgeordnetenwatch.de/profile/gunter-krings/archive/214657,224,166,"Dr. Günter Krings, Parl. Staatssekretär beim Bundesminister des Innern",Dr. Günter Krings,gunter-krings,1766.0,,"Lieber Kollege Ströbele, zunächst einmal hat uns das Bundesverfassungsgericht - Sie haben es nur angedeutet - Aufgaben auferlegt, was die Nachbesserung unter dem Gesichtspunkt des Verhältnismäßigkeitsprinzips von Vorschriften anbelangt. Es hat im Wesentlichen keine zentralen Vorschriften aufgehoben. Der Minister hat - das habe ich in meiner ersten Antwort eben ähnlich formuliert - in diesem Interview unter anderem gesagt:

Ich habe das Urteil des … Senats … zur Kenntnis genommen. Es ist zu respektieren und umzusetzen.

Das ist als Verfassungsminister auch seine Aufgabe, da wird ihm auch kein anderer Bundesminister in der Regierung widersprechen.

Allerdings befinden wir uns - um mit Peter Häberle zu sprechen - in einer „offenen Gesellschaft der Verfassungsinterpreten“. In einer freiheitlichen Demokratie müssen Verfassungsorgane miteinander kommunizieren, auch kritisch kommunizieren dürfen. Das gilt insbesondere auch für das Bundesverfassungsgericht, das nicht nur ein Gericht ist, sondern auch ein Verfassungsorgan, worauf die Richter zu Recht großen Wert legen. Deshalb muss vor und auch nach Urteilen des Bundesverfassungsgerichts, unbeschadet der vollumfänglichen und konsequenten Umsetzung der Urteile, ein Diskurs, eine politische Bewertung möglich sein. Das ist kein Widerspruch, das ist eine Selbstverständlichkeit. Wir sind kein Richterstaat, sondern eine offene Demokratie. Man muss mit solchen Urteilen daher offen umgehen können.

Sie haben dezidiert nach der Rechtsauffassung der gesamten Bundesregierung gefragt. Ich darf darauf hinweisen, dass nicht das Bundesinnenministerium Partei in Karlsruhe war, sondern die Bundesrepublik Deutschland. Die Bundesrepublik wird in solchen Verfahren durch die Bundesregierung vertreten, die Bundesregierung wiederum benennt - wie auch in diesem Fall - einen Prozessvertreter, der die Rechtsauffassung der gesamten Bundesregierung vertritt. Richtig ist: Wir haben uns mit unserer Rechtsauffassung nicht voll durchsetzen können. Insoweit kennen Sie auch die Rechtsauffassung der Bundesregierung.",TOP 2 Fragestunde,14828,speech,18
225,533704,,225,166,Vizepräsident Peter Hintze,Peter Hintze,peter-hintze,,,"Noch eine Zusatzfrage, Herr Abgeordneter Ströbele?",TOP 2 Fragestunde,14828,chair,18
226,533705,https://www.abgeordnetenwatch.de/profile/hans-christian-strobele,226,166,Hans-Christian Ströbele (BÜNDNIS 90/DIE GRÜNEN),Hans-Christian Ströbele,hans-christian-strobele,1578.0,gruene,"Danke, Herr Präsident. - Herr Staatssekretär, wir reden über ein Gesetz, das vom Bundesinnenminister der Großen Koalition 2009 eingebracht wurde; nicht von diesem Bundesinnenminister, sondern vom damaligen Bundesinnenminister. Das Bundesverfassungsgericht stellt nun fest, dass große Teile des Gesetzes verfassungswidrig sind. Wäre es nicht die richtige Reaktion des Verfassungsministers, zu sagen: „Mea culpa, mea culpa! Da ist etwas schief gegangen. Wir reparieren das so schnell wie möglich, und wir werden in Zukunft mehr darauf achten, dass Gesetze verfassungskonform formuliert werden“, statt jetzt nachzuhaken und zu sagen: „Ihr sollt euch in das Gesetzgebungsverfahren nicht einmischen, ihr sollt dem Gesetzgeber nicht in den Arm fallen“? Das Bundesverfassungsgericht ist dem Gesetzgeber im Übrigen zu Recht in den Arm gefallen.",TOP 2 Fragestunde,14828,speech,18
227,533706,,227,166,Vizepräsident Peter Hintze,Peter Hintze,peter-hintze,,,Herr Staatssekretär.,TOP 2 Fragestunde,14828,chair,18
228,533707,https://www.abgeordnetenwatch.de/profile/gunter-krings/archive/214657,228,166,"Dr. Günter Krings, Parl. Staatssekretär beim Bundesminister des Innern",Dr. Günter Krings,gunter-krings,1766.0,,"Der Bundesinnenminister hat - das habe ich jetzt schon zweimal gesagt; ich sage es Ihnen gern zum dritten Mal - deutlich gemacht, dass nicht nur selbstverständlich die Vorgaben aus Karlsruhe umgesetzt werden, sondern dass sie auch schnellstmöglich umgesetzt werden. Das ist auch unser Interesse.

Aber noch einmal: Es gehört in einer freiheitlichen offenen Demokratie dazu, dass man nach einem Urteil über das Urteil auch politisch reden darf. Wer das nicht möchte, hat offenbar einen anderen Staat vor Augen. Wir haben mit dem Bundesverfassungsgericht ein Gericht, aber zugleich ein Verfassungsorgan, das sich diesem Diskurs nicht nur stellen muss, sondern auch gerne stellt. Das wissen wir aus vielen Diskussionen, die wir mit Verfassungsrichtern führen.

Insofern waren die Äußerungen des Bundesministers richtig. Denn er hat auf diese Punkte und auf die politischen Implikationen eines Urteils hingewiesen, ohne in irgendeiner Form auch nur in Abrede zu stellen, dass wir natürlich konsequent die Vorgaben befolgen werden.",TOP 2 Fragestunde,14828,speech,18
229,533708,,229,166,Vizepräsident Peter Hintze,Peter Hintze,peter-hintze,,,"Herzlichen Dank. - Die Frage 32 des Abgeordneten Andrej Hunko, die Frage 33 der Abgeordneten Beate Walter-Rosenheimer und die Frage 34 der Abgeordneten Ulla Jelpke werden schriftlich beantwortet.

Wir kommen dann zum Geschäftsbereich des Bundesministeriums der Justiz und für Verbraucherschutz. Die Frage 35 der Abgeordneten Corinna Rüffer wird ebenfalls schriftlich beantwortet.

Damit kommen wir zum Geschäftsbereich des Bundesministeriums der Finanzen. Die Frage 36 der Abgeordneten Ulla Jelpke wird schriftlich beantwortet.

Wir kommen nun zum Geschäftsbereich des Bundesministeriums für Arbeit und Soziales. Die Frage 37 der Abgeordneten Corinna Rüffer, die Fragen 38 und 39 der Abgeordneten Sabine Zimmermann (Zwickau) sowie die Fragen 40 und 41 der Abgeordneten Katrin Kunert werden schriftlich beantwortet.

Wir kommen zum Geschäftsbereich des Bundesministeriums der Verteidigung. Die Frage 42 des Abgeordneten Niema Movassat und die Frage 43 des Abgeordneten Andrej Hunko werden ebenfalls schriftlich beantwortet.

Wir sind damit am Ende der Fragestunde.

Ich unterbreche die Sitzung des Deutschen Bundestages bis exakt 15.35 Uhr. Dann wird der Zusatzpunkt Aktuelle Stunde auf Verlangen der Fraktion Bündnis 90/Die Grünen zum Thema „Umgang mit der Presse- und Meinungsfreiheit in der Türkei“ aufgerufen. Also: Um 15.35 Uhr setzen wir das Plenum mit der Aktuellen Stunde fort.",TOP 2 Fragestunde,14828,chair,18
230,533709,,230,166,,,,,,Unterbrechung von 14.46 bis 15.35 Uhr,TOP 2 Fragestunde,14828,poi,18
231,533710,,231,166,Vizepräsident Peter Hintze,Peter Hintze,peter-hintze,,,"Die unterbrochene Sitzung ist wieder eröffnet.

Ich rufe den Zusatzpunkt 1 auf:

Aktuelle Stunde

auf Verlangen der Fraktion BÜNDNIS 90/DIE GRÜNEN

Umgang mit der Presse- und Meinungsfreiheit in der Türkei

Ich eröffne die Aussprache. Das Wort hat als erste Rednerin Frau Katrin Göring-Eckardt, Bündnis 90/Die Grünen.",TOP 2 Fragestunde,14828,chair,18
232,533711,https://www.abgeordnetenwatch.de/profile/katrin-goring-eckardt/archive/215231,232,166,Katrin Göring-Eckardt (BÜNDNIS 90/DIE GRÜNEN),Katrin Göring-Eckardt,katrin-goring-eckardt,1604.0,gruene,"Herr Präsident! Liebe Kolleginnen und liebe Kollegen! Ich zitiere:

Es wird dringend davon abgeraten, in der Öffentlichkeit politische Äußerungen gegen den türkischen Staat zu machen ...

So steht es auf der Homepage des Auswärtigen Amts, eine Information für Türkei-Reisende.

Es gibt Menschen, die haben diesen Satz in der jüngeren Vergangenheit nicht beachtet, zum Beispiel Hasnain Kazim, der Türkei-Korrespondent des Spiegels - im März musste er ausreisen: Akkreditierung nicht verlängert -, zum Beispiel die niederländische Journalistin Ebru Umar - Grund: kritische Äußerungen gegenüber Herrn Erdogan auf Twitter. ARD-Korrespondent Volker Schwenck durfte gar nicht erst einreisen, der amerikanische Journalist David Lepeska ebenfalls nicht. Ganz zu schweigen von den noch laufenden Prozessen gegen Can Dündar und Erdem Gül von der Zeitung Cumhuriyet. Sie sind wegen angeblicher Unterstützung einer Terrororganisation mit lebenslanger Haft bedroht. Meine Damen und Herren, auf der Liste der „Reporter ohne Grenzen“ zur Pressefreiheit steht die Türkei aktuell auf Platz 151 von 180, damit hinter Ländern wie Simbabwe, Bangladesch oder Äthiopien. Das kann uns nicht egal sein als Demokratinnen und Demokraten.",TOP ZP 1 Aktuelle Stunde zum Umgang mit der Presse- und Meinungsfreiheit in der Türkei,14829,speech,18
233,533712,,233,166,,,,,,"Beifall beim BÜNDNIS 90/DIE GRÜNEN, bei der SPD und der LINKEN",TOP ZP 1 Aktuelle Stunde zum Umgang mit der Presse- und Meinungsfreiheit in der Türkei,14829,poi,18
234,533713,https://www.abgeordnetenwatch.de/profile/katrin-goring-eckardt/archive/215231,234,166,Katrin Göring-Eckardt (BÜNDNIS 90/DIE GRÜNEN),Katrin Göring-Eckardt,katrin-goring-eckardt,1604.0,gruene,"Diese Entwicklung kam nicht über Nacht. Die Bundesregierung muss es bemerkt haben und ist untätig geblieben. Heute sagt ein Regierungsvertreter, der nicht genannt werden will, es gäbe keine schwarzen Listen von Journalisten in der Türkei. Gibt es keine, oder wissen wir nichts Genaueres? Die Konsequenz ist dieselbe: Ein Land, das immer noch die EU-Mitgliedschaft anstrebt, das kann nicht repressiv und willkürlich mit Journalistinnen und Journalisten umspringen. Wir müssen das als demokratischer Staat, müssen das als Europäer, die ihre Werte verteidigen, ansprechen.",TOP ZP 1 Aktuelle Stunde zum Umgang mit der Presse- und Meinungsfreiheit in der Türkei,14829,speech,18
235,533714,,235,166,,,,,,Beifall beim BÜNDNIS 90/DIE GRÜNEN und bei der LINKEN sowie bei Abgeordneten der SPD,TOP ZP 1 Aktuelle Stunde zum Umgang mit der Presse- und Meinungsfreiheit in der Türkei,14829,poi,18
236,533715,https://www.abgeordnetenwatch.de/profile/katrin-goring-eckardt/archive/215231,236,166,Katrin Göring-Eckardt (BÜNDNIS 90/DIE GRÜNEN),Katrin Göring-Eckardt,katrin-goring-eckardt,1604.0,gruene,"Das ist eine Entwicklung, die nicht nur Journalistinnen und Journalisten betrifft. Sie betrifft Künstler, sie betrifft Wissenschaftlerinnen und Wissenschaftler, sie betrifft kritische Oppositionelle.

Herr Erdogan ist Wiederholungstäter. Er ist nämlich nicht nur schnell beleidigt, er setzt sich auch gleich mit dem türkischen Staat, nach dem Motto: Der Staat bin ich. Wer gern ein absolutistischer Monarch sein will, der nimmt natürlich nicht nur jede Kritik an seiner Person übel, sondern versteht auch jede Kritik an staatlicher Willkür als Majestätsbeleidigung. Auch das ist für Demokratinnen und Demokraten unerträglich.",TOP ZP 1 Aktuelle Stunde zum Umgang mit der Presse- und Meinungsfreiheit in der Türkei,14829,speech,18
237,533716,,237,166,,,,,,Beifall beim BÜNDNIS 90/DIE GRÜNEN und bei der LINKEN sowie bei Abgeordneten der SPD,TOP ZP 1 Aktuelle Stunde zum Umgang mit der Presse- und Meinungsfreiheit in der Türkei,14829,poi,18
238,533717,https://www.abgeordnetenwatch.de/profile/katrin-goring-eckardt/archive/215231,238,166,Katrin Göring-Eckardt (BÜNDNIS 90/DIE GRÜNEN),Katrin Göring-Eckardt,katrin-goring-eckardt,1604.0,gruene,"Über 2 000 Prozesse führt er, zum Beispiel gegen „Academics for Peace“, deren Vertreter wegen Kritik am Vorgehen gegen die Kurden inhaftiert wurden. Die Dresdner Sinfoniker sollen besser nicht mehr über Völkermord in Armenien konzertieren, und die EU-Kommission hat Informationen über das entsprechende Projekt von der Homepage genommen. Meine Damen und Herren, dass eine EU-Kommission und eine deutsche Bundesregierung das nicht klar und deutlich benennen und kritisieren - übrigens ein Projekt, das mit Mitteln des deutschen Staates gefördert wird -, das ist für mich eine Absurdität. Das geht nicht. Das müssen Sie ändern!",TOP ZP 1 Aktuelle Stunde zum Umgang mit der Presse- und Meinungsfreiheit in der Türkei,14829,speech,18
239,533718,,239,166,,,,,,Beifall beim BÜNDNIS 90/DIE GRÜNEN und bei der LINKEN,TOP ZP 1 Aktuelle Stunde zum Umgang mit der Presse- und Meinungsfreiheit in der Türkei,14829,poi,18
240,533719,https://www.abgeordnetenwatch.de/profile/katrin-goring-eckardt/archive/215231,240,166,Katrin Göring-Eckardt (BÜNDNIS 90/DIE GRÜNEN),Katrin Göring-Eckardt,katrin-goring-eckardt,1604.0,gruene,"Nicht zuletzt: Es wird gegen Jan Böhmermann wegen Verstoßes gegen § 103 des Strafgesetzbuchs ermittelt. Ich habe mir erzählen lassen, dass es unter Juristinnen und Juristen einen Spruch gibt, den man gerne und überall zitiert: Ein Federstrich des Gesetzgebers, und ganze Bibliotheken werden zur Makulatur. - Sie hätten jetzt die Chance, Sie hätten jetzt die Gelegenheit. Warten Sie nicht bis 2017, warten Sie bitte nicht bis 2018 oder bis wann auch immer, sondern schaffen Sie jetzt nach unserer Vorlage sofort den § 103 StGB ab.",TOP ZP 1 Aktuelle Stunde zum Umgang mit der Presse- und Meinungsfreiheit in der Türkei,14829,speech,18
241,533720,,241,166,,,,,,Beifall beim BÜNDNIS 90/DIE GRÜNEN und bei der LINKEN sowie bei Abgeordneten der SPD,TOP ZP 1 Aktuelle Stunde zum Umgang mit der Presse- und Meinungsfreiheit in der Türkei,14829,poi,18
