,id,profile_url,sequence,sitzung,speaker,speaker_cleaned,speaker_fp,speaker_key,speaker_party,text,top,top_id,type,wahlperiode
0,533479,https://www.abgeordnetenwatch.de/profile/norbert-lammert,0,166,Präsident Dr. Norbert Lammert,Dr. Norbert Lammert,norbert-lammert,1754.0,,"Nehmen Sie bitte Platz. Die Sitzung ist eröffnet.

Liebe Kolleginnen und Kollegen! Ich begrüße Sie herzlich.

Bevor wir in die Regierungsbefragung und anschließend in die Fragestunde eintreten, möchte ich gerne Ihre Zustimmung zu einer interfraktionellen Vereinbarung herbeiführen, nämlich den Entwurf eines Zweiten Gesetzes zur Änderung des Buchpreisbindungsgesetzes auf der Drucksache 18/8043 dem Ausschuss für Gesundheit zur Mitberatung zu überweisen. Können Sie sich damit anfreunden? - Das ist offenkundig der Fall. Da wird sich der Ausschuss freuen, dass das mit diesem einmütigen Votum des Plenums auch zu seiner Mitberatung überwiesen ist.

Denjenigen, die nach der Regierungsbefragung, zu der wir gleich unter Tagesordnungspunkt 1 kommen werden, an der Fragestunde beteiligt sind, will ich schon jetzt den Hinweis geben, dass weit weniger als die Hälfte der eingereichten Fragen zur mündlichen Beantwortung übrig geblieben sind, sodass diejenigen, die glauben, möglicherweise just in time zur Beantwortung ihrer Frage erscheinen zu können, vielleicht ein bisschen neu disponieren sollten, weil diese womöglich zügiger aufgerufen wird, als man anhand der Papierform vermuten könnte.

Nun kommen wir zum Tagesordnungspunkt 1:

Befragung der Bundesregierung

Die Regierung hat als Thema der heutigen Kabinettssitzung den Berufsbildungsbericht 2016 angegeben.

Das Wort für den einleitenden fünfminütigen Bericht hat die Bundesministerin für Bildung und Forschung, Frau Dr. Wanka.

Ich darf jetzt schon bitten, soweit es absehbare Nachfragen aus den Fraktionen gibt, mir Hinweise zu geben, um das vorab sortieren zu können.

Frau Ministerin, Sie haben das Wort.",TOP 1 Befragung der Bundesregierung,14827,chair,18
1,533480,,1,166,"Dr. Johanna Wanka, Bundesministerin für Bildung und Forschung",Dr. Johanna Wanka,johanna-wanka,,,"Vielen Dank, Herr Präsident. - Meine sehr geehrten Damen und Herren! Wir haben heute früh im Kabinett den Berufsbildungsbericht 2016 beraten. Man kann sagen - das vielleicht auch als Botschaft an die jungen Leute, die heute hier sind -: Die Ausbildungschancen für junge Leute sind derzeit in Deutschland so gut wie seit über 20 Jahren nicht mehr. Wir haben mehr als 522 000 abgeschlossene Ausbildungsverträge, und es sind noch 41 000 Stellen offen. 41 000 Stellen warten auf junge Leute, die Interesse daran haben, eine Ausbildung zu beginnen.

Auf der anderen Seite haben rund 21 000 junge Leute - die genaue Zahl steht im Bericht - noch keine oder noch nicht die richtige Ausbildung gefunden. Das ist eines der Probleme, an deren Lösung wir seit Jahren arbeiten, nämlich dass die Wünsche der Jugendlichen zu den Möglichkeiten auf dem Arbeitsmarkt passen müssen. Viele unserer Instrumente - über einige werden wir ja heute in der Befragung vielleicht auch reden - sind darauf ausgerichtet, dies passend hinzubekommen und den jungen Leuten zu zeigen, wie vielfältig die Berufsmöglichkeiten und wie interessant die unterschiedlichen Berufe sind.

Die Zahl der Ausbildungsverträge ist annähernd so hoch wie im letzten Jahr - nur ein klein wenig niedriger. Ein Grund dafür ist natürlich die demografische Entwicklung. Wenn wir in der Bundesrepublik Deutschland insgesamt wesentlich weniger junge Leute haben, die in einen Ausbildungsberuf gehen können, dann macht sich das auch an der Zahl der Ausbildungsverträge bemerkbar. Zum anderen haben wir in den letzten Jahren natürlich auch ein gestiegenes Interesse am Studium bemerkt.

Was für uns kritisch ist und uns Sorgen macht, ist die Tatsache, dass die Ausbildungsbetriebsquote, das heißt die Zahl der Betriebe, die ausbilden, verglichen mit der Gesamtzahl der Betriebe, gesunken ist. Wir liegen derzeit bei etwa 20 Prozent. Der Schnitt lag über viele Jahre bei 25 Prozent. Die Ausbildungsbetriebsquote ist seit 2009 gesunken. Wenn man genauer hinschaut, dann stellt man fest: Es sind nicht die großen und mittleren Betriebe - diese bilden mehr oder auf gleichem Niveau aus -, sondern es sind vor allen Dingen die kleinen und kleinsten Betriebe, die nicht mehr ausbilden - zum Teil auch aus Resignation, weil sie über Jahre keinen Lehrling, keinen Auszubildenden mehr bekommen haben.

Wir waren und sind stolz, dass es uns gelungen ist, die Zahl der jungen Leute, die im Übergangssystem sind - darin waren einmal über 400 000 junge Leute -, Schritt für Schritt jedes Jahr zu senken, und zwar um insgesamt 165 000. Jetzt sind erstmals nach einer Reihe von Jahren mehr junge Leute im Übergangssystem, nämlich 7 Prozent. Nach Auswertungen des BIBB handelt es sich um junge Flüchtlinge, die zu uns gekommen sind und sich jetzt im Übergangssystem in einer schulischen Fortbildung befinden. Das Übergangssystem ist ja das System, was jungen Leuten, die noch nicht ausbildungsreif sind, die Möglichkeit zur Ausbildungsreife bieten soll. Deswegen sind sie, glaube ich, an dieser Stelle ganz richtig aufgehoben.

Wenn man sich die Zahlen genauer anschaut, dann stellt man außerdem fest: Vor allen Dingen bei den Jugendlichen mit ausländischer Staatsangehörigkeit - ich meine jetzt nicht die jungen Flüchtlinge, die gekommen sind, sondern die Jugendlichen mit Migrationshintergrund, bei denen zum Teil schon die Eltern oder Großeltern nach Deutschland gekommen sind - nehmen zurzeit, obwohl es Steigerungen gab, nur rund 31 Prozent eine berufliche Ausbildung auf. Bei den deutschen Jugendlichen sozusagen sind es 56 Prozent. Deswegen sind Maßnahmen wie die KAUSA-Servicestellen für uns sehr wichtige Instrumente, um die Zahlen in diesem Bereich zu verbessern. Wir werden die Zahl der 13 KAUSA-Servicestellen in diesem Jahr verdoppeln, um sehr viel mehr junge Leute und junge Unternehmer mit Migrationshintergrund zu erreichen.

Insgesamt kann man sagen, dass die Maßnahmen, die wir in der Allianz für Aus- und Weiterbildung vereinbart haben, greifen. Wir haben zum Beispiel 5 000 junge Menschen in einer assistierten Ausbildung. Wir treiben Dinge wie Bildungsketten in starkem Maße voran. Das ist immer noch das beste Instrument, um für eine berufliche Ausbildung zu werben und richtige Entscheidungen herbeizuführen.

Letzte Bemerkung: Eine unserer großen Aktivitäten - eine Maßnahme unseres Hauses gemeinsam mit dem Zentralverband des Deutschen Handwerks und der Bundesagentur - ist ein Programm, das 10 000 junge Leute, junge Flüchtlinge, in Ausbildung, in handwerkliche Berufe, bringen soll. Es gibt 41 000 unbesetzte Stellen. Wenn es uns wirklich gelingt, 10 000 dieser jungen Flüchtlinge in eine handwerkliche Ausbildung zu bringen, dann geht es um eine Größenordnung, die all das übertrifft, was wir durch viele Einzelinitiativen bisher erreicht haben. Darum ist das, wie ich glaube, eine Chance, die wir nutzen sollten, und damit kann sich die Lage in einer Situation, in der wir mehr Fachkräfte brauchen, in eine positive Richtung entwickeln.",TOP 1 Befragung der Bundesregierung,14827,speech,18
2,533481,https://www.abgeordnetenwatch.de/profile/norbert-lammert,2,166,Präsident Dr. Norbert Lammert,Dr. Norbert Lammert,norbert-lammert,1754.0,,Herzlichen Dank. - Wir beginnen jetzt mit den Nachfragen. Die erste Nachfrage stellt Frau Hein.,TOP 1 Befragung der Bundesregierung,14827,chair,18
3,533482,https://www.abgeordnetenwatch.de/profile/dr-rosemarie-hein,3,166,Dr. Rosemarie Hein (DIE LINKE),Dr. Rosemarie Hein,rosemarie-hein,1802.0,linke,"Vielen Dank. - Frau Ministerin, ich gebe zu, dass ich die positive Sicht, die Sie versucht haben zu verkünden, nicht so ganz teilen kann; denn aus den Daten und Zahlen, die uns bisher zugänglich waren, bzw. aus Zeitungsberichten oder Pressemitteilungen ist zu entnehmen, dass es an den signifikanten Stellen, über die wir in den letzten Jahren immer wieder geredet haben, lediglich Veränderungen von unter 1 Prozent gibt, und das seit dem Jahre 2012. Deswegen können wir nicht von einer Verbesserung reden - wir würden es zumindest nicht tun -, sondern eher von einer Stagnation.

Unter diesem Gesichtspunkt stellt sich für mich die Frage: Vor kurzem wurde der Bericht zur Evaluation des Berufsbildungsgesetzes veröffentlicht. Auch die Bundesregierung ist zu dem Schluss gekommen, dass es nur marginaler Veränderungen bedarf. Ich würde Ihnen gern die Frage stellen, wieso wir unter diesen Gesichtspunkten, wo wir doch einen erheblichen Handlungsbedarf haben - das haben Sie zum Teil selbst gesagt -, einen geringen Novellierungsbedarf beim BBiG haben sollen.

Danke schön.",TOP 1 Befragung der Bundesregierung,14827,speech,18
4,533483,,4,166,"Dr. Johanna Wanka, Bundesministerin für Bildung und Forschung",Dr. Johanna Wanka,johanna-wanka,,,"Frau Hein, Sie haben von Stagnation gesprochen. Worauf beziehen Sie das? Auf die Zahl der Ausbildungsverträge?",TOP 1 Befragung der Bundesregierung,14827,speech,18
5,533484,https://www.abgeordnetenwatch.de/profile/dr-rosemarie-hein,5,166,Dr. Rosemarie Hein (DIE LINKE),Dr. Rosemarie Hein,rosemarie-hein,1802.0,linke,"Ja, 0,1 Prozent.",TOP 1 Befragung der Bundesregierung,14827,speech,18
6,533485,,6,166,"Dr. Johanna Wanka, Bundesministerin für Bildung und Forschung",Dr. Johanna Wanka,johanna-wanka,,,"Ja. - Man überlege sich einmal, dass in dem Zeitraum von 2006 bis 2015, in dem das untersucht wurde, die Zahl der jungen Menschen, die die Schule verlassen und damit überhaupt in eine Ausbildung gehen könnten, um 14 Prozent zurückgegangen ist. Wenn man einmal diejenigen herausrechnet, die eine Studienberechtigung haben, und diejenigen nimmt, die keine Studienberechtigung haben - das sind ja in allererster Linie diejenigen, auf die wir im Ausbildungssystem warten -, dann sieht man, dass seit 2006 die Zahl der infragekommenden jungen Leute um 22 Prozent zurückgegangen ist, die Zahl der Ausbildungsverträge um 9 Prozent. Daran sieht man, dass es dort eine enorme Kraftanstrengung von allen beteiligten Seiten gibt - die spürt man -, und das würde ich nicht als Stagnation bezeichnen. Das muss man, auch wenn man in der Opposition ist, fairerweise registrieren.

Sie haben außerdem von der Evaluation des Berufsbildungsgesetzes gesprochen. Den Schluss, dass das Berufsbildungsgesetz beispielsweise die Ursache der Passungsprobleme ist, kann ich überhaupt nicht teilen. Ich denke, wir werden über die Notwendigkeit einer Novellierung diskutieren. Aber dafür, dass das Gesetz novelliert werden muss, weil es an ihm liegt, dass es zu Passungsproblemen kommt, sehe ich kein Indiz.",TOP 1 Befragung der Bundesregierung,14827,speech,18
7,533486,https://www.abgeordnetenwatch.de/profile/norbert-lammert,7,166,Präsident Dr. Norbert Lammert,Dr. Norbert Lammert,norbert-lammert,1754.0,,Rainer Spiering.,TOP 1 Befragung der Bundesregierung,14827,chair,18
8,533487,https://www.abgeordnetenwatch.de/profile/rainer-spiering/archive/216665,8,166,Rainer Spiering (SPD),Rainer Spiering,rainer-spiering,1383.0,spd,"Frau Ministerin, herzlichen Dank für den Berufsbildungsbericht. Sie haben bei einem Unterpunkt die Flüchtlinge erwähnt und gesagt, dass sie jetzt vorrangig an Schulen unterrichtet werden. Ich möchte vorwegschicken: Wir haben heute Morgen ein Gespräch mit VW gehabt. Es ging auch darum, wohin es in Zukunft geht. Da wird es um die große Frage der Digitalisierung gehen.

Eine zentrale Rolle im Rahmen der Berufsausbildung - ich glaube, da sind wir uns alle einig - spielt der Lernstandort Berufsschule, vielleicht sogar die zentralste Rolle. Vor dem Hintergrund der Herausforderungen der Zukunft - Stichwort „Digitalisierung“, aber auch die vielen Menschen, die frohen Mutes nach Deutschland kommen - würde ich gerne wissen: Was plant die Bundesregierung im Bereich der Berufsausbildung, auch vor dem Hintergrund, dass Länder mit der Bewältigung dieser großen Herausforderungen völlig überfordert sind? Was machen wir im Rahmen der universitären Berufsschullehrerausbildung? Wie fördern wir sie? Wo stehen wir da?",TOP 1 Befragung der Bundesregierung,14827,speech,18
9,533488,https://www.abgeordnetenwatch.de/profile/norbert-lammert,9,166,Präsident Dr. Norbert Lammert,Dr. Norbert Lammert,norbert-lammert,1754.0,,Herr Kollege.,TOP 1 Befragung der Bundesregierung,14827,chair,18
10,533489,https://www.abgeordnetenwatch.de/profile/rainer-spiering/archive/216665,10,166,Rainer Spiering (SPD),Rainer Spiering,rainer-spiering,1383.0,spd,"Und was plant die Regierung, um der Herausforderung „Digitalisierung des Lernstandortes Berufsschule“ gerecht zu werden?",TOP 1 Befragung der Bundesregierung,14827,speech,18
11,533490,https://www.abgeordnetenwatch.de/profile/norbert-lammert,11,166,Präsident Dr. Norbert Lammert,Dr. Norbert Lammert,norbert-lammert,1754.0,,Frau Ministerin.,TOP 1 Befragung der Bundesregierung,14827,chair,18
12,533491,,12,166,"Dr. Johanna Wanka, Bundesministerin für Bildung und Forschung",Dr. Johanna Wanka,johanna-wanka,,,"Vielen Dank. - Die universitäre Berufsschullehrerausbildung ist ein Punkt, dem wir bei der Qualitätsoffensive Lehrerbildung besondere Aufmerksamkeit gewidmet haben. Das ist ja ein Programm, bei dem es nicht darauf ankommt, die Länder zu entlasten, die natürlich die Hauptlast der Lehrerausbildung tragen, sondern bei dem es darum geht, neue Wege zu erproben, zum Beispiel hinsichtlich der Frage, wie man die Digitalisierung in der Lehrerausbildung, auch in der Berufsschullehrerausbildung, verankern kann. Ich glaube, mehr als die Hälfte der Projekte, die dort eingereicht wurden, beschäftigt sich mit diesem Thema, auch im Hinblick auf die Berufsschulen. Ich will aber nicht verhehlen, dass ich mir noch mehr konkrete Projekte gerade im Bereich der Berufsschullehrerausbildung gewünscht hätte, weil wir schon seit Jahren Probleme haben, überhaupt geeignete junge Leute zu finden, die sich für dieses Studium bewerben. - Das ist also ein Aspekt, der für uns sehr wichtig ist.

Das, was wir im Bereich der überbetrieblichen Ausbildungsstätten machen, gehört zu den Maßnahmen, die wir im Rahmen unserer Kompetenzen durchführen können. Dort können wir mit Geld fördern, dort können wir mit Know-how fördern.",TOP 1 Befragung der Bundesregierung,14827,speech,18
13,533492,https://www.abgeordnetenwatch.de/profile/norbert-lammert,13,166,Präsident Dr. Norbert Lammert,Dr. Norbert Lammert,norbert-lammert,1754.0,,Frau Ministerin.,TOP 1 Befragung der Bundesregierung,14827,chair,18
14,533493,,14,166,"Dr. Johanna Wanka, Bundesministerin für Bildung und Forschung",Dr. Johanna Wanka,johanna-wanka,,,"Wir wollen aber auch die betrieblichen Ausbilder im Bereich der Medieninformatik fit machen. Wir haben Projekte, in deren Rahmen wir jetzt ungefähr 1 200 Ausbilder in diesem Bereich weiterbilden. Das sind Bereiche, in denen die Bundesregierung Akzente setzt - aber natürlich nicht im Bereich der Berufsschulen, der in der originären Verantwortung der Länder liegt; da haben wir keinen Zugriff.",TOP 1 Befragung der Bundesregierung,14827,speech,18
15,533494,https://www.abgeordnetenwatch.de/profile/norbert-lammert,15,166,Präsident Dr. Norbert Lammert,Dr. Norbert Lammert,norbert-lammert,1754.0,,Gut.,TOP 1 Befragung der Bundesregierung,14827,chair,18
16,533495,,16,166,"Dr. Johanna Wanka, Bundesministerin für Bildung und Forschung",Dr. Johanna Wanka,johanna-wanka,,,"Aber in der Hinführung und auch in der Ausbildung der Berufsschullehrer und eben dann vor Ort, da sind wir als Bundes - -",TOP 1 Befragung der Bundesregierung,14827,speech,18
17,533496,https://www.abgeordnetenwatch.de/profile/norbert-lammert,17,166,Präsident Dr. Norbert Lammert,Dr. Norbert Lammert,norbert-lammert,1754.0,,"Vielen Dank. Wir hatten jetzt eine etwas längere Frage und eine folgerichtig etwas längere Antwort. Aber da es viele Nachfragen gibt, würde ich noch einmal darum bitten, dass wir uns um die Einhaltung der Grenze von einer Minute bemühen. - Frau Walter-Rosenheimer.",TOP 1 Befragung der Bundesregierung,14827,chair,18
18,533497,https://www.abgeordnetenwatch.de/profile/beate-walter-rosenheimer-0,18,166,Beate Walter-Rosenheimer (BÜNDNIS 90/DIE GRÜNEN),Beate Walter-Rosenheimer,beate-walter-rosenheimer,1360.0,gruene,"Sehr geehrte Frau Ministerin, Sie haben vorhin selbst erwähnt, dass viele Betriebe mittlerweile davon absehen, auszubilden, dass die Ausbildungsquote jetzt bei circa 20 Prozent liegt, nachdem es über Jahre hinweg 25 Prozent waren, und es vor allem kleine und Kleinstunternehmen sind, die sich da ausklinken. Meine Frage an Sie ist, ob Sie sich von einer Stärkung der überbetrieblichen Ausbildung versprechen würden, dass diese kleinen Betriebe und Kleinstunternehmen wieder Interesse an der Ausbildung gewinnen und sich dann vorstellen können, da wieder mitzumachen. Also, sehen Sie darin einen Weg?",TOP 1 Befragung der Bundesregierung,14827,speech,18
19,533498,,19,166,"Dr. Johanna Wanka, Bundesministerin für Bildung und Forschung",Dr. Johanna Wanka,johanna-wanka,,,"Ja, sehe ich auf jeden Fall. Wir versuchen auch, die kleinen und kleinsten Betriebe zu stärken - das Problem ist ja nicht neu -, und haben zum Beispiel in einem Programm die Möglichkeit eröffnet, auch Verbundausbildung zu ermöglichen, also dass mehrere Betriebe gemeinsam die Ausbildung zum Beispiel eines Drehers realisieren. Die außerbetrieblichen Ausbildungsstätten sind ein ganz wichtiges Element, um die Betriebe zu motivieren und ihnen zu zeigen: Wenn die jungen Leute dort ausgebildet werden, dann können sie mehr als der Meister im Betrieb, vor allen Dingen im Hinblick auf Informatik und Digitalisierung.",TOP 1 Befragung der Bundesregierung,14827,speech,18
20,533499,https://www.abgeordnetenwatch.de/profile/norbert-lammert,20,166,Präsident Dr. Norbert Lammert,Dr. Norbert Lammert,norbert-lammert,1754.0,,Katrin Albsteiger.,TOP 1 Befragung der Bundesregierung,14827,chair,18
21,533500,https://www.abgeordnetenwatch.de/profile/katrin-albsteiger,21,166,Katrin Albsteiger (CDU/CSU),Katrin Albsteiger,katrin-albsteiger,1275.0,cducsu,"Frau Ministerin, herzlichen Dank für Ihren Bericht. Ich denke, dem Bericht ist durchaus zu entnehmen, dass es die eine oder andere Herausforderung gibt, den einen oder anderen Punkt, auf dem wir noch aufbauen müssen, auch politisch. Auf der anderen Seite wird aber durchaus auch bestätigt, dass unsere politische Arbeit erfolgreich gewesen ist. Wir sehen auch an der niedrigen Jugendarbeitslosigkeitsquote in unserem Land, dass die berufliche Bildung ein Erfolgsmodell ist. Mich würde interessieren, in welcher Art und Weise sich die Bundesregierung einsetzt, um auch in anderen europäischen Ländern dabei unterstützend tätig zu sein.",TOP 1 Befragung der Bundesregierung,14827,speech,18
22,533501,,22,166,"Dr. Johanna Wanka, Bundesministerin für Bildung und Forschung",Dr. Johanna Wanka,johanna-wanka,,,"Es gab in den letzten Jahren nicht nur ein großes Interesse vonseiten anderer Länder in Europa, sondern auch vonseiten Chinas oder auch der amerikanischen Ministerin jetzt auf der Messe in Hannover an der dualen Ausbildung. Wir versuchen, diesem großen Interesse Rechnung zu tragen, indem wir alle, die damit befasst sind - ob das nun das Auswärtige Amt ist, ob das die Kammern sind -, an einen von uns koordinierten runden Tisch zu bringen und dort zu besprechen, wie zum Beispiel Griechenland oder anderen Ländern, die daran Interesse haben, das System der dualen Ausbildung zu vermitteln ist. Wir haben dafür beim BIBB in Bonn eine Anlaufstelle mit mittlerweile ungefähr 17 Mitarbeitern eingerichtet, die sich professionell um das Thema kümmern.

Es geht nicht darum, dass wir unser duales Ausbildungssystem eins zu eins auf China übertragen. Vielmehr soll entschieden werden: Welche Elemente unserer dualen Ausbildung passen zu dem dortigen System, um die besondere Verbindung von betrieblicher und schulischer Bildung zu realisieren?

Auch auf europäischer Ebene haben wir Abkommen geschlossen, um die duale Ausbildung beispielsweise nach Spanien oder in andere Länder zu übertragen. Man muss sagen: Unsere Firmen im Ausland, vor allem die größeren, versuchen immer, dort duale Ausbildung anzubieten.",TOP 1 Befragung der Bundesregierung,14827,speech,18
23,533502,https://www.abgeordnetenwatch.de/profile/norbert-lammert,23,166,Präsident Dr. Norbert Lammert,Dr. Norbert Lammert,norbert-lammert,1754.0,,Frau Binder.,TOP 1 Befragung der Bundesregierung,14827,chair,18
24,533503,https://www.abgeordnetenwatch.de/profile/karin-binder,24,166,Karin Binder (DIE LINKE),Karin Binder,karin-binder,1867.0,linke,"Vielen Dank, Herr Präsident. - Frau Ministerin, zum 30. September 2015 gab es 20 700 unversorgte Jugendliche. Die Allianz für Aus- und Weiterbildung hatte damals versprochen, wer bis dahin noch nicht vermittelt oder versorgt sei, solle von der BA drei Stellenangebote bekommen. Ich wüsste jetzt gerne: Wie viele dieser jungen Menschen haben tatsächlich Angebote erhalten, noch dazu drei Stück? Ich wüsste, wenn möglich, auch gerne: Wie viele davon konnten denn vermittelt werden?",TOP 1 Befragung der Bundesregierung,14827,speech,18
25,533504,,25,166,"Dr. Johanna Wanka, Bundesministerin für Bildung und Forschung",Dr. Johanna Wanka,johanna-wanka,,,"Die Zahlen liegen uns nicht vor, das ist auch nicht so einfach nachzuverfolgen. Aber im Rahmen der Allianz für Aus- und Weiterbildung sind wir mit dem Arbeitsministerium, das in Bezug auf diesen Part mehr Einsichtsmöglichkeiten hatte, auf einem guten Weg.

Ich kann sagen, dass die Wirtschaft im Jahr 2015  7 300 zusätzliche Ausbildungsstellen zur Verfügung gestellt hat und dass es im März dieses Jahres im Vergleich zum März 2014  20 000 Ausbildungsstellen mehr gab.",TOP 1 Befragung der Bundesregierung,14827,speech,18
26,533505,https://www.abgeordnetenwatch.de/profile/norbert-lammert,26,166,Präsident Dr. Norbert Lammert,Dr. Norbert Lammert,norbert-lammert,1754.0,,Kollege Rossmann.,TOP 1 Befragung der Bundesregierung,14827,chair,18
27,533506,https://www.abgeordnetenwatch.de/profile/dr-ernst-dieter-rossmann/archive/216613,27,166,Dr. Ernst Dieter Rossmann (SPD),Dr. Ernst Dieter Rossmann,ernst-dieter-rossmann,1684.0,spd,"Frau Ministerin, ein Erfolg ist ja auch, dass Bund und Länder zusammen mit den Tarifpartnern erreicht haben, dass die Zahl der Jugendlichen im sogenannten Übergangssystem deutlich zurückgegangen ist, von über 400 000 auf 250 000. Ich frage mich, ob wir nicht besser statt von einem Übergangssystem von einem Einstiegssystem sprechen sollten, um der Denunziation, dass es dabei nur um Warteschleifen geht, schon vom Begriff her entgegenzutreten. Deshalb meine Frage: Haben Sie Ideen, wie man das Einstiegssystem alias Übergangssystem verbessern bzw. so ausrichten könnte, dass am Ende noch mehr junge Menschen einen direkten Einstieg in eine vollwertige Berufsausbildung erreichen?",TOP 1 Befragung der Bundesregierung,14827,speech,18
28,533507,,28,166,"Dr. Johanna Wanka, Bundesministerin für Bildung und Forschung",Dr. Johanna Wanka,johanna-wanka,,,"Ja, Herr Rossmann. - Wir wissen ja, dass „Übergangssystem“ einmal die richtige Vokabel war, weil es in einer Zeit, in der es bundesweit zu wenige Ausbildungsplätze gab, eigentlich ein Zwischenparken war. Wir wissen auch, dass die unterschiedlichsten Dinge im Übergangssystem stattgefunden haben.

Unser Ziel ist, dass es ein Einstiegssystem für diejenigen wird, die wirklich der Unterstützung bedürfen. Wenn die Gruppe von Jugendlichen nicht zu groß oder zu heterogen ist - als Beispiel sind jene zu nennen, die schon eine Ausbildung haben, aber noch etwas Weiteres suchen -, dann ist es möglich, es noch mehr zu strukturieren. Derzeit haben wir ein sehr breitgefächertes Angebot, wobei wir in den Beratungen mit den Ländern natürlich immer auf das, was die Länder an der Stelle für eine optimale Lösung hielten, Rücksicht genommen haben. Aber wenn es sich auf die Kerngruppe konzentriert, dann kann es, glaube ich, auch strukturierter, also so, wie es Ihnen vorschwebt, gestaltet werden.",TOP 1 Befragung der Bundesregierung,14827,speech,18
29,533508,https://www.abgeordnetenwatch.de/profile/norbert-lammert,29,166,Präsident Dr. Norbert Lammert,Dr. Norbert Lammert,norbert-lammert,1754.0,,Frau Pothmer.,TOP 1 Befragung der Bundesregierung,14827,chair,18
30,533509,https://www.abgeordnetenwatch.de/profile/brigitte-pothmer,30,166,Brigitte Pothmer (BÜNDNIS 90/DIE GRÜNEN),Brigitte Pothmer,brigitte-pothmer,1705.0,gruene,"Das passt ja. Bei meiner Frage geht es auch um das Übergangssystem. Frau Wanka, Sie haben in Ihrer letzten Haushaltsrede schon prognostiziert, dass die Zahl der Jugendlichen im Übergangssystem wieder anwachsen würde. Das hat mich, ehrlich gesagt, mit tiefer Sorge erfüllt; denn wir wissen ja, dass das Übergangssystem - das wissen wir aus den gemachten Erfahrungen, das wissen wir durch Evaluierungen - die an es gesetzten Erwartungen bei weitem nicht erfüllt, nämlich die Jugendlichen tatsächlich der Ausbildungsreife näherzubringen. Im Gegenteil: Das Übergangssystem wirkt eher demotivierend. Man kann zusammenfassend sagen: Es ist teuer und schlecht.

Deswegen finde ich es hochgradig bedauerlich, dass wir in dieser Situation die Jugendlichen in dem, wie Sie ja selbst sagen, zumindest noch sehr breiten Angebot zwischenparken. Ich hätte von Ihnen deswegen gerne ein paar konkretere Hinweise darauf, wie Sie das Übergangssystem tatsächlich zu einem System des Einstiegs auf dem Weg zu einer abgeschlossenen Berufsausbildung entwickeln wollen.",TOP 1 Befragung der Bundesregierung,14827,speech,18
