,id,profile_url,sequence,sitzung,speaker,speaker_cleaned,speaker_fp,speaker_key,speaker_party,text,top,top_id,type,wahlperiode
337,533816,https://www.abgeordnetenwatch.de/profile/sevim-dagdelen/archive/215517,337,166,Sevim Dağdelen (DIE LINKE),Sevim Dağdelen,sevim-dagdelen,1850.0,linke,"Wir müssen hier Position beziehen und eine klare Haltung nicht nur gegenüber der Zivilgesellschaft, den verfolgten Kurden, den verfolgten Aleviten, den verfolgten Armeniern oder den verfolgten Journalisten und Gewerkschaftern in der Türkei einnehmen. Vielmehr müssen wir sogar - dazu hat uns diese Bundesregierung gebracht - unsere verfassungsmäßigen Grundwerte und Grundrechte verteidigen, weil Sie in den letzten Jahren Dialog mit Unterwerfung verwechselt haben. Wir brauchen einen Dialog mit der Türkei. Aber wir brauchen keine Unterwürfigkeit, kein Duckmäusertum, keine ständigen Bücklinge in Ankara, die der Zivilgesellschaft in der Türkei mehr schaden als helfen.

Vielen Dank.",TOP ZP 1 Aktuelle Stunde zum Umgang mit der Presse- und Meinungsfreiheit in der Türkei,14829,speech,18
338,533817,,338,166,,,,,,Beifall bei der LINKEN,TOP ZP 1 Aktuelle Stunde zum Umgang mit der Presse- und Meinungsfreiheit in der Türkei,14829,poi,18
339,533818,https://www.abgeordnetenwatch.de/profile/petra-pau/archive/215458,339,166,Vizepräsidentin Petra Pau,Petra Pau,petra-pau,1713.0,,Der Kollege Martin Dörmann hat für die SPD-Fraktion das Wort.,TOP ZP 1 Aktuelle Stunde zum Umgang mit der Presse- und Meinungsfreiheit in der Türkei,14829,chair,18
340,533819,,340,166,,,,,,Beifall bei der SPD,TOP ZP 1 Aktuelle Stunde zum Umgang mit der Presse- und Meinungsfreiheit in der Türkei,14829,poi,18
341,533820,https://www.abgeordnetenwatch.de/profile/martin-dormann/archive/216748,341,166,Martin Dörmann (SPD),Martin Dörmann,martin-dormann,1844.0,spd,"Frau Präsidentin! Liebe Kolleginnen und Kollegen! Presse- und Meinungsfreiheit sind Grundpfeiler jeder Demokratie. Es muss uns deshalb umtreiben, dass in immer mehr Staaten Journalisten und andere kritische Stimmen mit Repressalien bedroht werden. Wir sollten laut vernehmbar unsere Stimme erheben, um unabhängige Berichterstattung zu schützen.

Das gilt auch und gerade für die Türkei, die aus vielen Gründen ein wichtiges Partnerland für Deutschland ist. Umso mehr muss uns beunruhigen, dass die Türkei auf der von „Reporter ohne Grenzen“ aufgestellten Liste der Pressefreiheit weit hinten liegt, nämlich auf Platz 151 von 180 Staaten. Seit Jahren gibt es dort eine sehr negative Entwicklung in Bezug auf Presse- und Meinungsfreiheit, entscheidend forciert durch die zunehmend autokratische Politik des heutigen Staatspräsidenten Erdogan. Hunderte türkische Journalisten müssen sich wegen kritischer oder investigativer Veröffentlichungen vor Gericht verantworten. Inzwischen sind beinahe 2 000 Menschen mit Strafverfahren wegen Beleidigung des Präsidenten oder ähnlicher Vorwürfe überzogen worden. Die FAZ schrieb gestern von einem „Zustand fortgeschrittenen Majestätsbeleidigungswahns“ des Präsidenten, der mit den Methoden eines Polizeistaats vorgehe. Nun sind auch verstärkt ausländische Journalisten im Visier. Es häufen sich Berichte über schwarze Listen. Der Spiegel-Online-Korrespondent Hasnain Kazim musste kürzlich aus Angst vor einer Festnahme das Land verlassen. Gestern schrieb er auf Spiegel Online:

Die Türkei setzt internationale Pressevertreter unter Druck, mit Einreiseverboten, Anzeigen und Hasskampagnen im Internet. Die Reporter spüren jetzt die Angst, die ihre einheimischen Kollegen schon lange kennen.

Vermehrt interveniert die Türkei jetzt bei unliebsamen Beiträgen sogar im Ausland, wie mit der Einbestellung des deutschen Botschafters wegen eines Erdogan-kritischen Satireliedes in der ARD-Sendung extra3. Vor diesem Hintergrund war es richtig, dass Außenminister Frank-Walter Steinmeier und Justizminister Heiko Maas im Kabinett gegen den Antrag der Türkei im Fall Böhmermann und damit gegen eine Strafverfolgungsermächtigung wegen Majestätsbeleidigung gestimmt haben;",TOP ZP 1 Aktuelle Stunde zum Umgang mit der Presse- und Meinungsfreiheit in der Türkei,14829,speech,18
342,533821,,342,166,,,,,,Beifall bei der SPD sowie bei Abgeordneten der LINKEN,TOP ZP 1 Aktuelle Stunde zum Umgang mit der Presse- und Meinungsfreiheit in der Türkei,14829,poi,18
343,533822,https://www.abgeordnetenwatch.de/profile/martin-dormann/archive/216748,343,166,Martin Dörmann (SPD),Martin Dörmann,martin-dormann,1844.0,spd,"denn bei dieser Ermessensentscheidung kam es eben nicht auf juristische Erwägungen an, sondern vor allem auf die politische Wirkung. Die Verweigerung der Ermächtigung wäre ein starkes Signal gewesen, für Satire- und Meinungsfreiheit und gegen die Strategie des türkischen Präsidenten, kritische Stimmen mit den Mitteln des Strafrechts einzuschüchtern.

Die Kanzlerin hat leider anders entschieden und damit in Kauf genommen, dass hierdurch in den Augen vieler Menschen die gegenteiligen Signale gesetzt wurden. Das Votum der Kanzlerin ist aber auch widersprüchlich; denn sie selbst hat ja die Sondervorschrift des § 103 Strafgesetzbuch, landläufig als Majestätsbeleidigung bekannt, als für die Zukunft entbehrlich bezeichnet und deren Abschaffung angekündigt. Die Justiz kann ja bekanntlich - wie im vorliegenden Fall - wegen des normalen Beleidigungstatbestandes unabhängig ermitteln, genauso wie bei jedem anderen Bürger, aber eben nicht mit einer erhöhten Strafandrohung wie bei Staatsoberhäuptern. Nun fragt sich jeder doch: Warum soll jetzt noch zur Anwendung kommen, was eigentlich entbehrlich ist? Das öffnet letztlich Spekulationen Tür und Tor. Es darf doch gar nicht erst ein falscher Eindruck etwa in Bezug auf das Flüchtlingsabkommen der EU mit der Türkei erweckt werden. Vielmehr müssen wir klarmachen: Presse-, Kunst- und Meinungsfreiheit sind für uns nicht verhandelbar.",TOP ZP 1 Aktuelle Stunde zum Umgang mit der Presse- und Meinungsfreiheit in der Türkei,14829,speech,18
344,533823,,344,166,,,,,,"Beifall bei der SPD, der LINKEN und dem BÜNDNIS 90/DIE GRÜNEN",TOP ZP 1 Aktuelle Stunde zum Umgang mit der Presse- und Meinungsfreiheit in der Türkei,14829,poi,18
345,533824,https://www.abgeordnetenwatch.de/profile/martin-dormann/archive/216748,345,166,Martin Dörmann (SPD),Martin Dörmann,martin-dormann,1844.0,spd,"Liebe Kolleginnen und Kollegen, die SPD-Bundestagsfraktion hat gestern einen Gesetzentwurf zur sofortigen Abschaffung dieses unzeitgemäßen § 103 Strafgesetzbuch vorgelegt; denn es sind nicht die Obamas dieser Welt, die sich darauf berufen; es sind andere. Deshalb zum Schluss mein Appell an unseren Koalitionspartner: Lassen Sie uns diese unselige Sondervorschrift doch einfach schnell streichen! Lassen Sie uns ein klares Signal setzen, dass wir autokratischen Machthabern kein Sonderrecht mehr einräumen; denn unsere Haltung muss doch klar sein: Im Zweifel für die Freiheit.

Vielen Dank.",TOP ZP 1 Aktuelle Stunde zum Umgang mit der Presse- und Meinungsfreiheit in der Türkei,14829,speech,18
346,533825,,346,166,,,,,,Beifall bei der SPD und dem BÜNDNIS 90/DIE GRÜNEN,TOP ZP 1 Aktuelle Stunde zum Umgang mit der Presse- und Meinungsfreiheit in der Türkei,14829,poi,18
347,533826,https://www.abgeordnetenwatch.de/profile/petra-pau/archive/215458,347,166,Vizepräsidentin Petra Pau,Petra Pau,petra-pau,1713.0,,Das Wort hat die Kollegin Claudia Roth für die Fraktion Bündnis 90/Die Grünen.,TOP ZP 1 Aktuelle Stunde zum Umgang mit der Presse- und Meinungsfreiheit in der Türkei,14829,chair,18
348,533827,https://www.abgeordnetenwatch.de/profile/claudia-roth-0,348,166,Claudia Roth (Augsburg) (BÜNDNIS 90/DIE GRÜNEN),Claudia Roth,claudia-roth,1686.0,gruene,"Sehr geehrte Frau Präsidentin! Liebe Kolleginnen und Kollegen! Worum geht es? Es geht um die Pressefreiheit, also um das unzensierte Veröffentlichen von Informationen und Meinungen. Es geht darum, Fakten zu recherchieren, Licht ins Dunkel zu bringen und die Kontrolle der Regierung erst zu ermöglichen. Es geht um nichts weniger als um das Grundnahrungsmittel in der Demokratie. Aber auch die Kunst, auch die Satirefreiheit - sie machen uns reich, sie müssen respektiert und geschützt werden als universelles Recht, also bei uns und bei unseren Partnern.",TOP ZP 1 Aktuelle Stunde zum Umgang mit der Presse- und Meinungsfreiheit in der Türkei,14829,speech,18
349,533828,,349,166,,,,,,Beifall beim BÜNDNIS 90/DIE GRÜNEN sowie bei Abgeordneten der SPD und der LINKEN,TOP ZP 1 Aktuelle Stunde zum Umgang mit der Presse- und Meinungsfreiheit in der Türkei,14829,poi,18
350,533829,https://www.abgeordnetenwatch.de/profile/claudia-roth-0,350,166,Claudia Roth (Augsburg) (BÜNDNIS 90/DIE GRÜNEN),Claudia Roth,claudia-roth,1686.0,gruene,"Was ist die Realität bei unserem Partner Türkei? Entrechtung des Rechts, Freiheit im freien Fall, systematischer Abbau der Demokratie. Wer in der Türkei objektiv und kritisch berichtet und damit auch die dunklen Räume des AKP-Regimes erhellt, der lebt in Angst und Gefahr: wenn es um die Abschiebung von Flüchtlingen nach Syrien geht, wenn es über die geheimen Waffenlieferungen der Regierung an Islamisten zu berichten gilt, wenn die Situation in den kurdischen Städten, in denen ein Krieg gegen die eigene Bevölkerung geführt wird, Thema ist.

Aber wir vergessen sie nicht: Can Dündar und Erdem Gül von der Cumhuriyet, die wegen Beleidigung des Staatspräsidenten verurteilt worden sind und denen jetzt hohe Strafen wegen angeblicher Spionage und Unterstützung einer terroristischen Organisation drohen. Wir vergessen sie nicht: Cevheri Güven und Murat Capan von der Nokta, angeklagt wegen angeblicher Putschpläne. Ihr Verbrechen: ein Titelblatt zum Bürgerkrieg im Südosten der Türkei. Abdülhamit Bilici, ehemaliger Chefredakteur der auflagenstärksten Zeitung, der Zaman: Ihm wird die Unterstützung von Terroristen vorgeworfen, seine Redaktion wurde gestürmt und unter Zwangsverwaltung gestellt, genauso wie die des Medienkonzerns Koza-Ipek und die von Fernsehsendern wie Bügün und Kanaltürk.

Inzwischen gilt aber diese systematische Kriminalisierung nicht mehr nur für Journalisten aus oder in der Türkei; es sind mehr und mehr auch ausländische Korrespondenten von Repression in ihrer Arbeit betroffen. Ich will auch sie benennen: Volker Schwenck, David Lepeska, Ebru Umar, Giorgos Moutafis und Hasnain Kazim. Sie, wie die 2 000 Personen, die in der Türkei derzeit wegen angeblicher Beleidigung des Präsidenten angeklagt sind, brauchen kein stillschweigendes Wegducken, sie brauchen unsere laute Stimme der Kritik. Vor allem brauchen sie unsere deutliche Unterstützung.",TOP ZP 1 Aktuelle Stunde zum Umgang mit der Presse- und Meinungsfreiheit in der Türkei,14829,speech,18
351,533830,,351,166,,,,,,"Beifall beim BÜNDNIS 90/DIE GRÜNEN, bei der SPD und der LINKEN",TOP ZP 1 Aktuelle Stunde zum Umgang mit der Presse- und Meinungsfreiheit in der Türkei,14829,poi,18
352,533831,https://www.abgeordnetenwatch.de/profile/claudia-roth-0,352,166,Claudia Roth (Augsburg) (BÜNDNIS 90/DIE GRÜNEN),Claudia Roth,claudia-roth,1686.0,gruene,"Liebe Kolleginnen und Kollegen, wer soll uns denn in Zukunft darüber informieren, was los ist in dem Land, dem wir nun das Schicksal von Millionen von geflüchteten Menschen anvertrauen? Oder reicht uns etwa eine von der türkischen Regierung inszenierte Potemkin’sche Politshow in aufpolierten Flüchtlingslagern aus?

Bei der Kritik an Erdogan - das ist uns sehr wichtig - oder der Kritik an der türkischen Regierung geht es aber nicht um ein antitürkisches Ressentiment. Kritik heißt nicht: „Schlagt alle Türen zu!“; denn Erdogan ist nicht die Türkei. Es geht stattdessen darum, diejenigen Kräfte zu unterstützen, die eine demokratische Türkei wollen, die eine europäische Türkei wollen, die keine islamische Türkei und keine Verfassungsänderung wollen.

Doch genau bei den demokratischen, europäischen Kräften ist nun der Eindruck entstanden, Deutschland und Europa hätten sie vergessen und ließen sie allein. Das ist wirklich verheerend. Deshalb: Lassen wir sie nicht im Stich! Verkaufen wir sie nicht für einen gefährlichen Deal mit Erdogan, der uns und die Türkei teuer zu stehen kommt, von den Flüchtlingen ganz zu schweigen.

Mit diesem Deal wird doch nicht Stabilität, nicht Frieden unterstützt, sondern ein Destabilisator in einer gefährlich instabilen Region, ein Autokrat, der polarisiert, der spaltet, der kriminalisiert, der beleidigt, der neue Fluchtursachen schafft und der so längst auch der wirtschaftlichen Entwicklung in der Türkei massiv schadet. All das kann doch überhaupt nicht in unserem Interesse sein. Deshalb bin ich sehr froh, dass wir uns - nicht zuletzt in Erinnerung an den ermordeten Journalisten Hrant Dink - wenigstens einigen konnten, zum Genozid an den Armeniern ein klares gemeinsames Zeichen zu setzen.

Vielen Dank.",TOP ZP 1 Aktuelle Stunde zum Umgang mit der Presse- und Meinungsfreiheit in der Türkei,14829,speech,18
353,533832,,353,166,,,,,,Beifall beim BÜNDNIS 90/DIE GRÜNEN sowie bei Abgeordneten der SPD,TOP ZP 1 Aktuelle Stunde zum Umgang mit der Presse- und Meinungsfreiheit in der Türkei,14829,poi,18
354,533833,https://www.abgeordnetenwatch.de/profile/dr-dietmar-bartsch-0,354,166,Dr. Dietmar Bartsch [DIE LINKE],Dr. Dietmar Bartsch,dietmar-bartsch,1871.0,linke,Na ja! Ganz gemeinsam leider nicht!,TOP ZP 1 Aktuelle Stunde zum Umgang mit der Presse- und Meinungsfreiheit in der Türkei,14829,poi,18
355,533834,https://www.abgeordnetenwatch.de/profile/petra-pau/archive/215458,355,166,Vizepräsidentin Petra Pau,Petra Pau,petra-pau,1713.0,,Der Kollege Matern von Marschall hat für die CDU/CSU-Fraktion das Wort.,TOP ZP 1 Aktuelle Stunde zum Umgang mit der Presse- und Meinungsfreiheit in der Türkei,14829,chair,18
356,533835,,356,166,,,,,,Beifall bei der CDU/CSU,TOP ZP 1 Aktuelle Stunde zum Umgang mit der Presse- und Meinungsfreiheit in der Türkei,14829,poi,18
357,533836,https://www.abgeordnetenwatch.de/profile/matern-von-marschall,357,166,Matern von Marschall (CDU/CSU),Matern von Marschall,matern-marschall,1279.0,cducsu,"Verehrte Frau Präsidentin! Herzlichen Dank. - Ich frage mich ein wenig, wozu die Debatte dient, ob sie gegebenenfalls auch einfach nur ein Testen und Abklopfen politischer Nähe zwischen den Fraktionen im linken Spektrum ist. Das könnte auch gut sein.",TOP ZP 1 Aktuelle Stunde zum Umgang mit der Presse- und Meinungsfreiheit in der Türkei,14829,speech,18
358,533837,,358,166,,,,,,Beifall bei Abgeordneten der CDU/CSU,TOP ZP 1 Aktuelle Stunde zum Umgang mit der Presse- und Meinungsfreiheit in der Türkei,14829,poi,18
359,533838,,359,166,,,,,,Widerspruch bei der LINKEN und dem BÜNDNIS 90/DIE GRÜNEN,TOP ZP 1 Aktuelle Stunde zum Umgang mit der Presse- und Meinungsfreiheit in der Türkei,14829,poi,18
360,533839,https://www.abgeordnetenwatch.de/profile/ozcan-mutlu/archive/215087,360,166,Özcan Mutlu [BÜNDNIS 90/DIE GRÜNEN],Özcan Mutlu,ozcan-mutlu,1568.0,gruene,Was ist denn das für ein Einstieg? Das ist doch peinlich!,TOP ZP 1 Aktuelle Stunde zum Umgang mit der Presse- und Meinungsfreiheit in der Türkei,14829,poi,18
361,533840,https://www.abgeordnetenwatch.de/profile/matern-von-marschall,361,166,Matern von Marschall (CDU/CSU),Matern von Marschall,matern-marschall,1279.0,cducsu,"Im Übrigen, Frau Kollegin Schlegel, sind wir in der vergangenen Woche zusammen in der Türkei gewesen und teilen im Wesentlichen die Einschätzung über die Defizite in Rechtsstaatlichkeit, Presse- und Meinungsfreiheit sowie im Demonstrationsrecht. Es geht hier aber nicht um einen Deal, wie Sie, Kollegin Dağdelen und Kollegin Roth, gesagt haben; Sie haben das noch mit dem Adjektiv „schmutzig“ ergänzt. Ich möchte einmal darauf zu sprechen kommen, dass die Türkei - mit fast 3 Millionen Flüchtlingen - und Deutschland die wesentlichste Hilfe in der Flüchtlingskrise geleistet haben. Deshalb ist auch der Türkei in diesem Falle zu danken. Dies hat die Kanzlerin völlig zu Recht getan.",TOP ZP 1 Aktuelle Stunde zum Umgang mit der Presse- und Meinungsfreiheit in der Türkei,14829,speech,18
362,533841,,362,166,,,,,,Beifall bei der CDU/CSU,TOP ZP 1 Aktuelle Stunde zum Umgang mit der Presse- und Meinungsfreiheit in der Türkei,14829,poi,18
363,533842,https://www.abgeordnetenwatch.de/profile/matern-von-marschall,363,166,Matern von Marschall (CDU/CSU),Matern von Marschall,matern-marschall,1279.0,cducsu,"Da hier suggeriert worden ist, die Bundesregierung kümmere sich nicht um die Defizite, die wir als Delegation des Bundestages vor Ort sehr wohl haben nachvollziehen können, keineswegs nur im Gespräch mit der Regierung, sondern auch mit den Oppositionsparteien, mit NGOs, politischen Stiftungen und vielen anderen Kundigen, möchte ich Ihnen zitieren, was die Bundeskanzlerin in der gemeinsamen Pressekonferenz - neben Davutoglu stehend - mit Blick auf die Pressefreiheit gesagt hat:

Wenn es Fälle gibt, die die Pressefreiheit betreffen …, dann wird das angesprochen, dann wird das auf den Tisch gelegt, dann können wir darüber auch sehr offen und ehrlich sprechen.",TOP ZP 1 Aktuelle Stunde zum Umgang mit der Presse- und Meinungsfreiheit in der Türkei,14829,speech,18
364,533843,https://www.abgeordnetenwatch.de/profile/dr-dietmar-bartsch-0,364,166,Dr. Dietmar Bartsch [DIE LINKE],Dr. Dietmar Bartsch,dietmar-bartsch,1871.0,linke,Sensationell!,TOP ZP 1 Aktuelle Stunde zum Umgang mit der Presse- und Meinungsfreiheit in der Türkei,14829,poi,18
365,533844,https://www.abgeordnetenwatch.de/profile/matern-von-marschall,365,166,Matern von Marschall (CDU/CSU),Matern von Marschall,matern-marschall,1279.0,cducsu,"Das ist doch im besten Sinne das, was die Kanzlerin tut. Deshalb liegen Sie da völlig falsch. Die Intensität der Gespräche, die die Kanzlerin in den letzten Monaten im Zusammenhang mit der Flüchtlingskrise mit der türkischen Regierung geführt hat,",TOP ZP 1 Aktuelle Stunde zum Umgang mit der Presse- und Meinungsfreiheit in der Türkei,14829,speech,18
366,533845,https://www.abgeordnetenwatch.de/profile/ulla-jelpke/archive/187231,366,166,Ulla Jelpke [DIE LINKE],Ulla Jelpke,ulla-jelpke,1596.0,linke,Hinter verschlossenen Türen!,TOP ZP 1 Aktuelle Stunde zum Umgang mit der Presse- und Meinungsfreiheit in der Türkei,14829,poi,18
367,533846,https://www.abgeordnetenwatch.de/profile/matern-von-marschall,367,166,Matern von Marschall (CDU/CSU),Matern von Marschall,matern-marschall,1279.0,cducsu,"ist eben sehr wohl eine große Chance, auch andere Themen zu adressieren, und genau dies tut sie.",TOP ZP 1 Aktuelle Stunde zum Umgang mit der Presse- und Meinungsfreiheit in der Türkei,14829,speech,18
368,533847,,368,166,Zuruf von der CDU/CSU,von der CDU/CSU,von-der-cdu-csu,,cducsu,Genau!,TOP ZP 1 Aktuelle Stunde zum Umgang mit der Presse- und Meinungsfreiheit in der Türkei,14829,poi,18
369,533848,https://www.abgeordnetenwatch.de/profile/matern-von-marschall,369,166,Matern von Marschall (CDU/CSU),Matern von Marschall,matern-marschall,1279.0,cducsu,Dafür bin ich ihr auch sehr dankbar.,TOP ZP 1 Aktuelle Stunde zum Umgang mit der Presse- und Meinungsfreiheit in der Türkei,14829,speech,18
370,533849,,370,166,,,,,,Beifall bei der CDU/CSU,TOP ZP 1 Aktuelle Stunde zum Umgang mit der Presse- und Meinungsfreiheit in der Türkei,14829,poi,18
371,533850,https://www.abgeordnetenwatch.de/profile/ozcan-mutlu/archive/215087,371,166,Özcan Mutlu [BÜNDNIS 90/DIE GRÜNEN],Özcan Mutlu,ozcan-mutlu,1568.0,gruene,"Wie wäre es denn, wenn sie bedrohte Journalisten trifft?",TOP ZP 1 Aktuelle Stunde zum Umgang mit der Presse- und Meinungsfreiheit in der Türkei,14829,poi,18
372,533851,https://www.abgeordnetenwatch.de/profile/matern-von-marschall,372,166,Matern von Marschall (CDU/CSU),Matern von Marschall,matern-marschall,1279.0,cducsu,- Ich komme noch zu den bedrohten Journalisten.,TOP ZP 1 Aktuelle Stunde zum Umgang mit der Presse- und Meinungsfreiheit in der Türkei,14829,speech,18
373,533852,https://www.abgeordnetenwatch.de/profile/ozcan-mutlu/archive/215087,373,166,Özcan Mutlu [BÜNDNIS 90/DIE GRÜNEN],Özcan Mutlu,ozcan-mutlu,1568.0,gruene,"Nicht Sie, die Kanzlerin!",TOP ZP 1 Aktuelle Stunde zum Umgang mit der Presse- und Meinungsfreiheit in der Türkei,14829,poi,18
374,533853,https://www.abgeordnetenwatch.de/profile/matern-von-marschall,374,166,Matern von Marschall (CDU/CSU),Matern von Marschall,matern-marschall,1279.0,cducsu,"Wir waren mit der Delegation auch bei Herrn Dündar; das war - Kollegin Schlegel, Sie haben es erwähnt - ein interessantes Gespräch. Ich muss jedoch sagen - das ist mir schon sehr wichtig -: Ich habe Herrn Dündar in unserem Gespräch als einen eleganten, höflichen und zurückhaltenden Mann kennengelernt. Der Text, den er im Spiegel veröffentlicht hat, ist aber ganz anders; das ist ein von brachialer Kriegsrhetorik geprägter Text.",TOP ZP 1 Aktuelle Stunde zum Umgang mit der Presse- und Meinungsfreiheit in der Türkei,14829,speech,18
375,533854,,375,166,Zuruf von der LINKEN,von der LINKEN,von-der-linken,,linke,Warum wohl?,TOP ZP 1 Aktuelle Stunde zum Umgang mit der Presse- und Meinungsfreiheit in der Türkei,14829,poi,18
376,533855,https://www.abgeordnetenwatch.de/profile/matern-von-marschall,376,166,Matern von Marschall (CDU/CSU),Matern von Marschall,matern-marschall,1279.0,cducsu,"- Ja, das will ich Ihnen sagen: weil die Polarisierung in der türkischen Gesellschaft unglaublich weit vorangeschritten ist. Ich will Ihnen auch sagen: Wenn Sie diese Polarisierung aus der Türkei hier ins Parlament tragen, dann ist das bestimmt nicht der richtige Weg, um die Menschen in diesem Land auf den Weg einer Annäherung an Europa zu bringen.",TOP ZP 1 Aktuelle Stunde zum Umgang mit der Presse- und Meinungsfreiheit in der Türkei,14829,speech,18
377,533856,,377,166,,,,,,Beifall bei der CDU/CSU,TOP ZP 1 Aktuelle Stunde zum Umgang mit der Presse- und Meinungsfreiheit in der Türkei,14829,poi,18
378,533857,https://www.abgeordnetenwatch.de/profile/ozcan-mutlu/archive/215087,378,166,Özcan Mutlu [BÜNDNIS 90/DIE GRÜNEN],Özcan Mutlu,ozcan-mutlu,1568.0,gruene,"Sie haben wirklich nichts verstanden, oder?",TOP ZP 1 Aktuelle Stunde zum Umgang mit der Presse- und Meinungsfreiheit in der Türkei,14829,poi,18
379,533858,,379,166,,,,,,Zuruf des Abg. Dr. Dietmar Bartsch [DIE LINKE],TOP ZP 1 Aktuelle Stunde zum Umgang mit der Presse- und Meinungsfreiheit in der Türkei,14829,poi,18
380,533859,https://www.abgeordnetenwatch.de/profile/matern-von-marschall,380,166,Matern von Marschall (CDU/CSU),Matern von Marschall,matern-marschall,1279.0,cducsu,"Das ist nämlich der kapitale Fehler, den Sie machen, und Ihr Geschwätz von Erpressbarkeit, Herr Bartsch, kann man nicht mehr hören. Das ist unterirdisch und im Grunde auch zynisch gegenüber den Notleidenden.",TOP ZP 1 Aktuelle Stunde zum Umgang mit der Presse- und Meinungsfreiheit in der Türkei,14829,speech,18
381,533860,https://www.abgeordnetenwatch.de/profile/ozcan-mutlu/archive/215087,381,166,Özcan Mutlu [BÜNDNIS 90/DIE GRÜNEN],Özcan Mutlu,ozcan-mutlu,1568.0,gruene,Getroffene Hunde bellen!,TOP ZP 1 Aktuelle Stunde zum Umgang mit der Presse- und Meinungsfreiheit in der Türkei,14829,poi,18
382,533861,,382,166,Matthias W. Birkwald [DIE LINKE],Matthias W. Birkwald,matthias-birkwald,,linke,"Das ist jetzt keine Polarisierung, oder wie?",TOP ZP 1 Aktuelle Stunde zum Umgang mit der Presse- und Meinungsfreiheit in der Türkei,14829,poi,18
383,533862,https://www.abgeordnetenwatch.de/profile/matern-von-marschall,383,166,Matern von Marschall (CDU/CSU),Matern von Marschall,matern-marschall,1279.0,cducsu,Sie können sich gern alle gegenseitig beklatschen in diesem Spektrum. Fahren Sie nur fort in dieser Hinsicht!,TOP ZP 1 Aktuelle Stunde zum Umgang mit der Presse- und Meinungsfreiheit in der Türkei,14829,speech,18
384,533863,,384,166,Matthias W. Birkwald [DIE LINKE],Matthias W. Birkwald,matthias-birkwald,,linke,Ihre Rede ist eine Contradictio in adiecto!,TOP ZP 1 Aktuelle Stunde zum Umgang mit der Presse- und Meinungsfreiheit in der Türkei,14829,poi,18
385,533864,https://www.abgeordnetenwatch.de/profile/matern-von-marschall,385,166,Matern von Marschall (CDU/CSU),Matern von Marschall,matern-marschall,1279.0,cducsu,"- Wenn Sie wenigstens den Sprecher hier ausreden lassen würden, dann wäre das ganz höflich.",TOP ZP 1 Aktuelle Stunde zum Umgang mit der Presse- und Meinungsfreiheit in der Türkei,14829,speech,18
386,533865,,386,166,Matthias W. Birkwald [DIE LINKE],Matthias W. Birkwald,matthias-birkwald,,linke,Ach so! Jetzt werden auch Zwischenrufe verboten! So weit sind wir schon?,TOP ZP 1 Aktuelle Stunde zum Umgang mit der Presse- und Meinungsfreiheit in der Türkei,14829,poi,18
387,533866,https://www.abgeordnetenwatch.de/profile/matern-von-marschall,387,166,Matern von Marschall (CDU/CSU),Matern von Marschall,matern-marschall,1279.0,cducsu,In einer Aktuellen Stunde gibt es nämlich keine Gelegenheit für Interventionen.,TOP ZP 1 Aktuelle Stunde zum Umgang mit der Presse- und Meinungsfreiheit in der Türkei,14829,speech,18
388,533867,,388,166,Matthias W. Birkwald [DIE LINKE],Matthias W. Birkwald,matthias-birkwald,,linke,Aber für Zwischenrufe!,TOP ZP 1 Aktuelle Stunde zum Umgang mit der Presse- und Meinungsfreiheit in der Türkei,14829,poi,18
389,533868,https://www.abgeordnetenwatch.de/profile/matern-von-marschall,389,166,Matern von Marschall (CDU/CSU),Matern von Marschall,matern-marschall,1279.0,cducsu,Deswegen würde ich zumindest gern die fünf Minuten meiner Redezeit ausschöpfen.,TOP ZP 1 Aktuelle Stunde zum Umgang mit der Presse- und Meinungsfreiheit in der Türkei,14829,speech,18
390,533869,https://www.abgeordnetenwatch.de/profile/ozcan-mutlu/archive/215087,390,166,Özcan Mutlu [BÜNDNIS 90/DIE GRÜNEN],Özcan Mutlu,ozcan-mutlu,1568.0,gruene,"Wollen Sie uns die Zwischenrufe verbieten, oder was?",TOP ZP 1 Aktuelle Stunde zum Umgang mit der Presse- und Meinungsfreiheit in der Türkei,14829,poi,18
