,id,profile_url,sequence,sitzung,speaker,speaker_cleaned,speaker_fp,speaker_key,speaker_party,text,top,top_id,type,wahlperiode
1639,680241,https://www.abgeordnetenwatch.de/profile/jorn-wunderlich/archive/215545,1639,203,Jörn Wunderlich (DIE LINKE),Jörn Wunderlich,jorn-wunderlich,1617,linke,"Gut. Das wurde in der Bereinigungssitzung geklärt.

Was positiv zu erwähnen ist - auch das ist schon angesprochen worden -, ist der Ausbau des Unterhaltsvorschusses als eines wichtigen Schrittes im Kampf gegen Kinderarmut. Auf der Ministerpräsidentenkonferenz wurde, wie schon gesagt, im Rahmen dieses Gesamtpakets ein entsprechender Beschluss mit 16 : 0 gefasst. Es ist auch im Kabinett beschlossen worden. Letzte Woche sollte der betreffende Gesetzentwurf hier auf die Tagesordnung. Jetzt fehlt er immer noch im Parlament; er ist zurückgezogen worden.","TOP I.16 Familie, Senioren, Frauen und Jugend",15092,speech,18
1640,680242,https://www.abgeordnetenwatch.de/profile/paul-lehrieder/archive/214984,1640,203,Paul Lehrieder [CDU/CSU],Paul Lehrieder,paul-lehrieder,1747,cducsu,Das kann man alles erklären!,"TOP I.16 Familie, Senioren, Frauen und Jugend",15092,poi,18
1641,680243,https://www.abgeordnetenwatch.de/profile/jorn-wunderlich/archive/215545,1641,203,Jörn Wunderlich (DIE LINKE),Jörn Wunderlich,jorn-wunderlich,1617,linke,"Nach meiner Kenntnis blockt im Moment die CDU/CSU-Fraktion - weil Kinderarmut vielleicht doch nicht so ihr Thema ist -,","TOP I.16 Familie, Senioren, Frauen und Jugend",15092,speech,18
1642,680244,https://www.abgeordnetenwatch.de/profile/manfred-grund/archive/213924,1642,203,Manfred Grund [CDU/CSU],Manfred Grund,manfred-grund,1814,cducsu,Jetzt reicht es aber! Das ist eine unglaubliche Unterstellung!,"TOP I.16 Familie, Senioren, Frauen und Jugend",15092,poi,18
1643,680245,,1643,203,,,,,,Weitere Zurufe von der CDU/CSU,"TOP I.16 Familie, Senioren, Frauen und Jugend",15092,poi,18
1644,680246,https://www.abgeordnetenwatch.de/profile/jorn-wunderlich/archive/215545,1644,203,Jörn Wunderlich (DIE LINKE),Jörn Wunderlich,jorn-wunderlich,1617,linke,mit der Begründung: Diesen Gesetzentwurf bringen wir wegen Schlampigkeit nicht ein. Jetzt frage ich mich: Was ist dabei schlampig zu machen?,"TOP I.16 Familie, Senioren, Frauen und Jugend",15092,speech,18
1645,680247,https://www.abgeordnetenwatch.de/profile/marcus-weinberg/archive/214493,1645,203,Marcus Weinberg [Hamburg] [CDU/CSU],Marcus Weinberg,marcus-weinberg,1630,cducsu,"Eierkopp! Mann, Mann, Mann, Mann!","TOP I.16 Familie, Senioren, Frauen und Jugend",15092,poi,18
1646,680248,https://www.abgeordnetenwatch.de/profile/manfred-grund/archive/213924,1646,203,Manfred Grund [CDU/CSU],Manfred Grund,manfred-grund,1814,cducsu,"Also, so was! Das ist eine unglaubliche Unterstellung!","TOP I.16 Familie, Senioren, Frauen und Jugend",15092,poi,18
1647,680249,https://www.abgeordnetenwatch.de/profile/jorn-wunderlich/archive/215545,1647,203,Jörn Wunderlich (DIE LINKE),Jörn Wunderlich,jorn-wunderlich,1617,linke,"- Ja, Herr Grund passen Sie einmal auf: Ich ersetze die Zahl 12 durch die Zahl 18. Ich erweitere die Bezugnahme von Ziffer 1 und 2 auf Ziffer 3 und lasse den einen Paragrafen entfallen, der das Ganze begrenzt.

Frau Schwesig hat ja auch schon auf die Finanzen verwiesen.","TOP I.16 Familie, Senioren, Frauen und Jugend",15092,speech,18
1648,680250,,1648,203,,,,,,Zuruf des Abg. Paul Lehrieder [CDU/CSU],"TOP I.16 Familie, Senioren, Frauen und Jugend",15092,poi,18
1649,680251,https://www.abgeordnetenwatch.de/profile/manfred-grund/archive/213924,1649,203,Manfred Grund [CDU/CSU],Manfred Grund,manfred-grund,1814,cducsu,Da klatschen wir nie wieder!,"TOP I.16 Familie, Senioren, Frauen und Jugend",15092,poi,18
1650,680252,https://www.abgeordnetenwatch.de/profile/jorn-wunderlich/archive/215545,1650,203,Jörn Wunderlich (DIE LINKE),Jörn Wunderlich,jorn-wunderlich,1617,linke,"- Herr Grund, regen Sie sich doch nicht so auf. Meine Güte! Lebenslanges Lernen - hören Sie zu!","TOP I.16 Familie, Senioren, Frauen und Jugend",15092,speech,18
1651,680253,https://www.abgeordnetenwatch.de/profile/manfred-grund/archive/213924,1651,203,Manfred Grund [CDU/CSU],Manfred Grund,manfred-grund,1814,cducsu,Das geht mich etwas an! Jede Gemeinheit geht mich etwas an!,"TOP I.16 Familie, Senioren, Frauen und Jugend",15092,poi,18
1652,680254,https://www.abgeordnetenwatch.de/profile/jorn-wunderlich/archive/215545,1652,203,Jörn Wunderlich (DIE LINKE),Jörn Wunderlich,jorn-wunderlich,1617,linke,"Man kann letztlich den Kommunen und den Ländern noch Angebote machen im Rahmen dieser Verhandlungen. Wesentlich ist, dass der Anspruch jetzt kommt. Alois Rainer sagt ja auch: Bevor wir rückwirkend zahlen, zahlen wir lieber nichts. - Das ist CDU-Politik.","TOP I.16 Familie, Senioren, Frauen und Jugend",15092,speech,18
1653,680255,,1653,203,,,,,,Beifall der Abg. Katja Keul [BÜNDNIS 90/DIE GRÜNEN],"TOP I.16 Familie, Senioren, Frauen und Jugend",15092,poi,18
1654,680256,https://www.abgeordnetenwatch.de/profile/jorn-wunderlich/archive/215545,1654,203,Jörn Wunderlich (DIE LINKE),Jörn Wunderlich,jorn-wunderlich,1617,linke,"Wie sieht es mit der SGBXIII-Reform aus? Dieses Jahr sollte noch ein Referentenentwurf vorgelegt werden, und das Gesetzesvorhaben soll noch in dieser Legislaturperiode verabschiedet werden. Wir wissen doch auch, dass bei dieser Reform, wenn sie nicht zulasten von Kindern und Jugendlichen gehen soll, ordentlich Geld in die Hand genommen werden muss. Aber diese Investitionen finden sich im Haushalt nicht wieder. Oder geht es doch nur darum, im Rahmen dieser Reform Gelder auf Kosten der Qualität einzusparen? Das legten die diversen Arbeitsentwürfe, die im Sommer kursierten, nahe. Um es kurz zusammenzufassen: unterschiedliche Qualitätsstandards nach Kassenlage der Länder.

Ebenso ist es beim Kitaausbau: Es kommt eben nicht nur auf Quantität, sondern auch auf Qualität an. Frühkindliche Bildung ist ein Rädchen im Gesamtmechanismus, um Kinderarmut zu verhindern. Hier ist der Bund in der Verantwortung, um eine qualitativ gleichwertige Betreuung und Bildung zu gewährleisten.","TOP I.16 Familie, Senioren, Frauen und Jugend",15092,speech,18
1655,680257,,1655,203,,,,,,Beifall bei der LINKEN und der SPD,"TOP I.16 Familie, Senioren, Frauen und Jugend",15092,poi,18
1656,680258,https://www.abgeordnetenwatch.de/profile/jorn-wunderlich/archive/215545,1656,203,Jörn Wunderlich (DIE LINKE),Jörn Wunderlich,jorn-wunderlich,1617,linke,"Das kann nicht auf Länder und Kommunen abgewälzt werden. Letztlich wird es dann auf dem Rücken der Mitarbeiter ausgetragen.

Ich möchte etwas zitieren:

Dafür müssen wir auch weiterhin zusätzliche Kita-Plätze schaffen, da die Nachfrage der Eltern steigt, mehr Kinder geboren werden und auch die zu uns geflüchteten Kinder einen Kita-Platz zur schnellen Integration benötigen. ... Daher werden wir einen Rechtsanspruch auf Ganztagsbetreuung von Kita- und Grundschulkindern einführen - mit finanzieller Beteiligung des Bundes und einer sicheren Entlastung der Kommunen. Wir wollen mehr in die Qualität von Kitas und in qualifiziertes Personal investieren. Durch ein bundesweites Qualitätsgesetz wollen wir die Qualität der frühkindlichen Bildung verbessern. Wir werden schrittweise die Kita-Gebühren in Deutschland abschaffen.

Das ist aus dem SPD-Programmpapier „Fortschritt und Gerechtigkeit - Chancen für alle“, verfasst im Vorgriff auf den nächsten Bundestagswahlkampf. Sind es wieder nur Versprechungen, die dann aufgrund von Koalitionszwängen nicht gehalten werden können?

Wenn wir über ein Kitaqualitätsgesetz bundeseinheitlich frühkindliche Bildung intensiv fördern, die Arbeitsbedingungen für die Beschäftigten und den Betreuungsschlüssel verbessern, die Elterngebühren entfallen lassen und ein kostenloses Mittagessen gewährleisten wollen, dann reichen die aufgeführten Investitionsprogramme oder Sprachprogramme - bei allem Respekt vor diesen, das muss man anerkennen - nicht aus. Aber im Haushalt für 2017 findet sich das nicht wieder.

Die Haushaltsmittel aus dem Sondervermögen „Kinderbetreuungsausbau“ reichen eben nicht aus. Wenn wir den Auftrag der frühkindlichen Bildung ernst nehmen, dann kann sie nur beitragsfrei sein. Das ändert auch nichts an der Wertschätzung von Kindertagesstätten, nach dem Motto: „Was nichts kostet, kann nichts wert sein“; denn dann wären unsere Schulen ja auch nichts wert.

Schlimm ist es auch, was die Frauenhäuser betrifft. Traurig, dass sie erforderlich sind, aber das ist im Moment noch so. Die Linke fordert eine bundesweit einheitliche und bedarfsgerechte Finanzierung der Schutzhäuser und Beratungsstellen für von Gewalt betroffene Frauen ein.","TOP I.16 Familie, Senioren, Frauen und Jugend",15092,speech,18
1657,680259,,1657,203,,,,,,Beifall bei der LINKEN,"TOP I.16 Familie, Senioren, Frauen und Jugend",15092,poi,18
1658,680260,https://www.abgeordnetenwatch.de/profile/jorn-wunderlich/archive/215545,1658,203,Jörn Wunderlich (DIE LINKE),Jörn Wunderlich,jorn-wunderlich,1617,linke,"Es muss endlich eine Pflichtaufgabe von Bund, Ländern und Kommunen sein, diese Einrichtungen personell und finanziell in ausreichendem Maße zu finanzieren. Aber auch dazu findet sich im Haushalt leider nichts. Wenn man das Haushaltsgesetz elektronisch nach dem Wort „Frauenhaus“ abscannt, gibt es null Treffer.","TOP I.16 Familie, Senioren, Frauen und Jugend",15092,speech,18
1659,680261,https://www.abgeordnetenwatch.de/profile/ulrike-gottschalck,1659,203,Ulrike Gottschalck [SPD],Ulrike Gottschalck,ulrike-gottschalck,1292,spd,Ein bisschen was müssen die Länder auch noch leisten!,"TOP I.16 Familie, Senioren, Frauen und Jugend",15092,poi,18
1660,680262,,1660,203,,,,,,Signal am Rednerpult leuchtet auf,"TOP I.16 Familie, Senioren, Frauen und Jugend",15092,poi,18
1661,680263,https://www.abgeordnetenwatch.de/profile/jorn-wunderlich/archive/215545,1661,203,Jörn Wunderlich (DIE LINKE),Jörn Wunderlich,jorn-wunderlich,1617,linke,"- Machen Sie mich nicht nervös; ich bin gerade erst über der Zeit.

Wir wollen den Menschen eine Zukunft ermöglichen, in der sie frei von Sorgen vor Arbeitslosigkeit, Altersarmut oder Krankheit leben können. Damit müssen wir von Anfang an beginnen, und dafür müssen wir auch Investitionen tätigen. Das sind keine Kosten, sondern das ist gut angelegtes Geld mit einer Dividende, die unbezahlbar ist, nämlich glücklichen, zufriedenen Menschen in einer sozialen Gesellschaft. Daran können wir mitwirken. Aber dafür müssen wir umdenken. Einige gute Ansätze sind im Einzelplan 17 enthalten - unbestritten -, aber es fehlt auch noch Etliches, und zwar Wichtiges.

Die Linke ist bereit, in die Zukunft dieses Landes, in seine Menschen zu investieren, um eine gesicherte Zukunft zu gewährleisten. Die Antwort dazu liefert der Einzelplan 17 leider nur partiell. Schade!","TOP I.16 Familie, Senioren, Frauen und Jugend",15092,speech,18
1662,680264,,1662,203,,,,,,Beifall bei der LINKEN,"TOP I.16 Familie, Senioren, Frauen und Jugend",15092,poi,18
1663,680265,https://www.abgeordnetenwatch.de/profile/edelgard-bulmahn,1663,203,Vizepräsidentin Dr. h. c. Edelgard Bulmahn,Dr. h. c. Edelgard Bulmahn,edelgard-bulmahn,1856,,"Lieber Herr Kollege Wunderlich, es mag ja für den einzelnen Redner immer wenig erscheinen, das kann ich nachvollziehen. Aber wenn es sich summiert - alleine bei dieser Debatte sind es 13 Minuten, und wir haben mehrere Haushalte -, sind wir ganz schnell bei Stunden.","TOP I.16 Familie, Senioren, Frauen und Jugend",15092,chair,18
1664,680266,https://www.abgeordnetenwatch.de/profile/paul-lehrieder/archive/214984,1664,203,Paul Lehrieder [CDU/CSU],Paul Lehrieder,paul-lehrieder,1747,cducsu,Gnadenlos überzogen! Ich habe das Gefühl auch gehabt!,"TOP I.16 Familie, Senioren, Frauen und Jugend",15092,poi,18
1665,680267,https://www.abgeordnetenwatch.de/profile/edelgard-bulmahn,1665,203,Vizepräsidentin Dr. h. c. Edelgard Bulmahn,Dr. h. c. Edelgard Bulmahn,edelgard-bulmahn,1856,,"Es werden alle gleichbehandelt. Jeder bekommt das Zeichen der Präsidentin, wenn die Redezeit überschritten ist. Wenn es danach noch zu lange dauert, gibt es auch eine Ermahnung der Präsidentin. - Jetzt hat die Kollegin Nadine Schön für die CDU/CSU-Fraktion das Wort.","TOP I.16 Familie, Senioren, Frauen und Jugend",15092,chair,18
1666,680268,,1666,203,,,,,,Beifall bei der CDU/CSU,"TOP I.16 Familie, Senioren, Frauen und Jugend",15092,poi,18
1667,680269,https://www.abgeordnetenwatch.de/profile/nadine-schon/archive/214911,1667,203,Nadine Schön (St. Wendel) (CDU/CSU),Nadine Schön,nadine-schon,1390,cducsu,"Sehr geehrte Frau Präsidentin! Liebe Kolleginnen und Kollegen! In der letzten Haushaltsdebatte und auch in den letzten Wochen haben wir angesichts politischer Ereignisse auch in anderen Ländern viel über den Zusammenhalt der Gesellschaft gesprochen. Wir stellen uns die Frage: Wie sichern wir den gesellschaftlichen Zusammenhalt in einer Zeit, in der unsere Wirtschaft schnellen Entwicklungen wie der Digitalisierung ausgesetzt ist, in der es Terror und in vielen Ländern Krieg gibt, in der die Welt globaler und komplexer geworden ist? Für viele Menschen ist das nicht einfach. Wir wollen deshalb mit diesem Haushalt ein besonderes Zeichen setzen, dass uns der Zusammenhalt der Gesellschaft wichtig ist. Das fängt bei der kleinsten Zelle der Gesellschaft an, nämlich der Familie. Denn geht es den Familien in unserem Land gut, dann geht es auch der Gesellschaft gut.

Deshalb fördern wir mit unserem Haushalt in nie zuvor dagewesener Höhe Familien in ihrem tagtäglichen Leben und Zusammenleben. Das fängt beim Finanziellen an; denn wirtschaftliche Sicherheit und Stabilität sind die Grundlage eines guten Familienlebens.

Die Mittel für das Elterngeld steigen um 200 Millionen Euro auf über 6,4 Milliarden Euro.

Wir haben den Kinderzuschlag zum 1. Juli erhöht, und er wird zum 1. Januar noch einmal erhöht. Der Kinderzuschlag ist für Familien, die arbeiten, sehr wichtig, damit sie nicht wegen der Kinder in Hartz IV fallen. Das ist ein wichtiges Signal an alle, gerade an die Familien, deren Einkommen knapp oberhalb der HartzIV-Schwelle liegt und die es wirklich besonders schwer haben, weil die Eltern arbeiten, weil sie jeden Morgen aufstehen, ihre Kinder zum Kindergarten, zur Schule bringen, dann zur Arbeit fahren und diesen Spagat tagtäglich leisten müssen - und das bei geringem Einkommen. Deshalb ist es wichtig, dass wir den Kinderzuschlag deutlich angehoben haben.","TOP I.16 Familie, Senioren, Frauen und Jugend",15092,speech,18
1668,680270,,1668,203,,,,,,Beifall bei der CDU/CSU,"TOP I.16 Familie, Senioren, Frauen und Jugend",15092,poi,18
1669,680271,https://www.abgeordnetenwatch.de/profile/nadine-schon/archive/214911,1669,203,Nadine Schön (St. Wendel) (CDU/CSU),Nadine Schön,nadine-schon,1390,cducsu,"Wir haben das Kindergeld und den Kinderfreibetrag in dieser Legislaturperiode erhöht, auch den Freibetrag für Alleinerziehende.

Was heute in der Debatte schon öfter genannt wurde: Auch der Unterhaltsvorschuss ist uns ein wichtiges Anliegen. Marcus Weinberg wird nachher noch darauf eingehen. Herr Wunderlich, nur zwei Sätze. Wenn man so eine Reform macht, ist es natürlich wichtig, dass sie gut vorbereitet und auch besprochen ist. Das betrifft die Finanzierung, und das betrifft die Umsetzung. Sie sagen: Da sind nur zwei Ziffern im Gesetz zu ändern. - Das ist wirklich ein Hohn.","TOP I.16 Familie, Senioren, Frauen und Jugend",15092,speech,18
1670,680272,,1670,203,,,,,,Zuruf des Abg. Jörn Wunderlich [DIE LINKE],"TOP I.16 Familie, Senioren, Frauen und Jugend",15092,poi,18
1671,680273,https://www.abgeordnetenwatch.de/profile/nadine-schon/archive/214911,1671,203,Nadine Schön (St. Wendel) (CDU/CSU),Nadine Schön,nadine-schon,1390,cducsu,"Wichtig ist, dass das, wenn wir es ins Gesetz schreiben, vor Ort auch umzusetzen ist. Wenn sich die Zahl der Antragsteller durch die Änderung verdoppelt, dann heißt das, dass wir in den Kommunen doppelt so viele Leute brauchen, die diese Fälle bearbeiten.","TOP I.16 Familie, Senioren, Frauen und Jugend",15092,speech,18
1672,680274,,1672,203,,,,,,Beifall bei der CDU/CSU,"TOP I.16 Familie, Senioren, Frauen und Jugend",15092,poi,18
1673,680275,,1673,203,,,,,,Zuruf des Abg. Jörn Wunderlich [DIE LINKE],"TOP I.16 Familie, Senioren, Frauen und Jugend",15092,poi,18
1674,680276,https://www.abgeordnetenwatch.de/profile/nadine-schon/archive/214911,1674,203,Nadine Schön (St. Wendel) (CDU/CSU),Nadine Schön,nadine-schon,1390,cducsu,"Da sitzen ja nicht Leute, die nur darauf warten, dass sie endlich mal Arbeit bekommen und Anträge bearbeiten können, sondern Personal muss eingestellt werden. Die Anträge müssen bearbeitet werden. Deshalb gehen wir davon aus, dass Bundesregierung und Länder gemeinsam zu einem Konzept finden, das genau das ermöglicht.","TOP I.16 Familie, Senioren, Frauen und Jugend",15092,speech,18
1675,680277,https://www.abgeordnetenwatch.de/profile/jorn-wunderlich/archive/215545,1675,203,Jörn Wunderlich [DIE LINKE],Jörn Wunderlich,jorn-wunderlich,1617,linke,Jetzt ist aber gut!,"TOP I.16 Familie, Senioren, Frauen und Jugend",15092,poi,18
1676,680278,https://www.abgeordnetenwatch.de/profile/nadine-schon/archive/214911,1676,203,Nadine Schön (St. Wendel) (CDU/CSU),Nadine Schön,nadine-schon,1390,cducsu,- Bitte?,"TOP I.16 Familie, Senioren, Frauen und Jugend",15092,speech,18
1677,680279,https://www.abgeordnetenwatch.de/profile/jorn-wunderlich/archive/215545,1677,203,Jörn Wunderlich [DIE LINKE],Jörn Wunderlich,jorn-wunderlich,1617,linke,"Jahrelang spart ihr Personal ein, und dann beschwert ihr euch!","TOP I.16 Familie, Senioren, Frauen und Jugend",15092,poi,18
1678,680280,,1678,203,,,,,,Widerspruch bei der CDU/CSU,"TOP I.16 Familie, Senioren, Frauen und Jugend",15092,poi,18
1679,680281,https://www.abgeordnetenwatch.de/profile/alois-rainer-0,1679,203,Alois Rainer [CDU/CSU],Alois Rainer,alois-rainer,1407,cducsu,Da sind die Kommunen zuständig!,"TOP I.16 Familie, Senioren, Frauen und Jugend",15092,poi,18
1680,680282,https://www.abgeordnetenwatch.de/profile/nadine-schon/archive/214911,1680,203,Nadine Schön (St. Wendel) (CDU/CSU),Nadine Schön,nadine-schon,1390,cducsu,"- Das ist noch einmal typisch Linke. Sie sagen, dass wir Personal einsparen. Der Unterhaltsvorschuss wird in den Kommunen vor Ort bearbeitet und nicht vom Bund.","TOP I.16 Familie, Senioren, Frauen und Jugend",15092,speech,18
1681,680283,,1681,203,,,,,,Beifall bei der CDU/CSU,"TOP I.16 Familie, Senioren, Frauen und Jugend",15092,poi,18
1682,680284,https://www.abgeordnetenwatch.de/profile/nadine-schon/archive/214911,1682,203,Nadine Schön (St. Wendel) (CDU/CSU),Nadine Schön,nadine-schon,1390,cducsu,"Das heißt, selbst wenn wir im Familienministerium noch 100 Menschen einstellen würden, dürften die nicht die Anträge zum Unterhaltsvorschuss bearbeiten.","TOP I.16 Familie, Senioren, Frauen und Jugend",15092,speech,18
1683,680285,https://www.abgeordnetenwatch.de/profile/paul-lehrieder/archive/214984,1683,203,Paul Lehrieder [CDU/CSU],Paul Lehrieder,paul-lehrieder,1747,cducsu,So ist es!,"TOP I.16 Familie, Senioren, Frauen und Jugend",15092,poi,18
1684,680286,https://www.abgeordnetenwatch.de/profile/nadine-schon/archive/214911,1684,203,Nadine Schön (St. Wendel) (CDU/CSU),Nadine Schön,nadine-schon,1390,cducsu,"Das ist Föderalismus. Deshalb muss man alles, was man hier ankündigt, proklamiert und mit stolzgeschwellter Brust ins Gesetzblatt schreiben will, so machen, dass es vor Ort umgesetzt werden kann, und daran arbeiten wir.

Wir verbessern die Vereinbarkeit von Familie und Beruf dadurch, dass wir die Betreuungsinfrastruktur weiter ausbauen. Wir haben mehr Kitaplätze. Wir haben bessere Kitaplätze. Wir haben die Sprachprogramme in den Kindergärten. Ich bin sehr froh, dass wir mit der Änderung beim Kitasprachprogramm jetzt endlich auch die Kitas im ländlichen Raum erreichen, die bisher nur sehr schwer zu erreichen waren.","TOP I.16 Familie, Senioren, Frauen und Jugend",15092,speech,18
1685,680287,,1685,203,,,,,,Beifall der Abg. Ingrid Pahlmann [CDU/CSU],"TOP I.16 Familie, Senioren, Frauen und Jugend",15092,poi,18
1686,680288,https://www.abgeordnetenwatch.de/profile/nadine-schon/archive/214911,1686,203,Nadine Schön (St. Wendel) (CDU/CSU),Nadine Schön,nadine-schon,1390,cducsu,"Mit dem Elterngeld Plus schaffen wir Zeit für Familien, und auch das ist wichtig.

Insgesamt fördern wir mit diesen Maßnahmen die Familie als kleinste Zelle der Gesellschaft und fördern somit das gesellschaftliche Miteinander.

Miteinander wird aber auch an anderer Stelle gelebt. Damit spreche ich das Miteinander der Generationen an, das Miteinander in der Bevölkerung. In vielfältiger Weise tritt man selbstverständlich, oft auch ehrenamtlich, füreinander ein, hilft sich gegenseitig dort, wo es fehlt, ist man ehrenamtlich füreinander da.

Stichwort „Jugendverbände“. Hier wird genau das gelebt. In Jugendverbänden engagieren sich Jugendliche ehrenamtlich, engagieren sich auch Erwachsene für Jugendliche. Deshalb ist es total richtig, dass wir die Mittel für die Jugendverbände in den letzten Jahren immer aufgestockt haben. Wir haben im letzten Haushalt 2 Millionen Euro draufgelegt, und wir haben das im parlamentarischen Verfahren zu diesem Haushalt noch einmal gemacht. Es ist sehr schade - da gebe ich Ihnen recht -, dass das nicht bereits im Regierungsentwurf stand. Aber wir haben es gemeinsam geschafft, die Gelder noch einmal aufzustocken. Das haben die Jugendverbände verdient; denn hier wird wirklich großartige Arbeit geleistet.","TOP I.16 Familie, Senioren, Frauen und Jugend",15092,speech,18
1687,680289,,1687,203,,,,,,Beifall bei der CDU/CSU,"TOP I.16 Familie, Senioren, Frauen und Jugend",15092,poi,18
1688,680290,https://www.abgeordnetenwatch.de/profile/nadine-schon/archive/214911,1688,203,Nadine Schön (St. Wendel) (CDU/CSU),Nadine Schön,nadine-schon,1390,cducsu,"Wir fördern die politischen Jugendorganisationen mit 1,5 Millionen Euro und unterstützen so, dass sich junge Menschen politisch engagieren. Was mir besonders am Herzen liegt, ist der Bundesfreiwilligendienst, bei dem sich Menschen jeder Generation für andere engagieren können. Hier investieren wir rund 200 Millionen Euro. Bei den normalen Freiwilligendiensten investieren wir rund 92,6 Millionen Euro. Auch da geht es um Engagement, insbesondere von Jugendlichen, aber auch über die Generationen hinweg. Das ist gelebtes Miteinander ebenso wie bei den Mehrgenerationenhäusern, wo wir die Mittel verstetigen und zusätzliche Häuser einrichten. Überall dort wird Demokratie, wird Gemeinschaft, gesellschaftlicher Zusammenhalt gelebt. Deshalb ist es wichtig und gut, dass wir an diesen Stellen den Schwerpunkt unserer Förderung setzen.

Das Stichwort „Extremismusprävention“ ist oft genannt worden. Wir haben dafür über 100 Millionen Euro in den Haushalt eingestellt. Ich will einen Punkt erwähnen, der mir sehr wichtig ist: Es ist gut, wenn wir vor Ort tätig sind. Aber wir alle wissen, dass Extremismus, dass Radikalisierung, dass Gewalt zunehmend auch im Netz stattfinden. Deshalb ist mir wichtig, dass von den 100 Millionen Euro möglichst viel Geld in Angebote im Netz fließt; denn im Internet entsteht Radikalität, entsteht Hass. Über das Stichwort „Hate Speech“ diskutieren wir in diesen Tagen viel. Deshalb ist es wichtig, dass wir uns mit diesen Programmen zur Extremismusprävention auf das Internet konzentrieren und mit unseren Angeboten die Menschen erreichen, die sich im Netz bewegen. Wir müssen dafür Sorge tragen, dass mit diesen Geldern Modelle entwickelt werden, um Extremismus im Netz zu bekämpfen, aber auch Modelle, wie man lernt, Zivilcourage im normalen Leben wie auch im Netz zu zeigen. Das ist gar nicht so einfach. Das erfordert Mut. Das erfordert, dass wir die Augen nicht zumachen, sondern hinsehen, Lösungsstrategien entwickeln und die Menschen stark machen.

Ich will vom Internet nicht nur als bösen Ort sprechen, wo viel Schlimmes passiert; das Internet bietet auch Chancen. Das Netz ist ein Ort, an dem man auch Hilfe findet. Deshalb bin ich sehr froh, dass wir mit diesem Haushalt neue Projekte fördern können. Meine Berliner Kollegin Christina Schwarzer hat sich unter anderem sehr für das Projekt gewaltlos.de eingesetzt, ein Angebot im Internet, wo Mädchen und Frauen, die von häuslicher Gewalt betroffen sind, Hilfe bekommen, wo sie sich mit Experten austauschen können, ein Chat, der rund um die Uhr zur Verfügung steht. Es ist wichtig, dass wir diese Angebote im Netz ausbauen. Ich bin sehr dankbar, dass wir in diesem Haushalt gewaltlos.de erstmalig mit einer guten Summe fördern. Das gilt auch für [U25], die Onlineberatung für suizidgefährdete Jugendliche. All das brauchen wir viel mehr als bisher; denn Jugendliche bewegen sich tagtäglich im Netz. Wir müssen mit unseren Hilfs- und Unterstützungsangeboten dort sein, wo sich die Jugendlichen bewegen, und deshalb brauchen wir verstärkt Angebote im Netz.

Liebe Kolleginnen und Kollegen, ich bin dankbar, dass wir das mit diesem Haushalt realisieren. Wir fördern damit den gesellschaftlichen Zusammenhalt in der Familie, aber auch in der Zivilgesellschaft. Ich danke für die guten Beratungen und auch dafür, dass wir in den Haushaltsberatungen vieles erreichen konnten. Ich danke Ihnen für die konstruktive Arbeit, die wir nicht nur in den letzten Wochen, sondern das ganze Jahr über gemeinsam geleistet haben - für die Familien in unserem Land und für den gesellschaftlichen Zusammenhalt.","TOP I.16 Familie, Senioren, Frauen und Jugend",15092,speech,18
1689,680291,,1689,203,,,,,,Beifall bei der CDU/CSU sowie bei Abgeordneten der SPD,"TOP I.16 Familie, Senioren, Frauen und Jugend",15092,poi,18
