,id,profile_url,sequence,sitzung,speaker,speaker_cleaned,speaker_fp,speaker_key,speaker_party,text,top,top_id,type,wahlperiode
1128,679730,https://www.abgeordnetenwatch.de/profile/andrea-nahles-0,1128,203,"Andrea Nahles, Bundesministerin für Arbeit und Soziales",Andrea Nahles,andrea-nahles,1803,,"Wir wollen gemeinsam gesellschaftliche Anstrengungen für mehr Weiterbildung unternehmen; das ist gar keine Frage. Übrigens: Da machen wir schon vieles. Man wundert sich manchmal, dass es kaum Beachtung findet. Das AWStG - so hieß das Gesetz in schönster Abkürzung - haben wir hier mal eben so durchgeschoben. Es gibt jetzt eine Weiterbildungsprämie. Da haben wir eine sehr wichtige Sache miteinander verabredet, nämlich dass die Bundesagentur jetzt auch fördern kann, wenn die berufliche Weiterbildung außerhalb der Arbeitszeit erfolgt. Das war für den Mittelstand eine ganz wichtige Verabredung. Sie sehen also: Wir kündigen nicht nur für die Zukunft an; wir haben hier auch schon einiges beschlossen. Darüber freue ich mich.",TOP I.15 Arbeit und Soziales,15091,speech,18
1129,679731,,1129,203,,,,,,Beifall bei der SPD und der CDU/CSU,TOP I.15 Arbeit und Soziales,15091,poi,18
1130,679732,https://www.abgeordnetenwatch.de/profile/andrea-nahles-0,1130,203,"Andrea Nahles, Bundesministerin für Arbeit und Soziales",Andrea Nahles,andrea-nahles,1803,,"Hinzu kommt: Was die Zukunft der Arbeit angeht, haben wir wahrscheinlich mit mehr Formen selbstständiger Arbeit zu tun, mit neuen Formen, die durch die Plattformisierung der Ökonomie entstehen, die die Konsumenten nutzen; darüber kann man klagen, wie man will. Airbnb ist auch in Deutschland eine Erfolgsgeschichte, Helpling und andere ebenso. Damit müssen wir uns auseinandersetzen. Ob wir das alles gut oder schlecht finden, ist erst die zweite Frage.

Es wird genutzt. Das bedeutet: Viele Arbeitnehmer müssen in dieser Form ihr Einkommen erzielen. Da gibt es Schutzlücken; das sage ich ganz klar. Wir brauchen deswegen für Selbstständige Zugänge zu einer anständigen Altersversorgung. Das werden wir auch vorschlagen. Da gibt es für mich noch eine Menge zu tun. Ich wäre froh, wenn wir an dieser Stelle in der Koalition noch gemeinsam etwas anpacken könnten.",TOP I.15 Arbeit und Soziales,15091,speech,18
1131,679733,,1131,203,,,,,,Beifall bei der SPD und der CDU/CSU,TOP I.15 Arbeit und Soziales,15091,poi,18
1132,679734,https://www.abgeordnetenwatch.de/profile/andrea-nahles-0,1132,203,"Andrea Nahles, Bundesministerin für Arbeit und Soziales",Andrea Nahles,andrea-nahles,1803,,"Die Integration der Flüchtlinge wird in diesem Haushalt natürlich in zentraler Weise abgebildet. Wir haben ganz klar darauf gesetzt, dass wir den Spracherwerb verbessern und dass die Angebote, die Kapazitäten für die Sprachkurse nach oben gefahren werden. Das ist eine gemeinsame Anstrengung des BMI, das für die Integrationskurse zuständig ist, und des BMAS, das für die berufsbezogenen Sprachkurse zuständig ist. Das baut aufeinander auf. Ich will sagen: Wir sind hier schon enorm vorangekommen, aber wir sind noch nicht ganz am Ziel. Wir bauen weiter Kapazitäten auf. Es lohnt sich.

Es gibt zum ersten Mal seit langem eine valide Untersuchung des IAB. Die hat uns Fachleuten Hoffnung gemacht. Die Untersuchung hatte zum Ergebnis, dass viele, die zu uns gekommen sind, keinen formalen Abschluss, wie wir ihn hier gewohnt sind, aber Berufserfahrung haben. Hier können wir aufsetzen. Das tun wir auch. Es gibt zum Zweiten auch ganz viele junge Menschen, für die es sich allemal lohnt, eine Tür aufzustoßen, um hier eine ordentliche Ausbildung zu machen. Mit diesem Haushalt stellen wir die nötigen Mittel zur Verfügung. Das ist eine ganz wichtige Integrationsanstrengung, die in den nächsten Jahren vor uns liegt.

Es sei gesagt: Gemeinsam können wir das schultern, aber es ist nicht im Sprint zu schaffen. Deswegen werden auch die Passivleistungen in diesem Haushalt angehoben werden müssen; denn wir müssen die Leute unterstützen. Aber es ist eine Erkenntnis, dass wir wissen: Wir schaffen es, aber es dauert. Das ist ganz simpel. Das müssen wir ehrlich sagen. Es ist eine Anstrengung, die vor uns liegt. Aber ich mache mir, seitdem ich die Ergebnisse vom IAB gehört habe, große Hoffnung, dass uns das erfolgreich gelingen wird.",TOP I.15 Arbeit und Soziales,15091,speech,18
1133,679735,,1133,203,,,,,,Beifall bei der SPD und der CDU/CSU,TOP I.15 Arbeit und Soziales,15091,poi,18
1134,679736,https://www.abgeordnetenwatch.de/profile/andrea-nahles-0,1134,203,"Andrea Nahles, Bundesministerin für Arbeit und Soziales",Andrea Nahles,andrea-nahles,1803,,"Wenn ich „uns“ sage, dann lassen Sie mich sagen: Damit ist nicht nur die politische Seite gemeint, sondern damit sind auch die Unternehmen, die Handwerkskammern, die Industrie- und Handelskammern, diejenigen, die vor Ort ehrenamtliche Patenschaften übernommen haben, und viele Sozialverbände, die sich kümmern, gemeint. Wir alle sehen, dass das nur gemeinsam zu schaffen ist.

In der nächsten Woche beraten wir das BTHG. Das ist ein großer Schritt hin zu mehr Teilhabe für Menschen mit Behinderung. An dieser Stelle ist auch zu diskutieren - hier müssen Sie sich keine Sorgen machen -, dass wir die parlamentarischen Wünsche, die noch in Arbeit sind, finanziell absichern müssen. Das ist ganz klar, das werden wir auch tun.

Schließlich ist die Rentenpolitik ein großes Thema. Morgen werde ich mein Gesamtkonzept vorstellen. Ich möchte Ihnen an dieser Stelle nur sagen: Wir brauchen aus meiner Sicht Verlässlichkeit. Wir müssen etwas gegen Altersarmut tun. Wir müssen vor allem aber auch Verlässlichkeit bei den Beiträgen schaffen. Das ist genauso wichtig. Wir müssen auch Verlässlichkeit beim Sicherungsniveau schaffen. Das ist für alle wichtig. Deshalb spreche ich von einer doppelten Haltelinie und werde an dieser Stelle ganz konkrete Vorschläge unterbreiten, die wir dann selbstverständlich im parlamentarischen Raum diskutieren werden.

Sie sehen also, diese Bundesregierung legt mit diesem Haushalt gerade im Bereich der Arbeitsmarkt- und Sozialpolitik eine wesentliche Grundlage für eine verlässliche Sozialpolitik, für eine gute Integration der Menschen und vor allem für die Zukunft der Arbeit. Das ist für mich der Dreh- und Angelpunkt, damit wir eine ausgesprochen gute Arbeitsmarktlage, die wir jetzt haben, auch in Zukunft ermöglichen können. Daran machen sich dann auch verteilungspolitische Wünsche, die wir haben, fest. Das eine hängt mit dem anderen zusammen. Deswegen bin ich auch froh, anders als es bei vielen anderen Ländern der Welt ist, in denen es einen Arbeits- und einen Sozialminister gibt, dass ich das bei all den Schwierigkeiten in Kombination sein darf. Das passt und gehört zusammen. Mit diesem Haushalt legen wir für die Zukunft einen guten Grundstein.

Vielen Dank.",TOP I.15 Arbeit und Soziales,15091,speech,18
1135,679737,,1135,203,,,,,,Beifall bei der SPD und der CDU/CSU,TOP I.15 Arbeit und Soziales,15091,poi,18
1136,679738,https://www.abgeordnetenwatch.de/profile/ulla-schmidt/archive/216739,1136,203,Vizepräsidentin Ulla Schmidt,Ulla Schmidt,ulla-schmidt,1665,,Vielen Dank. - Nächster Redner für Bündnis 90/Die Grünen ist Markus Kurth.,TOP I.15 Arbeit und Soziales,15091,chair,18
1137,679739,https://www.abgeordnetenwatch.de/profile/markus-kurth/archive/215170,1137,203,Markus Kurth (BÜNDNIS 90/DIE GRÜNEN),Markus Kurth,markus-kurth,1590,gruene,"Frau Präsidentin! Liebe Kolleginnen und Kollegen! Frau Ministerin Nahles, ich habe ein gewisses Verständnis dafür, dass Sie angesichts einer guten Beschäftigungslage das betonen und ein Stück weit für sich vereinnahmen, obwohl man trefflich darüber streiten kann, ob die gute Beschäftigungslage trotz oder wegen Ihrer Politik da ist.",TOP I.15 Arbeit und Soziales,15091,speech,18
1138,679740,,1138,203,,,,,,Beifall beim BÜNDNIS 90/DIE GRÜNEN sowie bei Abgeordneten der LINKEN,TOP I.15 Arbeit und Soziales,15091,poi,18
1139,679741,https://www.abgeordnetenwatch.de/profile/markus-kurth/archive/215170,1139,203,Markus Kurth (BÜNDNIS 90/DIE GRÜNEN),Markus Kurth,markus-kurth,1590,gruene,"Ich finde es problematisch, wenn man einfach so tut, als ob die Zahl der arbeitenden Armen nicht angestiegen sei, was sie nämlich ist, als ob trotz der guten Beschäftigungslage die Zahl der Langzeitarbeitslosen und die Zahl von armen Kindern nicht auf einem erschreckend hohen Niveau verbleiben. Wenn man das nicht sieht und es einfach ausblendet, weil man sich an guten Zahlen berauschen möchte, dann trägt man leider einen Gutteil dazu bei, dass viele Menschen in diesem Land der Auffassung sind, die Politik nehme Probleme nicht wahr, und das sollten wir vermeiden.",TOP I.15 Arbeit und Soziales,15091,speech,18
1140,679742,,1140,203,,,,,,Beifall beim BÜNDNIS 90/DIE GRÜNEN und bei der LINKEN,TOP I.15 Arbeit und Soziales,15091,poi,18
1141,679743,https://www.abgeordnetenwatch.de/profile/markus-kurth/archive/215170,1141,203,Markus Kurth (BÜNDNIS 90/DIE GRÜNEN),Markus Kurth,markus-kurth,1590,gruene,"Dann nimmt man auch Handlungsnotwendigkeiten und auch Chancen nicht wahr. Das ist der Grund, warum wir hier von einem Haushalt der verpassten Chancen sprechen müssen.",TOP I.15 Arbeit und Soziales,15091,speech,18
1142,679744,,1142,203,,,,,,Beifall beim BÜNDNIS 90/DIE GRÜNEN,TOP I.15 Arbeit und Soziales,15091,poi,18
1143,679745,https://www.abgeordnetenwatch.de/profile/markus-kurth/archive/215170,1143,203,Markus Kurth (BÜNDNIS 90/DIE GRÜNEN),Markus Kurth,markus-kurth,1590,gruene,"Wann, wenn nicht jetzt, wäre zum Beispiel die Zeit, um massiv gegen Langzeitarbeitslosigkeit vorzugehen? Die Konjunktur ist gut, die Steuereinnahmen sind nicht gerade schlecht, der Arbeitsmarkt einigermaßen aufnahmefähig. Warum wird nicht einmal im Rahmen eines Modellprojekts der Versuch unternommen, das Arbeitslosengeld in einen Arbeitskostenzuschuss umzuwandeln und den sogenannten Passiv-Aktiv-Transfer für besonders schwer vermittelbare Arbeitslose zu fördern? Wann, wenn nicht jetzt, wäre die Zeit, um so etwas wenigstens mal auszuprobieren -",TOP I.15 Arbeit und Soziales,15091,speech,18
1144,679746,,1144,203,,,,,,Beifall beim BÜNDNIS 90/DIE GRÜNEN sowie der Abg. Dr. Gesine Lötzsch [DIE LINKE],TOP I.15 Arbeit und Soziales,15091,poi,18
1145,679747,https://www.abgeordnetenwatch.de/profile/markus-kurth/archive/215170,1145,203,Markus Kurth (BÜNDNIS 90/DIE GRÜNEN),Markus Kurth,markus-kurth,1590,gruene,"in den Regionen, die besonders betroffen sind?

Meine Damen und Herren, das Ende der Wahlperiode ist so langsam absehbar, und mit diesem Haushalt ist klar, dass auch diese Legislaturperiode als eine der verpassten Chancen in die Geschichte eingehen wird. Abgesehen von einer Ausnahme, der Einführung des gesetzlichen Mindestlohns, bleibt von der Großen Koalition der Jahre 2013 bis 2017 inhaltlich nichts,",TOP I.15 Arbeit und Soziales,15091,speech,18
1146,679748,https://www.abgeordnetenwatch.de/profile/prof-dr-matthias-zimmer/archive/214786,1146,203,Dr. Matthias Zimmer [CDU/CSU],Dr. Matthias Zimmer,matthias-zimmer,1342,cducsu,Mütterrente!,TOP I.15 Arbeit und Soziales,15091,poi,18
1147,679749,https://www.abgeordnetenwatch.de/profile/markus-kurth/archive/215170,1147,203,Markus Kurth (BÜNDNIS 90/DIE GRÜNEN),Markus Kurth,markus-kurth,1590,gruene,was diese Zeit überdauern und die nächsten Jahre prägen wird.,TOP I.15 Arbeit und Soziales,15091,speech,18
1148,679750,,1148,203,,,,,,Beifall beim BÜNDNIS 90/DIE GRÜNEN,TOP I.15 Arbeit und Soziales,15091,poi,18
1149,679751,https://www.abgeordnetenwatch.de/profile/peter-weis/archive/214884,1149,203,Peter Weiß [Emmendingen] [CDU/CSU],Peter Weiß,peter-weiß,1623,cducsu,"Dann haben Sie die Wahlperiode verpennt, Herr Kurth!",TOP I.15 Arbeit und Soziales,15091,poi,18
1150,679752,https://www.abgeordnetenwatch.de/profile/markus-kurth/archive/215170,1150,203,Markus Kurth (BÜNDNIS 90/DIE GRÜNEN),Markus Kurth,markus-kurth,1590,gruene,"Das Einzige, was diese Zeit - leider - überdauern wird, sind die dicken Kostenverpflichtungen aus dem Rentenpaket, das die Koalition zu Anfang geschnürt hat: 10 Milliarden Euro pro Jahr, die noch dem nächsten und überübernächsten Bundestag Kopfschmerzen bereiten werden.

Ansonsten bringen Sie von Union und SPD keine Strukturentwicklung in sozialpolitischer Hinsicht wirklich voran. Die Regierungsfraktionen haben leider in etwa die Dynamik einer Herde satter Wasserbüffel: Bräsig stehen Sie im Brackwasser Ihrer unambitionierten Vorhaben.",TOP I.15 Arbeit und Soziales,15091,speech,18
1151,679753,,1151,203,,,,,,Lachen bei Abgeordneten der CDU/CSU und der SPD,TOP I.15 Arbeit und Soziales,15091,poi,18
1152,679754,https://www.abgeordnetenwatch.de/profile/katja-mast/archive/217035,1152,203,Katja Mast [SPD],Katja Mast,katja-mast,1737,spd,Ich hasse nasse Füße!,TOP I.15 Arbeit und Soziales,15091,poi,18
1153,679755,https://www.abgeordnetenwatch.de/profile/markus-kurth/archive/215170,1153,203,Markus Kurth (BÜNDNIS 90/DIE GRÜNEN),Markus Kurth,markus-kurth,1590,gruene,Dabei wäre jetzt die Zeit der Chancen.,TOP I.15 Arbeit und Soziales,15091,speech,18
1154,679756,,1154,203,,,,,,Beifall beim BÜNDNIS 90/DIE GRÜNEN,TOP I.15 Arbeit und Soziales,15091,poi,18
1155,679757,https://www.abgeordnetenwatch.de/profile/markus-kurth/archive/215170,1155,203,Markus Kurth (BÜNDNIS 90/DIE GRÜNEN),Markus Kurth,markus-kurth,1590,gruene,"Verpasste Chancen gibt es auch in der Rentenpolitik. Jetzt wäre die Zeit, um ein wichtiges Sicherungsversprechen der Rentenversicherung zu erneuern. Wir Grüne haben es vor zehn Tagen in einem Parteitagsbeschluss formuliert: Wer über Jahrzehnte gearbeitet, Kinder erzogen, Eltern gepflegt hat, soll im Alter eine Rente erhalten, die vor Armut schützt. - Wir nennen es Garantierente.",TOP I.15 Arbeit und Soziales,15091,speech,18
1156,679758,,1156,203,,,,,,Beifall beim BÜNDNIS 90/DIE GRÜNEN,TOP I.15 Arbeit und Soziales,15091,poi,18
1157,679759,https://www.abgeordnetenwatch.de/profile/markus-kurth/archive/215170,1157,203,Markus Kurth (BÜNDNIS 90/DIE GRÜNEN),Markus Kurth,markus-kurth,1590,gruene,"Und wir sagen auch: Wer es in Jahrzehnten trotz kleiner Verdienste und Erwerbsunterbrechungen geschafft hat, privat etwas fürs Alter zurückzulegen, zum Beispiel über einen Riester-Vertrag oder eine Betriebsrente mit Eigenbeteiligung, soll diese Sparleistung im Alter auch behalten dürfen.",TOP I.15 Arbeit und Soziales,15091,speech,18
1158,679760,,1158,203,,,,,,Beifall beim BÜNDNIS 90/DIE GRÜNEN,TOP I.15 Arbeit und Soziales,15091,poi,18
1159,679761,https://www.abgeordnetenwatch.de/profile/markus-kurth/archive/215170,1159,203,Markus Kurth (BÜNDNIS 90/DIE GRÜNEN),Markus Kurth,markus-kurth,1590,gruene,"Und das geht mit unserem Modell der Garantierente, weil diese keine nachrangige Sozialhilfeleistung darstellt, sondern eine echte Rente, die durch Mitgliedschaft in der Rentenversicherung entstanden ist. Das ist für uns eine zentrale Frage der Gerechtigkeit.

Was macht diese Regierung? Nichts. Im Gegenteil: Sie gibt sogar ein Vorhaben auf, das wenigstens dem Anspruch nach die Zielsetzung gehabt hätte, den beschriebenen jahrzehntelang Arbeitenden, die dann trotzdem in die Grundsicherung fallen, unter die Arme zu greifen: Ihre solidarische Lebensleistungsrente.",TOP I.15 Arbeit und Soziales,15091,speech,18
1160,679762,https://www.abgeordnetenwatch.de/profile/kerstin-griese/archive/216767,1160,203,Kerstin Griese [SPD],Kerstin Griese,kerstin-griese,1816,spd,Das weißt du doch noch gar nicht!,TOP I.15 Arbeit und Soziales,15091,poi,18
1161,679763,https://www.abgeordnetenwatch.de/profile/markus-kurth/archive/215170,1161,203,Markus Kurth (BÜNDNIS 90/DIE GRÜNEN),Markus Kurth,markus-kurth,1590,gruene,"- Na ja, Sie von der Koalition haben sie immer hervorgezogen, um denen, die trotz eines langen Arbeitslebens nur Grundsicherung erhalten, das künftige soziale Ruhekissen zu zeigen. Dabei wissen Sie selbst, dass die Lebensleistungsrente unrealistisch hohe Zugangsvoraussetzungen hat, dass sie in Wirklichkeit den Charme einer verschimmelten Matratze hat und nicht den eines Ruhekissens.",TOP I.15 Arbeit und Soziales,15091,speech,18
1162,679764,,1162,203,,,,,,Beifall beim BÜNDNIS 90/DIE GRÜNEN,TOP I.15 Arbeit und Soziales,15091,poi,18
1163,679765,https://www.abgeordnetenwatch.de/profile/markus-kurth/archive/215170,1163,203,Markus Kurth (BÜNDNIS 90/DIE GRÜNEN),Markus Kurth,markus-kurth,1590,gruene,"Darum kann man ja auch froh sein, dass Sie sie jetzt entsorgt haben.",TOP I.15 Arbeit und Soziales,15091,speech,18
1164,679766,https://www.abgeordnetenwatch.de/profile/sabine-weiss/archive/214664,1164,203,Sabine Weiss [Wesel I] [CDU/CSU],Sabine Weiss,sabine-weiss,1353,cducsu,"Gestern zu lange am Stammtisch gewesen, oder was?",TOP I.15 Arbeit und Soziales,15091,poi,18
1165,679767,https://www.abgeordnetenwatch.de/profile/markus-kurth/archive/215170,1165,203,Markus Kurth (BÜNDNIS 90/DIE GRÜNEN),Markus Kurth,markus-kurth,1590,gruene,"Ich glaube nicht, dass Sie in dieser Legislaturperiode noch etwas Belastbares vorlegen - außer Versprechungen für die nächste Legislaturperiode.

Leider muss ich jetzt zum Schluss kommen; meine Redezeit steht in keinem Verhältnis zur Zahl der verpassten Chancen dieser Koalition, über die ich noch reden müsste.",TOP I.15 Arbeit und Soziales,15091,speech,18
1166,679768,,1166,203,,,,,,Beifall beim BÜNDNIS 90/DIE GRÜNEN,TOP I.15 Arbeit und Soziales,15091,poi,18
1167,679769,,1167,203,,,,,,Lachen bei der CDU/CSU und der SPD,TOP I.15 Arbeit und Soziales,15091,poi,18
1168,679770,https://www.abgeordnetenwatch.de/profile/markus-kurth/archive/215170,1168,203,Markus Kurth (BÜNDNIS 90/DIE GRÜNEN),Markus Kurth,markus-kurth,1590,gruene,"Wir können nur hoffen, dass nach der nächsten Bundestagswahl weniger träge Büffel hier sind und mehr Platz für die schnelle grüne Gazelle bleibt.

Danke.",TOP I.15 Arbeit und Soziales,15091,speech,18
1169,679771,,1169,203,,,,,,Beifall beim BÜNDNIS 90/DIE GRÜNEN,TOP I.15 Arbeit und Soziales,15091,poi,18
1170,679772,https://www.abgeordnetenwatch.de/profile/ulla-schmidt/archive/216739,1170,203,Vizepräsidentin Ulla Schmidt,Ulla Schmidt,ulla-schmidt,1665,,Vielen Dank. - Für die CDU/CSU-Fraktion hat jetzt Axel E. Fischer das Wort.,TOP I.15 Arbeit und Soziales,15091,chair,18
1171,679773,,1171,203,,,,,,Beifall bei der CDU/CSU,TOP I.15 Arbeit und Soziales,15091,poi,18
1172,679774,,1172,203,Zuruf von der CDU/CSU,von der CDU/CSU,von-der-cdu-csu,,cducsu,Jetzt kannst du ein paar Sachen klarstellen!,TOP I.15 Arbeit und Soziales,15091,poi,18
1173,679775,https://www.abgeordnetenwatch.de/profile/axel-e-fischer,1173,203,Axel E. Fischer (Karlsruhe-Land) (CDU/CSU),Axel E. Fischer,axel-fischer,1833,cducsu,"Frau Präsidentin! Liebe Kolleginnen und Kollegen! Meine Damen und Herren! Kompliment! Kompliment an die Bundesregierung für diesen Haushaltsentwurf für den Bundeshaushalt 2017, der in guter Zusammenarbeit der verschiedenen Ministerien, vor allem unter Führung des Finanzministeriums, zusammengestellt wurde. Kompliment aber auch an das Bundesministerium für Arbeit und Soziales für eine gute Zusammenarbeit bei der Erstellung des Entwurfs des Einzelplanes 11 zum Thema Arbeit und Soziales. In der Haushaltsberatung hat sich für uns da gar kein so großer Änderungsbedarf ergeben; denn wir konnten schon im Vorfeld in einer guten Zusammenarbeit mit den Arbeitsgruppen Arbeit und Soziales der CDU/CSU-Fraktion und der SPD-Fraktion die Dinge vorbereiten. Jetzt werden wir den vorliegenden Haushaltsentwurf der Bundesregierung noch ein bisschen besser machen.

Der Entwurf, über den wir heute diskutieren, zeigt deutlich die Früchte der von der Großen Koalition eingeleiteten Modernisierung am Arbeitsmarkt und im Bereich sozialer Sicherung. Er ist zukunftsgerichtet, er zeigt Wege zur besseren Teilhabe behinderter Menschen sowie zur Bewältigung des durch die Flüchtlingsströme einhergehenden Integrationsbedarfs auf. Zugleich ist er ein weiterer Schritt zur Fortsetzung des Konsolidierungspfades, den Finanzminister Schäuble nach überwundener Wirtschafts- und Finanzkrise eingeleitet und vor allem durchgehalten hat; und das war nicht einfach. Deshalb richte ich meinen Glückwunsch auch an Bundesfinanzminister Dr. Wolfgang Schäuble.

Ein paar Zahlen müssen sein, das gehört einfach mit dazu. Der Sollansatz für den Einzelplan 11 für das kommende Jahr lag bei den Ausgaben bei 138,6 Milliarden Euro. Wir sind in der Einzelplanberatung auf 137,6 Milliarden Euro gekommen. Das sind 42 Prozent der gesamten Ausgaben des Bundes im kommenden Jahr. Diese Mittel, meine Damen und Herren, sollen für Hartz IV, für die Leistungen zur Eingliederung in Arbeit, für die Beteiligung des Bundes an den Kosten für Unterkunft und Verpflegung, für Zuschüsse zur Rentenversicherung, für die Grundsicherung im Alter und bei Erwerbsminderung sowie für die Förderung der Inklusion von Menschen mit Behinderungen im kommenden Jahr ausgegeben werden.

Aus dem parlamentarischen Verfahren ergibt sich damit gegenüber dem Regierungsentwurf eine Absenkung um rund 1 Milliarde Euro. Das ist unser Beitrag für einen ausgeglichenen Bundeshaushalt, für eine verantwortungsvolle Ausgabenpolitik ohne Neuverschuldung, mit der wir finanzielle Lasten heute ausgleichen und sie eben nicht einseitig auf den jüngeren Bevölkerungsteil und deren Nachkommen abwälzen. Dass dies möglich geworden ist, liegt vor allem an zwei Faktoren: Einerseits brummt der Arbeitsmarkt - Kollege Mattfeldt hat darauf bereits hingewiesen -, und andererseits verursachen die Flüchtlinge deutlich weniger Kosten als bislang angenommen.

Zum Arbeitsmarkt. Auch dank der guten Wirtschaftspolitik der vergangenen Jahre und natürlich - auch das muss man offen ansprechen - des freundlichen Zinsumfelds ist die Zahl der Erwerbstätigen auf das Rekordniveau von knapp 44 Millionen gestiegen. Allein in den vergangenen drei Jahren stieg die Zahl der Erwerbstätigen um weit über 1 Million Menschen, von 42,5 Millionen im September 2013 auf nunmehr 43,7 Millionen.

Und der Ausblick auf die weitere Entwicklung am Arbeitsmarkt",TOP I.15 Arbeit und Soziales,15091,speech,18
1174,679776,https://www.abgeordnetenwatch.de/profile/sabine-zimmermann/archive/215549,1174,203,Sabine Zimmermann [Zwickau] [DIE LINKE],Sabine Zimmermann,sabine-zimmermann,1607,linke,Mehr prekäre Beschäftigung!,TOP I.15 Arbeit und Soziales,15091,poi,18
