,id,profile_url,sequence,sitzung,speaker,speaker_cleaned,speaker_fp,speaker_key,speaker_party,text,top,top_id,type,wahlperiode
516,679118,https://www.abgeordnetenwatch.de/profile/albert-rupprecht-0,516,203,Albert Rupprecht [CDU/CSU],Albert Rupprecht,albert-rupprecht,1691,cducsu,Da sagt Ministerpräsident Kretschmann etwas ganz anderes!,TOP I.14 Bildung und Forschung,15089,poi,18
517,679119,https://www.abgeordnetenwatch.de/profile/ekin-deligoz/archive/215303,517,203,Ekin Deligöz (BÜNDNIS 90/DIE GRÜNEN),Ekin Deligöz,ekin-deligoz,1846,gruene,"- Darauf habe ich jetzt gehofft. Noch besser wäre es, Sie würden mir eine Frage stellen; dann hätte ich eine Redezeitverlängerung.",TOP I.14 Bildung und Forschung,15089,speech,18
518,679120,https://www.abgeordnetenwatch.de/profile/albert-rupprecht-0,518,203,Albert Rupprecht [CDU/CSU],Albert Rupprecht,albert-rupprecht,1691,cducsu,So nicht!,TOP I.14 Bildung und Forschung,15089,poi,18
519,679121,https://www.abgeordnetenwatch.de/profile/ekin-deligoz/archive/215303,519,203,Ekin Deligöz (BÜNDNIS 90/DIE GRÜNEN),Ekin Deligöz,ekin-deligoz,1846,gruene,"- Aber das gönnen Sie mir nicht.

Sie sagen jetzt: Was sagt Ministerpräsident Kretschmann?",TOP I.14 Bildung und Forschung,15089,speech,18
520,679122,https://www.abgeordnetenwatch.de/profile/albert-rupprecht-0,520,203,Albert Rupprecht [CDU/CSU],Albert Rupprecht,albert-rupprecht,1691,cducsu,Er hat es ganz präzise formuliert! Er lehnt das ab!,TOP I.14 Bildung und Forschung,15089,poi,18
521,679123,https://www.abgeordnetenwatch.de/profile/ekin-deligoz/archive/215303,521,203,Ekin Deligöz (BÜNDNIS 90/DIE GRÜNEN),Ekin Deligöz,ekin-deligoz,1846,gruene,"Wissen Sie, Herr Kretschmann und wir sind uns einig, dass die Länder Planungssicherheit brauchen. Es ist ihm und uns wichtig, dass wir die Länder nicht von Programm zu Programm hoppeln lassen, ohne eine gewisse Planungssicherheit zu gewährleisten. Herr Kretschmann und ich bzw. wir als Fraktion sind uns auch einig,",TOP I.14 Bildung und Forschung,15089,speech,18
522,679124,https://www.abgeordnetenwatch.de/profile/albert-rupprecht-0,522,203,Albert Rupprecht [CDU/CSU],Albert Rupprecht,albert-rupprecht,1691,cducsu,"Nein, sind Sie nicht!",TOP I.14 Bildung und Forschung,15089,poi,18
523,679125,https://www.abgeordnetenwatch.de/profile/ekin-deligoz/archive/215303,523,203,Ekin Deligöz (BÜNDNIS 90/DIE GRÜNEN),Ekin Deligöz,ekin-deligoz,1846,gruene,dass wir in die Strukturen von Bildung und Wissenschaft investieren müssen. Dafür arbeitet auch er als baden-württembergischer Ministerpräsident.,TOP I.14 Bildung und Forschung,15089,speech,18
524,679126,https://www.abgeordnetenwatch.de/profile/albert-rupprecht-0,524,203,Albert Rupprecht [CDU/CSU],Albert Rupprecht,albert-rupprecht,1691,cducsu,Haarscharf am Thema vorbei!,TOP I.14 Bildung und Forschung,15089,poi,18
525,679127,https://www.abgeordnetenwatch.de/profile/ekin-deligoz/archive/215303,525,203,Ekin Deligöz (BÜNDNIS 90/DIE GRÜNEN),Ekin Deligöz,ekin-deligoz,1846,gruene,"Über den Weg, wie wir dahin kommen, gibt es tatsächlich eine Differenz; aber die gibt es nicht nur zwischen den Grünen und dem Ministerpräsidenten, sondern die gibt es generell zwischen Bund und Ländern. Es ist unser Auftrag, das gemeinsam zu verhandeln und den besten Weg zu suchen.",TOP I.14 Bildung und Forschung,15089,speech,18
526,679128,,526,203,,,,,,Beifall beim BÜNDNIS 90/DIE GRÜNEN,TOP I.14 Bildung und Forschung,15089,poi,18
527,679129,https://www.abgeordnetenwatch.de/profile/ekin-deligoz/archive/215303,527,203,Ekin Deligöz (BÜNDNIS 90/DIE GRÜNEN),Ekin Deligöz,ekin-deligoz,1846,gruene,"Darüber müssen wir streiten. Die Art und Weise, wie Sie diese Debatte blockieren, bringt uns nicht weiter. Das Kooperationsverbot haben wir übrigens Ihrer Fraktion zu verdanken. Und jetzt versuchen Sie, die Scherbenhaufen, die Sie angerichtet haben, irgendwie wieder zusammenzusetzen. Angriff ist nicht immer die beste Verteidigung. Manchmal fliegt einem das auch um die Ohren, Herr Kollege.",TOP I.14 Bildung und Forschung,15089,speech,18
528,679130,,528,203,,,,,,Beifall beim BÜNDNIS 90/DIE GRÜNEN,TOP I.14 Bildung und Forschung,15089,poi,18
529,679131,https://www.abgeordnetenwatch.de/profile/ekin-deligoz/archive/215303,529,203,Ekin Deligöz (BÜNDNIS 90/DIE GRÜNEN),Ekin Deligöz,ekin-deligoz,1846,gruene,"Wir sind uns mit den Ländern übrigens auch darüber einig, dass es selbstverständlich im Kompetenzbereich der Länder liegt, über Inhalte und das Funktionieren der Schulsysteme zu bestimmen. Eine Differenz gibt es an folgender Stelle: Wir von der Bundestagsfraktion betonen immer wieder, dass der Bund auch mit Finanzmitteln in die Schulfinanzierung in den Ländern hineingehen muss. Warum fordern wir das? Weil wir in diesem Land dringend eine Dynamik des sozialen Aufstiegs durch Bildung brauchen.",TOP I.14 Bildung und Forschung,15089,speech,18
530,679132,,530,203,,,,,,Beifall beim BÜNDNIS 90/DIE GRÜNEN sowie bei Abgeordneten der SPD,TOP I.14 Bildung und Forschung,15089,poi,18
531,679133,https://www.abgeordnetenwatch.de/profile/ekin-deligoz/archive/215303,531,203,Ekin Deligöz (BÜNDNIS 90/DIE GRÜNEN),Ekin Deligöz,ekin-deligoz,1846,gruene,"Diese Dynamik des sozialen Aufstiegs durch Bildung muss unabhängig vom Elternhaus, also vom Einkommen der Eltern und von der Herkunft der Kinder, funktionieren.",TOP I.14 Bildung und Forschung,15089,speech,18
532,679134,https://www.abgeordnetenwatch.de/profile/tankred-schipanski/archive/214802,532,203,Tankred Schipanski [CDU/CSU],Tankred Schipanski,tankred-schipanski,1396,cducsu,Das ist alles schon erfüllt! Schauen Sie sich mal den Nationalen Bildungsbericht an!,TOP I.14 Bildung und Forschung,15089,poi,18
533,679135,https://www.abgeordnetenwatch.de/profile/ozcan-mutlu/archive/215087,533,203,Gegenruf des Abg. Özcan Mutlu [BÜNDNIS 90/DIE GRÜNEN],Özcan Mutlu,ozcan-mutlu,1568,gruene,Da werden viele Defizite aufgezeigt!,TOP I.14 Bildung und Forschung,15089,poi,18
534,679136,https://www.abgeordnetenwatch.de/profile/ekin-deligoz/archive/215303,534,203,Ekin Deligöz (BÜNDNIS 90/DIE GRÜNEN),Ekin Deligöz,ekin-deligoz,1846,gruene,"Für viele Kinder ist das die einzige Möglichkeit, später erwerbstätig zu sein, den Armutskreislauf zu durchbrechen und teilzuhaben an dieser Gesellschaft. Das ist eine hohe Verantwortung. Hätten Sie es 2006 nicht verbockt, hätten Sie mit Ihrer Grundgesetzänderung damals Kooperationen zwischen Bund und Ländern nicht verhindert, wären wir schon viel weiter. Ihnen haben wir die verpassten Chancen der vergangenen Jahre zu verdanken, und zwar Ihnen alleine.",TOP I.14 Bildung und Forschung,15089,speech,18
535,679137,,535,203,,,,,,Beifall beim BÜNDNIS 90/DIE GRÜNEN sowie bei Abgeordneten der LINKEN,TOP I.14 Bildung und Forschung,15089,poi,18
536,679138,https://www.abgeordnetenwatch.de/profile/albert-rupprecht-0,536,203,Albert Rupprecht [CDU/CSU],Albert Rupprecht,albert-rupprecht,1691,cducsu,Es gab noch nie so viel Kooperation wie heute!,TOP I.14 Bildung und Forschung,15089,poi,18
537,679139,https://www.abgeordnetenwatch.de/profile/ekin-deligoz/archive/215303,537,203,Ekin Deligöz (BÜNDNIS 90/DIE GRÜNEN),Ekin Deligöz,ekin-deligoz,1846,gruene,"Fast alle Reden von Vertretern der Koalition begannen in dieser Woche damit, wie toll es ist, dass die Mittel für den Etat des Bildungsministeriums gesteigert wurden.",TOP I.14 Bildung und Forschung,15089,speech,18
538,679140,https://www.abgeordnetenwatch.de/profile/albert-rupprecht-0,538,203,Albert Rupprecht [CDU/CSU],Albert Rupprecht,albert-rupprecht,1691,cducsu,So ist es!,TOP I.14 Bildung und Forschung,15089,poi,18
539,679141,https://www.abgeordnetenwatch.de/profile/ekin-deligoz/archive/215303,539,203,Ekin Deligöz (BÜNDNIS 90/DIE GRÜNEN),Ekin Deligöz,ekin-deligoz,1846,gruene,"Ja, das finde ich wichtig. Das ist richtig. Aber es geht nicht nur darum, mehr Geld auszugeben und mehr Leute zu bedienen, sondern auch darum, wie das Geld, das ausgegeben wird, wirkt.",TOP I.14 Bildung und Forschung,15089,speech,18
540,679142,https://www.abgeordnetenwatch.de/profile/albert-rupprecht-0,540,203,Albert Rupprecht [CDU/CSU],Albert Rupprecht,albert-rupprecht,1691,cducsu,Da haben Sie auch recht!,TOP I.14 Bildung und Forschung,15089,poi,18
541,679143,https://www.abgeordnetenwatch.de/profile/ekin-deligoz/archive/215303,541,203,Ekin Deligöz (BÜNDNIS 90/DIE GRÜNEN),Ekin Deligöz,ekin-deligoz,1846,gruene,"In diesem Zusammenhang ist es interessant, Bundesrechnungshofberichte zu lesen. Der Bundesrechnungshof sagt, dass er große Zweifel daran hat, dass die Ausgabe der vielen Fördermillionen vom Ministerium ausreichend überwacht und kontrolliert wird, dass messbare Ziele formuliert werden. Auch bei den Großprojekten, bei denen viel Geld draufgeht - die Stilllegung atomarer Forschungsanlagen, der Teilchenbeschleuniger FAIR in Darmstadt -, gibt es große Versäumnisse, und die bleiben. Das sind die Hausaufgaben, die Sie erledigen müssen. Noch schlimmer kommt es, wenn man sich die Situation beim Kernfusionsreaktor ITER anschaut. Da fließen Milliarden hinein. Jetzt sagen Sie: Wir vom Bildungs- und Forschungsministerium sind dafür gar nicht direkt verantwortlich.",TOP I.14 Bildung und Forschung,15089,speech,18
542,679144,https://www.abgeordnetenwatch.de/profile/stefan-kaufmann/archive/214839,542,203,Dr. Stefan Kaufmann [CDU/CSU],Dr. Stefan Kaufmann,stefan-kaufmann,1466,cducsu,"Waren Sie mal dort? Fahren Sie mal hin, Frau Kollegin!",TOP I.14 Bildung und Forschung,15089,poi,18
543,679145,https://www.abgeordnetenwatch.de/profile/ekin-deligoz/archive/215303,543,203,Ekin Deligöz (BÜNDNIS 90/DIE GRÜNEN),Ekin Deligöz,ekin-deligoz,1846,gruene,"Aber das Ministerium ist maßgeblich dafür verantwortlich, welche Position die Bundesregierung diesbezüglich einnimmt. Sie wollen das Projekt politisch unterstützen. Ob ITER jemals Energie erzeugt, steht aber in den Sternen. Es gibt inzwischen sogar den Witz von der Fusionskonstante; ich weiß nicht, ob Sie den kennen.",TOP I.14 Bildung und Forschung,15089,speech,18
544,679146,https://www.abgeordnetenwatch.de/profile/stefan-kaufmann/archive/214839,544,203,Dr. Stefan Kaufmann [CDU/CSU],Dr. Stefan Kaufmann,stefan-kaufmann,1466,cducsu,Haben Sie sich inhaltlich damit beschäftigt?,TOP I.14 Bildung und Forschung,15089,poi,18
545,679147,https://www.abgeordnetenwatch.de/profile/ekin-deligoz/archive/215303,545,203,Ekin Deligöz (BÜNDNIS 90/DIE GRÜNEN),Ekin Deligöz,ekin-deligoz,1846,gruene,"Egal welchen Experten Sie fragen, ab wann mit ITER Strom produziert wird, kommt immer die Antwort: In 40 bis 50 Jahren. - Bis dahin kostet das Geld.",TOP I.14 Bildung und Forschung,15089,speech,18
546,679148,https://www.abgeordnetenwatch.de/profile/dr-philipp-lengsfeld,546,203,Dr. Philipp Lengsfeld [CDU/CSU],Dr. Philipp Lengsfeld,philipp-lengsfeld,1287,cducsu,Nur die Forschung!,TOP I.14 Bildung und Forschung,15089,poi,18
547,679149,https://www.abgeordnetenwatch.de/profile/ekin-deligoz/archive/215303,547,203,Ekin Deligöz (BÜNDNIS 90/DIE GRÜNEN),Ekin Deligöz,ekin-deligoz,1846,gruene,"Es werden jetzt 5 Milliarden Euro zusätzlich vom europäischen Steuerzahler dafür erbracht werden müssen, dass es womöglich auch in 40 Jahren noch heißt: In 40 Jahren. - Hier müssen Sie dringend umsteuern.",TOP I.14 Bildung und Forschung,15089,speech,18
548,679150,https://www.abgeordnetenwatch.de/profile/stefan-kaufmann/archive/214839,548,203,Dr. Stefan Kaufmann [CDU/CSU],Dr. Stefan Kaufmann,stefan-kaufmann,1466,cducsu,"Reine Ideologie, Frau Kollegin!",TOP I.14 Bildung und Forschung,15089,poi,18
549,679151,https://www.abgeordnetenwatch.de/profile/ekin-deligoz/archive/215303,549,203,Ekin Deligöz (BÜNDNIS 90/DIE GRÜNEN),Ekin Deligöz,ekin-deligoz,1846,gruene,"Wenn Sie die Debatte zum Wirtschafts- und Energieetat vorhin gehört hätten, wüssten Sie, dass wir dieses Geld eigentlich viel dringender in die erneuerbaren Energien und in innovative Technologien investieren müssten, auch hier in Deutschland, damit wir da mithalten können. Diese Chance für unser Land haben Sie verpasst.",TOP I.14 Bildung und Forschung,15089,speech,18
550,679152,,550,203,,,,,,Beifall beim BÜNDNIS 90/DIE GRÜNEN,TOP I.14 Bildung und Forschung,15089,poi,18
551,679153,https://www.abgeordnetenwatch.de/profile/sven-volmering/archive/214687,551,203,Sven Volmering [CDU/CSU],Sven Volmering,sven-volmering,1315,cducsu,20 Milliarden Euro reichen Ihnen nicht?,TOP I.14 Bildung und Forschung,15089,poi,18
552,679154,https://www.abgeordnetenwatch.de/profile/ekin-deligoz/archive/215303,552,203,Ekin Deligöz (BÜNDNIS 90/DIE GRÜNEN),Ekin Deligöz,ekin-deligoz,1846,gruene,"Inhaltlich haben wir einen Dissens, und wir teilen auch Ihre Prioritätensetzung nicht. Ich frage mich manchmal, von wem das Haus und die Ministerin sich eigentlich beraten lassen.",TOP I.14 Bildung und Forschung,15089,speech,18
553,679155,https://www.abgeordnetenwatch.de/profile/sven-volmering/archive/214687,553,203,Sven Volmering [CDU/CSU],Sven Volmering,sven-volmering,1315,cducsu,Von den Abgeordneten zum Beispiel!,TOP I.14 Bildung und Forschung,15089,poi,18
554,679156,https://www.abgeordnetenwatch.de/profile/albert-rupprecht-0,554,203,Albert Rupprecht [CDU/CSU],Albert Rupprecht,albert-rupprecht,1691,cducsu,Vom Parlament!,TOP I.14 Bildung und Forschung,15089,poi,18
555,679157,https://www.abgeordnetenwatch.de/profile/ekin-deligoz/archive/215303,555,203,Ekin Deligöz (BÜNDNIS 90/DIE GRÜNEN),Ekin Deligöz,ekin-deligoz,1846,gruene,"Interessanterweise frage das nicht nur ich, sondern das fragt inzwischen auch der Bundesrechnungshof. Liebe Kolleginnen und Kollegen, warum nennt das Bildungsministerium die Namen seiner externen Beratungsunternehmen eigentlich nicht? Wir wollen wissen: Wer sind die Einflüsterer?",TOP I.14 Bildung und Forschung,15089,speech,18
556,679158,,556,203,,,,,,Beifall beim BÜNDNIS 90/DIE GRÜNEN,TOP I.14 Bildung und Forschung,15089,poi,18
557,679159,https://www.abgeordnetenwatch.de/profile/ekin-deligoz/archive/215303,557,203,Ekin Deligöz (BÜNDNIS 90/DIE GRÜNEN),Ekin Deligöz,ekin-deligoz,1846,gruene,"Was für Eigeninteresse haben diese Unternehmen, von denen Sie sich beraten lassen? Wer sind diese Berater?",TOP I.14 Bildung und Forschung,15089,speech,18
558,679160,https://www.abgeordnetenwatch.de/profile/ozcan-mutlu/archive/215087,558,203,Özcan Mutlu [BÜNDNIS 90/DIE GRÜNEN],Özcan Mutlu,ozcan-mutlu,1568,gruene,Wir wollen Transparenz!,TOP I.14 Bildung und Forschung,15089,poi,18
559,679161,https://www.abgeordnetenwatch.de/profile/kai-gehring/archive/215144,559,203,Kai Gehring [BÜNDNIS 90/DIE GRÜNEN],Kai Gehring,kai-gehring,1821,gruene,Intransparenzressort!,TOP I.14 Bildung und Forschung,15089,poi,18
560,679162,https://www.abgeordnetenwatch.de/profile/ekin-deligoz/archive/215303,560,203,Ekin Deligöz (BÜNDNIS 90/DIE GRÜNEN),Ekin Deligöz,ekin-deligoz,1846,gruene,Ich frage Sie: Was verschweigen Sie?,TOP I.14 Bildung und Forschung,15089,speech,18
561,679163,https://www.abgeordnetenwatch.de/profile/tankred-schipanski/archive/214802,561,203,Tankred Schipanski [CDU/CSU],Tankred Schipanski,tankred-schipanski,1396,cducsu,Und vor allem: Wie viele schwarze Koffer müssen geöffnet werden?,TOP I.14 Bildung und Forschung,15089,poi,18
562,679164,https://www.abgeordnetenwatch.de/profile/ekin-deligoz/archive/215303,562,203,Ekin Deligöz (BÜNDNIS 90/DIE GRÜNEN),Ekin Deligöz,ekin-deligoz,1846,gruene,"Warum fällt es Ihnen so schwer, zu klären und uns mitzuteilen, wie viele Beratungsverträge Sie wirklich an wen vergeben haben?",TOP I.14 Bildung und Forschung,15089,speech,18
563,679165,https://www.abgeordnetenwatch.de/profile/tankred-schipanski/archive/214802,563,203,Tankred Schipanski [CDU/CSU],Tankred Schipanski,tankred-schipanski,1396,cducsu,"Jawohl, Transparenz!",TOP I.14 Bildung und Forschung,15089,poi,18
564,679166,https://www.abgeordnetenwatch.de/profile/ekin-deligoz/archive/215303,564,203,Ekin Deligöz (BÜNDNIS 90/DIE GRÜNEN),Ekin Deligöz,ekin-deligoz,1846,gruene,"Der Bundesrechnungshof schreibt in seinem Bericht, dass diese Strukturen im Beraterwesen potenziell geeignet sind, die Integrität der Bundesverwaltung zu beeinträchtigen. Sie schulden der Öffentlichkeit, den Abgeordneten, den Menschen hier eine Antwort. Transparenz dient der Herstellung von Akzeptanz.",TOP I.14 Bildung und Forschung,15089,speech,18
565,679167,,565,203,,,,,,Beifall beim BÜNDNIS 90/DIE GRÜNEN,TOP I.14 Bildung und Forschung,15089,poi,18
566,679168,https://www.abgeordnetenwatch.de/profile/ekin-deligoz/archive/215303,566,203,Ekin Deligöz (BÜNDNIS 90/DIE GRÜNEN),Ekin Deligöz,ekin-deligoz,1846,gruene,"Aber so, wie Sie vorgehen, unterstützen Sie dieses Anliegen mit der Politik Ihres Hauses nicht. Das ist ein Haushalt der verpassten Chancen. Deshalb werden wir nicht zustimmen.",TOP I.14 Bildung und Forschung,15089,speech,18
567,679169,,567,203,,,,,,Beifall beim BÜNDNIS 90/DIE GRÜNEN sowie der Abg. Nicole Gohlke [DIE LINKE],TOP I.14 Bildung und Forschung,15089,poi,18
568,679170,https://www.abgeordnetenwatch.de/profile/johannes-singhammer,568,203,Vizepräsident Johannes Singhammer,Johannes Singhammer,johannes-singhammer,1582,,Nächster Redner ist der Kollege Swen Schulz für die SPD.,TOP I.14 Bildung und Forschung,15089,chair,18
569,679171,,569,203,,,,,,Beifall bei der SPD sowie bei Abgeordneten der CDU/CSU,TOP I.14 Bildung und Forschung,15089,poi,18
570,679172,https://www.abgeordnetenwatch.de/profile/swen-schulz/archive/216724,570,203,Swen Schulz (Spandau) (SPD),Swen Schulz,swen-schulz,1659,spd,"Herr Präsident! Liebe Kolleginnen und Kollegen! Meine sehr verehrten Damen und Herren! Der Bundestag hat in den letzten Jahren im Rahmen der Haushaltsberatungen immer wieder einiges am Regierungsentwurf geändert. Wir haben, wie man so schön sagt, einen guten Entwurf noch verbessert. Doch in diesem Jahr haben wir uns selbst übertroffen.",TOP I.14 Bildung und Forschung,15089,speech,18
571,679173,,571,203,,,,,,Beifall des Abg. Dr. Ernst Dieter Rossmann [SPD],TOP I.14 Bildung und Forschung,15089,poi,18
572,679174,https://www.abgeordnetenwatch.de/profile/ozcan-mutlu/archive/215087,572,203,Özcan Mutlu [BÜNDNIS 90/DIE GRÜNEN],Özcan Mutlu,ozcan-mutlu,1568,gruene,"Na, na! Jetzt übertreib mal nicht!",TOP I.14 Bildung und Forschung,15089,poi,18
573,679175,https://www.abgeordnetenwatch.de/profile/swen-schulz/archive/216724,573,203,Swen Schulz (Spandau) (SPD),Swen Schulz,swen-schulz,1659,spd,"Es ist wirklich außergewöhnlich und - das kann man so sagen - krass, was wir geschafft haben.

Schon der Regierungsentwurf sah eine Erhöhung der Mittel für Bildung und Forschung um über 1 Milliarde Euro vor.",TOP I.14 Bildung und Forschung,15089,speech,18
574,679176,https://www.abgeordnetenwatch.de/profile/tankred-schipanski/archive/214802,574,203,Tankred Schipanski [CDU/CSU],Tankred Schipanski,tankred-schipanski,1396,cducsu,Gigantisch!,TOP I.14 Bildung und Forschung,15089,poi,18
575,679177,https://www.abgeordnetenwatch.de/profile/swen-schulz/archive/216724,575,203,Swen Schulz (Spandau) (SPD),Swen Schulz,swen-schulz,1659,spd,Wir haben noch fast 100 Millionen Euro für das nächste Jahr obendrauf gepackt.,TOP I.14 Bildung und Forschung,15089,speech,18
576,679178,https://www.abgeordnetenwatch.de/profile/susanna-karawanskij/archive/213308,576,203,Susanna Karawanskij [DIE LINKE],Susanna Karawanskij,susanna-karawanskij,1470,linke,Ui!,TOP I.14 Bildung und Forschung,15089,poi,18
577,679179,https://www.abgeordnetenwatch.de/profile/kai-gehring/archive/215144,577,203,Kai Gehring [BÜNDNIS 90/DIE GRÜNEN],Kai Gehring,kai-gehring,1821,gruene,Super!,TOP I.14 Bildung und Forschung,15089,poi,18
578,679180,https://www.abgeordnetenwatch.de/profile/dr-thomas-feist/archive/214735,578,203,Gegenruf des Abg. Dr. Thomas Feist [CDU/CSU],Dr. Thomas Feist,thomas-feist,1334,cducsu,Da freut sich ja sogar der Herr Gehring!,TOP I.14 Bildung und Forschung,15089,poi,18
579,679181,https://www.abgeordnetenwatch.de/profile/swen-schulz/archive/216724,579,203,Swen Schulz (Spandau) (SPD),Swen Schulz,swen-schulz,1659,spd,"Zusammengerechnet mit den zusätzlichen Mitteln für die Folgejahre ist das ein Vielfaches. Diese Koalition setzt einen klaren Schwerpunkt bei Bildung und Forschung und damit bei den wichtigsten Zukunftsinvestitionen überhaupt, meine sehr verehrten Damen und Herren.",TOP I.14 Bildung und Forschung,15089,speech,18
580,679182,,580,203,,,,,,Beifall bei der SPD und der CDU/CSU,TOP I.14 Bildung und Forschung,15089,poi,18
581,679183,https://www.abgeordnetenwatch.de/profile/kai-gehring/archive/215144,581,203,Kai Gehring [BÜNDNIS 90/DIE GRÜNEN],Kai Gehring,kai-gehring,1821,gruene,Haben Sie zu viele Selbstbeweihräucherungsstäbchen im Büro? Unglaublich!,TOP I.14 Bildung und Forschung,15089,poi,18
582,679184,https://www.abgeordnetenwatch.de/profile/swen-schulz/archive/216724,582,203,Swen Schulz (Spandau) (SPD),Swen Schulz,swen-schulz,1659,spd,"Es ist gesagt worden: Dies ist der letzte reguläre Haushaltsplan in dieser Legislaturperiode; darum kann man schon einmal Bilanz ziehen. Die Entwicklung des Haushalts in den letzten Jahren ist beeindruckend und geht deutlich - wirklich deutlich - über das hinaus, was die Vorgängerregierung von CDU/CSU und FDP ursprünglich geplant hatte.",TOP I.14 Bildung und Forschung,15089,speech,18
583,679185,https://www.abgeordnetenwatch.de/profile/albert-rupprecht-0,583,203,Albert Rupprecht [CDU/CSU],Albert Rupprecht,albert-rupprecht,1691,cducsu,"Ja, aber das ist doch immer so! Das ist nicht die große Leistung!",TOP I.14 Bildung und Forschung,15089,poi,18
584,679186,https://www.abgeordnetenwatch.de/profile/swen-schulz/archive/216724,584,203,Swen Schulz (Spandau) (SPD),Swen Schulz,swen-schulz,1659,spd,"2013 sah die Finanzplanung von Schwarz-Gelb für das Jahr 2017 Ausgaben für Bildung und Forschung in Höhe von 13,5 Milliarden Euro vor. Ich wiederhole: 13,5 Milliarden Euro.",TOP I.14 Bildung und Forschung,15089,speech,18
585,679187,,585,203,Zuruf von der CDU/CSU,von der CDU/CSU,von-der-cdu-csu,,cducsu,Auch schon nicht schlecht!,TOP I.14 Bildung und Forschung,15089,poi,18
586,679188,https://www.abgeordnetenwatch.de/profile/swen-schulz/archive/216724,586,203,Swen Schulz (Spandau) (SPD),Swen Schulz,swen-schulz,1659,spd,"Jetzt sind es 17,6 Milliarden Euro.",TOP I.14 Bildung und Forschung,15089,speech,18
587,679189,https://www.abgeordnetenwatch.de/profile/simone-raatz-2/archive/217188,587,203,Dr. Simone Raatz [SPD],Dr. Simone Raatz,simone-raatz,1545,spd,Viel besser!,TOP I.14 Bildung und Forschung,15089,poi,18
588,679190,https://www.abgeordnetenwatch.de/profile/swen-schulz/archive/216724,588,203,Swen Schulz (Spandau) (SPD),Swen Schulz,swen-schulz,1659,spd,Das sind über 4 Milliarden Euro mehr.,TOP I.14 Bildung und Forschung,15089,speech,18
589,679191,,589,203,,,,,,Beifall bei der SPD sowie des Abg. Bernhard Kaster [CDU/CSU],TOP I.14 Bildung und Forschung,15089,poi,18
590,679192,https://www.abgeordnetenwatch.de/profile/swen-schulz/archive/216724,590,203,Swen Schulz (Spandau) (SPD),Swen Schulz,swen-schulz,1659,spd,"Ich will nun nicht behaupten, dass das alles auf die SPD zurückgeht,",TOP I.14 Bildung und Forschung,15089,speech,18
591,679193,,591,203,,,,,,Heiterkeit bei Abgeordneten der SPD,TOP I.14 Bildung und Forschung,15089,poi,18
592,679194,https://www.abgeordnetenwatch.de/profile/albert-rupprecht-0,592,203,Albert Rupprecht [CDU/CSU],Albert Rupprecht,albert-rupprecht,1691,cducsu,Das war unter Steinbrück genauso!,TOP I.14 Bildung und Forschung,15089,poi,18
593,679195,,593,203,Weiterer Zuruf von der CDU/CSU,von der CDU/CSU,von-der-cdu-csu,,cducsu,"Oh, oh, oh! Jetzt müssen Sie aber aufpassen!",TOP I.14 Bildung und Forschung,15089,poi,18
594,679196,https://www.abgeordnetenwatch.de/profile/swen-schulz/archive/216724,594,203,Swen Schulz (Spandau) (SPD),Swen Schulz,swen-schulz,1659,spd,"aber das meiste schon, meine sehr verehrten Damen und Herren.",TOP I.14 Bildung und Forschung,15089,speech,18
595,679197,,595,203,,,,,,Beifall bei Abgeordneten der SPD,TOP I.14 Bildung und Forschung,15089,poi,18
596,679198,https://www.abgeordnetenwatch.de/profile/swen-schulz/archive/216724,596,203,Swen Schulz (Spandau) (SPD),Swen Schulz,swen-schulz,1659,spd,"Einige Bereiche will ich ansprechen. Deutschlands Wirtschaft ist stark. Das ist sie im internationalen Wettbewerb nur mit Forschung und Entwicklung. Der Staat leistet dabei mit den Hochschulen und außeruniversitären Einrichtungen unverzichtbare Beiträge. Wir haben mit der Exzellenzinitiative, mit der Initiative für Nachwuchswissenschaftler, mit dem Pakt für Forschung und Innovation, mit der Hightech-Strategie usw. usf. Jahr für Jahr die Finanzierung verbessert, in diesem Haushalt zum Beispiel durch die zusätzliche Erhöhung der Mittel für die Fraunhofer-Gesellschaft, damit sie ihre anwendungsorientierte Forschung ausbauen kann.",TOP I.14 Bildung und Forschung,15089,speech,18
597,679199,,597,203,,,,,,Beifall bei der SPD sowie bei Abgeordneten der CDU/CSU,TOP I.14 Bildung und Forschung,15089,poi,18
