,id,profile_url,sequence,sitzung,speaker,speaker_cleaned,speaker_fp,speaker_key,speaker_party,text,top,top_id,type,wahlperiode
440,690789,https://www.abgeordnetenwatch.de/profile/eva-hogl/archive/216719,440,211,Dr. Eva Högl (SPD),Dr. Eva Högl,eva-hogl,1790.0,spd,Das gehört nicht in eine so wichtige Debatte. Herr de Maizière hat zu Recht gesagt: Schuldzuweisungen sind hier fehl am Platz.,TOP ZP 1 Aktuelle Stunde zu Maßnahmen zum Schutz der öffentlichen Sicherheit,15147,speech,18
441,690790,,441,211,,,,,,Beifall bei der SPD,TOP ZP 1 Aktuelle Stunde zu Maßnahmen zum Schutz der öffentlichen Sicherheit,15147,poi,18
442,690791,https://www.abgeordnetenwatch.de/profile/eva-hogl/archive/216719,442,211,Dr. Eva Högl (SPD),Dr. Eva Högl,eva-hogl,1790.0,spd,"Herr Harbarth, ich muss darauf reagieren und will einmal daran erinnern, wer hier in Berlin fünf Jahre lang Verantwortung für den Innen- und den Justizbereich getragen hat. Beide Ressorts wurden hier in Berlin fünf Jahre lang von der CDU verantwortet.",TOP ZP 1 Aktuelle Stunde zu Maßnahmen zum Schutz der öffentlichen Sicherheit,15147,speech,18
443,690792,https://www.abgeordnetenwatch.de/profile/thomas-oppermann/archive/216688,443,211,Thomas Oppermann [SPD],Thomas Oppermann,thomas-oppermann,1719.0,spd,In der fraglichen Zeit!,TOP ZP 1 Aktuelle Stunde zu Maßnahmen zum Schutz der öffentlichen Sicherheit,15147,poi,18
444,690793,https://www.abgeordnetenwatch.de/profile/eva-hogl/archive/216719,444,211,Dr. Eva Högl (SPD),Dr. Eva Högl,eva-hogl,1790.0,spd,"Wenn Sie sich die Chronologie angucken, die wir heute in einer aktualisierten Fassung auf den Tisch bekommen haben, dann sehen Sie, dass es dort um Berlin geht: um das Landeskriminalamt Berlin und um die Generalstaatsanwaltschaft Berlin. Ein Staatsanwalt in Berlin hat am 21. September 2016 die Maßnahmen eingestellt. - Ich will so eigentlich nicht diskutieren;",TOP ZP 1 Aktuelle Stunde zu Maßnahmen zum Schutz der öffentlichen Sicherheit,15147,speech,18
445,690794,https://www.abgeordnetenwatch.de/profile/dr-konstantin-von-notz-0,445,211,Dr. Konstantin von Notz [BÜNDNIS 90/DIE GRÜNEN],Dr. Konstantin von Notz,konstantin-notz,1576.0,gruene,Doch! Da gibt es viel aufzuklären!,TOP ZP 1 Aktuelle Stunde zu Maßnahmen zum Schutz der öffentlichen Sicherheit,15147,poi,18
446,690795,https://www.abgeordnetenwatch.de/profile/eva-hogl/archive/216719,446,211,Dr. Eva Högl (SPD),Dr. Eva Högl,eva-hogl,1790.0,spd,"ich lasse es dabei auch bewenden. Aber die Debatte in der Form zu führen, wie Sie es getan haben, führt nicht zu einem Ergebnis.",TOP ZP 1 Aktuelle Stunde zu Maßnahmen zum Schutz der öffentlichen Sicherheit,15147,speech,18
447,690796,,447,211,,,,,,"Beifall bei der SPD, dem BÜNDNIS 90/DIE GRÜNEN und der LINKEN",TOP ZP 1 Aktuelle Stunde zu Maßnahmen zum Schutz der öffentlichen Sicherheit,15147,poi,18
448,690797,https://www.abgeordnetenwatch.de/profile/eva-hogl/archive/216719,448,211,Dr. Eva Högl (SPD),Dr. Eva Högl,eva-hogl,1790.0,spd,"Liebe Kolleginnen und Kollegen, der Fall Amri ist deshalb so tragisch, weil die Behörden wohl selten so viel über einen Gefährder wussten, wie sie über Amri gewusst haben. Deswegen muss natürlich schonungslos analysiert werden, wo, an welcher Stelle, Fehler gemacht worden sind. Das alles müssen wir schonungslos aufklären. Für die SPD-Bundestagsfraktion sage ich: Wir werden uns mit jedem geeigneten Instrument an der Aufklärung beteiligen. Das betrifft den Bund, die Bundesländer und alle Behörden.",TOP ZP 1 Aktuelle Stunde zu Maßnahmen zum Schutz der öffentlichen Sicherheit,15147,speech,18
449,690798,,449,211,,,,,,Beifall bei der SPD,TOP ZP 1 Aktuelle Stunde zu Maßnahmen zum Schutz der öffentlichen Sicherheit,15147,poi,18
450,690799,https://www.abgeordnetenwatch.de/profile/eva-hogl/archive/216719,450,211,Dr. Eva Högl (SPD),Dr. Eva Högl,eva-hogl,1790.0,spd,"Wir müssen ehrlicherweise sagen: Der Fall Amri zeigt, dass bereits bestehende Gesetze viel besser hätten angewandt werden müssen;",TOP ZP 1 Aktuelle Stunde zu Maßnahmen zum Schutz der öffentlichen Sicherheit,15147,speech,18
451,690800,https://www.abgeordnetenwatch.de/profile/dr-dietmar-bartsch-0,451,211,Dr. Dietmar Bartsch [DIE LINKE],Dr. Dietmar Bartsch,dietmar-bartsch,1871.0,linke,Richtig!,TOP ZP 1 Aktuelle Stunde zu Maßnahmen zum Schutz der öffentlichen Sicherheit,15147,poi,18
452,690801,https://www.abgeordnetenwatch.de/profile/eva-hogl/archive/216719,452,211,Dr. Eva Högl (SPD),Dr. Eva Högl,eva-hogl,1790.0,spd,denn wir haben ein Instrumentarium in diesem Land. Wir haben scharfe Gesetze. Viele haben wir in dieser Legislaturperiode noch verschärft. Diese Gesetze hätten im Fall Amri angewandt werden müssen. Dafür hätte es an der einen oder anderen Stelle die Möglichkeit gegeben.,TOP ZP 1 Aktuelle Stunde zu Maßnahmen zum Schutz der öffentlichen Sicherheit,15147,speech,18
453,690802,,453,211,,,,,,"Beifall bei der SPD, der LINKEN und dem BÜNDNIS 90/DIE GRÜNEN",TOP ZP 1 Aktuelle Stunde zu Maßnahmen zum Schutz der öffentlichen Sicherheit,15147,poi,18
454,690803,https://www.abgeordnetenwatch.de/profile/eva-hogl/archive/216719,454,211,Dr. Eva Högl (SPD),Dr. Eva Högl,eva-hogl,1790.0,spd,"Aber auch wir als Gesetzgeber sind gefragt. Die SPD-Bundestagsfraktion unterstützt ganz ausdrücklich, was Bundesminister Maas und Bundesminister de Maizière vereinbart haben und uns vorlegen werden. Wir werden das im parlamentarischen Verfahren beraten; denn wenn wir schon jetzt feststellen, dass wir Optimierungsbedarf haben - der Fall Amri gibt genügend Anlass, zu sagen: wir haben Optimierungsbedarf im Bereich der Gefährder, bei der Zusammenarbeit der Behörden, im Bereich Europa und auch im ausländerrechtlichen Bereich -,",TOP ZP 1 Aktuelle Stunde zu Maßnahmen zum Schutz der öffentlichen Sicherheit,15147,speech,18
455,690804,https://www.abgeordnetenwatch.de/profile/britta-haselmann-0,455,211,Britta Haßelmann [BÜNDNIS 90/DIE GRÜNEN],Britta Haßelmann,britta-haßelmann,1807.0,gruene,Beim Waffenrecht!,TOP ZP 1 Aktuelle Stunde zu Maßnahmen zum Schutz der öffentlichen Sicherheit,15147,poi,18
456,690805,https://www.abgeordnetenwatch.de/profile/eva-hogl/archive/216719,456,211,Dr. Eva Högl (SPD),Dr. Eva Högl,eva-hogl,1790.0,spd,"dann sind wir als Gesetzgeber hier und jetzt gefordert, Maßnahmen auf den Weg zu bringen.",TOP ZP 1 Aktuelle Stunde zu Maßnahmen zum Schutz der öffentlichen Sicherheit,15147,speech,18
457,690806,,457,211,,,,,,Beifall bei der SPD sowie der Abg. Dr. Silke Launert [CDU/CSU],TOP ZP 1 Aktuelle Stunde zu Maßnahmen zum Schutz der öffentlichen Sicherheit,15147,poi,18
458,690807,https://www.abgeordnetenwatch.de/profile/eva-hogl/archive/216719,458,211,Dr. Eva Högl (SPD),Dr. Eva Högl,eva-hogl,1790.0,spd,"Als letztes Stichwort dürfen wir die Prävention nicht vergessen. Auch da müssen wir noch eine Schippe drauflegen. Wir müssen die 100 Millionen Euro, die wir zur Verfügung gestellt haben, gut einsetzen, damit wir eine solche Radikalisierung schon im Ansatz verhindern.

Eine allerletzte, gute Nachricht - das ist ein Auftrag an uns als Gesetzgeber -: Die letzte Umfrage hat gezeigt, dass sich rund 75 Prozent der Bürgerinnen und Bürger sicher fühlen.",TOP ZP 1 Aktuelle Stunde zu Maßnahmen zum Schutz der öffentlichen Sicherheit,15147,speech,18
459,690808,https://www.abgeordnetenwatch.de/profile/dr-dietmar-bartsch-0,459,211,Dr. Dietmar Bartsch [DIE LINKE],Dr. Dietmar Bartsch,dietmar-bartsch,1871.0,linke,Genau!,TOP ZP 1 Aktuelle Stunde zu Maßnahmen zum Schutz der öffentlichen Sicherheit,15147,poi,18
460,690809,https://www.abgeordnetenwatch.de/profile/eva-hogl/archive/216719,460,211,Dr. Eva Högl (SPD),Dr. Eva Högl,eva-hogl,1790.0,spd,"Das können gerne noch ein paar mehr werden; aber bei dieser Zahl soll es auf jeden Fall bleiben. Daran arbeiten wir gemeinsam sehr konzentriert.

Herzlichen Dank.",TOP ZP 1 Aktuelle Stunde zu Maßnahmen zum Schutz der öffentlichen Sicherheit,15147,speech,18
461,690810,,461,211,,,,,,Beifall bei der SPD,TOP ZP 1 Aktuelle Stunde zu Maßnahmen zum Schutz der öffentlichen Sicherheit,15147,poi,18
462,690811,https://www.abgeordnetenwatch.de/profile/johannes-singhammer,462,211,Vizepräsident Johannes Singhammer,Johannes Singhammer,johannes-singhammer,1582.0,,"Nächster Redner ist der Kollege Hans-Christian Ströbele, Bündnis 90/Die Grünen.",TOP ZP 1 Aktuelle Stunde zu Maßnahmen zum Schutz der öffentlichen Sicherheit,15147,chair,18
463,690812,https://www.abgeordnetenwatch.de/profile/hans-christian-strobele,463,211,Hans-Christian Ströbele (BÜNDNIS 90/DIE GRÜNEN),Hans-Christian Ströbele,hans-christian-strobele,1578.0,gruene,"Danke, Herr Präsident. - Richtig ist, dass die Opfer von uns Solidarität erwarten, und diese bekommen sie, glaube ich, von uns allen. Was sie aber auch erwarten in der schrecklichen Situation, in der sich heute noch viele befinden, ist jede Art von Hilfe und Unterstützung. Diese müssen wir ihnen zusichern.",TOP ZP 1 Aktuelle Stunde zu Maßnahmen zum Schutz der öffentlichen Sicherheit,15147,speech,18
464,690813,,464,211,,,,,,"Beifall beim BÜNDNIS 90/DIE GRÜNEN, bei der SPD und der LINKEN sowie bei Abgeordneten der CDU/CSU",TOP ZP 1 Aktuelle Stunde zu Maßnahmen zum Schutz der öffentlichen Sicherheit,15147,poi,18
465,690814,https://www.abgeordnetenwatch.de/profile/hans-christian-strobele,465,211,Hans-Christian Ströbele (BÜNDNIS 90/DIE GRÜNEN),Hans-Christian Ströbele,hans-christian-strobele,1578.0,gruene,"Was uns hier alle mit den Opfern eint - da nehme ich erst einmal gar keinen aus, auch die Minister nicht -, sind die Fragen: Wie konnte das mitten in Deutschland, mitten in Berlin, an diesem Platz geschehen? Wie ist das zu erklären? Wie können wir verhindern, dass so etwas wieder geschieht?

Da muss man doch als Allererstes untersuchen: Was ist falsch gemacht worden? Herr de Maizière, Sie sind gleich danach mit Vorschlägen gekommen, welche Gesetze man nun ändern solle, dass man überlegen solle, den Verfassungsschutz zusammenzulegen - alles, was schon vor 20 Jahren gefordert worden ist. Aber zu der Frage: „Wie konnte das geschehen?“, ist der einzige Vorschlag, den ich von einem Minister der amtierenden Bundesregierung gehört habe: Wir brauchen einen Untersuchungsausschuss des Parlaments. - Ist es nicht erst einmal Ihre Aufgabe, in Ihrem Amt, in Ihrer Behörde, die ja eine maßgebliche Rolle gespielt hat, nachzuforschen, was bei uns schiefgelaufen ist? Das erwarten wir von Ihnen.",TOP ZP 1 Aktuelle Stunde zu Maßnahmen zum Schutz der öffentlichen Sicherheit,15147,speech,18
466,690815,,466,211,,,,,,Beifall beim BÜNDNIS 90/DIE GRÜNEN sowie der Abg. Dr. Petra Sitte [DIE LINKE],TOP ZP 1 Aktuelle Stunde zu Maßnahmen zum Schutz der öffentlichen Sicherheit,15147,poi,18
467,690816,https://www.abgeordnetenwatch.de/profile/hans-christian-strobele,467,211,Hans-Christian Ströbele (BÜNDNIS 90/DIE GRÜNEN),Hans-Christian Ströbele,hans-christian-strobele,1578.0,gruene,"Ich werde einmal ganz konkret. Die Bombe hat seit dem 19. September 2016 getickt. Genau drei Monate vor dem schrecklichen Anschlag gab es eine Meldung vom marokkanischen Geheimdienst, in einer Situation, in der die Beobachtung von Amri eingestellt worden ist, weil man gesagt hat: Eine konkrete Gefahr gibt es nicht. - Wissen Sie, was in dieser Meldung - das steht auch in Ihrer Zusammenstellung - stand? Darin stand erstens: Er ist ein Gefährder. - Das wussten wir schon. Darin stand aber zweitens - das war neu, das findet sich in all den anderen Meldungen früher nicht -: Er will nach Syrien, zum IS - was macht er da wohl? -, oder nach Libyen, zum IS. Was macht er da wohl? Allein dieses Bestreben ist inzwischen hier in Deutschland eine schwere Straftat. Darin stand als Drittes: Er hasst Deutschland, er ist der Auffassung, Deutschland ist das Land der Ungläubigen, und Deutschland erpresst seine Brüder. Zuletzt steht da noch, am 19. September 2016: Herr Amri führt ein Projekt aus, über das er nicht näher reden will.

Dann kam im Oktober, am 10. oder am 13. Oktober, erneut diese Meldung aus Marokko, und dann hat sich das GTAZ damit beschäftigt. Was haben sie gesagt? Sie haben das ernst genommen. Sie haben zwar gesagt: „Wir sehen immer noch keine Gefährdung“, aber sie haben an Ihr Amt, an das Bundesamt für Verfassungsschutz, den Auftrag übergeben: Überprüft bei dem marokkanischen Partnerdienst die übermittelten Erkenntnisse, und teilt sie uns mit.

Was ist daraufhin geschehen? Bis heute offenbar nichts. Nichts, Herr Minister! Fragen Sie sie doch mal. Es ist nichts geschehen. Sie sind einfach Ihrer Aufgabe nicht nachgekommen. Das war am 2. November 2016, also gut sechs Wochen vor dem Anschlag. Sie hätten genügend Zeit gehabt, nach Marokko zu fahren und das zu klären. Es ist nichts geschehen.

Da sage ich Ihnen: Da gibt es ein Verschulden, da gibt es ein Verschulden Ihrer Behörde, und da gibt es auch ein Verschulden der Aufsicht Ihrer Behörde.",TOP ZP 1 Aktuelle Stunde zu Maßnahmen zum Schutz der öffentlichen Sicherheit,15147,speech,18
468,690817,,468,211,,,,,,Beifall beim BÜNDNIS 90/DIE GRÜNEN,TOP ZP 1 Aktuelle Stunde zu Maßnahmen zum Schutz der öffentlichen Sicherheit,15147,poi,18
469,690818,https://www.abgeordnetenwatch.de/profile/hans-christian-strobele,469,211,Hans-Christian Ströbele (BÜNDNIS 90/DIE GRÜNEN),Hans-Christian Ströbele,hans-christian-strobele,1578.0,gruene,"Das nächste Beispiel ist vorhin schon angesprochen worden. Es wird immer wieder gesagt: Wir konnten ihn ja nach Tunis nicht loswerden, die dort Zuständigen reagieren ja nicht. - Das stimmt nicht. Am 24. Oktober - das war fast zwei Monate vor dem Anschlag - kam aus Tunesien die Mitteilung: „Wir haben anhand der Indizien festgestellt, er ist tunesischer Staatsbürger“, und man hat sogar Passdaten übermittelt. Warum hat sich da nicht einer von Ihrer Behörde",TOP ZP 1 Aktuelle Stunde zu Maßnahmen zum Schutz der öffentlichen Sicherheit,15147,speech,18
470,690819,,470,211,,,,,,Zurufe von der CDU/CSU,TOP ZP 1 Aktuelle Stunde zu Maßnahmen zum Schutz der öffentlichen Sicherheit,15147,poi,18
471,690820,https://www.abgeordnetenwatch.de/profile/hans-christian-strobele,471,211,Hans-Christian Ströbele (BÜNDNIS 90/DIE GRÜNEN),Hans-Christian Ströbele,hans-christian-strobele,1578.0,gruene,- von hoher Stelle in Tunis ist das gemeldet worden -,TOP ZP 1 Aktuelle Stunde zu Maßnahmen zum Schutz der öffentlichen Sicherheit,15147,speech,18
472,690821,https://www.abgeordnetenwatch.de/profile/max-straubinger/archive/214944,472,211,Max Straubinger [CDU/CSU],Max Straubinger,max-straubinger,1647.0,cducsu,Das ist Länderzuständigkeit!,TOP ZP 1 Aktuelle Stunde zu Maßnahmen zum Schutz der öffentlichen Sicherheit,15147,poi,18
473,690822,https://www.abgeordnetenwatch.de/profile/hans-christian-strobele,473,211,Hans-Christian Ströbele (BÜNDNIS 90/DIE GRÜNEN),Hans-Christian Ströbele,hans-christian-strobele,1578.0,gruene,"das Papier mit dieser Nachricht in die Tasche gesteckt, ist sofort zur Botschaft gefahren und hat gesagt: „Wir wollen jetzt in drei Stunden oder meinetwegen in drei Tagen die Papiere von ihm haben, damit wir ihn abschieben können“? Die Voraussetzung für eine Inhaftierung innerhalb von drei Monaten lag mit Sicherheit zu diesem Zeitpunkt vor. Sie haben es nicht gemacht.",TOP ZP 1 Aktuelle Stunde zu Maßnahmen zum Schutz der öffentlichen Sicherheit,15147,speech,18
474,690823,,474,211,,,,,,Beifall beim BÜNDNIS 90/DIE GRÜNEN sowie bei Abgeordneten der LINKEN,TOP ZP 1 Aktuelle Stunde zu Maßnahmen zum Schutz der öffentlichen Sicherheit,15147,poi,18
475,690824,https://www.abgeordnetenwatch.de/profile/hans-christian-strobele,475,211,Hans-Christian Ströbele (BÜNDNIS 90/DIE GRÜNEN),Hans-Christian Ströbele,hans-christian-strobele,1578.0,gruene,"Ich muss leider zum Ende kommen. Ich könnte noch weiter fortfahren; ich habe noch ein paar solche interessanten Details, zum Beispiel die Strafverfahren. Gegen ihn bestanden ein halbes Dutzend schwerer Strafvorwürfe. Die Ermittlungsverfahren sind nicht geführt worden. Wir wissen bis heute noch nicht, unter welchen Aliasnamen er wo überall Geld kassiert bzw. Sozialunterstützung bekommen hat. Diese Frage ist bis heute nicht beantwortet. Das haben Sie auch damals nicht versucht herauszubekommen, sondern Sie haben ein halbes Dutzend Ermittlungsverfahren eingestellt, obwohl die Möglichkeit bestanden hätte, Strafverfahren einzuleiten, einen Haftbefehl zu beantragen.",TOP ZP 1 Aktuelle Stunde zu Maßnahmen zum Schutz der öffentlichen Sicherheit,15147,speech,18
476,690825,https://www.abgeordnetenwatch.de/profile/volker-kauder/archive/214888,476,211,Volker Kauder [CDU/CSU],Volker Kauder,volker-kauder,1775.0,cducsu,Das macht doch nicht der Minister! So ein Quatschkopf!,TOP ZP 1 Aktuelle Stunde zu Maßnahmen zum Schutz der öffentlichen Sicherheit,15147,poi,18
477,690826,https://www.abgeordnetenwatch.de/profile/hans-christian-strobele,477,211,Hans-Christian Ströbele (BÜNDNIS 90/DIE GRÜNEN),Hans-Christian Ströbele,hans-christian-strobele,1578.0,gruene,"Ich garantiere Ihnen, der Haftbefehl wäre ausgestellt worden, ein strafrechtlicher Haftbefehl wäre ausgestellt worden.",TOP ZP 1 Aktuelle Stunde zu Maßnahmen zum Schutz der öffentlichen Sicherheit,15147,speech,18
478,690827,https://www.abgeordnetenwatch.de/profile/johannes-singhammer,478,211,Vizepräsident Johannes Singhammer,Johannes Singhammer,johannes-singhammer,1582.0,,"Herr Kollege Ströbele, Sie haben angekündigt, zum Ende zu kommen. Aufgrund der Redezeit war diese Ankündigung auch richtig.",TOP ZP 1 Aktuelle Stunde zu Maßnahmen zum Schutz der öffentlichen Sicherheit,15147,chair,18
479,690828,https://www.abgeordnetenwatch.de/profile/volker-kauder/archive/214888,479,211,Volker Kauder [CDU/CSU],Volker Kauder,volker-kauder,1775.0,cducsu,"Die Staatsanwaltschaft ist gefordert, und der kommt so daher!",TOP ZP 1 Aktuelle Stunde zu Maßnahmen zum Schutz der öffentlichen Sicherheit,15147,poi,18
480,690829,https://www.abgeordnetenwatch.de/profile/hans-christian-strobele,480,211,Hans-Christian Ströbele (BÜNDNIS 90/DIE GRÜNEN),Hans-Christian Ströbele,hans-christian-strobele,1578.0,gruene,"Entschuldigung, letzter Satz. - Auch dies zu verfolgen, haben Sie versäumt. Ich sage: Herr Maaßen, der Chef des Bundesamtes für Verfassungsschutz, und Herr de Maizière müssen die Verantwortung übernehmen. Ich fordere Sie auf, das zu tun, Herr Minister.",TOP ZP 1 Aktuelle Stunde zu Maßnahmen zum Schutz der öffentlichen Sicherheit,15147,speech,18
481,690830,,481,211,,,,,,Beifall beim BÜNDNIS 90/DIE GRÜNEN sowie bei Abgeordneten der SPD,TOP ZP 1 Aktuelle Stunde zu Maßnahmen zum Schutz der öffentlichen Sicherheit,15147,poi,18
482,690831,https://www.abgeordnetenwatch.de/profile/johannes-singhammer,482,211,Vizepräsident Johannes Singhammer,Johannes Singhammer,johannes-singhammer,1582.0,,Für die CDU/CSU spricht jetzt der Kollege Stephan Mayer.,TOP ZP 1 Aktuelle Stunde zu Maßnahmen zum Schutz der öffentlichen Sicherheit,15147,chair,18
483,690832,,483,211,,,,,,Beifall bei der CDU/CSU sowie bei Abgeordneten der SPD,TOP ZP 1 Aktuelle Stunde zu Maßnahmen zum Schutz der öffentlichen Sicherheit,15147,poi,18
484,690833,https://www.abgeordnetenwatch.de/profile/stephan-mayer,484,211,Stephan Mayer (Altötting) (CDU/CSU),Stephan Mayer,stephan-mayer,1731.0,cducsu,"Sehr geehrter Herr Präsident! Sehr verehrte Kolleginnen! Sehr geehrte Kollegen! Wir sind noch immer schwer ergriffen von dem schrecklichen, ja unfassbaren Anschlag am Breitscheidplatz am 19. Dezember letzten Jahres. Unsere Gedanken sind nach wie vor in erster Linie bei den Opfern, deren Angehörigen und vor allem bei den Verletzten. Trotzdem geht es sehr schnell auch darum, diesen Anschlag rückhaltlos und schonungslos zu analysieren. Es geht darum, Fehler bei allen Behörden sowie Vollzugsdefizite und gesetzgeberische Defizite rückhaltlos und nachdrücklich aufzudecken.

Ich bin schon etwas erstaunt, Herr Kollege von Notz, dass Sie in Ihrer Rede den Eindruck vermittelt haben, dass die Grünen die neue Law-and-order-Partei sind.",TOP ZP 1 Aktuelle Stunde zu Maßnahmen zum Schutz der öffentlichen Sicherheit,15147,speech,18
485,690834,https://www.abgeordnetenwatch.de/profile/renate-kunast/archive/215098,485,211,Renate Künast [BÜNDNIS 90/DIE GRÜNEN],Renate Künast,renate-kunast,1759.0,gruene,Wieso „neu“?,TOP ZP 1 Aktuelle Stunde zu Maßnahmen zum Schutz der öffentlichen Sicherheit,15147,poi,18
486,690835,https://www.abgeordnetenwatch.de/profile/stephan-mayer,486,211,Stephan Mayer (Altötting) (CDU/CSU),Stephan Mayer,stephan-mayer,1731.0,cducsu,"Mir ist in den letzten Jahren offenkundig entgangen, dass Sie auf Sicherheitsdefizite hingewiesen haben.",TOP ZP 1 Aktuelle Stunde zu Maßnahmen zum Schutz der öffentlichen Sicherheit,15147,speech,18
487,690836,,487,211,"Renate Künast [BÜNDNIS 90/DIE GRÜNEN], auf den Redner zeigend","Renate Künast , auf den Redner zeigend",renate-kunast-auf-den-redner-zeigend,,gruene,"Der ist doch gar nicht Law and Order, der tut nur so!",TOP ZP 1 Aktuelle Stunde zu Maßnahmen zum Schutz der öffentlichen Sicherheit,15147,poi,18
488,690837,https://www.abgeordnetenwatch.de/profile/stephan-mayer,488,211,Stephan Mayer (Altötting) (CDU/CSU),Stephan Mayer,stephan-mayer,1731.0,cducsu,"Wie war denn die Realität? Sie haben in dieser Legislaturperiode gegen alle Sicherheitsgesetze gestimmt, die wir vorgelegt haben, vom Entwurf eines Gesetzes zur Vorratsdatenspeicherung bis hin zum Antiterrorpaket kurz vor der Sommerpause.",TOP ZP 1 Aktuelle Stunde zu Maßnahmen zum Schutz der öffentlichen Sicherheit,15147,speech,18
489,690838,,489,211,,,,,,Beifall bei der CDU/CSU,TOP ZP 1 Aktuelle Stunde zu Maßnahmen zum Schutz der öffentlichen Sicherheit,15147,poi,18
490,690839,https://www.abgeordnetenwatch.de/profile/dr-konstantin-von-notz-0,490,211,Dr. Konstantin von Notz [BÜNDNIS 90/DIE GRÜNEN],Dr. Konstantin von Notz,konstantin-notz,1576.0,gruene,Das alles war verfassungswidrig! Schlagen Sie etwas Vernünftiges vor!,TOP ZP 1 Aktuelle Stunde zu Maßnahmen zum Schutz der öffentlichen Sicherheit,15147,poi,18
491,690840,https://www.abgeordnetenwatch.de/profile/stephan-mayer,491,211,Stephan Mayer (Altötting) (CDU/CSU),Stephan Mayer,stephan-mayer,1731.0,cducsu,"Es geht tatsächlich nicht um Schuldzuweisungen, sondern darum, die richtigen Lehren zu ziehen. Die Opposition hat immer wieder insinuiert, wir würden verschleiern, wir würden vertuschen, wir würden verzögern. Der Vorwurf des Ausbremsens wurde erhoben. Zur Erinnerung: Es war die CDU/CSU, die sehr schnell eine Sondersitzung des Innenausschusses - am 21. Dezember, nur zwei Tage nach dem Anschlag - beantragt hat.",TOP ZP 1 Aktuelle Stunde zu Maßnahmen zum Schutz der öffentlichen Sicherheit,15147,speech,18
492,690841,https://www.abgeordnetenwatch.de/profile/burkhard-lischka-0,492,211,Burkhard Lischka [SPD],Burkhard Lischka,burkhard-lischka,1438.0,spd,"Zusammen mit uns, Stephan!",TOP ZP 1 Aktuelle Stunde zu Maßnahmen zum Schutz der öffentlichen Sicherheit,15147,poi,18
493,690842,https://www.abgeordnetenwatch.de/profile/dr-konstantin-von-notz-0,493,211,Dr. Konstantin von Notz [BÜNDNIS 90/DIE GRÜNEN],Dr. Konstantin von Notz,konstantin-notz,1576.0,gruene,Das haben wir unterstützt!,TOP ZP 1 Aktuelle Stunde zu Maßnahmen zum Schutz der öffentlichen Sicherheit,15147,poi,18
494,690843,https://www.abgeordnetenwatch.de/profile/stephan-mayer,494,211,Stephan Mayer (Altötting) (CDU/CSU),Stephan Mayer,stephan-mayer,1731.0,cducsu,"Es war die CDU/CSU, die gemeinsam mit der SPD eine Sondersitzung des Parlamentarischen Kontrollgremiums Anfang dieser Woche beantragt hat. Wir haben uns heute im Innenausschuss intensiv mit dem Fall auseinandergesetzt. Am vergangenen Montag wurde eine Taskforce eingerichtet, die, wenn alle guten Willens sind, schon in der kommenden Woche ihre Arbeit aufnehmen kann.",TOP ZP 1 Aktuelle Stunde zu Maßnahmen zum Schutz der öffentlichen Sicherheit,15147,speech,18
495,690844,https://www.abgeordnetenwatch.de/profile/irene-mihalic/archive/215148,495,211,Irene Mihalic [BÜNDNIS 90/DIE GRÜNEN],Irene Mihalic,irene-mihalic,1430.0,gruene,"Alles geheim, Herr Mayer, alles geheim!",TOP ZP 1 Aktuelle Stunde zu Maßnahmen zum Schutz der öffentlichen Sicherheit,15147,poi,18
496,690845,https://www.abgeordnetenwatch.de/profile/stephan-mayer,496,211,Stephan Mayer (Altötting) (CDU/CSU),Stephan Mayer,stephan-mayer,1731.0,cducsu,"Die Taskforce wird - das wissen Sie, weil es bereits Präjudizien im Hinblick auf frühere Fälle gibt - einen Bericht als Bundestagsdrucksache veröffentlichen.",TOP ZP 1 Aktuelle Stunde zu Maßnahmen zum Schutz der öffentlichen Sicherheit,15147,speech,18
497,690846,https://www.abgeordnetenwatch.de/profile/dr-konstantin-von-notz-0,497,211,Dr. Konstantin von Notz [BÜNDNIS 90/DIE GRÜNEN],Dr. Konstantin von Notz,konstantin-notz,1576.0,gruene,Es wird aber nur die Hälfte veröffentlicht werden!,TOP ZP 1 Aktuelle Stunde zu Maßnahmen zum Schutz der öffentlichen Sicherheit,15147,poi,18
498,690847,https://www.abgeordnetenwatch.de/profile/stephan-mayer,498,211,Stephan Mayer (Altötting) (CDU/CSU),Stephan Mayer,stephan-mayer,1731.0,cducsu,Der Vorwurf des Verschleierns und des Vertuschens ist daher vollkommen unzutreffend.,TOP ZP 1 Aktuelle Stunde zu Maßnahmen zum Schutz der öffentlichen Sicherheit,15147,speech,18
499,690848,,499,211,,,,,,Beifall bei der CDU/CSU sowie bei Abgeordneten der SPD,TOP ZP 1 Aktuelle Stunde zu Maßnahmen zum Schutz der öffentlichen Sicherheit,15147,poi,18
500,690849,https://www.abgeordnetenwatch.de/profile/stephan-mayer,500,211,Stephan Mayer (Altötting) (CDU/CSU),Stephan Mayer,stephan-mayer,1731.0,cducsu,Ich möchte noch einmal deutlich sagen: Wir sind auch offen für einen Untersuchungsausschuss.,TOP ZP 1 Aktuelle Stunde zu Maßnahmen zum Schutz der öffentlichen Sicherheit,15147,speech,18
