,id,profile_url,sequence,sitzung,speaker,speaker_cleaned,speaker_fp,speaker_key,speaker_party,text,top,top_id,type,wahlperiode
224,690573,https://www.abgeordnetenwatch.de/profile/dr-ralf-brauksiepe-0,224,211,"Dr. Ralf Brauksiepe, Parl. Staatssekretär bei der Bundesministerin der Verteidigung",Dr. Ralf Brauksiepe,ralf-brauksiepe,1859.0,,"Herr Kollege Ströbele, ich will nur sehr deutlich sagen, was Sinn und Zweck der Aufklärung ist, die wir betreiben. Unabhängig davon, was Sie insinuieren mögen, geht es genau darum, zivile von militärischen Zielen zu unterscheiden. Das heißt, wir leisten Aufklärungsarbeit durch die Aufklärungsprodukte, die wir produzieren, die genau verhindern sollen, dass es zu einer irrtümlichen Bekämpfung ziviler Ziele kommt. Das, was wir tun, dient ausschließlich der Bekämpfung des sogenannten „Islamischen Staats“. Deswegen wird auch jedes Aufklärungsprodukt, das wir liefern, mit einem entsprechenden Vermerk „For Counter-Daesh Operation only“ versehen. Das ist Sinn und Zweck des Einsatzes unserer Soldaten, und dem dient die Aufklärungsarbeit, die unsere Tornados leisten. Das schließt nicht aus, dass es in Einzelfällen auch zur irrtümlichen Bekämpfung ziviler Ziele kommt.

Wo Menschen handeln, egal, in welchem Zusammenhang, machen Menschen auch Fehler. Aber die Arbeit, die wir leisten, dient genau dem Zweck, diese zu verhindern. Ich verwahre mich auch gegen jede indirekte oder direkte anderweitige Unterstellung. Wir machen keine Bilder, um die Bekämpfung von Zivilisten zu erleichtern, sondern ganz im Gegenteil, um die irrtümliche Bekämpfung ziviler Ziele zu verhindern.",TOP 2 Fragestunde,15146,speech,18
225,690574,https://www.abgeordnetenwatch.de/profile/edelgard-bulmahn,225,211,Vizepräsidentin Dr. h. c. Edelgard Bulmahn,Dr. h. c. Edelgard Bulmahn,edelgard-bulmahn,1856.0,,"Vielen Dank. - Die Fragen 35 und 36 des Kollegen Omid Nouripour zum Geschäftsbereich des Bundesministeriums der Verteidigung sollen schriftlich beantwortet werden.

Damit leite ich zum Geschäftsbereich des Bundesministeriums für Gesundheit über. Die Frage 37 der Kollegin Sabine Zimmermann wird schriftlich beantwortet.

Damit leite ich zum Geschäftsbereich des Bundesministeriums für Verkehr und digitale Infrastruktur über. Die Fragen 38 und 39 der Kollegin Tabea Rößner und die Frage 40 des Kollegen Stephan Kühn werden schriftlich beantwortet.

Damit rufe ich jetzt die Frage 41 des Kollegen Gastel auf:

Welche rechtlichen Grundlagen müssen nach Kenntnis der Bundesregierung geändert werden, damit der öffentliche Personennahverkehr gemäß dem Aktionsplan des Bundesministers für Verkehr und digitale Infrastruktur, Alexander Dobrindt, in allen deutschen Städten ab 2019 mit einer einzigen elektronischen Chipkarte bzw. einem Handyticket genutzt werden kann (vergleiche Berliner Zeitung vom 7. Januar 2017), und welche Gesetzesänderungen bereitet die Bundesregierung hierzu bereits vor?

Die Antworten auf die Fragen zu diesem Geschäftsbereich wird der Parlamentarische Staatssekretär Norbert Barthle geben. Deshalb, Herr Staatssekretär, haben Sie jetzt das Wort.",TOP 2 Fragestunde,15146,chair,18
226,690575,https://www.abgeordnetenwatch.de/profile/norbert-barthle/archive/214859,226,211,"Norbert Barthle, Parl. Staatssekretär beim Bundesminister für Verkehr und digitale Infrastruktur",Norbert Barthle,norbert-barthle,1877.0,,"Vielen Dank, Frau Präsidentin. - Sehr geehrter Herr Kollege Gastel, nach Auffassung der Bundesregierung sind zur Herstellung eines digital vernetzten öffentlichen Personennahverkehrs zunächst keine Änderungen von Bundesgesetzen notwendig. Gleichwohl bedarf es unter Umständen der Anpassung des rechtlichen Rahmens auf der Ebene der für den öffentlichen Personennahverkehr zuständigen Länder und Kommunen, um die Einführung einer interoperablen Lösung für ganz Deutschland zu beschleunigen.",TOP 2 Fragestunde,15146,speech,18
227,690576,https://www.abgeordnetenwatch.de/profile/edelgard-bulmahn,227,211,Vizepräsidentin Dr. h. c. Edelgard Bulmahn,Dr. h. c. Edelgard Bulmahn,edelgard-bulmahn,1856.0,,Herr Gastel.,TOP 2 Fragestunde,15146,chair,18
228,690577,https://www.abgeordnetenwatch.de/profile/matthias-gastel/archive/215312,228,211,Matthias Gastel (BÜNDNIS 90/DIE GRÜNEN),Matthias Gastel,matthias-gastel,1552.0,gruene,"Herr Staatssekretär, ich habe direkt zu Ihrer Antwort eine Nachfrage und dann sicherlich auch noch eine zweite Nachfrage. Wir haben im Moment im Bereich öffentlicher Nahverkehr, bei Bussen und Bahnen, das Problem, dass da viel Kleinstaaterei betrieben wird, das heißt, Verbundsysteme eigene Apps entwickeln usw., was dann die Mobilität über Verbundgrenzen hinweg extrem kompliziert macht. Deswegen halten wir den Vorstoß des Ministers im Grundsatz für einen guten Vorstoß. Wir als Grüne arbeiten schon länger daran, eine Lösung zu finden, die Mobilität über die Verbundgrenzen hinweg zu vereinfachen.

Die Frage, die ich jetzt an Sie habe, ist: Damit ein solches System funktionieren kann, müssen oder sollen ja alle Verbundsysteme, alle Verkehrsverbünde mitmachen, ihre Daten einspeisen, aber sich auch darauf einlassen, dass es eine Verrechnungsstelle gibt, die dann die entsprechende Abrechnung von Fahrkarten ermöglicht. Ist es auf der derzeitigen Rechtsgrundlage möglich, diese Verkehrsverbünde sozusagen zu verpflichten, da mitzumachen, damit es dann wirklich eine reibungslose Mobilitätskette geben kann?",TOP 2 Fragestunde,15146,speech,18
229,690578,https://www.abgeordnetenwatch.de/profile/edelgard-bulmahn,229,211,Vizepräsidentin Dr. h. c. Edelgard Bulmahn,Dr. h. c. Edelgard Bulmahn,edelgard-bulmahn,1856.0,,Herr Staatssekretär.,TOP 2 Fragestunde,15146,chair,18
230,690579,https://www.abgeordnetenwatch.de/profile/norbert-barthle/archive/214859,230,211,"Norbert Barthle, Parl. Staatssekretär für Verkehr und digitale Infrastruktur",Norbert Barthle,norbert-barthle,1877.0,,"Vielen Dank. - Herr Gastel, Sie haben vollkommen recht: Der Nutzer des öffentlichen Personennahverkehrs, der Kunde sozusagen, interessiert sich nicht dafür, wo Verbundgrenzen bestehen, wo Grenzen der Zuständigkeiten bestehen, ob nun Kommunen, Kreise oder der Bund zuständig sind, vielmehr ist der Nutzer an einem einheitlichen Vorgehen interessiert.

Damit Hemmnisse - das ist auch unser Interesse - abgebaut werden, was die Nutzung des öffentlichen Personenverkehrs anbelangt, entwickeln wir jetzt einheitliche Standards. Es gibt auch schon gute Anfänge. Der Verband Deutscher Verkehrsunternehmen hat uns mitgeteilt, dass es in 239 der insgesamt 402 Kreise und kreisfreien Städte in Deutschland bereits möglich ist, eTicketing mit Chipkarte oder Mobiltelefon zu nutzen. Das sind immerhin 60 Prozent oder, sofern man die Bevölkerungszahl zugrunde legt, sogar 72 Prozent. Damit ist sozusagen der Grundstein gelegt, und jetzt kommt es darauf an - das ist das, was Sie richtigerweise beschrieben haben -, dass die Systeme miteinander vernetzt werden können. Dazu bedarf es eines koordinierten Vorgehens; auch das ist richtig.

Aus diesem Grund hat die Bundesregierung im vergangenen Jahr eine sogenannte Roadmap entwickelt, die nicht nur Visionen und Ziele beschreibt, sondern auch die Maßnahmen benennt, die es nun umzusetzen gilt. Da wir keine Möglichkeit haben, die Umsetzung der entsprechenden Maßnahmen verpflichtend vorzuschreiben, schaffen wir Anreize. Die Bundesregierung hat für die kommenden zwei Jahre 16 Millionen Euro zur Förderung von Projekten zur Verfügung gestellt, die der Vernetzung bereits bestehender Möglichkeiten dienen, und die Verkehrsunternehmen und Verkehrsverbünde aufgefordert, sich als Leistungserbringer daran zu beteiligen. Die Betreffenden müssen sich aber auch daran beteiligen wollen.",TOP 2 Fragestunde,15146,speech,18
231,690580,https://www.abgeordnetenwatch.de/profile/edelgard-bulmahn,231,211,Vizepräsidentin Dr. h. c. Edelgard Bulmahn,Dr. h. c. Edelgard Bulmahn,edelgard-bulmahn,1856.0,,"Herr Kollege Gastel, Ihre zweite Zusatzfrage.",TOP 2 Fragestunde,15146,chair,18
232,690581,https://www.abgeordnetenwatch.de/profile/matthias-gastel/archive/215312,232,211,Matthias Gastel (BÜNDNIS 90/DIE GRÜNEN),Matthias Gastel,matthias-gastel,1552.0,gruene,"Die Deutsche Bahn ist Deutschlands größter Mobilitätsdienstleister und zugleich ein Unternehmen des Bundes. Herr Staatssekretär, meine zweite Zusatzfrage lautet deswegen: Mit welchen konkreten Erwartungen ist die Bundesregierung an den bundeseigenen Konzern Deutsche Bahn herangetreten, um das Projekt bundeseinheitliches eTicketing voranzubringen?",TOP 2 Fragestunde,15146,speech,18
233,690582,https://www.abgeordnetenwatch.de/profile/edelgard-bulmahn,233,211,Vizepräsidentin Dr. h. c. Edelgard Bulmahn,Dr. h. c. Edelgard Bulmahn,edelgard-bulmahn,1856.0,,Herr Staatssekretär.,TOP 2 Fragestunde,15146,chair,18
234,690583,https://www.abgeordnetenwatch.de/profile/norbert-barthle/archive/214859,234,211,"Norbert Barthle, Parl. Staatssekretär beim Bundesminister für Verkehr und digitale Infrastruktur",Norbert Barthle,norbert-barthle,1877.0,,"Herr Kollege Gastel, wir haben selbstverständlich auch in den jüngsten Gesprächen mit der Bahn, in denen es insbesondere darum ging, die Mobilfunkqualität zu erhöhen - WLAN für alle -, dieses Thema angesprochen. DB Regio gehört zu den Institutionen, die ganz konkrete Förderungen erhalten. Es gibt seit dem 1. Januar 2017 unser Förderprogramm „eTicketing und digitale Vernetzung im Öffentlichen Personenverkehr“. Im Rahmen dieses Programms fördern wir, wie gesagt, in den kommenden zwei Jahren mit insgesamt 45 Förderbescheiden die verschiedensten Verkehrsverbünde, unter anderem die DB Regio AG.",TOP 2 Fragestunde,15146,speech,18
235,690584,https://www.abgeordnetenwatch.de/profile/edelgard-bulmahn,235,211,Vizepräsidentin Dr. h. c. Edelgard Bulmahn,Dr. h. c. Edelgard Bulmahn,edelgard-bulmahn,1856.0,,"Vielen Dank. - Damit rufe ich Frage 42 des Kollegen Gastel auf:

Welchen Zeitplan verfolgt die Bundesregierung bezüglich des Verordnungsentwurfs zum Thema Schienenlärm, den der Parlamentarische Staatssekretär Norbert Barthle in der Antwort auf meine mündliche Frage 40, Plenarprotokoll 18/208, erwähnte (bitte angeben, in welchem Monat der Verordnungsentwurf vorgelegt werden soll), und enthält der Verordnungsentwurf die im Koalitionsvertrag zwischen CDU, CSU und SPD angekündigten ordnungsrechtlichen Eingriffe (Nachtfahrverbote für nicht umgerüstete Güterwagen), falls im Jahr 2016 nicht mindestens die Hälfte aller in Deutschland verkehrenden Güterwagen „leise“ Bremsen hatte?

Herr Staatssekretär, Sie haben wieder das Wort.",TOP 2 Fragestunde,15146,chair,18
236,690585,https://www.abgeordnetenwatch.de/profile/norbert-barthle/archive/214859,236,211,"Norbert Barthle, Parl. Staatssekretär beim Bundesminister für Verkehr und digitale Infrastruktur",Norbert Barthle,norbert-barthle,1877.0,,"Vielen Dank, Frau Präsidentin. - Auf diese Frage gebe ich folgende Antwort: Derzeit wird ein Regelungsentwurf über ordnungsrechtliche Maßnahmen auf stark befahrenen Güterstrecken für den Fall erarbeitet, dass das angestrebte Ziel verfehlt werden sollte. Der Zeitpunkt der möglichen Veröffentlichung hängt vom Abschluss der Evaluierung ab.",TOP 2 Fragestunde,15146,speech,18
237,690586,https://www.abgeordnetenwatch.de/profile/edelgard-bulmahn,237,211,Vizepräsidentin Dr. h. c. Edelgard Bulmahn,Dr. h. c. Edelgard Bulmahn,edelgard-bulmahn,1856.0,,Herr Gastel.,TOP 2 Fragestunde,15146,chair,18
238,690587,https://www.abgeordnetenwatch.de/profile/matthias-gastel/archive/215312,238,211,Matthias Gastel (BÜNDNIS 90/DIE GRÜNEN),Matthias Gastel,matthias-gastel,1552.0,gruene,"Das ist eine überraschend kurze und zu meinem Erschrecken unkonkrete Antwort. Angesichts der Tatsache, dass das Jahr 2016 beendet ist, ist es seltsam, abzuwarten, ob das Ziel im Jahr 2016 verfehlt wurde, um erst später mögliche Maßnahmen zu ergreifen, ohne zu wissen, was man tun wird, wenn das, was man sich vorgenommen hat, nicht klappt. Aber okay!

Ich habe eine Frage bezüglich des Schienenlärms an Sie. Nach dem, was wir wissen, wollen Sie nicht das im Koalitionsvertrag vorgesehene Verbot durchsetzen, sondern erwägen Maßnahmen, mit denen sich dieselbe Lärmreduzierung erreichen lässt. Güterzügen, die zu laut sind, wird nicht die Durchfahrt durch Deutschland verboten, sondern sie müssen ihre Geschwindigkeit drosseln. Um 10 dB(A) Lärmreduzierung zu erreichen, muss ein Güterzug seine Geschwindigkeit auf etwa 20 bis 30 Kilometer pro Stunde reduzieren. Das bedeutet eine massive Beschränkung der Kapazität des deutschen Schienennetzes, das ohnehin an seine Grenzen stößt. Ich möchte gerne von Ihnen wissen, ob Sie diese Maßnahme für geeignet halten, um einerseits die Lärmschutzanforderungen zu erfüllen und andererseits mehr Güter auf die Schiene zu bringen.",TOP 2 Fragestunde,15146,speech,18
239,690588,https://www.abgeordnetenwatch.de/profile/edelgard-bulmahn,239,211,Vizepräsidentin Dr. h. c. Edelgard Bulmahn,Dr. h. c. Edelgard Bulmahn,edelgard-bulmahn,1856.0,,Herr Staatssekretär.,TOP 2 Fragestunde,15146,chair,18
240,690589,https://www.abgeordnetenwatch.de/profile/norbert-barthle/archive/214859,240,211,"Norbert Barthle, Parl. Staatssekretär beim Bundesminister für Verkehr und digitale Infrastruktur",Norbert Barthle,norbert-barthle,1877.0,,"Herr Kollege Gastel, wie Sie wissen, hat die DB AG zugesagt, dass die Hälfte der im Netz verkehrenden Güterwagen bis Ende 2016 leise unterwegs sein wird. Wir erarbeiten derzeit einen Regelungsentwurf, um festzulegen, welche Maßnahmen wir ergreifen werden, wenn dieses Ziel bis Ende 2016 nicht erreicht worden ist; das wird derzeit evaluiert. Minister Alexander Dobrindt hat bereits im vergangenen Jahr sämtliche EU-Mitgliedstaaten angeschrieben und darum gebeten, die Wagenhalter über die entsprechenden Möglichkeiten zu informieren und zur Teilnahme aufzurufen. Wir werden schon in wenigen Tagen die Wagenhalter nochmals über den Stand der Evaluierung der Umrüstung informieren. Aber wie gesagt, der Regelungskatalog wird derzeit noch erarbeitet. Deshalb kann ich Ihre Frage noch nicht präzise beantworten.",TOP 2 Fragestunde,15146,speech,18
241,690590,https://www.abgeordnetenwatch.de/profile/edelgard-bulmahn,241,211,Vizepräsidentin Dr. h. c. Edelgard Bulmahn,Dr. h. c. Edelgard Bulmahn,edelgard-bulmahn,1856.0,,"Vielen Dank. - Herr Gastel, Sie haben das Wort zu einer zweiten Nachfrage.",TOP 2 Fragestunde,15146,chair,18
242,690591,https://www.abgeordnetenwatch.de/profile/matthias-gastel/archive/215312,242,211,Matthias Gastel (BÜNDNIS 90/DIE GRÜNEN),Matthias Gastel,matthias-gastel,1552.0,gruene,"Wir reden ja jetzt über das Jahr 2020 und die Zielsetzung für dieses Jahr, die da, was den Schienenlärm angeht, lautet: Halbierung bis zu diesem Zeitpunkt. Das alles ist auch gut und richtig - abgesehen davon, dass Sie bei den Maßnahmen nicht konsequent genug sind. Die Ziele aber sind in Ordnung.

Meine Frage lautet jetzt: In welchem Zusammenhang beschäftigen Sie sich im Bundesverkehrsministerium mit der Zeit nach 2020? Denn es ist ja nicht so, dass, wenn das Ziel der Halbierung der Lärmbelastung erreicht ist, alles gut ist, sondern wir müssen dann - aus Gesundheitsgründen, aber auch, um für den Schienengüterverkehr, von dem wir ja alle mehr haben wollen, in der Gesellschaft eine Akzeptanz zu schaffen - weiter an der Reduzierung der Lärmbelastung arbeiten. Was tun Sie für die Zeit nach 2020?",TOP 2 Fragestunde,15146,speech,18
243,690592,https://www.abgeordnetenwatch.de/profile/edelgard-bulmahn,243,211,Vizepräsidentin Dr. h. c. Edelgard Bulmahn,Dr. h. c. Edelgard Bulmahn,edelgard-bulmahn,1856.0,,Herr Staatssekretär.,TOP 2 Fragestunde,15146,chair,18
244,690593,https://www.abgeordnetenwatch.de/profile/norbert-barthle/archive/214859,244,211,"Norbert Barthle, Parl. Staatssekretär beim Bundesminister für Verkehr und digitale Infrastruktur",Norbert Barthle,norbert-barthle,1877.0,,"Vielen Dank, Herr Kollege Gastel. - Sie haben richtigerweise das Ziel, die aus dem Schienenverkehr resultierende Lärmbelastung im Vergleich zum Jahr 2008 bis zum Jahr 2020 halbieren zu wollen, beschrieben. Die Bevölkerung nimmt eine Reduzierung von 10 db(A) als Halbierung der Lärmbelastung wahr. An diesem Ziel halten wir nach wie vor fest.

Was die langfristige Überlegung in Bezug auf den Lärmschutz anbelangt, gehen wir nach einer Drei-Punkte-Strategie vor: einerseits fördern, andererseits ertüchtigen und zum Dritten regulieren. An Letzterem arbeiten wir gerade noch. Förderung betreiben wir bereits. Was Ertüchtigung anbelangt, unterstützen wir derzeit Forschungsvorhaben, um den Lärm dort zu reduzieren, wo er entsteht, also direkt am Material. Dabei geht es aber auch um andere sekundäre Lärmschutzmöglichkeiten. Auch da gibt es noch weitere Dinge, die wir derzeit erproben. Wir denken also schon über das Jahr 2020 hinaus, weil die Reduzierung der Lärmbelastung, insbesondere durch Güterzüge, ein ganz zentrales Anliegen der Bundesregierung ist.",TOP 2 Fragestunde,15146,speech,18
245,690594,https://www.abgeordnetenwatch.de/profile/edelgard-bulmahn,245,211,Vizepräsidentin Dr. h. c. Edelgard Bulmahn,Dr. h. c. Edelgard Bulmahn,edelgard-bulmahn,1856.0,,"Vielen Dank, liebe Kolleginnen und Kollegen.

Damit ist die Fragestunde beendet. Ich unterbreche die Sitzung kurz. Die Aktuelle Stunde beginnt um 15.35 Uhr. Dann werden wir unsere Sitzung fortsetzen. Also seien Sie bitte pünktlich um 15.35 Uhr wieder hier im Plenum.",TOP 2 Fragestunde,15146,chair,18
246,690595,,246,211,,,,,,Unterbrechung von 15.22 bis 15.35 Uhr,TOP 2 Fragestunde,15146,poi,18
247,690596,https://www.abgeordnetenwatch.de/profile/edelgard-bulmahn,247,211,Vizepräsidentin Dr. h. c. Edelgard Bulmahn,Dr. h. c. Edelgard Bulmahn,edelgard-bulmahn,1856.0,,"Liebe Kolleginnen und Kollegen, ich bitte Sie, Ihre Plätze einzunehmen. Die 211. Sitzung der 18. Legislaturperiode des Deutschen Bundestages wird fortgesetzt.

Ich rufe den Zusatzpunkt 1 auf:

Aktuelle Stunde

auf Verlangen der Fraktionen der CDU/CSU und SPD

Entschieden gegen Gefährder vorgehen - Maßnahmen zum Schutz der öffentlichen Sicherheit

Die Debatte eröffnen wird der Bundesminister des Innern, Dr. Thomas de Maizière. - Herr Minister, Sie haben das Wort.",TOP 2 Fragestunde,15146,chair,18
248,690597,,248,211,,,,,,Beifall bei der CDU/CSU sowie bei Abgeordneten der SPD,TOP 2 Fragestunde,15146,poi,18
249,690598,https://www.abgeordnetenwatch.de/profile/dr-thomas-de-maiziere-0,249,211,"Dr. Thomas de Maizière, Bundesminister des Innern",Dr. Thomas de Maizière,thomas-de-maiziere,1519.0,,"Frau Präsidentin! Meine lieben Kolleginnen und Kollegen! Einen Tag nach dem Anschlag habe ich mit anderen den Berliner Breitscheidplatz besucht. Es war nicht der erste Ort dieser Art, den ich gesehen und besucht habe. Wir haben dort Blumen niedergelegt. Ich habe den Schock und die Trauer in den Gesichtern der Menschen gesehen. Die Kirchen haben am Abend nach dem Tag des Anschlags einen wunderbaren Gottesdienst abgehalten. Alle diese Eindrücke bleiben bei mir und auch bei vielen von Ihnen noch Wochen im Kopf und im Herzen.

Jeder, den ich dort gesehen habe, hat seine eigene Weise, Anteil an den schrecklichen Ereignissen zu nehmen. Jeder und jede in unserem Land darf und muss für sich entscheiden, wie er oder sie mit dem Anschlag umgehen möchte. Ein Staat wird die Art des Trauerns nicht vorschreiben. Ein Staat hat andere Wege der Anteilnahme. Er leistet Unterstützung für die Hinterbliebenen, und wenn dort mehr zu tun ist, dann müssen wir mehr tun. Er setzt Flaggen auf Halbmast. Er vereinbart einen Moment des Schweigens. Er gedenkt morgen im Bundestag.

All das ist wichtig, nicht nur für die Hinterbliebenen, auch für uns, die wir niemanden verloren haben, und auch für eine wehrhafte Demokratie. All das lässt uns gemeinsam innehalten und zeigt, dass wir in diesen Tagen und Stunden und angesichts dieser Lage einander zugehörig sind - als Demokraten, oft im Streit, aber trotzdem in Freiheit miteinander verbunden.",TOP ZP 1 Aktuelle Stunde zu Maßnahmen zum Schutz der öffentlichen Sicherheit,15147,speech,18
250,690599,,250,211,,,,,,Beifall bei der CDU/CSU und der SPD sowie bei Abgeordneten des BÜNDNISSES 90/DIE GRÜNEN und des Abg. Dr. Dietmar Bartsch [DIE LINKE],TOP ZP 1 Aktuelle Stunde zu Maßnahmen zum Schutz der öffentlichen Sicherheit,15147,poi,18
251,690600,https://www.abgeordnetenwatch.de/profile/dr-thomas-de-maiziere-0,251,211,"Dr. Thomas de Maizière, Bundesminister des Innern",Dr. Thomas de Maizière,thomas-de-maiziere,1519.0,,"Meine Damen und Herren, all das verlangt - nach einer Phase des Innehaltens - aber auch nach Aufklärung und Konsequenzen. In den letzten Wochen ist viel über den Begriff des Gefährders gesprochen worden. Ein Gefährder ist jemand, von dem die Sicherheitsbehörden die Befürchtung haben, dass er etwas unternehmen wird, das unser Land bedrohen könnte. Deswegen beobachten sie ihn.

Auch Anis Amri, der Attentäter vom Breitscheidplatz, gehörte zu dieser Personengruppe. Die Sicherheitsbehörden hatten ihn im Visier. Sie haben ihn beobachtet. Sie haben Ermittlungsverfahren geführt. Auch die Ausländerbehörden der Länder haben sich mit ihm beschäftigt. Wir mussten aber feststellen - das ist meine vorläufige Bewertung angesichts des bisherigen Kenntnisstandes -: Alle Maßnahmen der Sicherheitsbehörden und der Ausländerbehörden haben nicht vermocht und nicht ausgereicht, ihn aufzuhalten und den Anschlag zu verhindern.

Die Gefährlichkeit von Menschen einzuschätzen, gehört zu den schwierigsten Aufgaben der Sicherheitsbehörden und der Justiz. Das kennen wir auch aus anderen Fällen, etwa der Sicherheitsverwahrung entlassener Sexualstraftäter. In anderen ähnlichen Terrorgefährdungsfällen haben die Sicherheitsbehörden auch in jüngster Zeit Anschläge verhindern können. Hier nicht; das ist bitter.

Ich habe gemeinsam mit meinem Kollegen Maas unter Beteiligung der betroffenen Bundesländer, allen voran Berlin und Nordrhein-Westfalen, eine Chronologie des Behördenhandelns vorgelegt. Das bietet jetzt die Grundlage für weitere Aufklärung - die wir in jeder Weise unterstützen -, die dieser Deutsche Bundestag unternimmt. Ich beteilige mich nicht an Schuldzuweisungen. Ich konzentriere mich auf die erforderlichen Konsequenzen.",TOP ZP 1 Aktuelle Stunde zu Maßnahmen zum Schutz der öffentlichen Sicherheit,15147,speech,18
252,690601,,252,211,,,,,,Beifall bei der CDU/CSU und der SPD,TOP ZP 1 Aktuelle Stunde zu Maßnahmen zum Schutz der öffentlichen Sicherheit,15147,poi,18
253,690602,https://www.abgeordnetenwatch.de/profile/dr-thomas-de-maiziere-0,253,211,"Dr. Thomas de Maizière, Bundesminister des Innern",Dr. Thomas de Maizière,thomas-de-maiziere,1519.0,,"Angesichts der Gefährdungslage haben wir keine Zeit zu verlieren; wir haben es heute im Ausschuss diskutiert. Erst volle Aufklärung zu verlangen und dann Maßnahmen und Konsequenzen zu diskutieren, halte ich jedenfalls dann für falsch, wenn wir von den Maßnahmen, die jetzt erforderlich sind, jetzt überzeugt sind. Dann sollten wir sie jetzt ergreifen, gegebenenfalls später andere. Aber was wir jetzt für richtig halten, sollten wir jetzt umsetzen und nicht abwarten.",TOP ZP 1 Aktuelle Stunde zu Maßnahmen zum Schutz der öffentlichen Sicherheit,15147,speech,18
254,690603,,254,211,,,,,,Beifall bei der CDU/CSU und der SPD,TOP ZP 1 Aktuelle Stunde zu Maßnahmen zum Schutz der öffentlichen Sicherheit,15147,poi,18
255,690604,https://www.abgeordnetenwatch.de/profile/dr-thomas-de-maiziere-0,255,211,"Dr. Thomas de Maizière, Bundesminister des Innern",Dr. Thomas de Maizière,thomas-de-maiziere,1519.0,,"Ich habe folgende operative Maßnahmen veranlasst: Die Arbeitsgemeinschaft Statusrechtliche Begleitmaßnahmen, die sogenannte AG Status, im Gemeinsamen Terrorismusabwehrzentrum nimmt in mehreren Sondersitzungen - auch heute, während wir hier diskutieren - jeden ihr bekannten Gefährder noch mal unter die Lupe und prüft nochmals, ob Abschiebungen oder ähnliche Maßnahmen erforderlich sind. Ich habe außerdem das Bundeskriminalamt beauftragt, die Risikobewertung von Gewaltstraftätern zu verbessern und Pläne zur Vereinheitlichung von Gefährderbewertungen voranzutreiben. Wir haben zwar eine - wenn Sie so wollen - sicherheitsfachliche Definition von Gefährdern und relevanten Personen in ihrem Umfeld, wir haben auch bundesweite Leitlinien zum Umgang mit ihnen, aber die Bewertung von Gefährdern und die taktischen Maßnahmen nimmt immer noch jedes Bundesland zu sehr für sich alleine vor. Wir brauchen eine bundesweit standardisierte Gefährderbewertung. Ich will auch den Erkenntnisaustausch in Europa weiter beschleunigen. Wir haben dort schon viel beschlossen. Das muss jetzt beschleunigt werden.

Neben diesen operativen Maßnahmen sind aber auch gesetzliche Maßnahmen erforderlich. Ich habe mich mit meinem Kollegen Maas auf eine Reihe von gesetzgeberischen Maßnahmen verständigt. Das ist gut. Wir sind uns jetzt darüber einig, dass es dabei zentral um aufenthaltsrechtliche Maßnahmen gehen muss, darunter einige Maßnahmen, die ich bereits im August vergangenen Jahres vorgeschlagen habe und zu denen ich bereits im Oktober entsprechende Gesetzentwürfe vorgeschlagen habe. Ich muss das einmal leider so sagen.

Was tun wir jetzt? Wir verschärfen die Möglichkeiten der Abschiebehaft für Gefährder. Eine erhebliche Gefahr für die Sicherheit muss ausreichen für eine Abschiebehaft. Das gilt nicht nur für Terror, sondern auch für sonstige schwere Kriminalität.",TOP ZP 1 Aktuelle Stunde zu Maßnahmen zum Schutz der öffentlichen Sicherheit,15147,speech,18
256,690605,,256,211,,,,,,Beifall bei der CDU/CSU und der SPD,TOP ZP 1 Aktuelle Stunde zu Maßnahmen zum Schutz der öffentlichen Sicherheit,15147,poi,18
