,id,sequence,sitzung,speaker,speaker_cleaned,speaker_fp,speaker_key,speaker_party,text,top,top_id,type,wahlperiode
613,162923,613,213,Dr. Claudia Lücking-Michel (CDU/CSU),Dr. Claudia Lücking-Michel,claudia-lucking-michel,176.0,cducsu,"Zweitens. Friedens- und Konfliktforschung befasst sich mit einem breiten Themenfeld; denn es hat wenig Sinn, zwischen- und innerstaatliche Konflikte als einzelne, isolierte thematische Blöcke zu untersuchen. In den Blick nehmen muss man immer ganze Kontexte. Konflikte sind etwa Ursache für Flucht und Vertreibung, und die Folgen von Flucht und Vertreibung sind oft genug wieder Ursachen für neue Konflikte.

Ein Beispiel will ich aufführen: Aktuell fördert das BMBF ein Verbundprojekt „Flucht: Forschung und Transfer“, das Erkenntnisse über Gewaltmigration und Fluchtursachen bündelt. Diese Fluchtforschung bezieht explizit die Auswirkungen von Gewalterfahrungen mit ein. Wir wissen es: Sie sind für die Radikalisierung von Menschen oft von zentraler Bedeutung. Es geht in dem Projekt aber auch um die spätere Reintegration von Flüchtlingen. So wird analysiert, wie die Rückkehr von Geflüchteten in ihre Herkunftsländer irgendwann einmal gelingen kann, ohne dass vor Ort gleich wieder neue Konflikte geschaffen werden, welche Bedingungen dafür in der Heimat geschaffen werden müssen, aber auch, welche in der Zwischenzeit in den Aufnahmeländern.

Zunehmend - das wird jetzt schon klar - geht es also auch um Themen, die uns hier in Deutschland direkt betreffen. Es geht um innere Sicherheit und die Bedingungen gesellschaftlichen Friedens hier bei uns. Hochaktuell ist das Projekt zur Erforschung des Salafismus in Deutschland, das von der Hessischen Stiftung Friedens- und Konfliktforschung in den letzten zwei Jahren durchgeführt wurde. Es liefert einen Überblick über das Wissen, das wir bei uns über Salafismus schon haben, aber auch darüber, welche Daten und Erkenntnisse uns noch fehlen, zum Beispiel über Anwerbepraktiken, um daraus wirkungsvolle Maßnahmen zur Prävention ableiten zu können.

Noch ein Drittes will ich sagen: Akteure der Friedens- und Konfliktforschung sind ebenso vielfältig wie die Disziplinen und die Themen. Sie arbeiten aus sehr unterschiedlichen Perspektiven. Schauen wir einmal auf die Akteure: Hier gibt es ein Spektrum von der Universität der Bundeswehr über das Institut für Friedensforschung und Sicherheitspolitik an der Uni Hamburg bis hin zum Leibniz-Institut in Form der Hessischen Stiftung. Wir fördern diese Träger in der ganzen Breite und sollten dies bewusst auch in Zukunft tun, sei es über die sogenannten Area Studies, die soziale, kulturelle und politische Gegebenheiten für bestimmte Regionen untersuchen, sei es über die Deutsche Stiftung Friedensforschung, die ihrerseits Förderangebote für Dritte ausschreibt.

In der Debatte über unseren Antrag im Forschungsausschuss wurde schon deutlich, dass die Kollegen von der Linken der deutschen Friedens- und Konfliktforschung gerne pauschal Regierungsnähe unterstellen.",TOP 26 Friedens- und Konfliktforschung,2923,speech,18
614,162924,614,213,,,,,,Heiterkeit der Abg. Dr. Ute Finckh-Krämer [SPD],TOP 26 Friedens- und Konfliktforschung,2923,poi,18
615,162925,615,213,Dr. Claudia Lücking-Michel (CDU/CSU),Dr. Claudia Lücking-Michel,claudia-lucking-michel,176.0,cducsu,"Umgekehrt halten einige CDU/CSU-Kollegen, also Kollegen von mir, die ganze Szene für links unterwandert.",TOP 26 Friedens- und Konfliktforschung,2923,speech,18
616,162926,616,213,,,,,,Heiterkeit bei Abgeordneten der SPD,TOP 26 Friedens- und Konfliktforschung,2923,poi,18
617,162927,617,213,Dr. Claudia Lücking-Michel (CDU/CSU),Dr. Claudia Lücking-Michel,claudia-lucking-michel,176.0,cducsu,"Ich finde, wenn sich beide Seiten aufregen, ist das schon einmal kein schlechtes Zeichen.",TOP 26 Friedens- und Konfliktforschung,2923,speech,18
618,162928,618,213,,,,,,Beifall bei der SPD,TOP 26 Friedens- und Konfliktforschung,2923,poi,18
619,162929,619,213,Dr. Claudia Lücking-Michel (CDU/CSU),Dr. Claudia Lücking-Michel,claudia-lucking-michel,176.0,cducsu,"Denn mir ist eine plurale Trägerstruktur in diesem Forschungsfeld besonders wichtig. Wir sollten als Politiker nicht bestimmte Träger bevorzugen oder gar Ergebnisse in Auftrag geben, sondern unsere Aufgabe sollte es sein, einen Rahmen zu setzen, in dem die verschiedensten Akteure unabhängig forschen können.

Wir haben aber durchaus auch einige sehr konkrete Anliegen. So formuliert unser Antrag, dass wir in Zukunft einen noch deutlich verstärkten Wissenstransfer von der Forschung in Gesellschaft und Politik haben wollen. Im besten Fall liefert die Forschung fundierte Hintergrundinformationen für unsere politisch aktuellen Entscheidungen, liefert unabhängige Bewertungen für die praktische Politik und zeigt neue Handlungsoptionen auf. Jetzt höre ich schon die Kritiker sagen: Aber die Forschungsergebnisse kommen doch immer zu spät. Schauen Sie doch einmal, wie viele Konflikte Sie nicht verhindern konnten. Und: Für die Suche nach Lösungen sind sie nicht verwertbar. - Das stimmt so nicht.",TOP 26 Friedens- und Konfliktforschung,2923,speech,18
620,162930,620,213,,,,,,Beifall bei der SPD,TOP 26 Friedens- und Konfliktforschung,2923,poi,18
621,162931,621,213,Ralph Lenkert [DIE LINKE],Ralph Lenkert,ralph-lenkert,182.0,linke,Genau!,TOP 26 Friedens- und Konfliktforschung,2923,poi,18
622,162932,622,213,Dr. Claudia Lücking-Michel (CDU/CSU),Dr. Claudia Lücking-Michel,claudia-lucking-michel,176.0,cducsu,"Vorab will ich sagen: Grundlagenforschung hat ihren Sinn auch dann, wenn ihre Ergebnisse nicht direkt angewendet werden können. Diese Binsenweisheit jeder Wissenschafts- und Forschungspolitik gilt auch für die Friedens- und Konfliktforschung. Doch dann gilt selbstverständlich auch: Es gibt Anwendungsnutzen. Das zeigt allein schon die Tatsache, wie oft Expertise von den verschiedenen Ministerien angefordert wird.",TOP 26 Friedens- und Konfliktforschung,2923,speech,18
623,162933,623,213,Kai Gehring [BÜNDNIS 90/DIE GRÜNEN],Kai Gehring,kai-gehring,561.0,gruene,"Na ja! Und dann ignoriert wird! Ob man das Wissen auch nutzt, ist die Frage!",TOP 26 Friedens- und Konfliktforschung,2923,poi,18
624,162934,624,213,Dr. Claudia Lücking-Michel (CDU/CSU),Dr. Claudia Lücking-Michel,claudia-lucking-michel,176.0,cducsu,"Ein Beispiel will ich nennen. Das BMZ hat im letzten Jahr erstmals eine Strategie zu Religion und Entwicklung vorgelegt und dazu auf Ergebnisse von Forschungsprojekten zurückgegriffen, die aus dem Hamburger GIGA-Institut kamen. In einem Projekt wird die Rolle von Religionen in Konflikten untersucht. Wichtig ist: Dabei zeigt sich, dass Religion nicht nur etwa oft Ursache für die gewaltsame Eskalation von Konflikten ist - wie ich es oft genug in öffentlichen Debatten höre -, sondern auch umgekehrt eine Rolle spielt, wenn es darum geht, Konflikte zu befrieden oder einzudämmen. Ebenso wird dort untersucht, inwiefern Religion positiv nachhaltige Entwicklung in einer Community befördern kann. Hier findet also Forschung begleitend zu Politikentwicklung statt.

Das gilt übrigens auch für das schon erwähnte Salafismus-Projekt. Forschungsergebnisse wurden nicht nur den Fachpolitikern kommuniziert, sondern sie waren auch Inhalt von Kurzfilmen und Blogs. Diese Kurzfilme gehören seit Mitte 2016 übrigens zum Standardlehrmaterial für die Aus- und Weiterbildung von Polizeibeamten in Baden-Württemberg. Das nenne ich mal einen gelungenen Transfer.",TOP 26 Friedens- und Konfliktforschung,2923,speech,18
625,162935,625,213,,,,,,Beifall bei Abgeordneten der CDU/CSU und der SPD,TOP 26 Friedens- und Konfliktforschung,2923,poi,18
626,162936,626,213,Dr. Claudia Lücking-Michel (CDU/CSU),Dr. Claudia Lücking-Michel,claudia-lucking-michel,176.0,cducsu,"In anderen Punkten unseres Antrags machen wir jedoch auch deutlich, wie wichtig es ist, dass es eine unvoreingenommene Evaluierung des gesamten Forschungsfeldes - am besten durch den Wissenschaftsrat - gibt, um Erkenntnisse darüber zu gewinnen, was man verbessern kann. Ich bin überzeugt: Die Ergebnisse der Evaluierung werden auch Hinweise für eine zukünftige auskömmliche Finanzierung dieses Forschungsfeldes geben.

Zum Schluss möchte ich noch kurz auf ein drittes Anliegen in unserem Antrag eingehen. Ich nenne nur ein Schlagwort: Es geht uns um internationale Vernetzung und Austausch, auch und gerade für das hier adressierte Feld.

Mit unserem Antrag wollen wir der Friedens- und Konfliktforschung die dringend nötigen neuen Impulse geben. Ich bitte Sie: Stimmen Sie dafür!

Danke schön.",TOP 26 Friedens- und Konfliktforschung,2923,speech,18
627,162937,627,213,,,,,,Beifall bei der CDU/CSU und der SPD,TOP 26 Friedens- und Konfliktforschung,2923,poi,18
628,162938,628,213,Vizepräsidentin Dr. h. c. Edelgard Bulmahn,Dr. h. c. Edelgard Bulmahn,edelgard-bulmahn,596.0,,Vielen Dank. - Als nächster Redner hat Ralph Lenkert für die Fraktion die Linke das Wort.,TOP 26 Friedens- und Konfliktforschung,2923,chair,18
629,162939,629,213,,,,,,Beifall bei der LINKEN,TOP 26 Friedens- und Konfliktforschung,2923,poi,18
630,162940,630,213,Ralph Lenkert (DIE LINKE),Ralph Lenkert,ralph-lenkert,182.0,linke,"Sehr geehrte Frau Präsidentin! Geehrte Damen und Herren! Wie sieht es in vielen arabischen Regionen aus? Ein ausgetrocknetes Flussbett liegt in gleißender Sonne, am Ufer stehen ein paar ärmliche Häuser mit abgestorbenen Obstbäumen, und auf der staubigen Straße verabschiedet sich eine Familie von den Großeltern. Infolge der Erderwärmung stieg die Temperatur, und seit vier Jahren hat es nicht geregnet. Um zu überleben, muss die Familie in die Großstadt ziehen. Ihr Ackerland verwaist. Nur die Alten bleiben zurück.

Tausende Bauern und Hirten verloren wegen der Dürre ihre Existenzgrundlage und zogen in die Städte. Behörden, Infrastruktur, Sozialsysteme sind dem Ansturm nicht gewachsen. Die Spannungen zwischen den Menschen nehmen in dem Maße zu, wie Binnenflucht, Armut, aber auch Reichtum wachsen. Auf beginnende Proteste der Bevölkerung reagiert der autokratische Präsident mit Repressalien. Religiöse Fanatiker und Nationalisten wittern ihre Chance. Das Land steuert auf einen Bürgerkrieg zu.

Genau dieses Szenario - Dürre, Landflucht, übervölkerte Städte, innere Spannung, Bürgerkrieg - entstammt einer wissenschaftlichen Studie von 2012. Diese Studie schlägt auch Gegenmaßnahmen vor: Investitionen in wirtschaftliche Entwicklung, zum Beispiel in erneuerbare Energien, damit Meerwasser preiswert entsalzt und zur Bewässerung genutzt werden kann, in die Unterstützung der Landbevölkerung zur Bewältigung der neuen klimatischen Bedingungen. Es geht also um eine lokale wirtschaftliche Entwicklung, von der die Gesellschaft vor Ort profitiert.",TOP 26 Friedens- und Konfliktforschung,2923,speech,18
631,162941,631,213,,,,,,Beifall bei der LINKEN sowie der Abg. Dr. Daniela De Ridder [SPD] und Kai Gehring [BÜNDNIS 90/DIE GRÜNEN],TOP 26 Friedens- und Konfliktforschung,2923,poi,18
632,162942,632,213,Ralph Lenkert (DIE LINKE),Ralph Lenkert,ralph-lenkert,182.0,linke,"Das hilft, Spannungen und Konflikte zu reduzieren. Wirtschaftskrisen und wachsende Einkommensunterschiede dagegen verstärken die Probleme.

Die Studie ist eine beeindruckende Vorhersage für den nordafrikanischen bzw. arabischen Raum und stammt von einer regierungsnahen, einer von uns eigentlich nicht so sehr geliebten Organisation, nämlich der Bundeswehr,",TOP 26 Friedens- und Konfliktforschung,2923,speech,18
633,162943,633,213,René Röspel [SPD],René Röspel,rene-rospel,433.0,spd,Schau an!,TOP 26 Friedens- und Konfliktforschung,2923,poi,18
634,162944,634,213,Ralph Lenkert (DIE LINKE),Ralph Lenkert,ralph-lenkert,182.0,linke,"dem Dezernat „Zukunftsanalysen“ des Planungsamtes der Bundeswehr. Diese Studie sagt geradezu prophetisch die Entwicklung des syrischen Bürgerkrieges voraus. Kannten Sie, liebe Damen und Herren von der Koalition, diese Studie mit dem Titel „Umweltdimensionen von Sicherheit“? Wenn nein, frage ich mich: Nehmen Sie die Bundeswehr ernst? Und wenn ja, muss ich feststellen: Sie ignorieren die Ergebnisse, die Ihnen nicht passen.",TOP 26 Friedens- und Konfliktforschung,2923,speech,18
635,162945,635,213,Jörn Wunderlich [DIE LINKE],Jörn Wunderlich,jorn-wunderlich,357.0,linke,So ist das!,TOP 26 Friedens- und Konfliktforschung,2923,poi,18
636,162946,636,213,Ralph Lenkert (DIE LINKE),Ralph Lenkert,ralph-lenkert,182.0,linke,"Aber egal, ob ja oder nein: Angesichts dieses Umgangs mit der Bundeswehrstudie frage ich Sie: Werden Sie zukünftig die Ergebnisse der Friedens- und Konfliktforschung, deren Stärkung Sie hier fordern, auch berücksichtigen?",TOP 26 Friedens- und Konfliktforschung,2923,speech,18
637,162947,637,213,Jörn Wunderlich [DIE LINKE],Jörn Wunderlich,jorn-wunderlich,357.0,linke,"Nein, werden sie nicht machen!",TOP 26 Friedens- und Konfliktforschung,2923,poi,18
638,162948,638,213,Gegenruf von der CDU/CSU,von der CDU/CSU,von-der-cdu-csu,,cducsu,Doch!,TOP 26 Friedens- und Konfliktforschung,2923,poi,18
639,162949,639,213,Ralph Lenkert (DIE LINKE),Ralph Lenkert,ralph-lenkert,182.0,linke,"Der Bürgerkrieg in Syrien hätte verhindert werden können. In der rückblickenden Analyse zum Syrien-Konflikt des Instituts für Friedensforschung und Sicherheitspolitik, Hamburg, werden neben dem Klimawandel weitere Faktoren genannt, die innersyrische Spannungen verschärften: einbrechende Einnahmen aus dem Ölexport, die vom Westen erzwungene Liberalisierung der Wirtschaft, die fehlende soziale Verantwortung des Regimes, ineffiziente Verwaltungsstrukturen, und dann kam die Dürre obendrauf. Jeder normal denkende Mensch weiß: Wenn man in so eine Krisenregion Waffen liefert, wie es deutsche Firmen getan haben, dann legt man die Zündschnur.",TOP 26 Friedens- und Konfliktforschung,2923,speech,18
640,162950,640,213,Jörn Wunderlich [DIE LINKE],Jörn Wunderlich,jorn-wunderlich,357.0,linke,Das Zauberwort ist „normal denkend“!,TOP 26 Friedens- und Konfliktforschung,2923,poi,18
641,162951,641,213,Ralph Lenkert (DIE LINKE),Ralph Lenkert,ralph-lenkert,182.0,linke,"Deshalb lehnt die Linke Waffenexporte strikt ab. Die Linke fordert fairen Handel statt Freihandel, mehr Gelder für Entwicklung und die Unterstützung des Ausbaus der erneuerbaren Energien.",TOP 26 Friedens- und Konfliktforschung,2923,speech,18
642,162952,642,213,,,,,,Beifall bei der LINKEN,TOP 26 Friedens- und Konfliktforschung,2923,poi,18
643,162953,643,213,Dr. Philipp Lengsfeld [CDU/CSU],Dr. Philipp Lengsfeld,philipp-lengsfeld,27.0,cducsu,Und Freibier für alle!,TOP 26 Friedens- und Konfliktforschung,2923,poi,18
644,162954,644,213,Ralph Lenkert (DIE LINKE),Ralph Lenkert,ralph-lenkert,182.0,linke,"Hätte man 2012 diese Maßnahmen ergriffen, würden Hunderttausende Syrer vielleicht noch leben, wären Millionen nicht auf der Flucht. Aber der Prophet gilt im eigenen Hause bekanntlich nichts.",TOP 26 Friedens- und Konfliktforschung,2923,speech,18
645,162955,645,213,Dagmar Ziegler [SPD],Dagmar Ziegler,dagmar-ziegler,87.0,spd,"Ich wusste gar nicht, dass die Linken Propheten sind!",TOP 26 Friedens- und Konfliktforschung,2923,poi,18
646,162956,646,213,Ralph Lenkert (DIE LINKE),Ralph Lenkert,ralph-lenkert,182.0,linke,"Wahrscheinlich ignorieren Sie deshalb seit Jahren unsere Warnungen und Forderungen und sogar die Informationen der Bundeswehr.

Ich freue mich trotzdem über den Antrag der Koalition und habe die Hoffnung, dass Sie vielleicht zukünftig die Ergebnisse der Forschung übernehmen werden, auch wenn in diesem Antrag sehr wenig Konkretes steht. Die Linke wird alles unterstützen, was Kriege verhindert oder beendet, Frieden sichert und Frieden schafft - ohne Waffen.

Vielen Dank.",TOP 26 Friedens- und Konfliktforschung,2923,speech,18
647,162957,647,213,,,,,,Beifall bei der LINKEN,TOP 26 Friedens- und Konfliktforschung,2923,poi,18
648,162958,648,213,Vizepräsidentin Dr. h. c. Edelgard Bulmahn,Dr. h. c. Edelgard Bulmahn,edelgard-bulmahn,596.0,,Vielen Dank. - Als nächster Redner hat René Röspel für die SPD-Fraktion das Wort.,TOP 26 Friedens- und Konfliktforschung,2923,chair,18
649,162959,649,213,,,,,,Beifall bei der SPD sowie bei Abgeordneten der CDU/CSU,TOP 26 Friedens- und Konfliktforschung,2923,poi,18
650,162960,650,213,René Röspel (SPD),René Röspel,rene-rospel,433.0,spd,"Frau Präsidentin! Meine sehr verehrten Damen und Herren! Vielleicht ist es sogar bezeichnend, dass wir an einem Mittag kurz vor dem Wochenende, nachdem über die Militäreinsätze gesprochen und der Bericht des Wehrbeauftragten gegeben worden ist, noch über Friedens- und Konfliktforschung reden, sozusagen am Ende der Sitzungswoche.",TOP 26 Friedens- und Konfliktforschung,2923,speech,18
651,162961,651,213,Kai Gehring [BÜNDNIS 90/DIE GRÜNEN],Kai Gehring,kai-gehring,561.0,gruene,Hättet ihr ja drehen können!,TOP 26 Friedens- und Konfliktforschung,2923,poi,18
652,162962,652,213,René Röspel (SPD),René Röspel,rene-rospel,433.0,spd,"Ich kann mich noch gut an die Zeit erinnern, als ich in dem Alter vieler der Zuhörer hier war: 1979 saß ich vor dem Fernseher und betrachtete entsetzt die sowjetische Armee, die in Afghanistan einmarschierte, und ich war nicht sicher, was passieren würde. Ihr in der DDR werdet das vielleicht anders gesehen und anders beurteilt haben.",TOP 26 Friedens- und Konfliktforschung,2923,speech,18
653,162963,653,213,Jörn Wunderlich [DIE LINKE],Jörn Wunderlich,jorn-wunderlich,357.0,linke,Ich bin Sachse mit Migrationshintergrund!,TOP 26 Friedens- und Konfliktforschung,2923,poi,18
654,162964,654,213,,,,,,Zuruf des Abg. Dr. Philipp Lengsfeld [CDU/CSU],TOP 26 Friedens- und Konfliktforschung,2923,poi,18
655,162965,655,213,René Röspel (SPD),René Röspel,rene-rospel,433.0,spd,"Es gab ein paar Tage und Wochen Diskussionen, in denen begründet wurde, warum das passiert, und dann ist das Thema schnell wieder verschwunden, und man hat Jahre nichts davon gehört.

Mir, wie vielen Millionen anderer Menschen, begegnete das Thema Afghanistan erst wieder, als James Bond in dem Kinofilm Der Hauch des Todes von den afghanischen Mudschaheddin, den Glaubenskriegern, gerettet wurde, und das waren dann offenbar die Guten. Das Thema ist dann wieder verschwunden, und im März 2001 ging ein Erschrecken durch die Weltbevölkerung, weil die Taliban die Buddha-Statuen in Bamiyan, die zum Weltkulturerbe gehörten, zerstörten. Die Welt war über diesen Kulturfrevel entsetzt. Ein halbes Jahr später musste dann der Bundestag hier entscheiden, ob er sich militärisch an einem Einsatz in Afghanistan beteiligt.

Viel differenzierter als der Krieg in Afghanistan sind in den 90er-Jahren die Golfkriege betrachtet worden. Sie waren viel mobilisierender. Tausende von Menschen, darunter Kinder und Schüler, sind auf die Straße gegangen. Damals war der Irak unter Saddam Hussein sozusagen das Bollwerk des freien Westens gegen den Iran unter dem Ajatollah Chomeini. Das ändert sich relativ schnell. Irgendwann Jahre später wurde dann Saddam Hussein der Gegner und der Böse in einer Auseinandersetzung, bei der es um viel mehr ging als um Frieden in der Golfregion, nämlich auch um wirtschaftliche Interessen.

Als in Libyen die Gelegenheit bestand, Gaddafi loszuwerden, waren viele Länder versucht - sie haben es auch gemacht -, Gaddafi zu stürzen, nicht wissend, was eigentlich in dem Land und mit dem Land danach passieren wird.

Wenn man die fürchterlichen Bilder aus Syrien sieht - so geht es mir jedenfalls -, weiß man nicht, wer bei dem Konflikt gerade mit wem gegen wen wofür kämpft. Am Ende ist die Frage: Wer sind eigentlich die Guten und wer die Bösen? Die Antwort darauf wird es so nie geben, weil das ganze Feld sehr komplex ist.

Wer sind eigentlich diejenigen, die Kriege anfangen? Wie entstehen Konflikte? Wo ist Konfliktpotenzial? Was sind die Ursachen von Kriegen? Ralph Lenkert hat ja einige angesprochen. Was werden die neuen Herausforderungen sein? Zum Beispiel der Klimawandel oder die Tatsache, dass Menschen nicht mehr in ihrer Region leben können, weil sie dort kein Wasser haben, keine Chance auf Arbeit, ihre Ernährung nicht sicherstellen können, weil es dort unterschiedliche Ethnien gibt, die aufgrund bestimmter Bedingungen als Land zusammengeschweißt wurden - wie geht man mit solchen Fragen um?

Wenn es um die Antworten geht, braucht Politik immer Hilfe und Beratung. Das Beste wäre, wenn man eine Friedens- und Konfliktforschung hätte, die eindeutige Antworten geben kann. Das ist im seltensten Fall so. Aber es ist wichtig, dass es eine solche Friedens- und Konfliktforschung gibt. Wir sind in Deutschland exzellent aufgestellt. Ich habe in meiner vor einigen Wochen zu Protokoll gegebenen Rede viele Institute aufgezählt, auf die wir stolz sein können. Sie verrichten gute Arbeit. Ihre Analysen und Äußerungen werden häufig nicht genug beachtet, aber sie geben wichtige Anhaltspunkte für politische Entscheidungen.

Ein wichtiger Impuls, den wir als Koalition mit diesem Antrag setzen, ist, dass wir der Friedens- und Konfliktforschung einen anderen Stellenwert geben und für Kontinuität und Verlässlichkeit sorgen wollen. Auch das ist ein wesentlicher Vorteil dieses Antrags: Wir reden über dieses Thema, während die Opposition in dieser Frage leider keinen Vorstoß gemacht hat.",TOP 26 Friedens- und Konfliktforschung,2923,speech,18
656,162966,656,213,Kai Gehring [BÜNDNIS 90/DIE GRÜNEN],Kai Gehring,kai-gehring,561.0,gruene,Das kann bei allem anderen schon passieren!,TOP 26 Friedens- und Konfliktforschung,2923,poi,18
657,162967,657,213,René Röspel (SPD),René Röspel,rene-rospel,433.0,spd,"Ich finde sogar, dass Friedens- und Konfliktforschung so verlässlich und kontinuierlich finanziert werden sollte, wie wir es beim Pakt für Forschung und Innovation machen, in dessen Rahmen wir technische Wissenschaften und viele andere mit 3 Prozent jährlich fördern.",TOP 26 Friedens- und Konfliktforschung,2923,speech,18
658,162968,658,213,,,,,,Beifall bei der SPD sowie bei Abgeordneten der CDU/CSU,TOP 26 Friedens- und Konfliktforschung,2923,poi,18
659,162969,659,213,René Röspel (SPD),René Röspel,rene-rospel,433.0,spd,"Ausdrücklich will ich an dieser Stelle - meine Redezeit ist kurz - Claudia Lücking-Michel für ihr Engagement danken und dafür, dass der Antrag, über den wir hier reden, überhaupt zustande gekommen ist. Das war nicht ganz einfach. Wir haben bei dem gemeinsamen Antrag für Friedens- und Konfliktforschung vieles abspecken müssen. Es ist auch dein Verdienst, dass es möglich geworden ist, dass wir diesen Impuls setzen. Ich finde es ausdrücklich schade, dass wir gerade aus den Reihen der Verteidigungspolitiker der Union immer wieder aufgefordert wurden, das Ganze abzuspecken oder zu reduzieren.

Ich will an dieser Stelle sagen: Wir haben in diesem Haushalt den Verteidigungsetat gegenüber dem letzten Jahr um 2 700 Millionen Euro erhöht. Angesichts der Krisen und Katastrophen, angesichts der Notwendigkeit, mehr darüber zu wissen, wie Konflikte entstehen, wie man sie vielleicht verhindern kann und wie man Abrüstung und Rüstungskontrolle machen kann, müsste es doch eigentlich ein paar Millionen mehr für Friedens- und Konfliktforschung geben, um an den Ursachen zu arbeiten.",TOP 26 Friedens- und Konfliktforschung,2923,speech,18
660,162970,660,213,,,,,,Beifall bei der SPD,TOP 26 Friedens- und Konfliktforschung,2923,poi,18
661,162971,661,213,Kai Gehring [BÜNDNIS 90/DIE GRÜNEN],Kai Gehring,kai-gehring,561.0,gruene,Und Herr Gabriel müsste anders entscheiden!,TOP 26 Friedens- und Konfliktforschung,2923,poi,18
662,162972,662,213,René Röspel (SPD),René Röspel,rene-rospel,433.0,spd,"Ganz herzlich bedanken möchte ich mich auch bei den vielen in der Bevölkerung, die seit Jahrzehnten in der Friedensbewegung immer wieder daran gearbeitet haben, Ursachen differenziert zu betrachten und auf sie hinzuweisen. Sie erlauben mir, dass ich stellvertretend an dieser Stelle ganz herzlich Günter Sauerbier danke, der in einigen Minuten in Hagen einen Friedenspreis für sein Lebenswerk, für seine Arbeit bei Pax Christi bekommen wird. Menschen wie er sind es, die unsere Gesellschaft besser machen; von diesen brauchen wir viel mehr. Ich wünsche Ihnen viele gute Erkenntnisse und dass wir bei der Friedens- und Konfliktforschung besser werden.

Vielen Dank.",TOP 26 Friedens- und Konfliktforschung,2923,speech,18
663,162973,663,213,,,,,,Beifall bei der SPD sowie bei Abgeordneten der CDU/CSU,TOP 26 Friedens- und Konfliktforschung,2923,poi,18
664,162974,664,213,Vizepräsidentin Dr. h. c. Edelgard Bulmahn,Dr. h. c. Edelgard Bulmahn,edelgard-bulmahn,596.0,,Vielen Dank. - Als nächster Redner hat Kai Gehring für die Fraktion Bündnis 90/Die Grünen das Wort.,TOP 26 Friedens- und Konfliktforschung,2923,chair,18
665,162975,665,213,Kai Gehring (BÜNDNIS 90/DIE GRÜNEN),Kai Gehring,kai-gehring,561.0,gruene,"Frau Präsidentin! Liebe Kolleginnen und Kollegen! An diesem Tag einer tiefen Zäsur in den USA diskutieren wir über die Perspektiven der Friedens- und Konfliktforschung hierzulande. Ich finde das durchaus passend. Denn das Verstehen von Konfliktursachen, das Verhindern von Konflikten und Kriegen, mehr Prävention, Rationalität und Gedankenaustausch tun den internationalen Beziehungen gut. Anders gesagt: Postfaktische Einfalt darf die internationale Politik nicht bestimmen; denn es geht letztlich um den Erhalt des friedlichen Zusammenlebens von uns allen. Die Politik ist auf wissenschaftlich fundierte Informationen und Empfehlungen angewiesen. Für uns Grüne ist deshalb klar: Wir müssen die Friedensforschung besser ausstatten und systematisch stärken.",TOP 26 Friedens- und Konfliktforschung,2923,speech,18
666,162976,666,213,,,,,,Beifall beim BÜNDNIS 90/DIE GRÜNEN sowie der Abg. Dr. Ute Finckh-Krämer [SPD],TOP 26 Friedens- und Konfliktforschung,2923,poi,18
