,id,sequence,sitzung,speaker,speaker_cleaned,speaker_fp,speaker_key,speaker_party,text,top,top_id,type,wahlperiode
0,162310,0,213,Präsident Dr. Norbert Lammert,Dr. Norbert Lammert,norbert-lammert,494.0,,"Nehmen Sie bitte Platz. Die Sitzung ist eröffnet.

Liebe Kolleginnen und Kollegen! Ich begrüße Sie alle herzlich und möchte vor Eintritt in die Tagesordnung dem Kollegen Hans-Joachim Schabedoth zu seinem heutigen 65. Geburtstag herzlich gratulieren.",TOP 21 Arbeitsprogramm der EU-Kommission 2017,2918,chair,18
1,162311,1,213,,,,,,Beifall,TOP 21 Arbeitsprogramm der EU-Kommission 2017,2918,poi,18
2,162312,2,213,Präsident Dr. Norbert Lammert,Dr. Norbert Lammert,norbert-lammert,494.0,,"Alle guten Wünsche für das neue Lebensjahr!

Wir kommen nun zum Tagesordnungspunkt 21:

Vereinbarte Debatte

zum Arbeitsprogramm der EU-Kommission 2017

Die Debatte soll nach einer interfraktionellen Vereinbarung 60 Minuten dauern. - Das ist offensichtlich einvernehmlich. Also können wir so verfahren.

Ich eröffne die Aussprache und erteile das Wort zunächst der Kollegin Katarina Barley für die SPD-Fraktion.",TOP 21 Arbeitsprogramm der EU-Kommission 2017,2918,chair,18
3,162313,3,213,,,,,,Beifall bei der SPD sowie bei Abgeordneten der CDU/CSU,TOP 21 Arbeitsprogramm der EU-Kommission 2017,2918,poi,18
4,162314,4,213,Dr. Katarina Barley (SPD),Dr. Katarina Barley,katarina-barley,274.0,spd,"Herr Präsident! Liebe Kolleginnen und Kollegen! Liebe Gäste! Das vorliegende Arbeitsprogramm der Europäischen Kommission für das Jahr 2017 ist Anlass für unsere heutige Debatte. Aber die Fragen, die uns beschäftigen, gehen weit darüber hinaus. Es geht im Moment um nichts weniger als um die Frage, wohin sich Europa entwickeln wird, wohin sich die Europäische Union entwickeln wird. Wir haben ja ein Jahr der Zäsuren hinter uns, ein Jahr mit Brexit-Referendum, ein Jahr mit Wahlkampf und Wahl in den USA; und Donald Trump wird heute als Präsident der Vereinigten Staaten vereidigt werden. All das wird die Architektur der Welt und die Architektur innerhalb der Europäischen Union verändern.

Genauso wie für viele von Ihnen bedeutete für mich die Idee der Europäischen Union, zusammenzuwachsen und einander besser zu verstehen, indem man zusammenarbeitet und sich austauscht. Es ist schon bestürzend, zu sehen, dass die bisherigen Entwicklungen umkehrbar sind. Wir sind mit zwei Entwicklungen konfrontiert, die mich und, wie ich vermute, die meisten hier im Saal sehr besorgt machen.

Die eine Entwicklung ist, dass sich Menschen von Europa, von der Idee der Europäischen Union abwenden, weil sie sich nicht mehr erreicht fühlen, sich nicht verstanden fühlen, weil sie sich nicht als Ziel europäischer Politik fühlen. Ich nenne als Beispiel eine Begegnung bei einer Wanderung in Bayern. Ein selbstständiger Metzger, der das Geschäft in fünfter Generation fortführt, sagte mir: Es ist schon wieder eine neue Regelung aus Brüssel gekommen. Ich muss schon wieder neue Hygienevorschriften beachten und müsste bauliche Veränderungen vornehmen, wenn ich meinen Betrieb an die nachfolgende Generation übergeben will. Das lohnt sich nicht mehr. Irgendwann werden wir dichtmachen müssen. - Das ist nur eine kleine Begebenheit. Es gibt viele davon, bei denen die Menschen das Gefühl haben: Europa wird zu sehr von der Logik der Märkte her gedacht, aus der Logik der Wirtschaft gedacht und eben zu wenig aus der Logik von Menschen.

Die zweite sehr besorgniserregende Entwicklung ist die der wachsenden nationalen Egoismen. Das ist keine ganz neue Entwicklung. Das hatten wir schon bei Maggie Thatcher. Insofern ist es wahrscheinlich auch kein Zufall, dass nun Großbritannien das Land ist, welches die Grundsatzfrage gestellt hat. Die Idee aber, dass man nicht gemeinsam zu etwas beiträgt, sondern sich das größte Stück herausbrechen will, haben wir schon lange.

Was wir jetzt aber zusätzlich sehen - zusätzlich zu Unterbietungswettbewerben, die wir leider immer noch haben in Form von Steuerdumping und auch Dumping bei Sozialstandards -, ist noch etwas Weiteres: Es kommt jetzt ein neuer Nationalismus, ein neuer Egoismus mit einer ganz anderen Qualität und einer ganz anderen Zielrichtung dazu. Deswegen ist es so wichtig, dass sich diejenigen, welche die EU nach wie vor als ein Projekt der Zukunft, als ein Projekt der Versöhnung, als ein Projekt des gemeinsamen Wohlstandes ansehen, jetzt ernsthaft überlegen, wie sich diese EU in Zukunft aufstellen soll. Ich glaube, dass wir nach diesem Jahr der Zäsuren einen neuen Aufschlag brauchen. Die EU ist ein Projekt, das von Menschen gemacht wird. Deswegen haben wir es auch in der Hand, Europa zu verändern. Und das müssen wir tun.

Wir müssen die Rechtspopulisten bekämpfen, die eine 180-Grad-Wende hin zu einem neuen säbelrasselnden, autoritären Nationalismus wollen. Das hat mit einem freiheitlichen Europa in einem aufgeklärten Kontinent überhaupt nichts mehr zu tun. Damit begänne eine Zeit des Nationalismus, des Protektionismus und der autoritären Regime. Das kann wirklich keiner wollen. Man blicke einmal auf Polen und Ungarn und schaue sich an, wem es da zuerst an den Kragen geht: der unabhängigen Justiz, der freien Presse, der kritischen Kultur, den Rechten der Frauen. Es sind immer die Gleichen, die darunter zu leiden haben. Das kann wirklich kein Mensch wollen, der an einem freiheitlichen Europa interessiert ist.",TOP 21 Arbeitsprogramm der EU-Kommission 2017,2918,speech,18
5,162315,5,213,,,,,,Beifall bei der SPD sowie bei Abgeordneten der CDU/CSU und des BÜNDNISSES 90/DIE GRÜNEN,TOP 21 Arbeitsprogramm der EU-Kommission 2017,2918,poi,18
6,162316,6,213,Dr. Katarina Barley (SPD),Dr. Katarina Barley,katarina-barley,274.0,spd,"Aber wir können und müssen Europa besser machen. Das heißt für uns Sozialdemokratinnen und Sozialdemokraten vor allen Dingen, Europa sozialer zu machen. Deswegen bin ich froh, dass die Europäische Kommission eine europäische Säule einziehen will. Das darf aber keine reine Worthülse bleiben. Wir fordern das schon lange; denn das bietet die Chance, wirklich ein Europa der Bürger aufzubauen. Das heißt soziale Sicherungsstandards, faire Mindestlöhne, das heißt ein Ende von Steuerflucht und Steuerdumping.

Das heißt auch ein Europa der Jugend; denn wir sehen doch, dass wir vor allen Dingen in Südeuropa eine ganze Generation für die europäische Idee verlieren. Die Idee des Juncker-Plans, Investitionen zu stärken, ist der richtige Ansatz. Aber Investitionen alleine werden uns nicht helfen, wenn sie nicht in Beschäftigung münden, vor allen Dingen in Beschäftigung von jungen Menschen; denn sie sind unsere Zukunft im Kampf für ein geeintes Europa.

Europa ist das, was wir daraus machen. Wir haben es in der Hand. Unsere Generation wird sich später daran messen lassen müssen, was wir aus dieser europäischen Idee gemacht haben. Wir wollen einen neuen Aufbruch in Europa für eine gute und eine gemeinsame Zukunft.

Vielen Dank.",TOP 21 Arbeitsprogramm der EU-Kommission 2017,2918,speech,18
7,162317,7,213,,,,,,Beifall bei der SPD sowie bei Abgeordneten der CDU/CSU,TOP 21 Arbeitsprogramm der EU-Kommission 2017,2918,poi,18
8,162318,8,213,Präsident Dr. Norbert Lammert,Dr. Norbert Lammert,norbert-lammert,494.0,,Gregor Gysi ist der nächste Redner für die Fraktion Die Linke.,TOP 21 Arbeitsprogramm der EU-Kommission 2017,2918,chair,18
9,162319,9,213,,,,,,Beifall bei der LINKEN,TOP 21 Arbeitsprogramm der EU-Kommission 2017,2918,poi,18
10,162320,10,213,Dr. Gregor Gysi (DIE LINKE),Dr. Gregor Gysi,gregor-gysi,550.0,linke,Herr Präsident! Liebe Kolleginnen und Kollegen! Die Europäische Union ist in einem desolaten Zustand. Leider - das muss ich sagen - haben die Bundeskanzlerin und der Bundesfinanzminister daran einen großen Anteil.,TOP 21 Arbeitsprogramm der EU-Kommission 2017,2918,speech,18
11,162321,11,213,Dr. Petra Sitte [DIE LINKE],Dr. Petra Sitte,petra-sitte,319.0,linke,Das stimmt!,TOP 21 Arbeitsprogramm der EU-Kommission 2017,2918,poi,18
12,162322,12,213,Dr. Gregor Gysi (DIE LINKE),Dr. Gregor Gysi,gregor-gysi,550.0,linke,"Auch Vizekanzler und Minister Gabriel ist insofern mitschuldig, als er als Vizekanzler zu all dem geschwiegen hat und sich als Wirtschaftsminister nicht eingemischt hat.",TOP 21 Arbeitsprogramm der EU-Kommission 2017,2918,speech,18
13,162323,13,213,Zuruf von der SPD,von der SPD,von-der-spd,,spd,Das stimmt jetzt nicht!,TOP 21 Arbeitsprogramm der EU-Kommission 2017,2918,poi,18
14,162324,14,213,Dr. Gregor Gysi (DIE LINKE),Dr. Gregor Gysi,gregor-gysi,550.0,linke,"Deutschland spielt eine führende Rolle in der Europäischen Union. Und es gibt zwei Wege, wie man diese Rolle ausfüllen kann. Der erste Weg ist: Man baut den Süden Europas und damit auch die Europäische Union auf. Der zweite Weg ist: Man baut den Süden Europas und damit auch die Europäische Union ab. Leider hat sich die Bundesregierung für den zweiten Weg entschieden. Das ist verhängnisvoll.

Sie reden von Wettbewerbsfähigkeit, von wettbewerbsfähiger Demokratie. Die soziale Frage, die ökologische Nachhaltigkeit, die Solidarität - all das spielt nicht die geringste Rolle; es interessiert Sie einfach nicht.",TOP 21 Arbeitsprogramm der EU-Kommission 2017,2918,speech,18
15,162325,15,213,,,,,,Widerspruch bei Abgeordneten der CDU/CSU,TOP 21 Arbeitsprogramm der EU-Kommission 2017,2918,poi,18
16,162326,16,213,Christian Petry [SPD],Christian Petry,christian-petry,277.0,spd,Das ist nicht wahr!,TOP 21 Arbeitsprogramm der EU-Kommission 2017,2918,poi,18
17,162327,17,213,Dr. Gregor Gysi (DIE LINKE),Dr. Gregor Gysi,gregor-gysi,550.0,linke,"Permanent wird vom Süden Europas gefordert: Runter mit den Löhnen, runter mit den Renten, runter mit den Sozialleistungen! Das sind aber Länder, die im Unterschied zu Deutschland nicht vom Export, sondern von der Binnenwirtschaft leben. Wenn Sie permanent die Kaufkraft reduzieren - ich bin noch gar nicht bei der sozialen Frage -, dann bringt das mit sich, dass die Binnenwirtschaft geschwächt wird. Das heißt, dass die Steuereinnahmen zurückgehen, und das bedeutet, dass die Schulden niemals zurückgezahlt werden können.",TOP 21 Arbeitsprogramm der EU-Kommission 2017,2918,speech,18
18,162328,18,213,,,,,,Zurufe von der SPD,TOP 21 Arbeitsprogramm der EU-Kommission 2017,2918,poi,18
19,162329,19,213,Dr. Gregor Gysi (DIE LINKE),Dr. Gregor Gysi,gregor-gysi,550.0,linke,"Was wir gebraucht hätten, wäre ein Marshallplan für den Süden gewesen. Den haben Sie abgelehnt. Aber Deutschland - nicht die DDR, aber die Bundesrepublik - bekam nach dem schlimmsten Krieg, nach den schlimmsten Verbrechen nach 1945 einen Marshallplan, der beim Aufbau geholfen hat. Nicht nur das: Acht Jahre nach diesen entsetzlichen Verbrechen tagte eine Schuldenkonferenz in London: 1953. Auf ihr wurden Deutschland fast alle Schulden erlassen. Vergleichen Sie das einmal mit der Art und Weise, wie Sie den Süden Europas behandeln.",TOP 21 Arbeitsprogramm der EU-Kommission 2017,2918,speech,18
20,162330,20,213,,,,,,Beifall bei der LINKEN,TOP 21 Arbeitsprogramm der EU-Kommission 2017,2918,poi,18
21,162331,21,213,Michael Grosse-Brömer [CDU/CSU],Michael Grosse-Brömer,michael-grosse-bromer,284.0,cducsu,Ein sehr gewagter Vergleich!,TOP 21 Arbeitsprogramm der EU-Kommission 2017,2918,poi,18
22,162332,22,213,Dr. Gregor Gysi (DIE LINKE),Dr. Gregor Gysi,gregor-gysi,550.0,linke,"Ich behaupte, wir brauchen jetzt, 64 Jahre nach 1953, wieder eine Schuldenkonferenz, nicht nur für Griechenland, sondern für die gesamte Euro-Zone.",TOP 21 Arbeitsprogramm der EU-Kommission 2017,2918,speech,18
23,162333,23,213,,,,,,Beifall bei der LINKEN,TOP 21 Arbeitsprogramm der EU-Kommission 2017,2918,poi,18
24,162334,24,213,Dr. Gregor Gysi (DIE LINKE),Dr. Gregor Gysi,gregor-gysi,550.0,linke,"Bestimmte Schulden müssen einfach gestrichen werden. Ich darf Sie an die Bibel erinnern, an das Alte Testament, an die Verse 8 bis 55 im 3. Buch Mose, Kapitel 25 - lesen Sie das einmal -:",TOP 21 Arbeitsprogramm der EU-Kommission 2017,2918,speech,18
25,162335,25,213,Michael Grosse-Brömer [CDU/CSU],Michael Grosse-Brömer,michael-grosse-bromer,284.0,cducsu,Sie müssen uns nicht an die Bibel erinnern!,TOP 21 Arbeitsprogramm der EU-Kommission 2017,2918,poi,18
26,162336,26,213,Dr. Gregor Gysi (DIE LINKE),Dr. Gregor Gysi,gregor-gysi,550.0,linke,"Da steht etwas von einem Schuldenerlass alle sieben Jahre, aber zumindest nach 50 Jahren im sogenannten Jubeljahr. - Ich finde, die Christdemokratinnen und Christdemokraten könnten sich doch wenigstens einmal nach der Bibel richten. Das wird höchste Zeit.",TOP 21 Arbeitsprogramm der EU-Kommission 2017,2918,speech,18
27,162337,27,213,,,,,,Beifall bei der LINKEN,TOP 21 Arbeitsprogramm der EU-Kommission 2017,2918,poi,18
28,162338,28,213,,,,,,Zuruf des Abg. Dr. Franz Josef Jung [CDU/CSU],TOP 21 Arbeitsprogramm der EU-Kommission 2017,2918,poi,18
29,162339,29,213,Dr. Gregor Gysi (DIE LINKE),Dr. Gregor Gysi,gregor-gysi,550.0,linke,"Wenn man den Banken sagt: „Alle 64 Jahre gibt es einen Schuldenerlass“, dann gewöhnen sie sich auch daran. Sie müssen es nur wissen. Ich glaube, dass das der richtige Weg wäre.

Die EU ist unsolidarisch. Ich nenne ein Beispiel: Deutschland hat die Solidarität mit Griechenland aufgekündigt. Das war deshalb so verhängnisvoll, weil sich alle anderen Regierungen gesagt haben: Ach, so werden wir behandelt, wenn es uns schlechtgeht. - Ich erinnere daran, dass die italienische Regierung, als sehr viele Flüchtlinge nach Italien kamen, um EU-Flüchtlingsquoten bat. Was sagte die Bundesregierung? Wir haben das Abkommen von Dublin. Das kommt gar nicht infrage. Das ist eure Angelegenheit.

Etwa zehn Monate später kamen sehr viele Flüchtlinge nach Deutschland, und plötzlich wollte die Bundesregierung EU-Flüchtlingsquoten. Ich habe selten in solch wonnige Gesichter von Staats- und Regierungschefs gesehen, die uns allen den mittleren Finger gezeigt haben. Da war mir klar: Die Solidarität in der EU ist kaputt. Und das geht nicht.",TOP 21 Arbeitsprogramm der EU-Kommission 2017,2918,speech,18
30,162340,30,213,,,,,,Beifall bei Abgeordneten der LINKEN,TOP 21 Arbeitsprogramm der EU-Kommission 2017,2918,poi,18
31,162341,31,213,,,,,,Zurufe der Abg. Annalena Baerbock [BÜNDNIS 90/DIE GRÜNEN],TOP 21 Arbeitsprogramm der EU-Kommission 2017,2918,poi,18
32,162342,32,213,Dr. Gregor Gysi (DIE LINKE),Dr. Gregor Gysi,gregor-gysi,550.0,linke,"Wissen Sie, was der Höhepunkt war? Als jetzt in Griechenland etwas Geld übrig blieb, hat man entschieden, dieses Geld den Ärmsten zur Verfügung zu stellen. Frau Merkel und Herr Schäuble haben ein Affentheater gemacht und gedroht, dass alle weiteren Hilfen für Griechenland gestrichen werden. Sie müssen sich einmal überlegen, wie das bei den Leuten in Europa ankommt, wenn man eine solch kleine Geste derart beschimpft.

Ich muss noch etwas sagen:

Die EU ist unsozial. Der Süden hat in den letzten Jahren nichts anderes als Sozialabbau kennengelernt, und auch in Deutschland haben wir den größten Niedriglohnsektor in Europa und millionenfache prekäre Beschäftigung.

Die EU ist auch ökologisch nicht nachhaltig. Ich sage immer: unzureichende Ziele und unzureichende Realisierung von Maßnahmen im Kampf gegen den Klimawandel.

Die EU ist intransparent. Die TTIP-Verhandlungen wurden als Geheimverhandlungen geführt. Ich beurteile die Tatsache, dass Trump heute Präsident der Vereinigten Staaten von Amerika wird, natürlich äußerst kritisch. Aber Sie wissen: Negative Entwicklungen haben immer auch ein positives Körnchen. Es könnte ja sein, dass er TTIP fallen lässt, und das wäre dann im Interesse der Europäerinnen und Europäer.",TOP 21 Arbeitsprogramm der EU-Kommission 2017,2918,speech,18
33,162343,33,213,,,,,,Beifall bei Abgeordneten der LINKEN,TOP 21 Arbeitsprogramm der EU-Kommission 2017,2918,poi,18
34,162344,34,213,Annalena Baerbock [BÜNDNIS 90/DIE GRÜNEN],Annalena Baerbock,annalena-baerbock,410.0,gruene,Eine ganz gewagte These!,TOP 21 Arbeitsprogramm der EU-Kommission 2017,2918,poi,18
35,162345,35,213,Dr. Gregor Gysi (DIE LINKE),Dr. Gregor Gysi,gregor-gysi,550.0,linke,"Die EU ist undemokratisch. Ich werde Ihnen auch sagen, warum die EU undemokratisch ist: weil sie einen Regierungsföderalismus begründet hat. Man interessiert sich diesbezüglich weder für das nationale Parlament noch für das Europäische Parlament.",TOP 21 Arbeitsprogramm der EU-Kommission 2017,2918,speech,18
36,162346,36,213,Annalena Baerbock [BÜNDNIS 90/DIE GRÜNEN],Annalena Baerbock,annalena-baerbock,410.0,gruene,Ist Ihre Rede gegen die EU nicht unsozial und undemokratisch?,TOP 21 Arbeitsprogramm der EU-Kommission 2017,2918,poi,18
37,162347,37,213,Dr. Gregor Gysi (DIE LINKE),Dr. Gregor Gysi,gregor-gysi,550.0,linke,"Ich nenne Ihnen ein Beispiel: Weil Erdogan die Türkei von einer Demokratie zu einer Despotie und zu einer Diktatur entwickelt, hat das Europäische Parlament beschlossen, die Beitrittsverhandlungen auszusetzen. Was sagt die Kanzlerin? Nein, wir verhandeln weiter. Vielleicht machen wir kein neues Kapitel. - Es interessiert sie einfach nicht. Das bekommen doch die Europäerinnen und Europäer mit und vertrauen deshalb der Struktur nicht mehr.

Außerdem ist alles wirr. Stichwort „Europarecht“ - Sie haben es erwähnt -: Jeder Bürgermeister stützt sich auf das Europarecht. In der einen Hälfte der Fälle zu Recht, in der anderen Hälfte ist der Zusammenhang frei erfunden. So geht es nicht weiter. Die Leute verlieren jede Übersicht.

Nun will die EU auch noch militärisch werden. Ich sage Ihnen klipp und klar - auf den Ersatz nationaler Streitkräfte könnten wir uns verständigen; aber das kann man ja vergessen; das alles kommt hinzu -: Wir sind strikt dagegen, dass die Europäische Union invasionsfähig wird.",TOP 21 Arbeitsprogramm der EU-Kommission 2017,2918,speech,18
38,162348,38,213,,,,,,Beifall bei der LINKEN,TOP 21 Arbeitsprogramm der EU-Kommission 2017,2918,poi,18
39,162349,39,213,Dr. Gregor Gysi (DIE LINKE),Dr. Gregor Gysi,gregor-gysi,550.0,linke,"Aber nachdem ich das alles gesagt habe, muss ich Ihnen begründen, weshalb ich einen Neustart will und die EU retten will.",TOP 21 Arbeitsprogramm der EU-Kommission 2017,2918,speech,18
40,162350,40,213,Annalena Baerbock [BÜNDNIS 90/DIE GRÜNEN],Annalena Baerbock,annalena-baerbock,410.0,gruene,Ach! Sie machen doch die EU fertig!,TOP 21 Arbeitsprogramm der EU-Kommission 2017,2918,poi,18
41,162351,41,213,Zuruf von der CDU/CSU,von der CDU/CSU,von-der-cdu-csu,,cducsu,Wie altruistisch!,TOP 21 Arbeitsprogramm der EU-Kommission 2017,2918,poi,18
42,162352,42,213,Dr. Gregor Gysi (DIE LINKE),Dr. Gregor Gysi,gregor-gysi,550.0,linke,"- Es ist ja scheinbar ein Widerspruch: Erst mache ich die EU fertig, und dann kommt das Gegenteil. Aber ich bin eben ein Dialektiker. Das kennen Sie nicht.

Erster Grund: die Jugend. Die Jugend ist europäisch aufgewachsen. Die meisten Jugendlichen sprechen ganz gut Englisch. Die haben mal hier, mal dort gearbeitet, sie haben mal hier, mal dort studiert etc. Stellen Sie sich doch mal vor, es gäbe wieder die alten Nationalstaaten mit Grenzbäumen. Dann bestünde irgendwann wieder die Notwendigkeit, einen Pass zu haben. Gibt es irgendwo einen Konflikt, dann wird eine Visumspflicht eingeführt. Stellen Sie sich mal vor: Zwei Monate bevor Sie nach Paris fliegen wollen, müssen Sie erst einmal ein Visum in der französischen Botschaft beantragen! Das ist für uns Alte ja kaum vorstellbar, aber für die Jungen eine blanke Katastrophe. Das ist der erste Grund, weshalb das nicht geht.",TOP 21 Arbeitsprogramm der EU-Kommission 2017,2918,speech,18
43,162353,43,213,Michael Grosse-Brömer [CDU/CSU],Michael Grosse-Brömer,michael-grosse-bromer,284.0,cducsu,Sie werden echt so langsam zum Märchenonkel!,TOP 21 Arbeitsprogramm der EU-Kommission 2017,2918,poi,18
44,162354,44,213,Dr. Gregor Gysi (DIE LINKE),Dr. Gregor Gysi,gregor-gysi,550.0,linke,"Zweiter Grund. Die weltpolitische Relevanz der Nationalstaaten können Sie vergessen. Was glauben Sie, welche Rolle Luxemburg im Nahostkonflikt spielt? Nur als EU sind wir ein Faktor.

Dritter Grund. Ökonomisch haben wir als Nationalstaaten im Verhältnis zu China und den USA nichts zu bestellen. Nur als EU sind wir ein Faktor.

Vierter Grund. Die deutsche Nationenbildung kam, weil wir schlechte Revolutionäre sind - ich erinnere an 1848 -, ja erst 1871. Zu spät! Da war die koloniale Aufteilung der Welt abgeschlossen, was wir heute begrüßen können; denn wir müssen uns nicht ganz so oft entschuldigen wie andere. Wir bekamen nur einen kleinen Teil Afrikas. Die Herrschenden fühlten sich jedoch zu kurz gekommen. Sie hatten nicht den Zugang zu Rohstoffen, konnten die Leute nicht so ausbeuten wie andere. Deshalb gab es immer wieder diesen deutschen Sonderweg, den Versuch der Neuordnung der Welt. Erster Weltkrieg, Zweiter Weltkrieg - gescheitert. Eine Schlussfolgerung bestand darin, Deutschland international zu verankern. Ich will nicht zurück zum alten deutschen Nationalstaat.",TOP 21 Arbeitsprogramm der EU-Kommission 2017,2918,speech,18
45,162355,45,213,Annalena Baerbock [BÜNDNIS 90/DIE GRÜNEN],Annalena Baerbock,annalena-baerbock,410.0,gruene,Es klingt aber manchmal so!,TOP 21 Arbeitsprogramm der EU-Kommission 2017,2918,poi,18
46,162356,46,213,Christian Petry [SPD],Christian Petry,christian-petry,277.0,spd,Was denn jetzt?,TOP 21 Arbeitsprogramm der EU-Kommission 2017,2918,poi,18
47,162357,47,213,Dr. Gregor Gysi (DIE LINKE),Dr. Gregor Gysi,gregor-gysi,550.0,linke,"Es gibt wieder Rechte, die davon träumen, die Einflusssphären zu erweitern. Genau diesen deutschen Sonderweg möchte ich für immer ausschließen. Auch deshalb will ich die Verankerung in der Europäischen Union.",TOP 21 Arbeitsprogramm der EU-Kommission 2017,2918,speech,18
48,162358,48,213,,,,,,Beifall bei der LINKEN,TOP 21 Arbeitsprogramm der EU-Kommission 2017,2918,poi,18
49,162359,49,213,Dr. Gregor Gysi (DIE LINKE),Dr. Gregor Gysi,gregor-gysi,550.0,linke,"Der fünfte und letzte Grund ist ganz einfach: Es gab noch nie zwischen zwei Mitgliedsländern der Europäischen Union einen Krieg, während vorher die ganze europäische Geschichte durch Kriege zwischen diesen Staaten gekennzeichnet war.

Vor diesem Hintergrund sage ich Ihnen zum Schluss: Wenn Sie nicht ernsthaft für eine solidarische, sozial gerechte, demokratische, transparente, unbürokratische und unmilitärische Europäische Union streiten, wird die Rechtsentwicklung, die wir in den USA, in Polen, in Ungarn, in Finnland, in Dänemark, in Frankreich und in Deutschland erleben, zunehmen. Wenn wir sie hier in Deutschland wirksam bekämpfen, dann können wir sie auch in Europa bekämpfen.",TOP 21 Arbeitsprogramm der EU-Kommission 2017,2918,speech,18
50,162360,50,213,,,,,,Beifall bei der LINKEN,TOP 21 Arbeitsprogramm der EU-Kommission 2017,2918,poi,18
51,162361,51,213,Präsident Dr. Norbert Lammert,Dr. Norbert Lammert,norbert-lammert,494.0,,Für die CDU/CSU-Fraktion hat nun die Kollegin Groden-Kranich das Wort.,TOP 21 Arbeitsprogramm der EU-Kommission 2017,2918,chair,18
52,162362,52,213,,,,,,Beifall bei der CDU/CSU,TOP 21 Arbeitsprogramm der EU-Kommission 2017,2918,poi,18
53,162363,53,213,Ursula Groden-Kranich (CDU/CSU),Ursula Groden-Kranich,ursula-groden-kranich,72.0,cducsu,"Herr Präsident! Liebe Kolleginnen und Kollegen! Herr Gysi, die Linke zitiert immer dann Bibelverse, wenn es opportun ist.",TOP 21 Arbeitsprogramm der EU-Kommission 2017,2918,speech,18
54,162364,54,213,Dr. Petra Sitte [DIE LINKE],Dr. Petra Sitte,petra-sitte,319.0,linke,Die CDU gar nicht!,TOP 21 Arbeitsprogramm der EU-Kommission 2017,2918,poi,18
55,162365,55,213,Ursula Groden-Kranich (CDU/CSU),Ursula Groden-Kranich,ursula-groden-kranich,72.0,cducsu,"Wenn wir auf kommunaler Ebene christliche Kitas oder Schulen unterstützen, dann ducken Sie sich ganz schnell weg.",TOP 21 Arbeitsprogramm der EU-Kommission 2017,2918,speech,18
56,162366,56,213,,,,,,Beifall bei der CDU/CSU,TOP 21 Arbeitsprogramm der EU-Kommission 2017,2918,poi,18
57,162367,57,213,Zuruf von der LINKEN,von der LINKEN,von-der-linken,,linke,Quatsch!,TOP 21 Arbeitsprogramm der EU-Kommission 2017,2918,poi,18
58,162368,58,213,Ursula Groden-Kranich (CDU/CSU),Ursula Groden-Kranich,ursula-groden-kranich,72.0,cducsu,"Das dominierende Thema meiner ersten vier Jahre im Deutschen Bundestag und im EU-Ausschuss war die Krisenbewältigung. Die erste Sondersitzung meiner Mandatszeit thematisierte die dramatische Situation in der Ukraine. Es folgten zahllose Unterrichtungen zur Lage in Griechenland. Und unser Kontinent sah sich mit der größten Flüchtlingswelle seit dem Ende des Zweiten Weltkriegs konfrontiert. Als wäre das noch nicht genug, beschäftigen wir uns künftig zusätzlich mit den Fragen, welche der Brexit für uns aufwirft. Auch bei Gesprächen in Brüssel dominierten bislang Krisenbewältigung und Schadensbegrenzung. Europa täte es gut, wenn wir uns deutlich häufiger mit unseren Erfolgen und der Schönheit unseres gemeinsamen europäischen Projekts beschäftigen würden.",TOP 21 Arbeitsprogramm der EU-Kommission 2017,2918,speech,18
59,162369,59,213,,,,,,Beifall bei der CDU/CSU,TOP 21 Arbeitsprogramm der EU-Kommission 2017,2918,poi,18
60,162370,60,213,Ursula Groden-Kranich (CDU/CSU),Ursula Groden-Kranich,ursula-groden-kranich,72.0,cducsu,"Leider wird das Arbeitsprogramm der EU-Kommission für das Jahr 2017 diesem Anspruch nicht wirklich gerecht. Überschrieben ist es mit „Für ein Europa, das schützt, stärkt und verteidigt“, und genau das sind die Bereiche, in denen Europa zu alter Stärke zurückfinden muss.

Anfang dieser Woche wählten die Kolleginnen und Kollegen im Europäischen Parlament Antonio Tajani zu ihrem neuen Präsidenten. Mit ihm haben sich die Abgeordneten abermals für einen überzeugten und leidenschaftlichen Europäer entschieden.",TOP 21 Arbeitsprogramm der EU-Kommission 2017,2918,speech,18
