,id,profile_url,sequence,sitzung,speaker,speaker_cleaned,speaker_fp,speaker_key,speaker_party,text,top,top_id,type,wahlperiode
212,794586,https://www.abgeordnetenwatch.de/profile/uwe-kekeritz/archive/215289,212,242,Uwe Kekeritz (BÜNDNIS 90/DIE GRÜNEN),Uwe Kekeritz,uwe-kekeritz,1467,gruene,"Herr Staatssekretär, ich wundere mich jetzt über Ihre Detailkenntnisse. Im Vertrag steht, dass dieses Projekt erst im Jahr 2020/21 gemonitort wird. Das heißt, es sind zehn Jahre, die nicht gemonitort werden. Arbeitsplätze - das haben Sie angesprochen - sollen geschaffen werden. 1 600 wurden in Sambia versprochen. Realisiert wurden 208 - immerhin: 208 Arbeitsplätze. In der Kalkulation vergessen Sie aber immer, zu sagen, wie viele Existenzen Sie durch diese Landraubprojekte vernichten. Man muss wissen, dass ungefähr 20 000 Familien dort gelebt haben und auch leben konnten, was sie jetzt nicht mehr können.

Dazu meine Frage. Es ist bekannt geworden, dass im Jahr 2016 Zinsen in Höhe von 6,1 Millionen US-Dollar aus Afrika in diesen Fonds nach Luxemburg geflossen sind. Für die gesamte Zeit, also von 2011 bis 2016, wurden aber nur Dividenden in Höhe von 3,2 Millionen US-Dollar ausgezahlt. Natürlich ist es so, dass die Privaten höhere Dividendenansprüche haben als die staatlichen Stellen. Aber wie wird eigentlich die Differenz zwischen Dividendenauszahlung und Zinseinnahmen verwaltet? Wie werden diese Überschüsse verrechnet? Oder werden davon Kosten beglichen, die dieser Fonds hat? Wenn das so ist, dann muss dieser Fonds extrem gut bezahlte Jobs haben.",TOP 2 Fragestunde,15409,speech,18
213,794587,https://www.abgeordnetenwatch.de/profile/hans-joachim-fuchtel/archive/214879,213,242,"Hans-Joachim Fuchtel, Parl. Staatssekretär beim Bundesminister für wirtschaftliche Zusammenarbeit und Entwicklung",Hans-Joachim Fuchtel,hans-joachim-fuchtel,1600,,"Herr Kollege, das kann ich Ihnen jetzt aus dem Stand beim besten Willen nicht in jedem Detail beantworten;",TOP 2 Fragestunde,15409,speech,18
214,794588,https://www.abgeordnetenwatch.de/profile/uwe-kekeritz/archive/215289,214,242,Uwe Kekeritz [BÜNDNIS 90/DIE GRÜNEN],Uwe Kekeritz,uwe-kekeritz,1467,gruene,Aber schriftlich geht es!,TOP 2 Fragestunde,15409,poi,18
215,794589,https://www.abgeordnetenwatch.de/profile/hans-joachim-fuchtel/archive/214879,215,242,"Hans-Joachim Fuchtel, Parl. Staatssekretär beim Bundesminister für wirtschaftliche Zusammenarbeit und Entwicklung",Hans-Joachim Fuchtel,hans-joachim-fuchtel,1600,,"das muss ich Ihnen schriftlich nachliefern, was ich gern tue. Ich könnte Ihnen jetzt noch die Proportionen zwischen der privaten Seite und der öffentlichen aufzeigen, aber das tue ich dann auch im Zusammenhang mit meiner schriftlichen Mitteilung.",TOP 2 Fragestunde,15409,speech,18
216,794590,https://www.abgeordnetenwatch.de/profile/uwe-kekeritz/archive/215289,216,242,Uwe Kekeritz [BÜNDNIS 90/DIE GRÜNEN],Uwe Kekeritz,uwe-kekeritz,1467,gruene,Aber Sie wissen: Ich weiß Bescheid!,TOP 2 Fragestunde,15409,poi,18
217,794591,https://www.abgeordnetenwatch.de/profile/edelgard-bulmahn,217,242,Vizepräsidentin Dr. h. c. Edelgard Bulmahn,Dr. h. c. Edelgard Bulmahn,edelgard-bulmahn,1856,,"Der Staatssekretär hat zugesagt, dass die Antwort schriftlich nachgeliefert wird.

Damit, liebe Kollegen, verlassen wir diesen Geschäftsbereich und gehen zum Geschäftsbereich der Bundeskanzlerin und des Bundeskanzleramtes über. Hier übernimmt die Beantwortung der Fragen die Staatsministerin Professor Monika Grütters.

Ich rufe die Frage 15 der Abgeordneten Tabea Rößner auf:

Wann wird die Bundesregierung den laut Beschlusslage des Deutschen Bundestages alle vier Jahre vorzulegenden und seit dem Jahr 2008 nicht mehr vorgelegten Medien- und Kommunikationsbericht vorlegen, damit noch in dieser Wahlperiode parlamentarisch über die Situation der Medienlandschaft beraten werden kann, und falls dieser Bericht nicht mehr bis zum Beginn der parlamentarischen Sommerpause vorgelegt werden kann, was sind die Gründe für den Verzug?

Frau Staatsministerin.",TOP 2 Fragestunde,15409,chair,18
218,794592,https://www.abgeordnetenwatch.de/profile/monika-grutters/archive/214612,218,242,"Monika Grütters, Staatsministerin bei der Bundeskanzlerin",Monika Grütters,monika-grutters,1815,,"So wie sich eben die grüne Kollegin Keul über das Unionsinteresse an Wölfen gewundert hat, bin ich ein bisschen erstaunt darüber, liebe Frau Kollegin Rößner, dass Sie ausgerechnet die Gelegenheit der letzten Fragestunde dieser Legislaturperiode nutzen, um sich nach dem Medien- und Kommunikationsbericht der Bundesregierung zu erkundigen, weil Ihre Fraktion bisher wenig Interesse daran gezeigt hat; zumindest war ein solches Interesse für mich nicht erkennbar.",TOP 2 Fragestunde,15409,speech,18
219,794593,https://www.abgeordnetenwatch.de/profile/uwe-kekeritz/archive/215289,219,242,Uwe Kekeritz [BÜNDNIS 90/DIE GRÜNEN],Uwe Kekeritz,uwe-kekeritz,1467,gruene,Dieser Kommentar steht Ihnen nicht zu! Sie haben Fragen zu beantworten!,TOP 2 Fragestunde,15409,poi,18
220,794594,https://www.abgeordnetenwatch.de/profile/monika-grutters/archive/214612,220,242,"Monika Grütters, Staatsministerin bei der Bundeskanzlerin",Monika Grütters,monika-grutters,1815,,"Aber gerade heute, wo das Thema jetzt, um 15 Uhr, auf der Tagesordnung des Kulturausschusses steht, freue ich mich natürlich über Ihr hiesiges vorgelagertes Interesse.

Zur Sache: Die Zeitspanne zwischen den Medienberichten variiert stark, und das hat gute Gründe. Der letzte Bericht stammt aus dem Jahr 2008. In der 17. Legislaturperiode hat es die Enquete-Kommission „Internet und digitale Gesellschaft“ gegeben. Deshalb hat der Bundestag damals auf einen eigenen Medien- und Kommunikationsbericht verzichtet, aber als Ergebnis der Enquete-Kommission eine Bund-Länder-Medienkommission zur Medienkonvergenz eingesetzt. Diese hat von 2015 bis 2016 getagt. Wir hielten es - übrigens in Abstimmung mit den MdB - für richtig, für inhaltlich ergiebig und aus Respekt vor den Ergebnissen der Bund-Länder-Kommission zur Medienkonvergenz auch für geboten, den Medien- und Kommunikationsbericht erst fertigzustellen, wenn die Ergebnisse dieser Kommission vorliegen. Der Abschlussbericht der Kommission, der schon im Herbst 2016 vorgelegt wurde und der Leitlinien für die Weiterentwicklung der Medienordnung in Deutschland aufzeigt, rechtfertigt meines Erachtens dieses Vorgehen und erfüllt die hohen Erwartungen, die mit der Einsetzung der Kommission von Bund und Ländern einhergingen. Übrigens war daran Baden-Württemberg - und damit auch die Grünen - beteiligt.

Wir haben die, wie Sie wissen, erforderliche Ausschreibung für das Gutachten, das wie üblich die wissenschaftliche Basis für den Medien- und Kommunikationsbericht ist, im Lichte der Ergebnisse der Bund-Länder-Kommission formuliert. Dies haben wir ohne Zeitverlust bewerkstelligt, allerdings wohlwissend, dass die Vorlage mit dem Ende der Legislaturperiode kollidiert.

Die Bund-Länder-Kommission zur Medienkonvergenz hat übrigens 2015 ihre Arbeit aufgenommen. Es wäre gut gewesen, im Ausschuss oder auch an dieser Stelle einmal die Frage zu erörtern: Was erwarten wir von den Ergebnissen der Kommission für den Bericht?",TOP 2 Fragestunde,15409,speech,18
221,794595,https://www.abgeordnetenwatch.de/profile/edelgard-bulmahn,221,242,Vizepräsidentin Dr. h. c. Edelgard Bulmahn,Dr. h. c. Edelgard Bulmahn,edelgard-bulmahn,1856,,"Frau Kollegin, Sie haben das Wort.",TOP 2 Fragestunde,15409,chair,18
222,794596,https://www.abgeordnetenwatch.de/profile/tabea-rosner/archive/215245,222,242,Tabea Rößner (BÜNDNIS 90/DIE GRÜNEN),Tabea Rößner,tabea-roßner,1399,gruene,"Vielen Dank, Frau Staatsministerin Grütters. Ich halte Ihre Vorbemerkung vonseiten der Bundesregierung für nicht angemessen, was ich hier anmerken möchte; denn schließlich gab es verschiedene Anfragen von verschiedenen Fraktionen, auch von unserer parlamentarischen Geschäftsführung bereits vor zwei Jahren, wann dieser Bericht vorgelegt wird. Wir haben in der Obleuterunde des Kultur- und Medienausschusses seit Anfang des Jahres immer wieder darüber gesprochen - im Übrigen von Kollegen Ihrer Fraktion -, dass er noch vor der Sommerpause vorliegen und besprochen werden soll. Deshalb verstehe ich Ihre Vorbemerkung nicht.

Der angemahnte Bericht unterscheidet sich von dem der Bund-Länder-Kommission zur Medienkonvergenz, weil es darum geht, eine Bewertung abzugeben über die zunehmende Medienkonzentration, über die Medienlandschaft, über die Medienvielfalt in diesem Land, was für unseren demokratisch-freiheitlichen Diskursprozess und Meinungsbildungsprozess von essenzieller Bedeutung ist. Ich verstehe nicht ganz, warum Sie sich über den Beschluss des Bundestages, alle vier Jahre einen solchen Bericht vorzulegen, hinwegsetzen. Daher die Frage: In welchem Stadium befindet sich der Bericht, und können nicht bereits fertiggestellte Teile, die über das genannte Gutachten des Hans-Bredow-Instituts hinausgehen, noch vorgelegt werden?",TOP 2 Fragestunde,15409,speech,18
223,794597,https://www.abgeordnetenwatch.de/profile/monika-grutters/archive/214612,223,242,"Monika Grütters, Staatsministerin bei der Bundeskanzlerin",Monika Grütters,monika-grutters,1815,,"Wie gesagt, das von der Bundesregierung beauftragte wissenschaftliche Gutachten des Hans-Bredow-Institutes ist die Grundlage. Jetzt wird das Gutachten ausgewertet. Uns ist dabei wichtig, dass das nicht einseitig durch BKM geschieht, sondern im Austausch mit Ihnen. Wie Sie wissen, liegt das Gutachten seit April 2017 vor. Wir haben es am 6. Juni an den Kulturausschuss gesandt, versehen mit einer fünfseitigen aus unserer Sicht ersten Auswertung und politischen Bewertung. Seit dem 27. Juni, also seit gestern, ist das Gutachten online.

Wir wollen diese Themen gemeinsam mit dem Bundestag erörtern. Wir können natürlich auch eine einseitige, regierungsseitige politische Bewertung vornehmen. Das war aber bislang unüblich und soll es auch künftig sein. Es ist klar: Das fällt in die Diskontinuität dieser Legislaturperiode. Eine gemeinsame Erörterung erscheint uns aber wichtiger, als allein eine regierungsamtliche politische Bewertung vorzunehmen. Das ist im Übrigen auch der Grund, warum das Thema jetzt im Kulturausschuss des Deutschen Bundestages behandelt wird. Die SPD-Fraktion macht übrigens auch einen Medienpolitischen Dialog dazu; das durfte ich wohl weitersagen.

Die Einordnung des Themas war, denke ich, notwendig. Ich hätte es überhaupt nicht nachvollziehen können, wenn wir die Ergebnisse der Bund-Länder-Kommission zur Medienkonvergenz in keiner Weise in diesem Bericht gewürdigt hätten.",TOP 2 Fragestunde,15409,speech,18
224,794598,https://www.abgeordnetenwatch.de/profile/edelgard-bulmahn,224,242,Vizepräsidentin Dr. h. c. Edelgard Bulmahn,Dr. h. c. Edelgard Bulmahn,edelgard-bulmahn,1856,,Frau Rößner.,TOP 2 Fragestunde,15409,chair,18
225,794599,https://www.abgeordnetenwatch.de/profile/tabea-rosner/archive/215245,225,242,Tabea Rößner (BÜNDNIS 90/DIE GRÜNEN),Tabea Rößner,tabea-roßner,1399,gruene,"Ich habe die Nachfrage, wann Sie zu der Erkenntnis gekommen sind, dass Sie diesen Bericht in diesem Jahr nicht mehr vorlegen, nachdem es in der Vergangenheit in entsprechenden Antworten immer wieder Vertröstungen gab, dass der Bericht noch kommen wird, und wir im Kultur- und Medienausschuss fest damit gerechnet haben, den Bericht noch vor der Sommerpause diskutieren zu können.",TOP 2 Fragestunde,15409,speech,18
226,794600,https://www.abgeordnetenwatch.de/profile/monika-grutters/archive/214612,226,242,"Monika Grütters, Staatsministerin bei der Bundeskanzlerin",Monika Grütters,monika-grutters,1815,,"Wenn die wissenschaftliche Grundlage erst im April vorliegt, dann kann sich jeder, der mitreden will, ausrechnen, dass das bis zur Sommerpause nur in dem Maße geht. Sie haben das Thema auch nicht eher auf die Tagesordnung des Kulturausschusses gesetzt.",TOP 2 Fragestunde,15409,speech,18
227,794601,https://www.abgeordnetenwatch.de/profile/tabea-rosner/archive/215245,227,242,Tabea Rößner [BÜNDNIS 90/DIE GRÜNEN],Tabea Rößner,tabea-roßner,1399,gruene,Es geht um den Bericht der Bundesregierung!,TOP 2 Fragestunde,15409,poi,18
228,794602,https://www.abgeordnetenwatch.de/profile/monika-grutters/archive/214612,228,242,"Monika Grütters, Staatsministerin bei der Bundeskanzlerin",Monika Grütters,monika-grutters,1815,,- Ja. Wir haben eine erste fünfseitige Einordnung vorgenommen; die liegt Ihnen seit dem 6. Juni vor.,TOP 2 Fragestunde,15409,speech,18
229,794603,https://www.abgeordnetenwatch.de/profile/tabea-rosner/archive/215245,229,242,Tabea Rößner [BÜNDNIS 90/DIE GRÜNEN],Tabea Rößner,tabea-roßner,1399,gruene,Das ist kein Bericht!,TOP 2 Fragestunde,15409,poi,18
230,794604,https://www.abgeordnetenwatch.de/profile/monika-grutters/archive/214612,230,242,"Monika Grütters, Staatsministerin bei der Bundeskanzlerin",Monika Grütters,monika-grutters,1815,,"Ich denke, schneller war es nicht möglich.

Ich habe Ihnen im Übrigen die drei großen Themenblöcke genannt, die aus unserer Sicht wichtig sind: Regulierung sozialer Netzwerke sowie Maßnahmen gegen Hasskriminalität, zukünftige Aufgabe der öffentlich-rechtlichen Grundversorgung, Sicherung vielfältiger Angebote von Qualitätsmedien. All das ist dem Ausschuss und seinen Mitgliedern am 6. Juni auf mehreren Seiten zugegangen. Wie gesagt, das wissenschaftliche Gutachten liegt Ihnen auch vor.",TOP 2 Fragestunde,15409,speech,18
231,794605,https://www.abgeordnetenwatch.de/profile/tabea-rosner/archive/215245,231,242,Tabea Rößner [BÜNDNIS 90/DIE GRÜNEN],Tabea Rößner,tabea-roßner,1399,gruene,Das ist kein Bericht!,TOP 2 Fragestunde,15409,poi,18
232,794606,https://www.abgeordnetenwatch.de/profile/monika-grutters/archive/214612,232,242,"Monika Grütters, Staatsministerin bei der Bundeskanzlerin",Monika Grütters,monika-grutters,1815,,"- Wir können den Bericht natürlich auch ohne Einbeziehung des Deutschen Bundestages erstellen. Ich glaube aber, dass das wesentlich unwürdiger gewesen wäre.",TOP 2 Fragestunde,15409,speech,18
233,794607,https://www.abgeordnetenwatch.de/profile/edelgard-bulmahn,233,242,Vizepräsidentin Dr. h. c. Edelgard Bulmahn,Dr. h. c. Edelgard Bulmahn,edelgard-bulmahn,1856,,"Liebe Kollegin, Ihre Fragen sind damit beantwortet.

Die Frage 16 der Abgeordneten Martina Renner wird schriftlich beantwortet.

Ich leite dann zum nächsten Geschäftsbereich über, nämlich zum Geschäftsbereich des Auswärtigen Amts. Hier übernimmt der Staatsminister Michael Roth die Beantwortung der Fragen.

Die Fragen 17 und 18 des Abgeordneten Özcan Mutlu, die Frage 19 der Abgeordneten Erika Steinbach und die Frage 20 des Abgeordneten Andrej Hunko werden schriftlich beantwortet.

Ich rufe Frage 21 der Abgeordneten Heike Hänsel auf:

Über welche eigenen (auch nachrichtendienstlichen) oder auch im Rahmen der NATO erhaltenen Erkenntnisse verfügt die Bundesregierung über den Abschuss eines Kampfflugzeuges der syrischen Luftwaffe durch das US-Militär nahe Rakka?",TOP 2 Fragestunde,15409,chair,18
234,794608,https://www.abgeordnetenwatch.de/profile/michael-roth/archive/216871,234,242,"Michael Roth, Staatsminister im Auswärtigen Amt",Michael Roth,michael-roth,1687,,"Vielen Dank, Frau Präsidentin. - Frau Kollegin Hänsel, der Bundesregierung liegen über den Abschuss eines syrischen Kampfflugzeugs durch die Vereinigten Staaten von Amerika keine eigenen Erkenntnisse und auch keine Erkenntnisse im Rahmen der NATO, die wir möglicherweise erhalten haben könnten, vor. Die Informationen, die uns zur Verfügung stehen, sind jene, zu denen auch Sie Zugang haben. Sie finden sich nämlich in der auf einer Website veröffentlichten Stellungnahme der Anti-IS-Koalition.

Die sogenannte Combined Joint Task Force der Operation Inherent Resolve hat sich nach dem Vorfall öffentlich dazu geäußert und Stellung bezogen. Wie gesagt, Sie können diese Stellungnahme lesen; sie ist relativ ausführlich. Demnach erfolgte der Abschuss des Kampfjets, nachdem dieser Kampfjet Einheiten der von der Anti-IS-Koalition unterstützten Syrian Democratic Forces angegriffen haben soll.",TOP 2 Fragestunde,15409,speech,18
235,794609,https://www.abgeordnetenwatch.de/profile/edelgard-bulmahn,235,242,Vizepräsidentin Dr. h. c. Edelgard Bulmahn,Dr. h. c. Edelgard Bulmahn,edelgard-bulmahn,1856,,Frau Hänsel.,TOP 2 Fragestunde,15409,chair,18
236,794610,https://www.abgeordnetenwatch.de/profile/heike-hansel/archive/215687,236,242,Heike Hänsel (DIE LINKE),Heike Hänsel,heike-hansel,1594,linke,"Danke schön. - Herr Staatsminister, die NATO ist ja mittlerweile Teil der Anti-IS-Koalition. Im Rahmen dessen muss es ja einen Informationsaustausch geben. Die Bundeswehr hat ja, wie wir alle wissen, bisher Tornados in Incirlik stationiert - sie werden jetzt nach Jordanien verlegt -, die Aufklärung betreiben. Insofern möchte ich nachhaken. Es kann ja wohl nicht der Ernst sein, dass die Bundesregierung über keine umfassenderen Erkenntnisse verfügt als jene, die auf dieser Website zu finden sind; es erschreckt mich eigentlich schon.

In diesem Zusammenhang möchte ich festhalten, dass es dazu widerstreitende Darstellungen gibt. Die syrische Luftwaffe sagt, dass sie nicht SDF-Kämpfer bombardiert, sondern die IS-Stellung bei al-Rusafa angegriffen haben. Ist Ihnen darüber etwas bekannt?",TOP 2 Fragestunde,15409,speech,18
237,794611,https://www.abgeordnetenwatch.de/profile/michael-roth/archive/216871,237,242,"Michael Roth, Staatsminister im Auswärtigen Amt",Michael Roth,michael-roth,1687,,"Liebe Frau Kollegin Hänsel, Ihre Nachfrage gibt mir Gelegenheit, klarzustellen, dass die deutschen Tornados vom 19. bis zum 22. Juni keine Aufklärungsflüge durchgeführt haben. Insofern liegen uns logischerweise keine eigenen Erkenntnisse vor. Das war auch ein Beitrag zur Deeskalation. Wir haben die Flugzeuge erst wieder seit dem 24. Juni eingesetzt",TOP 2 Fragestunde,15409,speech,18
238,794612,https://www.abgeordnetenwatch.de/profile/heike-hansel/archive/215687,238,242,Heike Hänsel [DIE LINKE],Heike Hänsel,heike-hansel,1594,linke,Aha!,TOP 2 Fragestunde,15409,poi,18
239,794613,https://www.abgeordnetenwatch.de/profile/michael-roth/archive/216871,239,242,"Michael Roth, Staatsminister im Auswärtigen Amt",Michael Roth,michael-roth,1687,,"- Entschuldigung, seit dem 23. Juni - und seit dem 24. Juni auch über dem östlichen Teil Syriens.",TOP 2 Fragestunde,15409,speech,18
240,794614,https://www.abgeordnetenwatch.de/profile/edelgard-bulmahn,240,242,Vizepräsidentin Dr. h. c. Edelgard Bulmahn,Dr. h. c. Edelgard Bulmahn,edelgard-bulmahn,1856,,Frau Hänsel.,TOP 2 Fragestunde,15409,chair,18
241,794615,https://www.abgeordnetenwatch.de/profile/heike-hansel/archive/215687,241,242,Heike Hänsel (DIE LINKE),Heike Hänsel,heike-hansel,1594,linke,"Ich habe noch eine generelle Frage zu dem Abschuss des syrischen Kampfflugzeugs und auch iranischer Drohnen durch das US-Militär in Syrien. Das ist ja eine äußerst gefährliche Situation und Zuspitzung, zumal die russische Seite die Kooperation mit den USA aufgekündigt hat. Im Rahmen des Memorandums zur Flugsicherheit soll solchen Vorfällen vorgebeugt und sich umfassend über die Flugbewegungen ausgetauscht werden. Russland wirft den USA vor, das Memorandum gebrochen zu haben, indem sie den Angriff vorher nicht angekündigt, sondern sofort reagiert haben. Was macht die Bundesregierung ganz konkret, um eine weitere Zuspitzung in dieser Region - womöglich greifen sich russische und US-amerikanische Kampfflugzeuge gegenseitig an oder das russische und das US-amerikanische Militär geraten in eine direkte militärische Auseinandersetzung mit weitreichenden Folgen - im Rahmen der NATO zu verhindern?",TOP 2 Fragestunde,15409,speech,18
242,794616,https://www.abgeordnetenwatch.de/profile/michael-roth/archive/216871,242,242,"Michael Roth, Staatsminister im Auswärtigen Amt",Michael Roth,michael-roth,1687,,"Frau Kollegin Hänsel, der Zwischenfall zeigt erneut, wie schwierig und komplex die Lage ist und wie schwierig auch der notwendige Kampf gegen die Terrororganisation „Islamischer Staat“ ist.

Ich will noch einmal klarstellen: Wir führen eine militärische Auseinandersetzung gegen eine Terrororganisation, aber nicht gegen einen Staat und auch nicht gegen demokratische Kräfte, die in den sogenannten Syrian Democratic Forces zusammengefasst werden.

Sie haben darüber hinaus darauf hingewiesen, dass Russland infolge des Abschusses des Flugzeuges öffentlich erklärt hat, das sogenannte Deconflicting einzustellen. Wir fühlen uns - und damit meine ich die gesamte Anti-IS-Koalition - weiterhin dem Prinzip von Deconflicting verpflichtet. Ich habe auch den Eindruck, dass das nach wie vor im Interesse aller Beteiligten und aller Parteien ist.",TOP 2 Fragestunde,15409,speech,18
243,794617,https://www.abgeordnetenwatch.de/profile/edelgard-bulmahn,243,242,Vizepräsidentin Dr. h. c. Edelgard Bulmahn,Dr. h. c. Edelgard Bulmahn,edelgard-bulmahn,1856,,"Liebe Kolleginnen und Kollegen, damit sind die Fragen zu diesem Geschäftsbereich abgeschlossen.

Wir kommen zum Geschäftsbereich des Bundesministeriums des Innern. Hier übernimmt die Beantwortung der Fragen der Parlamentarische Staatssekretär Dr. Günter Krings.

Die Frage 22 des Kollegen Oliver Krischer wird schriftlich beantwortet.

Ich rufe die Frage 23 des Kollegen Volker Beck auf:

Welche straf- und dienstrechtlichen Maßnahmen prüft bzw. ergreift die Bundespolizeidirektion in Pirna im Zusammenhang mit dem an die Öffentlichkeit gelangten Protokoll der WhatsApp-Gruppe der AfD Sachsen-Anhalt, ausweislich dessen mindestens ein mutmaßlicher Bundespolizist Äußerungen, die der freiheitlichen demokratischen Ordnung zuwiderlaufen (zum Beispiel „nach der Machtübernahme Journalisten sieben“), getätigt haben soll (www.morgenpost.de/politik/article2l0986363/Bundespolizei-prueft-nach-AfD-Leak-Konsequenzen-fuer-Beamte.html; https://twitter.com/LarsWienand), und inwiefern plant bzw. ergreift die Bundesregierung Maßnahmen, um auf die verfassungswidrigen Äußerungen mutmaßlicher Bundespolizisten, die im Netz veröffentlicht worden sind (https://linksunten.indymedia.org/de/node/215841), zu reagieren?

Herr Staatssekretär, Sie haben das Wort.",TOP 2 Fragestunde,15409,chair,18
244,794618,https://www.abgeordnetenwatch.de/profile/gunter-krings/archive/214657,244,242,"Dr. Günter Krings, Parl. Staatssekretär beim Bundesminister des Innern",Dr. Günter Krings,gunter-krings,1766,,"Vielen Dank. - Frau Präsidentin! Meine Damen und Herren! Lieber Kollege Beck, die Bundespolizeidirektion Pirna hat unmittelbar nach Bekanntwerden des inkriminierten Chatverlaufs gegen einen Beamten der Bundespolizei wegen möglicher Verstöße gegen die politische Neutralitäts- und Mäßigungspflicht, gegen die Pflicht zum Bekenntnis zur und zum Eintreten für die freiheitliche demokratische Grundordnung sowie die Pflicht zu achtungs- und vertrauensgerechtem Verhalten innerhalb und außerhalb des Dienstes ein Disziplinarverfahren eingeleitet. In diesem Zusammenhang wird allerdings darauf hingewiesen, dass nach dem bisherigen Stand der Ermittlungen zu den 221 Seiten umfassenden Protokoll des WhatsApp-Chatverlaufes unter Beteiligung unterschiedlicher Personen die beispielhaft zitierte Äußerung „Nach der Machtübernahme Journalisten sieben“ - wir kennen sie aus der Presse - nicht von diesem Teilnehmer des WhatsApp-Chats stammt, der nach derzeitigen Erkenntnissen der Bundespolizei angehören könnte.

Über den Einzelfall hinaus bleibt festzuhalten - das ist mir besonders wichtig, Herr Kollege Beck -, dass weder die Bundespolizei noch das innerhalb der Bundesregierung für die Bundespolizei zuständige Bundesinnenministerium verfassungswidrige Äußerungen oder Verstöße gegen die politische Neutralitäts- und Mäßigungspflicht oder andere Pflichtverstöße ihrer Beamten tolerieren. Werden mögliche Verstöße bekannt, so werden - wie auch dieser Einzelfall zeigt - aufgrund sofort aufgenommener Ermittlungen etwaige disziplinarrechtliche Maßnahmen geprüft und gegebenenfalls Disziplinarverfahren eingeleitet. Weiter gehende Maßnahmen der Strafverfolgung obliegen den zuständigen Strafverfolgungsbehörden.",TOP 2 Fragestunde,15409,speech,18
245,794619,https://www.abgeordnetenwatch.de/profile/edelgard-bulmahn,245,242,Vizepräsidentin Dr. h. c. Edelgard Bulmahn,Dr. h. c. Edelgard Bulmahn,edelgard-bulmahn,1856,,Herr Beck.,TOP 2 Fragestunde,15409,chair,18
246,794620,https://www.abgeordnetenwatch.de/profile/volker-beck,246,242,Volker Beck (Köln) (BÜNDNIS 90/DIE GRÜNEN),Volker Beck,volker-beck,1874,gruene,"Können Sie denn eine Aussage darüber treffen, wem diese Aussage zuzuordnen ist?

Im wiederstand sind wir schon lange alle, aber wir haben uns bis jetzt klein und unauffällig gemacht, vor allem um uns und unsere familien und soziale Kontakte zu schützen ... Aber es wird sich zunehmend ändern und irgendwann nicht mehr so weitergehen. Ich hab schon lange keine lust mehr mich zu verstecken!

Dasselbe gilt für die Äußerung, die Sie teilweise zitiert haben und die ja nach dem „sieben“ wie folgt weiter geht: „Chefs sofort entlassen, volksfeindliche Medien verbieten“. Diese Äußerung ist von der Intention her ausdrücklich darauf ausgerichtet, die freiheitlich-demokratische Grundordnung, zu der die freie Presse gehört, zu untergraben.

Wird das Bundespolizisten zugeordnet oder welchen anderen Personen, die sich ja auch in dem Chat befanden? Man muss ja fragen: Hätten die das nicht aus dienstlichen Gründen melden bzw. anzeigen müssen? Denn hier besteht doch schon die Gefahr, dass das auf Straf- bzw. Gewalttaten ausgerichtet ist.",TOP 2 Fragestunde,15409,speech,18
