,id,profile_url,sequence,sitzung,speaker,speaker_cleaned,speaker_fp,speaker_key,speaker_party,text,top,top_id,type,wahlperiode
850,795224,https://www.abgeordnetenwatch.de/profile/hans-christian-strobele,850,242,Hans-Christian Ströbele (BÜNDNIS 90/DIE GRÜNEN),Hans-Christian Ströbele,hans-christian-strobele,1578,gruene,"Sie verstieß gegen Grundrechte, die hier in Deutschland gelten.

Und wer trägt die Verantwortung dafür? Die politische Verantwortung dafür trägt das Kanzleramt. Das Kanzleramt hat in der Kette der Aufsicht versagt. Das Kanzleramt wusste, was „Eikonal“ ist. Das Kanzleramt wusste, was der BND treibt. Das Kanzleramt hat das alles gedeckt.

Der schlimmste Augenblick in meinem Aktenstudium, in der jahrelangen Aufklärungsarbeit, war, als ich lesen musste, dass der BND selber der Auffassung war, dass das, was er dort treibt, auf gar keinen Fall dem deutschen Parlament und dem dafür berufenen Parlamentarischen Kontrollgremium mitgeteilt werden darf. Schlimmer geht es nicht.",TOP 4 Bericht des 1. Untersuchungsausschusses (NSA),15412,speech,18
851,795225,,851,242,,,,,,Beifall beim BÜNDNIS 90/DIE GRÜNEN und bei der LINKEN,TOP 4 Bericht des 1. Untersuchungsausschusses (NSA),15412,poi,18
852,795226,https://www.abgeordnetenwatch.de/profile/hans-christian-strobele,852,242,Hans-Christian Ströbele (BÜNDNIS 90/DIE GRÜNEN),Hans-Christian Ströbele,hans-christian-strobele,1578,gruene,"Das war die Katastrophe, die der BND selbst befürchtete. Schon da hätte man eigentlich aufhören können. Schon daraus ergibt sich, dass selbst der BND der Auffassung gewesen ist: Er tut unrecht. So einfach ist das.",TOP 4 Bericht des 1. Untersuchungsausschusses (NSA),15412,speech,18
853,795227,,853,242,,,,,,Beifall beim BÜNDNIS 90/DIE GRÜNEN und bei der LINKEN,TOP 4 Bericht des 1. Untersuchungsausschusses (NSA),15412,poi,18
854,795228,https://www.abgeordnetenwatch.de/profile/hans-christian-strobele,854,242,Hans-Christian Ströbele (BÜNDNIS 90/DIE GRÜNEN),Hans-Christian Ströbele,hans-christian-strobele,1578,gruene,"Falsch war auch, was die Gewaltigen in den USA bis hin zum Präsidenten immer wieder beteuert haben: Wir halten uns in Deutschland an Recht und Gesetz. - Das ist nicht richtig. Auch das wusste der BND. Das wussten die Verantwortlichen des BND, die in die USA gefahren sind, und das wusste auch das Kanzleramt. Denn wo steht im deutschen Gesetz geschrieben, dass das Handy der Kanzlerin abgehört werden darf? Wo steht im deutschen Gesetz geschrieben, dass beispielsweise Markus R. in Deutschland spionieren und selbst den Bundesnachrichtendienst ausspionieren darf? Dafür ist er zu einer Freiheitsstrafe von acht Jahren verurteilt worden. Welchen Beweis brauchten Sie noch dafür, dass die NSA-Gewaltigen bzw. Geheimdienstgewaltigen in den USA die Unwahrheit sagen?

Wenn Herr Clapper, der Anführer der Geheimdienste in den USA, vor dem US-Kongress gelogen und das anschließend sogar zugegeben hat, dann können Sie doch nicht nach Deutschland zurückkommen und sagen: „Die NSA sagt, sie richtet sich nach deutschem Recht und Gesetz“, wenn Sie es besser wissen. Sie haben die deutsche Bevölkerung irregeführt.",TOP 4 Bericht des 1. Untersuchungsausschusses (NSA),15412,speech,18
855,795229,,855,242,,,,,,Beifall beim BÜNDNIS 90/DIE GRÜNEN und bei der LINKEN,TOP 4 Bericht des 1. Untersuchungsausschusses (NSA),15412,poi,18
856,795230,https://www.abgeordnetenwatch.de/profile/hans-christian-strobele,856,242,Hans-Christian Ströbele (BÜNDNIS 90/DIE GRÜNEN),Hans-Christian Ströbele,hans-christian-strobele,1578,gruene,"Sie haben die deutsche Bevölkerung auch hinsichtlich des Militärstützpunkts Ramstein irregeführt. Selbstverständlich war auch der Bundesregierung aus vielen Zeitungsmeldungen und auch aus Informationen aus den Diensten selber - davon gehe ich aus - bekannt, dass von Ramstein die Killerdrohnen zwar nicht losfliegen und auch nicht von dort direkt gesteuert werden, sie aber über Ramstein gesteuert worden sind. Sie haben zu all den Fragen, die aus dem deutschen Parlament dazu gestellt wurden, immer die Unwahrheit gesagt. Sie haben gesagt: Dem ist nicht so. Die USA haben uns versichert, dass das nicht stimmt. - Der Untersuchungsausschuss konnte ganz zum Abschluss klären, dass diese Aussage nicht stimmt, dass sehr wohl über Ramstein - damit macht sich Deutschland mitschuldig - die Drohnenangriffe in Afrika gesteuert werden.

Ein letzter Satz. Herr Pofalla in Person und die Bundesregierung haben sich im August 2013 die günstigen Voraussetzungen für den Wahlkampf und für die Wahl 2013 erschlichen. Herr Pofalla hat getäuscht und getrickst.",TOP 4 Bericht des 1. Untersuchungsausschusses (NSA),15412,speech,18
857,795231,https://www.abgeordnetenwatch.de/profile/tankred-schipanski/archive/214802,857,242,Tankred Schipanski [CDU/CSU],Tankred Schipanski,tankred-schipanski,1396,cducsu,Sie reden wider besseres Wissen!,TOP 4 Bericht des 1. Untersuchungsausschusses (NSA),15412,poi,18
858,795232,https://www.abgeordnetenwatch.de/profile/hans-christian-strobele,858,242,Hans-Christian Ströbele (BÜNDNIS 90/DIE GRÜNEN),Hans-Christian Ströbele,hans-christian-strobele,1578,gruene,"Er hat der deutschen Bevölkerung erklärt, es sei alles gut, es sei alles vom Tisch. Ein No-Spy-Abkommen sei angeboten worden.

Nichts davon war wahr. Das Weiße Haus hat drei Monate später gesagt: Von einem No-Spy-Abkommen war nie die Rede. - Das hat die deutsche Regierung, das hat Herr Pofalla erfunden. Wie wären die Wahlen 2013 ausgegangen, wenn all das, was wir jetzt wissen und was in dem dicken Bericht steht, bekannt geworden wäre? Ich bin der Auffassung: Damit haben Sie die Wählerinnen und Wähler und die deutsche Öffentlichkeit irregeführt. Das darf nie wieder passieren. Daraus müssen Schlussfolgerungen gezogen werden.",TOP 4 Bericht des 1. Untersuchungsausschusses (NSA),15412,speech,18
859,795233,,859,242,,,,,,Beifall beim BÜNDNIS 90/DIE GRÜNEN und bei der LINKEN sowie bei Abgeordneten der SPD,TOP 4 Bericht des 1. Untersuchungsausschusses (NSA),15412,poi,18
860,795234,https://www.abgeordnetenwatch.de/profile/ulla-schmidt/archive/216739,860,242,Vizepräsidentin Ulla Schmidt,Ulla Schmidt,ulla-schmidt,1665,,"Herr Kollege Ströbele, danke schön. - Für die CDU/CSU-Fraktion hat jetzt Nina Warken das Wort.",TOP 4 Bericht des 1. Untersuchungsausschusses (NSA),15412,chair,18
861,795235,,861,242,,,,,,Beifall bei der CDU/CSU,TOP 4 Bericht des 1. Untersuchungsausschusses (NSA),15412,poi,18
862,795236,https://www.abgeordnetenwatch.de/profile/nina-warken,862,242,Nina Warken (CDU/CSU),Nina Warken,nina-warken,1270,cducsu,"Frau Präsidentin! Liebe Kolleginnen und Kollegen! Dieser Untersuchungsausschuss war ein Erfolg. Der Ausschuss war schon alleine deshalb ein Erfolg, weil er die Gesellschaft für die vielen Herausforderungen im digitalen Zeitalter sensibilisiert hat. Das Spannungsfeld zwischen dem Schutz der Privatsphäre des Einzelnen und der doch so notwendigen Tätigkeit der Sicherheitsbehörden wurde selten so intensiv in der Gesellschaft diskutiert. Er war aber auch ein Erfolg, weil wir bestehende organisatorische Defizite erkennen und abstellen konnten und weil wir im Ergebnis nicht nur die parlamentarische Kontrolle, sondern auch die Sicherheit unserer Bürger gestärkt haben.

Die innere Sicherheit in einer freiheitlichen Gesellschaft zu gewährleisten, ist schon immer ein Kernanliegen von CDU und CSU gewesen. Deshalb war für uns auch ganz klar, dass dort, wo Fehler geschehen sind, auch die gebotenen Konsequenzen gezogen werden müssen. Aber Konsequenzen ziehen bedeutet für uns eben nicht, Nachrichtendienste pauschal zu diffamieren oder sogar abschaffen zu wollen, sondern Konsequenzen ziehen bedeutet für uns, Fehler zu beheben und gemeinsam daran zu arbeiten, dass sie sich nicht wiederholen.",TOP 4 Bericht des 1. Untersuchungsausschusses (NSA),15412,speech,18
863,795237,,863,242,,,,,,Beifall bei der CDU/CSU sowie der Abg. Susanne Mittag [SPD],TOP 4 Bericht des 1. Untersuchungsausschusses (NSA),15412,poi,18
864,795238,https://www.abgeordnetenwatch.de/profile/heike-hansel/archive/215687,864,242,Heike Hänsel [DIE LINKE],Heike Hänsel,heike-hansel,1594,linke,Wunderbar!,TOP 4 Bericht des 1. Untersuchungsausschusses (NSA),15412,poi,18
865,795239,https://www.abgeordnetenwatch.de/profile/nina-warken,865,242,Nina Warken (CDU/CSU),Nina Warken,nina-warken,1270,cducsu,"Deshalb war es richtig und wichtig, dass etwa im BND die Weisungslage zur Fernmeldeaufklärung konkretisiert wurde, dass Arbeitsabläufe verbessert wurden und dass wir als Deutscher Bundestag mit der Reform des BND-Gesetzes die gesetzlichen Grundlagen verbessert haben.

Europa und Deutschland stehen im Fokus des internationalen Terrorismus. Das Letzte, was wir zurzeit brauchen können, ist eine politisch motivierte Kampagne gegen unsere Sicherheitsbehörden. Nein, wir müssen gemeinsam mit unseren internationalen Freunden und Partnern geschlossen gegen diejenigen vorgehen, die unsere freiheitlichen Gesellschaften zerstören wollen.",TOP 4 Bericht des 1. Untersuchungsausschusses (NSA),15412,speech,18
866,795240,,866,242,,,,,,Beifall bei der CDU/CSU,TOP 4 Bericht des 1. Untersuchungsausschusses (NSA),15412,poi,18
867,795241,https://www.abgeordnetenwatch.de/profile/nina-warken,867,242,Nina Warken (CDU/CSU),Nina Warken,nina-warken,1270,cducsu,"Mit „Freunden und Partnern“ meine ich ausdrücklich nicht nur unsere europäischen Nachbarn, sondern auch ganz bewusst die USA. Denn bei allen politischen Differenzen, die wir manchmal haben, und bei allem, was in letzter Zeit aus dem Weißen Haus getwittert wird, sollten wir eines nicht vergessen: Unser Gegner befindet sich nicht jenseits des Atlantiks, sondern unsere gemeinsamen Gegner sind all jene, die unsere Freiheit und Sicherheit angreifen, und diese Gegner können wir nur gemeinsam bezwingen.",TOP 4 Bericht des 1. Untersuchungsausschusses (NSA),15412,speech,18
868,795242,,868,242,,,,,,Beifall bei der CDU/CSU,TOP 4 Bericht des 1. Untersuchungsausschusses (NSA),15412,poi,18
869,795243,https://www.abgeordnetenwatch.de/profile/nina-warken,869,242,Nina Warken (CDU/CSU),Nina Warken,nina-warken,1270,cducsu,"Bei aller gebotenen Kritik an der NSA und ihren Aktivitäten dürfen wir Maß und Mitte nicht verlieren. Ja, es gab Fehler. Und ja, die Tätigkeit der NSA entspricht in Art und Umfang nicht dem, was wir uns für unsere Dienste wünschen. Aber lassen Sie uns ehrlich sein: Dank der Hilfe amerikanischer Sicherheitsbehörden konnten wir bereits mehr als einmal Schlimmeres in unserem Land verhindern.

Deswegen finde ich bedauerlich, dass manche Medien nur zu gern Spekulationen verbreitet haben, die sich zwar gut verkauft haben, von denen wir aber heute längst wissen, dass sie mit der Realität nicht viel zu tun haben. So wurde etwa in der ursprünglichen Berichterstattung über die Snowden-Dokumente mehrfach unterstellt - heute wurde es von Kollegen wiederholt -, die Bundesregierung leite monatliche mehrere 100 Millionen Metadaten über deutsche Staatsbürger an die NSA weiter. Heute wissen wir, dass es sich dabei um Metadaten handelt, die der BND im Rahmen des Antiterrorkampfes und zum Schutz unserer Soldaten in Afghanistan erhoben hat.",TOP 4 Bericht des 1. Untersuchungsausschusses (NSA),15412,speech,18
870,795244,,870,242,Zuruf von der CDU/CSU,von der CDU/CSU,von-der-cdu-csu,,cducsu,Hört! Hört!,TOP 4 Bericht des 1. Untersuchungsausschusses (NSA),15412,poi,18
871,795245,https://www.abgeordnetenwatch.de/profile/hans-christian-strobele,871,242,Hans-Christian Ströbele [BÜNDNIS 90/DIE GRÜNEN],Hans-Christian Ströbele,hans-christian-strobele,1578,gruene,„Eikonal“!,TOP 4 Bericht des 1. Untersuchungsausschusses (NSA),15412,poi,18
872,795246,https://www.abgeordnetenwatch.de/profile/nina-warken,872,242,Nina Warken (CDU/CSU),Nina Warken,nina-warken,1270,cducsu,"Es wurde auch behauptet, das Bundesamt für Verfassungsschutz beteilige sich mit dem Programm XKeyscore an einer weltweiten Datensammlung der NSA. Mittlerweile wissen wir, dass es einen solchen Austausch nie gegeben hat. Das Bundesamt benutzte das Programm lediglich testweise und nur zur rein internen Auswertung von Daten, die völlig rechtmäßig erhoben wurden.",TOP 4 Bericht des 1. Untersuchungsausschusses (NSA),15412,speech,18
873,795247,https://www.abgeordnetenwatch.de/profile/hans-christian-strobele,873,242,Hans-Christian Ströbele [BÜNDNIS 90/DIE GRÜNEN],Hans-Christian Ströbele,hans-christian-strobele,1578,gruene,Drei Jahre lang!,TOP 4 Bericht des 1. Untersuchungsausschusses (NSA),15412,poi,18
874,795248,https://www.abgeordnetenwatch.de/profile/dr-andre-hahn-0,874,242,Dr. André Hahn [DIE LINKE],Dr. André Hahn,andre-hahn,1497,linke,Vier Jahre Test?,TOP 4 Bericht des 1. Untersuchungsausschusses (NSA),15412,poi,18
875,795249,,875,242,,,,,,Lachen bei der LINKEN und dem BÜNDNIS 90/DIE GRÜNEN,TOP 4 Bericht des 1. Untersuchungsausschusses (NSA),15412,poi,18
876,795250,,876,242,,,,,,Weitere Zurufe,TOP 4 Bericht des 1. Untersuchungsausschusses (NSA),15412,poi,18
877,795251,https://www.abgeordnetenwatch.de/profile/nina-warken,877,242,Nina Warken (CDU/CSU),Nina Warken,nina-warken,1270,cducsu,"Nicht weniger unangebracht erscheint mir im Übrigen, dass Teile der Opposition, wie es hier gerade wieder deutlich wird, vor allem Kolleginnen und Kollegen, die ich noch nicht im Ausschuss gesehen habe - daher weiß ich auch nicht, woher man sich da so sicher sein kann -, bei diesem Spiel mitspielen und der Bundesregierung wiederholt Rechts- und Verfassungsbruch vorgeworfen haben. Ich kann nur davor warnen, mit solchen staatstragenden Begriffen leichtfertig umzugehen. Ebenso wenig wurde auch die Aufklärung durch die Bundesregierung hintertrieben, wie es immer wieder hier heißt.

Tatsache ist: Noch nie hat es in der fast 70-jährigen Geschichte dieses Hauses einen Untersuchungsausschuss gegeben, der dermaßen umfassende und tiefe Einblicke in die Tätigkeit der Nachrichtendienste erhalten hat wie der unsere. Knapp 90 Zeugen, vom BND-Sachbearbeiter bis hin zur Bundeskanzlerin, wurden gehört. Ganze Regalwände teils streng geheimer Akten waren ein wohl beispielloses Aufgebot an Beweismitteln. An diesen Fakten kann man auch dann nicht vorbeireden, wenn man die Ergebnisse der Beweisaufnahme unterschiedlich bewertet.",TOP 4 Bericht des 1. Untersuchungsausschusses (NSA),15412,speech,18
878,795252,,878,242,,,,,,Beifall bei der CDU/CSU,TOP 4 Bericht des 1. Untersuchungsausschusses (NSA),15412,poi,18
879,795253,https://www.abgeordnetenwatch.de/profile/nina-warken,879,242,Nina Warken (CDU/CSU),Nina Warken,nina-warken,1270,cducsu,"Tatsache ist eben auch, dass Grüne und Linke sowohl vor dem Bundesgerichtshof als auch vor dem Bundesverfassungsgericht mit allen ihren Klagen gescheitert sind.

Liebe Kollegen, eines möchte ich auch noch erwähnen: Wir dürfen bei allem politischen Streit nicht vergessen, dass in unseren Sicherheitsbehörden Zigtausende Mitarbeiter unter schwierigen Bedingungen hervorragende Arbeit leisten, um uns alle und unser freiheitliches Gemeinwesen zu schützen. Politische Auseinandersetzungen gehören in den politischen Raum, gehören hierher in den Deutschen Bundestag und sollten nicht im Rahmen von Zeugenvernehmungen auf dem Rücken von einzelnen Sachbearbeitern ausgetragen werden, wie es leider oft stattgefunden hat.

Kommen wir zum Thema Snowden. Liebe Kolleginnen und Kollegen, wir als Koalition, die CDU, die CSU, aber auch die SPD, haben uns dafür eingesetzt, dass Edward Snowden dem Ausschuss seine Sicht der Dinge darlegen kann. Wir haben Herrn Snowden zum Beispiel angeboten, dass wir ihn per Videokonferenz zu uns in den Ausschuss schalten, damit er uns von seinen Erkenntnissen berichten kann. Herr Snowden hat das abgelehnt, obwohl er das in den vergangenen Monaten und Jahren dutzendfach bei Tagungen und Kongressen gemacht hat.

Wir haben Herrn Snowden angeboten, dass wir ihn in Moskau besuchen und uns dort mit ihm austauschen. Auch das hat Herr Snowden abgelehnt, obwohl er - das muss man sich auf der Zunge zergehen lassen - sogar die Gastgeber amerikanischer Comedyshows in Moskau empfangen und ihnen dort Interviews gegeben hat. Sich dann hinzustellen, wie es die Opposition getan hat und auch heute wieder tut, und der Bundesregierung zu unterstellen, sie wolle eine Vernehmung Snowdens hintertreiben, ist eine absurde Verdrehung der Tatsachen.",TOP 4 Bericht des 1. Untersuchungsausschusses (NSA),15412,speech,18
880,795254,,880,242,,,,,,Beifall bei der CDU/CSU),TOP 4 Bericht des 1. Untersuchungsausschusses (NSA),15412,poi,18
881,795255,https://www.abgeordnetenwatch.de/profile/dr-konstantin-von-notz-0,881,242,Dr. Konstantin von Notz [BÜNDNIS 90/DIE GRÜNEN],Dr. Konstantin von Notz,konstantin-notz,1576,gruene,Hat sie systematisch hintertrieben! Systematisch hintertrieben!,TOP 4 Bericht des 1. Untersuchungsausschusses (NSA),15412,poi,18
882,795256,https://www.abgeordnetenwatch.de/profile/nina-warken,882,242,Nina Warken (CDU/CSU),Nina Warken,nina-warken,1270,cducsu,"Wir haben immer gesagt: Vernehmung? Ja, aber nicht um jeden Preis. - Den Preis hat Herr Snowden selbst genannt, nämlich politisches Asyl oder zumindest Abschiebeschutz. Diesen Preis konnten und wollten wir nicht zahlen.",TOP 4 Bericht des 1. Untersuchungsausschusses (NSA),15412,speech,18
883,795257,https://www.abgeordnetenwatch.de/profile/dr-konstantin-von-notz-0,883,242,Dr. Konstantin von Notz [BÜNDNIS 90/DIE GRÜNEN],Dr. Konstantin von Notz,konstantin-notz,1576,gruene,Freies Geleit!,TOP 4 Bericht des 1. Untersuchungsausschusses (NSA),15412,poi,18
884,795258,https://www.abgeordnetenwatch.de/profile/nina-warken,884,242,Nina Warken (CDU/CSU),Nina Warken,nina-warken,1270,cducsu,"Das Staatswohl, die Sicherheitsinteressen und auch die außenpolitischen Beziehungen obliegen nicht nur der Bundesregierung, sondern auch uns als Parlament. Deswegen haben wir das Vorgehen der Bundesregierung mitgetragen und gesagt: Um jeden Preis wollen wir Herrn Snowden nicht hören, wenn er schon alle unsere Angebote ablehnt.

Das, was einige Kollegen zum Thema No-Spy-Abkommen geäußert haben, ist ebenfalls eine Verdrehung der Tatsachen. Der Untersuchungsausschuss hat gezeigt, dass im Sommer 2013 auf allen Ebenen intensive Verhandlungen zum No-Spy-Abkommen geführt wurden. Wenn jetzt behauptet wird, die Bundesregierung habe das deutsche Volk bewusst darüber getäuscht, dann ist das schlicht eine Unverschämtheit.",TOP 4 Bericht des 1. Untersuchungsausschusses (NSA),15412,speech,18
885,795259,,885,242,,,,,,Beifall bei der CDU/CSU,TOP 4 Bericht des 1. Untersuchungsausschusses (NSA),15412,poi,18
886,795260,https://www.abgeordnetenwatch.de/profile/dr-konstantin-von-notz-0,886,242,Dr. Konstantin von Notz [BÜNDNIS 90/DIE GRÜNEN],Dr. Konstantin von Notz,konstantin-notz,1576,gruene,Und die Wahrheit!,TOP 4 Bericht des 1. Untersuchungsausschusses (NSA),15412,poi,18
887,795261,https://www.abgeordnetenwatch.de/profile/nina-warken,887,242,Nina Warken (CDU/CSU),Nina Warken,nina-warken,1270,cducsu,"Es empfiehlt sich, in den Protokollen der Ausschusssitzungen nachzulesen. Der Zeuge und damalige Außenminister Frank-Walter Steinmeier sagte in seiner Vernehmung deutlich: „Nein, die Verhandlungen waren keine Erfindung. Die haben stattgefunden; das ist gar keine Frage.“ Das muss man in allen Fraktionen zur Kenntnis nehmen. Es gab keine Nebelkerze im Wahlkampf.",TOP 4 Bericht des 1. Untersuchungsausschusses (NSA),15412,speech,18
888,795262,,888,242,,,,,,Beifall bei Abgeordneten der CDU/CSU,TOP 4 Bericht des 1. Untersuchungsausschusses (NSA),15412,poi,18
889,795263,https://www.abgeordnetenwatch.de/profile/dr-konstantin-von-notz-0,889,242,Dr. Konstantin von Notz [BÜNDNIS 90/DIE GRÜNEN],Dr. Konstantin von Notz,konstantin-notz,1576,gruene,Da klatscht nur Schimanski!,TOP 4 Bericht des 1. Untersuchungsausschusses (NSA),15412,poi,18
890,795264,https://www.abgeordnetenwatch.de/profile/christian-flisek-0,890,242,Christian Flisek [SPD],Christian Flisek,christian-flisek,1508,spd,"Der Nebel war so dicht, dass selbst Herr Pofalla nicht mehr durchgeblickt hat!",TOP 4 Bericht des 1. Untersuchungsausschusses (NSA),15412,poi,18
891,795265,https://www.abgeordnetenwatch.de/profile/ulla-schmidt/archive/216739,891,242,Vizepräsidentin Ulla Schmidt,Ulla Schmidt,ulla-schmidt,1665,,"Frau Kollegin, denken Sie an die Zeit.",TOP 4 Bericht des 1. Untersuchungsausschusses (NSA),15412,chair,18
892,795266,https://www.abgeordnetenwatch.de/profile/nina-warken,892,242,Nina Warken (CDU/CSU),Nina Warken,nina-warken,1270,cducsu,"Zu den sonstigen Anwürfen, die die Kollegen hier vorgebracht haben, verweise ich gerne auf den gemeinsamen Bewertungsteil der Koalitionsfraktionen. Dort kann man vieles nachlesen und sehen, dass sich die Kollegin Renner und der Kollege Ströbele eher in einer Märchenstunde oder in einem anderen Untersuchungsausschuss befunden haben.",TOP 4 Bericht des 1. Untersuchungsausschusses (NSA),15412,speech,18
893,795267,https://www.abgeordnetenwatch.de/profile/dr-konstantin-von-notz-0,893,242,Dr. Konstantin von Notz [BÜNDNIS 90/DIE GRÜNEN],Dr. Konstantin von Notz,konstantin-notz,1576,gruene,Es wird ja immer doller!,TOP 4 Bericht des 1. Untersuchungsausschusses (NSA),15412,poi,18
894,795268,https://www.abgeordnetenwatch.de/profile/nina-warken,894,242,Nina Warken (CDU/CSU),Nina Warken,nina-warken,1270,cducsu,"Als Deutscher Bundestag nehmen wir den Schutz der Grundrechte sehr ernst. Gerade deshalb haben wir im vergangenen Jahr die parlamentarische Kontrolle unserer Nachrichtendienste deutlich verstärkt. Ich bin sehr zuversichtlich, dass wir da eine gute Grundlage für die zukünftige Arbeit geschaffen haben.",TOP 4 Bericht des 1. Untersuchungsausschusses (NSA),15412,speech,18
895,795269,https://www.abgeordnetenwatch.de/profile/dr-konstantin-von-notz-0,895,242,Dr. Konstantin von Notz [BÜNDNIS 90/DIE GRÜNEN],Dr. Konstantin von Notz,konstantin-notz,1576,gruene,"Schön, dass Sie zuversichtlich sind!",TOP 4 Bericht des 1. Untersuchungsausschusses (NSA),15412,poi,18
896,795270,https://www.abgeordnetenwatch.de/profile/ulla-schmidt/archive/216739,896,242,Vizepräsidentin Ulla Schmidt,Ulla Schmidt,ulla-schmidt,1665,,"Frau Kollegin Warken, ich darf Sie bitten, zum Schluss zu kommen.",TOP 4 Bericht des 1. Untersuchungsausschusses (NSA),15412,chair,18
897,795271,https://www.abgeordnetenwatch.de/profile/nina-warken,897,242,Nina Warken (CDU/CSU),Nina Warken,nina-warken,1270,cducsu,"Diese Reform umzusetzen und mit Leben zu erfüllen, dazu darf ich Sie herzlich einladen.

Vielen Dank.",TOP 4 Bericht des 1. Untersuchungsausschusses (NSA),15412,speech,18
898,795272,,898,242,,,,,,Beifall bei der CDU/CSU,TOP 4 Bericht des 1. Untersuchungsausschusses (NSA),15412,poi,18
899,795273,https://www.abgeordnetenwatch.de/profile/ulla-schmidt/archive/216739,899,242,Vizepräsidentin Ulla Schmidt,Ulla Schmidt,ulla-schmidt,1665,,"Ich darf noch einmal alle Kolleginnen und Kollegen darum bitten, sich an die vereinbarte Redezeit zu halten.",TOP 4 Bericht des 1. Untersuchungsausschusses (NSA),15412,chair,18
900,795274,https://www.abgeordnetenwatch.de/profile/dr-konstantin-von-notz-0,900,242,Dr. Konstantin von Notz [BÜNDNIS 90/DIE GRÜNEN],Dr. Konstantin von Notz,konstantin-notz,1576,gruene,Jetzt müssen wir das alles ausbaden! Das wird ja immer doller!,TOP 4 Bericht des 1. Untersuchungsausschusses (NSA),15412,poi,18
901,795275,https://www.abgeordnetenwatch.de/profile/ulla-schmidt/archive/216739,901,242,Vizepräsidentin Ulla Schmidt,Ulla Schmidt,ulla-schmidt,1665,,"- Wir können das aufrechnen; das sähe aber schlecht für euch aus.

Für die Fraktion Die Linke redet jetzt der Kollege Dr. André Hahn.",TOP 4 Bericht des 1. Untersuchungsausschusses (NSA),15412,chair,18
902,795276,,902,242,,,,,,Beifall bei der LINKEN,TOP 4 Bericht des 1. Untersuchungsausschusses (NSA),15412,poi,18
903,795277,https://www.abgeordnetenwatch.de/profile/dr-andre-hahn-0,903,242,Dr. André Hahn (DIE LINKE),Dr. André Hahn,andre-hahn,1497,linke,"Frau Präsidentin! Meine sehr verehrten Damen und Herren! Ich habe leider nicht genug Redezeit, um den ganzen Unfug zu korrigieren, den Frau Warken eben gesagt hat. Fakt ist: Ohne diesen Untersuchungsausschuss hätte die Öffentlichkeit nie erfahren, dass nicht nur die NSA, sondern auch der BND in nennenswerten Größenordnungen europäische Partner und Verbündete ausspioniert hat. Ich verweise diesbezüglich auf die öffentliche Erklärung des Parlamentarischen Kontrollgremiums vom 16. Dezember 2015. Wenn darin davon gesprochen wird, dass lediglich bei einem Drittel der vom Kontrollgremium untersuchten Selektoren, also der zu Abhörzwecken verwendeten Suchbegriffe, die beim BND im Einsatz waren, ein klarer Bezug zum Auftragsprofil der Bundesregierung erkennbar war, dann bedeutet das zugleich, dass rund zwei Drittel, also mehrere Tausend Suchbegriffe, mindestens umstritten und unverhältnismäßig - viele davon auch klar rechtswidrig - waren. In den Abhöranlagen des BND liefen zu Hoch-Zeiten mehr als 13 Millionen Suchbegriffe der NSA, also Namen, Telefonnummern, EMail-Adressen usw. Dass es so viele Terroristen oder Waffenschieber gibt, glaubt wohl nicht einmal die Bundeskanzlerin.",TOP 4 Bericht des 1. Untersuchungsausschusses (NSA),15412,speech,18
904,795278,,904,242,,,,,,Beifall bei der LINKEN,TOP 4 Bericht des 1. Untersuchungsausschusses (NSA),15412,poi,18
