,id,profile_url,sequence,sitzung,speaker,speaker_cleaned,speaker_fp,speaker_key,speaker_party,text,top,top_id,type,wahlperiode
559,794933,https://www.abgeordnetenwatch.de/profile/petra-pau/archive/215458,559,242,Vizepräsidentin Petra Pau,Petra Pau,petra-pau,1713,,Das Wort hat der Kollege Matthias W. Birkwald für die Fraktion Die Linke.,TOP 18 Armuts- und Reichtumsbericht,15410,chair,18
560,794934,,560,242,,,,,,Beifall bei der LINKEN,TOP 18 Armuts- und Reichtumsbericht,15410,poi,18
561,794935,,561,242,Matthias W. Birkwald (DIE LINKE),Matthias W. Birkwald,matthias-birkwald,,linke,"Sehr geehrte Frau Präsidentin! Meine Damen und Herren! Zwischen 2002 und 2013 stieg die Zahl der Einkommensmillionärinnen und -millionäre von 9 462 auf 17 400, und seit Jahren senken Union und SPD die Steuern auf große Vermögen, auf hohe Einkommen und Gewinne. Herr Schäuble lässt zu, dass sich Amazon, IKEA und andere große Konzerne notorisch davor drücken, Steuern zu zahlen.",TOP 18 Armuts- und Reichtumsbericht,15410,speech,18
562,794936,https://www.abgeordnetenwatch.de/profile/anja-karliczek-0,562,242,Anja Karliczek [CDU/CSU],Anja Karliczek,anja-karliczek,1463,cducsu,Das stimmt gar nicht! Das ist nicht wahr!,TOP 18 Armuts- und Reichtumsbericht,15410,poi,18
563,794937,,563,242,Matthias W. Birkwald (DIE LINKE),Matthias W. Birkwald,matthias-birkwald,,linke,"Millionen Euro fließen so jedes Jahr in die Kassen der Unternehmen und die Geldbeutel der Reichen. Gleichzeitig heben Sie den Regelsatz für Menschen, die von Hartz IV oder von der Grundsicherung im Alter leben müssen, nur um mickrige 5 Euro an. Das ist ungerecht und schlicht eine Frechheit.",TOP 18 Armuts- und Reichtumsbericht,15410,speech,18
564,794938,,564,242,,,,,,Beifall bei der LINKEN,TOP 18 Armuts- und Reichtumsbericht,15410,poi,18
565,794939,,565,242,Matthias W. Birkwald (DIE LINKE),Matthias W. Birkwald,matthias-birkwald,,linke,"Ihr Fünfter Armuts- und Reichtumsbericht zeigt deutlich: Von 1995 bis 2014 ist die Armutsquote, Herr Whittaker, drastisch gestiegen, und die soziale Ungleichheit hat deutlich zugenommen. Auf Deutsch - Faktencheck -: Die Reichen wurden immer reicher, und die Armen immer zahlreicher. - Darum wollte die CDU/CSU wohl so lange wie möglich vermeiden, dass wir heute hier im Plenum über den Bericht debattieren. Kein Wunder: Ihr Bericht beschreibt manches, aber er drückt sich um die Kritik.

Meine Damen und Herren, Armut und Reichtum nehmen gleichermaßen zu oder, wie es der renommierte Kölner Armutsforscher Christoph Butterwegge ausdrückt: „Während die einen nach oben fahren, fahren die anderen nach unten.“ Professor Butterwegge nennt das Paternoster-Effekt.

Meine Damen und Herren von der Koalition, es wäre gut, wenn Sie diesen Paternoster-Effekt kritisierten. Das tun Sie aber nicht. Im Gegenteil: Sie ignorieren, dass hier in Deutschland, in der viertgrößten Volkswirtschaft der Welt, das oberste Prozent der Einkommensbeziehenden über 400 000 Euro im Jahr hat und gleichzeitig immer mehr Menschen in Mülltonnen nach leeren Flaschen wühlen müssen, weil sie zu arm sind. Das können Sie, Herr Whittaker, übrigens auch hier im Regierungsviertel sehen. Wir Linken sagen: Das ist beschämend, und das muss unbedingt ein Ende haben.",TOP 18 Armuts- und Reichtumsbericht,15410,speech,18
566,794940,,566,242,,,,,,Beifall bei der LINKEN sowie der Abg. Corinna Rüffer [BÜNDNIS 90/DIE GRÜNEN],TOP 18 Armuts- und Reichtumsbericht,15410,poi,18
567,794941,,567,242,Matthias W. Birkwald (DIE LINKE),Matthias W. Birkwald,matthias-birkwald,,linke,"Ihr Armuts- und Reichtumsbericht zeigt uns einen Teil der beschämenden Zustände von heute, zum Beispiel, dass immer mehr Menschen auf die Grundsicherung im Alter, also auf das Rentner-Hartz-IV, angewiesen sind, und zwar absolut und relativ. Aber Ihr Bericht verschweigt, dass nach den Zahlen der Europäischen Union schon heute 2,7 Millionen Menschen in unserer reichen Gesellschaft in Altersarmut leben. In keiner Altersgruppe wächst die Armut so schnell wie bei den Seniorinnen und Senioren; Kollege Strengmann-Kuhn hat es schon gesagt.

Meine Damen und Herren, die vorgestern erschienene Studie von Bertelsmann-Stiftung und DIW zur Altersarmut schaut in die Zukunft. Die Zukunft wird noch düsterer werden. Wenn wir jetzt nicht handeln,",TOP 18 Armuts- und Reichtumsbericht,15410,speech,18
568,794942,https://www.abgeordnetenwatch.de/profile/anja-karliczek-0,568,242,Anja Karliczek [CDU/CSU],Anja Karliczek,anja-karliczek,1463,cducsu,Wir haben schon gehandelt! Jetzt lassen Sie es mal wirken!,TOP 18 Armuts- und Reichtumsbericht,15410,poi,18
569,794943,,569,242,Matthias W. Birkwald (DIE LINKE),Matthias W. Birkwald,matthias-birkwald,,linke,"dann wird sich die Anzahl der armen Rentnerinnen und Rentner in Ostdeutschland bis 2030 verdoppeln, dann wird bis 2030 im Osten jeder Dritte im Alter in Armut leben müssen, in Deutschland jeder Fünfte. Mit anderen Worten: In wenigen Jahren werden 20 Prozent der älteren Menschen in Deutschland in Armut leben. Besonders gefährdet sind heute und in Zukunft alleinstehende Frauen. Besonders gefährdet sind Langzeiterwerbslose sowie Migrantinnen und Migranten. Ich frage Sie, liebe Kolleginnen und Kollegen von der Union: Wann wachen Sie eigentlich endlich einmal auf?",TOP 18 Armuts- und Reichtumsbericht,15410,speech,18
570,794944,,570,242,,,,,,Beifall bei der LINKEN sowie bei Abgeordneten des BÜNDNISSES 90/DIE GRÜNEN,TOP 18 Armuts- und Reichtumsbericht,15410,poi,18
571,794945,,571,242,Matthias W. Birkwald (DIE LINKE),Matthias W. Birkwald,matthias-birkwald,,linke,"Meine Damen und Herren, in der Bertelsmann-Studie heißt es - Zitat -:

Es lässt sich aber festhalten, dass eine Abschaffung der Abschläge

- bei Erwerbsminderungsrenten -

zu einer deutlichen Reduktion der Altersarmut für die betroffene Gruppe führen würde.

Das fordern die Linke, Gewerkschaften, Sozialverbände und Bündnis 90/Die Grünen, und bis 2013 forderte das auch die SPD. Aber genau das machen Sie nicht. Sie lassen die heutigen Erwerbsminderungsrentnerinnen und rentner im Regen stehen. Sie bestrafen Menschen, die zu krank zum Arbeiten sind, weiter mit systemwidrigen Abschlägen. Niemand wird freiwillig krank. Ich fordere Sie auf: Schaffen Sie die Abschläge für Erwerbsminderungsrentnerinnen und rentner ab,",TOP 18 Armuts- und Reichtumsbericht,15410,speech,18
572,794946,,572,242,,,,,,Beifall bei der LINKEN,TOP 18 Armuts- und Reichtumsbericht,15410,poi,18
573,794947,,573,242,Matthias W. Birkwald (DIE LINKE),Matthias W. Birkwald,matthias-birkwald,,linke,"für die 1,8 Millionen, die schon heute im Schnitt nur 711 Euro erhalten, und für die, die künftig auf so eine Rente angewiesen sein werden! Das muss doch drin sein.",TOP 18 Armuts- und Reichtumsbericht,15410,speech,18
574,794948,,574,242,,,,,,Beifall bei der LINKEN,TOP 18 Armuts- und Reichtumsbericht,15410,poi,18
575,794949,,575,242,Matthias W. Birkwald (DIE LINKE),Matthias W. Birkwald,matthias-birkwald,,linke,"Meine Damen und Herren, wir müssen endlich dafür sorgen, dass in unserem reichen Land niemand mehr in Armut lebt und dass niemand mehr von gesellschaftlicher Teilhabe ausgeschlossen wird. Ob Kino oder Theater, ob gesundes Essen, Tickets für Busse und Bahnen, ein Schulranzen oder ein Kaffee oder ein Bier mit Freundinnen und Freunden: Das alles muss auch von armen Menschen bezahlt werden können. Deshalb sagt die Linke: Niemand soll in unserer Gesellschaft von weniger als 1 050 Euro im Monat leben müssen - keine Alleinerziehende, kein Erwerbsloser, kein Erwerbsminderungsrentner und keine Rentnerin. Warum 1 050 Euro? Nun, weil das DIW festgestellt hat, dass alle Einpersonenhaushalte, die weniger als 1 050 Euro zur Verfügung haben, schlicht arm sind.

Und darum sage ich Ihnen ganz zum Schluss: Hören Sie endlich auf, die Armut wegzudefinieren! Allen, die behaupten, die relative Armutsgrenze von 60 Prozent des Durchschnittseinkommens, also 1 050 Euro für einen Single, sei nur eine relative Größe, -",TOP 18 Armuts- und Reichtumsbericht,15410,speech,18
576,794950,https://www.abgeordnetenwatch.de/profile/petra-pau/archive/215458,576,242,Vizepräsidentin Petra Pau,Petra Pau,petra-pau,1713,,Kollege Birkwald.,TOP 18 Armuts- und Reichtumsbericht,15410,chair,18
577,794951,,577,242,Matthias W. Birkwald (DIE LINKE),Matthias W. Birkwald,matthias-birkwald,,linke,"- die zwar die Spreizung der Einkommen zeige, aber nicht die absolute Armut,",TOP 18 Armuts- und Reichtumsbericht,15410,speech,18
578,794952,https://www.abgeordnetenwatch.de/profile/kai-whittaker/archive/214866,578,242,Kai Whittaker [CDU/CSU],Kai Whittaker,kai-whittaker,1313,cducsu,Genau so ist es!,TOP 18 Armuts- und Reichtumsbericht,15410,poi,18
579,794953,,579,242,Matthias W. Birkwald (DIE LINKE),Matthias W. Birkwald,matthias-birkwald,,linke,"sage ich zum Schluss: Es geht nicht nur darum, die absolute Armut mit Sozialhilfe zu bekämpfen, es geht nicht nur darum, Elend zu bekämpfen, sondern es geht auch darum, alle Menschen in Würde an unserer Gesellschaft teilhaben zu lassen.

Danke schön.",TOP 18 Armuts- und Reichtumsbericht,15410,speech,18
580,794954,,580,242,,,,,,Beifall bei der LINKEN,TOP 18 Armuts- und Reichtumsbericht,15410,poi,18
581,794955,https://www.abgeordnetenwatch.de/profile/petra-pau/archive/215458,581,242,Vizepräsidentin Petra Pau,Petra Pau,petra-pau,1713,,Der Kollege Stephan Stracke hat für die CDU/CSU-Fraktion das Wort.,TOP 18 Armuts- und Reichtumsbericht,15410,chair,18
582,794956,,582,242,,,,,,Beifall bei der CDU/CSU,TOP 18 Armuts- und Reichtumsbericht,15410,poi,18
583,794957,https://www.abgeordnetenwatch.de/profile/stephan-stracke/archive/214996,583,242,Stephan Stracke (CDU/CSU),Stephan Stracke,stephan-stracke,1377,cducsu,"Grüß Gott, Frau Präsidentin! Meine sehr verehrten Damen und Herren! Liebe Kolleginnen und Kollegen! Ich bin Ihnen dankbar, lieber Herr Kollege Birkwald, dass Sie die Bertelsmann-Studie, die vor kurzem veröffentlicht wurde, erwähnt haben. Das gibt Gelegenheit, diese herauszugreifen und zu beleuchten.

Zum einen: Grundsicherung im Alter zu erhalten, ist nicht gleichzusetzen mit Altersarmut, sondern die Grundsicherung ist zunächst einmal ein Instrument, um vor Altersarmut zu schützen. Das ist das Entscheidende in dem Bereich.",TOP 18 Armuts- und Reichtumsbericht,15410,speech,18
584,794958,,584,242,,,,,,Beifall bei der CDU/CSU,TOP 18 Armuts- und Reichtumsbericht,15410,poi,18
585,794959,https://www.abgeordnetenwatch.de/profile/stephan-stracke/archive/214996,585,242,Stephan Stracke (CDU/CSU),Stephan Stracke,stephan-stracke,1377,cducsu,"Dazu haben wir sie im Jahr 2003 eingeführt. Verschämte Altersarmut wollten wir dadurch beseitigen, und das ist uns auch in großem Maße gelungen.",TOP 18 Armuts- und Reichtumsbericht,15410,speech,18
586,794960,https://www.abgeordnetenwatch.de/profile/wolfgang-strengmann-kuhn/archive/215221,586,242,Dr. Wolfgang Strengmann-Kuhn [BÜNDNIS 90/DIE GRÜNEN],Dr. Wolfgang Strengmann-Kuhn,wolfgang-strengmann-kuhn,1886,gruene,Woher wissen Sie das? Wo steht das?,TOP 18 Armuts- und Reichtumsbericht,15410,poi,18
587,794961,https://www.abgeordnetenwatch.de/profile/petra-pau/archive/215458,587,242,Vizepräsidentin Petra Pau,Petra Pau,petra-pau,1713,,"Kollege Stracke, gestatten Sie eine Frage oder Bemerkung des Kollegen Birkwald?",TOP 18 Armuts- und Reichtumsbericht,15410,chair,18
588,794962,https://www.abgeordnetenwatch.de/profile/stephan-stracke/archive/214996,588,242,Stephan Stracke (CDU/CSU),Stephan Stracke,stephan-stracke,1377,cducsu,"Ja, geht ja gut los. Herr Kollege Birkwald, bitte schön.",TOP 18 Armuts- und Reichtumsbericht,15410,speech,18
589,794963,,589,242,Matthias W. Birkwald (DIE LINKE),Matthias W. Birkwald,matthias-birkwald,,linke,"Vielen Dank, Frau Präsidentin, vielen Dank, Kollege Stracke, dass Sie die Frage zulassen.

Zunächst einmal wollen wir festhalten: Auf den Seiten 549 ff. Ihres Armuts- und Reichtumsberichtes sind vier Institute genannt, die eine Armutsquote messen, und da sind auch die Armutsquoten für Rentnerinnen und Rentner und Pensionäre ausgewiesen. Ich sage Ihnen: Bei allen vier Instituten sind die Zahlen zwischen 1995 und 2014 deutlich gestiegen, und bei drei von vier Instituten liegen die Armutsquoten von Rentnern mit 17 Prozent, 15,9 Prozent oder 20,2 Prozent signifikant über den Armutsquoten aller.

Jetzt kommt meine Frage: Meinen Sie wirklich, dass man bei einem bundesweit einheitlichen durchschnittlichen Bruttogesamtbedarf - so heißt der Fachbegriff - bei der Grundsicherung im Alter von 804 Euro nicht von Armut reden kann? 804 Euro! Davon müssen die Menschen alles bezahlen: Essen, Trinken, Miete, Heizung, Strom, Warmwasser und auch noch das, was wir hier gesellschaftliche Teilhabe nennen. Die Menschen draußen nennen es Kaffee, Wasser, Bier, Theater, Kino, Oper oder von mir aus auch Schwarzwälder Kirschtorte. Das kann man nicht von 804 Euro bezahlen. Diese Menschen sind arm. Sehen Sie das nicht genauso?",TOP 18 Armuts- und Reichtumsbericht,15410,speech,18
590,794964,,590,242,,,,,,Beifall bei der LINKEN,TOP 18 Armuts- und Reichtumsbericht,15410,poi,18
591,794965,https://www.abgeordnetenwatch.de/profile/stephan-stracke/archive/214996,591,242,Stephan Stracke (CDU/CSU),Stephan Stracke,stephan-stracke,1377,cducsu,"Lieber Herr Kollege Birkwald, das Instrument der Grundsicherung im Alter soll wie sämtliche Grundsicherungssysteme Menschen ja gerade dann schützen, wenn sie in die genannte Situation kommen. Deswegen gibt es vonseiten des Staates entsprechende Unterstützungssysteme wie eben die Grundsicherung im Alter, die gerade vor Altersarmut schützen soll.",TOP 18 Armuts- und Reichtumsbericht,15410,speech,18
592,794966,,592,242,Matthias W. Birkwald [DIE LINKE],Matthias W. Birkwald,matthias-birkwald,,linke,Mehr als 804 Euro haben die nicht!,TOP 18 Armuts- und Reichtumsbericht,15410,poi,18
593,794967,https://www.abgeordnetenwatch.de/profile/stephan-stracke/archive/214996,593,242,Stephan Stracke (CDU/CSU),Stephan Stracke,stephan-stracke,1377,cducsu,"Genau deswegen haben wir dieses Instrument geschaffen.

Die Armut betrifft im Übrigen ältere Menschen weitaus weniger als Menschen, die noch im Erwerbsleben stehen. Das zeigen auch die Berichte auf, die uns vorliegen. Die Bezieher kleinerer Renten sind im Regelfall auch nicht auf Grundsicherung angewiesen. Vielmehr gilt: Altersarmut ist in der Regel nicht das Thema, sie ist vielmehr die relativ seltene Ausnahme.",TOP 18 Armuts- und Reichtumsbericht,15410,speech,18
594,794968,https://www.abgeordnetenwatch.de/profile/wolfgang-strengmann-kuhn/archive/215221,594,242,Dr. Wolfgang Strengmann-Kuhn [BÜNDNIS 90/DIE GRÜNEN],Dr. Wolfgang Strengmann-Kuhn,wolfgang-strengmann-kuhn,1886,gruene,Das sagt der Armuts- und Reichtumsbericht aber anders!,TOP 18 Armuts- und Reichtumsbericht,15410,poi,18
595,794969,https://www.abgeordnetenwatch.de/profile/stephan-stracke/archive/214996,595,242,Stephan Stracke (CDU/CSU),Stephan Stracke,stephan-stracke,1377,cducsu,So ist es: Altersarmut ist die relativ seltene Ausnahme.,TOP 18 Armuts- und Reichtumsbericht,15410,speech,18
596,794970,https://www.abgeordnetenwatch.de/profile/wolfgang-strengmann-kuhn/archive/215221,596,242,Dr. Wolfgang Strengmann-Kuhn [BÜNDNIS 90/DIE GRÜNEN],Dr. Wolfgang Strengmann-Kuhn,wolfgang-strengmann-kuhn,1886,gruene,Nein! Das ist schlicht falsch! 15 Prozent!,TOP 18 Armuts- und Reichtumsbericht,15410,poi,18
597,794971,https://www.abgeordnetenwatch.de/profile/karin-binder,597,242,Karin Binder [DIE LINKE],Karin Binder,karin-binder,1867,linke,13 Millionen Menschen!,TOP 18 Armuts- und Reichtumsbericht,15410,poi,18
598,794972,https://www.abgeordnetenwatch.de/profile/stephan-stracke/archive/214996,598,242,Stephan Stracke (CDU/CSU),Stephan Stracke,stephan-stracke,1377,cducsu,"Ich will Ihnen, weil hier alle sehr aufgeregt sind, dafür einmal ein Beispiel nennen. Bei jemandem, der eine gesetzliche Rente von weniger als 600 Euro bezieht, würden Sie davon ausgehen, dass er in der Grundsicherung ist. Tatsächlich befinden sich aber nur 6 Prozent unserer Rentnerinnen und Rentner in der Grundsicherung. Das zeigt doch, dass Altersarmut Gott sei Dank in dieser Gesellschaft nicht die Regel ist, sondern die relativ seltene Ausnahme. Wir sollten uns aber natürlich auch daran messen lassen, das zu verbessern, meine sehr geehrten Damen und Herren.",TOP 18 Armuts- und Reichtumsbericht,15410,speech,18
599,794973,,599,242,,,,,,Beifall bei der CDU/CSU,TOP 18 Armuts- und Reichtumsbericht,15410,poi,18
600,794974,https://www.abgeordnetenwatch.de/profile/wolfgang-strengmann-kuhn/archive/215221,600,242,Dr. Wolfgang Strengmann-Kuhn [BÜNDNIS 90/DIE GRÜNEN],Dr. Wolfgang Strengmann-Kuhn,wolfgang-strengmann-kuhn,1886,gruene,Jetzt nennen Sie doch mal die Zahlen aus dem Armuts- und Reichtumsbericht und nicht Ihre eigenen Zahlen!,TOP 18 Armuts- und Reichtumsbericht,15410,poi,18
601,794975,https://www.abgeordnetenwatch.de/profile/stephan-stracke/archive/214996,601,242,Stephan Stracke (CDU/CSU),Stephan Stracke,stephan-stracke,1377,cducsu,"Ich nehme die Wortmeldung des Herrn Kollegen Birkwald zum Thema Bertelsmann-Studie auf. Die beste Politik für ein gutes Leben in Deutschland ist natürlich eine gute Arbeitsmarktpolitik bzw. eine gute Bildungspolitik. Und Altersarmut lässt sich eben am sinnvollsten präventiv durch sichere und ordentlich bezahlte Beschäftigung bekämpfen. Dafür haben wir in dieser Wahlperiode - auch mit dem Mindestlohn, mit der Stärkung der Sozialpartnerschaft und mit vielem mehr - eine Menge getan. Es geht vor allem darum, Reparaturmaßnahmen zu vermeiden. Diese sind nämlich nicht vordringlich.

Jetzt geht es darum, dass wir beim Arbeitsmarkt auch darauf achten, den Rahmen weiterhin hochzuhalten. Wir sollten keine Steuererhöhungen machen, wie es jetzt beispielsweise die SPD vorgeschlagen hat, sondern ganz im Gegenteil: Jetzt ist Zeit für Steuerentlastungen für alle.",TOP 18 Armuts- und Reichtumsbericht,15410,speech,18
602,794976,,602,242,Matthias W. Birkwald [DIE LINKE],Matthias W. Birkwald,matthias-birkwald,,linke,Arme zahlen doch keine Steuern!,TOP 18 Armuts- und Reichtumsbericht,15410,poi,18
603,794977,https://www.abgeordnetenwatch.de/profile/stephan-stracke/archive/214996,603,242,Stephan Stracke (CDU/CSU),Stephan Stracke,stephan-stracke,1377,cducsu,"Und dafür ist auch der entsprechende Rahmen vorhanden, meine sehr verehrten Damen und Herren.",TOP 18 Armuts- und Reichtumsbericht,15410,speech,18
604,794978,,604,242,,,,,,Beifall bei Abgeordneten der CDU/CSU,TOP 18 Armuts- und Reichtumsbericht,15410,poi,18
605,794979,https://www.abgeordnetenwatch.de/profile/stephan-stracke/archive/214996,605,242,Stephan Stracke (CDU/CSU),Stephan Stracke,stephan-stracke,1377,cducsu,"Seit 2005 sind - der Kollege hatte bereits darauf hingewiesen - die Arbeitnehmerentgelte stärker als die Gewinneinkommen gestiegen. Auch die Reallöhne sind im Übrigen spürbar gestiegen.

Die Ministerin hat darauf hingewiesen, dass die gemessen am Gehalt unteren 40 Prozent der Beschäftigten 2015 real weniger verdient haben als Mitte der 90er-Jahre. Auch da lohnt es sich, einen genauen Blick auf die Zahlen zu werfen. Tatsache ist, dass diese Senkungen und Einbußen im Reallohnbereich im Zeitraum zwischen 1993 und 2007 stattgefunden haben, also zu einer Zeit, in der im Wesentlichen die SPD regierte. Seit 2009 sind die Reallöhne kräftig gestiegen.",TOP 18 Armuts- und Reichtumsbericht,15410,speech,18
606,794980,,606,242,,,,,,Beifall bei der CDU/CSU,TOP 18 Armuts- und Reichtumsbericht,15410,poi,18
607,794981,https://www.abgeordnetenwatch.de/profile/stephan-stracke/archive/214996,607,242,Stephan Stracke (CDU/CSU),Stephan Stracke,stephan-stracke,1377,cducsu,"Das zeigt: Politik muss man richtig machen. Und wir vonseiten der Union tun das auch.

Erstmals seit dem Jahr 1993 ist die Zahl der Langzeitarbeitslosen unter die Marke von 1 Million gesunken. Auch dazu können wir sagen: In diesem Bereich haben wir richtig gehandelt.

Ja, es ist unser gemeinsames Ziel, die Altersarmut von Rentnerinnen und Rentnern zu verhindern. Auch in diesem Zusammenhang ist ein Blick auf die Rentensteigerungen gut: In den letzten zehn Jahren sind die Renten in Westdeutschland um 15,9 Prozent und im Osten sogar um 24,1 Prozent gestiegen.",TOP 18 Armuts- und Reichtumsbericht,15410,speech,18
608,794982,,608,242,Matthias W. Birkwald [DIE LINKE],Matthias W. Birkwald,matthias-birkwald,,linke,Wie sind die Löhne in derselben Zeit gestiegen? Deutlich mehr!,TOP 18 Armuts- und Reichtumsbericht,15410,poi,18
609,794983,https://www.abgeordnetenwatch.de/profile/stephan-stracke/archive/214996,609,242,Stephan Stracke (CDU/CSU),Stephan Stracke,stephan-stracke,1377,cducsu,"Das heißt, die Renten sind gut gestiegen. Trotz eines um 6,4 Prozent gesunkenen Rentenniveaus haben wir in Ostdeutschland eine Rentensteigerung um 24,1 Prozent. Das zeigt: Auch hier ist die Situation anders, als es in diesem Land oft behauptet wird.",TOP 18 Armuts- und Reichtumsbericht,15410,speech,18
610,794984,,610,242,Matthias W. Birkwald [DIE LINKE],Matthias W. Birkwald,matthias-birkwald,,linke,Die Renten steigen weniger als die Löhne!,TOP 18 Armuts- und Reichtumsbericht,15410,poi,18
611,794985,https://www.abgeordnetenwatch.de/profile/stephan-stracke/archive/214996,611,242,Stephan Stracke (CDU/CSU),Stephan Stracke,stephan-stracke,1377,cducsu,"Die Renten steigen, und das ist gut. Das kommt bei den Rentnerinnen und Rentnern in diesem Land an.",TOP 18 Armuts- und Reichtumsbericht,15410,speech,18
612,794986,,612,242,,,,,,Beifall bei Abgeordneten der CDU/CSU,TOP 18 Armuts- und Reichtumsbericht,15410,poi,18
613,794987,https://www.abgeordnetenwatch.de/profile/stephan-stracke/archive/214996,613,242,Stephan Stracke (CDU/CSU),Stephan Stracke,stephan-stracke,1377,cducsu,"Altersarmut sollten wir am besten zielgenau bekämpfen; darauf habe ich bereits hingewiesen. Drei Viertel derer, die ab Erreichen der Regelaltersgrenze Grundsicherung im Alter beziehen, waren unmittelbar vor Eintritt in das Rentenalter bereits Empfänger von Grundsicherungsleistungen, sei es ALG II, Erwerbsminderungsrente oder Sozialhilfe. Das bedeutet: Die Ursachen liegen offensichtlich weit vor dem Renteneintritt.

Deswegen müssen wir bei diesen Themen sehr zielgenau arbeiten. Ich meine den Übergang von Schule in Beruf sowie die betriebliche Weiterbildung. Außerdem müssen wir die gesamten Bedarfsgemeinschaften verstärkt in den Blick nehmen. In Bayern gibt es ein hervorragendes, funktionierendes Modellprojekt - Tandem -, bei dem zusammen mit den Kommunen versucht wird, die gesamte Bedarfsgemeinschaft in den Blick zu nehmen und gute Lösungswege aufzuzeigen. Genau diese Ansätze sollten wir verstetigen.

Herr Birkwald, Sie haben sich im Zusammenhang mit der Bertelsmann-Studie zwar auf die Erwerbsgeminderten bezogen - da haben wir in dieser Legislaturperiode viel getan -, Sie haben aber ausgeblendet, dass ein höheres Rentenniveau für alle, was vor allem Sie, aber auch die SPD fordern, kein taugliches Mittel zur Vermeidung von Altersarmut ist. Das ist der entscheidende Befund der Bertelsmann-Studie in diesem Bereich. Das hätte einen symbolischen Wert, wäre aber Politik mit der Gießkanne. So kann man Altersarmut nicht treffsicher bekämpfen. Außerdem kostet das unglaublich viel: Die kumulierten Kosten dafür beliefen sich auf mindestens 100 Milliarden Euro.

Schauen wir uns einmal die 530 000 Menschen, die Grundsicherung im Alter beziehen, an: 25 Prozent davon haben keinerlei Rentenansprüche, und 40 Prozent beziehen eine Rente von unter 400 Euro.",TOP 18 Armuts- und Reichtumsbericht,15410,speech,18
614,794988,https://www.abgeordnetenwatch.de/profile/wolfgang-strengmann-kuhn/archive/215221,614,242,Dr. Wolfgang Strengmann-Kuhn [BÜNDNIS 90/DIE GRÜNEN],Dr. Wolfgang Strengmann-Kuhn,wolfgang-strengmann-kuhn,1886,gruene,"Reden Sie doch einmal über Armut und nicht dauernd über die Grundsicherung! Sie haben angefangen, dass Grundsicherung nicht Armut ist!",TOP 18 Armuts- und Reichtumsbericht,15410,poi,18
615,794989,https://www.abgeordnetenwatch.de/profile/stephan-stracke/archive/214996,615,242,Stephan Stracke (CDU/CSU),Stephan Stracke,stephan-stracke,1377,cducsu,"Diese Menschen haben nichts, aber auch gar nichts von den Rentenplänen von Martin Schulz.",TOP 18 Armuts- und Reichtumsbericht,15410,speech,18
616,794990,https://www.abgeordnetenwatch.de/profile/katja-mast/archive/217035,616,242,Katja Mast [SPD],Katja Mast,katja-mast,1737,spd,Sie haben gar keine Pläne!,TOP 18 Armuts- und Reichtumsbericht,15410,poi,18
617,794991,https://www.abgeordnetenwatch.de/profile/stephan-stracke/archive/214996,617,242,Stephan Stracke (CDU/CSU),Stephan Stracke,stephan-stracke,1377,cducsu,"Tatsächlich würden diejenigen profitieren, die lange gearbeitet haben und gut verdient haben. Aber die haben in der Regel nichts mit Altersarmut zu tun.",TOP 18 Armuts- und Reichtumsbericht,15410,speech,18
618,794992,,618,242,,,,,,Beifall bei der CDU/CSU,TOP 18 Armuts- und Reichtumsbericht,15410,poi,18
619,794993,https://www.abgeordnetenwatch.de/profile/stephan-stracke/archive/214996,619,242,Stephan Stracke (CDU/CSU),Stephan Stracke,stephan-stracke,1377,cducsu,Ich würde sagen: Die Vorschläge gehen am Thema vorbei. Das ist nichts anderes als bei der Rente mit 63.,TOP 18 Armuts- und Reichtumsbericht,15410,speech,18
620,794994,https://www.abgeordnetenwatch.de/profile/katja-mast/archive/217035,620,242,Katja Mast [SPD],Katja Mast,katja-mast,1737,spd,"Wer keine Pläne hat, braucht keine anderen Pläne zu kritisieren!",TOP 18 Armuts- und Reichtumsbericht,15410,poi,18
621,794995,https://www.abgeordnetenwatch.de/profile/stephan-stracke/archive/214996,621,242,Stephan Stracke (CDU/CSU),Stephan Stracke,stephan-stracke,1377,cducsu,"Auch zu den Vorschlägen zur Solidarrente, die hier unterbreitet wurden, lautet der Befund der Bertelsmann-Stiftung: Nicht zielführend.",TOP 18 Armuts- und Reichtumsbericht,15410,speech,18
