,id,profile_url,sequence,sitzung,speaker,speaker_cleaned,speaker_fp,speaker_key,speaker_party,text,top,top_id,type,wahlperiode
840,513502,https://www.abgeordnetenwatch.de/profile/dirk-fischer,840,244,Dirk Fischer (Hamburg) (CDU/CSU),Dirk Fischer,dirk-fischer,1831,cducsu,"Aber ich bekenne auch ausdrücklich, dass ich jetzt nach diesen vielen Parlamentsjahren unverändert als begeistertes Mitglied unserer parlamentarischen Demokratie, die nach Winston Churchill „von allen schlechten Staatsformen immer noch die allerbeste“ ist, ausscheide. Deswegen wünsche ich unserem Land und unserem Parlament, dem Deutschen Bundestag, eine gute Zukunft.","TOP 29 Emissionsfreie Mobilität, Bahnpolitik, Radverkehr",15436,speech,18
841,513503,,841,244,,,,,,"Anhaltender Beifall bei der CDU/CSU, der SPD und dem BÜNDNIS 90/DIE GRÜNEN","TOP 29 Emissionsfreie Mobilität, Bahnpolitik, Radverkehr",15436,poi,18
842,513504,,842,244,,,,,,Beifall bei der LINKEN,"TOP 29 Emissionsfreie Mobilität, Bahnpolitik, Radverkehr",15436,poi,18
843,513505,,843,244,,,,,,"Die Fraktionen der CDU/CSU, der SPD sowie Abgeordnete des BÜNDNISSES 90/DIE GRÜNEN erheben sich von ihren Plätzen","TOP 29 Emissionsfreie Mobilität, Bahnpolitik, Radverkehr",15436,poi,18
844,513506,https://www.abgeordnetenwatch.de/profile/claudia-roth-0,844,244,Vizepräsidentin Claudia Roth,Claudia Roth,claudia-roth,1686,,"Lieber Dirk Fischer, Sie sehen, das ganze Haus bedankt sich bei Ihnen. Sie haben diesem Haus 37 Jahre als streitbarer Hanseat - ich komme aus dem Süden; das war für mich erst einmal etwas Neues - ein Gesicht gegeben.

Wenn man Herrn Fischer wirklich leidenschaftlich erleben will, dann muss man auf den Fußballplatz gehen. Auch dafür danke ich Ihnen: für Ihre streitbare, leidenschaftliche Arbeit beim DFB, beim Norddeutschen Fußball-Verband und beim Hamburger Fußball-Verband. Ich weiß nicht, ob Sie Sankt Paulianer oder HSVler sind.","TOP 29 Emissionsfreie Mobilität, Bahnpolitik, Radverkehr",15436,chair,18
845,513507,,845,244,Zurufe,,,,,Oh!,"TOP 29 Emissionsfreie Mobilität, Bahnpolitik, Radverkehr",15436,poi,18
846,513508,https://www.abgeordnetenwatch.de/profile/dirk-fischer,846,244,Dirk Fischer [Hamburg] [CDU/CSU],Dirk Fischer,dirk-fischer,1831,cducsu,HSV und Union Berlin!,"TOP 29 Emissionsfreie Mobilität, Bahnpolitik, Radverkehr",15436,poi,18
847,513509,https://www.abgeordnetenwatch.de/profile/claudia-roth-0,847,244,Vizepräsidentin Claudia Roth,Claudia Roth,claudia-roth,1686,,"- Okay. Wenn Sie HSVler sind, dann treffen wir uns zusammen mit Herrn Bosbach - mit ihm bin ich schon verabredet -, wenn der HSV gegen Augsburg spielt. Aber wir können auch mal zu Sankt Pauli gehen.","TOP 29 Emissionsfreie Mobilität, Bahnpolitik, Radverkehr",15436,chair,18
848,513510,https://www.abgeordnetenwatch.de/profile/dr-ralf-brauksiepe-0,848,244,Dr. Ralf Brauksiepe [CDU/CSU],Dr. Ralf Brauksiepe,ralf-brauksiepe,1859,cducsu,Er ist Rekordspieler beim FC Bundestag!,"TOP 29 Emissionsfreie Mobilität, Bahnpolitik, Radverkehr",15436,poi,18
849,513511,https://www.abgeordnetenwatch.de/profile/claudia-roth-0,849,244,Vizepräsidentin Claudia Roth,Claudia Roth,claudia-roth,1686,,"Wir wünschen Ihnen, dem streitbaren und leidenschaftlichen Kollegen Dirk Fischer alles, alles Gute.","TOP 29 Emissionsfreie Mobilität, Bahnpolitik, Radverkehr",15436,chair,18
850,513512,,850,244,,,,,,Beifall,"TOP 29 Emissionsfreie Mobilität, Bahnpolitik, Radverkehr",15436,poi,18
851,513513,https://www.abgeordnetenwatch.de/profile/dirk-fischer,851,244,Dirk Fischer [Hamburg] [CDU/CSU],Dirk Fischer,dirk-fischer,1831,cducsu,Herzlichen Dank!,"TOP 29 Emissionsfreie Mobilität, Bahnpolitik, Radverkehr",15436,poi,18
852,513514,https://www.abgeordnetenwatch.de/profile/claudia-roth-0,852,244,Vizepräsidentin Claudia Roth,Claudia Roth,claudia-roth,1686,,Nächster Redner: Herbert Behrens für die Linke.,"TOP 29 Emissionsfreie Mobilität, Bahnpolitik, Radverkehr",15436,chair,18
853,513515,,853,244,,,,,,Beifall bei der LINKEN,"TOP 29 Emissionsfreie Mobilität, Bahnpolitik, Radverkehr",15436,poi,18
854,513516,https://www.abgeordnetenwatch.de/profile/herbert-behrens/archive/215393,854,244,Herbert Behrens (DIE LINKE),Herbert Behrens,herbert-behrens,1344,linke,"Auch mein Dank für die Zusammenarbeit gilt dem Kollegen Fischer, den ich aus dem Verkehrsausschuss sehr gut kenne. Auch von meiner Seite aus alles Gute für Ihre Zukunft!","TOP 29 Emissionsfreie Mobilität, Bahnpolitik, Radverkehr",15436,speech,18
855,513517,,855,244,,,,,,"Beifall bei Abgeordneten der LINKEN, der SPD und des BÜNDNISSES 90/DIE GRÜNEN","TOP 29 Emissionsfreie Mobilität, Bahnpolitik, Radverkehr",15436,poi,18
856,513518,https://www.abgeordnetenwatch.de/profile/herbert-behrens/archive/215393,856,244,Herbert Behrens (DIE LINKE),Herbert Behrens,herbert-behrens,1344,linke,"Liebe Kolleginnen und Kollegen! Es ist gut, dass wir uns am Ende der Legislaturperiode noch einmal mit einem zentralen verkehrspolitischen Thema - eher einem Problem - auseinandersetzen. Es geht nämlich um den unrühmlichen Beitrag, den der Autoverkehr zur Schädigung des Klimas leistet, und auch um das Versagen der Bundesregierung, auf dieses Problem angemessen zu reagieren. Das wollen wir ihr nicht durchgehen lassen.","TOP 29 Emissionsfreie Mobilität, Bahnpolitik, Radverkehr",15436,speech,18
857,513519,,857,244,,,,,,Beifall bei der LINKEN,"TOP 29 Emissionsfreie Mobilität, Bahnpolitik, Radverkehr",15436,poi,18
858,513520,https://www.abgeordnetenwatch.de/profile/herbert-behrens/archive/215393,858,244,Herbert Behrens (DIE LINKE),Herbert Behrens,herbert-behrens,1344,linke,"Die Fraktion der Grünen hat Vorschläge gemacht, wie der Verkehr vom Automobil auf umweltgerechtere Verkehrsmittel wie die Bahn oder auch das Fahrrad übertragen werden kann. Dagegen steht das völlige Kontrastprogramm der Bundesregierung, die die politischen Fehler der vergangenen Jahrzehnte fortsetzt. Der Verkehrsminister verbreitet mit seinen Sprechblasen zwar immer wieder den Eindruck, dass er die Mobilitätsrevolution anführt und an der Spitze der Bewegung steht, wenn er von Modernität spricht, aber in Wirklichkeit reicht die Fantasie der Bundesregierung, wenn man genau hinschaut, nicht weiter als von der Fahrertür bis zum Fahrersitz.","TOP 29 Emissionsfreie Mobilität, Bahnpolitik, Radverkehr",15436,speech,18
859,513521,,859,244,,,,,,Beifall bei der LINKEN,"TOP 29 Emissionsfreie Mobilität, Bahnpolitik, Radverkehr",15436,poi,18
860,513522,https://www.abgeordnetenwatch.de/profile/herbert-behrens/archive/215393,860,244,Herbert Behrens (DIE LINKE),Herbert Behrens,herbert-behrens,1344,linke,"Vom Gesetz zum automatisierten Fahren über die Bundesfernstraßengesellschaft bis hin zur Kaufprämie für Elektroautos finden wir nur Geschenke für die Industrie. Die arbeitet mit systematischem Abgasbetrug - das wissen wir - unter den Augen der Aufsichtsbehörden und hat dazu beigetragen, dass wir den größten Skandal der letzten Jahrzehnte im Verkehrssektor zu beklagen haben, und zwar zulasten der Gesundheit der Menschen, zulasten der Beschäftigten in der Automobilindustrie, die um ihre Zukunft bangen, obwohl sie dringend für eine moderne Verkehrspolitik der Zukunft gebraucht werden.

Seit einem Jahr gibt es jetzt die Kaufprämie für Elektrofahrzeuge. 600 Millionen Euro gibt es vom Staat, 600 Millionen Euro angeblich von der Automobilindustrie, die über Rabatte finanziert werden sollen. Jeder von uns weiß: Rabatte gibt es bei jedem Autokauf. Ich weiß nicht, was der Beitrag sein soll.","TOP 29 Emissionsfreie Mobilität, Bahnpolitik, Radverkehr",15436,speech,18
861,513523,,861,244,,,,,,Beifall bei der LINKEN,"TOP 29 Emissionsfreie Mobilität, Bahnpolitik, Radverkehr",15436,poi,18
862,513524,https://www.abgeordnetenwatch.de/profile/herbert-behrens/archive/215393,862,244,Herbert Behrens (DIE LINKE),Herbert Behrens,herbert-behrens,1344,linke,"Elektroautos werden von fast allen hier vertretenen Fraktionen im Bundestag als Heilsbringer gefeiert. Bis vor kurzem standen diese Fraktionen auch geschlossen hinter dem sogenannten Umweltbonus, also der Kaufprämie für E-Autos. Ich bin froh, dass jetzt im Antrag der Grünen zumindest eine Abkehr erkennbar ist und sie ein Stück weit unseren Vorschlägen folgen. Die Kaufprämie ist nämlich sehr kritisch zu sehen und hält längst nicht das, was sie halten soll. Diese Art von Umweltbonus ist ein Etikettenschwindel.","TOP 29 Emissionsfreie Mobilität, Bahnpolitik, Radverkehr",15436,speech,18
863,513525,,863,244,,,,,,Beifall bei der LINKEN,"TOP 29 Emissionsfreie Mobilität, Bahnpolitik, Radverkehr",15436,poi,18
864,513526,https://www.abgeordnetenwatch.de/profile/herbert-behrens/archive/215393,864,244,Herbert Behrens (DIE LINKE),Herbert Behrens,herbert-behrens,1344,linke,"Mit diesem Bonus werden indirekt die großen Spritfresser subventioniert. Der Hintergrund ist ganz simpel: Demnächst müssen die Fahrzeugflotten das Klimaziel von 35 Gramm CO2-Ausstoß pro Kilometer einhalten. Das kann man mit den großen Limousinen nicht erreichen. Also bedarf es einer entsprechenden Umverteilung unter Einbeziehung von Elektroautos, damit der Schnitt wieder eingehalten werden kann. Das ist keine zukunftsfähige Verkehrspolitik. Das lehnen wir deshalb ab.

Mit anderen Worten: Die Industrie hat ihre Dieselflotte mit dem Umweltbonus subventioniert. Das können wir in der Zukunft nicht zulassen. Wir brauchen eine echte Wende in der Verkehrspolitik. Darum brauchen wir eine echte Veränderung auch bei den Mehrheitsverhältnissen hier im Bundestag.","TOP 29 Emissionsfreie Mobilität, Bahnpolitik, Radverkehr",15436,speech,18
865,513527,,865,244,,,,,,Beifall bei der LINKEN,"TOP 29 Emissionsfreie Mobilität, Bahnpolitik, Radverkehr",15436,poi,18
866,513528,https://www.abgeordnetenwatch.de/profile/claudia-roth-0,866,244,Vizepräsidentin Claudia Roth,Claudia Roth,claudia-roth,1686,,"Vielen Dank, Herbert Behrens. - Nächste Rednerin für die SPD-Fraktion: Birgit Kömpel.","TOP 29 Emissionsfreie Mobilität, Bahnpolitik, Radverkehr",15436,chair,18
867,513529,,867,244,,,,,,Beifall bei der SPD,"TOP 29 Emissionsfreie Mobilität, Bahnpolitik, Radverkehr",15436,poi,18
868,513530,https://www.abgeordnetenwatch.de/profile/birgit-kompel-0,868,244,Birgit Kömpel (SPD),Birgit Kömpel,birgit-kompel,1452,spd,"Sehr geehrte Frau Präsidentin! Meine sehr verehrten Damen und Herren! Wer unser Regierungsprogramm gelesen hat, der wird vieles aus dem Antrag der Grünen dort bereits gefunden haben; denn für die SPD ist vollkommen klar: Ein einseitiges Setzen auf fossile Antriebe hat keine Zukunft. Wir brauchen saubere, emissionsfreie und leise Antriebe, wenn wir auch in Zukunft individuell mobil sein wollen.","TOP 29 Emissionsfreie Mobilität, Bahnpolitik, Radverkehr",15436,speech,18
869,513531,,869,244,,,,,,Beifall bei der SPD,"TOP 29 Emissionsfreie Mobilität, Bahnpolitik, Radverkehr",15436,poi,18
870,513532,https://www.abgeordnetenwatch.de/profile/birgit-kompel-0,870,244,Birgit Kömpel (SPD),Birgit Kömpel,birgit-kompel,1452,spd,Die Zukunft der Autos geht nur elektrisch; da sind wir uns einig. Aber als Sozialdemokraten denken wir natürlich auch an die Arbeitsplätze.,"TOP 29 Emissionsfreie Mobilität, Bahnpolitik, Radverkehr",15436,speech,18
871,513533,https://www.abgeordnetenwatch.de/profile/cem-ozdemir-0,871,244,Cem Özdemir [BÜNDNIS 90/DIE GRÜNEN],Cem Özdemir,cem-ozdemir,1421,gruene,Das tun auch wir! Das sollten alle tun!,"TOP 29 Emissionsfreie Mobilität, Bahnpolitik, Radverkehr",15436,poi,18
872,513534,https://www.abgeordnetenwatch.de/profile/birgit-kompel-0,872,244,Birgit Kömpel (SPD),Birgit Kömpel,birgit-kompel,1452,spd,"- Lassen Sie mich doch ausreden. Da sind wir überhaupt nicht so weit voneinander entfernt. - Wichtig ist - deshalb danke ich den Grünen für den Antrag -, dass wir uns jetzt Gedanken machen; denn die Zeit läuft uns davon.","TOP 29 Emissionsfreie Mobilität, Bahnpolitik, Radverkehr",15436,speech,18
873,513535,https://www.abgeordnetenwatch.de/profile/cem-ozdemir-0,873,244,Cem Özdemir [BÜNDNIS 90/DIE GRÜNEN],Cem Özdemir,cem-ozdemir,1421,gruene,So ist es!,"TOP 29 Emissionsfreie Mobilität, Bahnpolitik, Radverkehr",15436,poi,18
874,513536,https://www.abgeordnetenwatch.de/profile/birgit-kompel-0,874,244,Birgit Kömpel (SPD),Birgit Kömpel,birgit-kompel,1452,spd,"Neben der Förderung von Forschung im Bereich alternativer Antriebe müssen wir dafür sorgen, dass wir einen sanften Übergang für die vielen Arbeitnehmer und Arbeitnehmerinnen in der Automobilindustrie hinbekommen. Das Ziel der Grünen, ab 2030 nur noch Elektromotoren zuzulassen, halte ich persönlich für sehr ambitioniert. Wir haben gerade gehört, dass Instrumente wie die Kaufprämie noch nicht so richtig wirken. Aber nur zu sagen, das gehe nicht, hilft uns hier nicht weiter.","TOP 29 Emissionsfreie Mobilität, Bahnpolitik, Radverkehr",15436,speech,18
875,513537,https://www.abgeordnetenwatch.de/profile/oliver-krischer/archive/215110,875,244,Oliver Krischer [BÜNDNIS 90/DIE GRÜNEN],Oliver Krischer,oliver-krischer,1450,gruene,Das ist schon mal ein Ansatz!,"TOP 29 Emissionsfreie Mobilität, Bahnpolitik, Radverkehr",15436,poi,18
876,513538,https://www.abgeordnetenwatch.de/profile/birgit-kompel-0,876,244,Birgit Kömpel (SPD),Birgit Kömpel,birgit-kompel,1452,spd,"Hier müssen Konzepte und Lösungen her, die uns einen sanften Übergang in die neuen Technologien ermöglichen.

Sehr hilfreich finde ich hierbei die Vorschläge unseres Kanzlerkandidaten Martin Schulz, die Bundesagentur für Arbeit neu zu strukturieren. Wir brauchen bessere Weiterbildungs- und Qualifizierungsangebote und müssen den Arbeitnehmerinnen und Arbeitnehmern die Möglichkeit geben, sich in neue Bereiche einzuarbeiten.","TOP 29 Emissionsfreie Mobilität, Bahnpolitik, Radverkehr",15436,speech,18
877,513539,,877,244,,,,,,Beifall bei der SPD,"TOP 29 Emissionsfreie Mobilität, Bahnpolitik, Radverkehr",15436,poi,18
878,513540,https://www.abgeordnetenwatch.de/profile/birgit-kompel-0,878,244,Birgit Kömpel (SPD),Birgit Kömpel,birgit-kompel,1452,spd,"Wir brauchen Qualifizierung und soziale Absicherung. Wir wollen auch die Bedingungen für Firmengründungen und Start-ups im Bereich Elektroantriebe und Batteriezellenfertigung entscheidend verbessern.

Wenn wir von Mobilität reden, dann denke ich als Abgeordnete aus dem Wahlkreis Fulda/Vogelsberg natürlich vor allem an den ländlichen Raum. Anders als in der Großstadt können die Menschen im ländlichen Raum nicht immer auf ein funktionierendes Netz von öffentlichen Verkehrsmitteln zurückgreifen.","TOP 29 Emissionsfreie Mobilität, Bahnpolitik, Radverkehr",15436,speech,18
879,513541,https://www.abgeordnetenwatch.de/profile/sabine-leidig/archive/215554,879,244,Sabine Leidig [DIE LINKE],Sabine Leidig,sabine-leidig,1854,linke,Dann muss man was ändern!,"TOP 29 Emissionsfreie Mobilität, Bahnpolitik, Radverkehr",15436,poi,18
880,513542,https://www.abgeordnetenwatch.de/profile/birgit-kompel-0,880,244,Birgit Kömpel (SPD),Birgit Kömpel,birgit-kompel,1452,spd,"- Genau.

Carsharing ist derzeit ein gutes Konzept für die Stadt. Aber auch auf dem Land gibt es natürlich viele Menschen, die von A nach B kommen müssen. Was tut man also? Man setzt sich in sein Auto. Das tun viele Menschen auf dem Land. Oft sind es weite Strecken, die sie fahren müssen, und viele Menschen pendeln täglich aus dem ländlichen Raum in die Großstädte.

Es gibt zwar schon Modelle von Elektroautos, die eine Reichweite von 500 Kilometern und mehr haben, aber jetzt machen wir uns einmal ehrlich: Diese Autos sind für Otto Normalverbraucher derzeit nicht erschwinglich.","TOP 29 Emissionsfreie Mobilität, Bahnpolitik, Radverkehr",15436,speech,18
881,513543,https://www.abgeordnetenwatch.de/profile/kirsten-luhmann/archive/216673,881,244,Kirsten Lühmann [SPD],Kirsten Lühmann,kirsten-luhmann,1435,spd,Richtig! Das ist das Problem!,"TOP 29 Emissionsfreie Mobilität, Bahnpolitik, Radverkehr",15436,poi,18
882,513544,https://www.abgeordnetenwatch.de/profile/birgit-kompel-0,882,244,Birgit Kömpel (SPD),Birgit Kömpel,birgit-kompel,1452,spd,"- Das ist das Problem; ganz genau.

Trotzdem lassen sich auch im ländlichen Raum Konzepte entwickeln, mit denen Emissionen eingespart werden können. Eine flächendeckende Breitbandversorgung und eine ausreichende Funknetzinfrastruktur sind Voraussetzungen für emissionsbewusste Mobilität auch auf dem Land.","TOP 29 Emissionsfreie Mobilität, Bahnpolitik, Radverkehr",15436,speech,18
883,513545,,883,244,,,,,,Beifall bei der SPD,"TOP 29 Emissionsfreie Mobilität, Bahnpolitik, Radverkehr",15436,poi,18
884,513546,https://www.abgeordnetenwatch.de/profile/birgit-kompel-0,884,244,Birgit Kömpel (SPD),Birgit Kömpel,birgit-kompel,1452,spd,"Staatliche Förderung darf hier und muss hier nach beiden Seiten erfolgen. Durch die Verbesserung unserer digitalen Infrastruktur können sich auch die Menschen im ländlichen Raum besser vernetzen. Dann können auch hier Konzepte wie Carsharing und Plattformen oder Apps für Mitfahrgelegenheiten entstehen; denn das ist umweltschonend, und das ist auch erschwinglich für jedermann und jede Frau.

In diesem Sinne wünsche ich Ihnen allen eine tollen Sommer. Ich freue mich darauf, Sie alle gesund und munter im September hier wiederzusehen.

Herzlichen Dank.","TOP 29 Emissionsfreie Mobilität, Bahnpolitik, Radverkehr",15436,speech,18
885,513547,,885,244,,,,,,Beifall bei der SPD,"TOP 29 Emissionsfreie Mobilität, Bahnpolitik, Radverkehr",15436,poi,18
886,513548,https://www.abgeordnetenwatch.de/profile/claudia-roth-0,886,244,Vizepräsidentin Claudia Roth,Claudia Roth,claudia-roth,1686,,"Vielen Dank, Birgit Kömpel. - Nächster Redner: Oliver Krischer für Bündnis 90/Die Grünen.","TOP 29 Emissionsfreie Mobilität, Bahnpolitik, Radverkehr",15436,chair,18
887,513549,https://www.abgeordnetenwatch.de/profile/oliver-krischer/archive/215110,887,244,Oliver Krischer (BÜNDNIS 90/DIE GRÜNEN),Oliver Krischer,oliver-krischer,1450,gruene,"Frau Präsidentin! Liebe Kolleginnen und Kollegen! Ich habe gerade von Herrn Fischer Namen von Verkehrsministern wie Georg Leber oder Volker Hauff gehört. Wenn man sich den aktuellen Verkehrsminister anschaut, kann man nur sagen: Manchmal geht es auch abwärts mit diesem Land.","TOP 29 Emissionsfreie Mobilität, Bahnpolitik, Radverkehr",15436,speech,18
888,513550,,888,244,,,,,,Beifall beim BÜNDNIS 90/DIE GRÜNEN sowie bei Abgeordneten der SPD,"TOP 29 Emissionsfreie Mobilität, Bahnpolitik, Radverkehr",15436,poi,18
889,513551,https://www.abgeordnetenwatch.de/profile/oliver-krischer/archive/215110,889,244,Oliver Krischer (BÜNDNIS 90/DIE GRÜNEN),Oliver Krischer,oliver-krischer,1450,gruene,"Wo ist er überhaupt? Wir sitzen hier zum wiederholten Mal und diskutieren hier über die Mobilität der Zukunft, diskutieren über die Zukunft der Autoindustrie, und - es ist schon interessant, dass es die Grünen sind, die diese Themen hier auf die Tagesordnung setzen - Alexander Dobrindt nicht da ist. Er hat offensichtlich Wichtigeres zu tun.","TOP 29 Emissionsfreie Mobilität, Bahnpolitik, Radverkehr",15436,speech,18
890,513552,,890,244,,,,,,Beifall beim BÜNDNIS 90/DIE GRÜNEN,"TOP 29 Emissionsfreie Mobilität, Bahnpolitik, Radverkehr",15436,poi,18
891,513553,https://www.abgeordnetenwatch.de/profile/matthias-gastel/archive/215312,891,244,Matthias Gastel [BÜNDNIS 90/DIE GRÜNEN],Matthias Gastel,matthias-gastel,1552,gruene,Das ist nicht sein Thema!,"TOP 29 Emissionsfreie Mobilität, Bahnpolitik, Radverkehr",15436,poi,18
892,513554,https://www.abgeordnetenwatch.de/profile/oliver-krischer/archive/215110,892,244,Oliver Krischer (BÜNDNIS 90/DIE GRÜNEN),Oliver Krischer,oliver-krischer,1450,gruene,"Das ist typisch für das, was hier in der Verkehrspolitik läuft.

Herr Bilger, ich möchte Ihnen etwas sagen. Sie haben gesagt, es sei Wunschdenken, ab 2030 nur noch emissionsfreie Mobilität haben zu wollen. Nein, das ist eine existenzielle Frage für das Überleben der Menschheit auf diesem Planeten. Darum geht es.","TOP 29 Emissionsfreie Mobilität, Bahnpolitik, Radverkehr",15436,speech,18
893,513555,,893,244,,,,,,Beifall beim BÜNDNIS 90/DIE GRÜNEN,"TOP 29 Emissionsfreie Mobilität, Bahnpolitik, Radverkehr",15436,poi,18
894,513556,https://www.abgeordnetenwatch.de/profile/oliver-krischer/archive/215110,894,244,Oliver Krischer (BÜNDNIS 90/DIE GRÜNEN),Oliver Krischer,oliver-krischer,1450,gruene,"Wir alle hier haben die Hände für das Pariser Klimaabkommen gehoben. Das Pariser Klimaabkommen besagt: Mitte dieses Jahrhunderts, bis 2050, darf es keine Nettoemissionen mehr geben. Da man weiß, dass ein Auto durchschnittlich 20 Jahre auf der Straße ist, wird man irgendwann um das Jahr 2030 nur noch emissionsfreie Mobilität zulassen können, oder aber man sagt: Das Pariser Klimaabkommen interessiert uns nicht, wir haben bei der Abstimmung darüber zwar die Hand gehoben, aber wir setzen es nicht um. Beides zusammen aber geht nicht. Entscheiden Sie sich, was Sie wollen.","TOP 29 Emissionsfreie Mobilität, Bahnpolitik, Radverkehr",15436,speech,18
895,513557,,895,244,,,,,,Beifall beim BÜNDNIS 90/DIE GRÜNEN,"TOP 29 Emissionsfreie Mobilität, Bahnpolitik, Radverkehr",15436,poi,18
896,513558,https://www.abgeordnetenwatch.de/profile/oliver-krischer/archive/215110,896,244,Oliver Krischer (BÜNDNIS 90/DIE GRÜNEN),Oliver Krischer,oliver-krischer,1450,gruene,"Ich sage Ihnen auch: Es geht nicht nur um Klimaschutz. Selbstverständlich werden wir die Mobilität verändern müssen. Selbstverständlich werden wir in den öffentlichen Verkehr, in den Radverkehr investieren müssen. Aber die Automobilindustrie ist die wichtigste Industrie unseres Landes. Ich will nicht, dass möglicherweise noch vor 2030 ein in Ostasien gefertigter e-Golf in Bremerhaven vom Schiff rollt und dann unsere Automobilindustrie den Bach runtergeht. Das darf nicht passieren. Dafür müssen wir uns aufstellen.","TOP 29 Emissionsfreie Mobilität, Bahnpolitik, Radverkehr",15436,speech,18
897,513559,,897,244,,,,,,Beifall beim BÜNDNIS 90/DIE GRÜNEN,"TOP 29 Emissionsfreie Mobilität, Bahnpolitik, Radverkehr",15436,poi,18
898,513560,https://www.abgeordnetenwatch.de/profile/oliver-krischer/archive/215110,898,244,Oliver Krischer (BÜNDNIS 90/DIE GRÜNEN),Oliver Krischer,oliver-krischer,1450,gruene,"Ich habe viel aus der Rubrik Wünsch-dir-Was gehört, was man alles in dieser Regierung machen könnte. Dazu sage ich: Sie regieren seit vier Jahren. Sie hätten hier handeln können.","TOP 29 Emissionsfreie Mobilität, Bahnpolitik, Radverkehr",15436,speech,18
899,513561,,899,244,,,,,,Beifall beim BÜNDNIS 90/DIE GRÜNEN,"TOP 29 Emissionsfreie Mobilität, Bahnpolitik, Radverkehr",15436,poi,18
900,513562,https://www.abgeordnetenwatch.de/profile/oliver-krischer/archive/215110,900,244,Oliver Krischer (BÜNDNIS 90/DIE GRÜNEN),Oliver Krischer,oliver-krischer,1450,gruene,"Aber heute ist der letzte reguläre Sitzungstag.

Man kann sich beispielsweise Ihre Kaufprämie anschauen. Ich habe das am eigenen Leib praktiziert und mir ein Elektrofahrzeug gekauft. Was haben Sie gemacht? Die Kaufprämie kommt bei den Menschen, die kaufen wollen, gar nicht an, weil die Händler und die Autoindustrie sie einsacken. Die Fahrzeuge kosten vor Abzug der Kaufprämie genau das gleiche wie danach. Ihre Kaufprämie verpufft. Das sieht man auch daran, dass Sie gerade mal 11 000 Fahrzeuge in Deutschland gefördert haben bei 3,4 Millionen Zulassungen pro Jahr. Das ist im Promillebereich. Das ist lachhaft. Und das nennt sich bei Ihnen „weltweiter Leitmarkt für Elektromobilität“? Eine größere Bankrotterklärung, meine Damen und Herren, kann es von dieser Großen Koalition nicht geben.","TOP 29 Emissionsfreie Mobilität, Bahnpolitik, Radverkehr",15436,speech,18
901,513563,,901,244,,,,,,Beifall beim BÜNDNIS 90/DIE GRÜNEN,"TOP 29 Emissionsfreie Mobilität, Bahnpolitik, Radverkehr",15436,poi,18
902,513564,https://www.abgeordnetenwatch.de/profile/oliver-krischer/archive/215110,902,244,Oliver Krischer (BÜNDNIS 90/DIE GRÜNEN),Oliver Krischer,oliver-krischer,1450,gruene,"Frau Merkel hat es inzwischen offen zuzugeben. Sie wollte bis 2020  1 Million Elektrofahrzeuge haben. Dieses Ziel hat sie seit 2007 zehn Jahre lang vor sich hergetragen. Sie ist weit von diesem Ziel entfernt. Und wie in dieser Bundesregierung üblich: Beim Klimaschutz, bei den erneuerbaren Energien, bei der Energieeffizienz - überall werden, wenn das Zieldatum näherrückt, die Ziele einfach weggeräumt. Meine Damen und Herren, das ist nicht zukunftsfähig. Wir brauchen verlässliche Rahmenbedingungen und politische Steuerung, damit sich die Industrie auch darauf einstellen kann. Das ist die Zukunft.

Wir Grüne wollen, dass die Menschen nicht am Ende in Wolfsburg, in Stuttgart und in München abends ins Bett gehen und morgens in Detroit aufwachen. Wir sollten aus den Fehlern von anderen lernen und klare Rahmenbedingungen setzen für die Zukunft der Automobilindustrie sowie für eine nachhaltige und emissionsfreie Mobilität. Darum geht es.

Das ist Zukunftspolitik für unser Land, und diese Zukunftspolitik wird von dieser Bundesregierung und diesem Verkehrsminister verweigert.

Danke schön.","TOP 29 Emissionsfreie Mobilität, Bahnpolitik, Radverkehr",15436,speech,18
903,513565,,903,244,,,,,,Beifall beim BÜNDNIS 90/DIE GRÜNEN,"TOP 29 Emissionsfreie Mobilität, Bahnpolitik, Radverkehr",15436,poi,18
904,513566,https://www.abgeordnetenwatch.de/profile/claudia-roth-0,904,244,Vizepräsidentin Claudia Roth,Claudia Roth,claudia-roth,1686,,"Vielen Dank, Oliver Krischer. - Nächster Redner ist Gero Storjohann, CDU/CSU-Fraktion.","TOP 29 Emissionsfreie Mobilität, Bahnpolitik, Radverkehr",15436,chair,18
905,513567,,905,244,,,,,,Beifall bei der CDU/CSU,"TOP 29 Emissionsfreie Mobilität, Bahnpolitik, Radverkehr",15436,poi,18
