,id,profile_url,sequence,sitzung,speaker,speaker_cleaned,speaker_fp,speaker_key,speaker_party,text,top,top_id,type,wahlperiode
433,513095,https://www.abgeordnetenwatch.de/profile/christian-flisek-0,433,244,Christian Flisek (SPD),Christian Flisek,christian-flisek,1508,spd,"Man muss sich einmal klarmachen, was ein Vorrang der Lizenzangebote ganz allgemein bedeutet hätte. Schon ein Lizenzangebot, also allein das Angebot, hätte dazu geführt, dass ein Verlag die gesetzlichen Schrankenregelungen hätte aushebeln können. Wenn wir einen Ausgleich zwischen Verlegern auf der einen Seite und Wissenschaft und Lehre auf der anderen Seite schaffen wollen, dann können wir eine gesetzliche Regelung nicht zur Disposition nur einer Seite stellen. Deswegen haben wir uns entschieden dagegen gewehrt.",TOP ZP 13 Urheberrechts-Wissensgesellschafts- Gesetz,15433,speech,18
434,513096,,434,244,,,,,,Beifall bei der SPD,TOP ZP 13 Urheberrechts-Wissensgesellschafts- Gesetz,15433,poi,18
435,513097,https://www.abgeordnetenwatch.de/profile/christian-flisek-0,435,244,Christian Flisek (SPD),Christian Flisek,christian-flisek,1508,spd,"Die SPD-Fraktion hat hier eine rote Linie gezogen und den Kern der Reform, den Vorrang der Schranke vor vertraglichen Angeboten, durchgesetzt. Das ist unserer klaren Linie geschuldet. So haben wir den bildungs- und wissenschaftsfreundlichen Charakter dieses Gesetzes erhalten können.

Meine Damen und Herren, ich möchte mich abschließend auch im Namen der SPD-Fraktion bei all jenen, die sich im Urheberrecht engagiert haben, für die ausgezeichnete Arbeit bedanken. Ich danke dem Bundesminister der Justiz und für Verbraucherschutz, Herrn Heiko Maas, und dem zuständigen Parlamentarischen Staatssekretär Christian Lange. Aber ich bitte Sie, Herr Minister, dieses Lob auch an Ihr Referat weiterzugeben. Es war über die weite Strecke dieser Legislaturperiode hinweg eine sehr intensive, fachlich höchst kompetente und immer konstruktive Zusammenarbeit.",TOP ZP 13 Urheberrechts-Wissensgesellschafts- Gesetz,15433,speech,18
436,513098,,436,244,,,,,,Beifall bei der SPD sowie bei Abgeordneten der CDU/CSU,TOP ZP 13 Urheberrechts-Wissensgesellschafts- Gesetz,15433,poi,18
437,513099,https://www.abgeordnetenwatch.de/profile/christian-flisek-0,437,244,Christian Flisek (SPD),Christian Flisek,christian-flisek,1508,spd,"Ich möchte mich aber auch bei den Kolleginnen und Kollegen meiner Fraktion bedanken, die über alle Fachbereiche hinweg Interesse am Urheberrecht hatten. Es sei mir erlaubt, dass ich einen hervorhebe, nämlich Siggi Ehrmann, weil er in der nächsten Legislaturperiode dem Bundestag nicht mehr angehören wird.",TOP ZP 13 Urheberrechts-Wissensgesellschafts- Gesetz,15433,speech,18
438,513100,,438,244,,,,,,Beifall bei Abgeordneten der SPD,TOP ZP 13 Urheberrechts-Wissensgesellschafts- Gesetz,15433,poi,18
439,513101,https://www.abgeordnetenwatch.de/profile/christian-flisek-0,439,244,Christian Flisek (SPD),Christian Flisek,christian-flisek,1508,spd,"Siggi, bei dir waren die urheberrechtlichen Interessen der Kreativen und der Kulturschaffenden immer gut aufgehoben. Herzlichen Dank dafür!",TOP ZP 13 Urheberrechts-Wissensgesellschafts- Gesetz,15433,speech,18
440,513102,,440,244,,,,,,Beifall bei der SPD sowie bei Abgeordneten des BÜNDNISSES 90/DIE GRÜNEN und der Abg. Dr. Petra Sitte [DIE LINKE],TOP ZP 13 Urheberrechts-Wissensgesellschafts- Gesetz,15433,poi,18
441,513103,https://www.abgeordnetenwatch.de/profile/christian-flisek-0,441,244,Christian Flisek (SPD),Christian Flisek,christian-flisek,1508,spd,"Meine Damen und Herren, ich möchte zum Schluss meinen Dank auch an die Kolleginnen und Kollegen des Koalitionspartners richten. Trotz aller Interessengegensätze haben wir immer fair zusammengearbeitet. Gerade bei diesem letzten Thema - das muss ich als Rechtspolitiker sagen - gab es eine ganz besondere Nähe zu den Bildungspolitikern in der Fraktion.",TOP ZP 13 Urheberrechts-Wissensgesellschafts- Gesetz,15433,speech,18
442,513104,,442,244,,,,,,Beifall des Abg. Dr. Ernst Dieter Rossmann [SPD],TOP ZP 13 Urheberrechts-Wissensgesellschafts- Gesetz,15433,poi,18
443,513105,https://www.abgeordnetenwatch.de/profile/christian-flisek-0,443,244,Christian Flisek (SPD),Christian Flisek,christian-flisek,1508,spd,"So ist das nun einmal. Aber wir sind zu einem guten Ergebnis gekommen.

Herzlichen Dank und Ihnen noch eine gute Zeit.",TOP ZP 13 Urheberrechts-Wissensgesellschafts- Gesetz,15433,speech,18
444,513106,,444,244,,,,,,Beifall bei der SPD sowie bei Abgeordneten der CDU/CSU,TOP ZP 13 Urheberrechts-Wissensgesellschafts- Gesetz,15433,poi,18
445,513107,https://www.abgeordnetenwatch.de/profile/michaela-noll/archive/214647,445,244,Vizepräsidentin Michaela Noll,Michaela Noll,michaela-noll,1722,,"Vielen Dank, Herr Kollege Flisek. - Als Nächster hat Dr. Stefan Heck für die CDU/CSU-Fraktion das Wort.",TOP ZP 13 Urheberrechts-Wissensgesellschafts- Gesetz,15433,chair,18
446,513108,,446,244,,,,,,Beifall bei der CDU/CSU,TOP ZP 13 Urheberrechts-Wissensgesellschafts- Gesetz,15433,poi,18
447,513109,,447,244,Dr. Stefan Heck (CDU/CSU),Dr. Stefan Heck,stefan-heck,,cducsu,"Frau Präsidentin! Liebe Kolleginnen und Kollegen! Liebe Gäste auf der Tribüne! Wir setzen heute den Koalitionsvertrag um, in dem festgelegt wurde, dass wir eine Bildungs- und Wissenschaftsschranke einführen wollen. Aber ich will ganz ehrlich sagen: Ich kann die Euphorie, die hier teilweise in den Wortmeldungen aus den Reihen der Koalition aufkam, als Rechtspolitiker der Union nicht so richtig teilen.",TOP ZP 13 Urheberrechts-Wissensgesellschafts- Gesetz,15433,speech,18
448,513110,https://www.abgeordnetenwatch.de/profile/kai-gehring/archive/215144,448,244,Kai Gehring [BÜNDNIS 90/DIE GRÜNEN],Kai Gehring,kai-gehring,1821,gruene,Ach!,TOP ZP 13 Urheberrechts-Wissensgesellschafts- Gesetz,15433,poi,18
449,513111,,449,244,Dr. Stefan Heck (CDU/CSU),Dr. Stefan Heck,stefan-heck,,cducsu,Wir haben in dieser Legislaturperiode ein ausgesprochen anspruchsvolles Arbeitsprogramm im Bereich des Urheberrechts gehabt.,TOP ZP 13 Urheberrechts-Wissensgesellschafts- Gesetz,15433,speech,18
450,513112,https://www.abgeordnetenwatch.de/profile/kai-gehring/archive/215144,450,244,Kai Gehring [BÜNDNIS 90/DIE GRÜNEN],Kai Gehring,kai-gehring,1821,gruene,Mit den Börsen!,TOP ZP 13 Urheberrechts-Wissensgesellschafts- Gesetz,15433,poi,18
451,513113,,451,244,Dr. Stefan Heck (CDU/CSU),Dr. Stefan Heck,stefan-heck,,cducsu,"Wir haben zu Beginn auf Grundlage einer europäischen Richtlinie das Verwertungsgesellschaftengesetz neu geregelt. Wir haben uns dann sehr intensiv mit dem Urhebervertragsrecht beschäftigt und die Novelle gemeinsam zum Abschluss gebracht. Es war gut, dass wir bei all diesen Gesetzen eines immer ganz besonders im Blick hatten: die Rechte der Urheberinnen und Urheber und der Rechteinhaber, die dafür sorgen, dass das geistige Eigentum, über das wir sprechen, überhaupt erst entsteht. Uns als Union war dabei immer wichtig, dass wir die grundlegenden Regeln und Überzeugungen, die wir im analogen Zusammenleben haben, auf das Digitale zu übertragen versuchen. Das gilt für viele Rechtsbereiche; das gilt für die Innenpolitik, und das gilt ganz besonders auch für die Rechtspolitik. Da ist es eben so, dass ein Ausgleich der Interessen, von dem gesprochen worden ist, im Regelfall dadurch stattfindet, dass eine Seite für die Leistungen der anderen Seite Geld bezahlt.",TOP ZP 13 Urheberrechts-Wissensgesellschafts- Gesetz,15433,speech,18
452,513114,https://www.abgeordnetenwatch.de/profile/albert-rupprecht-0,452,244,Albert Rupprecht [CDU/CSU],Albert Rupprecht,albert-rupprecht,1691,cducsu,Das wird auch in Zukunft so sein!,TOP ZP 13 Urheberrechts-Wissensgesellschafts- Gesetz,15433,poi,18
453,513115,,453,244,Dr. Stefan Heck (CDU/CSU),Dr. Stefan Heck,stefan-heck,,cducsu,"Es ist schade, dass wir diesen Weg heute ein Stück weit verlassen. Wir haben Schranken im Urheberrecht, und sie haben ihre gute Berechtigung. Ja, es geht um die Wissenschaftsfreiheit, die im Grundgesetz zu Recht einen besonderen Schutz erfährt; aber es geht eben auch um die Eigentumsfreiheit aus Artikel 14 des Grundgesetzes. Wir wissen, dass im Urheberrecht immer auch in besonderer Weise das Persönlichkeitsrecht der Urheberinnen und Urheber eine Rolle spielt. Ich glaube, dass in diesem besonderen Spannungsfeld der Grundrechte für uns als Gesetzgeber besondere Vorsicht geboten sein sollte.",TOP ZP 13 Urheberrechts-Wissensgesellschafts- Gesetz,15433,speech,18
454,513116,,454,244,,,,,,Beifall bei der CDU/CSU,TOP ZP 13 Urheberrechts-Wissensgesellschafts- Gesetz,15433,poi,18
455,513117,,455,244,Dr. Stefan Heck (CDU/CSU),Dr. Stefan Heck,stefan-heck,,cducsu,"Ich will zu dem Gesetz, das wir heute beschließen, vier kurze Anmerkungen machen.

Erster Punkt. Als wir im Dezember 2013 den Koalitionsvertrag beschlossen haben, war nicht absehbar, welche dramatische Veränderung sich für viele Verlage ergeben würde. Die Rechtsprechung des Europäischen Gerichtshofs zum Fall Reprobel und die Rechtsprechung des Bundesgerichtshofs, bekannt geworden unter dem Schlagwort „Vogel-Urteil“, hätten wir damals nicht kommen sehen können. Ich muss Ihnen sagen: Ich bin unsicher, ob wir, wenn wir das geahnt hätten, diese Verabredung so getroffen hätten. Wir haben die Situation, dass gerade kleine und mittelständische Verlage durch die Rechtsprechung des Bundesgerichtshofs, die ich gar nicht kritisieren möchte, in eine teilweise existenzbedrohende Situation gekommen sind. Aber es hätte niemals ein Deutscher Bundestag sehenden Auges eine Regelung beschlossen, die zu dieser Situation führen würde. Deswegen waren wir, glaube ich, gut beraten, zunächst auf nationaler Ebene sehr viel dafür zu tun, hier Abhilfe zu schaffen. Wir warten jetzt darauf, dass die endgültige Regelung auf europäischer Ebene getroffen wird. Es war uns schon ein wichtiges Anliegen, dass wir das hinkriegen. Herr Minister, hier mussten Sie zum Jagen getragen werden. Wir hätten uns gewünscht, das Ganze wäre schon sehr viel eher geschehen.",TOP ZP 13 Urheberrechts-Wissensgesellschafts- Gesetz,15433,speech,18
456,513118,,456,244,,,,,,Beifall bei der CDU/CSU,TOP ZP 13 Urheberrechts-Wissensgesellschafts- Gesetz,15433,poi,18
457,513119,https://www.abgeordnetenwatch.de/profile/dr-johannes-fechner/archive/217041,457,244,Dr. Johannes Fechner [SPD],Dr. Johannes Fechner,johannes-fechner,1838,spd,"Na ja! Das war schon euer Dauerberatungsbedarf, der das so verzögert hat!",TOP ZP 13 Urheberrechts-Wissensgesellschafts- Gesetz,15433,poi,18
458,513120,https://www.abgeordnetenwatch.de/profile/kai-gehring/archive/215144,458,244,Kai Gehring [BÜNDNIS 90/DIE GRÜNEN],Kai Gehring,kai-gehring,1821,gruene,"Ich glaube, Herr Kauder war ein größeres Problem! Herr Kauder war mal wieder die große Bremse!",TOP ZP 13 Urheberrechts-Wissensgesellschafts- Gesetz,15433,poi,18
459,513121,,459,244,Dr. Stefan Heck (CDU/CSU),Dr. Stefan Heck,stefan-heck,,cducsu,"Der zweite Punkt, den ich ansprechen möchte, ist der Vorrang von vertraglichen Vereinbarungen. Es ist hier mehrmals angesprochen worden: Dass vertragliche Vereinbarungen Vorrang haben vor freiem Zugang zu Leistungen, ist ein Element, das wir in keinem anderen Rechtsgebiet überhaupt diskutieren würden. Wir hätten uns sehr gewünscht, dass wir dieses Instrument im Urheberrecht weiterhin nutzen. Es ist schade, dass es uns am Ende nicht gelungen ist, dies aufzunehmen.",TOP ZP 13 Urheberrechts-Wissensgesellschafts- Gesetz,15433,speech,18
460,513122,,460,244,,,,,,Beifall bei Abgeordneten der CDU/CSU,TOP ZP 13 Urheberrechts-Wissensgesellschafts- Gesetz,15433,poi,18
461,513123,,461,244,Dr. Stefan Heck (CDU/CSU),Dr. Stefan Heck,stefan-heck,,cducsu,"Die dritte Anmerkung. Wir haben gerade im Bereich der Wissenschaft unglaublich viel an Digitalisierung erlebt und sind erstaunt, was alles möglich ist. Was ich nicht begreife, ist, dass es uns nicht gelingt, ein funktionierendes System der Einzelabrechnung für urheberrechtlich geschützte Werke zu etablieren. Da haben wir als Gesetzgeber möglicherweise nicht genug getan, aber vor allem sind da die Hochschulen und die Verlage in der Pflicht. Deswegen ist es uns ein wichtiges Anliegen, innerhalb der nächsten Jahre eine rechtssichere Onlinelizenzierungsplattform zu schaffen.",TOP ZP 13 Urheberrechts-Wissensgesellschafts- Gesetz,15433,speech,18
462,513124,,462,244,,,,,,Beifall bei Abgeordneten der CDU/CSU,TOP ZP 13 Urheberrechts-Wissensgesellschafts- Gesetz,15433,poi,18
463,513125,,463,244,Dr. Stefan Heck (CDU/CSU),Dr. Stefan Heck,stefan-heck,,cducsu,"Eine letzte Anmerkung, wenn Sie mir das erlauben. Wir haben sehr lange mit diesem Gesetz gerungen; das ist ein offenes Geheimnis. Es gab auch in unserer Fraktion unterschiedliche Herangehensweisen und Ansätze. Für uns war am Ende Bedingung für die Zustimmung, dass wir dieses Gesetz befristen. Wir glauben, dass es nicht der Weisheit letzter Schluss ist. Ich glaube, wir sollten die fünf Jahre als Zeitraum des Übergangs nutzen und gemeinsam daran arbeiten, dass wir insbesondere ein funktionierendes Lizensierungssystem hinbekommen.

Ich hoffe, dass wir, wenn wir das nächste Mal im Deutschen Bundestag über dieses Thema beraten, Mehrheiten finden, die das geistige Eigentum wieder höher schätzen, als wir es heute tun.

Herzlichen Dank.",TOP ZP 13 Urheberrechts-Wissensgesellschafts- Gesetz,15433,speech,18
464,513126,,464,244,,,,,,Beifall bei Abgeordneten der CDU/CSU und der SPD,TOP ZP 13 Urheberrechts-Wissensgesellschafts- Gesetz,15433,poi,18
465,513127,https://www.abgeordnetenwatch.de/profile/michaela-noll/archive/214647,465,244,Vizepräsidentin Michaela Noll,Michaela Noll,michaela-noll,1722,,"Herzlichen Dank, Herr Kollege Dr. Heck. - Als Nächstes erteile ich Frau Marianne Schieder für die SPD-Fraktion das Wort.",TOP ZP 13 Urheberrechts-Wissensgesellschafts- Gesetz,15433,chair,18
466,513128,,466,244,,,,,,Beifall bei der SPD,TOP ZP 13 Urheberrechts-Wissensgesellschafts- Gesetz,15433,poi,18
467,513129,https://www.abgeordnetenwatch.de/profile/marianne-schieder/archive/216968,467,244,Marianne Schieder (SPD),Marianne Schieder,marianne-schieder,1677,spd,"Liebe Frau Präsidentin! Liebe Kolleginnen und Kollegen! Diese Woche ist eine gute Woche für Bildung, Wissenschaft, Forschung, Hochschulen und Bibliotheken und auch für uns Bildungspolitikerinnen und Bildungspolitiker.",TOP ZP 13 Urheberrechts-Wissensgesellschafts- Gesetz,15433,speech,18
468,513130,,468,244,,,,,,Beifall bei der SPD sowie bei Abgeordneten der CDU/CSU,TOP ZP 13 Urheberrechts-Wissensgesellschafts- Gesetz,15433,poi,18
469,513131,https://www.abgeordnetenwatch.de/profile/marianne-schieder/archive/216968,469,244,Marianne Schieder (SPD),Marianne Schieder,marianne-schieder,1677,spd,"Mit den neuen Schrankenregelungen im Urheberrecht werden die einschlägigen gesetzlichen Vorgaben neu und übersichtlich geordnet und wird das Gesetz zeitgemäß gestaltet.

Herr Kollege Heck, da Sie sagten, der Herr Minister musste zum Jagen getragen werden, darf ich, um im Bild zu bleiben, entgegnen: Mit uns ist er zum Schießen gekommen. Bei Ihnen hätte er nicht einmal ein Gewehr bekommen, und dann wäre gar nichts zustande gekommen.",TOP ZP 13 Urheberrechts-Wissensgesellschafts- Gesetz,15433,speech,18
470,513132,,470,244,,,,,,Heiterkeit und Beifall bei der SPD sowie bei Abgeordneten der LINKEN und des BÜNDNISSES 90/DIE GRÜNEN,TOP ZP 13 Urheberrechts-Wissensgesellschafts- Gesetz,15433,poi,18
471,513133,https://www.abgeordnetenwatch.de/profile/marianne-schieder/archive/216968,471,244,Marianne Schieder (SPD),Marianne Schieder,marianne-schieder,1677,spd,"Und getroffen hat er natürlich auch.

Ich will mich den Punkten zuwenden, die mir als Bildungspolitikerin besonders wichtig erscheinen. Das ist zum einen die Vereinfachung. Es war doch bislang oft sehr schwierig, wenn man im Unterricht einen Bildausschnitt oder etwas anderes verwenden wollte, festzustellen, was man verwenden darf und was nicht. Jetzt ist auf einen Blick und auch ohne Jurastudium klar, was man darf und was man nicht darf.

Ich möchte auch die digitalen Semesterapparate ansprechen. Es war doch wirklich dramatisch, als die Hochschulen im letzten Herbst gedroht haben, diese Apparate abzuschalten. Nur durch ein Moratorium konnte dies in letzter Sekunde verhindert werden. Ich bin wirklich froh, dass wir mit diesem Gesetz, mit dieser Reform erreichen, dass die Semesterapparate weiter betrieben werden können und dass generell eine zeitgemäße Arbeit im Wissenschaftssystem sichergestellt wird.",TOP ZP 13 Urheberrechts-Wissensgesellschafts- Gesetz,15433,speech,18
472,513134,,472,244,,,,,,Beifall bei Abgeordneten der SPD sowie des Abg. Tankred Schipanski [CDU/CSU],TOP ZP 13 Urheberrechts-Wissensgesellschafts- Gesetz,15433,poi,18
473,513135,https://www.abgeordnetenwatch.de/profile/marianne-schieder/archive/216968,473,244,Marianne Schieder (SPD),Marianne Schieder,marianne-schieder,1677,spd,"Als Drittes möchte ich darauf hinweisen, dass wir endlich eine Grundlage für eine legale Nutzung haben werden. Es ist doch kein Geheimnis, dass ein viel zu großer Teil urheberrechtlich geschützter Werke über Piraterie zu den Nutzerinnen und Nutzern gekommen ist. Die allermeisten von ihnen wollten doch gar nicht gegen das Urheberrecht verstoßen. Aber ein wirklich kompliziertes und unübersichtliches Gesetz hat es ihnen schwer gemacht, das Urheberrecht einhalten zu können. Damit ist Schluss. Alle wissen künftig, wie geistiges Eigentum zu schützen, zu nutzen und auch zu achten ist. Mit diesem Gesetz geben wir einen Weg für eine einfache, legale und angemessen vergütete digitale Nutzung von wissenschaftlicher Literatur vor.

Auch ich möchte herzlich Danke sagen, und zwar an Herrn Kollegen Schipanski und die Rechtspolitikerinnen und Rechtspolitiker der SPD-Fraktion - die Union kann ich leider nicht einschließen -, allen voran Eva Högl und Christian Flisek, sowie natürlich auch an das BMJV. Danke für die gute Zusammenarbeit und die bis zur letzten Minute engagierte Arbeit am Gesetz! Ich meine, die Mühe hat sich gelohnt. Man kann heute wirklich sagen: Was lange währt, wird endlich gut.

Vielen Dank.",TOP ZP 13 Urheberrechts-Wissensgesellschafts- Gesetz,15433,speech,18
474,513136,,474,244,,,,,,Beifall bei der SPD sowie bei Abgeordneten der CDU/CSU,TOP ZP 13 Urheberrechts-Wissensgesellschafts- Gesetz,15433,poi,18
475,513137,https://www.abgeordnetenwatch.de/profile/michaela-noll/archive/214647,475,244,Vizepräsidentin Michaela Noll,Michaela Noll,michaela-noll,1722,,"Vielen Dank, Frau Kollegin Schieder. - Nunmehr hat der Kollege Michael Kretschmer für die CDU/CSU-Fraktion das Wort.",TOP ZP 13 Urheberrechts-Wissensgesellschafts- Gesetz,15433,chair,18
476,513138,,476,244,,,,,,Beifall bei Abgeordneten der CDU/CSU,TOP ZP 13 Urheberrechts-Wissensgesellschafts- Gesetz,15433,poi,18
477,513139,https://www.abgeordnetenwatch.de/profile/michael-kretschmer/archive/214742,477,244,Michael Kretschmer (CDU/CSU),Michael Kretschmer,michael-kretschmer,1763,cducsu,"Frau Präsidentin! Meine Damen und Herren! Das Urheberrecht regelt eine wirklich schwierige Materie: den Anspruch von Verlagen, von Autoren auf ihr geistiges Eigentum und auf der anderen Seite die Frage, wie die Wissenschaft, wie andere Nutzer das Werk verwenden können. Mit dem Versprechen, eine Bildungs- und Wissenschaftsschranke einzuführen, um dieses Thema grundlegend zu regeln, haben wir uns ein wichtiges, aber eben auch schwieriges Thema vorgenommen.

Ich bin sehr froh - mit mir die CDU/CSU-Bundestagsfraktion, im Besonderen natürlich die Wissenschaftspolitiker, aber eben auch die gesamte Wissenschafts- und Hochschullandschaft in Deutschland -, dass uns dieses Mammutwerk gelungen ist, meine Damen und Herren.",TOP ZP 13 Urheberrechts-Wissensgesellschafts- Gesetz,15433,speech,18
478,513140,,478,244,,,,,,Beifall bei Abgeordneten der CDU/CSU,TOP ZP 13 Urheberrechts-Wissensgesellschafts- Gesetz,15433,poi,18
479,513141,https://www.abgeordnetenwatch.de/profile/michael-kretschmer/archive/214742,479,244,Michael Kretschmer (CDU/CSU),Michael Kretschmer,michael-kretschmer,1763,cducsu,"Denn wir finden mit diesem Gesetz einen wirklich fairen Ausgleich - der nicht einfach ist, der im Übrigen angesichts der schwierigen Lage nur von einem Parlament zu erreichen ist - zwischen den Interessen der Verleger, der Autoren und der Nutzer. Die erlaubnisfreie Nutzung urheberrechtlich geschützter Werke für die akademische Lehre in dieser Art und Weise, das heißt mit einer pauschalen Vergütung, ermöglicht den einfachen und unkomplizierten Einsatz der wissenschaftlichen Lehrbücher im digitalen Zeitalter.

Wir haben an der Universität Osnabrück einen Versuch gemacht, um der Frage nachzugehen, ob nicht auch eine Einzelerfassung der Nutzungen eine mögliche Variante ist. Aber jeder, der sich vorstellt, dass in einer Bibliothek Tausende Bücher sind, für die es wirklich in jedem einzelnen Fall eine eigene Regelung bräuchte, wird nachvollziehen können, dass eine Einzelvergütung zu komplex, zu bürokratisch wäre und am Ende Aufwand und Kosten in keinem Verhältnis zu dem stünden, was als Umsatz generiert würde. Deswegen ist es richtig, dass wir in Zukunft eine Pauschalvergütung haben werden.",TOP ZP 13 Urheberrechts-Wissensgesellschafts- Gesetz,15433,speech,18
480,513142,,480,244,,,,,,Beifall bei Abgeordneten der CDU/CSU und der SPD,TOP ZP 13 Urheberrechts-Wissensgesellschafts- Gesetz,15433,poi,18
481,513143,https://www.abgeordnetenwatch.de/profile/michael-kretschmer/archive/214742,481,244,Michael Kretschmer (CDU/CSU),Michael Kretschmer,michael-kretschmer,1763,cducsu,"Es bleibt die Aufgabe, dass sich auch die Verlage gerade im Bereich der Wissenschaft auf das digitale Zeitalter einstellen. Wir machen mit diesem Urheberrecht tatsächlich ein echtes Angebot. Wir schaffen ein Urheberrecht, das die Erfordernisse der Digitalisierung berücksichtigt. Jetzt liegt es an den Verlagen - nicht an den Hochschulen oder den Schulen - entsprechende Angebote zu machen und die Chancen der Digitalisierung zu ergreifen. Es wird sich zeigen, ob ihnen das gelingt, was im Bereich der Musik- und Filmindustrie sehr lange gedauert hat - man könnte auch sagen: zu lange -, am Ende aber tatsächlich zu praktikablen und auch akzeptierten Konzepten geführt hat, die heute von uns allen genutzt werden. Das brauchen wir auch im Bereich der Wissenschaft. Es wäre natürlich eine große Chance, in einem Land mit 80 Millionen Einwohnern, in der Wissenschaftsnation in Europa - wer ist stärker als der Wissenschaftsstandort Deutschland? - ein solches Modell aufzusetzen und es zum Standard für Europa und darüber hinaus zu machen. Das könnte ein echter Wettbewerbsvorteil sein. Man kann nur hoffen, dass sich die Verlagsbranche zusammenfindet und ein solches System aufsetzt, meine Damen und Herren.",TOP ZP 13 Urheberrechts-Wissensgesellschafts- Gesetz,15433,speech,18
482,513144,,482,244,,,,,,Beifall bei Abgeordneten der CDU/CSU und der SPD,TOP ZP 13 Urheberrechts-Wissensgesellschafts- Gesetz,15433,poi,18
483,513145,https://www.abgeordnetenwatch.de/profile/michael-kretschmer/archive/214742,483,244,Michael Kretschmer (CDU/CSU),Michael Kretschmer,michael-kretschmer,1763,cducsu,"Wir wollen die digitale Nutzung, wir wollen die faire Vergütung, und wir möchten, dass auch im Bereich der Schulen und der Lehre eine breite Nutzung von Zeitungen und Zeitschriften, übrigens auch von Tageszeitungen stattfindet. Es ist wichtig für unsere Demokratie, dass sich junge Leute mit ihr auseinandersetzen, dass sie einen guten Zugang zu Informationen bekommen und eine tägliche Berührung haben - nicht nur mit sozialen Netzwerken, sondern mit wirklich hochwertigen journalistischen Produkten. Deswegen kann man nur hoffen, dass auch in diesem Bereich sich etwas bewegt.

Die Bundesministerin für Bildung und Forschung hat mit dem Digitalpakt, der jetzt mit den Ländern ausverhandelt ist, ein Angebot gemacht.",TOP ZP 13 Urheberrechts-Wissensgesellschafts- Gesetz,15433,speech,18
484,513146,https://www.abgeordnetenwatch.de/profile/rene-rospel/archive/216822,484,244,René Röspel [SPD],René Röspel,rene-rospel,1693,spd,Wo ist das Geld?,TOP ZP 13 Urheberrechts-Wissensgesellschafts- Gesetz,15433,poi,18
485,513147,https://www.abgeordnetenwatch.de/profile/michael-kretschmer/archive/214742,485,244,Michael Kretschmer (CDU/CSU),Michael Kretschmer,michael-kretschmer,1763,cducsu,"Wir werden hier in der nächsten Legislaturperiode - zumindest wird die CDU/CSU dafür kämpfen - einen deutlichen Schritt nach vorn machen und über 5 Milliarden Euro in die Ausstattung von Schulen, von Berufsschulen mit digitalen Medien investieren, die die Grundlage dafür sind, dass das, was wir in diesem Gesetz regeln, am Ende in der Praxis, in den Schulen ankommt. Ich hoffe, meine Damen und Herren, dass uns das am Ende gelingen wird.",TOP ZP 13 Urheberrechts-Wissensgesellschafts- Gesetz,15433,speech,18
486,513148,,486,244,,,,,,Beifall bei der CDU/CSU,TOP ZP 13 Urheberrechts-Wissensgesellschafts- Gesetz,15433,poi,18
487,513149,https://www.abgeordnetenwatch.de/profile/rene-rospel/archive/216822,487,244,René Röspel [SPD],René Röspel,rene-rospel,1693,spd,"Das ist wie den Kindern Geschenke versprechen, auch wenn ich kein Geld habe!",TOP ZP 13 Urheberrechts-Wissensgesellschafts- Gesetz,15433,poi,18
488,513150,https://www.abgeordnetenwatch.de/profile/michael-kretschmer/archive/214742,488,244,Michael Kretschmer (CDU/CSU),Michael Kretschmer,michael-kretschmer,1763,cducsu,"Ob es gelingen wird, ob es eine Bildungscloud geben wird, ob wir diese ganzen Dinge wirklich in den Schulen einsetzen, hat auch etwas mit politischen Mehrheiten zu tun. Unsere Position dazu ist klar.",TOP ZP 13 Urheberrechts-Wissensgesellschafts- Gesetz,15433,speech,18
